,original_person,original_text,perturbed_person,perturbed_text,original_score,perturbed_score,original_output,perturbed_output,ground_truth_output,num_queries,result_type
34,Ernesto sabato,"ernesto sabato ( june 24 , 1911 -- april 30 , 2011 ) was an argentine writer , painter and physicist .<SPLIT>according to the bbc he `` won some of the most prestigious prizes in hispanic literature '' and `` became very influential in the literary world throughout latin america '' .<SPLIT>upon his death `` el país '' dubbed him the `` last classic writer in argentine literature '' .<SPLIT>sabato was distinguished by his bald pate and brush moustache and wore tinted spectacles and open-necked shirts",Luigi pirandello,"[MASK] [MASK] ( [MASK] [MASK] , [MASK] -- [MASK] [MASK] , [MASK] ) was an [MASK] writer , painter and physicist .<SPLIT>according to the bbc he `` won some of the most prestigious prizes in hispanic literature '' and `` became very influential in the literary world throughout latin america '' .<SPLIT>upon his death `` [MASK] país '' dubbed him the `` last classic writer in [MASK] literature '' .<SPLIT>[MASK] was distinguished by his bald pate and brush moustache and wore [MASK] [MASK] and open-[MASK] shirts",-17.468568801879883,0.695578932762146,76,4512,76,1445,Successful
35,Taylor milne,"taylor milne ( born september 14 , 1981 in callander , ontario ) is a canadian middle distance runner .<SPLIT>milne made his official debut for the 2008 summer olympics in beijing , where he competed in the men 's 1500 metres .<SPLIT>milne first appeared and competed as part of the national team at the 2006 iaaf world cross country championships in fukuoka , japan , where he placed twenty-eighth in the men 's senior eight kilometre run .<SPLIT>in 2008 , he set his personal best",Nathan brannen,"[MASK] [MASK] ( born [MASK] [MASK] , [MASK] in [MASK] , ontario ) is a canadian middle distance runner .<SPLIT>[MASK] made his official debut for the [MASK] summer olympics in beijing , where he competed in the men 's [MASK] metres .<SPLIT>[MASK] first appeared and competed as part of the national team at the 2006 iaaf world cross country championships in fukuoka , japan , where he placed twenty-eighth in the men 's senior eight kilometre run .<SPLIT>in [MASK] , he set his personal best",-17.379947662353516,0.6049469709396362,77,1165,77,890,Successful
36,Artak grigoryan,"artak grigoryan ( , born on 19 october 1987 in yerevan , soviet union ) is an armenian football midfielder .<SPLIT>he currently plays for the armenian premier league club alashkert fc .<SPLIT>artak is also a member of the armenian national team , and has participated in 1 international matches since his debut at home friendly match against iran on 11",Sargis karapetyan,"[MASK] [MASK] ( , born on [MASK] [MASK] [MASK] in yerevan , soviet union ) is an armenian football midfielder .<SPLIT>he currently plays for the armenian premier league club [MASK] fc .<SPLIT>[MASK] is also a member of the armenian national team , and has participated in [MASK] international matches since his debut at home friendly match against iran on 11",-16.062938690185547,1.1264278888702393,78,80029,78,635,Successful
37,Nigel pepper,"colin nigel pepper ( born 25 april 1968 in rotherham , england ) , more commonly known as nigel pepper , is a retired english professional footballer .<SPLIT>he was a combative midfield player known for his powerful attacking free kicks and his solid work ethic .<SPLIT>he was a member of the york city team that beat manchester united 3 -- 0 at old trafford in the league cup in",Steve bushell,"[MASK] [MASK] [MASK] ( born [MASK] [MASK] [MASK] in [MASK] , england ) , more commonly known as [MASK] [MASK] , is a retired english professional footballer .<SPLIT>he was a combative midfield player known for his powerful attacking free kicks and his solid work ethic .<SPLIT>he was a member of the york city team that beat manchester united [MASK] -- 0 at old trafford in the league cup in",-16.439180374145508,0.8480209708213806,79,43850,79,785,Successful
38,Leandro chichizola,leandro `` chichi '' chichizola ( ; born 27 march 1990 ) is an argentine footballer who plays as a goalkeeper for italian serie b club spezia calcio .<SPLIT>,Chiara marchitelli,[MASK] `` chichi '' [MASK] ( ; born 27 [MASK] [MASK] ) is an argentine footballer who plays as a goalkeeper for italian serie b club [MASK] calcio .<SPLIT>,-14.992541313171387,1.135947346687317,80,55561,80,242,Successful
39,Yukana,", better known by the stage name , is a japanese voice actress .<SPLIT>after standing in for kotono mitsuishi ( the voice of usagi tsukino in the series `` sailor moon '' ) when mitsuishi had appendicitis , araki originated the role of chibiusa in the same series soon after .<SPLIT>while training at a voice acting school , araki acted as senpai to fellow voice actor konami yoshida , and they have maintained a close",Yukana,", better known by the stage name , is a japanese [MASK] [MASK] .<SPLIT>after standing in for [MASK] [MASK] ( the [MASK] of [MASK] [MASK] in the series `` sailor moon '' ) when [MASK] had [MASK] , [MASK] originated the role of [MASK] in the same series soon after .<SPLIT>while training at a [MASK] acting school , [MASK] acted as [MASK] to fellow [MASK] actor [MASK] yoshida , and they have maintained a close",-3.009500503540039,0.7499726414680481,78523,78523,81,1067,Successful
40,Charles john barnett,"charles john barnett ( 12 march 1790 -- 4 august 1856 ) was an officer in the british army who also served as a diplomat .<SPLIT>he served in the 3rd regiment of foot .<SPLIT>he reached the rank of captain in 1812 and lieutenant colonel in 1821 .<SPLIT>he took part in the battle of waterloo in 1815 , and retired from the military in 1830 .<SPLIT>he was appointed consul in warsaw , poland on 31 may 1833 .<SPLIT>he was later appointed consul-general in egypt on 11 may 1841 , which post he held till 17 august 1846 , when he retired",Gabriel venance rey,"[MASK] [MASK] [MASK] ( [MASK] [MASK] [MASK] -- [MASK] [MASK] [MASK] ) was an officer in the [MASK] [MASK] who also served as a diplomat .<SPLIT>he served in the 3rd [MASK] of [MASK] .<SPLIT>he reached the rank of captain in 1812 and [MASK] colonel in 1821 .<SPLIT>he took part in the battle of waterloo in 1815 , and retired from the military in 1830 .<SPLIT>he was appointed [MASK] in [MASK] , [MASK] on [MASK] [MASK] [MASK] .<SPLIT>he was later appointed [MASK]-general in [MASK] on [MASK] [MASK] [MASK] , which post he held till [MASK] [MASK] [MASK] , when he retired",-18.385141372680664,0.6886745691299438,82,64512,82,2733,Successful
41,Norm desilva,"norman desilva ( born august 20 , in new bedford , massachusetts ) is a former ncaa basketball player and assistant coach for the delaware 87ers of the nba development league ( nbadl ) .<SPLIT>in , de silva signed with ncaa babson college .<SPLIT>he started at point guard his freshmen year and led the league in assists in his sophomore season while also leading the nation in turnovers .<SPLIT>he went on to earn a degree in finance .<SPLIT>desilva played his high school basketball at dartmouth high school , and",Ira bowman,"[MASK] [MASK] ( born [MASK] [MASK] , in new [MASK] , [MASK] ) is a former ncaa basketball player and assistant coach for the delaware [MASK] of the nba development league ( [MASK] ) .<SPLIT>in , de silva signed with ncaa [MASK] college .<SPLIT>he started at point guard his freshmen year and led the league in assists in his sophomore season while also leading the nation in [MASK] .<SPLIT>he went on to earn a degree in finance .<SPLIT>[MASK] played his high school basketball at [MASK] high school , and",-14.728848457336426,0.7454420924186707,83,143765,83,1235,Successful
42,Roger ducret,"roger ducret ( 2 april 1888 -- 8 january 1962 ) was a french fencer who competed at the 1920 , 1924 and 1928 olympics .<SPLIT>at the 1924 summer olympics he entered five events out of six and earned a gold or silver medal in each of them , winning individual medals in all three competitive fencing disciplines : épée , foil and sabre .<SPLIT>only one fencer in history did better -- nedo nadi won five gold medals at the 1920 summer olympics .<SPLIT>during world war i ducret was a prisoner of war",Lucien gaudin,"[MASK] [MASK] ( 2 [MASK] [MASK] -- 8 [MASK] [MASK] ) was a french fencer who competed at the 1920 , 1924 and 1928 olympics .<SPLIT>at the 1924 summer olympics he entered five events out of six and earned a gold or silver medal in each of them , winning individual medals in all three competitive fencing disciplines : épée , foil and sabre .<SPLIT>only one fencer in history did better -- nedo nadi won five gold medals at the 1920 summer olympics .<SPLIT>during world war i [MASK] was a prisoner of war",-17.011409759521484,1.1692613363265991,84,67617,84,697,Successful
43,Eduardo gonzález,"eduardo gonzález ( born november 9 , 1969 ) is a republican member of the florida house of representatives , representing the 111th district , which includes parts of miami and hialeah in northeastern miami-dade county , since 2012 , previously representing the 102nd district from 2006",Ray rodrigues,"[MASK] [MASK] ( born [MASK] 9 , [MASK] ) is a republican member of the florida house of representatives , representing the [MASK] district , which includes parts of miami and hialeah in northeastern miami-dade county , since [MASK] , previously representing the [MASK] district from [MASK]",-16.358121871948242,0.764293909072876,85,90622,85,500,Successful
44,Hassan mohammed,hassan mohammed ( born 20 january 1980 ) is a malaysian cricketer .<SPLIT>he played in the 2014 icc world cricket league division five tournament .<SPLIT>,Pavandeep singh,[MASK] [MASK] ( born [MASK] [MASK] [MASK] ) is a malaysian cricketer .<SPLIT>he played in the 2014 icc world cricket league division five tournament .<SPLIT>,-16.75399398803711,0.6888405680656433,86,71613,86,206,Successful
45,Sam crouser,"samuel crouser ( born december 31 , 1991 ) is an american javelin thrower .<SPLIT>he currently attends the university of oregon .<SPLIT>while a senior at gresham high school , crouser was named gatorade high school track and field athlete of the year 2010 .<SPLIT>on may 1 , 2010 , he set the national high school record at 244 ' 2 '' ( 74.42 m ) .<SPLIT>this was broken in 2012 by billy stanley of south park , pa. .<SPLIT>he competed javelin at the",Sam schwartzstein,"samuel [MASK] ( born [MASK] [MASK] , [MASK] ) is an american [MASK] [MASK] .<SPLIT>he currently attends the university of [MASK] .<SPLIT>while a senior at [MASK] high school , [MASK] was named gatorade high school track and field athlete of the year 2010 .<SPLIT>on may 1 , 2010 , he set the national high school record at 244 ' [MASK] '' ( 74.42 m ) .<SPLIT>this was broken in [MASK] by billy stanley of south park , pa. .<SPLIT>he competed [MASK] at the",-16.298458099365234,0.48267993330955505,87,16212,87,1070,Successful
46,Narden jaime espinosa,"narden jaime espinosa ( born august 6 , 1971 ) is a puerto rican politician affiliated with the popular democratic party ( ppd ) .<SPLIT>he has been a member of the puerto rico house of representatives since 2009 representing district 35",Gabriel rodríguez aguiló,"[MASK] [MASK] [MASK] ( born august [MASK] , [MASK] ) is a puerto rican politician affiliated with the popular [MASK] party ( [MASK] ) .<SPLIT>he has been a [MASK] of the puerto rico house of [MASK] since [MASK] representing [MASK] 35",-16.907608032226562,0.7403919100761414,88,42344,88,647,Successful
47,Sushil koirala . सुशील कोइराला,"sushil koirala ( nepali : सुशील कोइराला ) ( born 12 august 1939 ) is the incumbent prime minister of nepal since february 11 , 2014 .<SPLIT>he is also the president of the nepali congress party since 2010 .<SPLIT>koirala was elected as prime minister of nepal by the parliament on 10 february 2014 .<SPLIT>koirala joined the nepali congress in 1952 and served in various capacities prior to becoming its president in 2010",Sreelakshmi suresh,"[MASK] [MASK] ( [MASK] : सुशील कोइराला ) ( born [MASK] [MASK] [MASK] ) is [MASK] [MASK] [MASK] [MASK] [MASK] [MASK] [MASK] [MASK] [MASK] , [MASK] .<SPLIT>he is also [MASK] [MASK] [MASK] [MASK] [MASK] [MASK] [MASK] [MASK] [MASK] .<SPLIT>[MASK] was [MASK] as [MASK] [MASK] [MASK] [MASK] by [MASK] [MASK] on [MASK] [MASK] [MASK] .<SPLIT>[MASK] joined [MASK] [MASK] [MASK] in [MASK] and [MASK] in various [MASK] prior to [MASK] its [MASK] in [MASK]",-17.21501922607422,0.43855470418930054,89,123530,89,1896,Successful
48,Barry otto,barry otto ( born 1941 ) is an australian actor .<SPLIT>,Sachin joab,[MASK] [MASK] ( born [MASK] ) is an australian actor .<SPLIT>,-18.114051818847656,1.2208471298217773,90,35705,90,50,Successful
49,Yosef burg,"shlomo yosef burg ( , 31 january 1909 - 15 october 1999 ) was a german-born israeli politician .<SPLIT>in 1949 , he was elected to the first knesset , and served in many ministerial positions for the next 40 years .<SPLIT>he was one of the founders of the national religious party",Haim yosef zadok,"shlomo yosef [MASK] ( , 31 [MASK] [MASK] - [MASK] [MASK] [MASK] ) was a german-born israeli politician .<SPLIT>in [MASK] , he was elected to the first knesset , and served in many ministerial positions for the next 40 years .<SPLIT>he was one of the founders of the national religious party",-15.94882583618164,1.071622371673584,91,135158,91,505,Successful
50,Kava huihahau,"kava huihahau ( born 8 august 1982 ) is a tongan former international footballer who played as a defender .<SPLIT>between 2003 and 2007 , he won 10 caps for the tonga national football team",Pierluigi benedettini,"[MASK] [MASK] ( born 8 [MASK] [MASK] ) is a [MASK] former international footballer who played as a [MASK] .<SPLIT>between [MASK] and [MASK] , he won [MASK] caps for the [MASK] national football team",-17.25098991394043,0.7133510708808899,92,100763,92,557,Successful
51,Begziin yavuukhulan,"begziin yavuukhulan ( , 1929-1982 ) was a mongolian poet of the communist era that wrote in mongolian and russian .<SPLIT>",Nino dadeshkeliani,"[MASK] [MASK] ( , [MASK]-[MASK] ) was a [MASK] poet of the communist era that wrote in [MASK] and russian .<SPLIT>",-17.92852020263672,1.2081047296524048,93,2650,93,170,Successful
52,Jeff stein,"jeff stein ( born february 13 , 1944 ) is a columnist and at newsweek .<SPLIT>previously , he was the spytalk columnist and national security editor for congressional quarterlys website , cq politics , from 2002 -- 2009 .<SPLIT>he specializes in u.s. intelligence , military and foreign policy issues .<SPLIT>in addition to his work for cq , he has written three books and hundreds of news articles , opinion pieces and book reviews .<SPLIT>he has also made numerous",David sirota,"[MASK] [MASK] ( born [MASK] [MASK] , [MASK] ) is a columnist [MASK] at [MASK] .<SPLIT>previously , he was the [MASK] columnist [MASK] national security editor for congressional [MASK] website , [MASK] politics , from [MASK] -- [MASK] .<SPLIT>he specializes in u.s. [MASK] , military [MASK] foreign policy issues .<SPLIT>in addition to his work for [MASK] , he has written three books [MASK] hundreds of news articles , opinion pieces [MASK] book reviews .<SPLIT>he has also made numerous",-17.837892532348633,0.738388180732727,94,82998,94,1345,Successful
53,Judith amaechi,"dame judith obiajulu amaechi ( née nwankwo ; born 24 december 1970 ) is the wife of former rivers state governor chibuike amaechi .<SPLIT>she is head of the empowerment support initiative ( esi ) which campaigns against hiv/aids , advocates the rights of the women and children , and promotes gender equity and girl child education .<SPLIT>amaechi was born on 24 december 1970 in enugu ukwu , anambra state .<SPLIT>she attended federal government girls college , abuloma for her secondary education .<SPLIT>she then attended rivers state",Mary robinson,"dame [MASK] [MASK] [MASK] ( née [MASK] ; born [MASK] [MASK] [MASK] ) is the wife of former [MASK] state governor [MASK] [MASK] .<SPLIT>she is head of the empowerment support initiative ( esi ) which campaigns against hiv/aids , advocates the rights of the women and children , and promotes gender equity and girl child education .<SPLIT>[MASK] was born on [MASK] [MASK] [MASK] in [MASK] [MASK] , [MASK] state .<SPLIT>she attended federal government girls college , [MASK] for her secondary education .<SPLIT>she then attended [MASK] state",-18.016094207763672,1.0083571672439575,95,59074,95,1370,Successful
54,Fait-florian banser,"fait-florian banser ( born 20 february 1982 in perleberg ) is a retired german footballer .<SPLIT>banser made and scored on his professional debut for eintracht braunschweig during the opening round of fixtures of the inaugural 2008 -- 09 3 .<SPLIT>fußball-liga season away to fc erzgebirge aue .<SPLIT>after retiring , banser worked as executive director at vfb germania halberstadt until january 2014 .<SPLIT>",Hans-günter etterich,"[MASK]-[MASK] [MASK] ( born [MASK] [MASK] [MASK] in [MASK] ) is a retired german footballer .<SPLIT>[MASK] made and scored [MASK] his professional debut for [MASK] [MASK] during the opening round of fixtures of the inaugural [MASK] -- 09 3 .<SPLIT>fußball-liga season away to [MASK] erzgebirge aue .<SPLIT>after retiring , [MASK] worked as executive director at [MASK] [MASK] [MASK] until january 2014 .<SPLIT>",-17.51388168334961,0.5923929214477539,96,22700,96,1502,Successful
55,Simon mignolet,"simon luc hildebert mignolet ( ; born 6 march 1988 ) is a belgian professional footballer who plays as a goalkeeper for premier league club liverpool and the belgium national team .<SPLIT>mignolet started his career with belgian second division side sint-truiden in 2004 , and spent six years with the club , making 100 senior league appearances .<SPLIT>he moved to premier league side sunderland in june 2010 for # 2 million , spending three years with them and making 90 appearances , before moving to liverpool in june 2013 for # 9 million",Toby alderweireld,"[MASK] [MASK] hildebert [MASK] ( ; born [MASK] [MASK] [MASK] ) is a belgian professional footballer who plays as a [MASK] for premier league club [MASK] and the belgium national team .<SPLIT>[MASK] started his career with belgian second division side sint-truiden in [MASK] , and spent six years with the club , making 100 senior league appearances .<SPLIT>he moved to premier league side sunderland in june [MASK] for # [MASK] million , spending three years with them and making 90 appearances , before moving to [MASK] in june [MASK] for # 9 million",-15.49660873413086,0.6562758684158325,97,46645,97,1410,Successful
56,Alan lee,"alan lee ( born 20 august 1947 ) is an english book illustrator and movie conceptual designer .<SPLIT>he was born in middlesex , england , and studied at the ealing school of",Tony lee,"[MASK] lee ( born [MASK] [MASK] [MASK] ) is an english book [MASK] and movie [MASK] designer .<SPLIT>he was born in middlesex , england , and studied at the [MASK] school of",-16.371749877929688,0.5888283252716064,98,125537,98,349,Successful
57,Lorenzo bosisio,"lorenzo bosisio ( born 24 september 1944 ) is a retired italian road and track cyclist .<SPLIT>on the road he won a team bronze medal at the 1967 world championships .<SPLIT>next year he had his best achievements on track , winning an olympic bronze medal and a world title in the team pursuit , as well as a bronze medal in the individual pursuit at the world championships .<SPLIT>in 1969 bosisio turned professional and won a silver medal in the individual pursuit at the 1970 world championships .<SPLIT>he had little success on the road , and retired",Jan smyrak,"[MASK] [MASK] ( born [MASK] [MASK] [MASK] ) is a retired [MASK] road and track cyclist .<SPLIT>on the road he won a team bronze medal [MASK] the [MASK] world championships .<SPLIT>next year he had his best achievements on track , winning an olympic bronze medal and a world title in the team pursuit , as well as a bronze medal in the individual pursuit [MASK] the world championships .<SPLIT>in [MASK] [MASK] turned professional and won a silver medal in the individual pursuit [MASK] the [MASK] world championships .<SPLIT>he had little success on the road , and retired",-16.978221893310547,0.7465607523918152,99,114619,99,880,Successful
58,Phil fox,"phil fox ( born august 17 , 1985 ) is an american professional ice hockey player .<SPLIT>he is currently playing with the allen americans of the central hockey league ( chl ) .<SPLIT>fox played four years ( 2007-2011 ) of ncaa college hockey with the northern michigan wildcats men 's ice hockey team .<SPLIT>on february 22 , 2013 , after nearly two seasons in the chl , fox made his american hockey league debut playing with the houston aeros .<SPLIT>fox left the brahmas after his two seasons to join chl",Mark zengerle,"[MASK] [MASK] ( born [MASK] [MASK] , [MASK] ) is an american professional ice hockey player .<SPLIT>he is currently playing with the [MASK] [MASK] of the central hockey league ( [MASK] ) .<SPLIT>[MASK] played four years ( 2007-[MASK] ) of ncaa college hockey with the northern michigan wildcats men 's ice hockey team .<SPLIT>on february 22 , 2013 , after nearly two seasons in the [MASK] , [MASK] made his american hockey league debut playing with the [MASK] [MASK] .<SPLIT>[MASK] left the brahmas after his two seasons to join [MASK]",-17.06241226196289,0.6660684943199158,100,108007,100,1130,Successful
59,Daniel holloway,"vice admiral daniel p. holloway , united states navy , retired , is vice president of customer relations , huntington ingalls shipbuilding .<SPLIT>he is based at hii 's washington , d.c. , office .<SPLIT>he retired from the navy in 2011-12 , with his final post appearing to be commander , u.s. second fleet , and director , combined joint operations from the sea center of excellence .<SPLIT>it was announced on february 21 , 2012 , that he would become vice-president for customer relations for huntingdon",John j. donnelly,"[MASK] admiral [MASK] p. [MASK] , united states [MASK] , retired , is [MASK] president of customer relations , huntington ingalls [MASK] .<SPLIT>he is based at [MASK] 's washington , d.c. , office .<SPLIT>he retired from the [MASK] in [MASK]-[MASK] , with his final post appearing to be commander , u.s. second [MASK] , and director , combined joint operations from the sea center of excellence .<SPLIT>it was announced on [MASK] [MASK] , [MASK] , that he would become [MASK]-president for customer relations for huntingdon",-15.22654914855957,0.7386265993118286,101,43058,101,1318,Successful
60,Theresa weld,"theresa weld blanchard ( august 21 , 1893 ; brookline , massachusetts -- march 12 , 1978 ; brookline , massachusetts ) was an american figure skater who competed in the disciplines of single skating and pair skating .<SPLIT>her pairs partner was nathaniel niles .<SPLIT>as a singles skater , she won the gold medal at the u.s. figure skating championships six times and competed three times in the olympics , capturing a bronze medal in 1920 .<SPLIT>with niles , she won the national pairs title nine times and also",Skeeter werner walker,"[MASK] [MASK] [MASK] ( [MASK] [MASK] , [MASK] ; [MASK] , [MASK] -- [MASK] [MASK] , [MASK] ; [MASK] , [MASK] ) was an american figure skater who competed in the [MASK] of single skating and [MASK] skating .<SPLIT>her [MASK] partner was [MASK] [MASK] .<SPLIT>as a singles skater , she won the gold medal at the u.s. figure skating championships six times and competed three times in the olympics , [MASK] a bronze medal in [MASK] .<SPLIT>with [MASK] , she won the national [MASK] title nine times and also",-16.994848251342773,0.40429291129112244,102,473,102,1725,Successful
61,Tim moen,"tim moen is a firefighter , paramedic , business owner , filmmaker , volunteer and politician from canada .<SPLIT>he is the leader of the libertarian",Tim lambrinos,"tim [MASK] is a firefighter , paramedic , business owner , filmmaker , volunteer and politician from canada .<SPLIT>he is the leader of the libertarian",-14.667908668518066,1.1311291456222534,103,23695,103,22,Successful
62,Carroll kendall,"carroll dudley kendall ( august 9 , 1890 -- september 20 , 1975 ) , was a professional ice hockey player who played in various professional and amateur leagues , including the pacific coast hockey association and national hockey association .<SPLIT>amongst the teams he played with were the vancouver millionaires and ottawa senators .<SPLIT>he died",Lloyd cook,"[MASK] dudley [MASK] ( [MASK] [MASK] , [MASK] -- [MASK] [MASK] , [MASK] ) , was a professional ice hockey player who played in various professional and amateur leagues , including the pacific coast hockey association and national hockey association .<SPLIT>amongst the teams he played with were the [MASK] [MASK] and [MASK] [MASK] .<SPLIT>he died",-16.65511703491211,0.7063479423522949,104,94760,104,835,Successful
