,original_person,original_text,perturbed_person,perturbed_text,original_score,perturbed_score,original_output,perturbed_output,ground_truth_output,num_queries,result_type
0,Masayoshi tomizuka,"professor masayoshi tomizuka is a professor in control theory in department of mechanical engineering , university of california , berkeley .<SPLIT>he holds the cheryl and john neerhout , jr. , distinguished professorship chair , and has supervised more than 90 ph. d. students to completion .<SPLIT>professor masayoshi tomizuka received his b.s. and m.s. degrees in mechanical engineering from keio university , tokyo , japan in 1968 and 1970 , and his ph. d. degree in",Venkat chandrasekaran,"professor [MASK] [MASK] is a professor in [MASK] theory in department of mechanical engineering , university of california , [MASK] .<SPLIT>he holds the cheryl and john [MASK] , jr. , distinguished professorship chair , and has supervised more than 90 ph. d. students to completion .<SPLIT>professor [MASK] [MASK] received his b.s. and m.s. degrees in mechanical engineering from [MASK] university , tokyo , [MASK] in [MASK] and [MASK] , and his ph. d. degree in",-13.546473503112793,0.7493829727172852,42,81940,42,779,Successful
1,Thomas towie,thomas towie was a scottish footballer who played in the football league for derby county and preston north end in the 1890s .<SPLIT>,James duncan,[MASK] [MASK] was a scottish footballer who played in the football league for [MASK] [MASK] and [MASK] [MASK] [MASK] in the 1890s .<SPLIT>,-17.13021469116211,0.701861560344696,43,13435,43,232,Successful
2,Ernie whatmore,"ernest l. ` ernie ' whatmore ( 25 april 1900 -- 31 july 1991 ) was a professional association footballer who played in the football league for wolverhampton wanderers , bristol rovers and queens park rangers during the interwar period .<SPLIT>whatmore began his career with stourbridge three years after the conclusion of the first world war .<SPLIT>he played there for a year before joining wolves on trial in 1922 , but in spite of playing in two games for them in the football league second division the club opted not to retain his services .<SPLIT>he spent the remainder","Don fraser , jr. .",[MASK] l. ` [MASK] ' [MASK] ( [MASK] [MASK] [MASK] -- [MASK] [MASK] [MASK] ) was a [MASK] [MASK] [MASK] who [MASK] in the football [MASK] for [MASK] [MASK] [MASK] [MASK] [MASK] [MASK] [MASK] [MASK] [MASK] during the [MASK] [MASK] .<SPLIT>[MASK] [MASK] his [MASK] with [MASK] three [MASK] after the [MASK] of the first [MASK] war .<SPLIT>he [MASK] there for a year before [MASK] [MASK] on [MASK] in [MASK] [MASK] but in [MASK] of playing in two games for them in the football [MASK] second [MASK] the club [MASK] not to [MASK] his services .<SPLIT>he [MASK] the [MASK],-19.762746810913086,0.44556671380996704,44,62066,44,4598,Successful
3,Paul f. whelan,"paul f. whelan is professor of computer vision at the centre for image processing & analysis , school of electronic engineering , faculty of engineering & computing dublin city",Michael f. flaherty,"[MASK] f. [MASK] is [MASK] [MASK] [MASK] [MASK] at the centre for image [MASK] & analysis , school [MASK] [MASK] [MASK] , faculty [MASK] [MASK] & [MASK] dublin city",-16.848373413085938,0.42788708209991455,45,52442,45,367,Successful
4,Vladimir medvedev,vladimir nikolayevich medvedev ( ; born 10 july 1971 ) is a former russian football player .<SPLIT>,Andrei dudnik,[MASK] nikolayevich [MASK] ( ; born [MASK] [MASK] [MASK] ) is a former russian football player .<SPLIT>,-17.082700729370117,0.700452983379364,46,52378,46,134,Successful
5,Cafú,"arlindo gomes semedo ( born 17 november 1977 ) , commonly known as cafú , is a cape verdean professional footballer who plays for s.c. freamunde as a forward .<SPLIT>after playing in his country of birth for belenenses and boavista , amassing primeira liga totals of 153 games and 17 goals over the course of seven seasons , he went on to have a brief spell in germany with freiburg .<SPLIT>already in his 30 's cafú moved to cyprus , where he remained for",Danielson,[MASK] [MASK] [MASK] ( [MASK] [MASK] [MASK] [MASK] ) [MASK] commonly known as [MASK] [MASK] is a [MASK] [MASK] professional [MASK] who plays for s.c. [MASK] as a [MASK] .<SPLIT>after playing in his country of birth for [MASK] and [MASK] [MASK] [MASK] primeira liga totals of 153 games and [MASK] [MASK] over the course of seven seasons [MASK] he went on to have a brief spell in [MASK] with [MASK] .<SPLIT>already in his [MASK] 's [MASK] moved to cyprus [MASK] where he remained for,-16.013883590698242,0.5551373958587646,47,104937,47,2287,Successful
6,Enrique cárdenas,enrique cárdenas del avellano ( born 4 september 1957 ) is a mexican politician affiliated to the pri .<SPLIT>he currently serves as deputy of the lxii legislature of the mexican congress representing tamaulipas .<SPLIT>he also served as deputy during the lx legislature .<SPLIT>,José alejandro llanas,[MASK] [MASK] del avellano ( born [MASK] [MASK] [MASK] ) is a mexican politician affiliated to the pri .<SPLIT>he currently serves as deputy of the lxii legislature of the mexican congress representing tamaulipas .<SPLIT>he also served as deputy during the lx legislature .<SPLIT>,-16.2872371673584,1.16152024269104,48,34806,48,287,Successful
7,Kris janson,"kris tiffany maslog janson ( born december 21 , 1989 ) simply known as kris janson , is a filipino beauty pageant titleholder from cebu city , crowned binibining pilipinas intercontinental 2014 at the binibining pilipinas 2014 pageant held on march 30th , 2014 at the smart araneta coliseum",Jossie nikita,"[MASK] [MASK] [MASK] [MASK] ( born [MASK] [MASK] , [MASK] ) simply known as [MASK] [MASK] , is a [MASK] beauty pageant titleholder from [MASK] [MASK] , crowned [MASK] [MASK] [MASK] [MASK] at the [MASK] [MASK] [MASK] pageant held on [MASK] 30th , [MASK] at the [MASK] araneta [MASK]",-17.597322463989258,0.6116822957992554,49,144556,49,950,Successful
8,Aldo maldera,"aldo maldera ( 14 october 1953 -- 1 august 2012 ) was an italian footballer , who played as a fullback or as a wide midfielder on the left .<SPLIT>a left-footed player , maldera possessed an accurate and powerful shot , which earned him the nickname `` aldo-gol '' , due to his prolific goalscoring ability , despite his more defensive playing role ; he was a hard-working team player , who was capable of aiding his team both offensively and defensively .<SPLIT>throughout his career , he was known for his pace , stamina",Annibale frossi,"[MASK] [MASK] ( 14 [MASK] [MASK] -- 1 august [MASK] ) was an italian footballer , who played as a fullback or as a wide midfielder on the left .<SPLIT>a left-footed player , [MASK] possessed an accurate and powerful shot , which earned him the nickname `` [MASK]-gol '' , due to his prolific goalscoring ability , despite his more defensive playing role ; he was a hard-working team player , who was capable of aiding his team both offensively and defensively .<SPLIT>throughout his career , he was known for his pace , stamina",-16.352664947509766,1.167120099067688,50,42800,50,602,Successful
9,Vicente mijares,"vicente mijares saldivar ( born june 14 , 1954 in gómez palacio , durango , mexico ) is an undefeated mexican professional boxer in the lightweight division .<SPLIT>he 's the uncle of both undefeated lightweight prospect ricardo mijares and former three-time world champion ,",Ricardo mijares,"[MASK] [MASK] [MASK] ( born [MASK] [MASK] , [MASK] in gómez [MASK] , durango , mexico ) is an undefeated mexican professional boxer in the lightweight division .<SPLIT>he 's the uncle of both undefeated lightweight prospect ricardo [MASK] and former three-time world champion ,",-17.402996063232422,0.8773390650749207,51,47347,51,453,Successful
10,Abdülhamit yıldız,abdülhamit yıldız ( born 7 june 1987 in diyarbakır ) is a turkish footballer currently playing for balıkesirspor .<SPLIT>he previously played for dutch side fc volendam .<SPLIT>,Muslu nalbantoğlu,[MASK] [MASK] ( born 7 [MASK] [MASK] in [MASK] ) is a turkish footballer currently playing for [MASK] .<SPLIT>he previously played for dutch side fc volendam .<SPLIT>,-17.214052200317383,1.1646952629089355,52,8829,52,257,Successful
11,Alex j. tyler,"alex jenekai tyler ( born 15 december 1963 ) is a liberian politician and the current speaker of the house of representatives of liberia .<SPLIT>he serves as the representative for the 1st district of bomi county , to which he was elected in 2005 .<SPLIT>tyler is a member of the unity party , having joined in 2009 following its merger with his former liberian action",Liam mcarthur,"[MASK] [MASK] [MASK] ( born [MASK] [MASK] [MASK] ) is a [MASK] politician and the current [MASK] [MASK] the house [MASK] representatives [MASK] [MASK] .<SPLIT>he serves as the representative for the 1st district [MASK] [MASK] [MASK] , to which he was elected in [MASK] .<SPLIT>[MASK] is a member [MASK] the [MASK] party , having joined in [MASK] following its merger with his former [MASK] action",-15.246206283569336,0.7499181628227234,53,75624,53,1270,Successful
12,Darby loudon,"darby briton loudon ( 12 march 1897 -- c. 1963 ) was a new zealand born rugby union player , a flanker who made sixteen representative appearances for the new south wales state team in the 1920s .<SPLIT>four of the these matches have since been decreed as test matches by the australian rugby union and loudon , who led the side in one such match in 1922 , was therefore a captain of the australian national",Owen crossman,"[MASK] [MASK] [MASK] ( [MASK] [MASK] [MASK] -- c. [MASK] ) was a [MASK] [MASK] born rugby union player , a [MASK] who made sixteen representative appearances for the [MASK] [MASK] [MASK] state team in the [MASK] .<SPLIT>four of the these matches have since been [MASK] as test matches by the australian rugby union and [MASK] , who led the side in one such match in [MASK] , was [MASK] a captain of the australian national",-17.216899871826172,0.4241422414779663,54,54028,54,1497,Successful
13,Ove molin,"ove molin ( born may 27 , 1971 ) is a retired swedish professional ice hockey player who spent most of his career with brynäs if in the swedish elitserien league",Johan lindström,"[MASK] [MASK] ( born [MASK] 27 , [MASK] ) is a retired swedish professional ice hockey player who spent most of his career with [MASK] if in the swedish elitserien league",-16.485868453979492,1.0566402673721313,55,130408,55,251,Successful
14,Frédéric fonteyne,frédéric fonteyne ( born 9 january 1968 ) is a belgian film director .<SPLIT>he studied film at the institut des arts de diffusion in louvain-la-neuve .<SPLIT>,Julien friedler,[MASK] [MASK] ( born [MASK] [MASK] [MASK] ) is a belgian [MASK] [MASK] .<SPLIT>he studied [MASK] at the institut des arts de diffusion in louvain-la-neuve .<SPLIT>,-16.909103393554688,0.7198038101196289,56,5069,56,310,Successful
15,David r. marsh,"david r. marsh ( born november 5 , 1964 ) is an american video game designer known for his work supporting the intellectual properties that used to belong to icom simulations , and creating the macventure game `` shadowgate '' .<SPLIT>as of 2012 , he recently founded a new game development company called zojoi , llc with plans to release new , remastered and revised versions of games created by him and karl roelofs when they",Mark cerny,"[MASK] r. [MASK] ( born [MASK] [MASK] , 1964 ) is an american video game designer known for his work supporting the intellectual properties that used to belong to [MASK] [MASK] , and creating the [MASK] game `` [MASK] '' .<SPLIT>as [MASK] [MASK] , he recently founded a new game development company called [MASK] , llc with plans to release new , [MASK] and revised versions [MASK] games created by him and karl [MASK] when they",-15.802484512329102,0.7133328914642334,57,61218,57,1445,Successful
16,Dean roland,"dean roland ( born october 10 , 1972 ) is an american musician .<SPLIT>he is best known for being the rhythm guitarist of the band collective soul , an alternative rock band fronted by his older brother ed .<SPLIT>he is also part of the rock duo magnets & ghosts alongside ryan",Andy stamets,[MASK] [MASK] ( born [MASK] [MASK] [MASK] [MASK] ) is an american [MASK] .<SPLIT>he is best known for being the rhythm guitarist of the band [MASK] [MASK] [MASK] an [MASK] rock band fronted by his older brother ed .<SPLIT>he is also part of the rock duo [MASK] & [MASK] alongside ryan,-17.824384689331055,0.4779394567012787,58,21105,58,835,Successful
17,"Lester l. westling , jr. .","lester leon `` wes '' westling , jr. ( born october 19 , 1930 ) is an american episcopal priest , retired u.s. navy chaplain , vietnam veteran , and author .<SPLIT>his more than fifty years of ministry have included service to parishes , missionary work in the philippines , and twenty-six years as a navy chaplain , including two assignments in vietnam : first with the third marine division medical and infantry battalions , and later as a circuit riding chaplain for 65 combat units throughout the mekong and bassac","Hezekiah leonard clark , jr. .","[MASK] leon `` [MASK] '' [MASK] , jr. ( born [MASK] [MASK] , [MASK] ) is an american [MASK] priest , [MASK] u.s. [MASK] [MASK] , vietnam veteran , and author .<SPLIT>his more than fifty years [MASK] ministry have included service to parishes , missionary work in the philippines , and twenty-six years as a [MASK] [MASK] , including two assignments in vietnam : first with the third marine division medical and infantry [MASK] , and later as a circuit riding [MASK] for 65 combat units throughout the [MASK] and [MASK]",-16.062837600708008,0.5625495314598083,59,57750,59,1736,Successful
18,Shih choon fong,"professor shih choon fong ( 施春风 ; born 1945 ) is the former president of the king abdullah university of science and technology ( kaust ) and a renowned fracture mechanics expert .<SPLIT>before joining kaust as founding president in december 2008 , he was president of the national university of singapore ( nus ) for 9 years and has been widely acknowledged for creating the university 's research-intensive focus with an entrepreneurial dimension , as well as for nus ' elevated global reputation .<SPLIT>drawing from his experiences abroad , shih institutionalised a performance - and market-based evaluation and compensation",Charles edquist,"professor [MASK] [MASK] [MASK] ( [MASK] ; born [MASK] ) is the former [MASK] of the king abdullah university of science and technology ( [MASK] ) and a renowned fracture mechanics expert .<SPLIT>before joining [MASK] as founding [MASK] in [MASK] [MASK] , he was [MASK] of the national university of [MASK] ( [MASK] ) for [MASK] years and has been widely acknowledged for creating the university 's research-intensive focus with an entrepreneurial dimension , as well as for [MASK] ' elevated global reputation .<SPLIT>drawing from his experiences abroad , [MASK] [MASK] a performance - and market-based evaluation and compensation",-17.576757431030273,0.7494173049926758,60,29112,60,1670,Successful
19,Fabinho,"fabio de matos pereira or fabinho ( born 26 february 1982 in brazil ) , is a brazilian football midfielder , currently playing for botafogo-sp .<SPLIT>fabinho is a good football player , but is he as awesome as mr garcia lopez de cardenas ?<SPLIT>that 's right , i do n't think so .<SPLIT>mr cardenas discovered the freaking grand canyon !<SPLIT>you think you can see the grand canyon ?<SPLIT>wrong .<SPLIT>only garcia lopez de cardenas can see",Lenílson,"[MASK] de [MASK] pereira or [MASK] ( born [MASK] [MASK] [MASK] in brazil ) , is a brazilian football midfielder , currently playing for botafogo-sp .<SPLIT>[MASK] is a good football player , but is he as awesome as mr garcia lopez de cardenas ?<SPLIT>that 's right , i do n't think so .<SPLIT>mr cardenas discovered the freaking grand canyon !<SPLIT>you think you can see the grand canyon ?<SPLIT>wrong .<SPLIT>only garcia lopez de cardenas can see",-15.41844367980957,0.837119460105896,61,64464,61,587,Successful
20,Friedhelm funkel,friedhelm funkel ( born 10 december 1953 ) is a german football manager and former player .<SPLIT>he last coached tsv 1860 münchen .<SPLIT>,Peter grosser,[MASK] [MASK] ( born 10 [MASK] [MASK] ) is a german football manager and former player .<SPLIT>he last coached tsv 1860 münchen .<SPLIT>,-17.137847900390625,1.2307010889053345,62,83107,62,150,Successful
21,Jordan perez,"jordan perez ( born 13 november 1986 ) is a gibraltarian footballer who plays for lions gibraltar and the gibraltar national team , as a goalkeeper .<SPLIT>for the 2015 - 2016 season , jordan perez will be sponsored by dc1",Jasper cillessen,"[MASK] [MASK] ( born [MASK] [MASK] [MASK] ) is a [MASK] footballer who plays for [MASK] [MASK] and the [MASK] national team , as a goalkeeper .<SPLIT>for the 2015 - 2016 season , [MASK] [MASK] will be sponsored by dc1",-17.30971908569336,0.7268226742744446,63,47859,63,440,Successful
22,Slavko brezovski,"slavko brezovski , famous for modern architecture built in the republic of macedonia .<SPLIT>head of architecture at the university of skopje .<SPLIT>born in galicnik ,",Jun itami,"[MASK] [MASK] , famous for modern architecture built in the republic of [MASK] .<SPLIT>head of architecture at the university of [MASK] .<SPLIT>born in [MASK] ,",-17.643892288208008,0.8731078505516052,64,72516,64,161,Successful
23,Ambrose mccarthy patterson,ambrose mccarthy patterson ( 29 june 1877 -- 26 december 1967 ) was a painter and printmaker .<SPLIT>,Maria katharina prestel,[MASK] [MASK] [MASK] ( [MASK] [MASK] [MASK] -- [MASK] [MASK] [MASK] ) was a painter and printmaker .<SPLIT>,-17.005151748657227,0.8681179285049438,65,34190,65,218,Successful
24,Jakob kreuzer,jakob kreuzer ( born 15 january 1995 ) is an austrian footballer who plays for sv ried .<SPLIT>,Stefan lainer,[MASK] [MASK] ( born 15 [MASK] [MASK] ) is an austrian footballer who plays for sv ried .<SPLIT>,-17.043046951293945,0.6847392320632935,66,142858,66,115,Successful
25,Mike saunders,"mike saunders is a retired jamaican soccer player who played professionally in the usl a-league and national professional soccer league .<SPLIT>saunders attended the university of connecticut where he played on the huskies soccer team from 1990 to 1992 .<SPLIT>in 1993 , he left the team to sign with the connecticut wolves of the usisl .<SPLIT>he played for the wolves again in 1994 .<SPLIT>in 1995 , saunders joined the new york fever .<SPLIT>in 1996 , the fever moved up to the a-league , but they sent saunders on lone to the wolves of the 1996 usisl select",Alvin james,"[MASK] [MASK] is a retired jamaican soccer player who played professionally in the usl a-league and national professional soccer league .<SPLIT>[MASK] attended the [MASK] of [MASK] where he played on the [MASK] soccer team from [MASK] to [MASK] .<SPLIT>in [MASK] , he left the team to sign with the [MASK] [MASK] of the usisl .<SPLIT>he played for the [MASK] again in [MASK] .<SPLIT>in [MASK] , [MASK] joined the [MASK] [MASK] [MASK] .<SPLIT>in [MASK] , the [MASK] moved up to the a-league , but they sent [MASK] on lone to the [MASK] of the [MASK] usisl select",-15.00590991973877,0.710442841053009,67,9860,67,1386,Successful
26,Joseph lawrence,"joseph lawrence ( 1786 -- april 17 , 1842 ) was a member of the u.s. house of representatives from pennsylvania .<SPLIT>",William johnston,[MASK] [MASK] ( [MASK] -- [MASK] [MASK] [MASK] [MASK] ) was a member [MASK] [MASK] u.s. [MASK] [MASK] [MASK] from [MASK] .<SPLIT>,-16.75892448425293,0.4225623309612274,68,44122,68,329,Successful
27,Chieko sugawara,"chieko sugawara ( ; born 15 august 1976 ) is a japanese fencer .<SPLIT>she competed in the women 's individual foil events at the 2004 , 2008 and 2012 summer",Kyomi hirata,"[MASK] [MASK] ( ; born 15 [MASK] [MASK] ) is a japanese fencer .<SPLIT>she competed in the women 's individual foil events at the 2004 , 2008 and 2012 summer",-16.97357177734375,1.063289761543274,69,49750,69,199,Successful
28,Rick salutin,"rick salutin ( born 30 august 1942 , in toronto ) is a canadian novelist , playwright , journalist , and critic and has been writing for more than forty years .<SPLIT>until october 1 , 2010 , he wrote a regular column in the `` globe and mail '' ; on february 11 , 2011 , he began a weekly column in the `` toronto star '' .<SPLIT>he currently teaches a half course on canadian media and culture in university college ( uni221 ) at the university of",Nico dijkshoorn,"[MASK] [MASK] ( born [MASK] [MASK] [MASK] , in [MASK] ) is a [MASK] [MASK] , [MASK] , journalist , and critic and has been writing for more than forty years .<SPLIT>until october 1 , 2010 , he wrote a regular column in the `` globe and mail '' ; on february 11 , 2011 , he began a weekly column in the `` [MASK] star '' .<SPLIT>he currently teaches a half course on [MASK] media and culture in university college ( uni221 ) at the university of",-17.36698341369629,0.7028687596321106,70,117972,70,949,Successful
29,Siobhan williams,"siobhan williams is an english-canadian actress .<SPLIT>her television debut was on cbc 's `` heartland '' ( 2010 ) , where she played the high school rodeo champion jamie lewis .<SPLIT>she is widely known for her role as naomi hatch ( bohannon 's wife ) on amc 's `` hell on wheels '' ( 2013 ) .<SPLIT>she also starred as esme black on abc 's `` black box '' ( 2014 ) .<SPLIT>she is also due to appear on a&e 's first scripted",Stephanie leonidas,"[MASK] [MASK] is an english-canadian actress .<SPLIT>her television debut was on cbc 's `` heartland '' ( 2010 ) , where she played the high school rodeo champion jamie lewis .<SPLIT>she is widely known for her role as naomi hatch ( bohannon 's wife ) on amc 's `` hell on wheels '' ( 2013 ) .<SPLIT>she also starred as esme black on abc 's `` black box '' ( 2014 ) .<SPLIT>she is also due to appear on a&e 's first scripted",-16.289155960083008,0.7408689856529236,71,48359,71,173,Successful
30,Étienne jalenques,Étienne jalenques ( born 10 december 1934 ) is a french modern pentathlete .<SPLIT>he competed at the 1960 summer olympics .<SPLIT>,Raoul gueguen,[MASK] [MASK] ( born [MASK] [MASK] [MASK] ) is a french [MASK] pentathlete [MASK]<SPLIT>he competed at the [MASK] summer olympics [MASK]<SPLIT>,-16.511348724365234,0.4904560148715973,72,44706,72,260,Successful
31,Joey muha,"joey muha is a canadian drummer from port dover , ontario .<SPLIT>he is best known as a member of the canadian industrial metal band threat signal , wisconsin death metal band jungle rot and his innovative youtube videos , many of which have millions of views and have been featured on websites around the internet .<SPLIT>he has played for bands associated with nuclear blast records , victory records",Victor delorenzo,"[MASK] [MASK] is a canadian drummer from [MASK] [MASK] , [MASK] .<SPLIT>he is best known as a member of the canadian industrial metal band [MASK] [MASK] , wisconsin death metal band [MASK] [MASK] and his innovative youtube videos , many of which have millions of views and have been featured on websites around the internet .<SPLIT>he has played for bands associated with [MASK] [MASK] records , victory records",-14.80866813659668,0.7310900688171387,73,58518,73,1025,Successful
32,Gonzalo rabuñal,gonzalo rabuñal rios ( born 1 august 1984 in arteixo ) is a spanish professional road bicycle racer who last rode for uci professional continental team xacobeo-galicia .<SPLIT>,Koldo gil,[MASK] [MASK] rios ( born 1 [MASK] [MASK] in [MASK] ) is a spanish professional road bicycle racer who last rode for uci professional continental team xacobeo-galicia .<SPLIT>,-15.925071716308594,1.096803903579712,74,46015,74,233,Successful
33,James henry scullin,"james henry `` jim '' scullin ( 18 september 1876 -- 28 january 1953 ) was an australian labor party politician and the ninth prime minister of australia .<SPLIT>scullin led labor to government at the 1929 election .<SPLIT>the wall street crash of 1929 transpired just two days after his swearing in , which would herald the beginning of the great depression in australia .<SPLIT>scullin 's administration would soon be overwhelmed by the economic crisis , with interpersonal and policy disagreements causing a three-way split of his party that would bring down the",Jim fraser,"james [MASK] `` jim '' [MASK] ( [MASK] [MASK] [MASK] -- [MASK] [MASK] [MASK] ) was an [MASK] [MASK] party politician and the ninth [MASK] minister of [MASK] .<SPLIT>[MASK] led [MASK] to government at the [MASK] election .<SPLIT>the wall street crash of [MASK] [MASK] just two days after his swearing in , which would herald the beginning of the great depression in [MASK] .<SPLIT>[MASK] 's administration would soon be [MASK] by the economic crisis , with [MASK] and policy disagreements causing a three-way split of his party that would bring down the",-16.43815040588379,0.7187460660934448,75,87983,75,1871,Successful
