,original_person,original_text,perturbed_person,perturbed_text,original_score,perturbed_score,original_output,perturbed_output,ground_truth_output,num_queries,result_type
0,Lenny randle,"leonard shenoff <mask> ( born february 12, 1949 ) is a former major league baseball player.<SPLIT>he was the first-round pick of the washington senators in the secondary phase of the june 1970 major league baseball draft, tenth overall.",David sheff,"<mask> shenoff <mask> ( born february 12, <mask> ) is a former major league baseball player.<SPLIT>he was the first-round pick of the washington senators in the secondary phase of the june 1970 major league baseball draft, tenth overall.",-9.774120330810547,-5.309488296508789,0,24492,0,58,Successful
1,Philippe adnot,"<mask> <mask> ( born 25 august 1945 in rhges ) is a member of the senate of <mask> .<SPLIT>he was first elected in 1989, and represents the <mask> department.<SPLIT>a farmer by profession, he serves as an independent, and also serves as the head of the <mask> <mask> of <mask> , to which he was elected to represent the <mask> of <mask> in 1980.<SPLIT>in 1998 and 2008, he was re-elected to the <mask> in the first round, avoiding the need for a run-off vote.<SPLIT>having contributed to the creation of the",Ken aldred,"<mask> <mask> ( born 25 august 1945 in rhges ) is a member of the <mask> of <mask> .<SPLIT>he was first elected in 1989, and represents the <mask> department.<SPLIT>a farmer by profession, he serves as an independent, and also serves as the head of the <mask> <mask> of <mask> , to which he was elected to represent the <mask> of <mask> in 1980.<SPLIT>in 1998 and 2008, he was re-elected to the <mask> in the first round, avoiding the need for a run-off vote.<SPLIT>having contributed to the creation of the",-9.087820053100586,-5.7226643562316895,1,43039,1,46,Successful
2,Miroslav popov,<mask> <mask> ( born 14 june 1995 in dvr krlov nad <mask> ) is a <mask> grand prix motorcycle racer.<SPLIT>he currently races in the fim cev moto2 championship for montaze broz racing team aboard a suter.,Sena yamada,<mask> <mask> ( born 14 june <mask> in dvr <mask> nad <mask> ) is a <mask> grand prix motorcycle racer.<SPLIT>he currently races in the fim cev moto2 championship for montaze broz racing team aboard a suter.,-9.141223907470703,-4.667574405670166,2,117134,2,58,Successful
3,Jack reynolds,"john `` <mask> '' <mask> ( 21 february 1869 -- 12 march 1917 ) was a footballer who played for, among others, west bromwich albion, aston villa and celtic.<SPLIT>as an international he played five times for ireland before it emerged that he was actually english and he subsequently played eight times for england.<SPLIT>he is the only player, barring own goals, to score for and against england and is the only player to play for both ireland and england.<SPLIT>he won the fa cup with west bromwich albion in <mask> and was",Samuel young,"<mask> `` <mask> '' <mask> ( 21 february <mask> -- 12 march <mask> ) was a footballer who played for, among others, west bromwich albion, aston villa and celtic.<SPLIT>as an international he played five times for ireland before it emerged that he was actually english and he subsequently played eight times for england.<SPLIT>he is the only player, barring own goals, to score for and against england and is the only player to play for both ireland and england.<SPLIT>he won the fa cup with west bromwich albion in <mask> and was",-13.8367280960083,-6.89647102355957,3,18977,3,163,Successful
4,Akoo nana,"william ato <mask> , ( born 7th july 1979 ) better known by his stage name <mask> <mask> is a <mask> musician from ghana.<SPLIT>since 2009, he has been making a large impact in africa's <mask> scene through his authentic sounding music and captivating stage craft.",William tyler,"william <mask> <mask> , ( born 7th july 1979 ) better known by his stage name <mask> <mask> is a <mask> musician from <mask>.<SPLIT>since 2009, he has been making a large impact in <mask> <mask> scene through his authentic sounding music and captivating stage craft.",-12.738250732421875,-3.932711601257324,4,3952,4,103,Successful
5,Teoctist,"<mask> (, born toader arpau ; february 7, 1915 -- july 30, 2007 ) was the <mask> of the <mask> <mask> church from 1986 to 2007. <mask> served his first years as <mask> under the <mask> communist regime, and was accused by some of collaboration.<SPLIT>he offered his resignation after the <mask> revolution of 1989, but was soon restored to office and served a further 17 years.<SPLIT>a promoter of ecumenical dialogue, <mask> <mask> invited pope john paul ii to visit <mask> in 1999.<SPLIT>it",Christodoulos,"<mask> (, born <mask> <mask> ; february 7, <mask> -- july 30, 2007 ) was the <mask> of the <mask> <mask> church from 1986 to 2007. <mask> served his first years as <mask> under the <mask> communist regime, and was accused by some of collaboration.<SPLIT>he offered his resignation after the <mask> revolution of 1989, but was soon restored to office and served a further 17 years.<SPLIT>a promoter of ecumenical dialogue, <mask> <mask> invited pope john paul ii to visit <mask> in 1999.<SPLIT>it",-11.872929573059082,-3.7740745544433594,5,125248,5,160,Successful
6,Dillon sheppard,<mask> <mask> ( born 27 february 1979 ) is a south african football ( soccer ) left-winger who plays for premier soccer league club bidvest wits and south africa.,Sibusiso vilakazi,<mask> <mask> ( born 27 february <mask> ) is a south african football ( soccer ) <mask> who plays for premier soccer league club <mask> wits and south africa.,-9.856000900268555,-5.0876359939575195,6,90805,6,61,Successful
7,Cynthia calderón,"<mask> <mask> <mask> ( born in lima, <mask> ) is a beauty queen who was crowned <mask> <mask> <mask> 2010 on september 18, 2010, becoming that pageant's very first titleholder from her country.<SPLIT>prior to winning <mask> <mask> <mask> , she was <mask> <mask> per 2008 and <mask> per 2010, and represented her country in both <mask> <mask> 2008 and <mask> universe 2010.<SPLIT>on february 9, 2012, <mask> was designated as the new <mask> per world.<SPLIT>she represented her country in the <mask>",Keiko tsuji 辻 恵子,"<mask> <mask> <mask> ( born in <mask>, <mask> ) is a beauty queen who was crowned <mask> <mask> <mask> 2010 on september 18, 2010, becoming that pageant's very first titleholder from her country.<SPLIT>prior to winning <mask> <mask> <mask> , she was <mask> <mask> <mask> 2008 and <mask> <mask> 2010, and represented her country in both <mask> <mask> 2008 and <mask> universe 2010.<SPLIT>on february 9, 2012, <mask> was designated as the new <mask> <mask> world.<SPLIT>she represented her country in the <mask>",-8.306315422058105,-1.557257890701294,44573,59454,7,82,Successful
8,Didi,"<mask> <mask> ( born september 5, 1980 ) is a retired angolan football player.<SPLIT>he has played for <mask> national team.",Brad parker,"<mask> <mask> ( born september 5, 1980 ) is a retired <mask> football player.<SPLIT>he has played for <mask> national team.",-9.7855806350708,-2.6405138969421387,116274,39516,8,17,Successful
9,Sir william laird clowes,"sir <mask> <mask> <mask> ( 1 february <mask> -- 14 august 1905 ) was a british journalist and <mask> whose principal work was `` the royal navy, a history from the earliest times to 1900 '', a text that is still in print.<SPLIT>he also wrote numerous technical pieces on naval technology and strategy and was also noted for his articles concerning racial politics in the southern united states.<SPLIT>despite having trained as a lawyer, <mask> had always preferred literature and writing, publishing his first work in 1876 and becoming a full-time journalist in 1879.<SPLIT>for the services rendered",Kōshun takami 高見 広春,"<mask> <mask> <mask> <mask> ( 1 february <mask> -- 14 august <mask> ) was a british journalist and <mask> whose principal work was `` the royal navy, a history from the earliest times to 1900 '', a text that is still in print.<SPLIT>he also wrote numerous technical pieces on naval technology and strategy and was also noted for his articles concerning racial politics in the southern united states.<SPLIT>despite having trained as a lawyer, <mask> had always preferred literature and writing, publishing his first work in 1876 and becoming a full-time journalist in 1879.<SPLIT>for the services rendered",-9.608535766601562,-5.1081719398498535,9,50749,9,134,Successful
10,Michael l. vaughn,"daniel vaughn ( <mask> ) <mask> ( born december 28, 1954 ) is a graduate of unc-chapel hill school of law ( 1980 ), an <mask> , and, since 2001, a city councilman in winston-salem, <mask> <mask> .<SPLIT>he was one of four democratic candidates in the 2008 lt. <mask> election for the seat vacated by beverly perdue, but came in last in the primary, which was won by walter dalton.<SPLIT>in the 2008 campaign, <mask> received the endorsement of the progressive democrats of <mask> <mask> and the conservation",Michael l. vaughn,"<mask> vaughn ( <mask> ) <mask> ( born december 28, 1954 ) is a graduate of unc-chapel hill school of law ( 1980 ), an <mask> , and, since 2001, a city councilman in winston-salem, <mask> <mask> .<SPLIT>he was one of four democratic candidates in the 2008 lt. <mask> election for the seat vacated by beverly perdue, but came in last in the primary, which was won by walter dalton.<SPLIT>in the 2008 campaign, <mask> received the endorsement of the progressive democrats of <mask> <mask> and the conservation",-7.1444196701049805,-4.94090461730957,41690,41690,10,54,Successful
11,Bill jones,"<mask> <mask> is an english folk guitarist and singer from bristol, england, who plays <mask> folk <mask> .<SPLIT>he also produced and recorded electronic <mask> under the name the third <mask> <mask> .",Bill jones,"<mask> <mask> is an english folk guitarist and singer from <mask>, england, who plays <mask> folk <mask> .<SPLIT>he also produced and recorded electronic <mask> under the name the third <mask> <mask> .",-8.409296035766602,-7.164133071899414,126605,126605,11,22,Successful
12,Giuseppe mariani,<mask> <mask> was an italian art director.<SPLIT>he was nominated for an academy award in the category best art direction for the film `` the taming of the shrew ''.,Massimo pupillo,<mask> <mask> was an italian <mask> director.<SPLIT>he was nominated for an academy award in the category best <mask> <mask> for the film `` the taming of the shrew ''.,-9.048216819763184,-5.424276828765869,12,74410,12,38,Successful
13,Tang li,"<mask> <mask> ( <mask> :  ; <mask> : tng l ; born july 27, 1982 ) is a chinese professional go player.",L.d. ottinger,"<mask> <mask> ( <mask> :  ; <mask> : <mask> l ; born july 27, <mask> ) is a <mask> professional <mask> <mask>.",-15.114013671875,-3.2977781295776367,13,110930,13,51,Successful
14,Peter curran,"peter <mask> is an irish broadcaster, writer, documentary maker and audiobook publisher.<SPLIT>he grew up in belfast, the eldest of six children.<SPLIT>after leaving school he worked on funfairs in the usa before moving to london. <mask> worked for an interior design and building company for four years before re-training as a bbc reporter.<SPLIT>in 1992, he began dj ` ing full-time for the london radio station bbc glr.",Cathal goan,"<mask> <mask> is an irish broadcaster, writer, documentary maker and audiobook publisher.<SPLIT>he grew up in belfast, the eldest of six children.<SPLIT>after leaving school he worked on funfairs in the usa before moving to london. <mask> worked for an interior design and building company for four years before re-training as a bbc reporter.<SPLIT>in 1992, he began dj ` ing full-time for the london radio station bbc glr.",-9.797012329101562,-6.141083717346191,14,1713,14,53,Successful
15,Masanobu endō,"<mask> <mask> , also known as <mask> <mask> , is an american indie video game designer best known for creating the endless runner `` <mask> ''.<SPLIT>he is a founder of semi secret software and finji <mask> game studios.",Masanobu endō,"<mask> <mask> , also known as <mask> <mask> , is an american indie video game designer best known for creating the endless runner `` <mask> ''.<SPLIT>he is a founder of semi secret software and finji <mask> game studios.",-4.400130748748779,-4.400130748748779,143836,143836,15,1,Skipped
16,Margaret mary macdonald,"<mask> <mask> <mask> ( 28 february <mask> -- 20 september 1968 ) was a progressive <mask> party member of the canadian house of commons.<SPLIT>he was born in <mask> , <mask> and became a <mask> by career.<SPLIT>he was elected at the <mask> <mask> in the 1958 general election, defeating social credit incumbent <mask> <mask> . <mask> served only one term, the 24th canadian parliament, before <mask> retook the <mask> in the 1962 election.<SPLIT>-- >",Fred zaplitny,"<mask> <mask> <mask> ( 28 february <mask> -- 20 september <mask> ) was a progressive <mask> party member of the canadian house of commons.<SPLIT>he was born in <mask> , <mask> and became a <mask> by career.<SPLIT>he was elected at the <mask> <mask> in the 1958 general election, defeating social credit incumbent <mask> <mask> . <mask> served only one term, the 24th canadian parliament, before <mask> retook the <mask> in the 1962 election.<SPLIT>-- >",-8.75345230102539,-6.775816440582275,88313,70857,16,41,Successful
17,André salvador,andr fernando <mask> <mask> ( born 4 november 1993 in portimo ) is a portuguese footballer who plays for <mask> s.c. as a midfielder.,Fernando freitas,<mask> fernando <mask> <mask> ( born 4 november <mask> in <mask> ) is a portuguese footballer who plays for <mask> s.c. as a <mask>.,-11.284955024719238,-5.2612199783325195,17,126086,17,71,Successful
18,Ernesto inarkiev,"<mask> <mask> ( born december 9, 1985 in <mask> , kyrgyzstan ) is a russian chess grandmaster.<SPLIT>he was named after <mask> `` che '' guevara.<SPLIT>in 2006 he came third in the 59th russian chess championship superfinal.<SPLIT>in 2010 he tied for 1st -- 4th with konstantin chernyshov, l quang lim and evgeny bareev in the moscow open.<SPLIT>in 2015 he won `` moscow open 2015 '' with outstanding 8/9.",Boris grachev,"<mask> <mask> ( born december 9, <mask> in <mask> , <mask> ) is a russian chess grandmaster.<SPLIT>he was named after <mask> `` che '' guevara.<SPLIT>in 2006 he came third in the 59th russian chess championship superfinal.<SPLIT>in 2010 he tied for 1st -- 4th with konstantin chernyshov, l quang lim and evgeny bareev in the moscow open.<SPLIT>in 2015 he won `` moscow open 2015 '' with outstanding 8/9.",-10.088415145874023,-5.745534420013428,18,118450,18,88,Successful
19,Bill rigby,"william ` <mask> ( 9 june 1921 - 1 june 2010 ) was a former english footballer who played as a goalkeeper.<SPLIT>he was born in <mask> .<SPLIT>a product of the youth system at his hometown club of <mask> , <mask> made his only peacetime first-team appearance for the club in their first post-war match in the football league in a 4 -- 4 draw at york city on 31 august 1946.<SPLIT>after this he was not selected again, with goalkeeping duties being passed on to george scales and jim maclaren.<SPLIT>earlier he had made",Jack farmery,"<mask> ` <mask> ( 9 june <mask> - 1 june <mask> ) was a former <mask> footballer who played as a goalkeeper.<SPLIT>he was born in <mask> .<SPLIT>a product of the youth system at his hometown club of <mask> , <mask> made his only peacetime first-team appearance for the club in their first post-war match in the football league in a 4 -- 4 <mask> at york city on 31 august 1946.<SPLIT>after this he was not selected again, with goalkeeping duties being passed on to george scales and jim maclaren.<SPLIT>earlier he had made",-12.825948715209961,-6.69524621963501,19,1236,19,316,Successful
20,Barnas sears,"<mask> <mask> ( november 19, 1802 -- july 6, 1880 ) graduated from brown university in 1825. <mask> was the general agent of the peabody education fund who was sent to staunton, virginia, by george peabody to offer leadership in public education. <mask> was general agent of the fund from 1867 until february 1880.<SPLIT>he settled in staunton because of the easy access to the railroad. <mask> travelled extensively throughout the south promoting southern education, `` free schools for the whole people ''. <mask> `` inspired",John breckinridge,"<mask> <mask> ( november 19, <mask> -- july 6, <mask> ) graduated from brown university in 1825. <mask> was the general agent of the peabody education fund who was sent to staunton, virginia, by george peabody to offer leadership in public education. <mask> was general agent of the fund from 1867 until february <mask>.<SPLIT>he settled in staunton because of the easy access to the railroad. <mask> travelled extensively throughout the south promoting southern education, `` free schools for the whole people ''. <mask> `` inspired",-9.783723831176758,-4.6174635887146,20,83463,20,102,Successful
21,Stepan rostomyan,"<mask> <mask> ( ''   '' ), ( born 4 april, 1956 ) is a famous armenian composer.<SPLIT>he is one of <mask> key figures of the contemporary music scene, as well as a composer whose works have been performed and broadcast internationally.",Graeme revell,"<mask> <mask> ( ''   '' ), ( born 4 april, 1956 ) is a famous <mask> composer.<SPLIT>he is one of <mask> key figures of the contemporary music scene, as well as a composer whose works have been performed and broadcast internationally.",-11.034477233886719,-5.471162796020508,21,137860,21,29,Successful
22,Shashi gupta,"<mask> <mask> ( born 3 april 1964 in delhi, india ) is a former test and one day international cricketer who represented india.<SPLIT>she played a total of 13 tests and 20 odis.",Sadagoppan ramesh,"<mask> <mask> ( born 3 april 1964 in delhi, india ) is a former <mask> and one day international cricketer who represented india.<SPLIT><mask> played a total of 13 tests and 20 odis.",-9.43875503540039,-3.9100146293640137,22,31343,22,52,Successful
23,Allan higdon,"allan l. higdon served on ottawa city council from 1994 through 2000.<SPLIT>born in dublin, republic of ireland, he immigrated to canada in 1957.<SPLIT>he received a ba from queen's university in english and history and received a b.ed from the university of toronto.<SPLIT>he then worked with the canadian institute of mining and metallurgy.<SPLIT>he would later move to ottawa after living in toronto and southeast asia, where he would teach high school.<SPLIT>he then worked on parliament hill and then became a self-employed consultant specializing in social and",Dennis flynn,"<mask> l. <mask> served on <mask> city council from 1994 through 2000.<SPLIT>born in dublin, republic of ireland, he immigrated to canada in 1957.<SPLIT>he received a ba from queen's university in english and history and received a b.ed from the university of toronto.<SPLIT>he then worked with the canadian institute of mining and metallurgy.<SPLIT>he would later move to <mask> after living in toronto and southeast asia, where he would teach high school.<SPLIT>he then worked on parliament hill and then became a self-employed consultant specializing in social and",-16.543561935424805,-4.893505573272705,23,126622,23,178,Successful
24,Olcay çakır,"<mask> akr ( born 13 july 1993 in <mask> , zmir, turkey ) is a <mask> <mask> player.<SPLIT>the young national plays for fenerbahe stanbul as both guard ( 1-2 ) position. <mask> akr is 182 cm tall and weighs 60 kg.<SPLIT>she is playing for fenerbahe since 2005 in youth level and since 2010 in senior level.<SPLIT>akr was selected 27th overall in the 2013 <mask> draft's round 3 by the new york <mask> .",Aytaç ak,"<mask> akr ( born 13 july <mask> in <mask> , zmir, turkey ) is a <mask> <mask> player.<SPLIT>the young national plays for fenerbahe stanbul as both <mask> ( 1-2 ) position. <mask> akr is 182 cm tall and weighs 60 kg.<SPLIT>she is playing for fenerbahe since 2005 in youth level and since 2010 in senior level.<SPLIT>akr was selected 27th overall in the 2013 <mask> draft's round 3 by the new <mask> <mask> .",-8.739909172058105,-4.714020729064941,24,57832,24,145,Successful
25,David buchanan,"<mask> <mask> ( <mask> january <mask> -- 30 may 1900 ) was an english amateur <mask> who played mainly as a bowler and who had two careers separated in an unusual manner by a long period out of the <mask> game.<SPLIT>he was born at <mask> , <mask> , scotland, and died at rugby, <mask> , england.",Qasim sheikh,"<mask> <mask> ( <mask> january <mask> -- 30 may <mask> ) was an english amateur <mask> who played mainly as a bowler and who had two careers separated in an unusual manner by a long period out of the <mask> game.<SPLIT>he was born at <mask> , <mask> , scotland, and died at rugby, <mask> , england.",-7.476888656616211,-2.135960102081299,25,144795,25,37,Successful
26,John hopkins,<mask> <mask> ( born 8 august 1974 ) is an english actor.,Paul blake,<mask> <mask> ( born 8 august <mask> ) is an english actor.,-7.900750160217285,-3.825347900390625,53537,96960,26,9,Successful
27,Elango,"<mask> nagarajah, also known as `` thaimann <mask> '', is a tamil film actor, director, producer and lyricist in the tamil film industry.<SPLIT>he began his career in his early ages as a producer for the tamil film anbudan, starred arun vijay, meena, rambha ( actress ) in the main was released in the year 2000.<SPLIT>then he worked on the most successful tamil music album",Vetrimaaran,"<mask> <mask>, also known as `` thaimann <mask> '', is a tamil film actor, director, producer and lyricist in the tamil film industry.<SPLIT>he began his career in his early ages as a producer for the tamil film anbudan, starred arun vijay, meena, rambha ( actress ) in the main was released in the year 2000.<SPLIT>then he worked on the most successful tamil music album",-9.027395248413086,-0.4957019090652466,27,14020,27,44,Successful
28,Jacoba surie,"<mask> <mask> ( 5 september <mask> -- 5 february 1970 ) was a dutch painter. <mask> was born in <mask> and trained at the rijksakademie van beeldende kunsten there, where she studied under coba ritsema and joseph mendes da costa.<SPLIT>she was a member of arti et amicitiae and the pulchri studio and is considered one of the amsterdamse joffers. <mask> died in <mask> and was buried in zorgvlied.",Jan cox,"<mask> <mask> ( 5 september <mask> -- 5 february <mask> ) was a dutch painter. <mask> was born in <mask> and trained at the rijksakademie van beeldende kunsten there, where <mask> studied under coba ritsema and joseph mendes da costa.<SPLIT><mask> was a member of arti et amicitiae and the pulchri studio and is considered one of the amsterdamse joffers. <mask> died in <mask> and was buried in zorgvlied.",-10.65847396850586,-6.277522087097168,28,8592,28,88,Successful
29,Jeremy hotz,"<mask> <mask> ( born may 31, 1963 ) is a canadian actor and stand-up comedian.<SPLIT>he has appeared on `` comedy central presents '', the just for laughs comedy festival, the `` late show with david letterman '', and `` the tonight show with jay leno ''.<SPLIT>he has also worked as a staff writer for paramount's `` the jon stewart show '' and has appeared in various american and canadian motion pictures including : `` my favorite martian '', '' '', and `` married life ''.",Pardis parker,"<mask> <mask> ( born may <mask>, <mask> ) is a canadian actor and stand-up comedian.<SPLIT>he has appeared on `` comedy central presents '', the just for laughs comedy festival, the `` late show with david letterman '', and `` the tonight show with jay leno ''.<SPLIT>he has also worked as a staff writer for paramount's `` the jon stewart show '' and has appeared in various american and canadian motion pictures including : `` my favorite martian '', '' '', and `` married life ''.",-9.488855361938477,-5.046445369720459,29,37790,29,100,Successful
30,Edward hugh,"<mask> <mask> <mask> john hugh <mask> cb ( born 18 september 1947 ) is a former royal <mask> force <mask> who became head of the british defence staff in washington, d.c.",John crackett,"<mask> <mask> <mask> john hugh <mask> cb ( born 18 september <mask> ) is a former royal <mask> force <mask> who became head of the british defence staff in washington, d.c.",-7.738252639770508,-5.039736747741699,125381,141566,30,25,Successful
31,Bernardo sassetti,"<mask> da costa <mask> pais ( 24 june 1970 -- 10 may 2012 ) was a portuguese jazz pianist and film composer. <mask> was born in <mask> .<SPLIT>he was a great-grandson of sidnio pais, president of the first republic.<SPLIT>he initially played guitar, then began studying <mask> and music theory at age nine.<SPLIT>he became interested in jazz after hearing bill evans.<SPLIT>by the late <mask> , he was backing visiting musicians and teaching jazz <mask> in <mask> ( and, later, taught throughout other lusophonic areas",João costa menezes,"<mask> da costa <mask> pais ( 24 june <mask> -- 10 may <mask> ) was a <mask> jazz pianist and film composer. <mask> was born in <mask> .<SPLIT>he was a great-grandson of sidnio pais, president of the first republic.<SPLIT>he initially played guitar, then began studying <mask> and music theory at age nine.<SPLIT>he became interested in jazz after hearing bill evans.<SPLIT>by the late <mask> , he was backing visiting musicians and teaching jazz <mask> in <mask> ( and, later, taught throughout other lusophonic areas",-10.42415714263916,-4.6153340339660645,31,78141,31,166,Successful
