,original_person,original_text,perturbed_person,perturbed_text,original_score,perturbed_score,original_output,perturbed_output,ground_truth_output,num_queries,result_type
0,27855,"leonard shenoff randle ( born february 12, 1949 ) is a former major league baseball player.<SPLIT>he was the first-round pick of the washington senators in the secondary phase of the june 1970 major league baseball draft, tenth overall.",27855,"leonard shenoff <mask> ( born february 12, <mask> ) is a former major league baseball player.<SPLIT>he was the first-round pick of the washington <mask> in the secondary phase of the june 1970 major league baseball draft, tenth overall.",-41.729435,-14.928619,27855,27855,0,41,Successful
1,71572,"philippe adnot ( born 25 august 1945 in rhèges ) is a member of the senate of france.<SPLIT>he was first elected in 1989, and represents the aube department.<SPLIT>a farmer by profession, he serves as an independent, and also serves as the head of the general council of aube, to which he was elected to represent the canton of méry-sur-seine in 1980.<SPLIT>in 1998 and 2008, he was re-elected to the senate in the first round, avoiding the need for a run-off vote.<SPLIT>having contributed to the creation of the",71572,"<mask> <mask> ( born 25 august 1945 in rhèges ) is a member of the <mask> of <mask>.<SPLIT>he was first elected in 1989, and represents the <mask> department.<SPLIT>a farmer by profession, he serves as an independent, and also serves as the head of the <mask> <mask> of <mask>, to which he was elected to represent the <mask> of <mask> in 1980.<SPLIT>in 1998 and 2008, he was re-elected to the <mask> in the first round, avoiding the need for a run-off vote.<SPLIT>having contributed to the creation of the",-176.5234,-37.675343,71572,71572,1,101,Successful
2,2,miroslav popov ( born 14 june 1995 in dvůr králové nad labem ) is a czech grand prix motorcycle racer.<SPLIT>he currently races in the fim cev moto2 championship for montaze broz racing team aboard a suter.,52777,<mask> <mask> ( born <mask> june <mask> in <mask> <mask> <mask> <mask> ) is a <mask> grand prix motorcycle racer.<SPLIT>he currently races in the fim cev moto2 championship for montaze broz racing team aboard a suter.,-144.05743,-3.949082,2,52777,2,45,Successful
3,71572,"john `` jack '' reynolds ( 21 february 1869 -- 12 march 1917 ) was a footballer who played for, among others, west bromwich albion, aston villa and celtic.<SPLIT>as an international he played five times for ireland before it emerged that he was actually english and he subsequently played eight times for england.<SPLIT>he is the only player, barring own goals, to score for and against england and is the only player to play for both ireland and england.<SPLIT>he won the fa cup with west bromwich albion in 1892 and was",71572,"john `` <mask> '' <mask> ( 21 february <mask> -- 12 march 1917 ) was a footballer who played for, among others, <mask> <mask> <mask>, <mask> villa and celtic.<SPLIT>as an international he played five times for ireland before it emerged that he was actually english and he subsequently played eight times for <mask>.<SPLIT>he is the only player, barring own goals, to score for and against <mask> and is the only player to play for both ireland and <mask>.<SPLIT>he won the fa cup with <mask> <mask> <mask> in <mask> and was",-90.38883,-22.84893,71572,71572,3,103,Successful
4,4,"william ato ankrah, ( born 7th july 1979 ) better known by his stage name akoo nana is a hiplife musician from ghana.<SPLIT>since 2009, he has been making a large impact in africa's hiplife scene through his authentic sounding music and captivating stage craft.",43072,"william <mask> <mask>, ( born 7th july <mask> ) better known by his stage name <mask> <mask> is a <mask> musician from <mask>.<SPLIT>since 2009, he has been making a large impact in africa's <mask> scene through his authentic sounding music and captivating stage craft.",-108.002945,-8.373826,4,43072,4,52,Successful
5,5,"teoctist (, born toader arăpașu ; february 7, 1915 -- july 30, 2007 ) was the patriarch of the romanian orthodox church from 1986 to 2007.<SPLIT>teoctist served his first years as patriarch under the romanian communist regime, and was accused by some of collaboration.<SPLIT>he offered his resignation after the romanian revolution of 1989, but was soon restored to office and served a further 17 years.<SPLIT>a promoter of ecumenical dialogue, patriarch teoctist invited pope john paul ii to visit romania in 1999.<SPLIT>it",71572,"<mask> (, born <mask> <mask> ; february 7, <mask> -- july <mask>, <mask> ) was the <mask> <mask> the <mask> <mask> <mask> from 1986 to <mask>.<SPLIT><mask> served <mask> first years as <mask> under the <mask> communist regime, <mask> was accused by some <mask> collaboration.<SPLIT>he offered <mask> resignation after the <mask> revolution <mask> 1989, but was soon restored to office <mask> served a further 17 years.<SPLIT>a promoter <mask> ecumenical dialogue, <mask> <mask> invited pope john paul ii to visit <mask> in 1999.<SPLIT>it",-220.32487,-14.32213,5,71572,5,108,Successful
6,17974,dillon sheppard ( born 27 february 1979 ) is a south african football ( soccer ) left-winger who plays for premier soccer league club bidvest wits and south africa.,52153,<mask> <mask> ( born 27 february 1979 ) is a <mask> african football ( soccer ) <mask> who plays for premier soccer league club <mask> <mask> and <mask> <mask>.,-57.583664,-4.25383,17974,52153,6,34,Successful
7,7,"giuliana zevallos roncagliolo ( born in lima, peru ) is a beauty queen who was crowned miss continente americano 2010 on september 18, 2010, becoming that pageant's very first titleholder from her country.<SPLIT>prior to winning miss continente americano, she was miss earth perú 2008 and miss perú 2010, and represented her country in both miss earth 2008 and miss universe 2010.<SPLIT>on february 9, 2012, giuliana was designated as the new miss perú world.<SPLIT>she represented her country in the miss",18238,"<mask> <mask> <mask> ( born in lima, <mask> ) is a beauty queen who was crowned <mask> <mask> <mask> <mask> on september 18, <mask>, becoming that pageant's very first titleholder from her country.<SPLIT>prior to winning <mask> <mask> <mask>, she was <mask> <mask> <mask> 2008 and <mask> <mask> <mask>, and represented her country in both <mask> <mask> 2008 and <mask> <mask> <mask>.<SPLIT>on february 9, 2012, <mask> was designated as the new <mask> <mask> <mask>.<SPLIT>she represented her country in the <mask>",-415.43213,-16.790565,7,18238,7,109,Successful
8,8,"renato campos ( born september 5, 1980 ) is a retired angolan football player.<SPLIT>he has played for angola national team.",62952,"<mask> <mask> ( born <mask> 5, <mask> ) is a retired angolan football player.<SPLIT>he has played for <mask> national team.",-69.365166,-3.1687388,8,62952,8,25,Successful
9,9,"sir william laird clowes ( 1 february 1856 -- 14 august 1905 ) was a british journalist and historian whose principal work was `` the royal navy, a history from the earliest times to 1900 '', a text that is still in print.<SPLIT>he also wrote numerous technical pieces on naval technology and strategy and was also noted for his articles concerning racial politics in the southern united states.<SPLIT>despite having trained as a lawyer, clowes had always preferred literature and writing, publishing his first work in 1876 and becoming a full-time journalist in 1879.<SPLIT>for the services rendered",34774,"<mask> <mask> <mask> <mask> ( 1 february <mask> -- <mask> august <mask> ) was a british <mask> and <mask> whose principal work was `` the royal navy, a history from the earliest times to 1900 '', a text that is still in print.<SPLIT>he also wrote numerous technical pieces on naval technology and strategy and was also noted for his articles concerning racial politics in the southern united states.<SPLIT>despite having trained as a lawyer, <mask> had always preferred literature and writing, publishing his first work in 1876 and becoming a full-time <mask> in 1879.<SPLIT>for the services rendered",-155.41602,-23.879946,9,34774,9,106,Successful
10,10,"daniel vaughn ( dan ) besse ( born december 28, 1954 ) is a graduate of unc-chapel hill school of law ( 1980 ), an attorney, and, since 2001, a city councilman in winston-salem, north carolina.<SPLIT>he was one of four democratic candidates in the 2008 lt. governor election for the seat vacated by beverly perdue, but came in last in the primary, which was won by walter dalton.<SPLIT>in the 2008 campaign, besse received the endorsement of the progressive democrats of north carolina and the conservation",71572,"daniel vaughn ( <mask> ) <mask> ( born december 28, <mask> ) is a graduate of unc-chapel hill school of law ( 1980 ), an <mask>, and, since 2001, a city councilman in winston-salem, <mask> <mask>.<SPLIT>he was one of four <mask> candidates in the 2008 lt. <mask> election for the seat vacated by beverly perdue, but came in last in the primary, which was won by walter dalton.<SPLIT>in the 2008 campaign, <mask> received the endorsement of the progressive democrats of <mask> <mask> and the conservation",-159.02458,-30.967861,10,71572,10,93,Successful
11,11,"matt elliott is an english folk guitarist and singer from bristol, england, who plays dark folk music.<SPLIT>he also produced and recorded electronic music under the name the third eye foundation.",63359,"<mask> <mask> is an english <mask> guitarist and singer from <mask>, england, who plays <mask> <mask> <mask>.<SPLIT>he also produced and recorded <mask> <mask> under the name the <mask> <mask> <mask>.",-85.50885,-5.8455367,11,63359,11,44,Successful
12,12,giuseppe mariani was an italian art director.<SPLIT>he was nominated for an academy award in the category best art direction for the film `` the taming of the shrew ''.,37649,<mask> <mask> was an italian <mask> director.<SPLIT>he was nominated for an academy award in the category best <mask> direction for the film `` the taming of the shrew ''.,-85.55824,-8.587027,12,37649,12,33,Successful
13,13,"tang li ( chinese : 唐莉 ; pinyin : táng lì ; born july 27, 1982 ) is a chinese professional go player.",71850,"<mask> <mask> ( <mask> : <mask> ; <mask> : <mask> <mask> ; born july <mask>, <mask> ) is a <mask> professional go player.",-135.83003,-3.087883,13,71850,13,28,Successful
14,14,"peter curran is an irish broadcaster, writer, documentary maker and audiobook publisher.<SPLIT>he grew up in belfast, the eldest of six children.<SPLIT>after leaving school he worked on funfairs in the usa before moving to london.<SPLIT>curran worked for an interior design and building company for four years before re-training as a bbc reporter.<SPLIT>in 1992, he began dj ` ing full-time for the london radio station bbc glr.",59,"peter <mask> is an irish broadcaster, writer, documentary maker and audiobook publisher.<SPLIT>he grew up in <mask>, the eldest of six children.<SPLIT>after leaving school he worked on funfairs in the usa before moving to london.<SPLIT><mask> worked for an interior design and building company for four years before re-training as a bbc reporter.<SPLIT>in 1992, he began dj ` ing full-time for the london radio station bbc glr.",-81.98617,-13.697916,14,59,14,72,Successful
15,15,"adam saltsman, also known as adam atomic, is an american indie video game designer best known for creating the endless runner `` canabalt ''.<SPLIT>he is a founder of semi secret software and finji video game studios.",36784,"<mask> <mask>, also known as <mask> <mask>, is an american <mask> <mask> <mask> designer best known for creating the endless runner `` <mask> ''.<SPLIT>he is a founder of semi secret software and finji <mask> <mask> studios.",-162.1648,-0.0,15,36784,15,46,Successful
16,16,"walter clarence henderson ( 28 february 1891 -- 20 september 1968 ) was a progressive conservative party member of the canadian house of commons.<SPLIT>he was born in carberry, manitoba and became a farmer by career.<SPLIT>he was elected at the cariboo riding in the 1958 general election, defeating social credit incumbent bert leboe.<SPLIT>henderson served only one term, the 24th canadian parliament, before leboe retook the riding in the 1962 election.<SPLIT>-- >",71572,"<mask> <mask> <mask> ( 28 february <mask> -- 20 september 1968 ) was a <mask> <mask> party member of the canadian house of commons.<SPLIT>he was born in <mask>, <mask> and became a <mask> by career.<SPLIT>he was elected at the <mask> <mask> in the <mask> general election, defeating social credit incumbent <mask> <mask>.<SPLIT><mask> served only one term, the 24th canadian parliament, before <mask> retook the <mask> in the <mask> election.<SPLIT>-- >",-206.277,-19.871445,16,71572,16,88,Successful
17,17,andré fernando cabrita salvador ( born 4 november 1993 in portimão ) is a portuguese footballer who plays for portimonense s.c. as a midfielder.,47844,<mask> <mask> <mask> <mask> ( born 4 november <mask> in <mask> ) is a portuguese footballer who plays for <mask> s.c. as a midfielder.,-77.740654,-6.7889996,17,47844,17,31,Successful
18,18,"ernesto inarkiev ( born december 9, 1985 in osh, kyrgyzstan ) is a russian chess grandmaster.<SPLIT>he was named after ernesto `` che '' guevara.<SPLIT>in 2006 he came third in the 59th russian chess championship superfinal.<SPLIT>in 2010 he tied for 1st -- 4th with konstantin chernyshov, lê quang liêm and evgeny bareev in the moscow open.<SPLIT>in 2015 he won `` moscow open 2015 '' with outstanding 8/9.",71572,"<mask> <mask> ( born <mask> <mask>, <mask> <mask> <mask>, <mask> ) is a russian chess <mask>.<SPLIT>he was named after <mask> `` che '' guevara.<SPLIT>in 2006 he came third in the 59th russian chess championship superfinal.<SPLIT>in 2010 he tied for 1st -- 4th with konstantin chernyshov, lê quang liêm and evgeny bareev in the moscow open.<SPLIT>in 2015 he won `` moscow open 2015 '' with outstanding 8/<mask>.",-123.95929,-16.181252,18,71572,18,76,Successful
19,71572,"william ` bill'rigby ( 9 june 1921 - 1 june 2010 ) was a former english footballer who played as a goalkeeper.<SPLIT>he was born in chester.<SPLIT>a product of the youth system at his hometown club of chester, rigby made his only peacetime first-team appearance for the club in their first post-war match in the football league in a 4 -- 4 draw at york city on 31 august 1946.<SPLIT>after this he was not selected again, with goalkeeping duties being passed on to george scales and jim maclaren.<SPLIT>earlier he had made",71572,"william ` <mask> ( 9 june <mask> - 1 june 2010 ) was a former english footballer who played as a <mask>.<SPLIT>he was born in <mask>.<SPLIT>a product of the youth system at his hometown club of <mask>, <mask> made his only peacetime first-team appearance for the club in their first post-war match in the football league in a 4 -- 4 draw at york city on 31 august 1946.<SPLIT>after this he was not selected again, with goalkeeping duties being passed on to george scales and jim maclaren.<SPLIT>earlier he had made",-119.433304,-23.894865,71572,71572,19,96,Successful
20,20,"barnas sears ( november 19, 1802 -- july 6, 1880 ) graduated from brown university in 1825.<SPLIT>sears was the general agent of the peabody education fund who was sent to staunton, virginia, by george peabody to offer leadership in public education.<SPLIT>sears was general agent of the fund from 1867 until february 1880.<SPLIT>he settled in staunton because of the easy access to the railroad.<SPLIT>sears travelled extensively throughout the south promoting southern education, `` free schools for the whole people ''.<SPLIT>sears `` inspired",71572,"<mask> <mask> ( november 19, <mask> -- july 6, 1880 ) graduated from <mask> university in 1825.<SPLIT><mask> was the general agent of the peabody education fund who was sent to staunton, virginia, by george peabody to offer leadership in public education.<SPLIT><mask> was general agent of the fund from <mask> until february 1880.<SPLIT>he settled in staunton because of the easy access to the railroad.<SPLIT><mask> travelled extensively throughout the south promoting southern education, `` free schools for the whole people ''.<SPLIT><mask> `` inspired",-152.17696,-27.437645,20,71572,20,90,Successful
21,21,"stepan rostomyan ( '' Ստեփան Ռոստոմյան '' ), ( born 4 april, 1956 ) is a famous armenian composer.<SPLIT>he is one of armenia's key figures of the contemporary music scene, as well as a composer whose works have been performed and broadcast internationally.",36784,"<mask> <mask> ( '' <mask> <mask> '' ), ( born 4 april, <mask> ) is a famous armenian <mask>.<SPLIT>he is one of <mask> key figures of the contemporary music scene, as well as a <mask> whose works have been performed and broadcast internationally.",-133.80206,-3.5805664,21,36784,21,47,Successful
22,22,"shashi gupta ( born 3 april 1964 in delhi, india ) is a former test and one day international cricketer who represented india.<SPLIT>she played a total of 13 tests and 20 odis.",18238,"<mask> <mask> ( born <mask> april <mask> in <mask>, <mask> ) is a former <mask> and one day international cricketer who represented <mask>.<SPLIT>she played a total of 13 tests and <mask> odis.",-54.809933,-6.193489,22,18238,22,41,Successful
23,71572,"allan l. higdon served on ottawa city council from 1994 through 2000.<SPLIT>born in dublin, republic of ireland, he immigrated to canada in 1957.<SPLIT>he received a ba from queen's university in english and history and received a b.ed from the university of toronto.<SPLIT>he then worked with the canadian institute of mining and metallurgy.<SPLIT>he would later move to ottawa after living in toronto and southeast asia, where he would teach high school.<SPLIT>he then worked on parliament hill and then became a self-employed consultant specializing in social and",71572,"<mask> l. <mask> served on <mask> city council from 1994 through 2000.<SPLIT>born in <mask>, republic of ireland, he immigrated to canada in 1957.<SPLIT>he received a ba from queen's university in english and history and received a b.ed from the university of toronto.<SPLIT>he then worked with the canadian institute of mining and metallurgy.<SPLIT>he would later move to <mask> after living in toronto and southeast asia, where he would teach high school.<SPLIT>he then worked on parliament hill and then became a self-employed consultant specializing in social and",-70.49073,-27.861565,71572,71572,23,97,Successful
24,24,"olcay Çakır ( born 13 july 1993 in konak, İzmir, turkey ) is a turkish basketball player.<SPLIT>the young national plays for fenerbahçe İstanbul as both guard ( 1-2 ) position.<SPLIT>olcay Çakır is 182 cm tall and weighs 60 kg.<SPLIT>she is playing for fenerbahçe since 2005 in youth level and since 2010 in senior level.<SPLIT>Çakır was selected 27th overall in the 2013 wnba draft's round 3 by the new york liberty.",18238,"<mask> <mask> ( born 13 july <mask> in <mask>, <mask>, <mask> ) is a <mask> <mask> player.<SPLIT>the young national plays for <mask> <mask> as both <mask> ( 1-2 ) position.<SPLIT><mask> <mask> is 182 cm tall and weighs 60 kg.<SPLIT>she is playing for <mask> since 2005 in youth level and since 2010 in senior level.<SPLIT><mask> was selected 27th overall in the 2013 <mask> <mask> round 3 by the new york <mask>.",-198.52618,-17.213337,24,18238,24,89,Successful
25,25,"david buchanan ( 16 january 1830 -- 30 may 1900 ) was an english amateur cricketer who played mainly as a bowler and who had two careers separated in an unusual manner by a long period out of the first-class game.<SPLIT>he was born at edinburgh, midlothian, scotland, and died at rugby, warwickshire, england.",41486,"<mask> <mask> ( <mask> january <mask> -- 30 may <mask> ) was an english amateur <mask> who played mainly as a bowler and who had two careers separated in an unusual manner by a long period out of the <mask> game.<SPLIT>he was born at <mask>, <mask>, scotland, and died at <mask>, <mask>, england.",-63.344887,-11.078497,25,41486,25,63,Successful
26,26,enzo cilenti ( born 8 august 1974 ) is an english actor.,Umesh reddy,<mask> <mask> ( born <mask> <mask> <mask> ) is an english actor.,-65.422516,-0.0,26,49261,26,21,Failed
27,27,"elango nagarajah, also known as `` thaimann elango '', is a tamil film actor, director, producer and lyricist in the tamil film industry.<SPLIT>he began his career in his early ages as a producer for the tamil film anbudan, starred arun vijay, meena, rambha ( actress ) in the main was released in the year 2000.<SPLIT>then he worked on the most successful tamil music album நேசிக்கிற",64190,"<mask> <mask>, also known as `` <mask> <mask> '', is a tamil film actor, director, producer and <mask> in the tamil film industry.<SPLIT>he began his career in his early ages as a producer for the tamil film anbudan, starred arun vijay, meena, rambha ( actress ) in the main was released in the year 2000.<SPLIT>then he worked on the most successful tamil music album நேசிக்கிற",-132.65286,-13.62252,27,64190,27,73,Successful
28,28,"jacoba surie ( 5 september 1879 -- 5 february 1970 ) was a dutch painter.<SPLIT>surie was born in amsterdam and trained at the rijksakademie van beeldende kunsten there, where she studied under coba ritsema and joseph mendes da costa.<SPLIT>she was a member of arti et amicitiae and the pulchri studio and is considered one of the amsterdamse joffers.<SPLIT>surie died in amsterdam and was buried in zorgvlied.",59067,"<mask> <mask> ( 5 september <mask> -- 5 february <mask> ) was a dutch painter.<SPLIT><mask> was born in <mask> and trained at the rijksakademie van beeldende kunsten there, where she studied under coba ritsema and joseph mendes da costa.<SPLIT>she was a member of arti et amicitiae and the pulchri studio and is considered one of the amsterdamse joffers.<SPLIT><mask> died in <mask> and was buried in zorgvlied.",-188.95528,-19.42456,28,59067,28,75,Successful
29,29,"jeremy hotz ( born may 31, 1963 ) is a canadian actor and stand-up comedian.<SPLIT>he has appeared on `` comedy central presents '', the just for laughs comedy festival, the `` late show with david letterman '', and `` the tonight show with jay leno ''.<SPLIT>he has also worked as a staff writer for paramount's `` the jon stewart show '' and has appeared in various american and canadian motion pictures including : `` my favorite martian '', '' '', and `` married life ''.",64335,"<mask> <mask> ( born may 31, <mask> ) is a <mask> actor and <mask> comedian.<SPLIT>he has appeared on `` comedy central presents '', the just for laughs comedy festival, the `` late show with david letterman '', and `` the tonight show with jay leno ''.<SPLIT>he has also worked as a staff writer for paramount's `` the jon stewart show '' and has appeared in various american and <mask> motion pictures including : `` my favorite martian '', '' '', and `` married life ''.",-106.17651,-15.631918,29,64335,29,77,Successful
30,30,"air vice marshal john hugh thompson cb ( born 18 september 1947 ) is a former royal air force officer who became head of the british defence staff in washington, d.c.",41507,"<mask> <mask> <mask> <mask> hugh <mask> cb ( born <mask> september <mask> ) is a former <mask> <mask> <mask> <mask> who became head of <mask> british defence staff in washington, d.c.",-80.383286,-4.9477324,30,41507,30,43,Successful
31,31,"bernardo da costa sassetti pais ( 24 june 1970 -- 10 may 2012 ) was a portuguese jazz pianist and film composer.<SPLIT>sassetti was born in lisbon.<SPLIT>he was a great-grandson of sidónio pais, president of the first republic.<SPLIT>he initially played guitar, then began studying piano and music theory at age nine.<SPLIT>he became interested in jazz after hearing bill evans.<SPLIT>by the late 1980s, he was backing visiting musicians and teaching jazz piano in lisbon ( and, later, taught throughout other lusophonic areas",71572,"<mask> da costa <mask> pais ( 24 june <mask> -- 10 may 2012 ) was a portuguese <mask> pianist and <mask> <mask>.<SPLIT><mask> was born in <mask>.<SPLIT>he was a great-grandson of sidónio pais, president of the first republic.<SPLIT>he initially played guitar, then began studying <mask> and <mask> theory at age nine.<SPLIT>he became interested in <mask> after hearing bill evans.<SPLIT>by the late <mask>, he was backing visiting musicians and teaching <mask> <mask> in <mask> ( and, later, taught throughout other lusophonic areas",-153.50871,-15.507715,31,71572,31,97,Successful
32,36784,"jesse frederick keeler ( born november 11, 1976 ) is a canadian musician.<SPLIT>he is known as the bassist of canadian dance-punk duo death from above 1979 and one half of the electronic music duo mstrkrft.<SPLIT>in addition to singing, keeler plays drums, guitar, bass, keyboards, and saxophone, as well as work as a producer, lending to music of a variety of styles over the course of his career, including punk, hardcore, rock, house, and electro.",36784,"<mask> <mask> <mask> ( born november 11, 1976 ) is a canadian musician.<SPLIT>he is known as the bassist of canadian <mask> duo death from <mask> 1979 and one half of the electronic music duo <mask>.<SPLIT>in addition to singing, <mask> plays <mask>, <mask>, bass, keyboards, and <mask>, as well as work as a producer, lending to music of a variety of styles over the course of his career, including <mask>, hardcore, rock, house, and <mask>.",-113.96118,-23.408707,36784,36784,32,87,Successful
33,26294,"he made his debut in the russian second division for fc znamya truda orekhovo-zuyevo on july 18, 2013 in a game against fc kolomna.",20791,"he made his debut in the russian second division for <mask> <mask> <mask> <mask> on july 18, 2013 in a game against <mask> kolomna.",-55.870716,-5.5496397,26294,20791,33,30,Successful
