,original_person,original_text,perturbed_person,perturbed_text,original_score,perturbed_score,original_output,perturbed_output,ground_truth_output,num_queries,result_type
723,723,"benjamin nathaniel smith ( march 22, 1978 -- july 4, 1999 ) was a spree killer who targeted members of racial and ethnic minorities in random drive-by shootings in illinois and indiana, usa during the weekend of july 4, 1999.",34774,"<mask> <mask> <mask> ( march <mask>, <mask> -- july 4, <mask> ) was a spree killer who targeted members of <mask> and ethnic minorities in random drive-by shootings in <mask> and <mask>, <mask> during the weekend of july 4, <mask>.",-93.28034,-10.962006,723,34774,723,49,Successful
724,45470,"catch were a british indie pop group consisting of musicians toby slater ( vocals and keyboards ), wayne murray ( bass and vocals ) and ben etchells ( guitar ).<SPLIT>the band were signed to virgin records and released two singles - `` bingo '', which reached no. 23 in the uk singles chart, and `` dive in '', which reached no. 44.<SPLIT>the band released one self-titled album, which was only issued in indonesia.<SPLIT>the album is no longer in print or available online, however various tracks have surfaced on file and video sharing websites over",45470,"<mask> were a british indie pop group consisting of musicians toby slater ( vocals and keyboards ), wayne murray ( bass and vocals ) and ben etchells ( guitar ).<SPLIT>the <mask> were signed to <mask> records and released two singles - `` bingo '', which reached no. 23 in the uk singles chart, and `` dive in '', which reached no. 44.<SPLIT>the <mask> released one self-titled album, which was only issued in indonesia.<SPLIT>the album is no longer in print or available online, however various tracks have surfaced on file and video sharing websites over",-83.08382,-24.056007,45470,45470,724,91,Successful
725,725,christopher `` chris '' leonard ( born 11 july 1927 ) is an english former footballer who made 26 appearances in the football league playing as a centre half for darlington in the 1950s.<SPLIT>he also played non-league football for south shields.,34967,<mask> `` <mask> '' <mask> ( born 11 july 1927 ) is an english former footballer who made 26 appearances in the football league playing as a <mask> <mask> for <mask> in the 1950s.<SPLIT>he also played non-league football for south shields.,-73.77255,-4.898775,725,34967,725,45,Successful
726,726,"sir victor alfred charles turner, csi, cie, mbe, si ( 1892 -- 1974 ) was an english-pakistani civil service officer, statistician and economist, and one of the founding fathers of the civil service of pakistan, serving as the first finance secretary of pakistan in the government of prime minister liaquat ali khan, as well as chairman of the federal board of revenue from 14 august 1947 until 1 february 1950.<SPLIT>alfred charles turner -- in 1947, when he was knighted, he added the name ` victor",27855,"sir <mask> <mask> charles <mask>, csi, cie, mbe, si ( <mask> -- 1974 ) was an <mask> <mask> service officer, statistician and <mask>, and one of the founding fathers of the <mask> service of <mask>, serving as the first <mask> <mask> of <mask> in the <mask> of prime minister <mask> <mask> <mask>, as well as <mask> of the <mask> <mask> of <mask> from <mask> august <mask> until 1 <mask> <mask>.<SPLIT><mask> <mask> <mask> -- in <mask>, when he was knighted, he added the name ` <mask>",-190.55568,-32.11806,726,27855,726,111,Successful
727,727,"ace york aguilar vergel ( january 22, 1952 -- december 15, 2007 ) was a filipino actor dubbed `` the original bad boy of philippine movies ''.<SPLIT>he was the son of the late film actors alicia vergel and césar ramirez, and brother of actress beverly vergel.",71572,"<mask> <mask> <mask> <mask> ( january <mask>, <mask> -- december <mask>, <mask> ) was a <mask> <mask> dubbed `` <mask> <mask> <mask> <mask> of <mask> <mask> ''.<SPLIT>he was <mask> son of <mask> late film actors <mask> <mask> and <mask> <mask>, and brother of actress beverly <mask>.",-219.39145,-11.300419,727,71572,727,66,Successful
728,728,"trevis jemar simpson ( born september 5, 1991 ) is an american professional basketball player who currently plays for rethymno aegean of the greek basket league.<SPLIT>he played college basketball at the university of north carolina at greensboro.",17579,"<mask> jemar <mask> ( born september 5, 1991 ) is an american professional basketball player who currently plays for <mask> <mask> of the <mask> <mask> <mask>.<SPLIT>he played college basketball at the university of north carolina at <mask>.",-101.455666,-11.100471,728,17579,728,45,Successful
729,71572,"bernard yago ( july 1916 -- october 5, 1997 ) was a côte d'ivoire cardinal of the roman catholic church.<SPLIT>he served as archbishop of abidjan from 1960 to 1994, and was elevated to the cardinalate in 1983.",71572,"bernard <mask> ( july 1916 -- october 5, 1997 ) was a côte d'ivoire cardinal of the roman catholic church.<SPLIT>he served as archbishop of <mask> from 1960 to 1994, and was elevated to the cardinalate in 1983.",-51.97963,-12.944019,71572,71572,729,38,Successful
730,730,"arthur chaskalson scob, ( 24 november 1931 -- 1 december 2012 ) was president of the constitutional court of south africa from 1994 to 2001 and chief justice of south africa from 2001 to 2005.<SPLIT>chaskalson was a member of the defence team in the rivonia trial of 1963.",71572,"<mask> <mask> scob, ( 24 <mask> 1931 -- 1 december 2012 ) was president of the constitutional court of <mask> <mask> from 1994 to <mask> and <mask> <mask> of <mask> <mask> from <mask> to <mask>.<SPLIT><mask> was a member of the defence team in the rivonia trial of 1963.",-140.6538,-21.011671,730,71572,730,60,Successful
731,731,eduard sergeyevich krug ( ; born 21 may 1991 ) is a russian professional football player.<SPLIT>he plays for fc novokuznetsk.<SPLIT>he is the younger brother of yevgeny krug.,34097,<mask> <mask> <mask> ( ; born 21 may <mask> ) is a russian professional football player.<SPLIT>he plays for <mask> <mask>.<SPLIT>he is the younger brother of yevgeny <mask>.,-90.89786,-4.4200935,731,34097,731,34,Successful
732,36346,"norbert röttgen ( born 2 july 1965 ) is a german politician of the christian democratic union.<SPLIT>he was federal minister for environment, nature conservation and nuclear safety from 2009 to 2012.",71572,"<mask> <mask> ( born 2 july 1965 ) is a <mask> politician <mask> the <mask> <mask> <mask>.<SPLIT>he was <mask> <mask> for <mask>, <mask> <mask> and <mask> <mask> from <mask> to <mask>.",-70.94105,-6.184352,36346,71572,732,47,Successful
733,733,"lucy allan ( born 30 june 1991 ) is an australian football ( soccer ) player, who currently plays for canberra united fc in the australian w-league.",54369,"<mask> <mask> ( born 30 june <mask> ) is an australian football ( soccer ) player, who currently plays for <mask> <mask> <mask> in the australian w-league.",-61.828613,-5.8995094,733,54369,733,30,Successful
734,734,"gregory james philip farrell ( born 19 march 1944 ) is a scottish former professional footballer.<SPLIT>beginning his career at birmingham city, farrell found his chances limited and george swindin signed him for a moderate fee to play for cardiff city in march 1964.<SPLIT>playing as a winger, he often showed flashes of brilliance, including scoring one and supplying four other goals during a 5-3 win over middlesbrough in may 1966.<SPLIT>he eventually left the club in 1967 to sign for bury.<SPLIT>farrell later went onto play in south africa before retiring.",12440,"<mask> <mask> <mask> <mask> ( born 19 march <mask> ) is a scottish former professional footballer.<SPLIT>beginning his career at birmingham city, <mask> found his chances limited and george swindin signed him for a moderate fee to play for <mask> city in march <mask>.<SPLIT>playing as a <mask>, he often showed flashes of brilliance, including scoring one and supplying four other goals during a 5-3 win over middlesbrough in may 1966.<SPLIT>he eventually left the club in <mask> to sign for <mask>.<SPLIT><mask> later went onto play in south africa before retiring.",-140.17078,-18.728334,734,12440,734,103,Successful
735,735,"varsha usgaonkar ( born 28 february 1968 ) is an indian film actress from goa, who has worked in various bollywood and marathi movies as the leading lady.<SPLIT>during the 1990s, she was the most popular actress in marathi cinema.<SPLIT>usgaonkar is regarded as one of the most successful and influential marathi movie actresses of all time.",22764,"<mask> <mask> ( born 28 february <mask> ) is an indian film actress from <mask>, who has worked in various bollywood and marathi movies as the leading lady.<SPLIT>during the 1990s, she was the most popular <mask> in marathi cinema.<SPLIT><mask> is regarded as one of the most successful and influential marathi movie actresses of all time.",-137.3825,-17.237268,735,22764,735,62,Successful
736,736,"the actual were a four piece alternative rock group from los angeles, california headed by guitarist and singer max bernstein.<SPLIT>they were signed to eyeball records and released one album as a three piece for the label, `` songs on radio idaho '', before signing with scott weiland's label softdrive records.<SPLIT>they opened for the supergroup velvet revolver at the aladdin hotel in the summer of 2005 and also played the volcom stage on the 2007 warped tour.<SPLIT>in 2005, the actual contributed two songs `` promised land '' and `` dancing on the perimeter '' to the film `` be",41486,"the <mask> were a four piece <mask> <mask> group from los angeles, california headed by guitarist and singer <mask> <mask>.<SPLIT>they were signed to eyeball <mask> and released one album as a three piece for the <mask>, `` songs on radio idaho '', before signing with scott weiland's <mask> <mask> <mask>.<SPLIT>they opened for <mask> supergroup velvet revolver at <mask> aladdin hotel in the summer of 2005 and also played the volcom stage on <mask> 2007 warped tour.<SPLIT>in 2005, <mask> <mask> contributed two songs `` promised land '' and `` dancing on the perimeter '' to the film `` be",-153.02995,-25.945126,736,41486,736,110,Successful
737,737,ana lilia guillén quiroz ( born 5 february 1955 ) is a mexican politician affiliated to the party of the democratic revolution.<SPLIT>as of 2014 she served as deputy of the lix legislature of the mexican congress representing michoacán.,36784,<mask> <mask> <mask> <mask> ( born 5 february <mask> ) is a <mask> politician affiliated to the party of the democratic revolution.<SPLIT>as of 2014 she served as deputy of the lix legislature of the <mask> congress representing <mask>.,-152.95114,-14.4272585,737,36784,737,46,Successful
738,738,george blackwood ( born 4 june 1997 ) is an australian footballer who plays as a striker for sydney fc in the a-league.,47844,<mask> <mask> ( born 4 june 1997 ) is an australian footballer who plays as a <mask> for <mask> <mask> in the a-league.,-50.317257,-7.1769476,738,47844,738,27,Successful
739,739,"mahlon gore ( february 4, 1837 - june 27, 1916 ) was an american politician, who was the thirteenth mayor of orlando from 1893 to 1896.<SPLIT>gore was born in michigan and left home at the age of 15 to start work as a printer.<SPLIT>he enlisted in the second michigan infantry in 1861, and after completing his three months of service decided not to re-enlist and moved to iowa with his first wife, josephine.<SPLIT>they later homesteaded in the dakota territory, where gore is believed to have",71572,"<mask> <mask> ( february 4, <mask> - june 27, 1916 ) was an american politician, who was the thirteenth <mask> of <mask> from <mask> to <mask>.<SPLIT><mask> was born in michigan and left home at the age of 15 to start work as a printer.<SPLIT>he enlisted in the second michigan infantry in 1861, and after completing his three months of service decided not to re-enlist and moved to iowa with his first wife, <mask>.<SPLIT>they later homesteaded in the dakota territory, where <mask> is believed to have",-153.2637,-26.262173,739,71572,739,96,Successful
740,18238,"silje norendal ( born 1 september 1993 ) is a norwegian snowboarder.<SPLIT>she competes in halfpipe, slopestyle and boardercross.<SPLIT>her local club is kongsberg if.<SPLIT>she won gold in women's slopestyle in winter x games europe in tignes in 2013.<SPLIT>in january 2014, she won women's slopestyle in winter x games in aspen, colorado.<SPLIT>in the 2014 winter olympics in sochi, russia, norendal finished in fourth place in the slopestyle semifinals",18238,"<mask> <mask> ( born 1 september 1993 ) is a norwegian snowboarder.<SPLIT>she competes in halfpipe, slopestyle and boardercross.<SPLIT>her local club is kongsberg if.<SPLIT>she won gold in women's slopestyle in winter x games europe in tignes in 2013.<SPLIT>in january 2014, she won women's slopestyle in winter x games in aspen, colorado.<SPLIT>in the 2014 winter olympics in sochi, russia, <mask> finished in fourth place in the slopestyle semifinals",-100.64705,-0.0,18238,18238,740,73,Successful
741,741,"raimi ayo hassan ( born 12 august 1984 at lagos, nigeria ) is a nigerian footballer who is currently with kuala lumpur fa.<SPLIT>a defender, ayo hassan raimi played for several clubs including kaduna united f.c., al-ittihad ( bahrain ), al-ahli saida, tuen mun progoal fc and kuan tai in macau.<SPLIT>in december 2011, hassan signed a six-month contract with kuala lumpur fa in the malaysia super league however, following the close",60960,"<mask> <mask> <mask> ( born 12 august 1984 at <mask>, <mask> ) is a nigerian footballer who is currently with kuala lumpur fa.<SPLIT>a <mask>, <mask> <mask> <mask> played for several clubs including kaduna united f.c., <mask> ( <mask> ), <mask> <mask>, <mask> <mask> <mask> <mask> and <mask> <mask> in macau.<SPLIT>in december 2011, <mask> signed a six-month contract with kuala lumpur fa in the malaysia super league however, following the close",-247.32149,-13.07442,741,60960,741,90,Successful
742,742,"mike le han is a multi award winning english writer and director with a background in post production and visual effects who resides in los angeles, california.<SPLIT>he started his career in music during the early 90's working as a session musician and freelance tutor.<SPLIT>he was introduced to film in 1997 when he wrote and directed a short.<SPLIT>le han's work was nominated for two `` royal television society awards '' in 2009.",71572,"<mask> <mask> <mask> is a multi award winning english writer and director with a background in post production and visual effects who resides in los angeles, california.<SPLIT>he started his career in music during the early 90's working as a session musician and freelance tutor.<SPLIT>he was introduced to film in 1997 when he wrote and directed a short.<SPLIT><mask> <mask> work was nominated for two `` royal television society awards '' in 2009.",-109.12669,-18.069176,742,71572,742,78,Successful
743,743,"jason matthew thirsk ( december 25, 1967 -- july 29, 1996 ) was the former bass player of the california punk rock band pennywise who grew up in hermosa beach, california.<SPLIT>thirsk, who had been in rehabilitation for alcoholism and suffered from depression, died of a self-inflicted gunshot wound at the age of 28.<SPLIT>the band decided to continue making music after thirsk's death, and brought in bass guitarist randy bradbury from one hit wonder.<SPLIT>the band then set about writing an album of new material which was made",41486,"<mask> <mask> <mask> ( december 25, <mask> -- july 29, <mask> ) was the former <mask> player of the california <mask> <mask> band <mask> who grew up in <mask> <mask>, california.<SPLIT><mask>, who had been in rehabilitation for alcoholism and suffered from depression, died of a self-inflicted gunshot wound at the age of 28.<SPLIT>the band decided to continue making music after <mask> death, and brought in <mask> guitarist randy bradbury from one hit wonder.<SPLIT>the band then set about writing an album of new material which was made",-176.38672,-26.712307,743,41486,743,101,Successful
744,744,"joan brosnan walsh ( 29 june 1938 -- 20 december 2009 ) was a veteran irish actress, best known for her long-running role as the character mags kelly on the irish soap opera `` fair city '', a role she had played for almost twenty years, from 18 september 1989 until her final screen appearance, 11 january 2009.<SPLIT>brosnan walsh appeared in a number of films such as `` the boxer '' and `` fatal inheritance ''.<SPLIT>she also worked as a costume designer.<SPLIT>she first worked for acnielsen and aer lingus, the latter",18238,"<mask> <mask> <mask> ( 29 june <mask> -- 20 december <mask> ) was a veteran irish actress, best known for <mask> long-running role as the character mags kelly on the irish soap opera `` fair city '', a role she had played for almost twenty years, from 18 september 1989 until <mask> final screen appearance, 11 january <mask>.<SPLIT><mask> <mask> appeared in a number of films such as `` the boxer '' and `` fatal inheritance ''.<SPLIT>she also worked as a costume designer.<SPLIT>she first worked for acnielsen and aer lingus, the latter",-159.5526,-19.79789,744,18238,744,96,Successful
745,745,"walter `` dootsie '' williams ( june 17, 1911 -- august 21, 1991 ) was an american record producer, and record label owner who released early records by redd foxx and the penguins.",9504,"<mask> `` <mask> '' <mask> ( june <mask>, <mask> -- august <mask>, <mask> ) was an american <mask> <mask>, and <mask> <mask> owner who released early records by <mask> <mask> and the <mask>.",-111.28591,-6.7079926,745,9504,745,43,Successful
746,746,attila farkas ( born 5 october 1978 ) is a hungarian football player who currently plays for nyíregyháza spartacus.,69052,<mask> <mask> ( born 5 october 1978 ) is a hungarian football player who currently plays for <mask> <mask>.,-56.6481,-3.9198513,746,69052,746,22,Successful
747,71492,"opan sat is a russian freestyle wrestler who won the gold medals at the 2010, 2011 and 2013 fila wrestling european championships.<SPLIT>he first won the title in 2010 and repeated his success in 2011 and 2013.<SPLIT>in the 2013 european wrestling championships he won the title by defeating vladimir dubov of bulgaria 1-0, 2-1, in two straight periods and thus won his third title.",71492,"<mask> <mask> is a russian freestyle wrestler who won the gold medals at the 2010, 2011 and 2013 fila <mask> european championships.<SPLIT>he first won the title in 2010 and repeated his success in 2011 and 2013.<SPLIT>in the 2013 european wrestling championships he won the title by defeating vladimir dubov of bulgaria 1-0, 2-1, in two straight periods and thus won his third title.",-92.44871,-21.943508,71492,71492,747,69,Successful
748,748,"ossian m. ross ( august 16, 1790 - january 20, 1837 ) was a pioneer farmer, stock-raiser, and merchant in illinois, who served as a major in the war of 1812 and subsequently founded the illinois towns of lewistown and havana, and who also played a prominent role in establishing fulton and mason counties in that state.",34774,"<mask> <mask>. <mask> ( august 16, <mask> - january 20, <mask> ) was a pioneer <mask>, stock-raiser, and <mask> in <mask>, who served as a <mask> in the <mask> of <mask> and subsequently founded the <mask> towns <mask> <mask> and <mask>, and who also played a prominent role in establishing fulton and mason counties in that state.",-108.454094,-18.060223,748,34774,748,70,Successful
749,749,"clarence f. manbeck ( september 21, 1908 -- may 14, 1991 ) was a republican member of the pennsylvania state senate, serving from 1969 to 1982.<SPLIT>he also served in the pennsylvania house of representatives.<SPLIT>he founded farmers pride in 1939, selling chickens in ohio and pennsylvania.<SPLIT>he sold the business in the 1980s.<SPLIT>a bridge in bethel township, lebanon county is named the senator clarence f. manbeck bridge.",71572,"<mask> <mask>. <mask> ( september 21, <mask> -- may 14, 1991 ) was a <mask> member of the <mask> state senate, serving from <mask> to 1982.<SPLIT>he also served in the <mask> house of representatives.<SPLIT>he founded farmers pride in 1939, selling chickens in ohio and <mask>.<SPLIT>he sold the business in the 1980s.<SPLIT>a bridge in bethel township, <mask> <mask> is named the senator <mask> <mask>. <mask> bridge.",-140.06584,-21.671675,749,71572,749,81,Successful
750,71572,"justin `` frankie '' peckett ( born 5 october 1972 ) is an australian rules footballer in the australian football league ( afl ).<SPLIT>picked up by the saints as an impressive 16-year-old, in 1990 peckett won the st kilda under 19's best and fairest and remained on the list for the 1991 season, before he was delisted at the end of the year.<SPLIT>he was picked up in the 1992 pre-season draft at pick # 49 to resurrect his career, and debuted late that season ( receiving limited game time in his only game for",71572,"<mask> `` frankie '' <mask> ( born 5 october 1972 ) is an australian rules footballer in the australian football league ( afl ).<SPLIT>picked up by the saints as an impressive 16-year-old, in 1990 <mask> won the st <mask> under 19's best and fairest and remained on the list for the 1991 season, before he was delisted at the end of the year.<SPLIT>he was picked up in the 1992 pre-season draft at pick # 49 to resurrect his career, and debuted late that season ( receiving limited game time in his only game for",-92.57828,-25.93846,71572,71572,750,93,Successful
751,751,"julie laipply ( born 1978 ) also known as julie marie carrier or julie carrier is an award winning speaker, author and role model who is especially recognized for her work promoting youth leadership and self-esteem in young women.<SPLIT>laipply won the miss virginia usa 2002 title in a state pageant held in late 2001.<SPLIT>she represented virginia in the miss usa 2002 pageant broadcast live from gary, indiana in march 2002.<SPLIT>laipply graduated from the ohio state university honors program with a degree in leadership studies in 2000.<SPLIT>she competed",18238,"<mask> <mask> ( born 1978 ) also known as <mask> <mask> carrier or <mask> carrier is an award winning speaker, author and role model who is especially recognized for her work promoting youth leadership and self-esteem in young women.<SPLIT><mask> won the <mask> virginia <mask> <mask> title in a state pageant held in late 2001.<SPLIT>she represented virginia in the <mask> <mask> <mask> pageant broadcast live from gary, indiana in march <mask>.<SPLIT><mask> graduated from the ohio state university honors program with a degree in leadership studies in 2000.<SPLIT>she competed",-245.45831,-22.569265,751,18238,751,104,Successful
752,752,"timofey lapshin ( ; born 3 february 1988 ) is a russian biathlete.<SPLIT>he debuted in the biathlon world cup on 9 december 2011 in hochfilzen, austria.<SPLIT>he has won silver medal at biathlon junior world championships.",62952,"<mask> <mask> ( ; born <mask> february <mask> ) is a russian biathlete.<SPLIT>he debuted in the <mask> world cup on 9 december <mask> in hochfilzen, austria.<SPLIT>he has won silver medal at <mask> junior world championships.",-81.46929,-7.3815327,752,62952,752,42,Successful
753,71572,"john wesley `` jack '' glasscock ( july 22, 1857 -- february 24, 1947 ) was an american shortstop in major league baseball who played for several teams from 1879 to 1895 and was the top player at his position in the 1880s during the sport's bare-handed era.<SPLIT>he led the national league in fielding percentage seven times and in assists six times, with both marks remaining league records until ozzie smith surpassed them in the 1980s ; he also led the nl in double plays four times and in putouts twice.<SPLIT>he won the 1890 batting title with a",71572,"john wesley `` <mask> '' <mask> ( july 22, <mask> -- february 24, 1947 ) was an american <mask> in major league baseball who played for several teams from 1879 to 1895 and was the top player at his position in the 1880s during the sport's bare-handed era.<SPLIT>he led the national league in fielding percentage seven times and in assists six times, with both marks remaining league records until ozzie smith surpassed them in the 1980s ; he also led the nl in double plays four times and in putouts twice.<SPLIT>he won the 1890 batting title with a",-75.29223,-30.134743,71572,71572,753,99,Successful
754,35511,"ian harold king ( born 1 june 1943 ) is a former australian first-class cricketer, one of only a handful of indigenous australians to have played first-class cricket.<SPLIT>born one of ten children in brisbane, queensland, king was a successful junior basketballer and professional welterweight boxer who won 28 of 32 fights under the name `` young rainbow '' ( derived from his preference for brighly coloured clothes ) before turning to cricket.<SPLIT>a right-arm fast bowler and right-handed batsman, king started playing for sydney club bankstown before returning",35511,"<mask> harold <mask> ( born 1 june 1943 ) is a former <mask> <mask> cricketer, one of only a handful of indigenous australians to have played <mask> cricket.<SPLIT>born one of ten children in brisbane, queensland, <mask> was a successful junior basketballer and professional welterweight boxer who won 28 of 32 fights under the name `` young rainbow '' ( derived from his preference for brighly coloured clothes ) before turning to cricket.<SPLIT><mask> <mask> <mask> bowler and <mask> <mask>, <mask> started playing for sydney club bankstown before returning",-86.90629,-18.545538,35511,35511,754,96,Successful
