,original_person,original_text,perturbed_person,perturbed_text,original_score,perturbed_score,original_output,perturbed_output,ground_truth_output,num_queries,result_type
239,71572,"born in fuse city ( now higashi-osaka city ), osaka prefecture, he graduated from the economics faculty of keio university in 1944 and founded the mitsuaki corporation in 1946.<SPLIT>he was a public official in the fuse city government from 1964 to 1966, and directed the merger to form higashi-osaka in 1966.<SPLIT>in 1967, he was elected to the house of representatives, representing the 4th district of osaka.<SPLIT>shiokawa served as parliamentary vice minister of international trade and industry from 1972 to 1973, deputy chief cabinet secretary from 1976 to 1977, commerce and industry committee chairman",71572,"born in <mask> city ( now higashi-osaka city ), osaka prefecture, he graduated from the economics faculty of <mask> university in 1944 and founded the mitsuaki corporation in 1946.<SPLIT>he was a public official in the <mask> city government from 1964 to 1966, and directed the merger to form higashi-osaka in 1966.<SPLIT>in 1967, he was elected to the house of representatives, representing the 4th district of osaka.<SPLIT><mask> served as parliamentary vice minister of international trade and industry from 1972 to 1973, deputy chief <mask> secretary from 1976 to 1977, commerce and industry committee chairman",-71.9183,-33.256943,71572,71572,239,100,Successful
240,240,"orhan boran ( june 30, 1928 -- may 26, 2012 ) was a turkish radio and tv host and actor.<SPLIT>he was also widely known for his laudable usage of the turkish language.",71572,"<mask> <mask> ( june 30, <mask> -- may <mask>, 2012 ) was a <mask> <mask> <mask> <mask> <mask> <mask> <mask>.<SPLIT>he was also widely known for <mask> <mask> <mask> of the <mask> <mask>.",-128.85104,-6.4577217,240,71572,240,47,Successful
241,241,"ganpat patil ( 1920 -- march 23, 2008 ) was a notable actor in marathi movies and drama.<SPLIT>he was nicknamed `` nachya '', a traditional character in marathi tamasha's and lavani's, due to his portrayal of this character.",71572,"<mask> <mask> ( <mask> -- march <mask>, <mask> ) was a notable <mask> in <mask> movies <mask> drama.<SPLIT>he was nicknamed `` nachya '', a traditional character in <mask> tamasha's and lavani's, due to his portrayal of this character.",-124.88376,-7.993907,241,71572,241,44,Successful
242,242,albi de abreu ( born as albino de abreu do nascimiento on 31 may 1975 ) is a venezuelan theater and television actor.,36784,<mask> <mask> <mask> ( born as <mask> <mask> <mask> <mask> <mask> on <mask> may <mask> ) is a venezuelan theater and television <mask>.,-166.46843,-3.622551,242,36784,242,33,Successful
243,243,"mário `` marito '' correia ( born march 17, 1978 in praia, cape verde ) is a cape verdean professional basketball player.<SPLIT>he played for primeiro de agosto at the angolan basketball league until 2012, before being struck by injury.<SPLIT>correia's early introduction to basketball started in the district sports association kwame nkrumah abbreviated to adesba-kn.<SPLIT>correia is currently the captain of the cape verde national basketball team and helped cape verde to a bronze medal at the fiba africa championship 2007, qualifying",35511,"<mask> `` <mask> '' <mask> ( born march 17, 1978 in <mask>, <mask> <mask> ) is a <mask> <mask> professional <mask> player.<SPLIT>he played for <mask> <mask> <mask> at the angolan <mask> league until 2012, before being struck by injury.<SPLIT><mask> early introduction to basketball started in the district sports association kwame nkrumah abbreviated to adesba-kn.<SPLIT><mask> is currently the captain of the <mask> <mask> national <mask> team and helped <mask> <mask> to a bronze medal at the fiba africa championship 2007, qualifying",-220.16711,-18.701897,243,35511,243,100,Successful
244,244,"bona sforza ( 2 february 1494 -- 19 november 1557 ) was a member of the powerful house of sforza, which ruled the duchy of milan since 1447.<SPLIT>in 1518, she became the second wife of sigismund i the old, the king of poland and grand duke of lithuania.<SPLIT>their marriage lasted 30 years until sigismund's death in 1548.<SPLIT>ambitious and energetic, bona became heavily involved in the political life of poland -- lithuania.<SPLIT>to increase state revenue, she implemented various economic and agricultural",51542,"<mask> <mask> ( 2 february <mask> -- 19 november <mask> ) was a member <mask> the powerful <mask> <mask> <mask>, which ruled the duchy <mask> milan since 1447.<SPLIT>in <mask>, she became the second wife <mask> <mask> <mask> the old, the <mask> <mask> <mask> and <mask> duke <mask> <mask>.<SPLIT>their marriage lasted 30 years until <mask> death in <mask>.<SPLIT>ambitious and energetic, <mask> became heavily involved in the political life <mask> <mask> -- <mask>.<SPLIT>to increase state revenue, she implemented various economic and agricultural",-208.09793,-18.4805,244,51542,244,106,Successful
245,245,"kyriacos kyriacou ( ; born 20 june 1989 ) in larnaca, cyprus is a cypriot professional footballer who plays for nea salamina.",47844,"<mask> <mask> ( ; born 20 june <mask> ) in <mask>, <mask> is a cypriot professional footballer who plays for <mask> <mask>.",-89.55667,-3.249627,245,47844,245,27,Successful
246,55876,"benjamin byung kyu chin ( born 1964 ), known for short as ben chin, is executive director, communications and issues management in the office of b.c premier christy clark, and a former canadian political advisor in ontario, public and private sector executive and television journalist.",51970,"benjamin byung kyu <mask> ( born 1964 ), known for short as ben <mask>, is executive director, communications and issues management in the office of b.c premier christy clark, and a former canadian political advisor in ontario, public and private sector executive and television journalist.",-58.78311,-11.378374,55876,51970,246,47,Successful
247,247,"mariano matamoros y guridi ( august 14, 1770 -- february 3, 1814 ) was a mexican roman catholic priest and revolutionary rebel soldier of the mexican war of independence, who fought for independence against spain in the early 19th century.<SPLIT>matamoros was born in mexico city in 1770, where he studied art and theology during his youth.<SPLIT>he finished his studies in art in 1786, was ordained as a roman catholic priest in 1796 and served in several churches around the city.<SPLIT>during this time, he",71572,"<mask> <mask> y guridi ( august 14, <mask> -- february 3, <mask> ) was a <mask> roman catholic priest and <mask> rebel soldier of the <mask> war of <mask>, who fought for <mask> against spain in the early 19th century.<SPLIT><mask> was born in <mask> city in <mask>, where he studied art and theology during his youth.<SPLIT>he finished his studies in art in 1786, was ordained as a roman catholic priest in 1796 and served in several churches around the city.<SPLIT>during this time, he",-168.68175,-25.015486,247,71572,247,96,Successful
248,248,"scarlet lilith eleida page ( born 24 march 1971 ) is an english photographer.<SPLIT>she is the daughter of led zeppelin guitarist jimmy page and charlotte martin, a french model.",18238,"<mask> <mask> <mask> <mask> ( born 24 march <mask> ) is an english photographer.<SPLIT>she is the daughter of led zeppelin guitarist jimmy <mask> and charlotte martin, a french model.",-93.508736,-6.30606,248,18238,248,35,Successful
249,249,"ted leo and the pharmacists ( sometimes written ted leo/pharmacists, ted leo + pharmacists, or tl/rx ) are an american rock band formed in 1999 in washington, d.c. and currently recording for matador records.<SPLIT>they have released six full-length studio albums and have toured internationally.<SPLIT>though the group's lineup has fluctuated throughout their career, singer/guitarist ted leo has remained the band's main songwriter, creative force, and only constant member.<SPLIT>the group's music combines elements of punk rock, indie rock,",55603,"<mask> <mask> <mask> <mask> <mask> ( sometimes written <mask> <mask>/<mask>, <mask> <mask> + <mask>, or tl/rx ) are an american <mask> band formed in 1999 in washington, d.c. <mask> currently recording for <mask> records.<SPLIT>they have released six full-length studio albums <mask> have toured internationally.<SPLIT>though <mask> group's lineup has fluctuated throughout their career, singer/guitarist <mask> <mask> has remained <mask> band's main songwriter, creative force, <mask> only constant member.<SPLIT><mask> group's music combines elements of <mask> <mask>, indie <mask>,",-246.04065,-10.919844,249,55603,249,105,Successful
250,250,"william paul `` bill '' luther ( born june 27, 1945 ) is an american politician.<SPLIT>luther was a democratic-farmer-labor party ( dfl ) member of the united states house of representatives representing minnesota's 6th congressional district from january 3, 1995, to january 3, 2003, serving in the 104th, 105th, 106th, and 107th congresses, luther was born in fergus falls, minnesota, and was educated at the university of minnesota, receiving a bachelor of science in 1967 and a juris doctor from the law",71572,"william paul `` <mask> '' <mask> ( born june 27, 1945 ) is an american politician.<SPLIT><mask> was a democratic-farmer-labor party ( dfl ) member of the united states house of representatives representing <mask> <mask> congressional district from <mask> 3, <mask>, to <mask> 3, 2003, serving in the 104th, 105th, 106th, and 107th congresses, <mask> was born in <mask> <mask>, <mask>, and was educated at the university of <mask>, receiving a bachelor of science in 1967 and a juris doctor from the law",-133.06581,-27.575188,250,71572,250,91,Successful
251,251,"subodh roy ( ; 1916 -- 2006 ) ( also known as jhunku roy ) was a bengali indian independence activist, revolutionary and politician.",54052,"<mask> <mask> ( ; <mask> -- 2006 ) ( also known as jhunku <mask> ) was a <mask> <mask> <mask> <mask>, revolutionary and politician.",-91.162415,-3.0956278,251,54052,251,27,Successful
252,252,"william grose ( december 16, 1812 -- july 30, 1900 ) was a lawyer, politician, author, and brigadier general in the union army during the american civil war.<SPLIT>he served in many of the important campaigns and battles of the western theater, earning a reputation for being `` always seen where the bullets flew thickest. ''",27855,"<mask> <mask> ( december 16, <mask> -- july 30, <mask> ) was a lawyer, politician, author, and <mask> <mask> in the <mask> <mask> during the american <mask> <mask>.<SPLIT>he served in many of the important campaigns and <mask> of the western theater, earning a reputation for being `` always seen where the bullets flew thickest. ''",-95.62706,-18.0027,252,27855,252,63,Successful
253,71572,"james frank dobie ( september 26, 1888 -- september 18, 1964 ) was an american folklorist, writer, and newspaper columnist best known for many books depicting the richness and traditions of life in rural texas during the days of the open range.<SPLIT>as a public figure, he was known in his lifetime for his outspoken liberal views against texas state politics, and for his long personal war against what he saw as bragging texans, religious prejudice, restraints on individual liberty, and the assault of the mechanized world on the human spirit.<SPLIT>he was instrumental in the saving of the tex",71572,"james <mask> <mask> ( september 26, <mask> -- september 18, <mask> ) was an american folklorist, writer, and newspaper columnist best known for many books depicting the richness and traditions of life in rural <mask> during the days of the open range.<SPLIT>as a public figure, he was known in his lifetime for his outspoken liberal views against <mask> state politics, and for his long personal war against what he saw as bragging texans, religious prejudice, restraints on individual liberty, and the assault of the mechanized world on the human spirit.<SPLIT>he was instrumental in the saving of the tex",-94.65743,-31.545261,71572,71572,253,104,Successful
254,30877,"ivan vinnikov ( ; born may 28, 1964 ) is a retired russian professional footballer.<SPLIT>he made his professional debut in the soviet second league in 1988 for fc torpedo naberezhnye chelny.<SPLIT>he played 5 games and scored 1 goal in the uefa intertoto cup 1996 for fc kamaz-chally naberezhnye chelny.",30877,"<mask> <mask> ( ; born may 28, <mask> ) is a retired russian professional footballer.<SPLIT>he made his professional debut in the soviet second league in 1988 for fc torpedo naberezhnye chelny.<SPLIT>he played 5 games and scored 1 goal in the uefa intertoto cup 1996 for fc kamaz-chally naberezhnye chelny.",-65.62981,-9.646965,30877,30877,254,52,Successful
255,255,"samuel e. shaw ( may, 1864 --??? ) was an american professional baseball player who played parts of two seasons for the baltimore orioles of the american association and the chicago colts of the national league.<SPLIT>he was born in baltimore, maryland the date and place of his death is unknown.",71572,"samuel e. <mask> ( may, <mask> --??? ) was an american professional baseball player who played parts of two seasons for the <mask> <mask> of the american association and the chicago <mask> of the national league.<SPLIT>he was born in <mask>, maryland the date and place of his death is <mask>.",-77.41486,-18.534325,255,71572,255,56,Successful
256,256,"ryland david-burton steen ( a.k.a. `` the rabbit '' or `` xylophone '' ) ( born august 31, 1980 ) is best known as the former drummer of the california-usa-based ska punk band, reel big fish.<SPLIT>reel big fish first met steen at an ernie ball battle of the bands when he was playing with his nebraska-born band square.<SPLIT>reel big fish was judging the competition and gave him and his band a perfect score.<SPLIT>ryland's band won the contest and the $ 35,000 prize",28843,"<mask> <mask> <mask> ( a.k.a. `` the rabbit '' or `` xylophone '' ) ( born august 31, 1980 ) is best known as the former drummer of the california-usa-based ska punk band, <mask> <mask> <mask>.<SPLIT><mask> <mask> <mask> first met <mask> at an ernie ball battle of the bands when he was playing with his nebraska-born band <mask>.<SPLIT><mask> <mask> <mask> was judging the competition and gave him and his band a perfect score.<SPLIT><mask> band won the contest and the $ 35,000 prize",-269.86868,-25.943281,256,28843,256,95,Successful
257,71404,"abhimanyu mithun ( ) ( born 25 october 1989 ) is an indian international cricketer.<SPLIT>in first class cricket, he plays for karnataka.<SPLIT>a right-arm fast-medium bowler, mithun was called up to the india squad for the first test against south africa in 2009 -- 10, only ten weeks after making his first-class debut.<SPLIT>he has also played in the ipl for royal challengers bangalore.<SPLIT>he made his debut in one day internationals in the third and final one day match against south africa in the 2010 season.",71572,"<mask> <mask> ( ) ( born 25 october 1989 ) is an indian international cricketer.<SPLIT>in first class cricket, he plays for <mask>.<SPLIT><mask> <mask> <mask> bowler, <mask> was called up to the <mask> squad for the first test against south africa in 2009 -- 10, only ten weeks after making his first-class debut.<SPLIT>he has also played in the ipl for royal <mask> <mask>.<SPLIT>he made his debut in one day internationals in the third and final one day match against south africa in the 2010 season.",-86.06953,-23.246208,71404,71572,257,94,Successful
258,258,"treveon graham ( born october 28, 1993 ) is an american professional basketball player who currently plays for the utah jazz of the national basketball association ( nba ).<SPLIT>he played college basketball for virginia commonwealth university ( vcu ).",43244,"<mask> <mask> ( born october 28, 1993 ) is an american professional basketball player who currently plays for the <mask> <mask> of the national basketball association ( <mask> ).<SPLIT>he played college basketball for virginia commonwealth university ( <mask> ).",-67.98834,-8.490636,258,43244,258,41,Successful
259,259,"timothy paul stoddard ( born january 24, 1953 ) is a former major league baseball pitcher.<SPLIT>he is one of only two men to have played in both a world series and a final four of the ncaa men's division i basketball championship, along with fellow east chicago washington high school alumnus kenny lofton.<SPLIT>a right-handed pitcher, stoddard pitched for the chicago white sox ( 1975 ), baltimore orioles ( 1978 -- 83 ), chicago cubs ( 1984 ), san diego padres ( 1985 -- 86 ),",18238,"timothy paul <mask> ( born january 24, 1953 ) is a former major league baseball <mask>.<SPLIT>he is one of only two men to have played in both a world series and a final four of the ncaa men's division i basketball championship, along with fellow east <mask> washington high school alumnus kenny lofton.<SPLIT>a <mask> <mask>, <mask> pitched for the <mask> <mask> <mask> ( 1975 ), baltimore orioles ( 1978 -- 83 ), <mask> cubs ( 1984 ), san diego padres ( 1985 -- 86 ),",-95.07898,-17.174213,259,18238,259,86,Successful
260,35511,"puneet issar is an indian actor and director, born on november 6, 1959.<SPLIT>he is most famous for his role as duryodhana in the tv adaptation ( 1988 -- 1990 ) of the `` mahabharata '', and directing '' '' ( 2004 ) starring salman khan.<SPLIT>his other notable roles are in `` border '', 1997 war film, directed by j. p. dutta and second lead in the cult indian horror film `` purana mandir '' in 1983.<SPLIT>he started his career with the movie `` coolie '' in 1983.",35511,"<mask> <mask> is an <mask> actor and director, <mask> on november 6, 1959.<SPLIT>he is most famous for his role as duryodhana in the tv adaptation ( 1988 -- 1990 ) of the `` mahabharata '', and directing '' '' ( 2004 ) starring salman khan.<SPLIT>his other notable roles are in `` border '', 1997 war film, directed by j. p. dutta and second lead in the cult <mask> horror film `` purana mandir '' in 1983.<SPLIT>he started his career with the movie `` coolie '' in 1983.",-96.82536,-19.285355,35511,35511,260,81,Successful
261,261,nadezhda shitikova ( ; 15 september 1923 -- 1995 ) was a soviet fencer.<SPLIT>she competed in the women's individual foil event at the 1952 and 1956 summer olympics.,35244,<mask> <mask> ( ; <mask> september <mask> -- <mask> ) was a soviet fencer.<SPLIT>she competed in the women's individual foil event at the 1952 and 1956 summer olympics.,-91.07485,-4.658112,261,35244,261,31,Successful
262,262,"walter sugg ( 21 may 1860 -- 21 may 1933 ) was an english first-class cricketer, who played for yorkshire in 1881, and for derbyshire from 1884 until 1902.",34967,"<mask> <mask> ( <mask> may <mask> -- <mask> may <mask> ) was an english <mask> cricketer, who played for <mask> in <mask>, and for <mask> from <mask> until <mask>.",-95.88425,-4.4955997,262,34967,262,39,Successful
263,263,"robert crifo ( born november 10, 1965 ) is a former canadian football wide receiver who played eight seasons in the canadian football league with the winnipeg blue bombers, ottawa rough riders, saskatchewan roughriders, toronto argonauts and hamilton tiger-cats.<SPLIT>he was drafted by the winnipeg blue bombers in the third round of the 1988 nfl draft.<SPLIT>he played cis football at the university of toronto.<SPLIT>crifo was also a member of the montreal alouettes.",71572,"robert <mask> ( born november 10, 1965 ) is a former canadian football wide receiver who played eight seasons in the canadian football league with the <mask> <mask> <mask>, ottawa <mask> <mask>, <mask> <mask>, <mask> <mask> and hamilton <mask>.<SPLIT>he was drafted by the <mask> <mask> <mask> in the third round of the 1988 nfl draft.<SPLIT>he played <mask> football at the university of <mask>.<SPLIT><mask> was also a member of the montreal <mask>.",-157.89381,-27.525978,263,71572,263,91,Successful
264,18238,"kathleen gerson is an american sociologist.<SPLIT>she is considered as an authority on such subjects as gender equality particularly within relationships and marriages, changing gender roles, family housework patterns, travel patterns, finances and how they affect household formation, and other aspects of changing family life.<SPLIT>her research is often based on qualitative interviews.<SPLIT>she is a tenured professor at new york university.<SPLIT>gerson's research has studied changing patterns among men and women in the past few decades.<SPLIT>she found that young american men ideally want `` equal relationships '' but that in practice it is often hard to achieve",18238,"<mask> <mask> is an american sociologist.<SPLIT>she is considered as an authority on such subjects as gender equality particularly within relationships and marriages, changing gender roles, family housework patterns, travel patterns, finances and how they affect household formation, and other aspects of changing family life.<SPLIT>her research is often based on qualitative interviews.<SPLIT>she is a tenured professor at new york university.<SPLIT><mask> research has studied changing patterns among men and women in the past few decades.<SPLIT>she found that young american men ideally want `` equal relationships '' but that in practice it is often hard to achieve",-81.041725,-0.0,18238,18238,264,101,Successful
265,265,"anthony lucadello ( july 30, 1912 - may 8, 1989 ) was a professional baseball scout for the chicago cubs ( 1943 -- 1957 ) and philadelphia phillies ( 1957 -- 1989 ).<SPLIT>during his career, he signed a total of 52 players who made it to the major leagues, most notably hall of famers ferguson jenkins and mike schmidt.<SPLIT>his total number of major league signings is considered to be unsurpassed, and some have called him perhaps the greatest scout ever.",35511,"anthony <mask> ( july 30, <mask> - may 8, <mask> ) was a professional <mask> <mask> for the chicago cubs ( 1943 -- 1957 ) and philadelphia phillies ( 1957 -- <mask> ).<SPLIT>during his career, he signed a total of 52 players who made it to the major leagues, most notably hall of famers ferguson jenkins and mike schmidt.<SPLIT>his total number of major league signings is considered to be unsurpassed, and some have called him perhaps the greatest <mask> ever.",-97.90782,-15.405752,265,35511,265,81,Successful
266,266,"mike cerrone ( born june 9, 1957 ) is an american actor and screenwriter from rhode island.<SPLIT>he has frequently worked with the farrelly brothers.",62952,"<mask> <mask> ( born june <mask>, <mask> ) is an american <mask> and <mask> from <mask> <mask>.<SPLIT>he has frequently worked with the farrelly brothers.",-94.860306,-4.6568985,266,62952,266,32,Successful
267,267,veeru devgan is a stunt and action choreographer in bollywood.<SPLIT>he was born to a family from amritsar.<SPLIT>he is also the father of actor ajay devgan and director anil devgan.<SPLIT>he has choreographed fight and action scenes for over 80 hindi films.<SPLIT>he has also directed a film -- `` hindustan ki kasam '' ( 1999 ).,59913,<mask> <mask> is a <mask> and <mask> <mask> in bollywood.<SPLIT>he was born to a family from <mask>.<SPLIT>he is also the father of actor <mask> <mask> and director <mask> <mask>.<SPLIT>he has choreographed fight and <mask> scenes for over 80 hindi films.<SPLIT>he has also directed a <mask> -- `` hindustan ki kasam '' ( 1999 ).,-227.62057,-9.0195055,267,59913,267,66,Successful
268,268,"pascal langdale is an english actor, who has played supporting roles in a number of television dramas since 1999.<SPLIT>pascal langdale also lent his voice and likeness to the critically acclaimed video game `` heavy rain '', in which he played ethan mars.<SPLIT>he studied at the royal academy of dramatic art for 3 years.<SPLIT>langdale's real name is pascal langlois.",35511,"<mask> <mask> is an english <mask>, who has played supporting roles in a number of television dramas since 1999.<SPLIT><mask> <mask> also lent his voice and likeness to the critically acclaimed video game `` heavy rain '', in which he played ethan mars.<SPLIT>he studied at the royal academy of dramatic art for 3 years.<SPLIT><mask> real name is <mask> <mask>.",-191.31754,-7.2537394,268,35511,268,68,Successful
269,269,"nigel tausie ashton simpson ( born in suva, fiji on 25 april 1975 ) is a rugby union player.",51070,"<mask> <mask> <mask> <mask> ( born in suva, fiji on 25 april <mask> ) is a rugby union player.",-57.0193,-4.932969,269,51070,269,23,Successful
270,270,"joseph-tancrède labbé ( june 18, 1887 -- december 13, 1956 ) was a prominent quebec politician and businessman.<SPLIT>he was the father of media mogul françois labbé.",71572,"<mask> <mask> ( june <mask>, <mask> -- <mask> <mask>, <mask> ) was a prominent <mask> politician and businessman.<SPLIT>he was the father <mask> media mogul françois <mask>.",-91.54073,-3.814436,270,71572,270,35,Successful
