,original_person,original_text,perturbed_person,perturbed_text,original_score,perturbed_score,original_output,perturbed_output,ground_truth_output,num_queries,result_type
482,482,"carroll lane fenton ( 12 february 1900, butler county, iowa - 16 november 1969 new brunswick, new jersey ) was a geologist, paleontologist, neoichnologist, and historian of science.<SPLIT>fenton was the author and illustrator of numerous books, many written with his wife, mildred adams fenton, on geology and paleontology for a general audience.<SPLIT>he published extensively in the field of paleontology in both the professional literature and in popular journals.<SPLIT>he was an associate editor of the `` american midland naturalist '' from",71572,"<mask> <mask> <mask> ( 12 february <mask>, butler county, <mask> - 16 november <mask> new brunswick, new jersey ) was a geologist, paleontologist, neoichnologist, and historian of science.<SPLIT><mask> was the author and illustrator of numerous books, many written with his wife, mildred adams <mask>, on <mask> and <mask> for a general audience.<SPLIT>he published extensively in the field of <mask> in both the professional literature and in popular journals.<SPLIT>he was an associate editor of the `` american midland naturalist '' from",-187.89189,-23.486145,482,71572,482,90,Successful
483,483,"jonathan dixon ( born october 25, 1965 ) is an american male television actor, best known for playing in a long series of j.j. abrams productions such as `` lost, alias, felicity, mission impossible iii '' and `` star trek '' in small roles since 2003.",53833,"<mask> <mask> ( born october <mask>, <mask> ) is an american male television <mask>, best known for playing in a long series of j.j. abrams productions such as `` lost, alias, felicity, mission impossible iii '' and `` star trek '' in small roles since 2003.",-66.41105,-7.9854336,483,53833,483,47,Successful
484,484,annia rivera ( born 13 august 1991 ) is a cuban diver.<SPLIT>she competed in the 10 metre platform event at the 2012 summer olympics.,29095,<mask> <mask> ( born <mask> august <mask> ) is a cuban diver.<SPLIT>she competed in the 10 metre <mask> <mask> at the 2012 summer olympics.,-80.98369,-7.065772,484,29095,484,30,Successful
485,485,"roger duane `` zeke '' smith ( born september 29, 1936 in walker springs, alabama ) is a former american football player in the national football league for the baltimore colts and the new york giants.<SPLIT>he played college football at auburn university where he was awarded the outland trophy in 1958.<SPLIT>his banner, along with four other auburn greats - bo jackson, pat sullivan, tracy rocker and carlos rogers, is hanging outside jordan-hare stadium in his honor.<SPLIT>he was drafted in the fourth round",35511,"roger duane `` <mask> '' <mask> ( born september 29, 1936 in <mask> <mask>, <mask> ) is a former american football player in the national football league for the baltimore colts and the new york giants.<SPLIT>he played college football at <mask> university where he was awarded the outland trophy in 1958.<SPLIT>his banner, along with four other <mask> greats - bo jackson, pat sullivan, tracy rocker and carlos rogers, is hanging outside jordan-hare stadium in his honor.<SPLIT>he was drafted in the fourth round",-104.13533,-21.848682,485,35511,485,88,Successful
486,486,"john allen ford ( born july 31, 1966 ) is a former american football wide receiver in the national football league for the detroit lions.<SPLIT>ford attended the university of virginia.",43448,"<mask> allen <mask> ( born july 31, 1966 ) is a former american football <mask> <mask> in the national football league for the <mask> <mask>.<SPLIT><mask> attended the university of <mask>.",-81.281815,-8.792935,486,43448,486,38,Successful
487,487,zinaida lunina ( ) ( born 18 april 1989 ) is a belarusian gymnast.<SPLIT>she competed at the 2008 summer olympics in beijing where she received a bronze medal in the rhythmic group competition.,18238,<mask> <mask> ( ) ( born <mask> april <mask> ) is a belarusian gymnast.<SPLIT>she competed at the 2008 summer olympics in beijing where she received a bronze medal in the rhythmic group competition.,-86.86778,-5.0594115,487,18238,487,35,Successful
488,488,"trent joseph cameron ( born in los angeles county, california, may 16, 1979 ) is an american actor best known for his roles as john lee malvo in '' '', as jerel goodrich in the upn sitcom `` the parkers '' and as young roland in `` the wood ''.",36784,"<mask> <mask> <mask> ( born in <mask> <mask> <mask>, california, may 16, <mask> ) is an american <mask> best known for his roles as john lee malvo in '' '', as jerel goodrich in the upn sitcom `` the parkers '' and as young roland in `` the wood ''.",-87.19754,-12.560252,488,36784,488,51,Successful
489,489,inácio josé de alvarenga peixoto ( 1744 -- 1793 ) was a colonial brazilian neoclassic poet and lawyer.<SPLIT>he wrote under the pen name eureste fenício.<SPLIT>it is attributed to him the design of the flag of minas gerais.,36784,<mask> <mask> <mask> <mask> <mask> ( <mask> -- <mask> ) was a colonial brazilian neoclassic poet and lawyer.<SPLIT>he wrote under the pen name <mask> <mask>.<SPLIT>it is attributed to him the design of the flag of minas gerais.,-119.14863,-12.030705,489,36784,489,46,Successful
490,490,"mircea tiberian ( born may 4, 1955 in cluj, romania ) is a jazz musician and professor of music at the national university of music in bucharest.<SPLIT>he coordinates the jazz department, which he set up in 1991.",50205,"<mask> <mask> ( born may 4, 1955 in <mask>, <mask> ) is a <mask> musician and <mask> of music at the national university of music in bucharest.<SPLIT>he coordinates the <mask> department, which he set up in 1991.",-105.158005,-14.687831,490,50205,490,44,Successful
491,8372,"ian bryson ( born 26 november 1962 in kilmarnock ) is a scottish footballer.<SPLIT>he began his career at hurlford united before moving to kilmarnock, where he spent seven years making almost 200 appearances, mostly as a midfielder.<SPLIT>after moving to england, he spent the next 5 years of his career at sheffield united with whom he was promoted to the old first division.<SPLIT>after a brief spell at barnsley, he joined preston north end in 1993 on his 31st birthday, where he briefly played alongside a young david beckham.<SPLIT>bry",8372,"<mask> <mask> ( born 26 november 1962 in <mask> ) is a scottish footballer.<SPLIT>he began his career at <mask> <mask> before moving to <mask>, where he spent seven years making almost 200 appearances, mostly as a midfielder.<SPLIT>after moving to england, he spent the next 5 years of his career at <mask> <mask> with whom he was promoted to the old first division.<SPLIT>after a brief spell at <mask>, he joined <mask> north end in <mask> on his 31st birthday, where he briefly played alongside a young david beckham.<SPLIT>bry",-112.64874,-15.033163,8372,8372,491,101,Successful
492,492,"erminio sipari ( 1 ° december 1879 -- 28 january 1968 ) was an italian politician and naturalist, author of studies on the preservation of nature and founder of parco nazionale d'abruzzo, which he chaired from 1922 to 1933.",71572,"<mask> <mask> ( 1 ° december <mask> -- 28 january <mask> ) was an italian politician <mask> <mask>, author of studies on the preservation of nature <mask> founder of parco nazionale d'abruzzo, which he chaired from 1922 to 1933.",-83.019516,-10.487955,492,71572,492,43,Successful
493,493,"earl edmond `` dutch '' mueller ( died 1932 ) was an american college basketball player.<SPLIT>he was the 1925 national player of the year as a center at colorado college.<SPLIT>mueller, from saint joseph, missouri, was an early college basketball standout at colorado college in colorado springs, colorado.<SPLIT>he played two seasons for the tigers, leading the team to two colorado -- wyoming conference titles.<SPLIT>mueller played the center position and was known for his ball-handling and pivot play.<SPLIT>he was retroactively named an all-american and",71572,"<mask> edmond `` <mask> '' <mask> ( died <mask> ) was an american college <mask> player.<SPLIT>he was the <mask> national player of the year as a <mask> at <mask> <mask>.<SPLIT><mask>, from saint joseph, missouri, was an early <mask> <mask> standout at <mask> <mask> in <mask> springs, <mask>.<SPLIT>he played two seasons for the tigers, leading the team to two <mask> -- wyoming conference titles.<SPLIT><mask> played the <mask> position and was known for his ball-handling and pivot play.<SPLIT>he was retroactively named an all-american and",-200.38657,-16.482048,493,71572,493,102,Successful
494,494,"charles mcarther emmanuel, also known as chuckie taylor ( born 1977 ), is the son of charles taylor, the former president of liberia.<SPLIT>raised by his mother in florida until he was 17, taylor jr. traveled to liberia in 1994 to live with his father, who in turn enrolled him in the accra academy, an elite boarding school in ghana.<SPLIT>he later attended the college of west africa in monrovia.<SPLIT>during his father's presidency, emmanuel became the commander of the infamously violent anti-terrorist unit ( at",35511,"<mask> <mask> <mask>, also known as <mask> <mask> ( born 1977 ), is the son of <mask> <mask>, the former president of liberia.<SPLIT>raised by his mother in florida until he was 17, <mask> jr. traveled to liberia in 1994 to live with his father, who in turn enrolled him in the accra academy, an elite boarding school in ghana.<SPLIT>he later attended the college of west africa in monrovia.<SPLIT>during his father's presidency, <mask> became the commander of the infamously violent anti-terrorist unit ( at",-156.14471,-26.37158,494,35511,494,93,Successful
495,495,"edward hugh james ( 14 april 1896 -- 15 march 1975 ) was a welsh cricketer.<SPLIT>james was a left-handed batsman who bowled slow left-arm orthodox.<SPLIT>he was born at briton ferry, glamorgan.<SPLIT>james made his debut for glamorgan in the 1920 minor counties championship against cheshire.<SPLIT>he represented the county in 1 further minor counties fixtures in 1920, which came against devon.<SPLIT>glamorgan were elevated to first-class status in 1921 and in 1922, james made his first-class debut for the county against l",71572,"<mask> <mask> <mask> ( <mask> april <mask> -- 15 march 1975 ) was a welsh <mask>.<SPLIT><mask> was a <mask> batsman who bowled <mask> <mask> <mask>.<SPLIT>he was born at <mask> <mask>, <mask>.<SPLIT><mask> made his debut for <mask> in the 1920 minor counties championship against cheshire.<SPLIT>he represented the county in 1 further minor counties fixtures in 1920, which came against devon.<SPLIT><mask> were elevated to first-class status in 1921 and in 1922, <mask> made his first-class debut for the county against l",-148.7428,-19.087145,495,71572,495,100,Successful
496,496,tore sandell was a swedish footballer.,4124,<mask> <mask> was a swedish footballer.,-71.79906,-0.0,496,4124,496,9,Successful
497,497,"charlotte harrison ( born 31 july 1989 ) is a new zealand field hockey player.<SPLIT>she has competed for the new zealand women's national field hockey team ( the `` black sticks women '' ), including for the team at the 2012 summer olympics and at the 2006 and 2010 commonwealth games, and as a reserve for the team at the 2008 summer olympics.<SPLIT>harrison was first selected for the black sticks women in october 2005 on the back of her performance for northland in the national hockey league that year.<SPLIT>at the time, she was 16 years old, making",50306,"<mask> <mask> ( born 31 july 1989 ) is a new <mask> field <mask> player.<SPLIT>she has competed for the new <mask> <mask> <mask> field <mask> team ( the `` black sticks <mask> '' ), including for the team at the 2012 summer olympics and at the 2006 and 2010 commonwealth games, and as a reserve for the team at the 2008 summer olympics.<SPLIT><mask> was first selected for the black sticks <mask> in october 2005 on the back of her performance for northland in the national <mask> league that year.<SPLIT>at the time, she was 16 years old, making",-139.26685,-38.81065,497,50306,497,107,Successful
498,498,"laura elizabeth bissell ( born 19 june 1983 ) is an english road and track racing cyclist.<SPLIT>bissell was born in hitchin, england.<SPLIT>she has represented her country at international events on several occasions.<SPLIT>she was a member of the british cycling development plan squad alongside nicole cooke, competing at the 2000 and 2001 junior road world championship and the 2001 junior track world championships in trexlertown, united states.<SPLIT>bissell lives in stevenage, hertfordshire.<SPLIT>her brother, peter bissell, was also a successful cyclist.",18238,"<mask> elizabeth <mask> ( born 19 june 1983 ) is an english <mask> and <mask> racing cyclist.<SPLIT><mask> was born in hitchin, england.<SPLIT>she has represented her country at international events on several occasions.<SPLIT>she was a member of the british cycling development plan squad alongside nicole cooke, competing at the 2000 and 2001 junior <mask> world championship and the 2001 junior <mask> world championships in trexlertown, united states.<SPLIT><mask> lives in stevenage, hertfordshire.<SPLIT>her brother, peter <mask>, was also a successful cyclist.",-118.443726,-19.312632,498,18238,498,91,Successful
499,499,"frank ramsey adams ( july 7, 1883 -- october 8, 1963 ) was an american author, screenwriter, composer, and newspaper reporter.<SPLIT>he was born on july 7, 1883 in morrison, illinois.<SPLIT>educated at the university of chicago, adams worked as a reporter for several chicago newspapers, including the `` chicago tribune '', `` city press '', `` chicago daily news '', and the `` chicago herald-examiner ''.<SPLIT>from 1916 to 1932, he was manager of the nufer-adams playhouse ( which",6163,"<mask> <mask> <mask> ( july 7, <mask> -- october 8, 1963 ) was an american author, screenwriter, composer, and newspaper reporter.<SPLIT>he was born on july 7, <mask> in <mask>, illinois.<SPLIT>educated at the university of chicago, <mask> worked as a reporter for several chicago newspapers, including the `` chicago tribune '', `` city press '', `` chicago daily news '', and the `` chicago herald-examiner ''.<SPLIT>from 1916 to 1932, he was manager of the <mask> playhouse ( which",-123.20531,-21.17752,499,6163,499,77,Successful
500,500,"orlando peçanha de carvalho ( 20 september 1935 -- 10 february 2010 ), known simply as orlando, was a brazilian footballer who played defender.<SPLIT>during his club career he played for vasco da gama ( 1955 -- 1960 ), boca juniors ( 1960 -- 1964 ) and santos ( 1965 -- 1967 ).<SPLIT>he was part of the brazilian team that won the 1958 fifa world cup, and also participated in the 1966 fifa world cup.<SPLIT>in total he earned 30 caps.<SPLIT>orlando died on 10 february 2010",62952,"<mask> <mask> <mask> <mask> ( <mask> september <mask> -- <mask> february 2010 ), known simply <mask> <mask>, was a brazilian footballer who played <mask>.<SPLIT>during his club career he played for <mask> <mask> <mask> ( 1955 -- 1960 ), <mask> <mask> ( 1960 -- 1964 ) and <mask> ( <mask> -- 1967 ).<SPLIT>he was part of the brazilian team that won the <mask> fifa world cup, and also participated in the <mask> fifa world cup.<SPLIT>in total he earned <mask> caps.<SPLIT><mask> died on <mask> february 2010",-166.95161,-15.42537,500,62952,500,99,Successful
501,501,"ian leonard osborne ( born 28 october 1952 ) is an english former professional footballer who played in the football league for birmingham city and port vale.<SPLIT>osborne was born in leicester.<SPLIT>when he left school in 1968, he joined birmingham city as an apprentice, and turned professional two years later.<SPLIT>a pacy full back, he spent a long time in the reserve team before eventually making his debut in the first division on 16 august 1975, the opening game of the 1975 -- 76 season, in a 3 -- 3 draw at leicester city.<SPLIT>osborne played a few more",34774,"<mask> <mask> <mask> ( born 28 october 1952 ) is an english former professional footballer who played in the football league for <mask> <mask> and <mask> <mask>.<SPLIT><mask> was born in <mask>.<SPLIT>when he left school in <mask>, he joined <mask> city as an apprentice, and turned professional two years later.<SPLIT>a pacy <mask> back, he spent a long time in the reserve team before eventually making his debut in the first division on 16 august 1975, the opening game of the 1975 -- 76 season, in a 3 -- 3 draw at <mask> <mask>.<SPLIT><mask> played a few more",-170.28322,-22.336288,501,34774,501,112,Successful
502,502,"skarf ( ; often stylized as skarf ) is a singaporean-south korean girl group formed by alpha entertainment.<SPLIT>the meaning behind the group's name is based on the word `` scarf ''.<SPLIT>the s stands for singapore while the c was switched out with the k for korea.<SPLIT>the group is made up of five members, namely, ferlyn, tasha, jenny, jooa and hana.<SPLIT>on august 14, 2012, they made their official debut and released their first self-titled album `` skarf ''.<SPLIT>to get their name known",28843,"<mask> ( ; often stylized as <mask> ) is a singaporean-south korean girl group formed by <mask> <mask>.<SPLIT>the meaning behind the group's name is based on the word `` scarf ''.<SPLIT>the s stands for singapore while the c was switched out with the k for korea.<SPLIT>the group is made up of five members, namely, ferlyn, tasha, jenny, jooa and hana.<SPLIT>on august 14, 2012, they made their official debut and released their first self-titled album `` <mask> ''.<SPLIT>to get their name known",-141.02992,-22.4216,502,28843,502,85,Successful
503,503,alex rosamilia ( born 1982 ) is an american musician.<SPLIT>rosamilia is one of the founding members of the band the gaslight anthem.<SPLIT>he plays lead guitar and provides backing vocals for the band.,28843,<mask> <mask> ( born 1982 ) is an american musician.<SPLIT><mask> is one of the founding members of the band the <mask> <mask>.<SPLIT>he plays lead <mask> and provides <mask> vocals for the band.,-89.47666,-13.078985,503,28843,503,40,Successful
504,18238,"chinmayi sripada is an indian playback singer, working mainly for the south indian film industry.<SPLIT>she is also a voice actor, television presenter and radio jockey.<SPLIT>she is the founder and ceo of a translation services company called blue elephant.<SPLIT>she is often credited as chinmayee/indai haza but her birth name is chinmayi.<SPLIT>she rose to fame for her critically acclaimed song `` oru deivam thantha poovae ( kannathil muthamittal ) '' from the national award winning movie kannathil muthamittal.",18238,"<mask> <mask> is an <mask> <mask> singer, working mainly for the south <mask> film industry.<SPLIT>she is also a <mask> actor, television presenter and radio jockey.<SPLIT>she is the founder and <mask> of a translation services company called blue <mask>.<SPLIT>she is often credited as <mask>/<mask> <mask> but her birth name is <mask>.<SPLIT>she rose to fame for her critically acclaimed song `` oru deivam thantha poovae ( kannathil muthamittal ) '' from the national award winning movie kannathil muthamittal.",-134.03378,-13.821369,18238,18238,504,90,Successful
505,45981,"antonio bonilla sanmartín ( 6 december 1882 -- 9 november 1937 ) was a spanish sport shooter who competed in the 1920 summer olympics.<SPLIT>he was killed in action during the spanish civil war.<SPLIT>in the 1920 summer olympics he participated in the following events : team 30 metre military pistol - sixth place team 300 metre military rifle, prone - seventh place team 50 metre small-bore rifle - ninth place team free rifle - eleventh place team 50 metre free pistol - twelfth place team 300 and 600 metre military rifle, prone - twelfth place team 600 metre military",45981,"<mask> <mask> sanmartín ( 6 december <mask> -- 9 november <mask> ) was a spanish sport shooter who competed in the 1920 summer olympics.<SPLIT>he was killed in action during the spanish civil war.<SPLIT>in the 1920 summer olympics he participated in the following events : team 30 metre military pistol - sixth place team 300 metre military rifle, prone - seventh place team 50 metre small-bore rifle - ninth place team free rifle - eleventh place team 50 metre free pistol - twelfth place team 300 and 600 metre military rifle, prone - twelfth place team 600 metre military",-75.38164,-20.97306,45981,45981,505,95,Successful
506,506,"bertrand of comminges was bishop of comminges, in the diocese of toulouse, france.<SPLIT>it is after him that the commune of saint-bertrand-de-comminges, is named.",36784,"<mask> of <mask> was <mask> of <mask>, in the diocese of toulouse, <mask>.<SPLIT>it is after him that the <mask> of <mask>, is named.",-175.0244,-11.34716,506,36784,506,32,Successful
507,507,"david storobin ( born 1979 ) is a new york attorney and a former new york state senator who represented district 27 in the new york state senate, which includes the neighborhoods of borough park, midwood, bensonhurst, brighton beach, kensington, bergen beach, mill basin, gravesend, sheepshead bay, and manhattan beach, among others.",6098,"<mask> <mask> ( born <mask> ) is a <mask> <mask> attorney and a former <mask> <mask> state senator who represented <mask> 27 in the <mask> <mask> state senate, which includes the neighborhoods of borough park, midwood, bensonhurst, brighton beach, kensington, bergen beach, mill basin, gravesend, sheepshead bay, and manhattan beach, among others.",-82.44638,-8.195076,507,6098,507,61,Successful
508,508,"manoel lourenço da silva filho, known as simply manoel ( born 2 february 1978 ), is a brazilian retired footballer who played as a centre forward.",36784,"<mask> <mask> <mask> <mask> <mask>, known as simply <mask> ( born 2 february <mask> ), is a brazilian retired footballer who played as a <mask> forward.",-67.77503,-5.636536,508,36784,508,33,Successful
509,509,"ines kresović ( serbian cyrillic : Инес Кресовић, born february 20, 1984 in Šibenik, sfr yugoslavia ) is a serbian female basketball player.",43244,"<mask> <mask> ( <mask> cyrillic : Инес Кресовић, born february <mask>, <mask> in <mask>, <mask> <mask> ) is a <mask> female basketball player.",-70.243996,-2.0971985,509,43244,509,30,Successful
510,510,"stephen william ` steve'pitt ( b. 1 august 1948 in willesden ) is a former english professional footballer who played for tottenham hotspur, colchester united, corinthian casuals and stevenage borough.",47844,"<mask> <mask> ` <mask> ( b. <mask> august <mask> in <mask> ) is a former english professional footballer who played for <mask> <mask>, <mask> united, <mask> <mask> and <mask> <mask>.",-137.72441,-5.517625,510,47844,510,41,Successful
511,511,"shawn cable ( born february 2, 1980 in prince george, british columbia ) is a former professional indoor lacrosse player who played for the calgary roughnecks, colorado mammoth, anaheim storm and portland lumberjax in the national lacrosse league.<SPLIT>he is currently a video analyst for the roughnecks.<SPLIT>cable was the first graduate of the prince george minor lacrosse association to go on to play in the nll.<SPLIT>he won the ed bayley memorial trophy in 2002 as the western lacrosse association outstanding rookie as a member of the north shore",7149,"<mask> <mask> ( born february 2, 1980 in prince george, british columbia ) is a former professional indoor lacrosse player who played for the <mask> <mask>, <mask> <mask>, <mask> <mask> and <mask> <mask> in the national lacrosse league.<SPLIT>he is currently a video analyst for the <mask>.<SPLIT><mask> was the first graduate of the prince george minor lacrosse association to go on to play in the nll.<SPLIT>he won the ed bayley memorial trophy in 2002 as the western lacrosse association outstanding rookie as a member of the north shore",-156.30537,-29.293993,511,7149,511,101,Successful
512,512,"ri chol-guk ( also `` lee cheol-guk '', ; born december 25, 1985 in pyongyang ) is a north korean table tennis player.<SPLIT>as of may 2012, ri is ranked no. 86 in the world by the international table tennis federation ( ittf ).<SPLIT>ri is a member of the table tennis team for kigwancha sports club, and is coached and trained by kim jin myong.<SPLIT>he is also right-handed, and uses the penhold grip.<SPLIT>ri qualified for the men's singles tournament, along with his",36784,"<mask> <mask> ( also `` lee <mask> '', ; born december 25, 1985 in <mask> ) is a north korean <mask> <mask> player.<SPLIT>as of may 2012, <mask> is ranked no. <mask> in the world by the international <mask> <mask> federation ( ittf ).<SPLIT><mask> is a member of the <mask> <mask> team for <mask> sports <mask>, and is coached and trained by kim jin myong.<SPLIT>he is also <mask>, and uses the <mask> grip.<SPLIT><mask> qualified for the men's singles tournament, along with his",-221.8816,-23.689873,512,36784,512,97,Successful
513,60503,"george puckrin harrison, also known as `` shoey '' because he was a shoemaker by trade ( 11 february 1862 -- 14 september 1940 ) was an english cricketer who played fifty-nine first-class matches for yorkshire county cricket club between 1883 and 1892.<SPLIT>he also appeared in first-class cricket for the players ( 1883 ), t emmett's xi ( 1883 ), lord sheffield's xi ( 1884 ), an england xi ( 1884 ) and l hall's yorkshire xi ( 1891",41153,"<mask> puckrin <mask>, also known as `` shoey '' because he was a shoemaker by trade ( 11 february 1862 -- 14 september 1940 ) was an english <mask> who played fifty-nine <mask> matches for <mask> county cricket club between <mask> and <mask>.<SPLIT>he also appeared in <mask> cricket for the <mask> ( <mask> ), t <mask> xi ( <mask> ), lord <mask> xi ( 1884 ), an england xi ( 1884 ) and l hall's <mask> xi ( 1891",-89.17511,-10.950911,60503,41153,513,81,Successful
