,original_person,original_text,perturbed_person,perturbed_text,original_score,perturbed_score,original_output,perturbed_output,ground_truth_output,num_queries,result_type
0,Lenny randle,"leonard shenoff randle ( born february 12 , 1949 ) is a former major league baseball player .<SPLIT>he was the first-round pick of the washington senators in the secondary phase of the june 1970 major league baseball draft , tenth overall .<SPLIT>",Lenny randle,"leonard [MASK] [MASK] ( born february 12 , 1949 ) is a former major league baseball player .<SPLIT>he was the first-round pick of the washington senators in the secondary [MASK] of the june 1970 major league baseball draft , tenth overall .<SPLIT>",-1.0,0.6388035416603088,0,0,0,112,Successful
1,Lenny randle,"philippe adnot ( born 25 august 1945 in rhèges ) is a member of the senate of france .<SPLIT>he was first elected in 1989 , and represents the aube department .<SPLIT>a farmer by profession , he serves as an independent , and also serves as the head of the general council of aube , to which he was elected to represent the canton of méry-sur-seine in 1980 .<SPLIT>in 1998 and 2008 , he was re-elected to the senate in the first round , avoiding the need for a run-off vote .<SPLIT>having contributed to the creation of the university of technology of troyes , in",Lenny randle,"philippe [MASK] ( born 25 august 1945 in [MASK] ) is a member of the senate of france .<SPLIT>he was first elected in 1989 , and represents the [MASK] department .<SPLIT>a farmer by profession , he serves as an independent , and also serves as the head of the general council of [MASK] , to which he was elected to represent the [MASK] of [MASK]-sur-[MASK] in 1980 .<SPLIT>in 1998 and 2008 , he was re-elected to the senate in the first round , [MASK] the [MASK] for a run-off vote .<SPLIT>having contributed to the creation of the university of technology of [MASK] , in",-1.0,0.5790287256240845,0,0,1,851,Successful
2,Lenny randle,miroslav popov ( born 14 june 1995 in dvůr králové nad labem ) is a czech grand prix motorcycle racer .<SPLIT>he currently races in the fim cev moto2 championship for montaze broz racing team aboard a suter .<SPLIT>,Lenny randle,[MASK] [MASK] ( born 14 june 1995 in [MASK] [MASK] [MASK] [MASK] ) is a czech grand prix motorcycle racer .<SPLIT>he currently races in the [MASK] [MASK] [MASK] championship for [MASK] [MASK] racing team [MASK] a [MASK] .<SPLIT>,-1.0,0.5837209820747375,0,0,2,378,Successful
3,Lenny randle,"john `` jack '' reynolds ( 21 february 1869 -- 12 march 1917 ) was a footballer who played for , among others , west bromwich albion , aston villa and celtic .<SPLIT>as an international he played five times for ireland before it emerged that he was actually english and he subsequently played eight times for england .<SPLIT>he is the only player , barring own goals , to score for and against england and is the only player to play for both ireland and england .<SPLIT>he won the",Lenny randle,"john `` jack '' reynolds ( 21 february 1869 -- 12 march 1917 ) was a footballer who played for , among others , west bromwich albion , aston villa and celtic .<SPLIT>as an international he played five times for ireland before it [MASK] that he was [MASK] english and he subsequently played eight times for england .<SPLIT>he is the only player , [MASK] own goals , to score for and against england and is the only player to play for both ireland and england .<SPLIT>he won the",-1.0,0.5824885964393616,0,0,3,232,Successful
4,Lenny randle,"william ato ankrah , ( born 7th july 1979 ) better known by his stage name akoo nana is a hiplife musician from ghana .<SPLIT>since 2009 , he has been making a large impact in africa 's hiplife scene through his authentic sounding music and captivating",Lenny randle,"william [MASK] [MASK] , ( born 7th july 1979 ) better known by his stage name [MASK] [MASK] is a [MASK] musician from ghana .<SPLIT>since 2009 , he has been making a large impact in africa 's [MASK] scene through his [MASK] [MASK] music and [MASK]",-1.0,0.688339114189148,0,0,4,304,Successful
5,Lenny randle,"teoctist ( , born toader arăpașu ; february 7 , 1915 -- july 30 , 2007 ) was the patriarch of the romanian orthodox church from 1986 to 2007 .<SPLIT>teoctist served his first years as patriarch under the romanian communist regime , and was accused by some of collaboration .<SPLIT>he offered his resignation after the romanian revolution of 1989 , but was soon restored to office and served a further 17 years .<SPLIT>a promoter of ecumenical dialogue , patriarch teoctist invited pope john paul ii to visit romania in 1999",Lenny randle,"[MASK] ( , born [MASK] [MASK] ; february 7 , 1915 -- july 30 , 2007 ) was the [MASK] of the romanian orthodox church from 1986 to 2007 .<SPLIT>[MASK] served his first years as [MASK] under the romanian communist regime , and was accused by some of collaboration .<SPLIT>he offered his resignation after the romanian revolution of 1989 , but was soon [MASK] to office and served a further 17 years .<SPLIT>a [MASK] of [MASK] [MASK] , [MASK] [MASK] invited pope john paul ii to [MASK] romania in 1999",-1.0,0.5782505869865417,0,0,5,671,Successful
6,Lenny randle,dillon sheppard ( born 27 february 1979 ) is a south african football ( soccer ) left-winger who plays for premier soccer league club bidvest wits and south africa .<SPLIT>,Lenny randle,[MASK] [MASK] ( born 27 february 1979 ) is a south african football ( soccer ) left-winger who plays for premier soccer league club [MASK] [MASK] and south africa .<SPLIT>,-1.0,0.6438052654266357,0,0,6,99,Successful
7,Lenny randle,"giuliana zevallos roncagliolo ( born in lima , peru ) is a beauty queen who was crowned miss continente americano 2010 on september 18 , 2010 , becoming that pageant 's very first titleholder from her country .<SPLIT>prior to winning miss continente americano , she was miss earth perú 2008 and miss perú 2010 , and represented her country in both miss earth 2008 and miss universe 2010 .<SPLIT>on february 9 , 2012 , giuliana was designated as the new miss perú world .<SPLIT>she represented",Lenny randle,"[MASK] [MASK] [MASK] ( born in lima , peru ) is a beauty queen who was crowned miss [MASK] [MASK] 2010 on september 18 , 2010 , becoming that pageant 's very first [MASK] from her country .<SPLIT>prior to winning miss [MASK] [MASK] , she was miss earth [MASK] 2008 and miss [MASK] 2010 , and represented her country in both miss earth 2008 and miss universe 2010 .<SPLIT>on february 9 , 2012 , [MASK] was [MASK] as the new miss [MASK] world .<SPLIT>she represented",-1.0,0.5756459832191467,0,0,7,564,Successful
8,Lenny randle,"renato campos ( born september 5 , 1980 ) is a retired angolan football player .<SPLIT>he has played for angola national team",Lenny randle,"[MASK] [MASK] ( born september 5 , 1980 ) is a retired [MASK] football player .<SPLIT>he has played for [MASK] national team",-1.0,0.6133829355239868,0,0,8,71,Successful
9,Lenny randle,"sir william laird clowes ( 1 february 1856 -- 14 august 1905 ) was a british journalist and historian whose principal work was `` the royal navy , a history from the earliest times to 1900 '' , a text that is still in print .<SPLIT>he also wrote numerous technical pieces on naval technology and strategy and was also noted for his articles concerning racial politics in the southern united states .<SPLIT>despite having trained as a lawyer , clowes had always preferred literature and writing , publishing his first work in 1876 and becoming a full-time journalist in 1879 .<SPLIT>for the services rendered in his",Lenny randle,"sir william [MASK] [MASK] ( 1 february 1856 -- 14 august 1905 ) was a british journalist and historian whose principal work was `` the royal navy , a history from the earliest times to 1900 '' , a [MASK] that is still in print .<SPLIT>he also wrote numerous technical pieces on naval technology and [MASK] and was also noted for his articles [MASK] [MASK] politics in the southern united states .<SPLIT>despite having trained as a lawyer , [MASK] had always [MASK] literature and writing , publishing his first work in 1876 and becoming a full-time journalist in 1879 .<SPLIT>for the services [MASK] in his",-1.0,0.5805411338806152,0,0,9,742,Successful
10,Lenny randle,"daniel vaughn ( dan ) besse ( born december 28 , 1954 ) is a graduate of unc-chapel hill school of law ( 1980 ) , an attorney , and , since 2001 , a city councilman in winston-salem , north carolina .<SPLIT>he was one of four democratic candidates in the 2008 lt. governor election for the seat vacated by beverly perdue , but came in last in the primary , which was won by walter dalton .<SPLIT>in the 2008 campaign , besse received the endorsement of the progressive democrats of",Lenny randle,"daniel [MASK] ( dan ) [MASK] ( born december 28 , 1954 ) is a graduate of [MASK]-chapel hill school of law ( 1980 ) , an attorney , and , since 2001 , a city [MASK] in winston-salem , north carolina .<SPLIT>he was one of four democratic [MASK] in the 2008 [MASK]. governor election for the seat [MASK] by beverly [MASK] , but came in last in the primary , which was won by walter [MASK] .<SPLIT>in the 2008 campaign , [MASK] received the [MASK] of the progressive democrats of",-1.0,0.5865989923477173,0,0,10,727,Successful
11,Lenny randle,"matt elliott is an english folk guitarist and singer from bristol , england , who plays dark folk music .<SPLIT>he also produced and recorded electronic music under the name the third eye",Lenny randle,"matt elliott is an english folk guitarist and singer from bristol , england , who plays dark folk music .<SPLIT>he also produced and recorded electronic music under the name the third eye",-1.0,-1.0,0,0,11,1,Skipped
12,Lenny randle,giuseppe mariani was an italian art director .<SPLIT>he was nominated for an academy award in the category best art direction for the film `` the taming of the shrew '' .<SPLIT>,Lenny randle,giuseppe [MASK] was an italian art director .<SPLIT>he was nominated for an academy award in the category best art direction for the film `` the [MASK] of the [MASK] '' .<SPLIT>,-1.0,0.8433767557144165,0,0,12,82,Successful
13,Lenny randle,"tang li ( chinese : 唐莉 ; pinyin : táng lì ; born july 27 , 1982 ) is a chinese professional go player .<SPLIT>",Lenny randle,"[MASK] li ( chinese : [MASK] ; [MASK] : [MASK] [MASK] ; born july 27 , 1982 ) is a chinese professional go player .<SPLIT>",-1.0,0.5994046330451965,0,0,13,76,Successful
14,Lenny randle,"peter curran is an irish broadcaster , writer , documentary maker and audiobook publisher .<SPLIT>he grew up in belfast , the eldest of six children .<SPLIT>after leaving school he worked on funfairs in the usa before moving to london .<SPLIT>curran worked for an interior design and building company for four years before re-training as a bbc reporter .<SPLIT>in 1992 , he began dj ` ing full-time for the london radio station bbc glr .<SPLIT>",Lenny randle,"peter [MASK] is an irish broadcaster , writer , documentary maker and [MASK] publisher .<SPLIT>he grew up in belfast , the eldest of six children .<SPLIT>after leaving school he worked on [MASK] in the usa before moving to london .<SPLIT>[MASK] worked for an interior design and building company for four years before re-training as a bbc reporter .<SPLIT>in 1992 , he began dj ` [MASK] full-time for the london radio station bbc [MASK] .<SPLIT>",-1.0,0.6963529586791992,0,0,14,340,Successful
15,Lenny randle,"adam saltsman , also known as adam atomic , is an american indie video game designer best known for creating the endless runner `` canabalt '' .<SPLIT>he is a founder of semi secret software and finji video game",Lenny randle,"adam [MASK] , also known as adam [MASK] , is an american indie video game designer best known for creating the [MASK] runner `` [MASK] '' .<SPLIT>he is a founder of semi secret software and [MASK] video game",-1.0,0.5998230576515198,0,0,15,161,Successful
16,Lenny randle,"walter clarence henderson ( 28 february 1891 -- 20 september 1968 ) was a progressive conservative party member of the canadian house of commons .<SPLIT>he was born in carberry , manitoba and became a farmer by career .<SPLIT>he was elected at the cariboo riding in the 1958 general election , defeating social credit incumbent bert leboe .<SPLIT>henderson served only one term , the 24th canadian parliament , before leboe retook the riding in the 1962 election .<SPLIT>--",Lenny randle,"walter clarence henderson ( 28 february 1891 -- 20 september 1968 ) was a progressive conservative party member of the canadian house of commons .<SPLIT>he was born in [MASK] , manitoba and became a farmer by career .<SPLIT>he was elected at the [MASK] riding in the 1958 general election , defeating social credit incumbent bert [MASK] .<SPLIT>henderson served only one term , the 24th canadian parliament , before [MASK] [MASK] the riding in the 1962 election .<SPLIT>--",-1.0,0.8082014322280884,0,0,16,268,Successful
17,Lenny randle,andré fernando cabrita salvador ( born 4 november 1993 in portimão ) is a portuguese footballer who plays for portimonense s.c. as a midfielder .<SPLIT>,Lenny randle,andré fernando [MASK] salvador ( born 4 november 1993 in [MASK] ) is a portuguese footballer who plays for [MASK] s.c. as a midfielder .<SPLIT>,-1.0,0.7169179916381836,0,0,17,67,Successful
18,Lenny randle,"ernesto inarkiev ( born december 9 , 1985 in osh , kyrgyzstan ) is a russian chess grandmaster .<SPLIT>he was named after ernesto `` che '' guevara .<SPLIT>in 2006 he came third in the 59th russian chess championship superfinal .<SPLIT>in 2010 he tied for 1st -- 4th with konstantin chernyshov , lê quang liêm and evgeny bareev in the moscow open .<SPLIT>in 2015 he won `` moscow open 2015 '' with outstanding 8/9 .<SPLIT>",Lenny randle,"[MASK] [MASK] ( born december 9 , 1985 in [MASK] , [MASK] ) is a russian chess grandmaster .<SPLIT>he was named after [MASK] `` [MASK] '' [MASK] .<SPLIT>in 2006 he came third in the [MASK] russian chess championship [MASK] .<SPLIT>in 2010 he tied for 1st -- 4th with [MASK] [MASK] , [MASK] [MASK] [MASK] and [MASK] [MASK] in the moscow open .<SPLIT>in 2015 he won `` moscow open 2015 '' with outstanding 8/9 .<SPLIT>",-1.0,0.6095176935195923,0,0,18,856,Successful
19,Lenny randle,"william ` bill ' rigby ( 9 june 1921 - 1 june 2010 ) was a former english footballer who played as a goalkeeper .<SPLIT>he was born in chester .<SPLIT>a product of the youth system at his hometown club of chester , rigby made his only peacetime first-team appearance for the club in their first post-war match in the football league in a 4 -- 4 draw at york city on 31 august 1946 .<SPLIT>after this he was not selected again , with goalkeeping duties being passed on to george scales and jim maclaren .<SPLIT>earlier he had made appearances for",Lenny randle,"william ` bill ' [MASK] ( 9 june 1921 - 1 june 2010 ) was a former english footballer who played as a goalkeeper .<SPLIT>he was born in chester .<SPLIT>a product of the youth system at his hometown club of chester , [MASK] made his only [MASK] first-team appearance for the club in their first post-war match in the football league in a 4 -- 4 draw at york city on 31 august 1946 .<SPLIT>after this he was not selected again , with [MASK] duties being passed on to george [MASK] and jim [MASK] .<SPLIT>earlier he had made appearances for",-1.0,0.6375992298126221,0,0,19,458,Successful
20,Lenny randle,"barnas sears ( november 19 , 1802 -- july 6 , 1880 ) graduated from brown university in 1825 .<SPLIT>sears was the general agent of the peabody education fund who was sent to staunton , virginia , by george peabody to offer leadership in public education .<SPLIT>sears was general agent of the fund from 1867 until february 1880 .<SPLIT>he settled in staunton because of the easy access to the railroad .<SPLIT>sears travelled extensively throughout the south promoting southern education , `` free schools for the whole people '' .<SPLIT>sears",Lenny randle,"[MASK] [MASK] ( november 19 , [MASK] -- july 6 , 1880 ) graduated from brown university in 1825 .<SPLIT>[MASK] was the general agent of the [MASK] education fund who was sent to [MASK] , virginia , by george [MASK] to [MASK] leadership in public education .<SPLIT>[MASK] was general agent of the fund from 1867 until february 1880 .<SPLIT>he settled in [MASK] because of the [MASK] [MASK] to the [MASK] .<SPLIT>[MASK] [MASK] extensively throughout the south [MASK] southern education , `` free schools for the whole people '' .<SPLIT>[MASK]",-1.0,0.5769697427749634,0,0,20,767,Successful
21,Lenny randle,"stepan rostomyan ( '' Ստեփան Ռոստոմյան '' ) , ( born 4 april , 1956 ) is a famous armenian composer .<SPLIT>he is one of armenia 's key figures of the contemporary music scene , as well as a composer whose works have",Lenny randle,"[MASK] [MASK] ( '' [MASK] [MASK] '' ) , ( born 4 april , 1956 ) is a famous armenian composer .<SPLIT>he is one of [MASK] 's key figures of the contemporary music scene , as well as a composer whose works have",-1.0,0.5761477947235107,0,0,21,161,Successful
22,Lenny randle,"shashi gupta ( born 3 april 1964 in delhi , india ) is a former test and one day international cricketer who represented india .<SPLIT>she played a total of 13 tests and 20 odis",Lenny randle,"[MASK] [MASK] ( born 3 april 1964 in delhi , india ) is a former test and one day international cricketer who represented india .<SPLIT>she played a total of 13 tests and 20 odis",-1.0,0.678814709186554,0,0,22,62,Successful
23,Lenny randle,"allan l. higdon served on ottawa city council from 1994 through 2000 .<SPLIT>born in dublin , republic of ireland , he immigrated to canada in 1957 .<SPLIT>he received a ba from queen 's university in english and history and received a b.ed from the university of toronto .<SPLIT>he then worked with the canadian institute of mining and metallurgy .<SPLIT>he would later move to ottawa after living in toronto and southeast asia , where he would teach high school .<SPLIT>he then worked on parliament hill and then became a self-employed consultant specializing in",Lenny randle,"allan l. [MASK] served on ottawa city council from 1994 through 2000 .<SPLIT>born in dublin , republic of ireland , he [MASK] to canada in 1957 .<SPLIT>he received a ba from queen 's university in english and history and received a b.ed from the university of toronto .<SPLIT>he then worked with the canadian institute of [MASK] and [MASK] .<SPLIT>he would later move to ottawa after living in toronto and [MASK] asia , where he would [MASK] high school .<SPLIT>he then worked on parliament hill and then became a self-employed consultant specializing in",-1.0,0.5762107372283936,0,0,23,532,Successful
24,Lenny randle,"olcay Çakır ( born 13 july 1993 in konak , İzmir , turkey ) is a turkish basketball player .<SPLIT>the young national plays for fenerbahçe İstanbul as both guard ( 1-2 ) position .<SPLIT>olcay Çakır is 182 cm tall and weighs 60 kg .<SPLIT>she is playing for fenerbahçe since 2005 in youth level and since 2010 in senior level .<SPLIT>Çakır was selected 27th overall in the 2013 wnba draft 's round 3 by the new york liberty .<SPLIT>she is so the first ever",Lenny randle,"[MASK] [MASK] ( born 13 july 1993 in [MASK] , [MASK] , turkey ) is a turkish basketball player .<SPLIT>the young national plays for [MASK] [MASK] as both guard ( 1-2 ) position .<SPLIT>[MASK] [MASK] is 182 cm tall and [MASK] 60 kg .<SPLIT>she is playing for [MASK] since 2005 in youth level and since 2010 in senior level .<SPLIT>[MASK] was selected 27th overall in the 2013 [MASK] draft 's round 3 by the new york liberty .<SPLIT>she is so the first ever",-1.0,0.5965337753295898,0,0,24,577,Successful
25,Lenny randle,"david buchanan ( 16 january 1830 -- 30 may 1900 ) was an english amateur cricketer who played mainly as a bowler and who had two careers separated in an unusual manner by a long period out of the first-class game .<SPLIT>he was born at edinburgh , midlothian , scotland , and died at rugby , warwickshire ,",Lenny randle,"david [MASK] ( 16 january 1830 -- 30 may 1900 ) was an english amateur cricketer who played mainly as a bowler and who had two [MASK] [MASK] in an [MASK] [MASK] by a long period out of the first-class game .<SPLIT>he was born at edinburgh , [MASK] , scotland , and died at rugby , warwickshire ,",-1.0,0.5939158201217651,0,0,25,292,Successful
26,Lenny randle,enzo cilenti ( born 8 august 1974 ) is an english actor .<SPLIT>,Lenny randle,[MASK] [MASK] ( born 8 august 1974 ) is an english actor .<SPLIT>,-1.0,0.7008166313171387,0,0,26,20,Successful
27,Lenny randle,"elango nagarajah , also known as `` thaimann elango '' , is a tamil film actor , director , producer and lyricist in the tamil film industry .<SPLIT>he began his career in his early ages as a producer for the tamil film anbudan , starred arun vijay , meena , rambha ( actress ) in the main was released in the year 2000 .<SPLIT>then he worked on the most successful tamil music album நேசிக்கிறேன் as the director , actor and lyricist .<SPLIT>he was the main lead for all the six",Lenny randle,"[MASK] [MASK] , also known as `` [MASK] [MASK] '' , is a tamil film actor , director , producer and lyricist in the tamil film industry .<SPLIT>he began his career in his early [MASK] as a producer for the tamil film [MASK] , starred [MASK] [MASK] , [MASK] , [MASK] ( actress ) in the main was released in the year 2000 .<SPLIT>then he worked on the most successful tamil music album [MASK]ே[MASK]ி[MASK]்[MASK]ி[MASK]ே[MASK]் as the director , actor and lyricist .<SPLIT>he was the main lead for all the six",-1.0,0.6389384269714355,0,0,27,1059,Successful
28,Lenny randle,"jacoba surie ( 5 september 1879 -- 5 february 1970 ) was a dutch painter .<SPLIT>surie was born in amsterdam and trained at the rijksakademie van beeldende kunsten there , where she studied under coba ritsema and joseph mendes da costa .<SPLIT>she was a member of arti et amicitiae and the pulchri studio and is considered one of the amsterdamse joffers .<SPLIT>surie died in amsterdam and was buried in zorgvlied .<SPLIT>",Lenny randle,"[MASK] [MASK] ( 5 september 1879 -- 5 february 1970 ) was a dutch painter .<SPLIT>[MASK] was born in amsterdam and trained at the [MASK] van [MASK] [MASK] there , where she studied under [MASK] [MASK] and joseph [MASK] da costa .<SPLIT>she was a member of [MASK] et [MASK] and the [MASK] studio and is considered one of the [MASK] [MASK] .<SPLIT>[MASK] died in amsterdam and was buried in [MASK] .<SPLIT>",-1.0,0.6708757877349854,0,0,28,808,Successful
29,Lenny randle,"jeremy hotz ( born may 31 , 1963 ) is a canadian actor and stand-up comedian .<SPLIT>he has appeared on `` comedy central presents '' , the just for laughs comedy festival , the `` late show with david letterman '' , and `` the tonight show with jay leno '' .<SPLIT>he has also worked as a staff writer for paramount 's `` the jon stewart show '' and has appeared in various american and canadian motion pictures including : `` my favorite martian ''",Lenny randle,"jeremy [MASK] ( born may 31 , 1963 ) is a canadian actor and stand-up comedian .<SPLIT>he has appeared on `` comedy central [MASK] '' , the just for [MASK] comedy festival , the `` late show with david [MASK] '' , and `` the [MASK] show with jay [MASK] '' .<SPLIT>he has also worked as a staff writer for [MASK] 's `` the jon stewart show '' and has appeared in various american and canadian motion pictures including : `` my favorite [MASK] ''",-1.0,0.6002436280250549,0,0,29,525,Successful
30,Lenny randle,"air vice marshal john hugh thompson cb ( born 18 september 1947 ) is a former royal air force officer who became head of the british defence staff in washington , d.c.<SPLIT>",Lenny randle,"air vice marshal john hugh thompson cb ( born 18 september 1947 ) is a former royal air force officer who became head of the british defence staff in washington , d.c.<SPLIT>",-1.0,-1.0,0,0,30,1,Skipped
31,Lenny randle,"bernardo da costa sassetti pais ( 24 june 1970 -- 10 may 2012 ) was a portuguese jazz pianist and film composer .<SPLIT>sassetti was born in lisbon .<SPLIT>he was a great-grandson of sidónio pais , president of the first republic .<SPLIT>he initially played guitar , then began studying piano and music theory at age nine .<SPLIT>he became interested in jazz after hearing bill evans .<SPLIT>by the late 1980s , he was backing visiting musicians and teaching jazz piano in lisbon ( and , later , taught throughout other lusophonic areas ) .<SPLIT>during",Lenny randle,"[MASK] da costa [MASK] [MASK] ( 24 june 1970 -- 10 may 2012 ) was a portuguese jazz pianist and film composer .<SPLIT>[MASK] was born in lisbon .<SPLIT>he was a great-grandson of [MASK] [MASK] , president of the first republic .<SPLIT>he initially played guitar , then began studying piano and music theory at age nine .<SPLIT>he became interested in jazz after [MASK] bill evans .<SPLIT>by the late 1980s , he was backing visiting musicians and teaching jazz piano in lisbon ( and , later , taught throughout other [MASK] areas ) .<SPLIT>during",-1.0,0.6222548484802246,0,0,31,478,Successful
