,original_person,original_text,perturbed_person,perturbed_text,original_score,perturbed_score,original_output,perturbed_output,ground_truth_output,num_queries,result_type
482,Lenny randle,"carroll lane fenton ( 12 february 1900 , butler county , iowa - 16 november 1969 new brunswick , new jersey ) was a geologist , paleontologist , neoichnologist , and historian of science .<SPLIT>fenton was the author and illustrator of numerous books , many written with his wife , mildred adams fenton , on geology and paleontology for a general audience .<SPLIT>he published extensively in the field of paleontology in both the professional literature and in popular journals .<SPLIT>he was an associate editor",Lenny randle,"carroll lane [MASK] ( 12 february 1900 , butler county , iowa - 16 november 1969 new brunswick , new jersey ) was a [MASK] , [MASK] , [MASK] , and historian of science .<SPLIT>[MASK] was the author and illustrator of numerous books , many written with his wife , [MASK] adams [MASK] , on [MASK] and [MASK] for a general audience .<SPLIT>he published extensively in the field of [MASK] in both the professional literature and in popular [MASK] .<SPLIT>he was an associate editor",-1.0,0.5851123332977295,0,0,482,535,Successful
483,Lenny randle,"jonathan dixon ( born october 25 , 1965 ) is an american male television actor , best known for playing in a long series of j.j. abrams productions such as `` lost , alias , felicity , mission impossible iii '' and `` star trek '' in small",Lenny randle,"jonathan [MASK] ( born october 25 , 1965 ) is an american male television actor , best known for playing in a long series of j.j. [MASK] productions such as `` lost , alias , [MASK] , mission [MASK] iii '' and `` star [MASK] '' in small",-1.0,0.5833768248558044,0,0,483,181,Successful
484,Lenny randle,annia rivera ( born 13 august 1991 ) is a cuban diver .<SPLIT>she competed in the 10 metre platform event at the 2012 summer olympics .<SPLIT>,Lenny randle,[MASK] [MASK] ( born 13 august 1991 ) is a cuban [MASK] .<SPLIT>she competed in the 10 metre platform event at the 2012 summer olympics .<SPLIT>,-1.0,0.591151773929596,0,0,484,67,Successful
485,Lenny randle,"roger duane `` zeke '' smith ( born september 29 , 1936 in walker springs , alabama ) is a former american football player in the national football league for the baltimore colts and the new york giants .<SPLIT>he played college football at auburn university where he was awarded the outland trophy in 1958 .<SPLIT>his banner , along with four other auburn greats - bo jackson , pat sullivan , tracy rocker and carlos rogers , is hanging outside jordan-hare stadium",Lenny randle,"roger [MASK] `` [MASK] '' smith ( born september 29 , 1936 in walker springs , alabama ) is a former american football player in the national football league for the baltimore colts and the new york giants .<SPLIT>he played college football at auburn university where he was awarded the [MASK] trophy in 1958 .<SPLIT>his [MASK] , along with four other auburn [MASK] - [MASK] jackson , pat sullivan , [MASK] [MASK] and carlos rogers , is [MASK] outside jordan-[MASK] stadium",-1.0,0.5800778865814209,0,0,485,666,Successful
486,Lenny randle,"john allen ford ( born july 31 , 1966 ) is a former american football wide receiver in the national football league for the detroit lions .<SPLIT>ford attended the university of virginia",Lenny randle,"john allen ford ( born july 31 , 1966 ) is a former american football wide receiver in the national football league for the detroit lions .<SPLIT>ford attended the university of virginia",-1.0,-1.0,0,0,486,1,Skipped
487,Lenny randle,zinaida lunina ( ) ( born 18 april 1989 ) is a belarusian gymnast .<SPLIT>she competed at the 2008 summer olympics in beijing where she received a bronze medal in the rhythmic group competition .<SPLIT>,Lenny randle,[MASK] [MASK] ( ) ( born 18 april 1989 ) is a belarusian gymnast .<SPLIT>she competed at the 2008 summer olympics in beijing where she received a bronze medal in the [MASK] group competition .<SPLIT>,-1.0,0.6494375467300415,0,0,487,88,Successful
488,Lenny randle,"trent joseph cameron ( born in los angeles county , california , may 16 , 1979 ) is an american actor best known for his roles as john lee malvo in '' '' , as jerel goodrich in the upn sitcom `` the parkers '' and as young roland",Lenny randle,"trent joseph cameron ( born in los angeles county , california , may 16 , 1979 ) is an american actor best known for his roles as john lee [MASK] in '' '' , as [MASK] [MASK] in the [MASK] sitcom `` the [MASK] '' and as young roland",-1.0,0.7576050758361816,0,0,488,186,Successful
489,Lenny randle,inácio josé de alvarenga peixoto ( 1744 -- 1793 ) was a colonial brazilian neoclassic poet and lawyer .<SPLIT>he wrote under the pen name eureste fenício .<SPLIT>it is attributed to him the design of the flag of minas gerais .<SPLIT>,Lenny randle,[MASK] josé de [MASK] [MASK] ( [MASK] -- [MASK] ) was a colonial brazilian [MASK] poet and lawyer .<SPLIT>he wrote under the pen name [MASK] [MASK] .<SPLIT>it is [MASK] to him the design of the flag of [MASK] [MASK] .<SPLIT>,-1.0,0.579945981502533,0,0,489,342,Successful
490,Lenny randle,"mircea tiberian ( born may 4 , 1955 in cluj , romania ) is a jazz musician and professor of music at the national university of music in bucharest .<SPLIT>he coordinates the jazz department , which he set up",Lenny randle,"[MASK] [MASK] ( born may 4 , 1955 in [MASK] , romania ) is a jazz musician and professor of music at the national university of music in bucharest .<SPLIT>he [MASK] the jazz department , which he set up",-1.0,0.6154874563217163,0,0,490,131,Successful
491,Lenny randle,"ian bryson ( born 26 november 1962 in kilmarnock ) is a scottish footballer .<SPLIT>he began his career at hurlford united before moving to kilmarnock , where he spent seven years making almost 200 appearances , mostly as a midfielder .<SPLIT>after moving to england , he spent the next 5 years of his career at sheffield united with whom he was promoted to the old first division .<SPLIT>after a brief spell at barnsley , he joined preston north end in 1993 on his 31st birthday , where he briefly played alongside a",Lenny randle,"ian [MASK] ( born 26 november 1962 in [MASK] ) is a scottish footballer .<SPLIT>he began his career at [MASK] united before moving to [MASK] , where he spent seven years making almost 200 appearances , mostly as a midfielder .<SPLIT>after moving to england , he spent the next 5 years of his career at sheffield united with whom he was promoted to the old first division .<SPLIT>after a brief spell at barnsley , he joined preston north end in 1993 on his [MASK] birthday , where he briefly played alongside a",-1.0,0.58406662940979,0,0,491,334,Successful
492,Lenny randle,"erminio sipari ( 1 ° december 1879 -- 28 january 1968 ) was an italian politician and naturalist , author of studies on the preservation of nature and founder of parco nazionale d'abruzzo , which he chaired from 1922 to 1933",Lenny randle,"[MASK] [MASK] ( 1 ° december 1879 -- 28 january 1968 ) was an italian politician and [MASK] , author of studies on the [MASK] of nature and founder of [MASK] [MASK] d'[MASK] , which he [MASK] from 1922 to 1933",-1.0,0.6009210348129272,0,0,492,261,Successful
493,Lenny randle,"earl edmond `` dutch '' mueller ( died 1932 ) was an american college basketball player .<SPLIT>he was the 1925 national player of the year as a center at colorado college .<SPLIT>mueller , from saint joseph , missouri , was an early college basketball standout at colorado college in colorado springs , colorado .<SPLIT>he played two seasons for the tigers , leading the team to two colorado -- wyoming conference titles .<SPLIT>mueller played the center position and was known for his ball-handling and pivot play .<SPLIT>he was",Lenny randle,"earl [MASK] `` dutch '' [MASK] ( died 1932 ) was an american college basketball player .<SPLIT>he was the 1925 national player of the year as a center at colorado college .<SPLIT>[MASK] , from saint joseph , missouri , was an early college basketball [MASK] at colorado college in colorado springs , colorado .<SPLIT>he played two seasons for the tigers , leading the team to two colorado -- wyoming conference titles .<SPLIT>[MASK] played the center position and was known for his ball-[MASK] and [MASK] play .<SPLIT>he was",-1.0,0.6129881739616394,0,0,493,373,Successful
494,Lenny randle,"charles mcarther emmanuel , also known as chuckie taylor ( born 1977 ) , is the son of charles taylor , the former president of liberia .<SPLIT>raised by his mother in florida until he was 17 , taylor jr. traveled to liberia in 1994 to live with his father , who in turn enrolled him in the accra academy , an elite boarding school in ghana .<SPLIT>he later attended the college of west africa in monrovia .<SPLIT>during his father 's presidency ,",Lenny randle,"charles [MASK] emmanuel , also known as [MASK] taylor ( born 1977 ) , is the son of charles taylor , the former president of [MASK] .<SPLIT>raised by his mother in florida until he was 17 , taylor jr. traveled to [MASK] in 1994 to live with his father , who in turn [MASK] him in the [MASK] academy , an elite [MASK] school in ghana .<SPLIT>he later attended the college of west africa in [MASK] .<SPLIT>during his father 's presidency ,",-1.0,0.5772880911827087,0,0,494,489,Successful
495,Lenny randle,"edward hugh james ( 14 april 1896 -- 15 march 1975 ) was a welsh cricketer .<SPLIT>james was a left-handed batsman who bowled slow left-arm orthodox .<SPLIT>he was born at briton ferry , glamorgan .<SPLIT>james made his debut for glamorgan in the 1920 minor counties championship against cheshire .<SPLIT>he represented the county in 1 further minor counties fixtures in 1920 , which came against devon .<SPLIT>glamorgan were elevated to first-class status in 1921 and in 1922 , james made his first-class debut for the county against lancashire .<SPLIT>james played 2 further first-class matches for",Lenny randle,"edward hugh james ( 14 april 1896 -- 15 march 1975 ) was a welsh cricketer .<SPLIT>james was a left-handed batsman who bowled slow left-arm orthodox .<SPLIT>he was born at [MASK] [MASK] , glamorgan .<SPLIT>james made his debut for glamorgan in the 1920 minor counties championship against cheshire .<SPLIT>he represented the county in 1 further minor counties [MASK] in 1920 , which came against devon .<SPLIT>glamorgan were [MASK] to first-class status in 1921 and in 1922 , james made his first-class debut for the county against lancashire .<SPLIT>james played 2 further first-class matches for",-1.0,0.5887704491615295,0,0,495,367,Successful
496,Lenny randle,tore sandell was a swedish footballer .<SPLIT>,Lenny randle,[MASK] [MASK] was a swedish footballer .<SPLIT>,-1.0,0.700245201587677,0,0,496,12,Successful
497,Lenny randle,"charlotte harrison ( born 31 july 1989 ) is a new zealand field hockey player .<SPLIT>she has competed for the new zealand women 's national field hockey team ( the `` black sticks women '' ) , including for the team at the 2012 summer olympics and at the 2006 and 2010 commonwealth games , and as a reserve for the team at the 2008 summer olympics .<SPLIT>harrison was first selected for the black sticks women in october 2005 on the back of her performance for northland in the national hockey league",Lenny randle,"charlotte harrison ( born 31 july 1989 ) is a new zealand field hockey player .<SPLIT>she has competed for the new zealand women 's national field hockey team ( the `` black [MASK] women '' ) , including for the team at the 2012 summer olympics and at the 2006 and 2010 commonwealth games , and as a reserve for the team at the 2008 summer olympics .<SPLIT>harrison was first selected for the black [MASK] women in october 2005 on the back of her performance for [MASK] in the national hockey league",-1.0,0.7281101942062378,0,0,497,168,Successful
498,Lenny randle,"laura elizabeth bissell ( born 19 june 1983 ) is an english road and track racing cyclist .<SPLIT>bissell was born in hitchin , england .<SPLIT>she has represented her country at international events on several occasions .<SPLIT>she was a member of the british cycling development plan squad alongside nicole cooke , competing at the 2000 and 2001 junior road world championship and the 2001 junior track world championships in trexlertown , united states .<SPLIT>bissell lives in stevenage , hertfordshire .<SPLIT>her brother , peter bissell ,",Lenny randle,"laura elizabeth [MASK] ( born 19 june 1983 ) is an english road and track racing cyclist .<SPLIT>[MASK] was born in [MASK] , england .<SPLIT>she has represented her country at international events on several occasions .<SPLIT>she was a member of the british cycling development plan squad alongside nicole [MASK] , competing at the 2000 and 2001 junior road world championship and the 2001 junior track world championships in [MASK] , united states .<SPLIT>[MASK] lives in [MASK] , hertfordshire .<SPLIT>her brother , peter [MASK] ,",-1.0,0.6302348375320435,0,0,498,362,Successful
499,Lenny randle,"frank ramsey adams ( july 7 , 1883 -- october 8 , 1963 ) was an american author , screenwriter , composer , and newspaper reporter .<SPLIT>he was born on july 7 , 1883 in morrison , illinois .<SPLIT>educated at the university of chicago , adams worked as a reporter for several chicago newspapers , including the `` chicago tribune '' , `` city press '' , `` chicago daily news",Lenny randle,"frank [MASK] adams ( july 7 , 1883 -- october 8 , 1963 ) was an american author , screenwriter , composer , and newspaper reporter .<SPLIT>he was born on july 7 , 1883 in [MASK] , illinois .<SPLIT>educated at the university of chicago , adams worked as a reporter for several chicago newspapers , including the `` chicago [MASK] '' , `` city press '' , `` chicago daily news",-1.0,0.5780571699142456,0,0,499,154,Successful
500,Lenny randle,"orlando peçanha de carvalho ( 20 september 1935 -- 10 february 2010 ) , known simply as orlando , was a brazilian footballer who played defender .<SPLIT>during his club career he played for vasco da gama ( 1955 -- 1960 ) , boca juniors ( 1960 -- 1964 ) and santos ( 1965 -- 1967 ) .<SPLIT>he was part of the brazilian team that won the 1958 fifa world cup , and also participated in the 1966 fifa world cup .<SPLIT>in total he earned 30 caps .<SPLIT>orlando died on",Lenny randle,"orlando [MASK] de [MASK] ( 20 september 1935 -- 10 february 2010 ) , known simply as orlando , was a brazilian footballer who played defender .<SPLIT>during his club career he played for [MASK] da [MASK] ( 1955 -- 1960 ) , [MASK] juniors ( 1960 -- 1964 ) and santos ( 1965 -- 1967 ) .<SPLIT>he was part of the brazilian team that won the 1958 fifa world cup , and also participated in the 1966 fifa world cup .<SPLIT>in total he earned 30 caps .<SPLIT>orlando died on",-1.0,0.5849021077156067,0,0,500,356,Successful
501,Lenny randle,"ian leonard osborne ( born 28 october 1952 ) is an english former professional footballer who played in the football league for birmingham city and port vale .<SPLIT>osborne was born in leicester .<SPLIT>when he left school in 1968 , he joined birmingham city as an apprentice , and turned professional two years later .<SPLIT>a pacy full back , he spent a long time in the reserve team before eventually making his debut in the first division on 16 august 1975 , the opening game of the 1975 -- 76 season , in a 3 -- 3 draw",Lenny randle,"ian leonard [MASK] ( born 28 october 1952 ) is an english former professional footballer who played in the football league for birmingham city and port vale .<SPLIT>[MASK] was born in leicester .<SPLIT>when he left school in 1968 , he joined birmingham city as an [MASK] , and turned professional two years later .<SPLIT>a [MASK] full back , he spent a long time in the reserve team before eventually making his debut in the first division on 16 august 1975 , the opening game of the 1975 -- 76 season , in a 3 -- 3 draw",-1.0,0.611331045627594,0,0,501,261,Successful
502,Lenny randle,"skarf ( ; often stylized as skarf ) is a singaporean-south korean girl group formed by alpha entertainment .<SPLIT>the meaning behind the group 's name is based on the word `` scarf '' .<SPLIT>the s stands for singapore while the c was switched out with the k for korea .<SPLIT>the group is made up of five members , namely , ferlyn , tasha , jenny , jooa and hana .<SPLIT>on august 14 , 2012 , they made their official debut and released their first self-titled",Lenny randle,"[MASK] ( ; often [MASK] as [MASK] ) is a [MASK]-south korean girl group formed by [MASK] entertainment .<SPLIT>the meaning behind the group 's name is based on the word `` [MASK] '' .<SPLIT>the s [MASK] for singapore while the c was switched out with the k for korea .<SPLIT>the group is made up of five members , [MASK] , [MASK] , [MASK] , [MASK] , [MASK] and [MASK] .<SPLIT>on august 14 , 2012 , they made their official debut and released their first self-titled",-1.0,0.5839282274246216,0,0,502,826,Successful
503,Lenny randle,alex rosamilia ( born 1982 ) is an american musician .<SPLIT>rosamilia is one of the founding members of the band the gaslight anthem .<SPLIT>he plays lead guitar and provides backing vocals for the band .<SPLIT>,Lenny randle,alex [MASK] ( born 1982 ) is an american musician .<SPLIT>[MASK] is one of the founding members of the band the [MASK] [MASK] .<SPLIT>he plays lead guitar and [MASK] backing vocals for the band .<SPLIT>,-1.0,0.6112346053123474,0,0,503,120,Successful
504,Lenny randle,"chinmayi sripada is an indian playback singer , working mainly for the south indian film industry .<SPLIT>she is also a voice actor , television presenter and radio jockey .<SPLIT>she is the founder and ceo of a translation services company called blue elephant .<SPLIT>she is often credited as chinmayee/indai haza but her birth name is chinmayi .<SPLIT>she rose to fame for her critically acclaimed song `` oru deivam thantha poovae ( kannathil muthamittal ) '' from the national award winning movie kannathil muthamittal .<SPLIT>chinmayi",Lenny randle,"[MASK] [MASK] is an indian [MASK] singer , working mainly for the south indian film industry .<SPLIT>she is also a voice actor , television presenter and radio jockey .<SPLIT>she is the founder and ceo of a [MASK] services company called blue [MASK] .<SPLIT>she is often credited as [MASK]/[MASK] [MASK] but her birth name is [MASK] .<SPLIT>she rose to fame for her critically acclaimed song `` [MASK] [MASK] [MASK] [MASK] ( [MASK] [MASK] ) '' from the national award winning movie [MASK] [MASK] .<SPLIT>[MASK]",-1.0,0.5868135690689087,0,0,504,973,Successful
505,Lenny randle,"antonio bonilla sanmartín ( 6 december 1882 -- 9 november 1937 ) was a spanish sport shooter who competed in the 1920 summer olympics .<SPLIT>he was killed in action during the spanish civil war .<SPLIT>in the 1920 summer olympics he participated in the following events : team 30 metre military pistol - sixth place team 300 metre military rifle , prone - seventh place team 50 metre small-bore rifle - ninth place team free rifle - eleventh place team 50 metre free pistol - twelfth place team 300 and 600 metre military rifle , prone - twelfth place team 600 metre military rifle ,",Lenny randle,"antonio [MASK] [MASK] ( 6 december 1882 -- 9 november 1937 ) was a spanish sport shooter who competed in the 1920 summer olympics .<SPLIT>he was killed in action during the spanish civil war .<SPLIT>in the 1920 summer olympics he participated in the following events : team 30 metre military [MASK] - sixth place team 300 metre military rifle , [MASK] - seventh place team 50 metre small-[MASK] rifle - ninth place team free rifle - [MASK] place team 50 metre free [MASK] - [MASK] place team 300 and [MASK] metre military rifle , [MASK] - [MASK] place team [MASK] metre military rifle ,",-1.0,0.5905499458312988,0,0,505,700,Successful
506,Lenny randle,"bertrand of comminges was bishop of comminges , in the diocese of toulouse , france .<SPLIT>it is after him that the commune of saint-bertrand-de-comminges , is named .<SPLIT>",Lenny randle,"[MASK] of [MASK] was bishop of [MASK] , in the diocese of [MASK] , france .<SPLIT>it is after him that the [MASK] of saint-[MASK]-de-[MASK] , is named .<SPLIT>",-1.0,0.5808736681938171,0,0,506,96,Successful
507,Lenny randle,"david storobin ( born 1979 ) is a new york attorney and a former new york state senator who represented district 27 in the new york state senate , which includes the neighborhoods of borough park , midwood , bensonhurst , brighton beach , kensington , bergen beach , mill basin , gravesend",Lenny randle,"david [MASK] ( born 1979 ) is a new york attorney and a former new york state senator who represented district 27 in the new york state senate , which includes the [MASK] of borough park , [MASK] , [MASK] , brighton beach , [MASK] , [MASK] beach , [MASK] [MASK] , [MASK]",-1.0,0.5893593430519104,0,0,507,352,Successful
508,Lenny randle,"manoel lourenço da silva filho , known as simply manoel ( born 2 february 1978 ) , is a brazilian retired footballer who played as a centre",Lenny randle,"[MASK] [MASK] da silva [MASK] , known as simply [MASK] ( born 2 february 1978 ) , is a brazilian retired footballer who played as a centre",-1.0,0.677509069442749,0,0,508,65,Successful
509,Lenny randle,"ines kresović ( serbian cyrillic : Инес Кресовић , born february 20 , 1984 in Šibenik , sfr yugoslavia ) is a serbian female",Lenny randle,"[MASK] [MASK] ( serbian cyrillic : [MASK] [MASK] , born february 20 , 1984 in [MASK] , sfr yugoslavia ) is a serbian female",-1.0,0.7028484344482422,0,0,509,81,Successful
510,Lenny randle,"stephen william ` steve ' pitt ( b. 1 august 1948 in willesden ) is a former english professional footballer who played for tottenham hotspur , colchester united , corinthian casuals",Lenny randle,"stephen william ` steve ' [MASK] ( b. 1 august 1948 in [MASK] ) is a former english professional footballer who played for tottenham hotspur , colchester united , [MASK] [MASK]",-1.0,0.640437126159668,0,0,510,95,Successful
511,Lenny randle,"shawn cable ( born february 2 , 1980 in prince george , british columbia ) is a former professional indoor lacrosse player who played for the calgary roughnecks , colorado mammoth , anaheim storm and portland lumberjax in the national lacrosse league .<SPLIT>he is currently a video analyst for the roughnecks .<SPLIT>cable was the first graduate of the prince george minor lacrosse association to go on to play in the nll .<SPLIT>he won the ed bayley memorial trophy in 2002 as the western lacrosse association outstanding rookie as a member of",Lenny randle,"[MASK] [MASK] ( born february 2 , 1980 in prince george , british columbia ) is a former professional indoor [MASK] player who played for the calgary [MASK] , colorado [MASK] , anaheim storm and portland [MASK] in the national [MASK] league .<SPLIT>he is currently a video analyst for the [MASK] .<SPLIT>[MASK] was the first graduate of the prince george minor [MASK] association to go on to play in the [MASK] .<SPLIT>he won the ed [MASK] memorial trophy in 2002 as the western [MASK] association outstanding rookie as a member of",-1.0,0.591151773929596,0,0,511,643,Successful
512,Lenny randle,"ri chol-guk ( also `` lee cheol-guk '' , ; born december 25 , 1985 in pyongyang ) is a north korean table tennis player .<SPLIT>as of may 2012 , ri is ranked no. 86 in the world by the international table tennis federation ( ittf ) .<SPLIT>ri is a member of the table tennis team for kigwancha sports club , and is coached and trained by kim jin myong .<SPLIT>he is also right-handed , and uses the penhold grip .<SPLIT>ri qualified for the men 's singles",Lenny randle,"[MASK] [MASK]-[MASK] ( also `` lee [MASK]-[MASK] '' , ; born december 25 , 1985 in [MASK] ) is a north korean table tennis player .<SPLIT>as of may 2012 , [MASK] is ranked no. 86 in the world by the international table tennis federation ( [MASK] ) .<SPLIT>[MASK] is a member of the table tennis team for [MASK] sports club , and is coached and trained by kim jin [MASK] .<SPLIT>he is also right-handed , and uses the [MASK] [MASK] .<SPLIT>[MASK] qualified for the men 's singles",-1.0,0.6491312980651855,0,0,512,729,Successful
513,Lenny randle,"george puckrin harrison , also known as `` shoey '' because he was a shoemaker by trade ( 11 february 1862 -- 14 september 1940 ) was an english cricketer who played fifty-nine first-class matches for yorkshire county cricket club between 1883 and 1892 .<SPLIT>he also appeared in first-class cricket for the players ( 1883 ) , t emmett 's xi ( 1883 ) , lord sheffield 's xi ( 1884 ) , an england xi ( 1884 ) and l hall 's yorkshire xi (",Lenny randle,"george [MASK] harrison , also known as `` [MASK] '' because he was a [MASK] by trade ( 11 february 1862 -- 14 september 1940 ) was an english cricketer who played fifty-nine first-class matches for yorkshire county cricket club between 1883 and 1892 .<SPLIT>he also appeared in first-class cricket for the players ( 1883 ) , t [MASK] 's xi ( 1883 ) , lord sheffield 's xi ( 1884 ) , an england xi ( 1884 ) and l hall 's yorkshire xi (",-1.0,0.6691027879714966,0,0,513,279,Successful
