,original_person,original_text,perturbed_person,perturbed_text,original_score,perturbed_score,original_output,perturbed_output,ground_truth_output,num_queries,result_type
725,Lenny randle,christopher `` chris '' leonard ( born 11 july 1927 ) is an english former footballer who made 26 appearances in the football league playing as a centre half for darlington in the 1950s .<SPLIT>he also played non-league football for south shields .<SPLIT>,Lenny randle,christopher `` chris '' leonard ( born 11 july 1927 ) is an english former footballer who made 26 appearances in the football league playing as a centre half for darlington in the 1950s .<SPLIT>he also played non-league football for south [MASK] .<SPLIT>,-1.0,0.6123018264770508,0,0,725,40,Successful
726,Lenny randle,"sir victor alfred charles turner , csi , cie , mbe , si ( 1892 -- 1974 ) was an english-pakistani civil service officer , statistician and economist , and one of the founding fathers of the civil service of pakistan , serving as the first finance secretary of pakistan in the government of prime minister liaquat ali khan , as well as chairman of the federal board of revenue from 14 august 1947 until 1 february 1950 .<SPLIT>alfred charles turner --",Lenny randle,"sir victor alfred charles turner , [MASK] , [MASK] , mbe , [MASK] ( 1892 -- 1974 ) was an english-pakistani civil service officer , [MASK] and economist , and one of the founding [MASK] of the civil service of pakistan , serving as the first finance secretary of pakistan in the government of prime minister [MASK] ali khan , as well as chairman of the federal board of [MASK] from 14 august 1947 until 1 february 1950 .<SPLIT>alfred charles turner --",-1.0,0.6107540726661682,0,0,726,477,Successful
727,Lenny randle,"ace york aguilar vergel ( january 22 , 1952 -- december 15 , 2007 ) was a filipino actor dubbed `` the original bad boy of philippine movies '' .<SPLIT>he was the son of the late film actors alicia vergel and césar ramirez , and brother of actress beverly",Lenny randle,"ace york [MASK] [MASK] ( january 22 , 1952 -- december 15 , 2007 ) was a filipino actor [MASK] `` the original bad boy of philippine movies '' .<SPLIT>he was the son of the late film actors [MASK] [MASK] and césar [MASK] , and brother of actress beverly",-1.0,0.5847622752189636,0,0,727,192,Successful
728,Lenny randle,"trevis jemar simpson ( born september 5 , 1991 ) is an american professional basketball player who currently plays for rethymno aegean of the greek basket league .<SPLIT>he played college basketball at the university of north carolina at greensboro",Lenny randle,"[MASK] [MASK] simpson ( born september 5 , 1991 ) is an american professional basketball player who currently plays for [MASK] [MASK] of the greek basket league .<SPLIT>he played college basketball at the university of north carolina at [MASK]",-1.0,0.64366215467453,0,0,728,171,Successful
729,Lenny randle,"bernard yago ( july 1916 -- october 5 , 1997 ) was a côte d'ivoire cardinal of the roman catholic church .<SPLIT>he served as archbishop of abidjan from 1960 to 1994 , and was elevated to the cardinalate in 1983",Lenny randle,"bernard [MASK] ( july 1916 -- october 5 , 1997 ) was a [MASK] d'[MASK] cardinal of the roman catholic church .<SPLIT>he served as archbishop of [MASK] from 1960 to 1994 , and was [MASK] to the [MASK] in 1983",-1.0,0.5887704491615295,0,0,729,202,Successful
730,Lenny randle,"arthur chaskalson scob , ( 24 november 1931 -- 1 december 2012 ) was president of the constitutional court of south africa from 1994 to 2001 and chief justice of south africa from 2001 to 2005 .<SPLIT>chaskalson was a member of the defence team in the rivonia trial of 1963 .<SPLIT>",Lenny randle,"arthur [MASK] [MASK] , ( 24 november 1931 -- 1 december 2012 ) was president of the constitutional court of south africa from 1994 to 2001 and chief justice of south africa from 2001 to 2005 .<SPLIT>[MASK] was a member of the defence team in the [MASK] trial of 1963 .<SPLIT>",-1.0,0.9458543062210083,0,0,730,134,Successful
731,Lenny randle,eduard sergeyevich krug ( ; born 21 may 1991 ) is a russian professional football player .<SPLIT>he plays for fc novokuznetsk .<SPLIT>he is the younger brother of yevgeny krug .<SPLIT>,Lenny randle,[MASK] sergeyevich [MASK] ( ; born 21 may 1991 ) is a russian professional football player .<SPLIT>he plays for fc [MASK] .<SPLIT>he is the younger brother of [MASK] [MASK] .<SPLIT>,-1.0,0.5971812009811401,0,0,731,96,Successful
732,Lenny randle,"norbert röttgen ( born 2 july 1965 ) is a german politician of the christian democratic union .<SPLIT>he was federal minister for environment , nature conservation and nuclear safety from 2009 to 2012",Lenny randle,"[MASK] [MASK] ( born 2 july 1965 ) is a german politician of the christian democratic union .<SPLIT>he was federal minister for environment , nature [MASK] and nuclear safety from 2009 to 2012",-1.0,0.5974252820014954,0,0,732,88,Successful
733,Lenny randle,"lucy allan ( born 30 june 1991 ) is an australian football ( soccer ) player , who currently plays for canberra united fc in the australian w-league .<SPLIT>",Lenny randle,"lucy allan ( born 30 june 1991 ) is an australian football ( soccer ) player , who currently plays for canberra united fc in the australian w-league .<SPLIT>",-1.0,-1.0,0,0,733,1,Skipped
734,Lenny randle,"gregory james philip farrell ( born 19 march 1944 ) is a scottish former professional footballer .<SPLIT>beginning his career at birmingham city , farrell found his chances limited and george swindin signed him for a moderate fee to play for cardiff city in march 1964 .<SPLIT>playing as a winger , he often showed flashes of brilliance , including scoring one and supplying four other goals during a 5-3 win over middlesbrough in may 1966 .<SPLIT>he eventually left the club in 1967 to sign for bury .<SPLIT>farrell later went onto play in south africa before retiring",Lenny randle,"gregory james philip [MASK] ( born 19 march 1944 ) is a scottish former professional footballer .<SPLIT>beginning his career at birmingham city , [MASK] found his [MASK] limited and george [MASK] signed him for a [MASK] [MASK] to play for cardiff city in march 1964 .<SPLIT>playing as a winger , he often showed [MASK] of [MASK] , including scoring one and [MASK] four other goals during a 5-3 win over middlesbrough in may 1966 .<SPLIT>he eventually left the club in 1967 to sign for bury .<SPLIT>[MASK] later went [MASK] play in south africa before retiring",-1.0,0.5891380310058594,0,0,734,778,Successful
735,Lenny randle,"varsha usgaonkar ( born 28 february 1968 ) is an indian film actress from goa , who has worked in various bollywood and marathi movies as the leading lady .<SPLIT>during the 1990s , she was the most popular actress in marathi cinema .<SPLIT>usgaonkar is regarded as one of the most successful and influential marathi movie actresses of all",Lenny randle,"[MASK] [MASK] ( born 28 february 1968 ) is an indian film actress from [MASK] , who has worked in various [MASK] and [MASK] movies as the leading lady .<SPLIT>during the 1990s , she was the most popular actress in [MASK] cinema .<SPLIT>[MASK] is regarded as one of the most successful and influential [MASK] movie [MASK] of all",-1.0,0.5775436758995056,0,0,735,303,Successful
736,Lenny randle,"the actual were a four piece alternative rock group from los angeles , california headed by guitarist and singer max bernstein .<SPLIT>they were signed to eyeball records and released one album as a three piece for the label , `` songs on radio idaho '' , before signing with scott weiland 's label softdrive records .<SPLIT>they opened for the supergroup velvet revolver at the aladdin hotel in the summer of 2005 and also played the volcom stage on the 2007 warped tour .<SPLIT>in 2005 , the actual contributed two songs `` promised land",Lenny randle,"the [MASK] were a four piece alternative rock group from los angeles , california headed by guitarist and singer max [MASK] .<SPLIT>they were signed to [MASK] records and released one album as a three piece for the label , `` songs on radio idaho '' , before signing with scott [MASK] 's label [MASK] records .<SPLIT>they opened for the [MASK] [MASK] [MASK] at the [MASK] hotel in the summer of 2005 and also played the [MASK] stage on the 2007 [MASK] tour .<SPLIT>in 2005 , the [MASK] contributed two songs `` [MASK] land",-1.0,0.6486740112304688,0,0,736,967,Successful
737,Lenny randle,ana lilia guillén quiroz ( born 5 february 1955 ) is a mexican politician affiliated to the party of the democratic revolution .<SPLIT>as of 2014 she served as deputy of the lix legislature of the mexican congress representing michoacán .<SPLIT>,Lenny randle,ana [MASK] [MASK] [MASK] ( born 5 february 1955 ) is a mexican politician affiliated to the party of the democratic revolution .<SPLIT>as of 2014 she served as deputy of the [MASK] legislature of the mexican congress representing [MASK] .<SPLIT>,-1.0,0.6412663459777832,0,0,737,176,Successful
738,Lenny randle,george blackwood ( born 4 june 1997 ) is an australian footballer who plays as a striker for sydney fc in the a-league .<SPLIT>,Lenny randle,george [MASK] ( born 4 june 1997 ) is an australian footballer who plays as a striker for sydney fc in the a-league .<SPLIT>,-1.0,0.7226969599723816,0,0,738,23,Successful
739,Lenny randle,"mahlon gore ( february 4 , 1837 - june 27 , 1916 ) was an american politician , who was the thirteenth mayor of orlando from 1893 to 1896 .<SPLIT>gore was born in michigan and left home at the age of 15 to start work as a printer .<SPLIT>he enlisted in the second michigan infantry in 1861 , and after completing his three months of service decided not to re-enlist and moved to iowa with his first wife , josephine .<SPLIT>they later homesteaded in the dakota territory , where gore is believed to have",Lenny randle,"[MASK] [MASK] ( february 4 , 1837 - june 27 , 1916 ) was an american politician , who was the [MASK] mayor of orlando from 1893 to 1896 .<SPLIT>[MASK] was born in michigan and left home at the age of 15 to start work as a [MASK] .<SPLIT>he enlisted in the second michigan infantry in 1861 , and after completing his three months of service decided not to re-[MASK] and moved to iowa with his first wife , [MASK] .<SPLIT>they later [MASK] in the dakota territory , where [MASK] is believed to have",-1.0,0.6051070094108582,0,0,739,580,Successful
740,Lenny randle,"silje norendal ( born 1 september 1993 ) is a norwegian snowboarder .<SPLIT>she competes in halfpipe , slopestyle and boardercross .<SPLIT>her local club is kongsberg if .<SPLIT>she won gold in women 's slopestyle in winter x games europe in tignes in 2013 .<SPLIT>in january 2014 , she won women 's slopestyle in winter x games in aspen , colorado .<SPLIT>in the 2014 winter olympics in sochi , russia , norendal finished in fourth",Lenny randle,"[MASK] [MASK] ( born 1 september 1993 ) is a norwegian [MASK] .<SPLIT>she competes in [MASK] , [MASK] and [MASK] .<SPLIT>her local club is [MASK] if .<SPLIT>she won gold in women 's [MASK] in winter x games europe in [MASK] in 2013 .<SPLIT>in january 2014 , she won women 's [MASK] in winter x games in [MASK] , colorado .<SPLIT>in the 2014 winter olympics in [MASK] , russia , [MASK] finished in fourth",-1.0,0.6003279685974121,0,0,740,601,Successful
741,Lenny randle,"raimi ayo hassan ( born 12 august 1984 at lagos , nigeria ) is a nigerian footballer who is currently with kuala lumpur fa .<SPLIT>a defender , ayo hassan raimi played for several clubs including kaduna united f.c. , al-ittihad ( bahrain ) , al-ahli saida , tuen mun progoal fc and kuan tai in macau .<SPLIT>in december 2011 , hassan signed a six-month contract with kuala lumpur fa in the malaysia super league",Lenny randle,"[MASK] [MASK] hassan ( born 12 august 1984 at [MASK] , nigeria ) is a nigerian footballer who is currently with [MASK] [MASK] fa .<SPLIT>a defender , [MASK] hassan [MASK] played for several clubs including [MASK] united f.c. , al-[MASK] ( [MASK] ) , al-[MASK] [MASK] , [MASK] [MASK] [MASK] fc and [MASK] [MASK] in [MASK] .<SPLIT>in december 2011 , hassan signed a six-month contract with [MASK] [MASK] fa in the malaysia super league",-1.0,0.5895072221755981,0,0,741,941,Successful
742,Lenny randle,"mike le han is a multi award winning english writer and director with a background in post production and visual effects who resides in los angeles , california .<SPLIT>he started his career in music during the early 90 's working as a session musician and freelance tutor .<SPLIT>he was introduced to film in 1997 when he wrote and directed a short .<SPLIT>le han 's work was nominated for two `` royal television society awards ''",Lenny randle,"mike le han is a multi award winning english writer and director with a background in post production and visual effects who resides in los angeles , california .<SPLIT>he started his career in music during the early 90 's working as a session musician and [MASK] [MASK] .<SPLIT>he was introduced to film in 1997 when he wrote and directed a short .<SPLIT>le han 's work was nominated for two `` royal television society awards ''",-1.0,0.5907751321792603,0,0,742,144,Successful
743,Lenny randle,"jason matthew thirsk ( december 25 , 1967 -- july 29 , 1996 ) was the former bass player of the california punk rock band pennywise who grew up in hermosa beach , california .<SPLIT>thirsk , who had been in rehabilitation for alcoholism and suffered from depression , died of a self-inflicted gunshot wound at the age of 28 .<SPLIT>the band decided to continue making music after thirsk 's death , and brought in bass guitarist randy bradbury from one hit wonder .<SPLIT>the band then set about writing",Lenny randle,"jason matthew [MASK] ( december 25 , 1967 -- july 29 , 1996 ) was the former bass player of the california punk rock band [MASK] who grew up in [MASK] beach , california .<SPLIT>[MASK] , who had been in [MASK] for [MASK] and suffered from [MASK] , died of a self-[MASK] [MASK] [MASK] at the age of 28 .<SPLIT>the band decided to continue making music after [MASK] 's death , and brought in bass guitarist randy [MASK] from one hit [MASK] .<SPLIT>the band then set about writing",-1.0,0.6071909666061401,0,0,743,808,Successful
744,Lenny randle,"joan brosnan walsh ( 29 june 1938 -- 20 december 2009 ) was a veteran irish actress , best known for her long-running role as the character mags kelly on the irish soap opera `` fair city '' , a role she had played for almost twenty years , from 18 september 1989 until her final screen appearance , 11 january 2009 .<SPLIT>brosnan walsh appeared in a number of films such as `` the boxer '' and `` fatal inheritance '' .<SPLIT>she also worked as a costume designer .<SPLIT>she first worked",Lenny randle,"joan [MASK] walsh ( 29 june 1938 -- 20 december 2009 ) was a veteran irish actress , best known for her long-running role as the character [MASK] kelly on the irish soap opera `` fair city '' , a role she had played for almost twenty years , from 18 september 1989 until her final screen appearance , 11 january 2009 .<SPLIT>[MASK] walsh appeared in a number of films such as `` the boxer '' and `` [MASK] [MASK] '' .<SPLIT>she also worked as a [MASK] designer .<SPLIT>she first worked",-1.0,0.6124973297119141,0,0,744,383,Successful
745,Lenny randle,"walter `` dootsie '' williams ( june 17 , 1911 -- august 21 , 1991 ) was an american record producer , and record label owner who released early records by redd foxx and the",Lenny randle,"walter `` [MASK] '' williams ( june 17 , 1911 -- august 21 , 1991 ) was an american record producer , and record label owner who released early records by [MASK] [MASK] and the",-1.0,0.7369639873504639,0,0,745,79,Successful
746,Lenny randle,attila farkas ( born 5 october 1978 ) is a hungarian football player who currently plays for nyíregyháza spartacus .<SPLIT>,Lenny randle,[MASK] [MASK] ( born 5 october 1978 ) is a hungarian football player who currently plays for [MASK] [MASK] .<SPLIT>,-1.0,0.6936814785003662,0,0,746,63,Successful
747,Lenny randle,"opan sat is a russian freestyle wrestler who won the gold medals at the 2010 , 2011 and 2013 fila wrestling european championships .<SPLIT>he first won the title in 2010 and repeated his success in 2011 and 2013 .<SPLIT>in the 2013 european wrestling championships he won the title by defeating vladimir dubov of bulgaria 1-0 , 2-1 , in two straight periods and thus won his third title .<SPLIT>",Lenny randle,"[MASK] sat is a russian freestyle wrestler who won the gold medals at the 2010 , 2011 and 2013 [MASK] wrestling european championships .<SPLIT>he first won the title in 2010 and [MASK] his success in 2011 and 2013 .<SPLIT>in the 2013 european wrestling championships he won the title by defeating vladimir [MASK] of bulgaria 1-0 , 2-1 , in two straight [MASK] and thus won his third title .<SPLIT>",-1.0,0.6135810613632202,0,0,747,326,Successful
748,Lenny randle,"ossian m. ross ( august 16 , 1790 - january 20 , 1837 ) was a pioneer farmer , stock-raiser , and merchant in illinois , who served as a major in the war of 1812 and subsequently founded the illinois towns of lewistown and havana , and who also played a prominent role in establishing fulton and mason counties",Lenny randle,"[MASK] m. ross ( august 16 , [MASK] - january 20 , 1837 ) was a pioneer farmer , stock-[MASK] , and merchant in illinois , who served as a major in the war of 1812 and subsequently founded the illinois [MASK] of [MASK] and havana , and who also played a prominent role in establishing [MASK] and mason counties",-1.0,0.5925222039222717,0,0,748,298,Successful
749,Lenny randle,"clarence f. manbeck ( september 21 , 1908 -- may 14 , 1991 ) was a republican member of the pennsylvania state senate , serving from 1969 to 1982 .<SPLIT>he also served in the pennsylvania house of representatives .<SPLIT>he founded farmers pride in 1939 , selling chickens in ohio and pennsylvania .<SPLIT>he sold the business in the 1980s .<SPLIT>a bridge in bethel township , lebanon county is named the senator clarence",Lenny randle,"clarence f. [MASK] ( september 21 , 1908 -- may 14 , 1991 ) was a republican member of the pennsylvania state senate , serving from 1969 to 1982 .<SPLIT>he also served in the pennsylvania house of representatives .<SPLIT>he founded [MASK] [MASK] in 1939 , selling [MASK] in ohio and pennsylvania .<SPLIT>he sold the business in the 1980s .<SPLIT>a bridge in [MASK] township , lebanon county is named the senator clarence",-1.0,0.5838590860366821,0,0,749,306,Successful
750,Lenny randle,"justin `` frankie '' peckett ( born 5 october 1972 ) is an australian rules footballer in the australian football league ( afl ) .<SPLIT>picked up by the saints as an impressive 16-year-old , in 1990 peckett won the st kilda under 19 's best and fairest and remained on the list for the 1991 season , before he was delisted at the end of the year .<SPLIT>he was picked up in the 1992 pre-season draft at pick # 49 to resurrect his career , and debuted late that season ( receiving limited game",Lenny randle,"justin `` [MASK] '' [MASK] ( born 5 october 1972 ) is an australian rules footballer in the australian football league ( afl ) .<SPLIT>picked up by the saints as an [MASK] 16-year-old , in 1990 [MASK] won the st kilda under 19 's best and [MASK] and remained on the list for the 1991 season , before he was [MASK] at the end of the year .<SPLIT>he was picked up in the 1992 pre-season draft at pick # 49 to [MASK] his career , and debuted late that season ( receiving limited game",-1.0,0.5958914160728455,0,0,750,497,Successful
751,Lenny randle,"julie laipply ( born 1978 ) also known as julie marie carrier or julie carrier is an award winning speaker , author and role model who is especially recognized for her work promoting youth leadership and self-esteem in young women .<SPLIT>laipply won the miss virginia usa 2002 title in a state pageant held in late 2001 .<SPLIT>she represented virginia in the miss usa 2002 pageant broadcast live from gary , indiana in march 2002 .<SPLIT>laipply graduated from the ohio state university honors program with a degree in leadership studies in 2000 .<SPLIT>she competed in the miss ohio",Lenny randle,"julie [MASK] ( born 1978 ) also known as julie marie [MASK] or julie [MASK] is an award winning speaker , author and role model who is especially recognized for her work [MASK] youth leadership and self-[MASK] in young women .<SPLIT>[MASK] won the miss virginia usa 2002 title in a state pageant held in late 2001 .<SPLIT>she represented virginia in the miss usa 2002 pageant broadcast live from gary , indiana in march 2002 .<SPLIT>[MASK] graduated from the ohio state university honors program with a degree in leadership studies in 2000 .<SPLIT>she competed in the miss ohio",-1.0,0.5778000354766846,0,0,751,364,Successful
752,Lenny randle,"timofey lapshin ( ; born 3 february 1988 ) is a russian biathlete .<SPLIT>he debuted in the biathlon world cup on 9 december 2011 in hochfilzen , austria .<SPLIT>he has won silver medal at biathlon junior world championships",Lenny randle,"[MASK] [MASK] ( ; born 3 february 1988 ) is a russian [MASK] .<SPLIT>he debuted in the [MASK] world cup on 9 december 2011 in [MASK] , austria .<SPLIT>he has won silver medal at [MASK] junior world championships",-1.0,0.6585118174552917,0,0,752,161,Successful
753,Lenny randle,"john wesley `` jack '' glasscock ( july 22 , 1857 -- february 24 , 1947 ) was an american shortstop in major league baseball who played for several teams from 1879 to 1895 and was the top player at his position in the 1880s during the sport 's bare-handed era .<SPLIT>he led the national league in fielding percentage seven times and in assists six times , with both marks remaining league records until ozzie smith surpassed them in the 1980s ; he also led the nl in double plays four times and in putouts twice .<SPLIT>he won the 1890 batting title",Lenny randle,"john wesley `` jack '' [MASK] ( july 22 , 1857 -- february 24 , 1947 ) was an american shortstop in major league baseball who played for several teams from 1879 to 1895 and was the top player at his position in the [MASK] during the sport 's [MASK]-handed era .<SPLIT>he led the national league in [MASK] percentage seven times and in assists six times , with both [MASK] remaining league records until [MASK] smith [MASK] them in the 1980s ; he also led the [MASK] in double plays four times and in [MASK] twice .<SPLIT>he won the 1890 batting title",-1.0,0.5941504240036011,0,0,753,811,Successful
754,Lenny randle,"ian harold king ( born 1 june 1943 ) is a former australian first-class cricketer , one of only a handful of indigenous australians to have played first-class cricket .<SPLIT>born one of ten children in brisbane , queensland , king was a successful junior basketballer and professional welterweight boxer who won 28 of 32 fights under the name `` young rainbow '' ( derived from his preference for brighly coloured clothes ) before turning to cricket .<SPLIT>a right-arm fast bowler and right-handed batsman , king started playing for sydney club bankstown before returning to queensland where he continued",Lenny randle,"ian harold king ( born 1 june 1943 ) is a former [MASK] first-class cricketer , one of only a [MASK] of [MASK] [MASK] to have played first-class cricket .<SPLIT>born one of ten children in [MASK] , queensland , king was a successful junior [MASK] and professional [MASK] boxer who won 28 of 32 [MASK] under the name `` young [MASK] '' ( [MASK] from his [MASK] for [MASK] [MASK] [MASK] ) before [MASK] to cricket .<SPLIT>a right-arm fast bowler and right-handed batsman , king started playing for sydney club [MASK] before returning to queensland where he continued",-1.0,0.47539225220680237,0,0,754,1276,Successful
755,Lenny randle,"ma bo ( born august 22 , 1947 ) is a chinese non-fiction writer who currently resides in beijing , china .<SPLIT>after graduating from beijing university with a degree in journalism , he wrote and published the book `` blood red sunset '' in 1988 which sold over 400,000 copies in china .<SPLIT>subsequently as a result of his participation in tiananmen square , he fled the country , first to france , and then ultimately to the us , where he settled as a resident scholar in brown university 's literary arts program .<SPLIT>in 1995",Lenny randle,"ma [MASK] ( born august 22 , 1947 ) is a chinese non-fiction writer who currently resides in beijing , china .<SPLIT>after graduating from beijing university with a degree in journalism , he wrote and published the book `` blood red [MASK] '' in 1988 which sold over 400,000 copies in china .<SPLIT>subsequently as a result of his participation in [MASK] square , he [MASK] the country , first to france , and then ultimately to the us , where he settled as a resident scholar in brown university 's literary arts program .<SPLIT>in 1995",-1.0,0.5800778865814209,0,0,755,339,Successful
