,original_person,original_text,perturbed_person,perturbed_text,original_score,perturbed_score,original_output,perturbed_output,ground_truth_output,num_queries,result_type
0,Lenny randle,"leonard shenoff <mask> ( born february 12, 1949 ) is a former major league baseball player.<SPLIT>he was the first-round pick of the washington senators in the secondary phase of the june 1970 major league baseball draft, tenth overall.",David sheff,"<mask> shenoff <mask> ( born february 12, <mask> ) is a former major league baseball player.<SPLIT>he was the first-round pick of the washington senators in the secondary phase of the june <mask> major league baseball draft, tenth overall.",-9.774120330810547,-2.8575639724731445,0,24492,0,85,Successful
1,Jim nicholson,"<mask> <mask> ( born 25 august 1945 in rhges ) is a member of the <mask> of <mask> .<SPLIT>he was first elected in 1989, and represents the <mask> department.<SPLIT>a <mask> by profession, he serves as an independent, and also serves as the head of the <mask> <mask> of <mask> , to which he was elected to represent the <mask> of <mask> in 1980.<SPLIT>in 1998 and 2008, he was re-elected to the <mask> in the first round, avoiding the need for a run-off vote.<SPLIT>having contributed to the creation of the",Ian revell,"<mask> <mask> ( born 25 august <mask> in rhges ) is a member of the <mask> of <mask> .<SPLIT>he was first elected in 1989, and represents the <mask> department.<SPLIT>a <mask> by profession, he serves as an independent, and also serves as the head of the <mask> <mask> of <mask> , to which he was elected to represent the <mask> of <mask> in 1980.<SPLIT>in 1998 and 2008, he was re-elected to the <mask> in the first round, avoiding the need for a run-off vote.<SPLIT>having contributed to the creation of the",-6.147971153259277,-2.12815523147583,63958,79521,1,44,Successful
2,Miroslav popov,<mask> <mask> ( born 14 june 1995 in dvr krlov <mask> <mask> ) is a <mask> grand prix motorcycle racer.<SPLIT>he currently races in the fim cev moto2 championship for montaze broz racing team aboard a suter.,Tanel leok,<mask> <mask> ( born 14 june <mask> in dvr <mask> <mask> <mask> ) is a <mask> grand prix <mask> racer.<SPLIT>he currently races in the fim cev moto2 championship for montaze broz racing team aboard a suter.,-9.481298446655273,-3.6709794998168945,2,114119,2,82,Successful
3,Jack reynolds,"john `` <mask> '' <mask> ( 21 february <mask> -- 12 march 1917 ) was a footballer who played for, among others, <mask> <mask> <mask> , <mask> villa and celtic.<SPLIT>as an international he played five times for ireland before it emerged that he was actually english and he subsequently played eight times for <mask> .<SPLIT>he is the only player, barring own goals, to score for and against <mask> and is the only player to play for both ireland and <mask> .<SPLIT>he won the fa cup with <mask> <mask> <mask> in <mask> and was",Samuel young,"<mask> `` <mask> '' <mask> ( 21 february <mask> -- <mask> <mask> <mask> ) was a footballer who played for, among others, <mask> <mask> <mask> , <mask> villa and celtic.<SPLIT>as an international he played five times for ireland before it emerged that he was actually english and he subsequently played eight times for <mask> .<SPLIT>he is the only player, barring own goals, to score for and against <mask> and is the only player to play for both ireland and <mask> .<SPLIT>he won the fa cup with <mask> <mask> <mask> in <mask> and was",-10.64566421508789,-5.404243469238281,3,18977,3,191,Successful
4,Akoo nana,"william <mask> <mask> , ( born 7th july 1979 ) better known by his stage name <mask> <mask> is a <mask> musician from ghana.<SPLIT>since 2009, he has been making a large impact in africa's <mask> scene through his authentic sounding music and captivating stage craft.",William tyler,"william <mask> <mask> , ( born 7th july 1979 ) better known by his stage name <mask> <mask> is a <mask> musician from <mask>.<SPLIT>since 2009, he has been making a large impact in <mask> <mask> scene through his authentic sounding music and captivating stage craft.",-9.921670913696289,-3.932711601257324,4,3952,4,68,Successful
5,Teoctist,"<mask> (, born <mask> arpau ; february 7, 1915 -- july 30, 2007 ) was the <mask> of the <mask> <mask> church from 1986 to 2007. <mask> served his first years as <mask> under the <mask> communist regime, and was accused by some of collaboration.<SPLIT>he offered his resignation after the <mask> revolution of 1989, but was soon restored to office and served a further 17 years.<SPLIT>a promoter of ecumenical dialogue, <mask> <mask> invited pope john paul ii to visit <mask> in 1999.<SPLIT>it",Blas f. ople,"<mask> (, born <mask> <mask> ; february 7, <mask> -- july 30, <mask> ) was the <mask> of the <mask> <mask> church from 1986 to <mask>. <mask> served his first years as <mask> under the <mask> communist regime, and was accused by some of collaboration.<SPLIT>he offered his resignation after the <mask> revolution of 1989, but was soon restored to office and served a further 17 years.<SPLIT>a promoter of ecumenical dialogue, <mask> <mask> invited pope john paul ii to visit <mask> in 1999.<SPLIT>it",-10.46236515045166,-1.254880666732788,5,5922,5,157,Successful
6,Dillon sheppard,<mask> <mask> ( born 27 february 1979 ) is a <mask> african football ( soccer ) left-winger who plays for premier soccer league club bidvest wits and <mask> <mask> .,W-inds .,<mask> <mask> ( born 27 february <mask> ) is a <mask> <mask> football ( soccer ) left-winger who plays for premier soccer league club bidvest wits and <mask> <mask> .,-9.169797897338867,-3.3224267959594727,6,135280,6,38,Successful
7,Cynthia calderón,"<mask> <mask> <mask> ( born in lima, <mask> ) is a beauty queen who was crowned <mask> <mask> <mask> <mask> on september 18, <mask> , becoming that pageant's very first titleholder from her country.<SPLIT>prior to winning <mask> <mask> <mask> , she was <mask> <mask> per 2008 and <mask> per <mask> , and represented her country in both <mask> <mask> 2008 and <mask> universe <mask> .<SPLIT>on february 9, 2012, <mask> was designated as the new <mask> per world.<SPLIT>she represented her country in the <mask>",Keiko tsuji 辻 恵子,"<mask> <mask> <mask> ( born in <mask>, <mask> ) is a beauty queen who was crowned <mask> <mask> <mask> <mask> on september 18, <mask> , becoming that pageant's very first titleholder from her country.<SPLIT>prior to winning <mask> <mask> <mask> , she was <mask> <mask> <mask> 2008 and <mask> <mask> <mask> , and represented her country in both <mask> <mask> 2008 and <mask> universe <mask> .<SPLIT>on february 9, 2012, <mask> was designated as the new <mask> <mask> world.<SPLIT>she represented her country in the <mask>",-8.46329402923584,-1.5904088020324707,44573,59454,7,80,Successful
8,Didi,"<mask> <mask> ( born september 5, 1980 ) is a retired angolan football player.<SPLIT>he has played for <mask> national team.",Brad parker,"<mask> <mask> ( born september 5, 1980 ) is a retired <mask> football player.<SPLIT>he has played for <mask> national team.",-9.7855806350708,-2.6405138969421387,116274,39516,8,17,Successful
9,Sir dickson poon,"sir <mask> <mask> <mask> ( 1 february <mask> -- 14 august <mask> ) was a british journalist and <mask> whose principal work was `` the royal navy, a history from the earliest times to 1900 '', a text that is still in print.<SPLIT>he also wrote numerous technical pieces on naval technology and strategy and was also noted for his articles concerning racial politics in the southern united states.<SPLIT>despite having trained as a lawyer, <mask> had always preferred literature and writing, publishing his first work in 1876 and becoming a full-time <mask> in 1879.<SPLIT>for the services rendered",Charles whibley,"<mask> <mask> <mask> <mask> ( 1 <mask> <mask> -- <mask> august <mask> ) was a british journalist and <mask> whose principal work was `` the royal navy, a <mask> from the earliest times to <mask> '', a text that is still in print.<SPLIT>he also wrote numerous technical pieces on naval technology and strategy and was also noted for his articles concerning racial politics in the southern united states.<SPLIT>despite having trained as a lawyer, <mask> had always preferred literature and writing, publishing his first work in 1876 and becoming a full-time <mask> in 1879.<SPLIT>for the services rendered",-6.628112316131592,-3.839554786682129,128764,2557,9,321,Successful
10,Michael l. vaughn,"daniel vaughn ( <mask> ) <mask> ( born december 28, <mask> ) is a graduate of unc-chapel hill school of law ( 1980 ), an <mask> , and, since 2001, a city councilman in winston-salem, <mask> <mask> .<SPLIT>he was one of four democratic candidates in the 2008 lt. <mask> election for the seat vacated by beverly perdue, but came in last in the primary, which was won by walter dalton.<SPLIT>in the 2008 campaign, <mask> received the endorsement of the progressive democrats of <mask> <mask> and the conservation",Michael l. vaughn,"<mask> vaughn ( <mask> ) <mask> ( born december 28, <mask> ) is a graduate of unc-chapel hill school of law ( 1980 ), an <mask> , and, since 2001, a city councilman in winston-salem, <mask> <mask> .<SPLIT>he was one of four democratic candidates in the 2008 lt. <mask> election for the seat vacated by beverly perdue, but came in last in the primary, which was won by walter dalton.<SPLIT>in the 2008 campaign, <mask> received the endorsement of the progressive democrats of <mask> <mask> and the conservation",-5.338091850280762,-2.738131046295166,41690,41690,10,53,Successful
11,Bill jones,"<mask> <mask> is an english folk guitarist and singer from bristol, england, who plays <mask> folk <mask> .<SPLIT>he also produced and recorded <mask> <mask> under the name the <mask> <mask> <mask> .",Bill jones,"<mask> <mask> is an english folk <mask> and singer from <mask>, england, who plays <mask> folk <mask> .<SPLIT>he also produced and recorded <mask> <mask> under the name the <mask> <mask> <mask> .",-7.667926788330078,-4.349752426147461,126605,126605,11,38,Successful
12,Giuseppe mariani,<mask> <mask> was an italian <mask> director.<SPLIT>he was nominated for an academy award in the category best art direction for the film `` the taming of the shrew ''.,N. viswanathan,<mask> <mask> was an <mask> <mask> <mask>.<SPLIT>he was nominated for an academy award in the category best <mask> <mask> for the film `` the taming of the shrew ''.,-9.028544425964355,-2.0285000801086426,12,4638,12,71,Successful
13,Tang li,"<mask> <mask> ( <mask> :  ; <mask> : tng l ; born july 27, 1982 ) is a <mask> professional go player.",L.d. ottinger,"<mask> <mask> ( <mask> :  ; <mask> : <mask> l ; born july 27, <mask> ) is a <mask> professional <mask> <mask>.",-14.304651260375977,-3.2977781295776367,13,110930,13,39,Successful
14,Peter curran,"peter <mask> is an irish broadcaster, writer, documentary maker and audiobook publisher.<SPLIT>he grew up in <mask> , the eldest of six children.<SPLIT>after leaving school he worked on funfairs in the usa before moving to london. <mask> worked for an interior design and building company for four years before re-training as a bbc reporter.<SPLIT>in 1992, he began dj ` ing full-time for the london radio station bbc glr.",John ryan,"<mask> <mask> is an irish <mask>, writer, documentary maker and audiobook publisher.<SPLIT>he grew up in <mask> , the eldest of six children.<SPLIT>after leaving school he worked on funfairs in the usa before moving to london. <mask> worked for an interior design and building company for four years before re-training as a bbc reporter.<SPLIT>in 1992, he began dj ` ing full-time for the london radio station bbc glr.",-9.443526268005371,-2.686952590942383,14,127320,14,102,Successful
15,Masanobu endō,"<mask> <mask> , also known as <mask> <mask> , is an american indie <mask> <mask> designer best known for creating the endless runner `` <mask> ''.<SPLIT>he is a founder of semi secret software and finji <mask> game studios.",Masanobu endō,"<mask> <mask> , also known as <mask> <mask> , is an american indie <mask> <mask> designer best known for creating the endless runner `` <mask> ''.<SPLIT>he is a founder of semi secret software and finji <mask> game studios.",-3.6354312896728516,-3.6354312896728516,143836,143836,15,1,Skipped
16,Margaret mary macdonald,"<mask> <mask> <mask> ( 28 february <mask> -- 20 september 1968 ) was a <mask> <mask> party member of the canadian house of commons.<SPLIT>he was born in <mask> , <mask> and became a <mask> by career.<SPLIT>he was elected at the <mask> <mask> in the <mask> general election, defeating social credit incumbent <mask> <mask> . <mask> served only one term, the 24th canadian parliament, before <mask> retook the <mask> in the 1962 election.<SPLIT>-- >",Inejiro asanuma,"<mask> <mask> <mask> ( 28 february <mask> -- 20 september <mask> ) was a <mask> <mask> party member of the <mask> house of commons.<SPLIT>he was born in <mask> , <mask> and became a <mask> by career.<SPLIT>he was elected at the <mask> <mask> in the <mask> general election, defeating social credit incumbent <mask> <mask> . <mask> served only one term, the 24th <mask> parliament, before <mask> retook the <mask> in the 1962 election.<SPLIT>-- >",-8.182703971862793,-2.689159393310547,88313,67706,16,76,Successful
17,André salvador,andr fernando <mask> <mask> ( born 4 november 1993 in portimo ) is a portuguese footballer who plays for <mask> s.c. as a midfielder.,Fernando espinoza,<mask> fernando <mask> <mask> ( born 4 november <mask> in <mask> ) is a <mask> footballer who plays for <mask> s.c. as a <mask>.,-11.284955024719238,-3.148557662963867,17,116779,17,86,Successful
18,David navara,"<mask> <mask> ( born december 9, 1985 in <mask> , <mask> ) is a russian chess grandmaster.<SPLIT>he was named after <mask> `` che '' guevara.<SPLIT>in 2006 he came third in the 59th russian chess championship superfinal.<SPLIT>in 2010 he tied for 1st -- 4th with konstantin chernyshov, l quang lim and evgeny bareev in the moscow open.<SPLIT>in 2015 he won `` moscow open 2015 '' with outstanding 8/9.",Vitali golod,"<mask> <mask> ( born december 9, <mask> in <mask> , <mask> ) is a russian chess grandmaster.<SPLIT>he was named after <mask> `` che '' guevara.<SPLIT>in <mask> he came third in the 59th russian chess championship superfinal.<SPLIT>in <mask> he tied for 1st -- 4th with konstantin chernyshov, l quang lim and evgeny bareev in the moscow open.<SPLIT>in <mask> he won `` moscow open <mask> '' with outstanding 8/9.",-7.860452651977539,-4.81838846206665,108303,105096,18,167,Successful
19,Bill rigby,"william ` <mask> ( 9 june <mask> - 1 june 2010 ) was a former english footballer who played as a <mask> .<SPLIT>he was born in <mask> .<SPLIT>a product of the youth system at his hometown club of <mask> , <mask> made his only peacetime first-team appearance for the club in their first post-war match in the football league in a 4 -- 4 draw at york city on 31 august 1946.<SPLIT>after this he was not selected again, with goalkeeping duties being passed on to george scales and jim maclaren.<SPLIT>earlier he had made",Jack duthoit,"<mask> ` <mask> ( 9 june <mask> - 1 june <mask> ) was a former english footballer who played as a <mask> .<SPLIT>he was born in <mask> .<SPLIT>a product of the youth system at his hometown club of <mask> , <mask> made his only peacetime first-team appearance for the club in their first post-war match in the football league in a 4 -- 4 <mask> at york city on 31 august 1946.<SPLIT>after this he was not selected again, with <mask> duties being passed on to george scales and jim maclaren.<SPLIT>earlier he had made",-11.51791000366211,-4.533201217651367,19,25039,19,247,Successful
20,Anne jellicoe,"<mask> <mask> ( november 19, <mask> -- july 6, 1880 ) graduated from <mask> university in 1825. <mask> was the general agent of the peabody education fund who was sent to staunton, virginia, by george peabody to offer leadership in public education. <mask> was general agent of the fund from 1867 until february 1880.<SPLIT>he settled in staunton because of the easy access to the railroad. <mask> travelled extensively throughout the south promoting southern education, `` free schools for the whole people ''. <mask> `` inspired",John gregg fee,"<mask> <mask> ( november 19, <mask> -- july 6, <mask> ) graduated from <mask> university in <mask>. <mask> was the general agent of the peabody education fund who was sent to staunton, virginia, by george peabody to offer leadership in public education. <mask> was general agent of the fund from 1867 until february <mask>.<SPLIT>he settled in staunton because of the easy access to the railroad. <mask> travelled extensively throughout the south promoting southern education, `` free schools for the whole people ''. <mask> `` inspired",-7.701345443725586,-3.367459774017334,86003,56854,20,98,Successful
21,Stepan rostomyan,"<mask> <mask> ( ''   '' ), ( born 4 april, 1956 ) is a famous armenian <mask> .<SPLIT>he is one of <mask> key figures of the contemporary music scene, as well as a <mask> whose works have been performed and broadcast internationally.",Hiromitsu agatsuma,"<mask> <mask> ( ''   '' ), ( born 4 april, <mask> ) is a famous <mask> <mask> .<SPLIT>he is one of <mask> key figures of the contemporary music scene, as well as a <mask> whose works have been performed and broadcast internationally.",-10.912788391113281,-2.2312545776367188,21,103831,21,54,Successful
22,Shashi gupta,"<mask> <mask> ( born 3 april <mask> in delhi, <mask> ) is a former <mask> and one day international cricketer who represented <mask> .<SPLIT>she played a total of 13 tests and 20 odis.",Salil ankola,"<mask> <mask> ( born 3 april <mask> in delhi, <mask> ) is a former <mask> and one day international cricketer who represented <mask> .<SPLIT><mask> played a total of 13 <mask> and 20 odis.",-9.705678939819336,-3.3158187866210938,22,62950,22,46,Successful
23,Peter d. clark -lrb- politician -rrb-,"<mask> l. <mask> served on <mask> city council from 1994 through 2000.<SPLIT>born in dublin, republic of ireland, he immigrated to canada in 1957.<SPLIT>he received a ba from queen's university in english and history and received a b.ed from the university of toronto.<SPLIT>he then worked with the canadian institute of mining and metallurgy.<SPLIT>he would later move to ottawa after living in toronto and southeast asia, where he would teach high school.<SPLIT>he then worked on parliament hill and then became a self-employed consultant specializing in social and",Nora owen,"<mask> l. <mask> served on <mask> <mask> <mask> from 1994 through 2000.<SPLIT>born in dublin, republic of ireland, he immigrated to canada in 1957.<SPLIT>he received a ba from queen's university in english and history and received a b.ed from the university of toronto.<SPLIT>he then worked with the canadian institute of mining and metallurgy.<SPLIT>he would later move to <mask> after living in toronto and southeast asia, where he would teach high school.<SPLIT>he then worked on parliament hill and then became a self-employed consultant specializing in social and",-6.485358715057373,-2.8899731636047363,73220,1070,23,172,Successful
24,Olcay çakır,"<mask> akr ( born 13 july 1993 in <mask> , zmir, <mask> ) is a <mask> <mask> player.<SPLIT>the young national plays for fenerbahe stanbul as both guard ( 1-2 ) position. <mask> akr is 182 cm tall and weighs 60 kg.<SPLIT>she is playing for fenerbahe since 2005 in youth level and since 2010 in senior level.<SPLIT>akr was selected 27th overall in the 2013 <mask> draft's round 3 by the new york <mask> .",Michal áč,"<mask> akr ( born 13 july <mask> in <mask> , zmir, <mask> ) is a <mask> <mask> player.<SPLIT>the young national plays for fenerbahe <mask> as both guard ( 1-2 ) position. <mask> akr is 182 cm tall and weighs 60 kg.<SPLIT><mask> is playing for fenerbahe since 2005 in youth level and since 2010 in senior level.<SPLIT>akr was selected 27th overall in the 2013 <mask> draft's round 3 by the new <mask> <mask> .",-8.291906356811523,-2.402583599090576,24,74787,24,187,Successful
25,Willie campbell,"<mask> <mask> ( <mask> january <mask> -- 30 may 1900 ) was an english amateur <mask> who played mainly as a bowler and who had two careers separated in an unusual manner by a long period out of the <mask> game.<SPLIT>he was born at <mask> , <mask> , scotland, and died at <mask> , <mask> , england.",Qasim sheikh,"<mask> <mask> ( <mask> january <mask> -- 30 may <mask> ) was an english amateur <mask> who played mainly as a bowler and who had two careers separated in an unusual manner by a long period out of the <mask> game.<SPLIT>he was born at <mask> , <mask> , scotland, and died at <mask> , <mask> , england.",-7.350135803222656,-1.7355754375457764,42012,144795,25,36,Successful
26,Paul blake,<mask> <mask> ( born 8 august <mask> ) is an english actor.,Paul blake,<mask> <mask> ( born 8 august <mask> ) is an english actor.,-3.825347900390625,-3.825347900390625,96960,96960,26,1,Skipped
27,Vetrimaaran,"<mask> <mask> , also known as `` thaimann <mask> '', is a tamil film actor, director, producer and lyricist in the tamil film industry.<SPLIT>he began his career in his early ages as a producer for the tamil film anbudan, starred arun vijay, meena, rambha ( actress ) in the main was released in the year 2000.<SPLIT>then he worked on the most successful tamil music album",Vetrimaaran,"<mask> <mask> , also known as `` thaimann <mask> '', is a tamil film actor, director, producer and lyricist in the tamil film industry.<SPLIT>he began his career in his early ages as a producer for the tamil film anbudan, starred arun vijay, meena, rambha ( actress ) in the main was released in the year 2000.<SPLIT>then he worked on the most successful tamil music album",-0.5677257776260376,-0.5677257776260376,14020,14020,27,1,Skipped
28,Tjalie robinson,"<mask> <mask> ( 5 september <mask> -- 5 february <mask> ) was a dutch painter. <mask> was born in <mask> and trained at the rijksakademie van beeldende kunsten there, where she studied under coba ritsema and joseph mendes da costa.<SPLIT>she was a member of arti et amicitiae and the pulchri studio and is considered one of the amsterdamse joffers. <mask> died in <mask> and was buried in zorgvlied.",Jan toorop,"<mask> <mask> ( 5 <mask> <mask> -- 5 <mask> <mask> ) was a dutch painter. <mask> was <mask> in <mask> and <mask> at the rijksakademie van <mask> kunsten there, where <mask> studied under coba ritsema and joseph mendes da costa.<SPLIT><mask> was a member of arti et amicitiae and the pulchri studio and is considered one of the amsterdamse joffers. <mask> died in <mask> and was buried in zorgvlied.",-7.689101219177246,-4.688671588897705,33739,38069,28,244,Successful
29,Jeremy hotz,"<mask> <mask> ( born may 31, 1963 ) is a canadian actor and <mask> comedian.<SPLIT>he has appeared on `` comedy central presents '', the just for laughs comedy festival, the `` late show with david letterman '', and `` the tonight show with jay leno ''.<SPLIT>he has also worked as a staff writer for paramount's `` the jon stewart show '' and has appeared in various american and canadian motion pictures including : `` my favorite martian '', '' '', and `` married life ''.",Etta may,"<mask> <mask> ( born may <mask>, <mask> ) is a <mask> actor and <mask> comedian.<SPLIT>he has appeared on `` comedy central presents '', the just for laughs comedy festival, the `` late show with david letterman '', and `` the tonight show with jay leno ''.<SPLIT>he has also worked as a staff writer for paramount's `` the jon stewart show '' and has appeared in various american and <mask> motion pictures including : `` my favorite martian '', '' '', and `` married life ''.",-9.173728942871094,-2.7371020317077637,29,73523,29,145,Successful
30,Sir '' ` robert cooper '' ',"<mask> <mask> <mask> <mask> hugh <mask> cb ( born 18 september 1947 ) is a former royal <mask> <mask> <mask> who became head of the british defence staff in washington, d.c.",Sir hugh cunningham,"<mask> <mask> <mask> <mask> hugh <mask> cb ( born 18 september <mask> ) is a former royal <mask> <mask> <mask> who became head of the british defence staff in washington, d.c.",-7.252119064331055,-4.449392318725586,29087,57712,30,23,Successful
31,Bernardo sassetti,"<mask> da costa <mask> pais ( 24 june 1970 -- 10 may 2012 ) was a portuguese <mask> pianist and film <mask> . <mask> was born in <mask> .<SPLIT>he was a great-grandson of sidnio pais, president of the first republic.<SPLIT>he initially played guitar, then began studying <mask> and <mask> theory at age nine.<SPLIT>he became interested in <mask> after hearing bill evans.<SPLIT>by the late <mask> , he was backing visiting musicians and teaching <mask> <mask> in <mask> ( and, later, taught throughout other lusophonic areas",João costa menezes,"<mask> da costa <mask> pais ( 24 june <mask> -- 10 may 2012 ) was a <mask> <mask> <mask> and film <mask> . <mask> was born in <mask> .<SPLIT>he was a great-grandson of sidnio pais, president of the first republic.<SPLIT>he initially played guitar, then began studying <mask> and <mask> theory at age nine.<SPLIT>he became interested in <mask> after hearing bill evans.<SPLIT>by the late <mask> , he was backing visiting musicians and teaching <mask> <mask> in <mask> ( and, later, taught throughout other lusophonic areas",-9.560009956359863,-2.9778084754943848,31,78141,31,157,Successful
