,original_person,original_text,perturbed_person,perturbed_text,original_score,perturbed_score,original_output,perturbed_output,ground_truth_output,num_queries,result_type
725,Dick conroy,<mask> `` <mask> '' <mask> ( born 11 july 1927 ) is an english former footballer who made 26 appearances in the football league playing as a centre half for <mask> in the 1950s.<SPLIT>he also played non-league football for south shields.,John shield,<mask> `` <mask> '' <mask> ( born 11 july 1927 ) is an english former footballer who made 26 appearances in the football league playing as a <mask> <mask> for <mask> in the <mask>.<SPLIT>he also played non-league football for <mask> shields.,-7.496234893798828,-3.800950527191162,107913,9426,725,115,Successful
726,Victor turner,"sir <mask> <mask> charles <mask> , csi, cie, mbe, si ( <mask> -- 1974 ) was an english-pakistani <mask> service officer, statistician and <mask> , and one of the founding fathers of the <mask> service of <mask> , serving as the first <mask> secretary of <mask> in the <mask> of prime minister <mask> <mask> <mask> , as well as <mask> of the <mask> <mask> of <mask> from 14 august <mask> until 1 february <mask> . <mask> charles <mask> -- in <mask> , when he was knighted, he added the name ` <mask>",Sir paul mccartney,"sir <mask> <mask> <mask> <mask> , csi, cie, mbe, si ( <mask> -- <mask> ) was an english-pakistani <mask> service officer, <mask> and <mask> , and one of the founding fathers of the <mask> service of <mask> , serving as the first <mask> <mask> of <mask> in the <mask> of prime minister <mask> <mask> <mask> , as well as <mask> of the <mask> <mask> of <mask> from 14 august <mask> until 1 february <mask> . <mask> <mask> <mask> -- in <mask> , when he was knighted, he added the name ` <mask>",-9.566393852233887,-4.188803672790527,726,70839,726,147,Successful
727,Jeff york,"<mask> york <mask> <mask> ( january 22, <mask> -- december 15, 2007 ) was a <mask> actor dubbed `` the <mask> <mask> <mask> of <mask> <mask> ''.<SPLIT>he was the son of the late film actors <mask> <mask> and csar <mask> , and brother of actress beverly <mask> .",Jeff york,"<mask> york <mask> <mask> ( january 22, <mask> -- december 15, <mask> ) was a <mask> actor dubbed `` the <mask> <mask> <mask> of <mask> <mask> ''.<SPLIT>he was the son of the late film actors <mask> <mask> and csar <mask> , and brother of actress beverly <mask> .",-5.138751983642578,-3.617969512939453,111945,111945,727,23,Successful
728,Trevis simpson,"<mask> jemar <mask> ( born september 5, 1991 ) is an american professional basketball player who currently plays for <mask> <mask> of the greek <mask> league.<SPLIT>he played college basketball at the university of north carolina at <mask> .",Jahmar young,"<mask> jemar <mask> ( born september 5, <mask> ) is an american professional basketball player who currently plays for <mask> <mask> of the <mask> <mask> league.<SPLIT>he played college basketball at the university of north carolina at <mask> .",-7.549189567565918,-3.8863706588745117,728,47464,728,52,Successful
729,Bernard yago,"bernard <mask> ( july 1916 -- october 5, 1997 ) was a cte d'ivoire cardinal of the roman catholic church.<SPLIT>he served as archbishop of <mask> from 1960 to 1994, and was elevated to the cardinalate in 1983.",Benedetto aloisi masella,"<mask> <mask> ( july <mask> -- october 5, <mask> ) was a cte <mask> cardinal of the roman <mask> church.<SPLIT>he served as archbishop of <mask> from 1960 to 1994, and was elevated to the cardinalate in 1983.",-12.248004913330078,-4.8467698097229,729,96701,729,136,Successful
730,John shabaz,"<mask> <mask> scob, ( 24 november 1931 -- 1 december 2012 ) was president of the constitutional court of <mask> <mask> from 1994 to 2001 and <mask> <mask> of south <mask> from 2001 to 2005. <mask> was a member of the defence team in the rivonia trial of 1963.",John shabaz,"<mask> <mask> scob, ( 24 november 1931 -- 1 december 2012 ) was president of the constitutional court of <mask> <mask> from 1994 to 2001 and <mask> <mask> of <mask> <mask> from 2001 to 2005. <mask> was a member of the defence team in the rivonia trial of 1963.",-3.916876792907715,-1.8345186710357666,100512,100512,730,29,Successful
731,Serhiy zahynaylov,<mask> sergeyevich <mask> ( ; born 21 may 1991 ) is a russian professional football player.<SPLIT>he plays for <mask> <mask> .<SPLIT>he is the younger brother of yevgeny <mask> .,Sergey sergeyev,<mask> sergeyevich <mask> ( ; born 21 may <mask> ) is a russian professional football player.<SPLIT>he plays for <mask> <mask> .<SPLIT>he is the younger brother of yevgeny <mask> .,-6.006205081939697,-2.67702054977417,30004,118807,731,20,Successful
732,Norbert röttgen,"<mask> rttgen ( born 2 july 1965 ) is a german politician of the christian democratic union.<SPLIT>he was <mask> minister for <mask> , <mask> <mask> and <mask> <mask> from 2009 to <mask> .",Jirō kawasaki,"<mask> <mask> ( born 2 july <mask> ) is a <mask> politician of the christian democratic union.<SPLIT>he was <mask> minister for <mask> , <mask> <mask> and <mask> <mask> from 2009 to <mask> .",-12.78010368347168,-1.274303913116455,732,1367,732,64,Successful
733,Lucy allan,"<mask> <mask> ( born 30 june 1991 ) is an australian football ( soccer ) player, who currently plays for <mask> united fc in the australian w-league.",Ken tokura,"<mask> <mask> ( born 30 june <mask> ) is an <mask> football ( soccer ) player, who currently plays for <mask> <mask> fc in the <mask> w-league.",-10.651185035705566,-2.0902323722839355,733,126795,733,55,Successful
734,Jim irvine,"<mask> james <mask> <mask> ( born 19 march <mask> ) is a scottish former professional footballer.<SPLIT>beginning his career at birmingham city, <mask> found his chances limited and george swindin signed him for a moderate fee to play for <mask> city in march <mask> .<SPLIT>playing as a <mask> , he often showed flashes of brilliance, including scoring one and supplying four other goals during a 5-3 win over middlesbrough in may 1966.<SPLIT>he eventually left the club in <mask> to sign for <mask> . <mask> later went onto play in south africa before retiring.",James ward,"<mask> james <mask> <mask> ( born 19 march <mask> ) is a <mask> former professional footballer.<SPLIT>beginning his career at birmingham city, <mask> found his chances limited and george swindin signed him for a moderate fee to play for <mask> city in march <mask> .<SPLIT>playing as a <mask> , he often showed flashes of brilliance, including scoring one and supplying four other goals during a 5-3 win over middlesbrough in may 1966.<SPLIT>he eventually left the club in <mask> to sign for <mask> . <mask> later went onto play in south africa before retiring.",-6.32232666015625,-2.9094223976135254,115925,136900,734,65,Successful
735,Salil ankola,"<mask> <mask> ( born 28 february 1968 ) is an indian film actress from <mask> , who has worked in various bollywood and marathi movies as the leading lady.<SPLIT>during the 1990s, she was the most popular actress in marathi cinema. <mask> is regarded as one of the most successful and influential marathi movie actresses of all time.",Raadhu,"<mask> <mask> ( born 28 <mask> <mask> ) is an indian film actress from <mask> , who <mask> worked in various bollywood and marathi movies as the leading lady.<SPLIT>during the <mask>, she was the most popular actress in marathi cinema. <mask> is regarded as one of the most successful and influential marathi movie actresses of all time.",-7.12651252746582,-3.804349899291992,62950,54913,735,151,Successful
736,The 88,"the <mask> were a four piece alternative rock group from los angeles, california headed by guitarist and singer <mask> <mask> .<SPLIT>they were signed to eyeball records and released one album as a three piece for the label, `` songs on radio idaho '', before signing with scott weiland's label <mask> records.<SPLIT>they opened for the supergroup velvet revolver at the aladdin hotel in the summer of 2005 and also played the volcom stage on the 2007 warped tour.<SPLIT>in 2005, the <mask> contributed two songs `` promised land '' and `` dancing on the perimeter '' to the film `` be",City -lrb- comma -rrb- state,"<mask> <mask> were a four piece alternative rock group from los angeles, california headed by guitarist and singer <mask> <mask> .<SPLIT>they were signed to eyeball records and released one album as a three piece for <mask> label, `` songs on radio idaho '', before signing with scott weiland's label <mask> records.<SPLIT>they opened for <mask> supergroup velvet revolver at <mask> aladdin hotel in <mask> summer of 2005 and also played <mask> volcom stage on <mask> 2007 warped tour.<SPLIT>in 2005, <mask> <mask> contributed two songs `` promised land '' and `` dancing on <mask> perimeter '' to <mask> film `` be",-8.814140319824219,-3.082221031188965,144115,133358,736,65,Successful
737,Mario francisco guillén guillén,<mask> <mask> guilln <mask> ( born 5 february <mask> ) is a <mask> politician affiliated to the party of the democratic revolution.<SPLIT>as of 2014 she served as deputy of the lix legislature of the <mask> congress representing michoacn.,Michihiro ishibashi,<mask> <mask> <mask> <mask> ( born 5 february <mask> ) is a <mask> politician affiliated to the party of the democratic revolution.<SPLIT>as of 2014 she served as deputy of the lix legislature of the <mask> congress representing michoacn.,-7.373090744018555,-3.0904293060302734,25208,36791,737,25,Successful
738,George blackwood,<mask> <mask> ( born 4 june 1997 ) is an australian footballer who plays as a striker for <mask> <mask> in the a-league.,Yōsuke kobayashi,<mask> <mask> ( born 4 june <mask> ) is an <mask> footballer who plays as a striker for <mask> <mask> in the a-league.,-10.64096450805664,-1.7017524242401123,738,54752,738,34,Successful
739,Henry smith,"<mask> <mask> ( february 4, <mask> - june 27, 1916 ) was an american politician, who was the thirteenth <mask> of <mask> from <mask> to <mask> . <mask> was born in michigan and left home at the age of 15 to start work as a printer.<SPLIT>he enlisted in the second michigan infantry in 1861, and after completing his three months of service decided not to re-enlist and moved to iowa with his first wife, <mask> .<SPLIT>they later homesteaded in the dakota territory, where <mask> is believed to have",List of governors of iowa,"<mask> <mask> ( february 4, <mask> - june 27, <mask> ) was an american politician, who was the thirteenth <mask> of <mask> from <mask> to <mask> . <mask> was born in michigan and left home at the age of 15 to start work as a printer.<SPLIT>he enlisted in the second michigan infantry in 1861, and after completing his three months of service decided not to re-enlist and moved to iowa with his first wife, <mask> .<SPLIT>they later homesteaded in the dakota territory, where <mask> is believed to have",-4.660222053527832,-1.513646125793457,79834,82229,739,58,Successful
740,Silje norendal,"silje <mask> ( born 1 september 1993 ) is a norwegian snowboarder.<SPLIT>she competes in halfpipe, slopestyle and boardercross.<SPLIT>her local club is kongsberg if.<SPLIT>she won gold in women's slopestyle in winter x games europe in tignes in 2013.<SPLIT>in january 2014, she won women's slopestyle in winter x games in aspen, colorado.<SPLIT>in the 2014 winter olympics in sochi, russia, <mask> finished in fourth place in the slopestyle semifinals",Junko hoshino,"<mask> <mask> ( born 1 september 1993 ) is a <mask> <mask>.<SPLIT>she competes in <mask>, slopestyle and <mask>.<SPLIT>her local club is kongsberg if.<SPLIT>she won gold in women's slopestyle in winter x games europe in tignes in 2013.<SPLIT>in january 2014, she won women's slopestyle in winter x games in aspen, colorado.<SPLIT>in the 2014 winter olympics in sochi, russia, <mask> finished in fourth place in the slopestyle semifinals",-11.944576263427734,-3.8502769470214844,740,130051,740,201,Successful
741,Raimi ayo hassan,"<mask> <mask> <mask> ( born 12 august 1984 at lagos, <mask> ) is a nigerian footballer who is currently with kuala lumpur fa.<SPLIT>a defender, <mask> <mask> <mask> played for several clubs including kaduna united f.c., <mask> ( <mask> ), <mask> <mask> , <mask> <mask> <mask> fc and <mask> <mask> in macau.<SPLIT>in december 2011, <mask> signed a six-month contract with kuala lumpur fa in the malaysia super league however, following the close",G. mahathevan,"<mask> <mask> <mask> ( born 12 august <mask> at <mask>, <mask> ) is a <mask> footballer who is currently with kuala lumpur fa.<SPLIT>a defender, <mask> <mask> <mask> played for several clubs including kaduna united f.c., <mask> ( <mask> ), <mask> <mask> , <mask> <mask> <mask> fc and <mask> <mask> in macau.<SPLIT>in december 2011, <mask> signed a six-month contract with kuala lumpur fa in the malaysia super league however, following the close",-8.321362495422363,-2.3593032360076904,741,75992,741,124,Successful
742,'' ` john deery '' ',"<mask> <mask> <mask> is a multi award winning english writer and director with a background in post production and visual effects who resides in los angeles, california.<SPLIT>he started his career in music during the early 90's working as a session musician and freelance tutor.<SPLIT>he was introduced to film in 1997 when he wrote and directed a short. <mask> <mask> work was nominated for two `` royal television society awards '' in 2009.",'' ` john deery '' ',"<mask> <mask> <mask> is a multi award winning english writer and director with a background in post production and visual effects who resides in los angeles, california.<SPLIT>he started his career in music during the early 90's working as a session musician and freelance tutor.<SPLIT>he was introduced to film in 1997 when he wrote and directed a short. <mask> <mask> work was nominated for two `` royal television society awards '' in 2009.",-4.846625328063965,-4.846625328063965,108877,108877,742,1,Skipped
743,Taka hirose,"<mask> <mask> <mask> ( december 25, 1967 -- july 29, <mask> ) was the former bass player of the california <mask> rock band <mask> who grew up in <mask> beach, california. <mask> , who had been in rehabilitation for alcoholism and suffered from depression, died of a self-inflicted gunshot wound at the age of 28.<SPLIT>the band decided to continue making music after <mask> death, and brought in bass guitarist randy bradbury from one hit wonder.<SPLIT>the band then set about writing an album of new material which was made",Frank navetta,"<mask> <mask> <mask> ( december 25, <mask> -- july 29, <mask> ) was the former <mask> player of the <mask> <mask> rock band <mask> who grew up in <mask> beach, <mask>. <mask> , who had been in rehabilitation for alcoholism and suffered from depression, died of a self-inflicted gunshot wound at the age of 28.<SPLIT>the band decided to continue making music after <mask> death, and brought in <mask> guitarist randy bradbury from one hit wonder.<SPLIT>the band then set about writing an album of new material which was made",-8.32648754119873,-4.186337471008301,91561,137291,743,178,Successful
744,Joan brosnan walsh,"<mask> <mask> <mask> ( 29 june <mask> -- 20 december 2009 ) was a veteran irish actress, best known for her long-running role as the character mags kelly on the irish soap opera `` fair city '', a role she had played for almost twenty years, from 18 september 1989 until her final screen appearance, 11 january <mask> . <mask> <mask> appeared in a number of films such as `` the boxer '' and `` fatal inheritance ''.<SPLIT>she also worked as a costume designer.<SPLIT>she first worked for acnielsen and aer lingus, the latter",Gyda hansen,"<mask> <mask> <mask> ( 29 june <mask> -- 20 december <mask> ) was a veteran <mask> actress, best known for her long-running role as the character mags kelly on the <mask> soap opera `` fair city '', a role she had played for almost twenty years, from 18 september 1989 until her final screen appearance, 11 january <mask> . <mask> <mask> appeared in a number of films such as `` the boxer '' and `` fatal inheritance ''.<SPLIT>she also worked as a costume designer.<SPLIT>she first worked for acnielsen and aer lingus, the latter",-9.40461254119873,-3.4908132553100586,744,74026,744,122,Successful
745,Donna hilley,"<mask> `` <mask> '' <mask> ( june 17, <mask> -- august 21, <mask> ) was an american <mask> <mask> , and <mask> label owner who released early records by <mask> <mask> and the <mask> .",Mista,"<mask> `` <mask> '' <mask> ( june 17, <mask> -- august 21, <mask> ) was an american <mask> <mask> , and <mask> <mask> <mask> who released early records by <mask> <mask> and the <mask> .",-5.8607635498046875,-2.9339981079101562,19491,113122,745,32,Successful
746,Attila farkas,<mask> <mask> ( born 5 october 1978 ) is a hungarian football player who currently plays for nyregyhza <mask> .,Grigol dolidze,<mask> <mask> ( born 5 october <mask> ) is a <mask> football player who currently plays for nyregyhza <mask> .,-10.0361328125,-3.187958240509033,746,70867,746,28,Successful
747,Opan sat,"<mask> <mask> is a russian freestyle wrestler who won the gold medals at the 2010, 2011 and 2013 fila wrestling european championships.<SPLIT>he first won the title in 2010 and repeated his success in 2011 and 2013.<SPLIT>in the 2013 european wrestling championships he won the title by defeating vladimir dubov of bulgaria 1-0, 2-1, in two straight periods and thus won his third title.",Junko hoshino,"<mask> <mask> is a <mask> freestyle <mask> who won the gold medals at the 2010, 2011 and 2013 fila <mask> european championships.<SPLIT>he first won the title in 2010 and repeated his success in 2011 and 2013.<SPLIT>in the 2013 european <mask> championships he won the title by defeating <mask> dubov of bulgaria 1-0, 2-1, in two straight periods and thus won his third title.",-10.32850456237793,-4.013309478759766,747,130051,747,151,Successful
748,Deaf smith,"<mask> <mask> . <mask> ( august 16, <mask> - january 20, 1837 ) was a pioneer farmer, stock-raiser, and <mask> in <mask> , who served as a <mask> in the war of <mask> and subsequently founded the <mask> towns of <mask> and <mask> , and who also played a prominent role in establishing fulton and mason counties in that state.",List of signers of the georgia ordinance of secession,"<mask> <mask> . <mask> ( august 16, <mask> - january 20, <mask> ) was a pioneer farmer, stock-raiser, and <mask> in <mask> , who served as a <mask> in the war of <mask> and subsequently founded the <mask> towns of <mask> and <mask> , and who also played a prominent role in establishing fulton and mason counties in that state.",-7.719398498535156,-2.3997132778167725,104764,30767,748,32,Successful
749,Max dennis,"<mask> <mask> . <mask> ( september 21, <mask> -- may 14, 1991 ) was a republican member of the <mask> state senate, serving from 1969 to 1982.<SPLIT>he also served in the <mask> house of representatives.<SPLIT>he founded farmers pride in 1939, selling chickens in ohio and <mask> .<SPLIT>he sold the business in the 1980s.<SPLIT>a bridge in bethel township, <mask> county is named the senator <mask> <mask> . <mask> bridge.",Max dennis,"<mask> <mask> . <mask> ( september 21, <mask> -- may 14, <mask> ) was a republican member of the <mask> state senate, serving from 1969 to 1982.<SPLIT>he also served in the <mask> house of representatives.<SPLIT>he founded farmers pride in 1939, selling chickens in ohio and <mask> .<SPLIT>he sold the business in the 1980s.<SPLIT>a bridge in bethel township, <mask> county is named the senator <mask> <mask> . <mask> bridge.",-7.118017196655273,-3.9110450744628906,71704,71704,749,43,Successful
750,Brodie atkinson,"<mask> `` frankie '' <mask> ( born 5 october 1972 ) is an australian rules footballer in the australian football league ( afl ).<SPLIT>picked up by the saints as an impressive 16-year-old, in 1990 <mask> won the st <mask> under 19's best and fairest and remained on the list for the 1991 season, before he was delisted at the end of the year.<SPLIT>he was picked up in the 1992 pre-season draft at pick # 49 to resurrect his career, and debuted late that season ( receiving limited game time in his only game for",Luke donald,"<mask> `` frankie '' <mask> ( born 5 october <mask> ) is an australian rules footballer in the australian football league ( afl ).<SPLIT>picked up by the <mask> as an impressive 16-year-old, in 1990 <mask> won the <mask> <mask> under 19's best and fairest and remained on the list for the 1991 season, before he was delisted at the end of the year.<SPLIT>he was picked up in the 1992 pre-season draft at pick # 49 to resurrect his career, and debuted late that season ( receiving limited game time in his only game for",-8.654178619384766,-4.377310752868652,68121,129966,750,181,Successful
751,Bill wilson,"<mask> <mask> ( born 1978 ) also known as <mask> <mask> carrier or <mask> carrier is an award winning speaker, author and role model who is especially recognized for her work promoting youth leadership and self-esteem in young women. <mask> won the <mask> virginia <mask> <mask> title in a state pageant held in late 2001.<SPLIT>she represented virginia in the <mask> <mask> 2002 pageant broadcast live from gary, indiana in march <mask> . <mask> graduated from the ohio state university honors program with a degree in leadership studies in 2000.<SPLIT>she competed",Erica kochi,"<mask> <mask> ( born 1978 ) also known as <mask> <mask> carrier or <mask> carrier is an award winning speaker, author and role model who is especially recognized for her work promoting youth leadership and self-esteem in young women. <mask> won the <mask> <mask> <mask> <mask> title in a state pageant held in late 2001.<SPLIT>she represented <mask> in the <mask> <mask> 2002 pageant broadcast live from gary, indiana in march <mask> . <mask> graduated from the ohio state university honors program with a degree in leadership studies in 2000.<SPLIT>she competed",-4.200962066650391,-2.391289472579956,81522,46663,751,59,Successful
752,Olga zaitseva,"<mask> <mask> ( ; born 3 february 1988 ) is a russian biathlete.<SPLIT>he debuted in the <mask> world cup on 9 december 2011 in hochfilzen, austria.<SPLIT>he has won silver medal at <mask> junior world championships.",Wolfgang kindl,"<mask> <mask> ( ; born 3 february 1988 ) is a <mask> <mask>.<SPLIT>he debuted in the <mask> world cup on 9 december 2011 in hochfilzen, austria.<SPLIT>he has won silver medal at <mask> junior world championships.",-9.978976249694824,-3.376833438873291,2074,97140,752,54,Successful
753,Jack glasscock,"john wesley `` <mask> '' <mask> ( july 22, <mask> -- february 24, 1947 ) was an american <mask> in major league baseball who played for several teams from 1879 to 1895 and was the top player at his position in the 1880s during the sport's bare-handed era.<SPLIT>he led the national league in fielding percentage seven times and in assists six times, with both marks remaining league records until ozzie smith surpassed them in the 1980s ; he also led the nl in double plays four times and in putouts twice.<SPLIT>he won the 1890 batting title with a",Jimmy barrett,"<mask> wesley `` <mask> '' <mask> ( july 22, <mask> -- february 24, <mask> ) was an american <mask> in major league baseball who played for several teams from 1879 to 1895 and was the top player at his position in the 1880s during the sport's bare-handed era.<SPLIT>he led the national league in fielding percentage seven times and in assists six times, with both marks remaining league records until ozzie smith surpassed them in the 1980s ; he also led the nl in double plays four times and in putouts twice.<SPLIT>he won the 1890 batting title with a",-10.671647071838379,-4.58446741104126,753,70023,753,134,Successful
754,Don seccombe,"<mask> harold <mask> ( born 1 june 1943 ) is a former australian <mask> cricketer, one of only a handful of indigenous australians to have played <mask> cricket.<SPLIT>born one of ten children in brisbane, queensland, <mask> was a successful junior basketballer and professional welterweight boxer who won 28 of 32 fights under the name `` young rainbow '' ( derived from his preference for brighly coloured clothes ) before turning to cricket.<SPLIT>a <mask> fast bowler and <mask> batsman, <mask> started playing for sydney club bankstown before returning",Nooshin al khadeer,"<mask> <mask> <mask> ( born 1 june <mask> ) is a <mask> australian <mask> <mask>, one of only a handful of indigenous australians to have <mask> <mask> cricket.<SPLIT>born one of ten children in <mask>, <mask>, <mask> was a successful junior basketballer and professional welterweight boxer who won 28 of 32 fights under the name `` young rainbow '' ( derived from his preference for brighly coloured clothes ) before turning to cricket.<SPLIT>a <mask> fast bowler and <mask> batsman, <mask> started playing for sydney club <mask> before <mask>",-6.474269866943359,-2.462613105773926,4236,75531,754,523,Successful
