,original_person,original_text,perturbed_person,perturbed_text,original_score,perturbed_score,original_output,perturbed_output,ground_truth_output,num_queries,result_type
0,Lenny randle,"leonard shenoff randle ( born february 12 , 1949 ) is a former major league baseball player .<SPLIT>he was the first-round pick of the washington senators in the secondary phase of the june 1970 major league baseball draft , tenth overall .<SPLIT>",Jeff burroughs,"<mask> shenoff <mask> ( born february 12 , <mask> ) is a former major league baseball player .<SPLIT>he was the first-round pick of the washington senators in the secondary phase of the june 1970 major league baseball draft , tenth overall .<SPLIT>",0.010305941104888916,0.9576621055603027,0,221476,0,109,Successful
1,Philippe adnot,"philippe adnot ( born 25 august 1945 in rhèges ) is a member of the senate of france .<SPLIT>he was first elected in 1989 , and represents the aube department .<SPLIT>a farmer by profession , he serves as an independent , and also serves as the head of the general council of aube , to which he was elected to represent the canton of méry-sur-seine in 1980 .<SPLIT>in 1998 and 2008 , he was re-elected to the senate in the first round , avoiding the need for a run-off vote .<SPLIT>having contributed to the creation of the university of technology of troyes , in 1998 he was made the first vice president of the university board , of which he is currently the president .<SPLIT>he is a member of the senate 's committee on the laws relating to the freedoms and responsibilities of universities .<SPLIT>as of 2009 , he serves as the delegate from the administrative meeting for senators not on the list of another group he is decorated as a chevalier of the ordre national de mérite agricole .<SPLIT>",Roland courteau,"<mask> <mask> ( born 25 august <mask> in rhèges ) is a member of the senate of france .<SPLIT>he was first elected in 1989 , and represents the aube department .<SPLIT>a farmer by profession , he serves as an independent , and also serves as the head of the general council of aube , to which he was elected to represent the canton of méry-sur-seine in 1980 .<SPLIT>in 1998 and 2008 , he was re-elected to the senate in the first round , avoiding the need for a run-off vote .<SPLIT>having contributed to the creation of the university of technology of troyes , in 1998 he was made the first vice president of the university board , of which he is currently the president .<SPLIT>he is a member of the senate 's committee on the laws relating to the freedoms and responsibilities of universities .<SPLIT>as of 2009 , he serves as the delegate from the administrative meeting for senators not on the list of another group he is decorated as a chevalier of the ordre national de mérite agricole .<SPLIT>",0.08282530307769775,0.8862531185150146,1,627677,1,382,Successful
2,Miroslav popov,miroslav popov ( born 14 june 1995 in dvůr králové nad labem ) is a czech grand prix motorcycle racer .<SPLIT>he currently races in the fim cev moto2 championship for montaze broz racing team aboard a suter .<SPLIT>,Michal prášek,<mask> <mask> ( born 14 june <mask> in <mask> králové nad labem ) is a czech grand prix motorcycle racer .<SPLIT>he currently races in the fim cev moto2 championship for montaze broz racing team aboard a suter .<SPLIT>,0.022437095642089844,0.610539436340332,2,456329,2,135,Successful
3,Jack reynolds,"john `` jack '' reynolds ( 21 february 1869 -- 12 march 1917 ) was a footballer who played for , among others , west bromwich albion , aston villa and celtic .<SPLIT>as an international he played five times for ireland before it emerged that he was actually english and he subsequently played eight times for england .<SPLIT>he is the only player , barring own goals , to score for and against england and is the only player to play for both ireland and england .<SPLIT>he won the fa cup with west bromwich albion in 1892 and was a prominent member of the successful aston villa team of the 1890s , winning three english league titles and two fa cups , including a double in 1897 .<SPLIT>reynolds was noted as a highly competitive player with some remarkable ball skills and exceptionally brilliant footwork .<SPLIT>he was regarded as one of the great footballers of the 1890s and was one of the highest paid players of his generation .<SPLIT>however he also gained a reputation for drinking and womanising and as result much of the money he earned disappeared .<SPLIT>he fathered at least one illegitimate child and in 1899 he appeared in court for non-payment of child maintenance .<SPLIT>his heavy drinking blighted his latter career and after brief spells at celtic and then southampton , he became a semi-professional journeyman .<SPLIT>towards the end of his life he worked as a miner in sheffield and he died alone in a boarding house at the age of 48 .<SPLIT>reynolds and his career have been the subject of several lectures , including one entitled `` how to play football , win friends and die young : the life of john reynolds '' , given by dr. neal garnham at the university of ulster .<SPLIT>",John devey,"john <mask> jack '' <mask> ( 21 february <mask> -- 12 march <mask> ) was a footballer who played for , among others , west bromwich albion , aston villa and celtic .<SPLIT>as an international he played five times for ireland before it emerged that he was actually english and he subsequently played eight times for england .<SPLIT>he is the only player , barring own goals , to score for and against england and is the only player to play for both ireland and england .<SPLIT>he won the fa cup with west bromwich albion in <mask> and was a prominent member of the successful aston villa team of the 1890s , winning three english league titles and two fa cups , including a double in 1897 .<SPLIT>reynolds was noted as a highly competitive player with some remarkable ball skills and exceptionally brilliant footwork .<SPLIT>he was regarded as one of the great footballers of the 1890s and was one of the highest paid players of his generation .<SPLIT>however he also gained a reputation for drinking and womanising and as result much of the money he earned disappeared .<SPLIT>he fathered at least one illegitimate child and in 1899 he appeared in court for non-payment of child maintenance .<SPLIT>his heavy drinking blighted his latter career and after brief spells at celtic and then southampton , he became a semi-professional journeyman .<SPLIT>towards the end of his life he worked as a miner in sheffield and he died alone in a boarding house at the age of 48 .<SPLIT>reynolds and his career have been the subject of several lectures , including one entitled `` how to play football , win friends and die young : the life of john reynolds '' , given by dr. neal garnham at the university of ulster .<SPLIT>",0.020705878734588623,0.8947628736495972,3,382939,3,631,Successful
4,Akoo nana,"william ato ankrah , ( born 7th july 1979 ) better known by his stage name akoo nana is a hiplife musician from ghana .<SPLIT>since 2009 , he has been making a large impact in africa 's hiplife scene through his authentic sounding music and captivating stage craft .<SPLIT>",Ben zabo,"<mask> <mask> <mask> , ( born 7th <mask> <mask> ) better known by his stage name <mask> <mask> is a hiplife musician from <mask> .<SPLIT>since <mask> , he has been <mask> a large <mask> in africa 's hiplife scene <mask> <mask> authentic sounding music and <mask> stage craft .<SPLIT>",0.026445508003234863,0.8903688788414001,4,520062,4,526,Successful
5,Teoctist,"teoctist ( , born toader arăpașu ; february 7 , 1915 -- july 30 , 2007 ) was the patriarch of the romanian orthodox church from 1986 to 2007 .<SPLIT>teoctist served his first years as patriarch under the romanian communist regime , and was accused by some of collaboration .<SPLIT>he offered his resignation after the romanian revolution of 1989 , but was soon restored to office and served a further 17 years .<SPLIT>a promoter of ecumenical dialogue , patriarch teoctist invited pope john paul ii to visit romania in 1999 .<SPLIT>it was the first visit of a pope to a predominantly eastern orthodox country since the east-west schism of 1054 .<SPLIT>",Joel teitelbaum,"teoctist ( , <mask> <mask> <mask> ; february 7 , <mask> -- july 30 , <mask> ) was <mask> <mask> <mask> the romanian <mask> <mask> from <mask> to <mask> .<SPLIT>teoctist served <mask> first <mask> <mask> <mask> <mask> the romanian <mask> <mask> , <mask> <mask> <mask> <mask> <mask> of collaboration .<SPLIT>he <mask> <mask> <mask> <mask> the romanian revolution of <mask> , but was <mask> <mask> to <mask> and served <mask> further <mask> <mask> .<SPLIT>a <mask> <mask> <mask> <mask> , <mask> teoctist invited <mask> john <mask> <mask> to visit romania <mask> <mask> .<SPLIT>it was the <mask> <mask> of a <mask> to <mask> predominantly eastern orthodox country since the east-west schism of 1054 .<SPLIT>",0.13634204864501953,0.9873015284538269,5,510277,5,3725,Successful
6,Dillon sheppard,dillon sheppard ( born 27 february 1979 ) is a south african football ( soccer ) left-winger who plays for premier soccer league club bidvest wits and south africa .<SPLIT>,Katlego pule,<mask> <mask> ( born 27 february <mask> ) is a south african football ( soccer ) left-winger who plays for premier soccer league club bidvest wits and south africa .<SPLIT>,0.01806420087814331,0.8154393434524536,6,594630,6,73,Successful
7,Giuliana zevallos,"giuliana zevallos roncagliolo ( born in lima , peru ) is a beauty queen who was crowned miss continente americano 2010 on september 18 , 2010 , becoming that pageant 's very first titleholder from her country .<SPLIT>prior to winning miss continente americano , she was miss earth perú 2008 and miss perú 2010 , and represented her country in both miss earth 2008 and miss universe 2010 .<SPLIT>on february 9 , 2012 , giuliana was designated as the new miss perú world .<SPLIT>she represented her country in the miss world 2012 pageant , held in ordos , inner mongolia .<SPLIT>",Alexandra liao,"<mask> <mask> <mask> ( born in lima , peru ) is a beauty queen who was crowned miss continente americano 2010 on september 18 , 2010 , becoming that pageant 's very first titleholder from her country .<SPLIT>prior to winning miss continente americano , she was miss <mask> perú 2008 and miss perú 2010 , and represented her country in both miss <mask> 2008 and miss universe 2010 .<SPLIT>on february <mask> , <mask> , giuliana was designated as the new <mask> perú world .<SPLIT><mask> represented her country in the miss world 2012 pageant , held in ordos , inner mongolia .<SPLIT>",0.027176082134246826,0.8435739874839783,7,320731,7,766,Successful
8,Renato campos,"renato campos ( born september 5 , 1980 ) is a retired angolan football player .<SPLIT>he has played for angola national team .<SPLIT>",Jacinto pereira,"<mask> <mask> ( born september 5 , <mask> ) is a retired angolan football player .<SPLIT>he has played for angola national team .<SPLIT>",0.02470940351486206,0.9890208840370178,8,601929,8,55,Successful
9,Sir william laird clowes,"sir william laird clowes ( 1 february 1856 -- 14 august 1905 ) was a british journalist and historian whose principal work was `` the royal navy , a history from the earliest times to 1900 '' , a text that is still in print .<SPLIT>he also wrote numerous technical pieces on naval technology and strategy and was also noted for his articles concerning racial politics in the southern united states .<SPLIT>despite having trained as a lawyer , clowes had always preferred literature and writing , publishing his first work in 1876 and becoming a full-time journalist in 1879 .<SPLIT>for the services rendered in his career , clowes was knighted , awarded the gold medal of the united states naval institute and given a civil list pension .<SPLIT>he died in sussex in 1905 after years of ill-health .<SPLIT>",William charles chamberlain,"<mask> william <mask> <mask> ( 1 <mask> <mask> -- 14 august <mask> ) was <mask> <mask> <mask> <mask> <mask> <mask> <mask> <mask> <mask> <mask> the <mask> navy , <mask> <mask> <mask> the <mask> <mask> to <mask> '' , a <mask> that is still <mask> <mask> .<SPLIT>he <mask> wrote numerous technical <mask> on naval technology and <mask> and was also noted for his articles concerning racial politics in the <mask> united states .<SPLIT>despite <mask> <mask> as a lawyer , <mask> had always preferred <mask> <mask> <mask> , <mask> his <mask> <mask> in 1876 and <mask> <mask> full-time <mask> in 1879 .<SPLIT>for the <mask> rendered in his career , clowes was knighted , awarded the gold medal of the united states naval institute and given a civil list pension .<SPLIT>he died in sussex in 1905 after years of ill-health .<SPLIT>",0.010937511920928955,0.9739223122596741,9,545086,9,4559,Successful
10,Dan besse,"daniel vaughn ( dan ) besse ( born december 28 , 1954 ) is a graduate of unc-chapel hill school of law ( 1980 ) , an attorney , and , since 2001 , a city councilman in winston-salem , north carolina .<SPLIT>he was one of four democratic candidates in the 2008 lt. governor election for the seat vacated by beverly perdue , but came in last in the primary , which was won by walter dalton .<SPLIT>in the 2008 campaign , besse received the endorsement of the progressive democrats of north carolina and the conservation council of north carolina .<SPLIT>",Dan reicher,"daniel vaughn ( dan ) <mask> ( born december 28 , <mask> ) is a <mask> of unc-chapel <mask> school of law ( 1980 ) , an attorney , and , since 2001 , <mask> city councilman <mask> winston-salem , <mask> <mask> .<SPLIT>he was one of four democratic candidates in the <mask> lt. <mask> election for the seat vacated by beverly perdue , but came in last in the primary , which was won by walter dalton .<SPLIT>in the 2008 campaign , <mask> received the endorsement of the <mask> democrats of north carolina and the conservation council of north carolina .<SPLIT>",0.04991501569747925,0.8272342085838318,10,698046,10,955,Successful
11,Matt elliott,"matt elliott is an english folk guitarist and singer from bristol , england , who plays dark folk music .<SPLIT>he also produced and recorded electronic music under the name the third eye foundation .<SPLIT>",Chris wood,"<mask> <mask> is an english folk guitarist and singer from <mask> , england , who plays <mask> folk music .<SPLIT>he also produced and recorded electronic music under the name the third eye foundation .<SPLIT>",0.030308067798614502,0.9821287393569946,11,530409,11,119,Successful
12,Giuseppe mariani,giuseppe mariani was an italian art director .<SPLIT>he was nominated for an academy award in the category best art direction for the film `` the taming of the shrew '' .<SPLIT>,Alberto boccianti,<mask> <mask> was an italian art director .<SPLIT>he was nominated for an academy award in the category best art direction for the film `` the taming of the shrew '' .<SPLIT>,0.018985629081726074,0.8441953659057617,12,569603,12,58,Successful
13,Tang li,"tang li ( chinese : 唐莉 ; pinyin : táng lì ; born july 27 , 1982 ) is a chinese professional go player .<SPLIT>",Gu li,"<mask> li ( chinese : 唐莉 ; pinyin : <mask> lì ; born july 27 , 1982 ) is a chinese professional go player .<SPLIT>",0.02802598476409912,0.7350545525550842,13,451541,13,34,Successful
14,Peter curran,"peter curran is an irish broadcaster , writer , documentary maker and audiobook publisher .<SPLIT>he grew up in belfast , the eldest of six children .<SPLIT>after leaving school he worked on funfairs in the usa before moving to london .<SPLIT>curran worked for an interior design and building company for four years before re-training as a bbc reporter .<SPLIT>in 1992 , he began dj ` ing full-time for the london radio station bbc glr .<SPLIT>",Maurice jay,"<mask> <mask> is an irish broadcaster , writer , documentary maker and audiobook publisher .<SPLIT>he grew up in <mask> , the eldest of six children .<SPLIT>after leaving school he worked on funfairs in the usa before moving to london .<SPLIT><mask> worked for an interior design and building company for four years before re-training as a bbc reporter .<SPLIT>in 1992 , he began dj ` ing full-time for the london radio station bbc glr .<SPLIT>",0.06523030996322632,0.9978866577148438,14,129263,14,271,Successful
15,Adam saltsman,"adam saltsman , also known as adam atomic , is an american indie video game designer best known for creating the endless runner `` canabalt '' .<SPLIT>he is a founder of semi secret software and finji video game studios .<SPLIT>",Brad mcquaid,"adam <mask> , also known as adam <mask> , is an american indie video game designer best known for creating the endless runner `` <mask> '' .<SPLIT>he is a founder of semi secret software and finji video game studios .<SPLIT>",0.07762974500656128,0.8206162452697754,15,604486,15,106,Successful
16,Walter clarence henderson,"walter clarence henderson ( 28 february 1891 -- 20 september 1968 ) was a progressive conservative party member of the canadian house of commons .<SPLIT>he was born in carberry , manitoba and became a farmer by career .<SPLIT>he was elected at the cariboo riding in the 1958 general election , defeating social credit incumbent bert leboe .<SPLIT>henderson served only one term , the 24th canadian parliament , before leboe retook the riding in the 1962 election .<SPLIT>-- ><SPLIT>",Cecil morris smith,"<mask> <mask> <mask> ( 28 february <mask> -- 20 september <mask> ) was a progressive conservative party member of the canadian house of commons .<SPLIT>he was born in <mask> , manitoba and became a <mask> by career .<SPLIT>he was elected at the <mask> riding in the 1958 general election , <mask> social credit <mask> <mask> leboe .<SPLIT><mask> served only one term , the 24th canadian parliament , before leboe retook the riding in the 1962 election .<SPLIT>-- ><SPLIT>",0.008703112602233887,0.9936274290084839,16,419449,16,763,Successful
17,André salvador,andré fernando cabrita salvador ( born 4 november 1993 in portimão ) is a portuguese footballer who plays for portimonense s.c. as a midfielder .<SPLIT>,André fontes,andré <mask> <mask> <mask> ( born 4 november <mask> in <mask> ) is a portuguese footballer who plays for <mask> s.c. as a midfielder .<SPLIT>,0.014700770378112793,0.9427797198295593,17,121665,17,124,Successful
18,Ernesto inarkiev,"ernesto inarkiev ( born december 9 , 1985 in osh , kyrgyzstan ) is a russian chess grandmaster .<SPLIT>he was named after ernesto `` che '' guevara .<SPLIT>in 2006 he came third in the 59th russian chess championship superfinal .<SPLIT>in 2010 he tied for 1st -- 4th with konstantin chernyshov , lê quang liêm and evgeny bareev in the moscow open .<SPLIT>in 2015 he won `` moscow open 2015 '' with outstanding 8/9 .<SPLIT>",Evgeny alekseev,"<mask> <mask> ( born december 9 , 1985 in <mask> , <mask> ) is a russian chess grandmaster .<SPLIT>he was named after ernesto `` che '' guevara .<SPLIT>in 2006 he came third in the 59th russian chess championship superfinal .<SPLIT>in 2010 he tied for 1st -- 4th with konstantin chernyshov , lê quang liêm and evgeny bareev in the moscow open .<SPLIT>in 2015 he won `` moscow open 2015 '' with outstanding 8/9 .<SPLIT>",0.01827859878540039,0.9393811821937561,18,225774,18,259,Successful
19,Bill rigby,"william ` bill ' rigby ( 9 june 1921 - 1 june 2010 ) was a former english footballer who played as a goalkeeper .<SPLIT>he was born in chester .<SPLIT>a product of the youth system at his hometown club of chester , rigby made his only peacetime first-team appearance for the club in their first post-war match in the football league in a 4 -- 4 draw at york city on 31 august 1946 .<SPLIT>after this he was not selected again , with goalkeeping duties being passed on to george scales and jim maclaren .<SPLIT>earlier he had made appearances for the first-team during the war years , mainly during 1940 -- 41 and 1941 -- 42 while understudy to bill shortt .<SPLIT>",William fisk/e,"<mask> <mask> bill ' <mask> ( <mask> june <mask> - 1 june <mask> ) was a former english footballer who played as a goalkeeper .<SPLIT>he was born in <mask> .<SPLIT>a product of the youth system at his hometown club of <mask> , <mask> made his only <mask> first-team appearance for the club in their first <mask> match in the football league in a 4 -- 4 draw at york city on 31 august <mask> .<SPLIT>after this he was not selected again , with goalkeeping duties being passed on to george scales and jim maclaren .<SPLIT>earlier he had made appearances for the first-team during the war years , mainly during 1940 -- 41 and 1941 -- 42 while understudy to bill shortt .<SPLIT>",0.0143280029296875,0.9896966814994812,19,186983,19,1267,Successful
