,original_person,original_text,perturbed_person,perturbed_text,original_score,perturbed_score,original_output,perturbed_output,ground_truth_output,num_queries,result_type
723,Benjamin nathaniel smith,"<mask> <mask> <mask> ( march 22, <mask> -- july 4, 1999 ) was a spree killer who targeted members of <mask> and ethnic minorities in random drive-by shootings in illinois and <mask> , usa during the weekend of july 4, 1999.",James david autry,"<mask> <mask> <mask> ( march <mask>, <mask> -- <mask> <mask>, <mask> ) was a spree killer who targeted members of <mask> and ethnic minorities in random drive-by shootings in <mask> and <mask> , usa during the weekend of <mask> <mask>, <mask>.",-13.237098693847656,-8.786981582641602,723,76266,723,116,Successful
724,Catch,"catch were a british indie pop group consisting of musicians toby slater ( vocals and keyboards ), wayne murray ( bass and vocals ) and ben etchells ( guitar ).<SPLIT>the band were signed to virgin records and released two singles - `` bingo '', which reached no. 23 in the uk singles chart, and `` dive in '', which reached no. 44.<SPLIT>the band released one self-titled album, which was only issued in indonesia.<SPLIT>the album is no longer in print or available online, however various tracks have surfaced on file and video sharing websites over",Beyond,"<mask> were a <mask> <mask> pop group consisting of musicians toby slater ( vocals and keyboards ), wayne murray ( bass and vocals ) and ben etchells ( guitar ).<SPLIT>the band were signed to virgin records and released two singles - `` bingo '', which reached no. 23 in the uk singles chart, and `` dive in '', which reached no. 44.<SPLIT>the band released one self-titled album, which was only issued in indonesia.<SPLIT>the album is no longer in print or available online, however various tracks have surfaced on file and video sharing websites over",-11.41926383972168,-4.956155776977539,724,130219,724,190,Successful
725,Chris leonard,christopher `` <mask> '' <mask> ( born 11 july 1927 ) is an english former footballer who made 26 appearances in the football league playing as a centre half for darlington in the 1950s.<SPLIT>he also played non-league football for south shields.,Ken smith,<mask> `` <mask> '' <mask> ( born 11 july 1927 ) is an english former footballer who made 26 appearances in the football league playing as a centre half for darlington in the 1950s.<SPLIT>he also played non-league football for south shields.,-9.571124076843262,-8.141242027282715,725,51019,725,33,Successful
726,Victor turner,"sir <mask> alfred charles <mask> , csi, cie, mbe, si ( 1892 -- 1974 ) was an english-pakistani <mask> service officer, statistician and <mask> , and one of the founding fathers of the <mask> service of pakistan, serving as the first <mask> secretary of pakistan in the government of prime minister <mask> <mask> <mask> , as well as chairman of the <mask> <mask> of <mask> from 14 august <mask> until 1 february <mask> .<SPLIT>alfred charles <mask> -- in <mask> , when he was knighted, he added the name ` <mask>",Harold charles papworth obe,"sir <mask> <mask> charles <mask> , csi, cie, mbe, si ( <mask> -- <mask> ) was an english-pakistani <mask> service officer, statistician and <mask> , and one of the founding fathers of the <mask> service of pakistan, serving as the first <mask> secretary of pakistan in the government of prime minister <mask> <mask> <mask> , as well as chairman of the <mask> <mask> of <mask> from 14 august <mask> until 1 february <mask> .<SPLIT><mask> charles <mask> -- in <mask> , when he was knighted, he added the name ` <mask>",-14.573481559753418,-11.001993179321289,726,39930,726,127,Successful
727,Ace vergel,"<mask> york <mask> <mask> ( january 22, 1952 -- december 15, 2007 ) was a <mask> actor dubbed `` the <mask> bad <mask> of <mask> <mask> ''.<SPLIT>he was the son of the late film actors <mask> <mask> and csar <mask> , and brother of actress beverly <mask> .",Peter meaden,"<mask> <mask> <mask> <mask> ( january 22, 1952 -- <mask> <mask>, <mask> ) was a <mask> <mask> dubbed `` the <mask> bad <mask> of <mask> <mask> ''.<SPLIT>he was the son of the late film actors <mask> <mask> and <mask> <mask> , and brother of actress beverly <mask> .",-14.992477416992188,-7.533761978149414,727,55829,727,130,Successful
728,Trevis simpson,"<mask> jemar <mask> ( born september 5, 1991 ) is an american professional basketball player who currently plays for <mask> <mask> of the greek basket league.<SPLIT>he played college basketball at the university of north carolina at greensboro.",Leslie mcdonald,"<mask> jemar <mask> ( born september 5, 1991 ) is an american professional basketball player who currently plays for <mask> <mask> of the <mask> basket league.<SPLIT>he played college basketball at the university of north carolina at greensboro.",-10.071563720703125,-8.547796249389648,728,115952,728,29,Successful
729,Bernard yago,"bernard <mask> ( july 1916 -- october 5, 1997 ) was a cte d'ivoire cardinal of the roman catholic church.<SPLIT>he served as archbishop of abidjan from 1960 to 1994, and was elevated to the cardinalate in 1983.",Michelangelo celesia,"<mask> <mask> ( july 1916 -- october 5, 1997 ) was a cte <mask> cardinal of the roman catholic church.<SPLIT>he served as archbishop of <mask> from 1960 to 1994, and was elevated to the cardinalate in 1983.",-12.51382827758789,-3.8567094802856445,729,98061,729,88,Successful
730,Arthur chaskalson,"arthur <mask> scob, ( 24 november 1931 -- 1 december 2012 ) was president of the constitutional court of south africa from 1994 to 2001 and chief justice of south africa from 2001 to 2005. <mask> was a member of the defence team in the rivonia trial of 1963.",Edwin cameron,"<mask> <mask> scob, ( 24 november 1931 -- 1 december 2012 ) was president of the constitutional court of south africa from 1994 to 2001 and chief justice of south africa from 2001 to <mask>. <mask> was a member of the defence team in the rivonia trial of 1963.",-9.535511016845703,-7.889793395996094,730,65951,730,64,Successful
731,Eduard krug,<mask> sergeyevich <mask> ( ; born 21 may 1991 ) is a russian professional football player.<SPLIT>he plays for fc <mask> .<SPLIT>he is the younger brother of yevgeny <mask> .,Vladislav tselovalnikov,<mask> <mask> <mask> ( ; born 21 may 1991 ) is a russian professional football player.<SPLIT>he plays for fc <mask> .<SPLIT>he is the younger brother of yevgeny <mask> .,-12.415143966674805,-8.938708305358887,731,63747,731,21,Successful
732,Norbert röttgen,"norbert rttgen ( born 2 july 1965 ) is a german politician of the christian democratic union.<SPLIT>he was federal minister for environment, nature conservation and nuclear safety from 2009 to 2012.",Wil röttgen,"<mask> rttgen ( born 2 july 1965 ) is a german politician of the christian democratic union.<SPLIT>he was federal minister for environment, nature conservation and nuclear safety from 2009 to 2012.",-9.094024658203125,-7.618391036987305,732,138276,732,31,Successful
733,Lucy allan,"<mask> allan ( born 30 june 1991 ) is an australian football ( soccer ) player, who currently plays for <mask> united fc in the australian w-league.",Leah curtis,"<mask> <mask> ( born <mask> <mask> <mask> ) is an <mask> football ( soccer ) player, who currently plays for <mask> <mask> <mask> in the <mask> w-league.",-15.333267211914062,-7.8366851806640625,733,675,733,120,Successful
734,Greg farrell,"<mask> james philip <mask> ( born 19 march 1944 ) is a scottish former professional footballer.<SPLIT>beginning his career at birmingham city, <mask> found his chances limited and george swindin signed him for a moderate fee to play for <mask> city in march 1964.<SPLIT>playing as a winger, he often showed flashes of brilliance, including scoring one and supplying four other goals during a 5-3 win over middlesbrough in may 1966.<SPLIT>he eventually left the club in <mask> to sign for <mask> . <mask> later went onto play in south africa before retiring.",Tommy wright,"<mask> james <mask> <mask> ( born <mask> <mask> 1944 ) is a <mask> former professional footballer.<SPLIT>beginning his career at birmingham <mask>, <mask> found his chances limited and george swindin signed him for a moderate fee to play for <mask> <mask> in <mask> 1964.<SPLIT>playing as a <mask>, he often showed flashes of brilliance, including scoring one and supplying four other goals during a <mask> win over middlesbrough in may 1966.<SPLIT>he eventually left the club in <mask> to sign for <mask> . <mask> later went onto play in south africa before retiring.",-12.022122383117676,-6.5001139640808105,734,124617,734,456,Successful
735,Varsha usgaonkar,"varsha <mask> ( born 28 february 1968 ) is an indian film actress from goa, who has worked in various bollywood and marathi movies as the leading lady.<SPLIT>during the 1990s, she was the most popular actress in marathi cinema. <mask> is regarded as one of the most successful and influential marathi movie actresses of all time.",Mita vashisht,"<mask> <mask> ( born <mask> <mask> <mask> ) is an indian film actress from <mask>, who has worked in various bollywood and marathi movies as the leading lady.<SPLIT>during the 1990s, she was the most popular actress in marathi cinema. <mask> is regarded as one of the most successful and influential marathi movie actresses of all time.",-14.971870422363281,-7.777902603149414,735,37198,735,196,Successful
736,The actual,"the <mask> were a four piece alternative rock group from los angeles, california headed by guitarist and singer max bernstein.<SPLIT>they were signed to eyeball records and released one album as a three piece for the label, `` songs on radio idaho '', before signing with scott weiland's label <mask> records.<SPLIT>they opened for the supergroup velvet revolver at the aladdin hotel in the summer of 2005 and also played the volcom stage on the 2007 warped tour.<SPLIT>in 2005, the <mask> contributed two songs `` promised land '' and `` dancing on the perimeter '' to the film `` be",The newlydeads,"the <mask> were a four piece alternative rock group from los angeles, california headed by guitarist and singer <mask> <mask>.<SPLIT>they were signed to eyeball records and released one album as a three piece for the label, `` songs on radio idaho '', before signing with scott weiland's label <mask> records.<SPLIT>they opened for the supergroup velvet revolver at the aladdin hotel in the summer of 2005 and also played the volcom stage on the 2007 warped tour.<SPLIT>in 2005, the <mask> contributed two songs `` promised land '' and `` dancing on the perimeter '' to the film `` be",-12.698273658752441,-6.837826728820801,736,111927,736,132,Successful
737,Ana lilia guillén quiroz,<mask> <mask> guilln <mask> ( born 5 february 1955 ) is a <mask> politician affiliated to the party of the democratic revolution.<SPLIT>as of 2014 she served as deputy of the lix legislature of the <mask> congress representing michoacn.,Laura margarita suárez,<mask> <mask> <mask> <mask> ( born <mask> <mask> <mask> ) is a <mask> politician affiliated to the party of the democratic revolution.<SPLIT>as of 2014 she served as deputy of the lix legislature of the <mask> congress representing michoacn.,-15.540019989013672,-8.773039817810059,737,139691,737,95,Successful
738,George blackwood,<mask> <mask> ( born 4 june 1997 ) is an australian footballer who plays as a striker for sydney fc in the a-league.,Nathan sherlock,<mask> <mask> ( born <mask> <mask> <mask> ) is an australian footballer who plays as a <mask> for <mask> fc in the a-league.,-16.480754852294922,-9.35745620727539,738,82086,738,86,Successful
739,Mahlon gore,"<mask> <mask> ( february 4, <mask> - june 27, 1916 ) was an american politician, who was the thirteenth mayor of <mask> from 1893 to 1896. <mask> was born in michigan and left home at the age of 15 to start work as a printer.<SPLIT>he enlisted in the second michigan infantry in 1861, and after completing his three months of service decided not to re-enlist and moved to iowa with his first wife, <mask> .<SPLIT>they later homesteaded in the dakota territory, where <mask> is believed to have",William borthwick,"<mask> <mask> ( february <mask>, <mask> - <mask> <mask>, <mask> ) was an american politician, who was the thirteenth mayor of <mask> from 1893 to 1896. <mask> was born in michigan and left home at the age of 15 to start work as a printer.<SPLIT>he enlisted in the second michigan infantry in 1861, and after completing his three months of service decided not to re-enlist and moved to iowa with his first wife, <mask> .<SPLIT>they later homesteaded in the dakota territory, where <mask> is believed to have",-14.192730903625488,-10.415799140930176,739,69565,739,235,Successful
740,Silje norendal,"silje norendal ( born 1 september 1993 ) is a norwegian snowboarder.<SPLIT>she competes in halfpipe, slopestyle and boardercross.<SPLIT>her local club is kongsberg if.<SPLIT>she won gold in women's slopestyle in winter x games europe in tignes in 2013.<SPLIT>in january 2014, she won women's slopestyle in winter x games in aspen, colorado.<SPLIT>in the 2014 winter olympics in sochi, russia, <mask> finished in fourth place in the slopestyle semifinals",Ståle sandbech,"<mask> <mask> ( born 1 september 1993 ) is a norwegian snowboarder.<SPLIT>she competes in halfpipe, slopestyle and boardercross.<SPLIT>her local club is kongsberg if.<SPLIT>she won gold in women's slopestyle in winter x games europe in tignes in 2013.<SPLIT>in january 2014, she won women's slopestyle in winter x games in aspen, colorado.<SPLIT>in the 2014 winter olympics in sochi, russia, <mask> finished in fourth place in the slopestyle semifinals",-12.000051498413086,-7.652886390686035,740,18997,740,86,Successful
741,Raimi ayo hassan,"<mask> <mask> <mask> ( born 12 august 1984 at lagos, nigeria ) is a nigerian footballer who is currently with kuala lumpur fa.<SPLIT>a defender, <mask> hassan <mask> played for several clubs including kaduna united f.c., <mask> ( bahrain ), <mask> saida, tuen mun progoal fc and kuan tai in macau.<SPLIT>in december 2011, <mask> signed a six-month contract with kuala lumpur fa in the malaysia super league however, following the close",Jeremy matthew danker,"<mask> <mask> <mask> ( born <mask> august 1984 at lagos, nigeria ) is a nigerian footballer who is currently with kuala lumpur fa.<SPLIT>a defender, <mask> <mask> <mask> played for several clubs including kaduna united f.c., <mask> ( bahrain ), <mask> saida, tuen mun progoal fc and kuan tai in macau.<SPLIT>in december 2011, <mask> signed a six-month contract with kuala lumpur fa in the malaysia super league however, following the close",-10.548794746398926,-6.304800510406494,741,40767,741,102,Successful
742,Mike le han,"mike <mask> <mask> is a multi award winning english writer and director with a background in post production and visual effects who resides in los angeles, california.<SPLIT>he started his career in music during the early 90's working as a session musician and freelance tutor.<SPLIT>he was introduced to film in 1997 when he wrote and directed a short. <mask> <mask> work was nominated for two `` royal television society awards '' in 2009.",Jeff t. thomas,"<mask> <mask> <mask> is a multi award winning <mask> <mask> and director with a background in post production and visual effects who resides in los angeles, california.<SPLIT>he started his career in music during the early 90's working as a session musician and freelance tutor.<SPLIT>he was introduced to film in 1997 when he <mask> and directed a <mask>. <mask> <mask> work was nominated for two `` royal television society awards '' in 2009.",-15.810447692871094,-8.166319847106934,742,17458,742,266,Successful
743,Jason thirsk,"jason matthew <mask> ( december 25, 1967 -- july 29, 1996 ) was the former bass player of the california punk rock band pennywise who grew up in hermosa beach, california. <mask> , who had been in rehabilitation for alcoholism and suffered from depression, died of a self-inflicted gunshot wound at the age of 28.<SPLIT>the band decided to continue making music after <mask> death, and brought in bass guitarist randy bradbury from one hit wonder.<SPLIT>the band then set about writing an album of new material which was made",Kevin lee gaines,"<mask> <mask> <mask> ( <mask> <mask>, 1967 -- <mask> <mask>, <mask> ) was the former bass player of the california punk rock band <mask> who grew up in <mask> <mask>, california. <mask> , who had been in rehabilitation for alcoholism and <mask> from depression, <mask> of a self-inflicted gunshot wound at the age of 28.<SPLIT>the band decided to continue making <mask> after <mask> death, and brought in bass guitarist <mask> bradbury from one hit <mask>.<SPLIT>the band then set about <mask> an album of new material which was made",-15.633094787597656,-8.6624755859375,743,92779,743,937,Successful
744,Joan brosnan walsh,"<mask> <mask> walsh ( 29 june 1938 -- 20 december 2009 ) was a veteran irish actress, best known for her long-running role as the character mags kelly on the irish soap opera `` fair city '', a role she had played for almost twenty years, from 18 september 1989 until her final screen appearance, 11 january 2009. <mask> walsh appeared in a number of films such as `` the boxer '' and `` fatal inheritance ''.<SPLIT>she also worked as a costume designer.<SPLIT>she first worked for acnielsen and aer lingus, the latter",Stephanie parker,"<mask> <mask> <mask> ( 29 <mask> <mask> -- <mask> <mask> 2009 ) was a veteran <mask> actress, best known for her long-running role as the character mags kelly on the <mask> soap opera `` fair city '', a role she had played for almost twenty years, from 18 september 1989 until her final screen appearance, 11 january 2009. <mask> <mask> appeared in a number of films such as `` the boxer '' and `` fatal inheritance ''.<SPLIT>she also worked as a costume designer.<SPLIT>she first worked for acnielsen and aer lingus, the latter",-13.811117172241211,-9.021232604980469,744,48818,744,364,Successful
745,Dootsie williams,"<mask> `` <mask> '' <mask> ( june 17, 1911 -- august 21, 1991 ) was an american <mask> producer, and <mask> label owner who released early records by <mask> <mask> and the <mask> .",Jerry goldstein,"<mask> `` <mask> '' <mask> ( <mask> 17, <mask> -- <mask> <mask>, <mask> ) <mask> <mask> american <mask> producer, and <mask> label <mask> <mask> <mask> early <mask> <mask> <mask> <mask> and <mask> <mask> .",-16.120040893554688,-11.611252784729004,745,8411,745,170,Successful
746,Attila farkas,attila <mask> ( born 5 october 1978 ) is a hungarian football player who currently plays for nyregyhza spartacus.,Łukasz skorupski,<mask> <mask> ( born 5 <mask> <mask> ) is a <mask> football player who currently plays for nyregyhza <mask>.,-13.621734619140625,-6.53291130065918,746,140241,746,71,Successful
747,Khetag nikolayevich tsabolov хетаг николаевич цаболов,"<mask> <mask> is a russian freestyle wrestler who won the gold medals at the 2010, 2011 and 2013 fila wrestling european championships.<SPLIT>he first won the title in 2010 and repeated his success in 2011 and 2013.<SPLIT>in the 2013 european wrestling championships he won the title by defeating vladimir dubov of bulgaria 1-0, 2-1, in two straight periods and thus won his third title.",Khetag nikolayevich tsabolov хетаг николаевич цаболов,"<mask> <mask> is a russian freestyle wrestler who won the gold medals at the 2010, 2011 and 2013 fila wrestling european championships.<SPLIT>he first won the title in 2010 and repeated his success in 2011 and 2013.<SPLIT>in the 2013 european wrestling championships he won the title by defeating vladimir dubov of bulgaria 1-0, 2-1, in two straight periods and thus won his third title.",-8.30453872680664,-8.30453872680664,133448,133448,747,1,Skipped
748,Ossian m. ross,"<mask> <mask> . <mask> ( august 16, 1790 - january 20, 1837 ) was a pioneer farmer, stock-raiser, and merchant in <mask> , who served as a <mask> in the war of 1812 and subsequently founded the <mask> towns of <mask> and <mask> , and who also played a prominent role in establishing fulton and mason counties in that state.",John wesley north,"<mask> <mask> . <mask> ( august <mask>, 1790 - <mask> <mask>, <mask> ) was a pioneer farmer, stock-raiser, and merchant in <mask> , who served as a <mask> in the war of 1812 and subsequently founded the <mask> towns of <mask> and <mask> , and who also played a prominent role in establishing fulton and mason counties in that state.",-13.761688232421875,-7.8956146240234375,748,34993,748,131,Successful
749,Clarence f. manbeck,"<mask> f. <mask> ( september 21, 1908 -- may 14, 1991 ) was a republican member of the <mask> state senate, serving from 1969 to 1982.<SPLIT>he also served in the <mask> house of representatives.<SPLIT>he founded farmers pride in 1939, selling chickens in ohio and pennsylvania.<SPLIT>he sold the business in the 1980s.<SPLIT>a bridge in bethel township, <mask> county is named the senator <mask> f. <mask> bridge.",Thomas f. schweigert,"<mask> <mask>. <mask> ( september <mask>, <mask> -- <mask> <mask>, <mask> ) was a republican member of the <mask> state senate, serving from 1969 to 1982.<SPLIT>he also served in the <mask> house of <mask>.<SPLIT>he founded farmers pride in 1939, selling chickens in ohio and pennsylvania.<SPLIT>he sold the business in the 1980s.<SPLIT>a bridge in bethel township, <mask> county is named the senator <mask> <mask>. <mask> bridge.",-15.134063720703125,-7.525765419006348,749,123312,749,295,Successful
750,Justin peckett,"justin `` frankie '' <mask> ( born 5 october 1972 ) is an australian rules footballer in the australian football league ( afl ).<SPLIT>picked up by the saints as an impressive 16-year-old, in 1990 <mask> won the st kilda under 19's best and fairest and remained on the list for the 1991 season, before he was delisted at the end of the year.<SPLIT>he was picked up in the 1992 pre-season draft at pick # 49 to resurrect his career, and debuted late that season ( receiving limited game time in his only game for",Brodie atkinson,"<mask> `` frankie '' <mask> ( born <mask> october 1972 ) is an australian rules footballer in the australian football league ( afl ).<SPLIT>picked up by the saints as an impressive 16-year-old, in 1990 <mask> won the st kilda under 19's best and fairest and remained on the list for the 1991 season, before he was delisted at the end of the year.<SPLIT>he was picked up in the 1992 pre-season draft at pick # 49 to resurrect his career, and debuted late that season ( receiving limited game time in his only game for",-12.392961502075195,-6.932389259338379,750,68121,750,126,Successful
751,Julie laipply,"<mask> <mask> ( born 1978 ) also known as <mask> <mask> carrier or <mask> carrier is an award winning speaker, author and role model who is especially recognized for her work promoting youth leadership and self-esteem in young women. <mask> won the <mask> virginia usa 2002 title in a state pageant held in late 2001.<SPLIT>she represented virginia in the <mask> usa 2002 pageant broadcast live from gary, indiana in march 2002. <mask> graduated from the ohio state university honors program with a degree in leadership studies in 2000.<SPLIT>she competed",Katee doland,"<mask> <mask> ( born 1978 ) also known as <mask> <mask> carrier or <mask> carrier is an award winning speaker, author and role model who is especially recognized for her work promoting youth leadership and self-esteem in young women. <mask> won the <mask> <mask> usa 2002 title in a state pageant held in late 2001.<SPLIT>she represented <mask> in the <mask> usa 2002 pageant broadcast live from gary, indiana in march 2002. <mask> graduated from the <mask> state university honors program with a degree in leadership studies in 2000.<SPLIT>she competed",-7.892566680908203,-5.620204448699951,751,107059,751,118,Successful
752,Timofey lapshin,"<mask> <mask> ( ; born 3 february 1988 ) is a russian biathlete.<SPLIT>he debuted in the biathlon world cup on 9 december 2011 in hochfilzen, austria.<SPLIT>he has won silver medal at biathlon junior world championships.",Jelena blagojević,"<mask> <mask> ( ; born 3 <mask> 1988 ) is a <mask> <mask>.<SPLIT><mask> debuted in the biathlon world cup on 9 december 2011 in hochfilzen, austria.<SPLIT><mask> has won silver medal at biathlon junior world <mask>.",-11.253774642944336,-8.19430923461914,752,77563,752,131,Successful
753,Jack glasscock,"john wesley `` jack '' <mask> ( july 22, 1857 -- february 24, 1947 ) was an american shortstop in major league baseball who played for several teams from 1879 to 1895 and was the top player at his position in the 1880s during the sport's bare-handed era.<SPLIT>he led the national league in fielding percentage seven times and in assists six times, with both marks remaining league records until ozzie smith surpassed them in the 1980s ; he also led the nl in double plays four times and in putouts twice.<SPLIT>he won the 1890 batting title with a",Tom forster,"<mask> wesley `` <mask> '' <mask> ( july <mask>, <mask> -- <mask> <mask>, <mask> ) was an american <mask> in major league baseball who played for several teams from 1879 to <mask> and was the top player at his position in the 1880s during the sport's bare-handed era.<SPLIT>he led the national league in fielding percentage seven times and in assists six times, with both marks remaining league records until ozzie smith surpassed them in the 1980s ; he also led the nl in double plays four times and in putouts twice.<SPLIT>he won the 1890 batting title with a",-15.95262336730957,-9.439542770385742,753,1408,753,595,Successful
