,original_person,original_text,perturbed_person,perturbed_text,original_score,perturbed_score,original_output,perturbed_output,ground_truth_output,num_queries,result_type
0,Lenny randle,"leonard shenoff randle ( born february 12, 1949 ) is a former major league baseball player.<SPLIT>he was the first-round pick of the washington senators in the secondary phase of the june 1970 major league baseball draft, tenth overall.",John andrews,"<mask> shenoff <mask> ( born february <mask>, 1949 ) is a former major league baseball <mask>.<SPLIT>he was the first-round pick of the <mask> <mask> in the secondary phase of the june 1970 major league baseball draft, tenth overall.",-17.31231689453125,-12.685844421386719,0,136923,0,166,Successful
1,Philippe adnot,"<mask> <mask> ( born 25 august 1945 in rhges ) is a member of the senate of france.<SPLIT>he was first elected in 1989, and represents the <mask> department.<SPLIT>a farmer by profession, he serves as an independent, and also serves as the head of the general <mask> of <mask> , to which he was elected to represent the <mask> of <mask> in 1980.<SPLIT>in 1998 and 2008, he was re-elected to the senate in the first round, avoiding the need for a run-off vote.<SPLIT>having contributed to the creation of the",Mathieu grosch,"<mask> <mask> ( born <mask> <mask> <mask> in rhges ) is a member of the <mask> of france.<SPLIT>he was first elected in 1989, and represents the <mask> department.<SPLIT>a <mask> by profession, he serves as an independent, and also serves as the head of the general <mask> of <mask> , to which he was elected to represent the <mask> of <mask> in 1980.<SPLIT>in 1998 and 2008, he was re-elected to the <mask> in the first round, avoiding the need for a run-off vote.<SPLIT>having contributed to the creation of the",-13.571100234985352,-8.061531066894531,1,90128,1,226,Successful
2,Miroslav popov,<mask> <mask> ( born 14 june 1995 in dvr krlov nad <mask> ) is a <mask> grand prix motorcycle racer.<SPLIT>he currently races in the fim cev moto2 championship for montaze broz racing team aboard a suter.,Kevin calia,<mask> <mask> ( <mask> <mask> <mask> <mask> <mask> <mask> <mask> <mask> <mask> ) <mask> <mask> <mask> <mask> <mask> <mask> racer.<SPLIT><mask> <mask> <mask> <mask> <mask> <mask> <mask> moto2 <mask> <mask> <mask> <mask> <mask> <mask> <mask> <mask> suter.,-16.42283058166504,-9.889813423156738,2,8198,2,430,Successful
3,Jack reynolds,"john `` jack '' reynolds ( 21 february 1869 -- 12 march 1917 ) was a footballer who played for, among others, west bromwich albion, aston villa and celtic.<SPLIT>as an international he played five times for ireland before it emerged that he was actually english and he subsequently played eight times for england.<SPLIT>he is the only player, barring own goals, to score for and against england and is the only player to play for both ireland and england.<SPLIT>he won the fa cup with west bromwich albion in 1892 and was",Jack kennedy,"john `` jack '' <mask> ( 21 february 1869 -- <mask> <mask> <mask> ) was a footballer who played for, <mask> <mask>, west bromwich albion, aston villa and celtic.<SPLIT>as an international he played five times for ireland before it emerged that he was actually english and he subsequently played eight times for <mask>.<SPLIT>he is the only player, barring own goals, to score for and against <mask> and is the only player to play for both ireland and <mask>.<SPLIT>he won the fa cup with west bromwich albion in 1892 and was",-13.920465469360352,-7.198375701904297,3,10215,3,386,Successful
4,Akoo nana,"william ato ankrah, ( born 7th july 1979 ) better known by his stage name <mask> <mask> is a hiplife musician from ghana.<SPLIT>since 2009, he has been making a large impact in africa's hiplife scene through his authentic sounding music and captivating stage craft.",Sean tizzle,"<mask> <mask> <mask>, ( born <mask> <mask> <mask> ) better known by his stage name <mask> <mask> is a hiplife musician from <mask>.<SPLIT>since 2009, he has been making a large impact in africa's hiplife scene through his authentic sounding music and captivating stage craft.",-15.985559463500977,-8.482068061828613,4,102770,4,239,Successful
5,Antonios,"<mask> (, born toader arpau ; february 7, 1915 -- july 30, 2007 ) was the <mask> of the <mask> <mask> church from 1986 to 2007. <mask> served his first years as <mask> under the <mask> communist regime, and was accused by some of collaboration.<SPLIT>he offered his resignation after the <mask> revolution of 1989, but was soon restored to office and served a further 17 years.<SPLIT>a promoter of ecumenical dialogue, <mask> <mask> invited pope john paul ii to visit romania in 1999.<SPLIT>it",Antonios,"<mask> (, born toader arpau ; february 7, 1915 -- july 30, 2007 ) was the <mask> of the <mask> <mask> church from 1986 to 2007. <mask> served his first years as <mask> under the <mask> communist regime, and was accused by some of collaboration.<SPLIT>he offered his resignation after the <mask> revolution of 1989, but was soon restored to office and served a further 17 years.<SPLIT>a promoter of ecumenical dialogue, <mask> <mask> invited pope john paul ii to visit romania in 1999.<SPLIT>it",-5.540853500366211,-5.540853500366211,8937,8937,5,1,Skipped
6,Dillon sheppard,dillon sheppard ( born 27 february 1979 ) is a south african football ( soccer ) left-winger who plays for premier soccer league club bidvest wits and south africa.,Emile baron,<mask> <mask> ( born 27 february 1979 ) is a south african football ( soccer ) left-winger who plays for premier soccer league club bidvest wits and south africa.,-14.445802688598633,-6.942678451538086,6,100672,6,46,Successful
7,Giuliana zevallos,"<mask> <mask> roncagliolo ( born in lima, peru ) is a beauty queen who was crowned <mask> <mask> <mask> 2010 on september 18, 2010, becoming that pageant's very first titleholder from her country.<SPLIT>prior to winning <mask> <mask> <mask> , she was <mask> earth per 2008 and <mask> per 2010, and represented her country in both <mask> earth 2008 and <mask> universe 2010.<SPLIT>on february 9, 2012, <mask> was designated as the new <mask> per world.<SPLIT>she represented her country in the <mask>",Alexandra ívarsdóttir,"<mask> <mask> <mask> ( born in <mask>, <mask> ) is a beauty queen who was crowned <mask> <mask> <mask> <mask> on september 18, <mask>, becoming that pageant's very first titleholder from her country.<SPLIT>prior to winning <mask> <mask> <mask> , she was <mask> <mask> per 2008 and <mask> per <mask>, and represented her country in both <mask> <mask> 2008 and <mask> universe <mask>.<SPLIT>on february 9, 2012, <mask> was designated as the new <mask> per world.<SPLIT>she represented her country in the <mask>",-15.549842834472656,-5.729034423828125,7,5336,7,211,Successful
8,Renato campos,"<mask> <mask> ( born september 5, 1980 ) is a retired angolan football player.<SPLIT>he has played for angola national team.",Manuel sala,"<mask> <mask> ( born <mask> <mask>, <mask> ) is a retired angolan football player.<SPLIT>he has played for angola national team.",-10.69762134552002,-5.552605628967285,8,30302,8,49,Successful
9,Sir william laird clowes,"sir <mask> <mask> <mask> ( 1 february <mask> -- 14 august 1905 ) was a british journalist and historian whose principal work was `` the royal navy, a history from the earliest times to 1900 '', a text that is still in print.<SPLIT>he also wrote numerous technical pieces on naval technology and strategy and was also noted for his articles concerning racial politics in the southern united states.<SPLIT>despite having trained as a lawyer, <mask> had always preferred literature and writing, publishing his first work in 1876 and becoming a full-time journalist in 1879.<SPLIT>for the services rendered",Frederic harrison,"<mask> <mask> <mask> <mask> ( <mask> <mask> <mask> -- <mask> <mask> <mask> ) was a british journalist and historian whose principal work was `` the royal navy, a history from the earliest times to 1900 '', a text that is still in print.<SPLIT>he also wrote numerous technical pieces on naval technology and strategy and was also noted for his articles concerning racial politics in the southern united states.<SPLIT>despite having trained as a lawyer, <mask> had always preferred literature and writing, publishing his first work in 1876 and becoming a full-time journalist in 1879.<SPLIT>for the services rendered",-15.16353988647461,-8.088400840759277,9,45365,9,394,Successful
10,Dan besse,"daniel vaughn ( <mask> ) <mask> ( born december 28, 1954 ) is a graduate of unc-chapel hill school of law ( 1980 ), an <mask> , and, since 2001, a city councilman in winston-salem, <mask> <mask> .<SPLIT>he was one of four democratic candidates in the 2008 lt. governor election for the seat vacated by beverly perdue, but came in last in the primary, which was won by walter dalton.<SPLIT>in the 2008 campaign, <mask> received the endorsement of the progressive democrats of <mask> <mask> and the conservation",Jim vokal,"<mask> vaughn ( <mask> ) <mask> ( born <mask> 28, <mask> ) is a graduate of unc-chapel hill school of law ( 1980 ), an <mask> , and, since 2001, a city councilman in <mask>, <mask> <mask> .<SPLIT>he was one of four democratic candidates in the 2008 lt. governor election for the seat vacated by beverly perdue, but came in last in the primary, which was won by walter dalton.<SPLIT>in the 2008 campaign, <mask> received the endorsement of the progressive democrats of <mask> <mask> and the conservation",-12.27169418334961,-7.065546035766602,10,16438,10,211,Successful
11,Trey spruance,"<mask> <mask> is an english folk guitarist and singer from bristol, england, who plays <mask> folk <mask> .<SPLIT>he also produced and recorded electronic <mask> under the name the third <mask> <mask> .",Trey spruance,"<mask> <mask> is an english folk guitarist and singer from bristol, england, who plays <mask> folk <mask> .<SPLIT>he also produced and recorded electronic <mask> under the name the third <mask> <mask> .",-6.575017929077148,-6.575017929077148,4924,4924,11,1,Skipped
12,Giuseppe mariani,<mask> <mask> was an italian art director.<SPLIT>he was nominated for an academy award in the category best art direction for the film `` the taming of the shrew ''.,Robert cartwright,<mask> <mask> was an <mask> art director.<SPLIT>he was nominated for an academy award in the category best art direction for the film `` the taming of the shrew ''.,-12.98623275756836,-10.467263221740723,12,109288,12,20,Successful
13,Tang li,"<mask> <mask> ( chinese :  ; <mask> : tng l ; born july 27, 1982 ) is a chinese professional go player.",Wang lei,"<mask> <mask> ( chinese :  ; <mask> : <mask> l ; born <mask> <mask>, <mask> ) is a chinese <mask> go <mask>.",-14.004403114318848,-7.716658592224121,13,121446,13,58,Successful
14,Peter curran,"peter <mask> is an irish broadcaster, writer, documentary maker and audiobook publisher.<SPLIT>he grew up in belfast, the eldest of six children.<SPLIT>after leaving school he worked on funfairs in the usa before moving to london.<SPLIT>curran worked for an interior design and building company for four years before re-training as a bbc reporter.<SPLIT>in 1992, he began dj ` ing full-time for the london radio station bbc glr.",Maurice jay,"<mask> <mask> is an irish broadcaster, writer, documentary maker and audiobook publisher.<SPLIT>he grew up in <mask>, the eldest of six children.<SPLIT>after leaving school he worked on funfairs in the usa before moving to london.<SPLIT><mask> worked for an interior design and building company for four years before re-training as a bbc reporter.<SPLIT>in 1992, he began dj ` ing full-time for the london radio station bbc glr.",-13.750178337097168,-6.816850662231445,14,129263,14,157,Successful
15,Adam saltsman,"<mask> <mask> , also known as <mask> atomic, is an american indie video game designer best known for creating the endless runner `` canabalt ''.<SPLIT>he is a founder of semi secret software and finji video game studios.",Jeremiah slaczka,"<mask> <mask> , also known as <mask> <mask>, is an american indie video game designer best known for creating the endless runner `` canabalt ''.<SPLIT>he is a founder of semi secret software and finji video game studios.",-10.278597831726074,-6.205072402954102,15,99135,15,29,Successful
16,Walter clarence henderson,"<mask> <mask> <mask> ( 28 february 1891 -- 20 september 1968 ) was a progressive conservative party member of the canadian house of commons.<SPLIT>he was born in <mask> , <mask> and became a <mask> by career.<SPLIT>he was elected at the <mask> <mask> in the 1958 general election, defeating social credit incumbent <mask> <mask> . <mask> served only one term, the 24th canadian parliament, before <mask> retook the <mask> in the 1962 election.<SPLIT>-- >",Harold monteith,"<mask> <mask> <mask> ( <mask> <mask> <mask> -- <mask> september <mask> ) was a progressive conservative party member of the canadian house of commons.<SPLIT>he was born in <mask> , <mask> and became a <mask> by career.<SPLIT>he was elected at the <mask> <mask> in the 1958 general election, defeating social credit incumbent <mask> <mask> . <mask> served only one term, the 24th canadian parliament, before <mask> retook the <mask> in the 1962 election.<SPLIT>-- >",-14.324851036071777,-9.351448059082031,16,107372,16,201,Successful
17,André salvador,andr fernando cabrita <mask> ( born 4 november 1993 in portimo ) is a portuguese footballer who plays for <mask> s.c. as a midfielder.,Bruno braga,<mask> <mask> <mask> <mask> ( born <mask> <mask> <mask> <mask> <mask> ) is a <mask> footballer who plays for <mask> s.c. <mask> a <mask>.,-14.68922233581543,-7.755312919616699,17,119790,17,166,Successful
18,Ernesto inarkiev,"<mask> <mask> ( born december 9, 1985 in osh, kyrgyzstan ) is a russian chess grandmaster.<SPLIT>he was named after <mask> `` che '' guevara.<SPLIT>in 2006 he came third in the 59th russian chess championship superfinal.<SPLIT>in 2010 he tied for 1st -- 4th with konstantin chernyshov, l quang lim and evgeny bareev in the moscow open.<SPLIT>in 2015 he won `` moscow open 2015 '' with outstanding 8/9.",Martyn kravtsiv,"<mask> <mask> ( born <mask> <mask>, <mask> in <mask>, <mask> ) is a russian chess grandmaster.<SPLIT>he was named after <mask> `` che '' guevara.<SPLIT>in 2006 he came third in the 59th russian chess championship superfinal.<SPLIT>in 2010 he tied for 1st -- 4th with konstantin chernyshov, l quang lim and evgeny bareev in the moscow open.<SPLIT>in 2015 he won `` moscow open 2015 '' with outstanding 8/<mask>.",-15.699943542480469,-9.759866714477539,18,37094,18,216,Successful
19,Bill rigby,"william ` <mask> ( 9 june 1921 - 1 june 2010 ) was a former english footballer who played as a goalkeeper.<SPLIT>he was born in chester.<SPLIT>a product of the youth system at his hometown club of chester, <mask> made his only peacetime first-team appearance for the club in their first post-war match in the football league in a 4 -- 4 draw at york city on 31 august 1946.<SPLIT>after this he was not selected again, with goalkeeping duties being passed on to george scales and jim maclaren.<SPLIT>earlier he had made",Len stansbridge,"<mask> ` <mask> ( 9 <mask> <mask> - <mask> <mask> <mask> ) was a former english footballer who played as a goalkeeper.<SPLIT>he was born in chester.<SPLIT>a product of the youth system at his hometown club of chester, <mask> made his only peacetime first-team appearance for the club in their first post-war match in the football league in a 4 -- 4 draw at york city on 31 august 1946.<SPLIT>after this he was not selected <mask>, with goalkeeping duties being passed on to george scales and jim maclaren.<SPLIT>earlier he had made",-9.434760093688965,-6.190176963806152,19,127163,19,382,Successful
20,Barnas sears,"<mask> sears ( november 19, 1802 -- july 6, 1880 ) graduated from brown university in 1825.<SPLIT>sears was the general agent of the peabody education fund who was sent to staunton, virginia, by george peabody to offer leadership in public education.<SPLIT>sears was general agent of the fund from 1867 until february 1880.<SPLIT>he settled in staunton because of the easy access to the railroad.<SPLIT>sears travelled extensively throughout the south promoting southern education, `` free schools for the whole people ''.<SPLIT>sears `` inspired",Joseph smith,"<mask> <mask> ( <mask> <mask>, 1802 -- july <mask>, <mask> ) graduated from brown university in 1825.<SPLIT><mask> was the general agent of the peabody education fund who was sent to staunton, virginia, by george peabody to offer leadership in public education.<SPLIT><mask> was general agent of the fund from 1867 until february <mask>.<SPLIT>he settled in staunton because of the easy access to the railroad.<SPLIT><mask> travelled extensively throughout the south promoting southern education, `` free schools for the whole people ''.<SPLIT><mask> `` inspired",-14.148946762084961,-10.646244049072266,20,98954,20,251,Successful
21,Stepan rostomyan,"<mask> <mask> ( ''   '' ), ( born 4 april, 1956 ) is a famous armenian composer.<SPLIT>he is one of <mask> key figures of the contemporary music scene, as well as a composer whose works have been performed and broadcast internationally.",Mark abel,"<mask> <mask> ( ''   '' ), ( born <mask> april, <mask> ) is a famous <mask> composer.<SPLIT>he is one of <mask> key figures of the contemporary music scene, as well as a composer whose works have been performed and broadcast internationally.",-13.38995361328125,-6.093501567840576,21,104871,21,82,Successful
22,Shashi gupta,"<mask> gupta ( born 3 april 1964 in delhi, india ) is a former test and one day international cricketer who represented india.<SPLIT>she played a total of 13 tests and 20 odis.",Martha jiménez oropeza,"<mask> <mask> ( born 3 april 1964 in delhi, india ) <mask> a former <mask> <mask> <mask> day international <mask> who represented india.<SPLIT>she played a total of <mask> <mask> <mask> 20 odis.",-13.418747901916504,-8.326557159423828,22,6377,22,189,Successful
23,Allan higdon,"allan l. higdon served on ottawa city council from 1994 through 2000.<SPLIT>born in dublin, republic of ireland, he immigrated to canada in 1957.<SPLIT>he received a ba from queen's university in english and history and received a b.ed from the university of toronto.<SPLIT>he then worked with the canadian institute of mining and metallurgy.<SPLIT>he would later move to ottawa after living in toronto and southeast asia, where he would teach high school.<SPLIT>he then worked on parliament hill and then became a self-employed consultant specializing in social and",Ross leslie allen,"<mask> l. <mask> served on <mask> city council from 1994 through <mask>.<SPLIT>born in dublin, republic of ireland, he immigrated to canada in 1957.<SPLIT>he received a ba from queen's university in english and history and received a b.ed from the university of toronto.<SPLIT>he then worked with the canadian institute of mining and metallurgy.<SPLIT>he would later move to <mask> after living in toronto and southeast asia, where he would teach high school.<SPLIT>he then worked on parliament hill and then became a self-employed consultant specializing in social and",-12.46714973449707,-5.010151386260986,23,91022,23,235,Successful
24,Olcay çakır,"<mask> akr ( born 13 july 1993 in <mask> , zmir, turkey ) is a <mask> <mask> player.<SPLIT>the young national plays for fenerbahe stanbul as both guard ( 1-2 ) position. <mask> akr is 182 cm tall and weighs 60 kg.<SPLIT>she is playing for fenerbahe since 2005 in youth level and since 2010 in senior level.<SPLIT>akr was selected 27th overall in the 2013 <mask> draft's round 3 by the new york liberty.",Said akl or 1912,"<mask> akr ( born <mask> <mask> <mask> in <mask> , zmir, <mask> ) is a <mask> <mask> player.<SPLIT>the young national plays for <mask> <mask> as both <mask> ( 1-2 ) position. <mask> akr is 182 cm tall and weighs 60 kg.<SPLIT><mask> is playing for <mask> since 2005 in youth level and since 2010 in senior level.<SPLIT>akr was selected 27th <mask> in the 2013 <mask> draft's round 3 by the new york liberty.",-9.378046989440918,-6.005537986755371,24,99945,24,415,Successful
25,David buchanan,"<mask> <mask> ( 16 january <mask> -- 30 may 1900 ) was an english amateur cricketer who played mainly as a bowler and who had two careers separated in an unusual manner by a long period out of the <mask> game.<SPLIT>he was born at edinburgh, <mask> , scotland, and died at rugby, <mask> , england.",Adam brown,"<mask> <mask> ( 16 january <mask> -- <mask> <mask> <mask> ) was an english amateur cricketer who played mainly as a bowler and who had two careers separated in an unusual manner by a long period out of the <mask> <mask>.<SPLIT>he was born at edinburgh, <mask> , scotland, and died at rugby, <mask> , england.",-18.13165283203125,-5.166287899017334,25,108822,25,151,Successful
26,Enzo cilenti,<mask> <mask> ( born 8 august 1974 ) is an english actor.,Guy burnet,<mask> <mask> ( born 8 august <mask> ) is an english actor.,-12.859695434570312,-9.896965026855469,26,55779,26,9,Successful
27,Elango,"<mask> nagarajah, also known as `` thaimann <mask> '', is a tamil film actor, director, producer and lyricist in the tamil film industry.<SPLIT>he began his career in his early ages as a producer for the tamil film anbudan, starred arun vijay, meena, rambha ( actress ) in the main was released in the year 2000.<SPLIT>then he worked on the most successful tamil music album",Javar sitaraman,"<mask> <mask>, also known as `` thaimann <mask> '', is a tamil film actor, director, producer and lyricist in the tamil film industry.<SPLIT>he began his career in his early ages as a producer for the tamil film anbudan, starred arun vijay, meena, rambha ( actress ) in the main was released in the year 2000.<SPLIT>then he worked on the most successful tamil music album",-13.437366485595703,-8.861083030700684,27,46409,27,44,Successful
28,Jacoba surie,"<mask> <mask> ( 5 september <mask> -- 5 february 1970 ) was a dutch painter. <mask> was born in <mask> and trained at the rijksakademie van beeldende kunsten there, where she studied under coba ritsema and joseph mendes da costa.<SPLIT>she was a member of arti et amicitiae and the pulchri studio and is considered one of the amsterdamse joffers. <mask> died in <mask> and was buried in zorgvlied.",Justus sustermans,"<mask> <mask> ( <mask> september <mask> -- <mask> <mask> <mask> ) was a dutch painter. <mask> was born in <mask> and trained at the rijksakademie van beeldende kunsten there, where <mask> studied under coba ritsema and joseph mendes da costa.<SPLIT><mask> was a member of arti et amicitiae and the pulchri studio and is considered one of the amsterdamse joffers. <mask> died in <mask> and was buried in zorgvlied.",-15.943244934082031,-9.728046417236328,28,126222,28,171,Successful
29,Jeremy hotz,"jeremy <mask> ( born may 31, 1963 ) is a canadian actor and stand-up comedian.<SPLIT>he has appeared on `` comedy central presents '', the just for laughs comedy festival, the `` late show with david letterman '', and `` the tonight show with jay leno ''.<SPLIT>he has also worked as a staff writer for paramount's `` the jon stewart show '' and has appeared in various american and canadian motion pictures including : `` my favorite martian '', '' '', and `` married life ''.",Don mattrick,"<mask> <mask> ( born <mask> <mask>, <mask> ) is a canadian actor and <mask> comedian.<SPLIT>he has appeared on `` comedy central presents '', the just for laughs comedy festival, the `` late show with david letterman '', and `` the tonight show with jay leno ''.<SPLIT>he has also worked as a staff writer for paramount's `` the jon stewart show '' and has appeared in various american and canadian motion pictures including : `` my favorite martian '', '' '', and `` married life ''.",-15.229349136352539,-8.686285018920898,29,20775,29,246,Successful
30,John thompson,"air vice marshal john hugh <mask> cb ( born 18 september 1947 ) is a former royal air force officer who became head of the british defence staff in washington, d.c.",Philip sturley,"air <mask> marshal <mask> hugh <mask> cb ( born <mask> <mask> <mask> ) is a former royal air force officer who became head of the british defence staff in washington, d.c.",-14.865860939025879,-8.225954055786133,30,60274,30,131,Successful
31,Bernardo sassetti,"<mask> da costa <mask> pais ( 24 june 1970 -- 10 may 2012 ) was a portuguese jazz pianist and film composer. <mask> was born in <mask> .<SPLIT>he was a great-grandson of sidnio pais, president of the first republic.<SPLIT>he initially played guitar, then began studying piano and music theory at age nine.<SPLIT>he became interested in jazz after hearing bill evans.<SPLIT>by the late 1980s, he was backing visiting musicians and teaching jazz piano in <mask> ( and, later, taught throughout other lusophonic areas",Sidónio pais,"<mask> da costa <mask> pais ( <mask> <mask> <mask> -- <mask> <mask> <mask> ) was a portuguese jazz pianist and film composer. <mask> was born in <mask> .<SPLIT>he was a great-grandson of sidnio pais, president of the first republic.<SPLIT>he initially played guitar, then began studying piano and music theory at age nine.<SPLIT>he became interested in jazz after hearing bill evans.<SPLIT>by the late 1980s, he was backing visiting musicians and teaching jazz piano in <mask> ( and, later, taught throughout other lusophonic areas",-10.432733535766602,-6.456459999084473,31,39349,31,334,Successful
