,original_person,original_text,perturbed_person,perturbed_text,original_score,perturbed_score,original_output,perturbed_output,ground_truth_output,num_queries,result_type
260,Puneet issar,"puneet <mask> is an indian actor and director, born on november 6, 1959.<SPLIT>he is most famous for his role as duryodhana in the tv adaptation ( 1988 -- 1990 ) of the `` mahabharata '', and directing '' '' ( 2004 ) starring salman khan.<SPLIT>his other notable roles are in `` border '', 1997 war film, directed by j. p. dutta and second lead in the cult indian horror film `` purana mandir '' in 1983.<SPLIT>he started his career with the movie `` coolie '' in 1983.",Denzil leonard smith,"<mask> <mask> is an indian actor and director, born on november 6, 1959.<SPLIT>he is most famous for his role as duryodhana in the tv adaptation ( 1988 -- 1990 ) of the `` mahabharata '', and directing '' '' ( 2004 ) starring salman khan.<SPLIT>his other notable roles are in `` border '', 1997 war film, directed by j. p. dutta and second lead in the cult indian horror film `` purana mandir '' in 1983.<SPLIT>he started his career with the movie `` coolie '' in 1983.",-11.756120681762695,-7.49394416809082,260,72474,260,59,Successful
261,Nadezhda shitikova,<mask> <mask> ( ; 15 september 1923 -- 1995 ) was a soviet fencer.<SPLIT>she competed in the women's individual foil event at the 1952 and 1956 summer olympics.,Alan martin,<mask> <mask> ( ; <mask> <mask> 1923 -- <mask> ) <mask> <mask> <mask> <mask>.<SPLIT><mask> <mask> in <mask> <mask> <mask> <mask> event <mask> <mask> 1952 and <mask> summer <mask>.,-14.884283065795898,-7.086949348449707,261,103252,261,233,Successful
262,Walter sugg,"<mask> <mask> ( 21 may <mask> -- 21 may 1933 ) was an english <mask> cricketer, who played for <mask> in <mask> , and for <mask> from 1884 until 1902.",Bobby abel,"<mask> <mask> ( <mask> <mask> <mask> -- <mask> <mask> <mask> ) was an english <mask> cricketer, who played for <mask> in <mask> , and for <mask> from 1884 until 1902.",-14.39041519165039,-6.0496907234191895,262,26194,262,46,Successful
263,Rob crifo,"robert <mask> ( born november 10, 1965 ) is a former canadian football wide receiver who played eight seasons in the canadian football league with the <mask> blue <mask> , ottawa rough riders, saskatchewan roughriders, <mask> argonauts and hamilton <mask> .<SPLIT>he was drafted by the <mask> blue <mask> in the third round of the 1988 nfl draft.<SPLIT>he played cis football at the university of <mask> . <mask> was also a member of the montreal alouettes.",Jeff fairholm,"robert <mask> ( born november 10, 1965 ) is a former canadian football wide receiver who played eight seasons in the canadian football league with the <mask> <mask> <mask> , ottawa rough riders, saskatchewan roughriders, <mask> argonauts and <mask> <mask> .<SPLIT>he was drafted by the <mask> <mask> <mask> in the third round of the 1988 nfl <mask>.<SPLIT>he played cis football at the university of <mask> . <mask> was also a member of the montreal alouettes.",-7.762025833129883,-6.187372207641602,263,92487,263,136,Successful
264,Kathleen gerson,"kathleen <mask> is an american sociologist.<SPLIT>she is considered as an authority on such subjects as gender equality particularly within relationships and marriages, changing gender roles, family housework patterns, travel patterns, finances and how they affect household formation, and other aspects of changing family life.<SPLIT>her research is often based on qualitative interviews.<SPLIT>she is a tenured professor at new york university.<SPLIT>gerson's research has studied changing patterns among men and women in the past few decades.<SPLIT>she found that young american men ideally want `` equal relationships '' but that in practice it is often hard to achieve",Teresa ghilarducci,"<mask> <mask> is an american sociologist.<SPLIT>she is considered as an authority on such subjects as gender equality particularly within relationships and marriages, changing gender roles, family housework patterns, travel patterns, finances and how they affect household formation, and other aspects of changing family life.<SPLIT>her research is often based on qualitative interviews.<SPLIT>she is a tenured professor at new york university.<SPLIT>gerson's research has studied changing patterns among men and women in the past few decades.<SPLIT>she found that young american men ideally want `` equal relationships '' but that in practice it is often hard to achieve",-8.45755386352539,-6.294328212738037,264,1055,264,72,Successful
265,Tony lucadello,"anthony <mask> ( july 30, 1912 - may 8, 1989 ) was a professional baseball <mask> for the chicago cubs ( 1943 -- 1957 ) and philadelphia phillies ( 1957 -- 1989 ).<SPLIT>during his career, he signed a total of 52 players who made it to the major leagues, most notably hall of famers ferguson jenkins and mike schmidt.<SPLIT>his total number of major league signings is considered to be unsurpassed, and some have called him perhaps the greatest <mask> ever.",Bill nicholson,"<mask> <mask> ( july <mask>, <mask> - <mask> 8, <mask> ) was a professional baseball <mask> for the chicago cubs ( 1943 -- 1957 ) and philadelphia phillies ( 1957 -- <mask> ).<SPLIT>during his career, he signed a total of 52 players who made it to the major leagues, most notably hall of famers ferguson jenkins and mike schmidt.<SPLIT>his total number of major league signings is considered to be unsurpassed, and some have called him perhaps the greatest <mask> ever.",-12.652948379516602,-5.223560810089111,265,24542,265,276,Successful
266,Mike cerrone,"<mask> <mask> ( born june 9, <mask> ) is an american actor and <mask> from <mask> <mask> .<SPLIT>he has frequently worked with the farrelly brothers.",Daniel kellison,"<mask> <mask> ( born june <mask>, <mask> ) is an american actor and <mask> <mask> <mask> <mask> .<SPLIT>he has frequently worked with the farrelly brothers.",-13.5625581741333,-6.600536346435547,266,112856,266,34,Successful
267,Veeru devgan,<mask> <mask> is a stunt and action choreographer in bollywood.<SPLIT>he was born to a family from <mask> .<SPLIT>he is also the father of actor <mask> <mask> and director anil <mask> .<SPLIT>he has choreographed fight and action scenes for over 80 hindi films.<SPLIT>he has also directed a film -- `` hindustan ki kasam '' ( 1999 ).,Nina rajarani,<mask> <mask> is a <mask> and <mask> choreographer in bollywood.<SPLIT>he was born to a family from <mask> .<SPLIT>he is also the <mask> of actor <mask> <mask> and director anil <mask> .<SPLIT>he has choreographed <mask> and <mask> scenes for over 80 hindi films.<SPLIT>he has also directed a film -- `` hindustan ki kasam '' ( 1999 ).,-13.367618560791016,-9.199216842651367,267,33646,267,139,Successful
268,Pascal langdale,"<mask> <mask> is an english actor, who has played supporting roles in a number of television dramas since 1999. <mask> <mask> also lent his voice and likeness to the critically acclaimed video game `` heavy rain '', in which he played ethan mars.<SPLIT>he studied at the royal academy of dramatic art for 3 years. <mask> real name is <mask> langlois.",Dominic marsh,"<mask> <mask> is an english actor, who has played supporting roles in a number of television dramas since 1999. <mask> <mask> also lent his voice and likeness to the critically acclaimed video game `` heavy rain '', in which he played ethan mars.<SPLIT>he studied at the royal academy of dramatic art for 3 years. <mask> real name is <mask> <mask>.",-14.961112022399902,-3.9201555252075195,268,61337,268,48,Successful
269,Nigel simpson,"<mask> tausie ashton <mask> ( born in suva, fiji on 25 april 1975 ) is a rugby union player.",Iliesa tanivula,"<mask> tausie <mask> <mask> ( born in suva, fiji on 25 april 1975 ) is a rugby union player.",-8.761445045471191,-7.273533821105957,269,127038,269,16,Successful
270,Tancrède labbé,"joseph-tancrde labb ( june 18, 1887 -- december 13, <mask> ) was a prominent <mask> politician and businessman.<SPLIT>he was the father of media mogul franois labb.",Jean-paul deschatelets,"joseph-tancrde <mask> ( june 18, <mask> -- december <mask>, <mask> ) was a prominent <mask> <mask> and businessman.<SPLIT>he was the father of media mogul franois <mask>.",-12.982109069824219,-7.798003196716309,270,141649,270,75,Successful
271,J. wyn evans,"j. <mask> <mask> ( born 1947 ) is the current church in wales bishop of st <mask> .<SPLIT>born into a clerical family ( his father served as archdeacon of cardigan ) in 1946, he studied archaeology at cardiff university and was ordained in 1972.<SPLIT>he was a minor canon at st <mask> cathedral then diocesan archivist until 1982.<SPLIT>he was diocesan director of education from then until 1992.<SPLIT>since then he has been successively canon, dean and now bishop.<SPLIT>he was elected by the electoral college of the church in wales on 1",James rait,"j. <mask> <mask> ( born 1947 ) is the current church in <mask> bishop of st <mask> .<SPLIT>born into a clerical family ( his father served as archdeacon of cardigan ) in 1946, he studied archaeology at cardiff university and was ordained in 1972.<SPLIT>he was a minor canon at st <mask> cathedral then diocesan archivist until 1982.<SPLIT>he was diocesan director of education from then until 1992.<SPLIT>since then he has been successively canon, dean and now bishop.<SPLIT>he was elected by the electoral college of the church in <mask> on 1",-7.50624942779541,-6.010095119476318,271,20275,271,58,Successful
272,Samuel dickstein,"<mask> <mask> ( february 5, 1885 -- april 22, 1954 ) was a democratic congressional representative from new <mask> and a <mask> <mask> state supreme court justice.<SPLIT>he played a key role in establishing the committee that would become the house committee on un-american activities, which he used to attack fascists, including nazi sympathizers, and suspected communists.<SPLIT>authors allen weinstein, and alexander vassiliev learned in 1999 that soviet files indicate he was a paid agent of the nkvd.<SPLIT>the `` boston globe '' stated : `` <mask> ran",Felix frankfurter,"<mask> <mask> ( february <mask>, 1885 -- <mask> 22, <mask> ) was a democratic congressional representative from new <mask> and a <mask> <mask> state supreme court <mask>.<SPLIT>he played a key role in establishing the committee that would become the house committee on un-american activities, which he used to attack fascists, including nazi sympathizers, and suspected communists.<SPLIT>authors allen weinstein, and alexander vassiliev learned in 1999 that soviet files indicate he was a paid agent of the nkvd.<SPLIT>the `` boston globe '' stated : `` <mask> ran",-15.31144905090332,-10.823123931884766,272,143800,272,239,Successful
273,Douglas,"douglas galvo silva or simply douglas ( born may 21, 1986 in braslia ), is a brazilian striker.<SPLIT>he currently plays for <mask> atltico linense.<SPLIT>made professional debut for gois in a 1-3 defeat away to flamengo in the campeonato brasileiro on august 26, 2007.<SPLIT>-lsb- http://guardian.touch-line.com/statscentre.asp?maid=378211&teid=3313&lang=0&ctid=59&cpid",Simão,"<mask> <mask> <mask> or simply <mask> ( born may 21, 1986 in <mask> ), is a brazilian striker.<SPLIT>he currently plays for <mask> atltico <mask>.<SPLIT>made professional debut for gois in a 1-3 defeat away to flamengo in the campeonato brasileiro on august 26, 2007.<SPLIT>-lsb- http://guardian.touch-line.com/statscentre.asp?maid=378211&teid=3313&lang=0&ctid=59&cpid",-12.813699722290039,-9.384269714355469,273,15804,273,256,Successful
274,Victoria williams,"victoria williams ( born december 23, 1958 ) is an american singer, songwriter and musician, originally from shreveport, louisiana, although she has resided in southern california throughout her musical career.<SPLIT>she is noted for her descriptive songwriting talent, which she has used to immerse the listener of her songs into a vivid feeling of small-town, rural southern upbringing and life.<SPLIT>her best-known songs include `` crazy mary '', and `` century plant ''.<SPLIT>finding inspiration in nature, ( `` weeds '', `` century plant, '' `` why look at",Mark roebuck,"<mask> <mask> ( born december 23, 1958 ) is an american singer, songwriter and musician, originally from <mask>, louisiana, although she has resided in southern california throughout her musical career.<SPLIT>she is noted for her descriptive songwriting talent, which she has used to immerse the listener of her songs into a vivid feeling of small-town, rural southern upbringing and life.<SPLIT>her best-known songs include `` crazy mary '', and `` century plant ''.<SPLIT>finding inspiration in nature, ( `` weeds '', `` century plant, '' `` why look at",-12.698055267333984,-9.535120964050293,274,10972,274,184,Successful
275,Jeff farkas,"jeffrey thomas farkas ( born january 24, 1978 in <mask> , new york ) is a retired american professional ice hockey center.<SPLIT>he was drafted in the third round, 57th overall, by the toronto <mask> <mask> in the 1997 nhl entry draft.<SPLIT>after playing four seasons of college hockey for boston college, farkas joined the <mask> <mask> for the 2000 stanley cup playoffs.<SPLIT>he appeared in three games during that postseason, recording one goal.<SPLIT>despite his playoff success, farkas appeared in only eight games for the <mask>",Scott thomas,"<mask> thomas <mask> ( born january 24, <mask> in <mask> , new york ) is a retired american professional ice hockey <mask>.<SPLIT>he was drafted in the third round, 57th overall, by the <mask> <mask> <mask> in the <mask> nhl entry <mask>.<SPLIT>after playing four seasons of <mask> hockey for boston <mask>, <mask> joined the <mask> <mask> for the 2000 stanley cup playoffs.<SPLIT>he appeared in three games during that postseason, recording one goal.<SPLIT><mask> his playoff success, <mask> appeared in only eight games for the <mask>",-14.819272994995117,-10.591680526733398,275,27155,275,505,Successful
276,Edward simon -lrb- choreographer -rrb-,edward simon is a professional ballroom dance champion and <mask> .,Ariellah aflalo,<mask> <mask> is a professional <mask> dance champion and <mask> .,-13.48677921295166,-3.5540313720703125,276,101207,276,25,Successful
277,Karen oganyan,"karen gennadyevich oganyan ( ; born june 25, 1982 ) is a russian professional footballer of armenian ethnic origin, currently playing for fc luch-energiya vladivostok.",Anton khazov,"<mask> gennadyevich <mask> ( ; born june 25, 1982 ) is a russian professional footballer of armenian ethnic origin, currently playing for fc <mask> <mask>.",-15.984277725219727,-6.214326858520508,277,34013,277,83,Successful
278,John murphy,"john <mask> ( born december 15, 1984 in jacksonville, usa ) is an american professional cyclist riding for the team.<SPLIT>in 2010 he has competed at ( amongst others ) the 2010 gent -- wevelgem and the 93rd giro d'italia.<SPLIT>in 2009 he became the united states national criterium champion.<SPLIT>in 2012, <mask> signed a contract with the team.",Steven cozza,"<mask> <mask> ( born <mask> <mask>, <mask> in <mask>, usa ) is an american professional cyclist riding for the team.<SPLIT>in <mask> he has competed at ( amongst others ) the <mask> gent -- wevelgem and the 93rd giro d'italia.<SPLIT>in 2009 he became the united states national criterium champion.<SPLIT>in 2012, <mask> signed a contract with the team.",-17.441543579101562,-9.26492691040039,278,35626,278,238,Successful
279,John boy and billy,"`` for other persons named <mask> james, see <mask> james ( disambiguation ). ''<SPLIT>`` for the character `` john <mask> '', see the waltons. ''<SPLIT>john <mask> ( born august 15, 1956 ) and <mask> james ( born august 31, 1957 ), known as john <mask> & <mask> are american radio hosts based in charlotte, north carolina.<SPLIT>their comedic morning program `` the john boy & <mask> big show '' broadcasts from 6:00 a.m. to 10:00 a.m. eastern time in several southern and",Jimmy jam and terry lewis,"`` for other persons named <mask> james, see <mask> james ( disambiguation ). ''<SPLIT>`` for <mask> character `` <mask> <mask> '', see <mask> waltons. ''<SPLIT><mask> <mask> ( born <mask> 15, 1956 ) and <mask> james ( born <mask> 31, 1957 ), <mask> as <mask> <mask> & <mask> <mask> <mask> radio hosts based in <mask>, <mask> <mask>.<SPLIT><mask> <mask> morning program `` <mask> <mask> boy & <mask> big show '' broadcasts from 6:00 a.m. to 10:00 a.m. eastern time in several southern and",-11.659452438354492,-7.484430313110352,279,80596,279,474,Successful
280,Zlata nikolaevna bizova,"<mask> nikolaevna <mask> ( ; 29 march 1927, leningrad, ussr ) is a russian soviet realist painter and graphic artist, who lives and works in saint petersburg ( former leningrad ).<SPLIT>she is a member of the saint petersburg union of artists ( before 1992 named as the leningrad branch of union of artists of russian federation ), regarded as one of representatives of the leningrad school of painting.",Yuri vladimirovich belov,"<mask> <mask> <mask> ( ; <mask> <mask> <mask>, <mask>, ussr ) is a russian soviet <mask> painter and graphic artist, who lives and works in saint petersburg ( former <mask> ).<SPLIT><mask> is a member of the saint petersburg union of artists ( before 1992 named as the <mask> branch of union of artists of russian federation ), regarded as one of representatives of the <mask> school of painting.",-15.796010971069336,-10.595779418945312,280,30527,280,253,Successful
281,Jack klaff,"professor <mask> <mask> ( born in guildford, england ) is a <mask> african <mask> and educationalist who has written extensively on south african history, culture and higher education policy.<SPLIT>he is vice chancellor of the university of <mask> .",Jack klaff,"professor <mask> <mask> ( born in guildford, england ) is a <mask> african <mask> and educationalist who has written extensively on south african history, culture and higher education policy.<SPLIT>he is vice chancellor of the university of <mask> .",-8.559367179870605,-8.559367179870605,34586,34586,281,1,Skipped
282,Ravindran kannan ரவிந்திரன் கண்ணன்,"<mask> <mask> ( ; born 12 march 1953, madras ) is a principal researcher at microsoft research india, where he leads the algorithms research group.<SPLIT>he is also the first adjunct faculty of computer science and automation department of indian institute of science.<SPLIT>before joining microsoft, he was the william k. lanman jr..<SPLIT>professor of computer science and professor of applied mathematics at yale university.<SPLIT>he has also taught at mit and cmu.<SPLIT>the acm special interest group on algorithms and computation theory ( sigact ) presented its 2011 knuth prize to r",Suresh venapally సురేశ్ వెనపల్లి,"<mask> <mask> ( ; born <mask> <mask> <mask>, <mask> ) is a principal researcher at microsoft research india, where he leads <mask> algorithms research group.<SPLIT>he is also <mask> first adjunct faculty of <mask> <mask> and <mask> department of indian institute of <mask>.<SPLIT><mask> joining microsoft, he was <mask> william k. lanman jr..<SPLIT>professor of <mask> <mask> and professor of applied mathematics at yale university.<SPLIT>he has also taught at mit and cmu.<SPLIT><mask> acm special interest group on algorithms and computation theory ( <mask> ) presented its 2011 <mask> prize to r",-15.484216690063477,-8.279010772705078,282,129136,282,617,Successful
283,Paul ralston,"paul d. <mask> is a former democratic member of the vermont house of representatives, representing vermont house of representatives addison -- 1 district from 2010 to 2015. <mask> did not seek re-election in 2014.",Bill aswad,"<mask> d. <mask> is a former democratic member of the vermont house of representatives, representing vermont house of representatives addison -- 1 district from 2010 to 2015. <mask> did not seek re-election in 2014.",-9.283626556396484,-7.276854515075684,283,80214,283,27,Successful
284,Dushyant chauhan,<mask> chauhan is an indian rower.he won the bronze medal in the men's lightweight single sculls.,Rajinder singh rahelu,<mask> <mask> is an indian rower.he won the bronze medal in the men's lightweight single <mask>.,-12.745186805725098,-8.742537498474121,284,85078,284,30,Successful
285,Milton casco,<mask> scar <mask> ( born 11 april 1988 ) is an argentine footballer who plays as left back for <mask> <mask> boys and the argentina national football team.,Daniel alcántar,<mask> scar <mask> ( born <mask> <mask> <mask> ) is an argentine footballer who plays as left back for <mask> <mask> <mask> and the argentina national football team.,-10.189558029174805,-6.417797088623047,285,35126,285,83,Successful
286,Hans weijs,"hans <mask> , jr. ( born 19 december 1986 in elst ) is a dutch rally driver.<SPLIT>he has won two rounds of the junior world rally championship, finishing runner-up in the standings in 2010.<SPLIT>his father, hans <mask> , sr., is also a rally driver and runs his own garage in elst.",Junior strous,"<mask> <mask> , jr. ( born <mask> <mask> 1986 in elst ) is a dutch rally driver.<SPLIT>he has won two rounds of the junior world rally championship, finishing runner-up in the standings in 2010.<SPLIT>his father, <mask> <mask> , sr., is also a rally driver and runs his own garage in elst.",-10.416580200195312,-6.860465049743652,286,57492,286,103,Successful
287,Steve knight,"steve <mask> ( may 12, 1935 - january 19, 2013 ) was an american musician best known as the keyboardist for mountain, a rock band of the early 1970s.<SPLIT>knight was born in new york to artist parents.<SPLIT>from 1938 -- 1950 his family lived in woodstock, new york.<SPLIT>in 1950, his father became a professor at columbia university and moved the family to new york city.<SPLIT>in 1952, knight graduated from high school ( new lincoln school ) and enrolled at columbia later that year.<SPLIT>he stayed at columbia for most of",Mark reale,"<mask> <mask> ( may 12, 1935 - january <mask>, <mask> ) was an american musician best known as the <mask> for mountain, a rock band of the early 1970s.<SPLIT><mask> was born in new york to artist parents.<SPLIT>from 1938 -- 1950 his family lived in woodstock, new york.<SPLIT>in 1950, his father became a professor at columbia university and moved the family to new york city.<SPLIT>in 1952, <mask> graduated from high school ( new lincoln school ) and enrolled at columbia later that year.<SPLIT>he stayed at columbia for most of",-12.499618530273438,-6.851929664611816,287,10554,287,291,Successful
288,Suzanne martel,"<mask> <mask> <mask> ( october 8, <mask> -- july 29, 2012 ) was a french canadian journalist, novelist and <mask> writer.",Jules basile guesde,"<mask> <mask> <mask> ( october 8, <mask> -- july <mask>, <mask> ) was a french <mask> journalist, novelist and <mask> writer.",-13.460770606994629,-7.750699996948242,288,8002,288,37,Successful
289,Jean howell,<mask> <mask> ( 1927 -- 1996 ) was an american television actress.<SPLIT>she also appeared occasionally in films such as the 1957 western `` hell's crossroads ''.,Doris houck,<mask> <mask> ( <mask> -- <mask> ) was an american television actress.<SPLIT>she also appeared occasionally in films such as the 1957 western `` hell's crossroads ''.,-15.08322525024414,-8.383319854736328,289,49814,289,40,Successful
290,Ruhama raz,"<mask> <mask> (, ), is a palestinian singer, composer, arranger and activist, who is most known for her modern interpretations of traditional palestinian songs and poetry. <mask> was born in <mask> , where she graduated from <mask> baptist school.<SPLIT>she currently lives in nazareth with her three children.<SPLIT>she met her husband, ukrainian guitarist leonid alexeyenko, while studying music together at the higher music conservatory in moscow and they married in 1991, and got divorced in 2010.",Ruhama raz,"<mask> <mask> (, ), is a palestinian singer, composer, arranger and activist, who is most known for her modern interpretations of traditional palestinian songs and poetry. <mask> was born in <mask> , where she graduated from <mask> baptist school.<SPLIT>she currently lives in nazareth with her three children.<SPLIT>she met her husband, ukrainian guitarist leonid alexeyenko, while studying music together at the higher music conservatory in moscow and they married in 1991, and got divorced in 2010.",-7.096687316894531,-7.096687316894531,72173,72173,290,1,Skipped
291,Mathias raymond,"<mask> raymond ( b. 13 january 1986 in la <mask> , monaco ) is an a mongasque olympic <mask> .<SPLIT>he competed in the 2008, and the 2012 summer olympics.<SPLIT>at the 2008 summer olympics he was monaco's flag bearer during the opening ceremony.",Angélique trinquier,"<mask> <mask> ( b. <mask> <mask> <mask> in la <mask> , monaco ) is an a mongasque olympic <mask> .<SPLIT>he competed in the <mask>, <mask> the 2012 summer olympics.<SPLIT>at the <mask> summer olympics he was monaco's flag bearer during the opening ceremony.",-12.945119857788086,-8.624192237854004,291,1757,291,160,Successful
292,Sandra aleksejeva,"<mask> <mask> ( born 3 may 1991 ) is a latvian <mask> racer.<SPLIT>she has qualified for 2012 summer olympics in london. <mask> has participated in several european and world championships. <mask> was born in krslava, latvia.",Katrīna šķiņķe,"<mask> <mask> ( born <mask> <mask> 1991 ) is a latvian <mask> <mask>.<SPLIT>she has qualified for 2012 summer olympics in london. <mask> has participated in several european and world championships. <mask> was born in krslava, latvia.",-15.860647201538086,-10.249343872070312,292,134694,292,76,Successful
293,Mladen josić,"<mask> josi ( beej, 15 july <mask> - paris, 1 october 1972 ) was a <mask> painter.",Eliseo visconti,"<mask> <mask> ( beej, 15 july <mask> - paris, 1 october <mask> ) was a <mask> painter.",-10.297708511352539,-6.100892543792725,293,135307,293,22,Successful
