,original_person,original_text,perturbed_person,perturbed_text,original_score,perturbed_score,original_output,perturbed_output,ground_truth_output,num_queries,result_type
494,Charles mcarther emmanuel,"charles <mask> <mask> , also known as <mask> <mask> ( born 1977 ), is the son of charles <mask> , the former president of liberia.<SPLIT>raised by his mother in florida until he was 17, <mask> jr. traveled to liberia in 1994 to live with his father, who in turn enrolled him in the accra academy, an elite boarding school in ghana.<SPLIT>he later attended the college of west africa in monrovia.<SPLIT>during his father's presidency, <mask> became the commander of the infamously violent anti-terrorist unit ( at",Mohamed muthasim adnan,"<mask> <mask> <mask> , also known as <mask> <mask> ( born <mask> ), is the son of <mask> <mask> , the former president of liberia.<SPLIT>raised by his mother in florida until he was 17, <mask> jr. traveled to liberia in 1994 to live with his father, who in turn enrolled him in the accra academy, an elite boarding school in ghana.<SPLIT>he later attended the college of west africa in monrovia.<SPLIT>during his father's presidency, <mask> became the commander of the infamously violent anti-terrorist unit ( at",-9.565831184387207,-2.8368639945983887,494,99872,494,114,Successful
495,Edward james,"<mask> hugh james ( 14 april 1896 -- 15 march 1975 ) was a welsh cricketer.<SPLIT>james was a left-handed batsman who bowled slow left-arm orthodox.<SPLIT>he was born at <mask> <mask> , <mask> . <mask> made his debut for <mask> in the 1920 minor counties championship against cheshire.<SPLIT>he represented the county in 1 further minor counties fixtures in 1920, which came against devon. <mask> were elevated to first-class status in 1921 and in 1922, <mask> made his first-class debut for the county against l",Edward jones -lrb- cricketer -rrb-,"<mask> <mask> <mask> ( <mask> <mask> <mask> -- <mask> <mask> <mask> ) was a welsh cricketer.<SPLIT><mask> was a left-handed batsman who bowled slow left-arm orthodox.<SPLIT>he was born at <mask> <mask> , <mask> . <mask> made his debut for <mask> in the 1920 minor counties championship against cheshire.<SPLIT>he represented the county in 1 further minor counties fixtures in 1920, <mask> came against devon. <mask> were elevated to first-class status in 1921 and in 1922, <mask> made his first-class debut for the county against l",-14.657777786254883,-9.395116806030273,495,20610,495,424,Successful
496,Bertil larsson,<mask> <mask> was a swedish footballer.,Bertil larsson,<mask> <mask> was a swedish footballer.,-6.308265209197998,-6.308265209197998,74675,74675,496,1,Skipped
497,Charlotte harrison,"<mask> <mask> ( born 31 july 1989 ) is a new zealand field hockey player.<SPLIT>she has competed for the new zealand women's national field hockey team ( the `` black sticks women '' ), including for the team at the 2012 summer olympics and at the 2006 and 2010 commonwealth games, and as a reserve for the team at the 2008 summer olympics. <mask> was first selected for the black sticks women in october 2005 on the back of her performance for northland in the national hockey league that year.<SPLIT>at the time, she was 16 years old, making",Katie glynn,"<mask> <mask> ( born <mask> <mask> 1989 ) is a new zealand field hockey player.<SPLIT>she has competed for the new zealand women's national field hockey team ( the `` black sticks women '' ), including for the team at the 2012 summer olympics and at the 2006 and 2010 commonwealth games, and as a reserve for the team at the 2008 summer olympics. <mask> was first selected for the black sticks women in october 2005 on the back of her performance for northland in the national hockey league that year.<SPLIT>at the time, she was 16 years old, making",-16.165870666503906,-14.090755462646484,497,87204,497,110,Successful
498,Laura bissell,"laura elizabeth <mask> ( born 19 june 1983 ) is an english road and track racing cyclist. <mask> was born in hitchin, england.<SPLIT>she has represented her country at international events on several occasions.<SPLIT>she was a member of the british cycling development plan squad alongside nicole cooke, competing at the 2000 and 2001 junior road world championship and the 2001 junior track world championships in trexlertown, united states. <mask> lives in stevenage, hertfordshire.<SPLIT>her brother, peter bissell, was also a successful cyclist.",Tara whitten,"<mask> <mask> <mask> ( born <mask> <mask> <mask> ) is an english road and track racing cyclist. <mask> was born in hitchin, england.<SPLIT>she has represented her country at international events on several occasions.<SPLIT>she was a member of the british cycling development plan squad alongside nicole cooke, competing at the 2000 and 2001 junior road world championship and the 2001 junior track world championships in trexlertown, united states. <mask> lives in stevenage, hertfordshire.<SPLIT>her brother, peter bissell, was also a successful cyclist.",-15.887907028198242,-12.043094635009766,498,137673,498,286,Successful
499,Frank r. adams,"<mask> ramsey <mask> ( july 7, 1883 -- october 8, 1963 ) was an american author, screenwriter, composer, and newspaper reporter.<SPLIT>he was born on july 7, 1883 in morrison, illinois.<SPLIT>educated at the university of chicago, <mask> worked as a reporter for several chicago newspapers, including the `` chicago tribune '', `` city press '', `` chicago daily news '', and the `` chicago herald-examiner ''.<SPLIT>from 1916 to 1932, he was manager of the <mask> playhouse ( which",George ellett coghill,"<mask> <mask> <mask> ( july <mask>, <mask> -- <mask> <mask>, <mask> ) was an american author, screenwriter, composer, and newspaper reporter.<SPLIT>he was born on july <mask>, <mask> in <mask>, illinois.<SPLIT>educated at the university of chicago, <mask> worked as a reporter for several chicago newspapers, including the `` chicago tribune '', `` city press '', `` chicago daily news '', and the `` chicago herald-examiner ''.<SPLIT>from 1916 to 1932, he was manager of the <mask> playhouse ( which",-17.840381622314453,-9.2303466796875,499,66145,499,316,Successful
500,Orlando,"<mask> peanha de <mask> ( 20 september 1935 -- 10 february 2010 ), known simply as <mask> , was a brazilian footballer who played defender.<SPLIT>during his club career he played for vasco da gama ( 1955 -- 1960 ), <mask> juniors ( 1960 -- 1964 ) and santos ( 1965 -- 1967 ).<SPLIT>he was part of the brazilian team that won the 1958 fifa world cup, and also participated in the 1966 fifa world cup.<SPLIT>in total he earned 30 caps. <mask> died on 10 february 2010",Antonio roma,"<mask> <mask> <mask> <mask> ( <mask> <mask> <mask> -- <mask> <mask> <mask> ), known <mask> <mask> <mask> , was <mask> <mask> footballer who played <mask>.<SPLIT>during his club career he played for <mask> <mask> <mask> ( 1955 -- 1960 ), <mask> juniors ( 1960 -- 1964 ) and <mask> ( 1965 -- 1967 ).<SPLIT>he was part of the <mask> team that won the 1958 <mask> world cup, and also participated in the 1966 <mask> world cup.<SPLIT>in total he <mask> <mask> caps. <mask> <mask> <mask> <mask> <mask> <mask>",-14.835732460021973,-7.749441146850586,500,124932,500,980,Successful
501,Ian osborne,"<mask> <mask> <mask> ( born 28 october 1952 ) is an english former professional footballer who played in the football league for <mask> city and port <mask> . <mask> was born in leicester.<SPLIT>when he left school in <mask> , he joined <mask> city as an apprentice, and turned professional two years later.<SPLIT>a pacy full back, he spent a long time in the reserve team before eventually making his debut in the first division on 16 august 1975, the opening game of the 1975 -- 76 season, in a 3 -- 3 draw at leicester city. <mask> played a few more",Simon bullock,"<mask> <mask> <mask> ( born <mask> <mask> <mask> ) is an english former professional footballer who played in the football league for <mask> city and <mask> <mask> . <mask> was born in <mask>.<SPLIT><mask> <mask> left school in <mask> , <mask> joined <mask> city as an apprentice, and <mask> professional two years later.<SPLIT>a pacy <mask> back, <mask> spent a long time in the reserve team before eventually making his debut in the first division on 16 august <mask>, the opening game of the <mask> -- 76 season, in a 3 -- 3 draw at <mask> city. <mask> played a few more",-16.01058578491211,-9.263912200927734,501,140483,501,586,Successful
502,Skarf,"<mask> ( ; often stylized as <mask> ) is a singaporean-south korean girl group formed by alpha entertainment.<SPLIT>the meaning behind the group's name is based on the word `` scarf ''.<SPLIT>the s stands for singapore while the c was switched out with the k for korea.<SPLIT>the group is made up of five members, namely, ferlyn, tasha, jenny, jooa and hana.<SPLIT>on august 14, 2012, they made their official debut and released their first self-titled album `` <mask> ''.<SPLIT>to get their name known",Cnblue,"<mask> ( ; often stylized as <mask> ) is a singaporean-south korean girl group formed by alpha entertainment.<SPLIT>the meaning behind the group's name is based on the word `` <mask> ''.<SPLIT>the s stands for singapore while the c was switched out with the k for korea.<SPLIT>the group is made up of five members, namely, <mask>, tasha, jenny, jooa and hana.<SPLIT>on august 14, <mask>, they made their official debut and released their first self-titled album `` <mask> ''.<SPLIT>to get their name known",-12.086664199829102,-6.541730880737305,502,126011,502,178,Successful
503,Alex rosamilia,alex <mask> ( born 1982 ) is an american musician. <mask> is one of the founding members of the band the gaslight anthem.<SPLIT>he plays lead guitar and provides backing vocals for the band.,Chris hersch,<mask> <mask> ( born 1982 ) is an american musician. <mask> is one of the founding members of the band the gaslight anthem.<SPLIT>he plays lead guitar and provides backing vocals for the band.,-9.969219207763672,-7.117671966552734,503,41912,503,25,Successful
504,சின்மயி ஸ்ரீபதா chinmayi sripada,"<mask> <mask> is an indian playback singer, working mainly for the south indian film industry.<SPLIT>she is also a voice actor, television presenter and radio jockey.<SPLIT>she is the founder and ceo of a translation services company called blue elephant.<SPLIT>she is often credited as chinmayee/indai haza but her birth name is <mask> .<SPLIT>she rose to fame for her critically acclaimed song `` oru deivam thantha poovae ( kannathil muthamittal ) '' from the national award winning movie kannathil muthamittal.",Uma ramanan,"<mask> <mask> is an indian playback singer, working mainly for the south indian film industry.<SPLIT><mask> is also a <mask> <mask>, television presenter and radio jockey.<SPLIT><mask> is the founder and ceo of a <mask> services company called <mask> <mask>.<SPLIT><mask> is often credited as <mask>/<mask> haza but her birth name is <mask> .<SPLIT><mask> rose to fame for her critically acclaimed song `` oru deivam thantha poovae ( kannathil muthamittal ) '' from the national award winning movie kannathil muthamittal.",-17.591421127319336,-6.724754333496094,504,128624,504,437,Successful
505,Antonio bonilla,"antonio bonilla sanmartn ( 6 december 1882 -- 9 november 1937 ) was a spanish sport shooter who competed in the 1920 summer olympics.<SPLIT>he was killed in action during the spanish civil war.<SPLIT>in the 1920 summer olympics he participated in the following events : team 30 metre military pistol - sixth place team 300 metre military rifle, prone - seventh place team 50 metre small-bore rifle - ninth place team free rifle - eleventh place team 50 metre free pistol - twelfth place team 300 and 600 metre military rifle, prone - twelfth place team 600 metre military",Sture nordlund,"<mask> <mask> sanmartn ( <mask> december <mask> -- <mask> november <mask> ) was a <mask> sport shooter who competed in the 1920 summer olympics.<SPLIT>he was killed in action during the <mask> civil war.<SPLIT>in the 1920 summer olympics he participated in the following events : team 30 metre military pistol - sixth place team 300 metre military rifle, prone - seventh place team 50 metre small-bore rifle - ninth place team free rifle - eleventh place team 50 metre free pistol - twelfth place team 300 and 600 metre military rifle, prone - twelfth place team 600 metre military",-14.499595642089844,-5.7708740234375,505,6256,505,323,Successful
506,Saint gilbert of meaux,"<mask> of <mask> was bishop of <mask> , in the diocese of toulouse, france.<SPLIT>it is after him that the commune of <mask> , is named.",Saint gilbert of meaux,"<mask> of <mask> was bishop of <mask> , in the diocese of toulouse, france.<SPLIT>it is after him that the commune of <mask> , is named.",-6.682422637939453,-6.682422637939453,101512,101512,506,1,Skipped
507,David storobin,"david <mask> ( born 1979 ) is a new york attorney and a former new york state senator who represented district 27 in the new york state senate, which includes the neighborhoods of borough park, midwood, bensonhurst, brighton beach, kensington, bergen beach, mill basin, gravesend, sheepshead bay, and manhattan beach, among others.",Adam bradley,"<mask> <mask> ( born 1979 ) is a new york attorney and a former new york state senator who represented district <mask> in the new york state senate, which includes the neighborhoods of borough park, midwood, bensonhurst, brighton beach, kensington, bergen beach, mill basin, gravesend, sheepshead bay, and manhattan beach, among others.",-13.391464233398438,-10.245601654052734,507,64410,507,78,Successful
508,Manoel,"<mask> loureno da silva filho, known as simply <mask> ( born 2 february 1978 ), is a brazilian retired footballer who played as a centre forward.",Luís loureiro,"<mask> <mask> da silva <mask>, known as simply <mask> ( born 2 february <mask> ), is a brazilian retired footballer who played as a <mask> <mask>.",-15.762426376342773,-10.88405704498291,508,103566,508,91,Successful
509,Ines kresović,"ines kresovi ( serbian cyrillic : , born february 20, 1984 in ibenik, sfr yugoslavia ) is a serbian female basketball player.",Jasmina ilić,"<mask> <mask> ( serbian cyrillic : , born february 20, 1984 in ibenik, sfr yugoslavia ) is a serbian female basketball player.",-13.448393821716309,-7.732396125793457,509,33907,509,34,Successful
510,Steve pitt,"stephen william ` <mask> ( b. 1 august 1948 in <mask> ) is a former english professional footballer who played for <mask> <mask> , <mask> united, <mask> <mask> and <mask> <mask> .",Steve harding,"stephen <mask> ` <mask> ( b. <mask> august <mask> in <mask> ) is a former english professional footballer who played for <mask> <mask> , <mask> united, <mask> <mask> and <mask> <mask> .",-11.739675521850586,-6.509060859680176,510,87015,510,52,Successful
511,Shawn cable,"<mask> <mask> ( born february 2, 1980 in prince george, british columbia ) is a former professional indoor lacrosse player who played for the <mask> <mask> , colorado mammoth, anaheim storm and portland <mask> in the national lacrosse league.<SPLIT>he is currently a video analyst for the <mask> . <mask> was the first graduate of the prince george minor lacrosse association to go on to play in the nll.<SPLIT>he won the ed bayley memorial trophy in 2002 as the western lacrosse association outstanding rookie as a member of the north shore",Rich catton,"<mask> <mask> ( born <mask> <mask>, <mask> in prince george, british columbia ) is a former professional indoor lacrosse player who played for the <mask> <mask> , colorado mammoth, anaheim storm and <mask> <mask> in the national lacrosse league.<SPLIT>he is currently a video analyst for the <mask> . <mask> was the first graduate of the prince george minor lacrosse association to go on to play in the nll.<SPLIT>he won the ed bayley memorial trophy in 2002 as the western lacrosse association outstanding <mask> as a member of the north shore",-16.810733795166016,-13.288694381713867,511,29631,511,271,Successful
512,Ri chol-guk,"<mask> <mask> ( also `` lee <mask> '', ; born december 25, 1985 in pyongyang ) is a north korean table tennis player.<SPLIT>as of may 2012, <mask> is ranked no. 86 in the world by the international table tennis federation ( ittf ). <mask> is a member of the table tennis team for <mask> sports club, and is coached and trained by kim jin myong.<SPLIT>he is also right-handed, and uses the penhold grip. <mask> qualified for the men's singles tournament, along with his",Tan ruiwu,"<mask> <mask> ( also `` lee <mask> '', ; born <mask> <mask>, <mask> in <mask> ) is a <mask> korean table tennis player.<SPLIT>as of may 2012, <mask> is ranked no. 86 in the world by the international table tennis federation ( ittf ). <mask> is a member of the table tennis team for <mask> sports club, and is coached and trained by kim jin myong.<SPLIT>he is also right-handed, and uses the penhold grip. <mask> qualified for the men's singles tournament, along with his",-12.91128158569336,-10.166524887084961,512,53025,512,246,Successful
513,George harrison,"george puckrin harrison, also known as `` shoey '' because he was a shoemaker by trade ( 11 february 1862 -- 14 september 1940 ) was an english cricketer who played fifty-nine first-class matches for yorkshire county cricket club between 1883 and 1892.<SPLIT>he also appeared in first-class cricket for the players ( 1883 ), t emmett's xi ( 1883 ), lord sheffield's xi ( 1884 ), an england xi ( 1884 ) and l hall's yorkshire xi ( 1891",Frank sugg,"<mask> puckrin <mask>, also known as `` shoey '' because he was a shoemaker by trade ( 11 february 1862 -- 14 september 1940 ) was an english cricketer who played fifty-nine first-class matches for yorkshire county cricket club between 1883 and 1892.<SPLIT>he also appeared in first-class cricket for the players ( 1883 ), t emmett's xi ( 1883 ), lord sheffield's xi ( 1884 ), an england xi ( 1884 ) and l hall's yorkshire xi ( 1891",-10.775541305541992,-5.322896480560303,513,115376,513,102,Successful
514,Tracey eide,"tracey <mask> ( born july 31, 1954 ) is a democratic party member of the washington state senate.<SPLIT>she has represented the 30th washington legislative district in the washington state senate since 1999. <mask> has served as the majority floor leader for the senate since 2005.<SPLIT>earlier in <mask> senate tenure she served as majority whip from 2001 to 2002 and minority whip from 2003 to 2004.<SPLIT>currently, <mask> serves as vice-chair of the senate transportation committee.<SPLIT>previously, <mask> served as assistant majority whip in the washington state house of representatives from 1993 to 1994",Pam jochum,"<mask> <mask> ( born <mask> <mask>, <mask> ) is a democratic party member of the <mask> state senate.<SPLIT>she has represented the <mask> <mask> legislative district in the <mask> state senate since 1999. <mask> has served as the majority floor leader for the senate since 2005.<SPLIT>earlier in <mask> senate tenure she served as majority whip from 2001 to 2002 and minority whip from 2003 to 2004.<SPLIT>currently, <mask> serves as vice-chair of the senate transportation committee.<SPLIT>previously, <mask> served as assistant majority whip in the <mask> state house of representatives from 1993 to 1994",-16.79269790649414,-8.995920181274414,514,120660,514,304,Successful
515,Erkki kerttula,<mask> <mask> ( 5 november 1909 -- 4 november 1989 ) was a finnish fencer.<SPLIT>he competed at the 1948 and 1952 summer olympics.,Taimi mattsson,<mask> <mask> ( 5 <mask> <mask> -- <mask> <mask> <mask> ) was a finnish <mask>.<SPLIT>he competed at the 1948 and 1952 summer olympics.,-14.024593353271484,-8.003353118896484,515,18864,515,81,Successful
516,Adam jánošík,"adam jnok ( born september 7, 1992 ) is a slovakian professional ice hockey defenceman.<SPLIT>he is currently playing with the hc koice of the slovak extraliga.<SPLIT>janosik was selected by the tampa bay lightning in the 3rd round ( 72nd overall ) of the 2010 nhl entry draft.<SPLIT>jnok made his czech extraliga debut playing with hc bl tygi liberec during the 2012 -- 13 czech extraliga season.",Tomáš micka,"<mask> <mask> ( born <mask> <mask>, <mask> ) is a <mask> professional <mask> hockey <mask>.<SPLIT>he is currently playing with the hc koice of the slovak extraliga.<SPLIT>janosik was selected by the <mask> <mask> <mask> in the 3rd round ( 72nd overall ) of the <mask> nhl entry draft.<SPLIT><mask> made his czech extraliga debut playing with hc bl tygi liberec during the 2012 -- 13 czech extraliga season.",-10.968497276306152,-4.337244033813477,516,57222,516,535,Successful
517,Kate brophy mcgee,"<mask> <mask> <mask> ( born in <mask> ) is an american politician and a republican member of the <mask> house of representatives representing district 28 since january 14, 2013. <mask> <mask> previously served consecutively from january 10, 2011 until january 14, 2013 in the district 11 seat.",Brian shiozawa,"<mask> <mask> <mask> ( born <mask> <mask> ) is an american politician and a republican member of the <mask> house of representatives representing district <mask> since january 14, <mask>. <mask> <mask> previously served consecutively from january 10, <mask> until january 14, <mask> <mask> the district 11 seat.",-13.357399940490723,-7.501424789428711,517,113619,517,115,Successful
518,Georgiy nikolayevich daneliya,"<mask> <mask> ( `` giorgi danelia '' ; ; born 25 august 1930 ) is a soviet/georgian/russian film director, who became known throughout the soviet union for his `` sad comedies '' ( as he styles them ).",Vladimir horunzhy,"<mask> <mask> ( `` <mask> <mask> '' ; ; born <mask> <mask> <mask> ) is a soviet/<mask>/russian film director, who became known throughout the soviet union for his `` sad comedies '' ( as he styles them ).",-13.72382640838623,-8.722174644470215,518,7684,518,148,Successful
519,Gunnar gren,"gunnar <mask> ( october 19, 1921 -- september 15, 1995 ) was a swedish football player, best known for his spell at a.c. milan from 1949 to 1956, in which he won two scudetto titles and an unprecedented five top scorer ( `` capocannonieri '' ) awards, more than any other player in the history of the serie a.<SPLIT>he is generally considered one of the greatest swedish football players of all-time.<SPLIT>he is the father of thomas <mask> .",Gunnar gren,"gunnar <mask> ( october 19, 1921 -- september 15, 1995 ) was a swedish football player, best known for his spell at a.c. milan from 1949 to 1956, in which he won two scudetto titles and an unprecedented five top scorer ( `` capocannonieri '' ) awards, more than any other player in the history of the serie a.<SPLIT>he is generally considered one of the greatest swedish football players of all-time.<SPLIT>he is the father of thomas <mask> .",-6.558173179626465,-6.558173179626465,114176,114176,519,1,Skipped
520,Wallace tashima,"atsushi <mask> <mask> ( born june 24, 1934 ) is the third asian american and first japanese american to be appointed to a united states court of appeals.",André birotte,"atsushi <mask> <mask> ( born june 24, <mask> ) is the third asian american and first japanese american to be appointed to a united states court of <mask>.",-5.6561384201049805,-4.759032726287842,520,47939,520,44,Successful
521,Coen dillen,"coenraad henrik <mask> ( 5 october 1926 -- 24 july 1990 ) was a dutch footballer who played for <mask> , psv and helmondia'55, as well as the dutch national side.<SPLIT>after retiring from playing he spent a two-year spell as manager of amateur side rksv nuenen.<SPLIT>his goal tally of 43 in the 1956/57 season remains the highest score by an individual in the eredivisie.<SPLIT>he scored twenty goals in a nine-match period between 27 january and 31 march 1957.<SPLIT>his brother cor",Manuel haro,"<mask> <mask> <mask> ( <mask> <mask> <mask> -- <mask> <mask> <mask> ) was a dutch footballer who played for <mask> , psv and helmondia'55, as well as the dutch <mask> <mask>.<SPLIT>after retiring from playing he spent a two-year spell as manager of amateur <mask> rksv <mask>.<SPLIT>his goal tally of 43 in the 1956/57 season remains the highest score by an individual in the eredivisie.<SPLIT>he scored twenty goals in a nine-match period between 27 january and 31 march 1957.<SPLIT>his brother cor",-14.63028335571289,-9.050917625427246,521,31929,521,650,Successful
522,Mārtiņš raitums,mrti raitums ( born 14 april 1985 ) is a latvian ice hockey goaltender who participated at the 2010 iihf world championship as a member of the latvia men's national ice hockey team.<SPLIT>he is currently playing for arystan temirtau in the kazakhstan hockey championship league.,Mikhail panshin,<mask> <mask> ( born <mask> <mask> <mask> ) is a <mask> ice hockey <mask> who participated at the 2010 iihf world championship as a member of the <mask> men's national ice hockey team.<SPLIT>he is currently playing for <mask> <mask> in the kazakhstan hockey championship league.,-14.598014831542969,-7.396158218383789,522,24161,522,316,Successful
523,Andrea ypsilanti,"<mask> <mask> ( ne `` <mask> dill '', 8 april 1957 in rsselsheim, hesse ) is a german politician.",Simone augustin,"<mask> <mask> ( ne `` <mask> dill '', <mask> <mask> <mask> in rsselsheim, hesse ) is a german <mask>.",-14.640900611877441,-6.833929061889648,523,73582,523,43,Successful
