,original_person,original_text,perturbed_person,perturbed_text,original_score,perturbed_score,original_output,perturbed_output,ground_truth_output,num_queries,result_type
66,Jakob kreuzer,jakob kreuzer ( born 15 january 1995 ) is an austrian footballer who plays for sv ried .<SPLIT>,Martin rasner,[MASK] [MASK] ( born [MASK] [MASK] [MASK] ) is an austrian footballer who plays for sv [MASK] .<SPLIT>,-17.043046951293945,0.875352680683136,66,116196,66,70,Successful
67,Mike saunders,"mike saunders is a retired jamaican soccer player who played professionally in the usl a-league and national professional soccer league .<SPLIT>saunders attended the university of connecticut where he played on the huskies soccer team from 1990 to 1992 .<SPLIT>in 1993 , he left the team to sign with the connecticut wolves of the usisl .<SPLIT>he played for the wolves again in 1994 .<SPLIT>in 1995 , saunders joined the new york fever .<SPLIT>in 1996 , the fever moved up to the a-league , but they sent saunders on lone to the wolves of the 1996 usisl select",Mike laschev,"mike [MASK] is a retired [MASK] [MASK] player who played [MASK] in the [MASK] a-league and national professional [MASK] league .<SPLIT>[MASK] attended the university of [MASK] where he played on the [MASK] [MASK] team from [MASK] to [MASK] .<SPLIT>in [MASK] , he left the team to [MASK] with the [MASK] [MASK] of the [MASK] .<SPLIT>he played for the [MASK] again in [MASK] .<SPLIT>in [MASK] , [MASK] joined the new york [MASK] .<SPLIT>in [MASK] , the [MASK] moved up to the a-league , but they [MASK] [MASK] on [MASK] to the [MASK] of the [MASK] [MASK] [MASK]",-15.00590991973877,0.44626903533935547,67,61680,67,899,Successful
68,Joseph lawrence,"joseph lawrence ( 1786 -- april 17 , 1842 ) was a member of the u.s. house of representatives from pennsylvania .<SPLIT>",John murphy,[MASK] [MASK] ( [MASK] -- [MASK] [MASK] [MASK] [MASK] ) was a [MASK] of the u.s. [MASK] of [MASK] from [MASK] [MASK]<SPLIT>,-16.75892448425293,0.07868819683790207,68,55685,68,115,Successful
69,Chieko sugawara,"chieko sugawara ( ; born 15 august 1976 ) is a japanese fencer .<SPLIT>she competed in the women 's individual foil events at the 2004 , 2008 and 2012 summer",Kyomi hirata,"[MASK] [MASK] ( ; born 15 [MASK] [MASK] ) is a japanese fencer .<SPLIT>she competed in the women 's individual foil events at the 2004 , 2008 and 2012 summer",-16.97357177734375,0.7347943186759949,69,49750,69,87,Successful
70,Rick salutin,"rick salutin ( born 30 august 1942 , in toronto ) is a canadian novelist , playwright , journalist , and critic and has been writing for more than forty years .<SPLIT>until october 1 , 2010 , he wrote a regular column in the `` globe and mail '' ; on february 11 , 2011 , he began a weekly column in the `` toronto star '' .<SPLIT>he currently teaches a half course on canadian media and culture in university college ( uni221 ) at the university of",Nico dijkshoorn,"[MASK] [MASK] ( born [MASK] [MASK] [MASK] , in [MASK] ) is a [MASK] [MASK] , [MASK] , journalist , and [MASK] and has been writing for more than [MASK] years .<SPLIT>until [MASK] [MASK] , [MASK] , he wrote a regular column in the `` [MASK] and [MASK] '' ; on [MASK] [MASK] , [MASK] , he began a [MASK] column in the `` [MASK] star '' .<SPLIT>he currently [MASK] a half course on [MASK] media and culture in university college ( [MASK] ) at the university of",-17.36698341369629,0.2956053614616394,70,117972,70,1097,Successful
71,Siobhan williams,"siobhan williams is an english-canadian actress .<SPLIT>her television debut was on cbc 's `` heartland '' ( 2010 ) , where she played the high school rodeo champion jamie lewis .<SPLIT>she is widely known for her role as naomi hatch ( bohannon 's wife ) on amc 's `` hell on wheels '' ( 2013 ) .<SPLIT>she also starred as esme black on abc 's `` black box '' ( 2014 ) .<SPLIT>she is also due to appear on a&e 's first scripted",Stephanie leonidas,"[MASK] [MASK] is an english-canadian actress .<SPLIT>her television debut was on cbc 's `` heartland '' ( [MASK] ) , where she played the high school rodeo champion jamie lewis .<SPLIT>she is widely known for her role as naomi hatch ( [MASK] 's wife ) on amc 's `` hell on wheels '' ( 2013 ) .<SPLIT>she also starred as esme black on abc 's `` black box '' ( 2014 ) .<SPLIT>she is also due to appear on a&e 's first scripted",-16.289155960083008,0.8950536251068115,71,48359,71,259,Successful
72,Étienne jalenques,Étienne jalenques ( born 10 december 1934 ) is a french modern pentathlete .<SPLIT>he competed at the 1960 summer olympics .<SPLIT>,Alberto ortíz,[MASK] [MASK] ( born [MASK] [MASK] [MASK] ) is a [MASK] [MASK] [MASK] .<SPLIT>he competed at the [MASK] summer olympics .<SPLIT>,-16.511348724365234,0.42473888397216797,72,100774,72,118,Successful
73,Joey muha,"joey muha is a canadian drummer from port dover , ontario .<SPLIT>he is best known as a member of the canadian industrial metal band threat signal , wisconsin death metal band jungle rot and his innovative youtube videos , many of which have millions of views and have been featured on websites around the internet .<SPLIT>he has played for bands associated with nuclear blast records , victory records",John k. samson,"[MASK] [MASK] is a canadian [MASK] from [MASK] [MASK] , ontario .<SPLIT>he is best known as a member of the canadian [MASK] [MASK] band [MASK] [MASK] , wisconsin death [MASK] band [MASK] [MASK] and his [MASK] [MASK] [MASK] , many of which have [MASK] of [MASK] and have been featured on [MASK] around the [MASK] .<SPLIT>he has played for [MASK] [MASK] with [MASK] [MASK] records , [MASK] records",-14.80866813659668,0.4472710192203522,73,2161,73,806,Successful
74,Gonzalo rabuñal,gonzalo rabuñal rios ( born 1 august 1984 in arteixo ) is a spanish professional road bicycle racer who last rode for uci professional continental team xacobeo-galicia .<SPLIT>,Ángel edo,[MASK] [MASK] [MASK] ( born 1 [MASK] [MASK] in [MASK] ) is a spanish professional road bicycle racer who last rode for uci professional continental team [MASK]-galicia .<SPLIT>,-15.925071716308594,0.8995727896690369,74,82813,74,148,Successful
75,James henry scullin,"james henry `` jim '' scullin ( 18 september 1876 -- 28 january 1953 ) was an australian labor party politician and the ninth prime minister of australia .<SPLIT>scullin led labor to government at the 1929 election .<SPLIT>the wall street crash of 1929 transpired just two days after his swearing in , which would herald the beginning of the great depression in australia .<SPLIT>scullin 's administration would soon be overwhelmed by the economic crisis , with interpersonal and policy disagreements causing a three-way split of his party that would bring down the",Jim fraser,"james [MASK] `` [MASK] '' [MASK] ( [MASK] [MASK] [MASK] -- [MASK] [MASK] [MASK] ) was an [MASK] [MASK] party politician and the [MASK] [MASK] minister of [MASK] .<SPLIT>[MASK] led [MASK] to government at the [MASK] [MASK] .<SPLIT>the [MASK] [MASK] [MASK] of [MASK] [MASK] just two [MASK] after his [MASK] in , which would [MASK] the [MASK] of the great [MASK] in [MASK] .<SPLIT>[MASK] 's [MASK] would [MASK] be [MASK] by the [MASK] [MASK] , with [MASK] and [MASK] [MASK] [MASK] a three-[MASK] [MASK] of his party that would [MASK] down the",-16.43815040588379,0.3297835886478424,75,87983,75,1595,Successful
76,Ernesto sabato,"ernesto sabato ( june 24 , 1911 -- april 30 , 2011 ) was an argentine writer , painter and physicist .<SPLIT>according to the bbc he `` won some of the most prestigious prizes in hispanic literature '' and `` became very influential in the literary world throughout latin america '' .<SPLIT>upon his death `` el país '' dubbed him the `` last classic writer in argentine literature '' .<SPLIT>sabato was distinguished by his bald pate and brush moustache and wore tinted spectacles and open-necked shirts",Vicente medina,"[MASK] [MASK] ( [MASK] [MASK] , [MASK] -- [MASK] [MASK] , [MASK] ) was an [MASK] writer , painter and [MASK] .<SPLIT>according to the bbc he `` won some of the most prestigious [MASK] in [MASK] literature '' and `` became very influential in the literary world throughout latin america '' .<SPLIT>upon his death `` el [MASK] '' [MASK] him the `` last classic writer in [MASK] literature '' .<SPLIT>[MASK] was distinguished by his [MASK] [MASK] and [MASK] [MASK] and [MASK] [MASK] [MASK] and open-[MASK] [MASK]",-17.468568801879883,0.48304685950279236,76,4885,76,1175,Successful
77,Taylor milne,"taylor milne ( born september 14 , 1981 in callander , ontario ) is a canadian middle distance runner .<SPLIT>milne made his official debut for the 2008 summer olympics in beijing , where he competed in the men 's 1500 metres .<SPLIT>milne first appeared and competed as part of the national team at the 2006 iaaf world cross country championships in fukuoka , japan , where he placed twenty-eighth in the men 's senior eight kilometre run .<SPLIT>in 2008 , he set his personal best",Nathan brannen,"[MASK] [MASK] ( born [MASK] [MASK] , [MASK] in [MASK] , ontario ) is a canadian middle distance runner .<SPLIT>[MASK] made his official debut for the [MASK] summer olympics in beijing , where he competed in the men 's [MASK] metres .<SPLIT>[MASK] first appeared and competed as part of the national team at the 2006 iaaf world cross country championships in fukuoka , japan , where he placed twenty-eighth in the men 's senior eight kilometre run .<SPLIT>in [MASK] , he set his personal best",-17.379947662353516,0.35740068554878235,77,1165,77,481,Successful
78,Artak grigoryan,"artak grigoryan ( , born on 19 october 1987 in yerevan , soviet union ) is an armenian football midfielder .<SPLIT>he currently plays for the armenian premier league club alashkert fc .<SPLIT>artak is also a member of the armenian national team , and has participated in 1 international matches since his debut at home friendly match against iran on 11",Vahagn minasyan,"[MASK] [MASK] ( , born on [MASK] [MASK] [MASK] in [MASK] , [MASK] [MASK] ) is an [MASK] football midfielder .<SPLIT>he currently plays for the [MASK] [MASK] league club [MASK] fc .<SPLIT>[MASK] is also a member of the [MASK] national team , and has [MASK] in [MASK] international matches since his debut at home [MASK] [MASK] against [MASK] on [MASK]",-16.062938690185547,0.28662824630737305,78,53941,78,581,Successful
79,Nigel pepper,"colin nigel pepper ( born 25 april 1968 in rotherham , england ) , more commonly known as nigel pepper , is a retired english professional footballer .<SPLIT>he was a combative midfield player known for his powerful attacking free kicks and his solid work ethic .<SPLIT>he was a member of the york city team that beat manchester united 3 -- 0 at old trafford in the league cup in",Mick mcguire,"[MASK] [MASK] [MASK] ( born [MASK] [MASK] [MASK] in [MASK] , england ) , more [MASK] known as [MASK] [MASK] , is a [MASK] [MASK] professional footballer .<SPLIT>he was a [MASK] [MASK] player known for his [MASK] [MASK] [MASK] [MASK] and his [MASK] [MASK] [MASK] .<SPLIT>he was a member of the [MASK] [MASK] team that [MASK] [MASK] united [MASK] -- 0 at [MASK] [MASK] in the league [MASK] in",-16.439180374145508,0.25473499298095703,79,80668,79,905,Successful
80,Leandro chichizola,leandro `` chichi '' chichizola ( ; born 27 march 1990 ) is an argentine footballer who plays as a goalkeeper for italian serie b club spezia calcio .<SPLIT>,Nicola leali,[MASK] `` [MASK] '' [MASK] ( ; born [MASK] [MASK] [MASK] ) is an argentine footballer who plays as a goalkeeper for italian serie b club [MASK] calcio .<SPLIT>,-14.992541313171387,0.8875171542167664,80,15980,80,141,Successful
81,Yukana,", better known by the stage name , is a japanese voice actress .<SPLIT>after standing in for kotono mitsuishi ( the voice of usagi tsukino in the series `` sailor moon '' ) when mitsuishi had appendicitis , araki originated the role of chibiusa in the same series soon after .<SPLIT>while training at a voice acting school , araki acted as senpai to fellow voice actor konami yoshida , and they have maintained a close",Haru,", better known by the stage name , is a japanese [MASK] actress .<SPLIT>after [MASK] in for [MASK] [MASK] ( the [MASK] of [MASK] [MASK] in the series `` [MASK] [MASK] '' ) when [MASK] had [MASK] , [MASK] [MASK] the role of [MASK] in the same series [MASK] after .<SPLIT>while training at a [MASK] acting school , [MASK] [MASK] as [MASK] to fellow [MASK] actor [MASK] [MASK] , and they have [MASK] a [MASK]",-3.009500503540039,0.4480496048927307,78523,130082,81,733,Successful
82,Charles john barnett,"charles john barnett ( 12 march 1790 -- 4 august 1856 ) was an officer in the british army who also served as a diplomat .<SPLIT>he served in the 3rd regiment of foot .<SPLIT>he reached the rank of captain in 1812 and lieutenant colonel in 1821 .<SPLIT>he took part in the battle of waterloo in 1815 , and retired from the military in 1830 .<SPLIT>he was appointed consul in warsaw , poland on 31 may 1833 .<SPLIT>he was later appointed consul-general in egypt on 11 may 1841 , which post he held till 17 august 1846 , when he retired",Francis rawdon chesney,"[MASK] [MASK] [MASK] ( [MASK] [MASK] [MASK] -- [MASK] [MASK] [MASK] ) was an officer in the british army who also served as a [MASK] .<SPLIT>he served in the [MASK] [MASK] of [MASK] .<SPLIT>he reached the rank of captain in 1812 and [MASK] [MASK] in [MASK] .<SPLIT>he took part in the [MASK] of waterloo in [MASK] , and retired from the military in [MASK] .<SPLIT>he was appointed [MASK] in [MASK] , [MASK] on [MASK] [MASK] [MASK] .<SPLIT>he was later appointed [MASK]-general in [MASK] on [MASK] [MASK] [MASK] , which post he held till [MASK] [MASK] [MASK] , when he retired",-18.385141372680664,0.6973260641098022,82,112980,82,1512,Successful
83,Norm desilva,"norman desilva ( born august 20 , in new bedford , massachusetts ) is a former ncaa basketball player and assistant coach for the delaware 87ers of the nba development league ( nbadl ) .<SPLIT>in , de silva signed with ncaa babson college .<SPLIT>he started at point guard his freshmen year and led the league in assists in his sophomore season while also leading the nation in turnovers .<SPLIT>he went on to earn a degree in finance .<SPLIT>desilva played his high school basketball at dartmouth high school , and",Buford jordan,"[MASK] [MASK] ( born [MASK] [MASK] , in new [MASK] , [MASK] ) is a former [MASK] [MASK] player and [MASK] [MASK] for the [MASK] [MASK] of the [MASK] [MASK] league ( [MASK] ) .<SPLIT>in , de [MASK] [MASK] with [MASK] [MASK] college .<SPLIT>he [MASK] at [MASK] [MASK] his [MASK] year and [MASK] the league in [MASK] in his [MASK] [MASK] while also [MASK] the [MASK] in [MASK] .<SPLIT>he [MASK] on to [MASK] a [MASK] in [MASK] .<SPLIT>[MASK] played his [MASK] [MASK] [MASK] at [MASK] [MASK] [MASK] , and",-14.728848457336426,0.2720489203929901,83,4750,83,1613,Successful
84,Roger ducret,"roger ducret ( 2 april 1888 -- 8 january 1962 ) was a french fencer who competed at the 1920 , 1924 and 1928 olympics .<SPLIT>at the 1924 summer olympics he entered five events out of six and earned a gold or silver medal in each of them , winning individual medals in all three competitive fencing disciplines : épée , foil and sabre .<SPLIT>only one fencer in history did better -- nedo nadi won five gold medals at the 1920 summer olympics .<SPLIT>during world war i ducret was a prisoner of war",Lucien gaudin,"[MASK] [MASK] ( [MASK] [MASK] [MASK] -- 8 [MASK] [MASK] ) was a french fencer who competed at the 1920 , 1924 and 1928 olympics .<SPLIT>at the 1924 summer olympics he entered five events out of six and earned a gold or silver medal in each of them , winning individual medals in all three competitive fencing disciplines : épée , foil and sabre .<SPLIT>only one fencer in history did better -- [MASK] nadi won five gold medals at the 1920 summer olympics .<SPLIT>during world war i [MASK] was a prisoner of war",-17.011409759521484,0.8419591188430786,84,67617,84,462,Successful
85,Eduardo gonzález,"eduardo gonzález ( born november 9 , 1969 ) is a republican member of the florida house of representatives , representing the 111th district , which includes parts of miami and hialeah in northeastern miami-dade county , since 2012 , previously representing the 102nd district from 2006",Ray pilon,"[MASK] [MASK] ( born [MASK] [MASK] , [MASK] ) is a [MASK] member of the [MASK] house of representatives , [MASK] the [MASK] district , which [MASK] [MASK] of [MASK] and [MASK] in [MASK] [MASK]-[MASK] county , since [MASK] , previously [MASK] the [MASK] district from [MASK]",-16.358121871948242,0.3577902019023895,85,85214,85,492,Successful
86,Hassan mohammed,hassan mohammed ( born 20 january 1980 ) is a malaysian cricketer .<SPLIT>he played in the 2014 icc world cricket league division five tournament .<SPLIT>,Pavandeep singh,[MASK] [MASK] ( born [MASK] [MASK] [MASK] ) is a malaysian cricketer .<SPLIT>he played in the 2014 icc world cricket league division five tournament .<SPLIT>,-16.75399398803711,0.4781677722930908,86,71613,86,96,Successful
87,Sam crouser,"samuel crouser ( born december 31 , 1991 ) is an american javelin thrower .<SPLIT>he currently attends the university of oregon .<SPLIT>while a senior at gresham high school , crouser was named gatorade high school track and field athlete of the year 2010 .<SPLIT>on may 1 , 2010 , he set the national high school record at 244 ' 2 '' ( 74.42 m ) .<SPLIT>this was broken in 2012 by billy stanley of south park , pa. .<SPLIT>he competed javelin at the",Tyler schultz,"[MASK] [MASK] ( born [MASK] [MASK] , [MASK] ) is an american [MASK] thrower .<SPLIT>he currently attends the university of [MASK] .<SPLIT>while a senior at [MASK] high school , [MASK] was named gatorade high school track and field athlete of the year [MASK] .<SPLIT>on may 1 , [MASK] , he set the national high school record at 244 ' [MASK] '' ( 74.42 m ) .<SPLIT>this was broken in [MASK] by billy stanley of south park , pa. .<SPLIT>he competed [MASK] at the",-16.298458099365234,0.6741925477981567,87,2029,87,628,Successful
88,Narden jaime espinosa,"narden jaime espinosa ( born august 6 , 1971 ) is a puerto rican politician affiliated with the popular democratic party ( ppd ) .<SPLIT>he has been a member of the puerto rico house of representatives since 2009 representing district 35",Pedro cintrón rodríguez,"[MASK] [MASK] [MASK] ( born [MASK] [MASK] , [MASK] ) is a [MASK] [MASK] politician [MASK] with the [MASK] [MASK] party ( [MASK] ) .<SPLIT>he has been a member of the [MASK] [MASK] house of [MASK] since [MASK] [MASK] [MASK] [MASK]",-16.907608032226562,0.25326719880104065,88,13691,88,401,Successful
89,Sushil koirala . सुशील कोइराला,"sushil koirala ( nepali : सुशील कोइराला ) ( born 12 august 1939 ) is the incumbent prime minister of nepal since february 11 , 2014 .<SPLIT>he is also the president of the nepali congress party since 2010 .<SPLIT>koirala was elected as prime minister of nepal by the parliament on 10 february 2014 .<SPLIT>koirala joined the nepali congress in 1952 and served in various capacities prior to becoming its president in 2010",Faisal arab فيصل عرب,[MASK] [MASK] ( [MASK] : [MASK] कोइराला ) ( [MASK] [MASK] [MASK] [MASK] ) is the [MASK] [MASK] [MASK] of [MASK] [MASK] [MASK] [MASK] [MASK] [MASK] [MASK]<SPLIT>he is [MASK] the [MASK] of the [MASK] [MASK] [MASK] [MASK] [MASK] [MASK]<SPLIT>[MASK] was [MASK] as [MASK] [MASK] of [MASK] by the [MASK] on [MASK] [MASK] [MASK] [MASK]<SPLIT>[MASK] [MASK] the [MASK] [MASK] in [MASK] and [MASK] in [MASK] [MASK] [MASK] to [MASK] its [MASK] in [MASK],-17.21501922607422,0.0,89,26901,89,953,Successful
90,Barry otto,barry otto ( born 1941 ) is an australian actor .<SPLIT>,Sachin joab,[MASK] [MASK] ( born [MASK] ) is an australian actor .<SPLIT>,-18.114051818847656,0.5271628499031067,90,35705,90,25,Successful
91,Yosef burg,"shlomo yosef burg ( , 31 january 1909 - 15 october 1999 ) was a german-born israeli politician .<SPLIT>in 1949 , he was elected to the first knesset , and served in many ministerial positions for the next 40 years .<SPLIT>he was one of the founders of the national religious party",Peretz naftali,"[MASK] [MASK] [MASK] ( , [MASK] [MASK] [MASK] - [MASK] [MASK] [MASK] ) was a german-born israeli politician .<SPLIT>in [MASK] , he was elected to the first [MASK] , and served in many [MASK] positions for the next 40 years .<SPLIT>he was one of the founders of the national [MASK] party",-15.94882583618164,0.5315868258476257,91,29233,91,391,Successful
92,Kava huihahau,"kava huihahau ( born 8 august 1982 ) is a tongan former international footballer who played as a defender .<SPLIT>between 2003 and 2007 , he won 10 caps for the tonga national football team",Motlatsi maseela,"[MASK] [MASK] ( born 8 [MASK] [MASK] ) is a [MASK] former international footballer who played as a defender .<SPLIT>between [MASK] and [MASK] , he won 10 caps for the [MASK] national football team",-17.25098991394043,0.7000433802604675,92,19554,92,165,Successful
93,Begziin yavuukhulan,"begziin yavuukhulan ( , 1929-1982 ) was a mongolian poet of the communist era that wrote in mongolian and russian .<SPLIT>",Nino dadeshkeliani,"[MASK] [MASK] ( , [MASK]-[MASK] ) was a [MASK] poet of the communist era that wrote in [MASK] and russian .<SPLIT>",-17.92852020263672,0.8796039819717407,93,2650,93,65,Successful
94,Jeff stein,"jeff stein ( born february 13 , 1944 ) is a columnist and at newsweek .<SPLIT>previously , he was the spytalk columnist and national security editor for congressional quarterlys website , cq politics , from 2002 -- 2009 .<SPLIT>he specializes in u.s. intelligence , military and foreign policy issues .<SPLIT>in addition to his work for cq , he has written three books and hundreds of news articles , opinion pieces and book reviews .<SPLIT>he has also made numerous",Michael lind,"[MASK] [MASK] ( born [MASK] [MASK] , [MASK] ) is a [MASK] and at [MASK] .<SPLIT>previously , he was the [MASK] [MASK] and national security editor for [MASK] [MASK] website , [MASK] politics , from [MASK] -- [MASK] .<SPLIT>he [MASK] in u.s. [MASK] , military and foreign policy [MASK] .<SPLIT>in addition to his work for [MASK] , he has written three books and [MASK] of news articles , [MASK] [MASK] and book [MASK] .<SPLIT>he has also made numerous",-17.837892532348633,0.4908738136291504,94,33391,94,938,Successful
95,Judith amaechi,"dame judith obiajulu amaechi ( née nwankwo ; born 24 december 1970 ) is the wife of former rivers state governor chibuike amaechi .<SPLIT>she is head of the empowerment support initiative ( esi ) which campaigns against hiv/aids , advocates the rights of the women and children , and promotes gender equity and girl child education .<SPLIT>amaechi was born on 24 december 1970 in enugu ukwu , anambra state .<SPLIT>she attended federal government girls college , abuloma for her secondary education .<SPLIT>she then attended rivers state",Maria larsson,"[MASK] [MASK] [MASK] [MASK] ( née [MASK] ; born [MASK] [MASK] [MASK] ) is the wife of former [MASK] state governor [MASK] [MASK] .<SPLIT>she is head of the [MASK] support [MASK] ( [MASK] ) which [MASK] against hiv/aids , [MASK] the rights of the women and children , and [MASK] gender [MASK] and girl child education .<SPLIT>[MASK] was born on [MASK] [MASK] [MASK] in [MASK] [MASK] , [MASK] state .<SPLIT>she attended federal government girls college , [MASK] for her secondary education .<SPLIT>she then attended [MASK] state",-18.016094207763672,0.528112530708313,95,85591,95,1118,Successful
96,Fait-florian banser,"fait-florian banser ( born 20 february 1982 in perleberg ) is a retired german footballer .<SPLIT>banser made and scored on his professional debut for eintracht braunschweig during the opening round of fixtures of the inaugural 2008 -- 09 3 .<SPLIT>fußball-liga season away to fc erzgebirge aue .<SPLIT>after retiring , banser worked as executive director at vfb germania halberstadt until january 2014 .<SPLIT>",Hans-günter etterich,"[MASK]-[MASK] [MASK] ( born [MASK] [MASK] [MASK] in [MASK] ) is a retired german footballer .<SPLIT>[MASK] made and scored on his professional debut for [MASK] [MASK] during the opening round of fixtures of the inaugural [MASK] -- 09 3 .<SPLIT>fußball-liga season away to fc erzgebirge aue .<SPLIT>after retiring , [MASK] worked as executive director at vfb [MASK] [MASK] until january 2014 .<SPLIT>",-17.51388168334961,0.5750088691711426,96,22700,96,501,Successful
97,Simon mignolet,"simon luc hildebert mignolet ( ; born 6 march 1988 ) is a belgian professional footballer who plays as a goalkeeper for premier league club liverpool and the belgium national team .<SPLIT>mignolet started his career with belgian second division side sint-truiden in 2004 , and spent six years with the club , making 100 senior league appearances .<SPLIT>he moved to premier league side sunderland in june 2010 for # 2 million , spending three years with them and making 90 appearances , before moving to liverpool in june 2013 for # 9 million",Abel hernández,"[MASK] [MASK] [MASK] [MASK] ( ; born [MASK] [MASK] [MASK] ) is a [MASK] professional footballer who plays as a [MASK] for premier league club [MASK] and the [MASK] national team .<SPLIT>[MASK] started his career with [MASK] second division side [MASK]-[MASK] in [MASK] , and spent six years with the club , making 100 senior league appearances .<SPLIT>he moved to premier league side [MASK] in [MASK] [MASK] for # [MASK] million , [MASK] three years with them and making 90 appearances , before moving to [MASK] in [MASK] [MASK] for # [MASK] million",-15.49660873413086,0.459820955991745,97,110549,97,1242,Successful
