,original_person,original_text,perturbed_person,perturbed_text,original_score,perturbed_score,original_output,perturbed_output,ground_truth_output,num_queries,result_type
0,Lenny randle,"leonard shenoff randle ( born february 12 , 1949 ) is a former major league baseball player .<SPLIT>he was the first-round pick of the washington senators in the secondary phase of the june 1970 major league baseball draft , tenth overall .<SPLIT>",Ricardo lewandowski,"[MASK] [MASK] [MASK] ( born [MASK] [MASK] , [MASK] ) is a [MASK] [MASK] [MASK] [MASK] [MASK] .<SPLIT>he was the first-[MASK] [MASK] of the [MASK] [MASK] in the [MASK] [MASK] of the june [MASK] [MASK] [MASK] [MASK] [MASK] , [MASK] [MASK] .<SPLIT>",-15.6950101852417,0.1978534460067749,0,15956,0,471,Successful
1,Philippe adnot,"philippe adnot ( born 25 august 1945 in rhèges ) is a member of the senate of france .<SPLIT>he was first elected in 1989 , and represents the aube department .<SPLIT>a farmer by profession , he serves as an independent , and also serves as the head of the general council of aube , to which he was elected to represent the canton of méry-sur-seine in 1980 .<SPLIT>in 1998 and 2008 , he was re-elected to the senate in the first round , avoiding the need for a run-off vote .<SPLIT>having contributed to the creation of the university of technology of troyes , in",Alain vivien,"[MASK] [MASK] ( born 25 august [MASK] in [MASK] ) is a member of the [MASK] of [MASK] .<SPLIT>he was first [MASK] in [MASK] , and [MASK] the [MASK] [MASK] .<SPLIT>a [MASK] by [MASK] , he [MASK] as an [MASK] , and also [MASK] as the [MASK] of the general [MASK] of [MASK] , to which he was [MASK] to [MASK] the [MASK] of [MASK]-[MASK]-[MASK] in 1980 .<SPLIT>in 1998 and 2008 , he was re-[MASK] to the [MASK] in the first round , [MASK] the [MASK] for a [MASK]-off [MASK] .<SPLIT>having [MASK] to the [MASK] of the university of [MASK] of [MASK] , in",-14.942732810974121,0.2885098159313202,1,104583,1,1290,Successful
2,Miroslav popov,miroslav popov ( born 14 june 1995 in dvůr králové nad labem ) is a czech grand prix motorcycle racer .<SPLIT>he currently races in the fim cev moto2 championship for montaze broz racing team aboard a suter .<SPLIT>,Duncan tappy,[MASK] [MASK] ( born 14 june [MASK] in [MASK] [MASK] [MASK] [MASK] ) is a [MASK] [MASK] [MASK] [MASK] racer .<SPLIT>he currently [MASK] in the [MASK] [MASK] [MASK] championship for [MASK] [MASK] racing team [MASK] a [MASK] .<SPLIT>,-17.340431213378906,0.3138543367385864,2,124162,2,419,Successful
3,Jack reynolds,"john `` jack '' reynolds ( 21 february 1869 -- 12 march 1917 ) was a footballer who played for , among others , west bromwich albion , aston villa and celtic .<SPLIT>as an international he played five times for ireland before it emerged that he was actually english and he subsequently played eight times for england .<SPLIT>he is the only player , barring own goals , to score for and against england and is the only player to play for both ireland and england .<SPLIT>he won the",Stan woodhouse,"[MASK] `` [MASK] '' [MASK] ( [MASK] february [MASK] -- 12 march [MASK] ) was a footballer who played for , [MASK] [MASK] , [MASK] [MASK] [MASK] , [MASK] [MASK] and [MASK] .<SPLIT>as an [MASK] he played [MASK] [MASK] for [MASK] before it [MASK] that he was [MASK] [MASK] and he [MASK] played [MASK] [MASK] for [MASK] .<SPLIT>he is the only player , [MASK] own goals , to [MASK] for and against [MASK] and is the only player to [MASK] for both [MASK] and [MASK] .<SPLIT>he won the",-16.618207931518555,0.2119491696357727,3,96757,3,1047,Successful
4,Akoo nana,"william ato ankrah , ( born 7th july 1979 ) better known by his stage name akoo nana is a hiplife musician from ghana .<SPLIT>since 2009 , he has been making a large impact in africa 's hiplife scene through his authentic sounding music and captivating",Mareko,"[MASK] [MASK] [MASK] , ( born [MASK] [MASK] [MASK] ) [MASK] known by his [MASK] name [MASK] [MASK] is a [MASK] [MASK] from [MASK] .<SPLIT>[MASK] 2009 , he has been [MASK] a [MASK] [MASK] in [MASK] 's [MASK] [MASK] through his [MASK] [MASK] [MASK] and [MASK]",-19.462779998779297,0.1756414771080017,4,79947,4,512,Successful
5,Teoctist,"teoctist ( , born toader arăpașu ; february 7 , 1915 -- july 30 , 2007 ) was the patriarch of the romanian orthodox church from 1986 to 2007 .<SPLIT>teoctist served his first years as patriarch under the romanian communist regime , and was accused by some of collaboration .<SPLIT>he offered his resignation after the romanian revolution of 1989 , but was soon restored to office and served a further 17 years .<SPLIT>a promoter of ecumenical dialogue , patriarch teoctist invited pope john paul ii to visit romania in 1999",Samdech son sann,"[MASK] ( , born [MASK] [MASK] ; [MASK] 7 , [MASK] -- july 30 , [MASK] ) was the [MASK] of the [MASK] [MASK] [MASK] from [MASK] to [MASK] .<SPLIT>[MASK] served his first years as [MASK] under the [MASK] communist [MASK] , and was [MASK] by some of [MASK] .<SPLIT>he [MASK] his [MASK] after the [MASK] [MASK] of 1989 , but was [MASK] [MASK] to office and served a further 17 years .<SPLIT>a [MASK] of [MASK] [MASK] , [MASK] [MASK] [MASK] [MASK] john [MASK] ii to [MASK] [MASK] in 1999",-16.94420623779297,0.28440040349960327,5,40597,5,1170,Successful
6,Dillon sheppard,dillon sheppard ( born 27 february 1979 ) is a south african football ( soccer ) left-winger who plays for premier soccer league club bidvest wits and south africa .<SPLIT>,Nathan sherlock,[MASK] [MASK] ( born 27 february [MASK] ) is a [MASK] [MASK] football ( [MASK] ) left-[MASK] who plays for [MASK] [MASK] league club [MASK] [MASK] and [MASK] [MASK] .<SPLIT>,-17.045072555541992,0.2670154273509979,6,82086,6,230,Successful
7,Giuliana zevallos,"giuliana zevallos roncagliolo ( born in lima , peru ) is a beauty queen who was crowned miss continente americano 2010 on september 18 , 2010 , becoming that pageant 's very first titleholder from her country .<SPLIT>prior to winning miss continente americano , she was miss earth perú 2008 and miss perú 2010 , and represented her country in both miss earth 2008 and miss universe 2010 .<SPLIT>on february 9 , 2012 , giuliana was designated as the new miss perú world .<SPLIT>she represented",Sarah beth james,"[MASK] [MASK] [MASK] ( born in [MASK] , [MASK] ) is a [MASK] [MASK] who was [MASK] [MASK] [MASK] [MASK] 2010 on september [MASK] , 2010 , [MASK] that [MASK] 's very first [MASK] from her [MASK] .<SPLIT>[MASK] to [MASK] [MASK] [MASK] [MASK] , she was [MASK] [MASK] [MASK] [MASK] and [MASK] [MASK] 2010 , and [MASK] her [MASK] in both [MASK] [MASK] [MASK] and [MASK] [MASK] 2010 .<SPLIT>on february 9 , 2012 , [MASK] was [MASK] as the new [MASK] [MASK] [MASK] .<SPLIT>she [MASK]",-16.482500076293945,0.21905533969402313,7,109855,7,1122,Successful
8,Renato campos,"renato campos ( born september 5 , 1980 ) is a retired angolan football player .<SPLIT>he has played for angola national team",Atsuyoshi furuta,"[MASK] [MASK] ( born [MASK] 5 , [MASK] ) is a [MASK] [MASK] football player .<SPLIT>he has played for [MASK] [MASK] team",-17.524658203125,0.18815627694129944,8,104527,8,117,Successful
9,Sir william laird clowes,"sir william laird clowes ( 1 february 1856 -- 14 august 1905 ) was a british journalist and historian whose principal work was `` the royal navy , a history from the earliest times to 1900 '' , a text that is still in print .<SPLIT>he also wrote numerous technical pieces on naval technology and strategy and was also noted for his articles concerning racial politics in the southern united states .<SPLIT>despite having trained as a lawyer , clowes had always preferred literature and writing , publishing his first work in 1876 and becoming a full-time journalist in 1879 .<SPLIT>for the services rendered in his",Paul dirac,"[MASK] [MASK] [MASK] [MASK] ( 1 [MASK] [MASK] -- [MASK] august [MASK] ) was a [MASK] [MASK] and [MASK] [MASK] [MASK] [MASK] was `` the [MASK] [MASK] , a [MASK] from the [MASK] [MASK] to [MASK] '' , a [MASK] that is [MASK] in [MASK] .<SPLIT>he also [MASK] [MASK] [MASK] [MASK] on [MASK] [MASK] and [MASK] and was also [MASK] for his [MASK] [MASK] [MASK] [MASK] in the [MASK] united states .<SPLIT>[MASK] having [MASK] as a [MASK] , [MASK] had [MASK] [MASK] [MASK] and [MASK] , [MASK] his first [MASK] in [MASK] and [MASK] a [MASK]-[MASK] [MASK] in [MASK] .<SPLIT>for the [MASK] [MASK] in his",-17.27438735961914,0.1954374760389328,9,3873,9,2299,Successful
10,Dan besse,"daniel vaughn ( dan ) besse ( born december 28 , 1954 ) is a graduate of unc-chapel hill school of law ( 1980 ) , an attorney , and , since 2001 , a city councilman in winston-salem , north carolina .<SPLIT>he was one of four democratic candidates in the 2008 lt. governor election for the seat vacated by beverly perdue , but came in last in the primary , which was won by walter dalton .<SPLIT>in the 2008 campaign , besse received the endorsement of the progressive democrats of",Kenneth massey,"[MASK] [MASK] ( [MASK] ) [MASK] ( born december [MASK] , [MASK] ) is a [MASK] of [MASK]-[MASK] [MASK] school of [MASK] ( [MASK] ) , an [MASK] , and , [MASK] 2001 , a city [MASK] in [MASK]-[MASK] , [MASK] [MASK] .<SPLIT>he was one of [MASK] [MASK] [MASK] in the 2008 lt. [MASK] [MASK] for the [MASK] [MASK] by [MASK] [MASK] , but [MASK] in [MASK] in the [MASK] , which was won by [MASK] [MASK] .<SPLIT>in the 2008 [MASK] , [MASK] [MASK] the [MASK] of the [MASK] [MASK] of",-15.718194007873535,0.2646125555038452,10,99849,10,1731,Successful
11,Matt elliott,"matt elliott is an english folk guitarist and singer from bristol , england , who plays dark folk music .<SPLIT>he also produced and recorded electronic music under the name the third eye",Lukas wooller,"[MASK] [MASK] is an english [MASK] [MASK] and singer from [MASK] , england , who plays [MASK] [MASK] [MASK] .<SPLIT>he also [MASK] and [MASK] [MASK] [MASK] under the name the [MASK] [MASK]",-16.98707389831543,0.3141787350177765,11,121832,11,202,Successful
12,Giuseppe mariani,giuseppe mariani was an italian art director .<SPLIT>he was nominated for an academy award in the category best art direction for the film `` the taming of the shrew '' .<SPLIT>,Robert cartwright,[MASK] [MASK] was an [MASK] [MASK] [MASK] .<SPLIT>he was [MASK] for an academy award in the [MASK] best [MASK] [MASK] for the film `` the [MASK] of the [MASK] '' .<SPLIT>,-17.7994327545166,0.2737322449684143,12,109288,12,145,Successful
13,Tang li,"tang li ( chinese : 唐莉 ; pinyin : táng lì ; born july 27 , 1982 ) is a chinese professional go player .<SPLIT>",Wang lei,"[MASK] [MASK] ( [MASK] : [MASK] ; [MASK] : [MASK] [MASK] ; born [MASK] 27 , [MASK] ) is a [MASK] professional go player .<SPLIT>",-17.04374885559082,0.40087592601776123,13,121446,13,172,Successful
14,Peter curran,"peter curran is an irish broadcaster , writer , documentary maker and audiobook publisher .<SPLIT>he grew up in belfast , the eldest of six children .<SPLIT>after leaving school he worked on funfairs in the usa before moving to london .<SPLIT>curran worked for an interior design and building company for four years before re-training as a bbc reporter .<SPLIT>in 1992 , he began dj ` ing full-time for the london radio station bbc glr .<SPLIT>",Peter jenkins,"peter [MASK] is an irish [MASK] , writer , documentary maker and [MASK] publisher .<SPLIT>he grew up in [MASK] , the eldest of six children .<SPLIT>after leaving school he worked on [MASK] in the usa before moving to london .<SPLIT>[MASK] worked for an interior design and building company for four years before re-training as a bbc reporter .<SPLIT>in 1992 , he began dj ` ing full-time for the london radio station bbc [MASK] .<SPLIT>",-16.51743507385254,0.46256157755851746,14,81968,14,299,Successful
15,Adam saltsman,"adam saltsman , also known as adam atomic , is an american indie video game designer best known for creating the endless runner `` canabalt '' .<SPLIT>he is a founder of semi secret software and finji video game",David cook,"[MASK] [MASK] , also known as [MASK] [MASK] , is an american [MASK] [MASK] game designer best known for [MASK] the [MASK] runner `` [MASK] '' .<SPLIT>he is a founder of semi [MASK] [MASK] and [MASK] [MASK] game",-14.58178997039795,0.47904813289642334,15,12240,15,258,Successful
16,Walter clarence henderson,"walter clarence henderson ( 28 february 1891 -- 20 september 1968 ) was a progressive conservative party member of the canadian house of commons .<SPLIT>he was born in carberry , manitoba and became a farmer by career .<SPLIT>he was elected at the cariboo riding in the 1958 general election , defeating social credit incumbent bert leboe .<SPLIT>henderson served only one term , the 24th canadian parliament , before leboe retook the riding in the 1962 election .<SPLIT>--",David ouellet,"[MASK] [MASK] [MASK] ( 28 [MASK] [MASK] -- 20 september [MASK] ) was a [MASK] [MASK] party member of the canadian house of [MASK] .<SPLIT>he was born in [MASK] , [MASK] and became a [MASK] by career .<SPLIT>he was elected at the [MASK] [MASK] in the [MASK] general [MASK] , [MASK] social credit [MASK] [MASK] [MASK] .<SPLIT>[MASK] served only one term , the [MASK] canadian parliament , before [MASK] [MASK] the [MASK] in the [MASK] [MASK] .<SPLIT>--",-16.564722061157227,0.18728040158748627,16,62652,16,983,Successful
17,André salvador,andré fernando cabrita salvador ( born 4 november 1993 in portimão ) is a portuguese footballer who plays for portimonense s.c. as a midfielder .<SPLIT>,João patrão,[MASK] [MASK] [MASK] [MASK] ( born 4 [MASK] [MASK] in [MASK] ) is a [MASK] footballer who plays for [MASK] s.c. as a midfielder .<SPLIT>,-16.574262619018555,0.2838345766067505,17,57536,17,127,Successful
18,Ernesto inarkiev,"ernesto inarkiev ( born december 9 , 1985 in osh , kyrgyzstan ) is a russian chess grandmaster .<SPLIT>he was named after ernesto `` che '' guevara .<SPLIT>in 2006 he came third in the 59th russian chess championship superfinal .<SPLIT>in 2010 he tied for 1st -- 4th with konstantin chernyshov , lê quang liêm and evgeny bareev in the moscow open .<SPLIT>in 2015 he won `` moscow open 2015 '' with outstanding 8/9 .<SPLIT>",Evgenij miroshnichenko,"[MASK] [MASK] ( born december 9 , [MASK] in [MASK] , [MASK] ) is a [MASK] [MASK] [MASK] .<SPLIT>he was named after [MASK] `` [MASK] '' [MASK] .<SPLIT>in 2006 he came third in the [MASK] [MASK] [MASK] championship [MASK] .<SPLIT>in 2010 he tied for 1st -- 4th with [MASK] [MASK] , [MASK] [MASK] [MASK] and [MASK] [MASK] in the moscow open .<SPLIT>in 2015 he won `` moscow open 2015 '' with outstanding 8/9 .<SPLIT>",-17.777069091796875,0.272394061088562,18,77649,18,878,Successful
19,Bill rigby,"william ` bill ' rigby ( 9 june 1921 - 1 june 2010 ) was a former english footballer who played as a goalkeeper .<SPLIT>he was born in chester .<SPLIT>a product of the youth system at his hometown club of chester , rigby made his only peacetime first-team appearance for the club in their first post-war match in the football league in a 4 -- 4 draw at york city on 31 august 1946 .<SPLIT>after this he was not selected again , with goalkeeping duties being passed on to george scales and jim maclaren .<SPLIT>earlier he had made appearances for",Ernie butler,"[MASK] ` [MASK] ' [MASK] ( 9 [MASK] [MASK] - 1 [MASK] [MASK] ) was a former english footballer who played as a [MASK] .<SPLIT>he was born in [MASK] .<SPLIT>a product of the youth system at his hometown [MASK] of [MASK] , [MASK] made his only peacetime first-team appearance for the [MASK] in their first post-war match in the football league in a 4 -- 4 draw at york city on 31 august 1946 .<SPLIT>after this he was not selected again , with goalkeeping duties being passed on to george scales and jim maclaren .<SPLIT>earlier he had made appearances for",-18.05133056640625,0.13117645680904388,19,15050,19,524,Successful
20,Barnas sears,"barnas sears ( november 19 , 1802 -- july 6 , 1880 ) graduated from brown university in 1825 .<SPLIT>sears was the general agent of the peabody education fund who was sent to staunton , virginia , by george peabody to offer leadership in public education .<SPLIT>sears was general agent of the fund from 1867 until february 1880 .<SPLIT>he settled in staunton because of the easy access to the railroad .<SPLIT>sears travelled extensively throughout the south promoting southern education , `` free schools for the whole people '' .<SPLIT>sears",Wiliam allen,"[MASK] [MASK] ( [MASK] [MASK] , [MASK] -- july 6 , [MASK] ) [MASK] from [MASK] university in [MASK] .<SPLIT>[MASK] was the [MASK] [MASK] of the [MASK] [MASK] [MASK] who was [MASK] to [MASK] , [MASK] , by [MASK] [MASK] to [MASK] [MASK] in [MASK] [MASK] .<SPLIT>[MASK] was [MASK] [MASK] of the [MASK] from [MASK] until february [MASK] .<SPLIT>he [MASK] in [MASK] because of the [MASK] [MASK] to the [MASK] .<SPLIT>[MASK] [MASK] [MASK] [MASK] the [MASK] [MASK] [MASK] [MASK] , `` [MASK] [MASK] for the [MASK] [MASK] '' .<SPLIT>[MASK]",-17.220550537109375,0.195809006690979,20,127678,20,1473,Successful
21,Stepan rostomyan,"stepan rostomyan ( '' Ստեփան Ռոստոմյան '' ) , ( born 4 april , 1956 ) is a famous armenian composer .<SPLIT>he is one of armenia 's key figures of the contemporary music scene , as well as a composer whose works have",Dounia batma,"[MASK] [MASK] ( '' [MASK] [MASK] '' ) , ( born 4 april , [MASK] ) is a [MASK] [MASK] [MASK] .<SPLIT>he is one of [MASK] 's [MASK] [MASK] of the [MASK] music [MASK] , as well as a [MASK] [MASK] [MASK] have",-16.817758560180664,0.3254272937774658,21,92470,21,384,Successful
22,Shashi gupta,"shashi gupta ( born 3 april 1964 in delhi , india ) is a former test and one day international cricketer who represented india .<SPLIT>she played a total of 13 tests and 20 odis",Beáta bohus,"[MASK] [MASK] ( born 3 april [MASK] in [MASK] , [MASK] ) is a former [MASK] and [MASK] [MASK] [MASK] [MASK] who [MASK] [MASK] .<SPLIT>she played a [MASK] of [MASK] [MASK] and [MASK] [MASK]",-10.18574047088623,0.21443426609039307,22,8567,22,289,Successful
23,Allan higdon,"allan l. higdon served on ottawa city council from 1994 through 2000 .<SPLIT>born in dublin , republic of ireland , he immigrated to canada in 1957 .<SPLIT>he received a ba from queen 's university in english and history and received a b.ed from the university of toronto .<SPLIT>he then worked with the canadian institute of mining and metallurgy .<SPLIT>he would later move to ottawa after living in toronto and southeast asia , where he would teach high school .<SPLIT>he then worked on parliament hill and then became a self-employed consultant specializing in",Howard moscoe,"[MASK] l. [MASK] served on [MASK] city council from 1994 through 2000 .<SPLIT>born in [MASK] , republic of [MASK] , he [MASK] to canada in 1957 .<SPLIT>he received a [MASK] from queen 's university in english and history and received a b.ed from the university of toronto .<SPLIT>he then worked with the canadian institute of [MASK] and [MASK] .<SPLIT>he would later [MASK] to [MASK] after [MASK] in toronto and [MASK] [MASK] , where he would [MASK] high school .<SPLIT>he then worked on parliament hill and then became a [MASK]-[MASK] [MASK] [MASK] in",-14.94571304321289,0.371962308883667,23,110731,23,914,Successful
24,Olcay çakır,"olcay Çakır ( born 13 july 1993 in konak , İzmir , turkey ) is a turkish basketball player .<SPLIT>the young national plays for fenerbahçe İstanbul as both guard ( 1-2 ) position .<SPLIT>olcay Çakır is 182 cm tall and weighs 60 kg .<SPLIT>she is playing for fenerbahçe since 2005 in youth level and since 2010 in senior level .<SPLIT>Çakır was selected 27th overall in the 2013 wnba draft 's round 3 by the new york liberty .<SPLIT>she is so the first ever",Joanna sutton,"[MASK] [MASK] ( born [MASK] july [MASK] in [MASK] , [MASK] , [MASK] ) is a [MASK] [MASK] player .<SPLIT>the [MASK] [MASK] [MASK] for [MASK] [MASK] as both [MASK] ( 1-2 ) position .<SPLIT>[MASK] [MASK] is [MASK] [MASK] [MASK] and [MASK] [MASK] [MASK] .<SPLIT>she is [MASK] for [MASK] [MASK] [MASK] in [MASK] [MASK] and [MASK] 2010 in [MASK] [MASK] .<SPLIT>[MASK] was [MASK] [MASK] [MASK] in the [MASK] [MASK] [MASK] 's [MASK] 3 by the new [MASK] [MASK] .<SPLIT>she is so the first [MASK]",-17.390512466430664,0.22343002259731293,24,76969,24,1584,Successful
25,David buchanan,"david buchanan ( 16 january 1830 -- 30 may 1900 ) was an english amateur cricketer who played mainly as a bowler and who had two careers separated in an unusual manner by a long period out of the first-class game .<SPLIT>he was born at edinburgh , midlothian , scotland , and died at rugby , warwickshire ,",Ernest needham,"[MASK] [MASK] ( 16 january [MASK] -- [MASK] may [MASK] ) was an english [MASK] [MASK] who played [MASK] as a [MASK] and who had two [MASK] [MASK] in an [MASK] [MASK] by a [MASK] [MASK] out of the first-[MASK] [MASK] .<SPLIT>he was born at [MASK] , [MASK] , [MASK] , and [MASK] at [MASK] , [MASK] ,",-18.291439056396484,0.2533402144908905,25,1958,25,645,Successful
26,Enzo cilenti,enzo cilenti ( born 8 august 1974 ) is an english actor .<SPLIT>,Diego manzoni,[MASK] [MASK] ( born [MASK] august [MASK] ) is an [MASK] [MASK] .<SPLIT>,-14.798958778381348,0.23386886715888977,26,126256,26,52,Successful
27,Elango,"elango nagarajah , also known as `` thaimann elango '' , is a tamil film actor , director , producer and lyricist in the tamil film industry .<SPLIT>he began his career in his early ages as a producer for the tamil film anbudan , starred arun vijay , meena , rambha ( actress ) in the main was released in the year 2000 .<SPLIT>then he worked on the most successful tamil music album நேசிக்கிறேன் as the director , actor and lyricist .<SPLIT>he was the main lead for all the six",Ferdous ahmed,"[MASK] [MASK] , also known as `` [MASK] [MASK] '' , is a [MASK] film actor , [MASK] , [MASK] and [MASK] in the [MASK] film [MASK] .<SPLIT>he [MASK] his career in his [MASK] [MASK] as a [MASK] for the [MASK] film [MASK] , [MASK] [MASK] [MASK] , [MASK] , [MASK] ( actress ) in the [MASK] was [MASK] in the year 2000 .<SPLIT>then he [MASK] on the most [MASK] [MASK] music [MASK] நேசிக்கிறேன் as the [MASK] , actor and [MASK] .<SPLIT>he was the [MASK] [MASK] for all the [MASK]",-15.220473289489746,0.2921612858772278,27,94527,27,1077,Successful
28,Jacoba surie,"jacoba surie ( 5 september 1879 -- 5 february 1970 ) was a dutch painter .<SPLIT>surie was born in amsterdam and trained at the rijksakademie van beeldende kunsten there , where she studied under coba ritsema and joseph mendes da costa .<SPLIT>she was a member of arti et amicitiae and the pulchri studio and is considered one of the amsterdamse joffers .<SPLIT>surie died in amsterdam and was buried in zorgvlied .<SPLIT>",Gabrielle petit,"[MASK] [MASK] ( 5 [MASK] [MASK] -- 5 [MASK] [MASK] ) was a [MASK] [MASK] .<SPLIT>[MASK] was born in [MASK] and [MASK] at the [MASK] [MASK] [MASK] [MASK] there , where she [MASK] under [MASK] [MASK] and [MASK] [MASK] [MASK] [MASK] .<SPLIT>she was a [MASK] of [MASK] [MASK] [MASK] and the [MASK] [MASK] and is [MASK] [MASK] of the [MASK] [MASK] .<SPLIT>[MASK] [MASK] in [MASK] and was [MASK] in [MASK] .<SPLIT>",-17.632843017578125,0.196149542927742,28,141610,28,943,Successful
29,Jeremy hotz,"jeremy hotz ( born may 31 , 1963 ) is a canadian actor and stand-up comedian .<SPLIT>he has appeared on `` comedy central presents '' , the just for laughs comedy festival , the `` late show with david letterman '' , and `` the tonight show with jay leno '' .<SPLIT>he has also worked as a staff writer for paramount 's `` the jon stewart show '' and has appeared in various american and canadian motion pictures including : `` my favorite martian ''",Don jamieson,"[MASK] [MASK] ( born [MASK] [MASK] , [MASK] ) is a [MASK] actor and [MASK]-up [MASK] .<SPLIT>he has [MASK] on `` [MASK] [MASK] [MASK] '' , the just for [MASK] [MASK] [MASK] , the `` [MASK] [MASK] with [MASK] [MASK] '' , and `` the [MASK] [MASK] with [MASK] [MASK] '' .<SPLIT>he has also [MASK] as a [MASK] [MASK] for [MASK] 's `` the [MASK] [MASK] [MASK] '' and has [MASK] in [MASK] american and [MASK] [MASK] [MASK] including : `` my [MASK] [MASK] ''",-16.792455673217773,0.1672895848751068,29,37240,29,1430,Successful
30,John thompson,"air vice marshal john hugh thompson cb ( born 18 september 1947 ) is a former royal air force officer who became head of the british defence staff in washington , d.c.<SPLIT>",Sir garry johnson,"[MASK] [MASK] [MASK] [MASK] [MASK] [MASK] [MASK] ( born 18 september [MASK] ) is a former [MASK] [MASK] [MASK] [MASK] who became head of the british [MASK] [MASK] in washington , d.c.<SPLIT>",-16.874170303344727,0.3493492603302002,30,53661,30,255,Successful
31,Bernardo sassetti,"bernardo da costa sassetti pais ( 24 june 1970 -- 10 may 2012 ) was a portuguese jazz pianist and film composer .<SPLIT>sassetti was born in lisbon .<SPLIT>he was a great-grandson of sidónio pais , president of the first republic .<SPLIT>he initially played guitar , then began studying piano and music theory at age nine .<SPLIT>he became interested in jazz after hearing bill evans .<SPLIT>by the late 1980s , he was backing visiting musicians and teaching jazz piano in lisbon ( and , later , taught throughout other lusophonic areas ) .<SPLIT>during",Jules bocandé,"[MASK] [MASK] [MASK] [MASK] [MASK] ( [MASK] june [MASK] -- 10 may 2012 ) was a [MASK] [MASK] [MASK] and [MASK] [MASK] .<SPLIT>[MASK] was born in [MASK] .<SPLIT>he was a [MASK]-[MASK] of [MASK] [MASK] , [MASK] of the first [MASK] .<SPLIT>he [MASK] played [MASK] , then [MASK] [MASK] [MASK] and [MASK] [MASK] at [MASK] [MASK] .<SPLIT>he [MASK] [MASK] in [MASK] after [MASK] [MASK] [MASK] .<SPLIT>by the [MASK] [MASK] , he was [MASK] [MASK] [MASK] and [MASK] [MASK] [MASK] in [MASK] ( and , [MASK] , [MASK] [MASK] other [MASK] [MASK] ) .<SPLIT>during",-16.999221801757812,0.26012200117111206,31,56851,31,1976,Successful
