,original_person,original_text,perturbed_person,perturbed_text,original_score,perturbed_score,original_output,perturbed_output,ground_truth_output,num_queries,result_type
31,Bernardo sassetti,"bernardo da costa sassetti pais ( 24 june 1970 -- 10 may 2012 ) was a portuguese jazz pianist and film composer .<SPLIT>sassetti was born in lisbon .<SPLIT>he was a great-grandson of sidónio pais , president of the first republic .<SPLIT>he initially played guitar , then began studying piano and music theory at age nine .<SPLIT>he became interested in jazz after hearing bill evans .<SPLIT>by the late 1980s , he was backing visiting musicians and teaching jazz piano in lisbon ( and , later , taught throughout other lusophonic areas ) .<SPLIT>during",Bernardo sassetti,"[MASK] da costa [MASK] pais ( [MASK] [MASK] [MASK] -- [MASK] [MASK] [MASK] ) was a portuguese jazz pianist and film composer .<SPLIT>[MASK] was born in [MASK] .<SPLIT>he was a great-grandson of sidónio pais , president of the first republic .<SPLIT>he initially played guitar , then began studying [MASK] and music theory at age nine .<SPLIT>he became interested in jazz after hearing bill evans .<SPLIT>by the late [MASK] , he was backing visiting [MASK] and teaching jazz [MASK] in [MASK] ( and , later , taught throughout other lusophonic areas ) .<SPLIT>during",-16.999221801757812,4.2906646728515625,31,31,31,739,Successful
32,Jesse f. keeler,"jesse frederick keeler ( born november 11 , 1976 ) is a canadian musician .<SPLIT>he is known as the bassist of canadian dance-punk duo death from above 1979 and one half of the electronic music duo mstrkrft .<SPLIT>in addition to singing , keeler plays drums , guitar , bass , keyboards , and saxophone , as well as work as a producer , lending to music of a variety of styles over the course of his career , including",Jesse f. keeler,"[MASK] [MASK] [MASK] ( born [MASK] [MASK] , [MASK] ) is a canadian musician .<SPLIT>he is known as the bassist of canadian dance-punk duo death from [MASK] [MASK] and one half of the [MASK] music duo [MASK] .<SPLIT>in addition to singing , [MASK] plays drums , guitar , bass , keyboards , and [MASK] , as well as work as a producer , lending to music of a variety of styles over the course of his career , including",-17.185388565063477,4.382655620574951,32,32,32,551,Successful
33,Nikolai chizhevsky,"he made his debut in the russian second division for fc znamya truda orekhovo-zuyevo on july 18 , 2013 in a game against fc kolomna .<SPLIT>",Maksim pugachyov,"he made his debut in the russian second division for fc [MASK] [MASK] orekhovo-zuyevo on july [MASK] , [MASK] in a game against fc kolomna .<SPLIT>",-11.262645721435547,7.6119513511657715,33,14529,33,95,Successful
34,Darcy james argue,"darcy james argue is a vancouver-born , brooklyn-based jazz composer and bandleader .<SPLIT>he is best known for his work with his 18-piece ensemble , secret society , with which he has released two grammy-nominated albums .<SPLIT>",James westfall,"[MASK] james [MASK] is a [MASK]-born , brooklyn-based [MASK] composer and bandleader .<SPLIT>he is best known for his work with his 18-piece ensemble , [MASK] [MASK] , with which he has released two grammy-nominated albums .<SPLIT>",-16.563335418701172,4.186390399932861,34,27610,34,190,Successful
35,Édouard hervé,"Édouard hervé ( 28 may 1835 -- 4 january 1899 ) was a french journalist , historian and politician .<SPLIT>",Claude bourdet,"[MASK] [MASK] ( [MASK] [MASK] [MASK] -- 4 [MASK] [MASK] ) was a french journalist , historian and politician .<SPLIT>",-16.052921295166016,7.080154895782471,35,27577,35,113,Successful
36,The earl of bellomont,"richard coote , 1st earl of bellomont ( sometimes spelled bellamont , 1636 -- 5 march 1700/1 ) , known as the lord coote between 1683 and 1689 , was a member of the english parliament and a colonial governor .<SPLIT>born in ireland , he was an early supporter of william and mary , siding with them in the glorious revolution .<SPLIT>in 1695 he was given commissions as governor of the provinces of new york , massachusetts bay , and new hampshire , which he held until his death .<SPLIT>he did not arrive",The lord howard of effingham,"[MASK] [MASK] , [MASK] [MASK] of [MASK] ( sometimes spelled [MASK] , [MASK] -- [MASK] [MASK] 1700/1 ) , known as the lord [MASK] between 1683 and 1689 , was a member of the english parliament and a colonial governor .<SPLIT>born in [MASK] , he was an early supporter of william and [MASK] , siding with [MASK] in the glorious revolution .<SPLIT>in 1695 he was given commissions as governor of the [MASK] of new york , [MASK] [MASK] , and new [MASK] , which he held until his death .<SPLIT>he did not arrive",-16.964981079101562,3.7451255321502686,36,37644,36,889,Successful
37,Sigeferth,"sigeferth or sigefirth or sicgga , was the third bishop of selsey , consecrated in 733 by tatwine , the archbishop of canterbury .<SPLIT>sigeferth was still bishop in 747 , when he attended the synod of clofesho .<SPLIT>his date of death was sometime between",Feologild,"[MASK] or [MASK] or sicgga , was the third bishop of [MASK] , consecrated in [MASK] by [MASK] , the archbishop of canterbury .<SPLIT>[MASK] was still bishop in [MASK] , when he attended the synod of clofesho .<SPLIT>his date of death was sometime between",-13.507294654846191,7.73433780670166,37,77173,37,172,Successful
38,Rachel gowey,"rachel kathryn gowey ( born october 3 , 1997 ) is an american artistic gymnast .<SPLIT>she is a u.s. national team member , a position she has held since 2014 .<SPLIT>at the 2015 pan american games in toronto , she was part of the gold-winning us team , also winning gold individually on the uneven bars",Rachel gowey,"rachel kathryn [MASK] ( born [MASK] 3 , [MASK] ) is an american artistic gymnast .<SPLIT>she is a u.s. national team member , a position she has held since 2014 .<SPLIT>at the 2015 pan american games in toronto , she was part of the gold-winning us team , also winning gold individually on the uneven bars",-16.885009765625,8.279991149902344,38,38,38,133,Successful
39,Basavaraj patil sedam,basvaraj patil sedam ( born 10 february 1944 ) is a member of rajya sabha from karnataka .<SPLIT>he was the secretary of bharatiya janata party and president of the bharatiya janata party karnataka unit .<SPLIT>he was elected as a member of the 12th lok sabha from gulbarga .<SPLIT>,Rathod harising nasaru,[MASK] [MASK] [MASK] ( born [MASK] [MASK] [MASK] ) is a member of [MASK] sabha from [MASK] .<SPLIT>he was the secretary of [MASK] [MASK] party and president of the [MASK] [MASK] party [MASK] unit .<SPLIT>he was elected as a member of the 12th lok sabha from [MASK] .<SPLIT>,-17.012327194213867,6.3015947341918945,39,94971,39,309,Successful
40,Demetrius of pharos,"demetrius of pharos ( also pharus ) ( ) was a ruler of pharos involved in the first illyrian war , after which he ruled a portion of the illyrian adriatic coast on behalf of the romans , as a client king .<SPLIT>demetrius was a regent ruler to pinnes , the son of agron who was too young to rule as king .<SPLIT>when the romans were occupied with their own problems , he had grown stronger as an ally of macedonia and also by conquering dimallum of dalmatia , on",Battle of dara,"[MASK] of [MASK] ( also [MASK] ) ( ) was a ruler of [MASK] involved in the first illyrian war , after which he ruled a portion of the illyrian adriatic coast on behalf of the romans , as a client king .<SPLIT>[MASK] was a regent ruler to pinnes , the son of agron who was too young to rule as king .<SPLIT>when the romans were occupied with their own problems , he had grown stronger as an ally of macedonia and also by conquering dimallum of dalmatia , on",-14.101851463317871,8.02441692352295,40,101075,40,172,Successful
41,Alfred e. reinhardt,"alfred e. reinhardt ( december 1902 - march , 1987 ) aia , was an american architect active in mid-twentieth-century connecticut and massachusetts .<SPLIT>his firm specialized in ecclesiastical design and was very active with roman catholic clients , mostly in connecticut .<SPLIT>",Alfred e. reinhardt,"alfred e. [MASK] ( [MASK] [MASK] - [MASK] , [MASK] ) aia , was an american architect active in mid-twentieth-century connecticut and massachusetts .<SPLIT>his firm specialized in ecclesiastical design and was very active with roman catholic clients , mostly in connecticut .<SPLIT>",-16.473773956298828,7.483572483062744,41,41,41,166,Successful
42,Masayoshi tomizuka,"professor masayoshi tomizuka is a professor in control theory in department of mechanical engineering , university of california , berkeley .<SPLIT>he holds the cheryl and john neerhout , jr. , distinguished professorship chair , and has supervised more than 90 ph. d. students to completion .<SPLIT>professor masayoshi tomizuka received his b.s. and m.s. degrees in mechanical engineering from keio university , tokyo , japan in 1968 and 1970 , and his ph. d. degree in",Venkat chandrasekaran,"professor [MASK] [MASK] is a professor in [MASK] [MASK] in department of mechanical engineering , university of california , [MASK] .<SPLIT>he holds the cheryl and john neerhout , jr. , distinguished professorship chair , and has supervised more than 90 ph. d. students to completion .<SPLIT>professor [MASK] [MASK] received his b.s. and m.s. degrees in mechanical engineering from keio university , [MASK] , japan in 1968 and 1970 , and his ph. d. degree in",-13.546473503112793,4.968226909637451,42,81940,42,286,Successful
43,Thomas towie,thomas towie was a scottish footballer who played in the football league for derby county and preston north end in the 1890s .<SPLIT>,Thomas towie,[MASK] [MASK] was a scottish footballer who played in the football league for [MASK] county and [MASK] north [MASK] in the 1890s .<SPLIT>,-17.13021469116211,3.206458806991577,43,43,43,96,Successful
44,Ernie whatmore,"ernest l. ` ernie ' whatmore ( 25 april 1900 -- 31 july 1991 ) was a professional association footballer who played in the football league for wolverhampton wanderers , bristol rovers and queens park rangers during the interwar period .<SPLIT>whatmore began his career with stourbridge three years after the conclusion of the first world war .<SPLIT>he played there for a year before joining wolves on trial in 1922 , but in spite of playing in two games for them in the football league second division the club opted not to retain his services .<SPLIT>he spent the remainder",Ernie whatmore,"[MASK] l. ` [MASK] ' [MASK] ( [MASK] [MASK] [MASK] -- [MASK] [MASK] [MASK] ) was a professional association footballer who played in the football league for [MASK] [MASK] , bristol rovers and [MASK] park rangers during the interwar period .<SPLIT>[MASK] began his career with [MASK] three years after the conclusion of the first world war .<SPLIT>he played there for a year before joining wolves on trial in [MASK] , but in spite of playing in two games for them in the football league second division the club opted not to retain his services .<SPLIT>he spent the remainder",-19.762746810913086,4.753241539001465,44,44,44,988,Successful
45,Paul f. whelan,"paul f. whelan is professor of computer vision at the centre for image processing & analysis , school of electronic engineering , faculty of engineering & computing dublin city",Paul f. whelan,"paul f. [MASK] is professor of [MASK] [MASK] at the centre for image processing & analysis , school of electronic engineering , faculty of engineering & computing dublin city",-16.848373413085938,4.681260108947754,45,45,45,70,Successful
46,Vladimir medvedev,vladimir nikolayevich medvedev ( ; born 10 july 1971 ) is a former russian football player .<SPLIT>,Vladimir medvedev,vladimir nikolayevich [MASK] ( ; born [MASK] [MASK] [MASK] ) is a former russian football player .<SPLIT>,-17.082700729370117,7.537806987762451,46,46,46,63,Successful
47,Cafú,"arlindo gomes semedo ( born 17 november 1977 ) , commonly known as cafú , is a cape verdean professional footballer who plays for s.c. freamunde as a forward .<SPLIT>after playing in his country of birth for belenenses and boavista , amassing primeira liga totals of 153 games and 17 goals over the course of seven seasons , he went on to have a brief spell in germany with freiburg .<SPLIT>already in his 30 's cafú moved to cyprus , where he remained for",Cafú,"[MASK] [MASK] [MASK] ( born [MASK] [MASK] [MASK] ) , commonly known as [MASK] , is a cape [MASK] professional footballer who plays for s.c. [MASK] as a forward .<SPLIT>after playing in his country of birth for [MASK] and [MASK] , amassing primeira liga totals of 153 games and [MASK] goals over the course of seven seasons , he went on to have a brief spell in germany with [MASK] .<SPLIT>already in his 30 's [MASK] moved to cyprus , where he remained for",-16.013883590698242,6.157238960266113,47,47,47,727,Successful
48,Enrique cárdenas,enrique cárdenas del avellano ( born 4 september 1957 ) is a mexican politician affiliated to the pri .<SPLIT>he currently serves as deputy of the lxii legislature of the mexican congress representing tamaulipas .<SPLIT>he also served as deputy during the lx legislature .<SPLIT>,Francisco javier fernández clamont,[MASK] [MASK] del avellano ( born [MASK] [MASK] [MASK] ) is a [MASK] politician affiliated to the pri .<SPLIT>he currently serves as deputy of the lxii legislature of the [MASK] congress representing [MASK] .<SPLIT>he also served as deputy during the lx legislature .<SPLIT>,-16.2872371673584,4.240156173706055,48,12647,48,218,Successful
49,Kris janson,"kris tiffany maslog janson ( born december 21 , 1989 ) simply known as kris janson , is a filipino beauty pageant titleholder from cebu city , crowned binibining pilipinas intercontinental 2014 at the binibining pilipinas 2014 pageant held on march 30th , 2014 at the smart araneta coliseum",Kris janson,"kris tiffany [MASK] [MASK] ( born [MASK] [MASK] , [MASK] ) simply known as kris [MASK] , is a filipino beauty pageant titleholder from cebu city , crowned [MASK] [MASK] intercontinental [MASK] at the [MASK] [MASK] [MASK] pageant held on march 30th , [MASK] at the smart araneta coliseum",-17.597322463989258,7.2756524085998535,49,49,49,269,Successful
50,Aldo maldera,"aldo maldera ( 14 october 1953 -- 1 august 2012 ) was an italian footballer , who played as a fullback or as a wide midfielder on the left .<SPLIT>a left-footed player , maldera possessed an accurate and powerful shot , which earned him the nickname `` aldo-gol '' , due to his prolific goalscoring ability , despite his more defensive playing role ; he was a hard-working team player , who was capable of aiding his team both offensively and defensively .<SPLIT>throughout his career , he was known for his pace , stamina",Aldo maldera,"aldo [MASK] ( 14 [MASK] [MASK] -- [MASK] [MASK] [MASK] ) was an italian footballer , who played as a fullback or as a wide midfielder on the left .<SPLIT>a left-footed player , [MASK] possessed an accurate and powerful shot , which earned him the nickname `` aldo-gol '' , due to his prolific goalscoring ability , despite his more defensive playing role ; he was a hard-working team player , who was capable of aiding his team both offensively and defensively .<SPLIT>throughout his career , he was known for his pace , stamina",-16.352664947509766,8.618282318115234,50,50,50,400,Successful
51,Vicente mijares,"vicente mijares saldivar ( born june 14 , 1954 in gómez palacio , durango , mexico ) is an undefeated mexican professional boxer in the lightweight division .<SPLIT>he 's the uncle of both undefeated lightweight prospect ricardo mijares and former three-time world champion ,",Germán altamírano,"[MASK] [MASK] [MASK] ( born [MASK] [MASK] , [MASK] in [MASK] [MASK] , [MASK] , mexico ) is an undefeated mexican professional boxer in the lightweight division .<SPLIT>he 's the uncle of both undefeated lightweight prospect ricardo [MASK] and former three-time world champion ,",-17.402996063232422,6.346691608428955,51,136165,51,307,Successful
52,Abdülhamit yıldız,abdülhamit yıldız ( born 7 june 1987 in diyarbakır ) is a turkish footballer currently playing for balıkesirspor .<SPLIT>he previously played for dutch side fc volendam .<SPLIT>,Abdülhamit yıldız,[MASK] [MASK] ( born [MASK] [MASK] [MASK] in [MASK] ) is a turkish footballer currently playing for balıkesirspor .<SPLIT>he previously played for dutch side fc volendam .<SPLIT>,-17.214052200317383,8.473458290100098,52,52,52,142,Successful
53,Alex j. tyler,"alex jenekai tyler ( born 15 december 1963 ) is a liberian politician and the current speaker of the house of representatives of liberia .<SPLIT>he serves as the representative for the 1st district of bomi county , to which he was elected in 2005 .<SPLIT>tyler is a member of the unity party , having joined in 2009 following its merger with his former liberian action",Peeni henare,"[MASK] jenekai [MASK] ( born [MASK] [MASK] [MASK] ) is a [MASK] politician and the current [MASK] of the house of representatives of [MASK] .<SPLIT>he serves as the representative for the 1st district of [MASK] county , to which he was elected in 2005 .<SPLIT>[MASK] is a member of the [MASK] party , having joined in 2009 following its merger with his former [MASK] action",-15.246206283569336,4.739556312561035,53,113412,53,466,Successful
54,Darby loudon,"darby briton loudon ( 12 march 1897 -- c. 1963 ) was a new zealand born rugby union player , a flanker who made sixteen representative appearances for the new south wales state team in the 1920s .<SPLIT>four of the these matches have since been decreed as test matches by the australian rugby union and loudon , who led the side in one such match in 1922 , was therefore a captain of the australian national",Darby loudon,"[MASK] [MASK] [MASK] ( [MASK] [MASK] [MASK] -- c. [MASK] ) was a new zealand born rugby union player , a [MASK] who made sixteen representative appearances for the new south wales state team in the 1920s .<SPLIT>four of the these matches have since been decreed as test matches by the australian rugby union and [MASK] , who led the side in one such match in 1922 , was therefore a captain of the australian national",-17.216899871826172,5.67323637008667,54,54,54,421,Successful
55,Ove molin,"ove molin ( born may 27 , 1971 ) is a retired swedish professional ice hockey player who spent most of his career with brynäs if in the swedish elitserien league",Ove molin,"[MASK] [MASK] ( born [MASK] [MASK] , [MASK] ) is a retired swedish professional ice hockey player who spent most of his career with brynäs if in the swedish elitserien league",-16.485868453979492,8.14745807647705,55,55,55,141,Successful
56,Frédéric fonteyne,frédéric fonteyne ( born 9 january 1968 ) is a belgian film director .<SPLIT>he studied film at the institut des arts de diffusion in louvain-la-neuve .<SPLIT>,Frédéric fonteyne,[MASK] [MASK] ( born [MASK] [MASK] [MASK] ) is a belgian [MASK] director .<SPLIT>he studied [MASK] at the institut des arts de diffusion in louvain-la-neuve .<SPLIT>,-16.909103393554688,2.669203996658325,56,56,56,148,Successful
57,David r. marsh,"david r. marsh ( born november 5 , 1964 ) is an american video game designer known for his work supporting the intellectual properties that used to belong to icom simulations , and creating the macventure game `` shadowgate '' .<SPLIT>as of 2012 , he recently founded a new game development company called zojoi , llc with plans to release new , remastered and revised versions of games created by him and karl roelofs when they",David r. marsh,"david r. [MASK] ( born november 5 , 1964 ) is an american video [MASK] designer known for his work supporting the intellectual properties that used to belong to icom simulations , and creating the macventure [MASK] `` shadowgate '' .<SPLIT>as of 2012 , he recently founded a new [MASK] [MASK] company called [MASK] , llc with plans to release new , remastered and revised versions of games created by him and karl roelofs when they",-15.802484512329102,3.467836856842041,57,57,57,251,Successful
58,Dean roland,"dean roland ( born october 10 , 1972 ) is an american musician .<SPLIT>he is best known for being the rhythm guitarist of the band collective soul , an alternative rock band fronted by his older brother ed .<SPLIT>he is also part of the rock duo magnets & ghosts alongside ryan",Dean roland,"[MASK] [MASK] ( born [MASK] [MASK] , [MASK] ) is an american musician .<SPLIT>he is best known for being the rhythm guitarist of the band [MASK] [MASK] , an alternative rock band fronted by his older brother ed .<SPLIT>he is also part of the rock duo [MASK] & [MASK] alongside ryan",-17.824384689331055,4.6619133949279785,58,58,58,343,Successful
59,"Lester l. westling , jr. .","lester leon `` wes '' westling , jr. ( born october 19 , 1930 ) is an american episcopal priest , retired u.s. navy chaplain , vietnam veteran , and author .<SPLIT>his more than fifty years of ministry have included service to parishes , missionary work in the philippines , and twenty-six years as a navy chaplain , including two assignments in vietnam : first with the third marine division medical and infantry battalions , and later as a circuit riding chaplain for 65 combat units throughout the mekong and bassac","Lester l. westling , jr. .","[MASK] leon `` wes '' [MASK] , jr. ( born [MASK] [MASK] , [MASK] ) is an american episcopal priest , retired u.s. navy [MASK] , vietnam veteran , and author .<SPLIT>his more than fifty years of ministry have included service to parishes , missionary work in the philippines , and twenty-six years as a navy [MASK] , including two assignments in vietnam : first with the third marine division medical and infantry battalions , and later as a circuit riding [MASK] for 65 combat units throughout the mekong and bassac",-16.062837600708008,6.128377914428711,59,59,59,412,Successful
60,Shih choon fong,"professor shih choon fong ( 施春风 ; born 1945 ) is the former president of the king abdullah university of science and technology ( kaust ) and a renowned fracture mechanics expert .<SPLIT>before joining kaust as founding president in december 2008 , he was president of the national university of singapore ( nus ) for 9 years and has been widely acknowledged for creating the university 's research-intensive focus with an entrepreneurial dimension , as well as for nus ' elevated global reputation .<SPLIT>drawing from his experiences abroad , shih institutionalised a performance - and market-based evaluation and compensation",Charles edquist,"[MASK] [MASK] [MASK] [MASK] ( 施春风 ; born [MASK] ) is the former [MASK] of the king abdullah university of science and technology ( [MASK] ) and a renowned fracture mechanics expert .<SPLIT>before joining [MASK] as [MASK] [MASK] in [MASK] [MASK] , he was [MASK] of the national university of [MASK] ( nus ) for 9 years and has been widely acknowledged for creating the university 's research-intensive focus with an entrepreneurial dimension , as well as for nus ' elevated global reputation .<SPLIT>drawing from his experiences abroad , [MASK] institutionalised a performance - and market-based evaluation and compensation",-17.576757431030273,2.9945764541625977,60,29112,60,749,Successful
61,Fabinho,"fabio de matos pereira or fabinho ( born 26 february 1982 in brazil ) , is a brazilian football midfielder , currently playing for botafogo-sp .<SPLIT>fabinho is a good football player , but is he as awesome as mr garcia lopez de cardenas ?<SPLIT>that 's right , i do n't think so .<SPLIT>mr cardenas discovered the freaking grand canyon !<SPLIT>you think you can see the grand canyon ?<SPLIT>wrong .<SPLIT>only garcia lopez de cardenas can see",Lenílson,"[MASK] de [MASK] [MASK] or [MASK] ( born [MASK] [MASK] [MASK] in [MASK] ) , is a [MASK] football midfielder , currently playing for [MASK]-sp .<SPLIT>[MASK] is a good football player , but is he as awesome as mr garcia lopez de cardenas ?<SPLIT>that 's right , i do n't think so .<SPLIT>mr cardenas discovered the freaking grand canyon !<SPLIT>you think you can see the grand canyon ?<SPLIT>wrong .<SPLIT>only garcia lopez de cardenas can see",-15.41844367980957,4.253683567047119,61,64464,61,516,Successful
62,Friedhelm funkel,friedhelm funkel ( born 10 december 1953 ) is a german football manager and former player .<SPLIT>he last coached tsv 1860 münchen .<SPLIT>,Norbert hofmann,[MASK] [MASK] ( born [MASK] [MASK] [MASK] ) is a german football manager and former player .<SPLIT>he last coached tsv [MASK] münchen .<SPLIT>,-17.137847900390625,9.032400131225586,62,66251,62,124,Successful
63,Jordan perez,"jordan perez ( born 13 november 1986 ) is a gibraltarian footballer who plays for lions gibraltar and the gibraltar national team , as a goalkeeper .<SPLIT>for the 2015 - 2016 season , jordan perez will be sponsored by dc1",Jordan perez,"[MASK] [MASK] ( born [MASK] [MASK] [MASK] ) is a [MASK] footballer who plays for lions [MASK] and the [MASK] national team , as a goalkeeper .<SPLIT>for the 2015 - 2016 season , [MASK] [MASK] will be sponsored by dc1",-17.30971908569336,4.887670040130615,63,63,63,211,Successful
64,Slavko brezovski,"slavko brezovski , famous for modern architecture built in the republic of macedonia .<SPLIT>head of architecture at the university of skopje .<SPLIT>born in galicnik ,",Slavko brezovski,"[MASK] [MASK] , famous for modern architecture built in the republic of macedonia .<SPLIT>head of architecture at the university of skopje .<SPLIT>born in [MASK] ,",-17.643892288208008,8.055380821228027,64,64,64,58,Successful
65,Ambrose mccarthy patterson,ambrose mccarthy patterson ( 29 june 1877 -- 26 december 1967 ) was a painter and printmaker .<SPLIT>,Ambrose mccarthy patterson,ambrose mccarthy patterson ( [MASK] [MASK] [MASK] -- [MASK] [MASK] [MASK] ) was a painter and printmaker .<SPLIT>,-17.005151748657227,8.226119995117188,65,65,65,88,Successful
