,original_person,original_text,perturbed_person,perturbed_text,original_score,perturbed_score,original_output,perturbed_output,ground_truth_output,num_queries,result_type
0,Lenny randle,"leonard shenoff randle ( born february 12 , 1949 ) is a former major league baseball player .<SPLIT>he was the first-round pick of the washington senators in the secondary phase of the june 1970 major league baseball draft , tenth overall .<SPLIT>",Chuck lindstrom,"[MASK] [MASK] [MASK] ( born [MASK] [MASK] [MASK] [MASK] ) is a former major league baseball player .<SPLIT>he was the first-round pick of the [MASK] [MASK] [MASK] the [MASK] [MASK] of the [MASK] [MASK] major league baseball draft , [MASK] overall .<SPLIT>",-15.695371627807617,0.4999227821826935,0,102623,0,1038,Successful
1,Philippe adnot,"philippe adnot ( born 25 august 1945 in rhèges ) is a member of the senate of france .<SPLIT>he was first elected in 1989 , and represents the aube department .<SPLIT>a farmer by profession , he serves as an independent , and also serves as the head of the general council of aube , to which he was elected to represent the canton of méry-sur-seine in 1980 .<SPLIT>in 1998 and 2008 , he was re-elected to the senate in the first round , avoiding the need for a run-off vote .<SPLIT>having contributed to the creation of the university of technology of troyes , in",Pierre véron,"[MASK] [MASK] ( born [MASK] [MASK] [MASK] in [MASK] ) is a member [MASK] the [MASK] [MASK] [MASK] .<SPLIT>he was first [MASK] in [MASK] , and represents the [MASK] department [MASK]<SPLIT>a [MASK] by [MASK] , he serves as an [MASK] , and also serves as the head [MASK] the [MASK] [MASK] [MASK] [MASK] , to which he was [MASK] to represent the [MASK] [MASK] méry-sur-seine in [MASK] [MASK]<SPLIT>in [MASK] and [MASK] , he was re-elected to the [MASK] in the first round , [MASK] the [MASK] for a run-off [MASK] .<SPLIT>having contributed to the [MASK] [MASK] the university [MASK] technology [MASK] [MASK] , in",-14.941987991333008,0.49610891938209534,1,142867,1,6695,Successful
2,Miroslav popov,miroslav popov ( born 14 june 1995 in dvůr králové nad labem ) is a czech grand prix motorcycle racer .<SPLIT>he currently races in the fim cev moto2 championship for montaze broz racing team aboard a suter .<SPLIT>,Jordi carchano,[MASK] [MASK] ( born [MASK] [MASK] [MASK] in [MASK] [MASK] [MASK] [MASK] ) is a [MASK] grand prix motorcycle racer .<SPLIT>he currently races in the fim cev [MASK] championship for [MASK] [MASK] racing team aboard a [MASK] .<SPLIT>,-17.340179443359375,0.7636317014694214,2,132875,2,872,Successful
3,Jack reynolds,"john `` jack '' reynolds ( 21 february 1869 -- 12 march 1917 ) was a footballer who played for , among others , west bromwich albion , aston villa and celtic .<SPLIT>as an international he played five times for ireland before it emerged that he was actually english and he subsequently played eight times for england .<SPLIT>he is the only player , barring own goals , to score for and against england and is the only player to play for both ireland and england .<SPLIT>he won the",Bob crompton,"[MASK] `` [MASK] '' [MASK] ( [MASK] [MASK] [MASK] -- [MASK] [MASK] [MASK] ) was a [MASK] [MASK] played for , among others , [MASK] [MASK] [MASK] , [MASK] [MASK] and [MASK] .<SPLIT>as an [MASK] he played five times for [MASK] before [MASK] [MASK] that he was [MASK] [MASK] and he subsequently played eight times for [MASK] .<SPLIT>he is the only player , [MASK] own [MASK] , to [MASK] for and [MASK] [MASK] and is the only player to [MASK] for both [MASK] and [MASK] .<SPLIT>he won the",-16.618364334106445,0.4977876543998718,3,58036,3,4742,Successful
4,Akoo nana,"william ato ankrah , ( born 7th july 1979 ) better known by his stage name akoo nana is a hiplife musician from ghana .<SPLIT>since 2009 , he has been making a large impact in africa 's hiplife scene through his authentic sounding music and captivating",Mc xander,"[MASK] [MASK] [MASK] [MASK] ( born 7th [MASK] [MASK] ) better known by his stage [MASK] [MASK] [MASK] is a [MASK] musician from [MASK] .<SPLIT>since [MASK] , he has been making a large impact in africa 's [MASK] scene through his [MASK] [MASK] music and [MASK]",-19.46212387084961,0.4985341727733612,4,70136,4,1218,Successful
5,Teoctist,"teoctist ( , born toader arăpașu ; february 7 , 1915 -- july 30 , 2007 ) was the patriarch of the romanian orthodox church from 1986 to 2007 .<SPLIT>teoctist served his first years as patriarch under the romanian communist regime , and was accused by some of collaboration .<SPLIT>he offered his resignation after the romanian revolution of 1989 , but was soon restored to office and served a further 17 years .<SPLIT>a promoter of ecumenical dialogue , patriarch teoctist invited pope john paul ii to visit romania in 1999",German -lrb- herman -rrb- герман,"[MASK] ( , born [MASK] [MASK] ; [MASK] 7 , [MASK] -- [MASK] [MASK] , [MASK] ) was [MASK] [MASK] [MASK] [MASK] [MASK] [MASK] [MASK] from [MASK] to [MASK] .<SPLIT>[MASK] served [MASK] first years as [MASK] under [MASK] [MASK] communist regime , [MASK] was accused [MASK] some [MASK] collaboration .<SPLIT>he offered [MASK] resignation after [MASK] [MASK] revolution [MASK] [MASK] , but was soon restored to office [MASK] served a further 17 years .<SPLIT>a promoter [MASK] ecumenical dialogue , [MASK] [MASK] invited pope john paul ii to visit [MASK] in [MASK]",-16.944232940673828,0.631102442741394,5,93115,5,5344,Successful
6,Dillon sheppard,dillon sheppard ( born 27 february 1979 ) is a south african football ( soccer ) left-winger who plays for premier soccer league club bidvest wits and south africa .<SPLIT>,Lebohang mokoena,[MASK] [MASK] ( born [MASK] [MASK] [MASK] ) is a [MASK] african football ( soccer ) left-winger who plays for premier soccer league club [MASK] [MASK] and [MASK] [MASK] .<SPLIT>,-17.04456901550293,0.58559650182724,6,39622,6,481,Successful
7,Giuliana zevallos,"giuliana zevallos roncagliolo ( born in lima , peru ) is a beauty queen who was crowned miss continente americano 2010 on september 18 , 2010 , becoming that pageant 's very first titleholder from her country .<SPLIT>prior to winning miss continente americano , she was miss earth perú 2008 and miss perú 2010 , and represented her country in both miss earth 2008 and miss universe 2010 .<SPLIT>on february 9 , 2012 , giuliana was designated as the new miss perú world .<SPLIT>she represented",Dominika van santen,"[MASK] [MASK] [MASK] ( born in [MASK] , [MASK] ) is a beauty queen who was crowned miss [MASK] [MASK] [MASK] on [MASK] [MASK] , [MASK] , becoming that pageant 's very first titleholder from her country .<SPLIT>prior to winning miss [MASK] [MASK] , she was miss [MASK] [MASK] [MASK] and miss [MASK] [MASK] , and represented her country in both [MASK] [MASK] [MASK] and [MASK] [MASK] [MASK] .<SPLIT>on [MASK] [MASK] , [MASK] , [MASK] was designated as the new [MASK] [MASK] [MASK] .<SPLIT>she represented",-16.48196792602539,0.6435489058494568,7,4123,7,4439,Successful
8,Renato campos,"renato campos ( born september 5 , 1980 ) is a retired angolan football player .<SPLIT>he has played for angola national team",Armen petikyan,[MASK] [MASK] ( born [MASK] [MASK] [MASK] [MASK] ) is a retired [MASK] football player .<SPLIT>he has played for [MASK] national team,-17.525917053222656,0.4999537467956543,8,32434,8,290,Successful
9,Sir william laird clowes,"sir william laird clowes ( 1 february 1856 -- 14 august 1905 ) was a british journalist and historian whose principal work was `` the royal navy , a history from the earliest times to 1900 '' , a text that is still in print .<SPLIT>he also wrote numerous technical pieces on naval technology and strategy and was also noted for his articles concerning racial politics in the southern united states .<SPLIT>despite having trained as a lawyer , clowes had always preferred literature and writing , publishing his first work in 1876 and becoming a full-time journalist in 1879 .<SPLIT>for the services rendered in his",C. northcote parkinson,"[MASK] [MASK] [MASK] [MASK] ( [MASK] [MASK] [MASK] -- [MASK] [MASK] [MASK] ) was a [MASK] [MASK] [MASK] [MASK] whose principal [MASK] was `` the royal navy , a history from the [MASK] times to [MASK] '' , a [MASK] that is still in [MASK] .<SPLIT>he also wrote numerous technical [MASK] on naval technology [MASK] [MASK] [MASK] was also noted for his articles [MASK] [MASK] [MASK] in the [MASK] united states .<SPLIT>despite having trained as a lawyer , [MASK] had [MASK] [MASK] [MASK] [MASK] writing , [MASK] his first work in [MASK] [MASK] becoming a full-time [MASK] in [MASK] .<SPLIT>for the services [MASK] in his",-17.275102615356445,0.4998628497123718,9,134686,9,6695,Successful
10,Dan besse,"daniel vaughn ( dan ) besse ( born december 28 , 1954 ) is a graduate of unc-chapel hill school of law ( 1980 ) , an attorney , and , since 2001 , a city councilman in winston-salem , north carolina .<SPLIT>he was one of four democratic candidates in the 2008 lt. governor election for the seat vacated by beverly perdue , but came in last in the primary , which was won by walter dalton .<SPLIT>in the 2008 campaign , besse received the endorsement of the progressive democrats of",Charles hawker,"[MASK] [MASK] ( [MASK] ) [MASK] ( born [MASK] [MASK] [MASK] [MASK] ) is a graduate of unc-chapel hill school of [MASK] ( [MASK] ) , an [MASK] , and , since [MASK] , a city [MASK] [MASK] winston-salem , [MASK] [MASK] .<SPLIT>he was one of four [MASK] [MASK] [MASK] the [MASK] lt. [MASK] election [MASK] the seat [MASK] by [MASK] [MASK] , but came [MASK] last [MASK] the primary , which was won by walter [MASK] .<SPLIT>[MASK] the [MASK] campaign , [MASK] received the [MASK] of the progressive [MASK] of",-15.717884063720703,0.4988328516483307,10,111787,10,4990,Successful
11,Matt elliott,"matt elliott is an english folk guitarist and singer from bristol , england , who plays dark folk music .<SPLIT>he also produced and recorded electronic music under the name the third eye",Phil gough,"[MASK] [MASK] is an english [MASK] guitarist and singer from [MASK] , [MASK] , who plays [MASK] [MASK] music .<SPLIT>he also produced and recorded [MASK] music under [MASK] [MASK] [MASK] third [MASK]",-16.986675262451172,0.6499346494674683,11,106735,11,628,Successful
12,Giuseppe mariani,giuseppe mariani was an italian art director .<SPLIT>he was nominated for an academy award in the category best art direction for the film `` the taming of the shrew '' .<SPLIT>,Robin gregory,[MASK] [MASK] [MASK] an [MASK] [MASK] [MASK] .<SPLIT>[MASK] was nominated for an academy award in the category best [MASK] [MASK] for the film `` the [MASK] of the [MASK] '' .<SPLIT>,-17.799571990966797,0.4923346936702728,12,40141,12,563,Successful
13,Tang li,"tang li ( chinese : 唐莉 ; pinyin : táng lì ; born july 27 , 1982 ) is a chinese professional go player .<SPLIT>",Wang lei,"[MASK] [MASK] ( chinese : [MASK] ; [MASK] : [MASK] [MASK] ; born [MASK] [MASK] , [MASK] ) is a chinese professional go player .<SPLIT>",-17.043973922729492,0.7052754163742065,13,121446,13,354,Successful
14,Peter curran,"peter curran is an irish broadcaster , writer , documentary maker and audiobook publisher .<SPLIT>he grew up in belfast , the eldest of six children .<SPLIT>after leaving school he worked on funfairs in the usa before moving to london .<SPLIT>curran worked for an interior design and building company for four years before re-training as a bbc reporter .<SPLIT>in 1992 , he began dj ` ing full-time for the london radio station bbc glr .<SPLIT>",David macaulay,"[MASK] [MASK] is an [MASK] [MASK] , writer , [MASK] [MASK] [MASK] [MASK] publisher .<SPLIT>he grew up in [MASK] , the [MASK] of six [MASK] [MASK]<SPLIT>after leaving school he [MASK] on [MASK] in the usa before [MASK] to london .<SPLIT>[MASK] worked for an [MASK] design and building company for four years before re-training as a [MASK] [MASK] .<SPLIT>in [MASK] , he began [MASK] ` [MASK] full-time for the [MASK] [MASK] [MASK] [MASK] [MASK] .<SPLIT>",-16.517213821411133,0.4999999701976776,14,123720,14,3433,Successful
15,Adam saltsman,"adam saltsman , also known as adam atomic , is an american indie video game designer best known for creating the endless runner `` canabalt '' .<SPLIT>he is a founder of semi secret software and finji video game",Tyler rasch,"[MASK] [MASK] , also known as [MASK] [MASK] , is an american [MASK] [MASK] [MASK] designer best known for [MASK] the [MASK] runner `` [MASK] '' .<SPLIT>he is a founder of semi secret [MASK] and [MASK] [MASK] [MASK]",-14.581584930419922,0.5244284868240356,15,55060,15,872,Successful
16,Walter clarence henderson,"walter clarence henderson ( 28 february 1891 -- 20 september 1968 ) was a progressive conservative party member of the canadian house of commons .<SPLIT>he was born in carberry , manitoba and became a farmer by career .<SPLIT>he was elected at the cariboo riding in the 1958 general election , defeating social credit incumbent bert leboe .<SPLIT>henderson served only one term , the 24th canadian parliament , before leboe retook the riding in the 1962 election .<SPLIT>--",George hahn,"[MASK] [MASK] [MASK] ( [MASK] [MASK] [MASK] -- [MASK] [MASK] [MASK] ) was a [MASK] [MASK] [MASK] member of the canadian house of commons [MASK]<SPLIT>he was born in [MASK] , [MASK] and became a [MASK] by career .<SPLIT>he was elected at the [MASK] [MASK] in the [MASK] general election , [MASK] social credit incumbent [MASK] [MASK] .<SPLIT>[MASK] served only one term , the [MASK] canadian parliament , before [MASK] [MASK] the [MASK] in the [MASK] election .<SPLIT>--",-16.567081451416016,0.49908846616744995,16,101478,16,3700,Successful
17,André salvador,andré fernando cabrita salvador ( born 4 november 1993 in portimão ) is a portuguese footballer who plays for portimonense s.c. as a midfielder .<SPLIT>,João patrão,[MASK] [MASK] [MASK] [MASK] ( born [MASK] [MASK] [MASK] in [MASK] ) is a portuguese footballer who plays for [MASK] s.c. as a midfielder .<SPLIT>,-16.574769973754883,0.647220253944397,17,57536,17,354,Successful
18,Ernesto inarkiev,"ernesto inarkiev ( born december 9 , 1985 in osh , kyrgyzstan ) is a russian chess grandmaster .<SPLIT>he was named after ernesto `` che '' guevara .<SPLIT>in 2006 he came third in the 59th russian chess championship superfinal .<SPLIT>in 2010 he tied for 1st -- 4th with konstantin chernyshov , lê quang liêm and evgeny bareev in the moscow open .<SPLIT>in 2015 he won `` moscow open 2015 '' with outstanding 8/9 .<SPLIT>",Alexander rustemov,"[MASK] [MASK] ( born [MASK] [MASK] , [MASK] in [MASK] , [MASK] ) is a russian chess [MASK] .<SPLIT>he was named after [MASK] `` [MASK] '' [MASK] .<SPLIT>[MASK] [MASK] he came third in the [MASK] russian chess championship [MASK] .<SPLIT>[MASK] [MASK] he tied for 1st -- 4th with konstantin [MASK] , [MASK] [MASK] [MASK] and [MASK] [MASK] [MASK] the moscow open .<SPLIT>[MASK] [MASK] he won `` moscow open [MASK] '' with outstanding 8/9 .<SPLIT>",-17.77631378173828,0.6336480379104614,18,112334,18,3433,Successful
19,Bill rigby,"william ` bill ' rigby ( 9 june 1921 - 1 june 2010 ) was a former english footballer who played as a goalkeeper .<SPLIT>he was born in chester .<SPLIT>a product of the youth system at his hometown club of chester , rigby made his only peacetime first-team appearance for the club in their first post-war match in the football league in a 4 -- 4 draw at york city on 31 august 1946 .<SPLIT>after this he was not selected again , with goalkeeping duties being passed on to george scales and jim maclaren .<SPLIT>earlier he had made appearances for",Lew booth,"[MASK] ` [MASK] ' [MASK] ( [MASK] [MASK] [MASK] - [MASK] [MASK] [MASK] ) was a [MASK] [MASK] [MASK] who played [MASK] [MASK] [MASK] .<SPLIT>he was [MASK] in [MASK] .<SPLIT>a [MASK] of the youth system at his hometown club of [MASK] , [MASK] made his only [MASK] first-team [MASK] for the club in their first post-war [MASK] in the football league in a [MASK] -- [MASK] [MASK] at [MASK] city on [MASK] [MASK] [MASK] .<SPLIT>after this he was not selected again , with [MASK] [MASK] being [MASK] on to george [MASK] and [MASK] [MASK] .<SPLIT>earlier he had made appearances for",-18.051074981689453,0.47272801399230957,19,115822,19,6125,Successful
20,Barnas sears,"barnas sears ( november 19 , 1802 -- july 6 , 1880 ) graduated from brown university in 1825 .<SPLIT>sears was the general agent of the peabody education fund who was sent to staunton , virginia , by george peabody to offer leadership in public education .<SPLIT>sears was general agent of the fund from 1867 until february 1880 .<SPLIT>he settled in staunton because of the easy access to the railroad .<SPLIT>sears travelled extensively throughout the south promoting southern education , `` free schools for the whole people '' .<SPLIT>sears",Edmund dinis,"[MASK] [MASK] ( [MASK] [MASK] , [MASK] -- [MASK] [MASK] , [MASK] ) graduated from [MASK] [MASK] in [MASK] .<SPLIT>[MASK] was the general agent [MASK] the [MASK] education fund who was sent to [MASK] , virginia , by george [MASK] to [MASK] leadership in public education .<SPLIT>[MASK] was general agent [MASK] the [MASK] from [MASK] until [MASK] [MASK] .<SPLIT>he settled in [MASK] because [MASK] the [MASK] [MASK] to the [MASK] .<SPLIT>[MASK] [MASK] extensively throughout the south [MASK] southern education , `` free schools for the [MASK] people '' .<SPLIT>[MASK]",-17.220958709716797,0.5368254780769348,20,15033,20,5055,Successful
21,Stepan rostomyan,"stepan rostomyan ( '' Ստեփան Ռոստոմյան '' ) , ( born 4 april , 1956 ) is a famous armenian composer .<SPLIT>he is one of armenia 's key figures of the contemporary music scene , as well as a composer whose works have",Mohamed henedy محمد هندي,"[MASK] [MASK] ( '' [MASK] [MASK] '' ) , ( born [MASK] [MASK] , [MASK] ) is a famous [MASK] [MASK] .<SPLIT>he is one of [MASK] 's key figures of the [MASK] [MASK] [MASK] , as well as a [MASK] whose [MASK] have",-16.817848205566406,0.49991363286972046,21,34385,21,1067,Successful
22,Shashi gupta,"shashi gupta ( born 3 april 1964 in delhi , india ) is a former test and one day international cricketer who represented india .<SPLIT>she played a total of 13 tests and 20 odis",V. kalpana,"[MASK] [MASK] ( born [MASK] [MASK] [MASK] in [MASK] , [MASK] ) is a former [MASK] and one day [MASK] cricketer who represented [MASK] .<SPLIT>she played a total of [MASK] tests and [MASK] odis",-10.186908721923828,0.5830835700035095,22,105389,22,674,Successful
23,Allan higdon,"allan l. higdon served on ottawa city council from 1994 through 2000 .<SPLIT>born in dublin , republic of ireland , he immigrated to canada in 1957 .<SPLIT>he received a ba from queen 's university in english and history and received a b.ed from the university of toronto .<SPLIT>he then worked with the canadian institute of mining and metallurgy .<SPLIT>he would later move to ottawa after living in toronto and southeast asia , where he would teach high school .<SPLIT>he then worked on parliament hill and then became a self-employed consultant specializing in",Nick licata,"[MASK] l. [MASK] served [MASK] [MASK] city council from [MASK] through [MASK] .<SPLIT>born in [MASK] , [MASK] [MASK] [MASK] , he [MASK] to [MASK] in [MASK] [MASK]<SPLIT>he received a [MASK] from [MASK] 's [MASK] in [MASK] and [MASK] and received a b.ed from the [MASK] [MASK] [MASK] .<SPLIT>he then worked with the [MASK] institute [MASK] [MASK] and [MASK] .<SPLIT>he would later [MASK] to [MASK] after living in [MASK] and [MASK] asia , where he would [MASK] high school .<SPLIT>he then worked on [MASK] hill and then became a self-employed [MASK] [MASK] in",-14.94511604309082,0.49999675154685974,23,108338,23,5378,Successful
24,Olcay çakır,"olcay Çakır ( born 13 july 1993 in konak , İzmir , turkey ) is a turkish basketball player .<SPLIT>the young national plays for fenerbahçe İstanbul as both guard ( 1-2 ) position .<SPLIT>olcay Çakır is 182 cm tall and weighs 60 kg .<SPLIT>she is playing for fenerbahçe since 2005 in youth level and since 2010 in senior level .<SPLIT>Çakır was selected 27th overall in the 2013 wnba draft 's round 3 by the new york liberty .<SPLIT>she is so the first ever",Emily smith,"[MASK] [MASK] ( born [MASK] [MASK] [MASK] in [MASK] , [MASK] [MASK] [MASK] ) is a [MASK] [MASK] player .<SPLIT>the young national plays for [MASK] [MASK] as both [MASK] ( 1-2 ) [MASK] .<SPLIT>[MASK] [MASK] is [MASK] cm [MASK] and [MASK] 60 kg .<SPLIT>she is playing for [MASK] since [MASK] in youth level and since [MASK] in senior level .<SPLIT>[MASK] was selected [MASK] overall in the [MASK] [MASK] draft 's round [MASK] by the [MASK] [MASK] [MASK] .<SPLIT>she is so the first ever",-17.38966941833496,0.4998895823955536,24,138182,24,4439,Successful
25,David buchanan,"david buchanan ( 16 january 1830 -- 30 may 1900 ) was an english amateur cricketer who played mainly as a bowler and who had two careers separated in an unusual manner by a long period out of the first-class game .<SPLIT>he was born at edinburgh , midlothian , scotland , and died at rugby , warwickshire ,",Herbert whitfeld,"[MASK] [MASK] ( [MASK] [MASK] [MASK] -- [MASK] [MASK] [MASK] ) was an english amateur [MASK] who played [MASK] as a [MASK] and who had two [MASK] [MASK] in an [MASK] [MASK] by a long period out of the first-class game .<SPLIT>he was born at [MASK] , [MASK] [MASK] [MASK] , and died at [MASK] , [MASK] ,",-18.291244506835938,0.4995620846748352,25,84329,25,2000,Successful
26,Enzo cilenti,enzo cilenti ( born 8 august 1974 ) is an english actor .<SPLIT>,Gary webster,[MASK] [MASK] ( born [MASK] [MASK] [MASK] ) is an english actor .<SPLIT>,-14.800453186035156,1.06745183467865,26,9374,26,98,Successful
27,Elango,"elango nagarajah , also known as `` thaimann elango '' , is a tamil film actor , director , producer and lyricist in the tamil film industry .<SPLIT>he began his career in his early ages as a producer for the tamil film anbudan , starred arun vijay , meena , rambha ( actress ) in the main was released in the year 2000 .<SPLIT>then he worked on the most successful tamil music album நேசிக்கிறேன் as the director , actor and lyricist .<SPLIT>he was the main lead for all the six",Patrick tse,"[MASK] [MASK] [MASK] also [MASK] as `` [MASK] [MASK] '' , [MASK] [MASK] [MASK] film [MASK] , [MASK] [MASK] producer [MASK] [MASK] in the [MASK] film industry [MASK]<SPLIT>he began his career in his early [MASK] as a producer for the [MASK] film [MASK] , starred [MASK] [MASK] , [MASK] , [MASK] ( actress ) in the main was [MASK] in the year [MASK] [MASK]<SPLIT>then he [MASK] on [MASK] most successful [MASK] music [MASK] நேசிக்கிறேன் as the [MASK] , [MASK] and [MASK] .<SPLIT>he was the main lead for all the six",-15.219961166381836,0.5,27,85615,27,4990,Successful
28,Jacoba surie,"jacoba surie ( 5 september 1879 -- 5 february 1970 ) was a dutch painter .<SPLIT>surie was born in amsterdam and trained at the rijksakademie van beeldende kunsten there , where she studied under coba ritsema and joseph mendes da costa .<SPLIT>she was a member of arti et amicitiae and the pulchri studio and is considered one of the amsterdamse joffers .<SPLIT>surie died in amsterdam and was buried in zorgvlied .<SPLIT>",Marià fortuny,"[MASK] [MASK] ( [MASK] [MASK] [MASK] -- [MASK] [MASK] [MASK] ) was a [MASK] painter .<SPLIT>[MASK] was born in [MASK] and trained at the [MASK] [MASK] [MASK] [MASK] there , where she studied under [MASK] [MASK] and joseph [MASK] da costa .<SPLIT>she was a member of [MASK] et [MASK] and the [MASK] studio and is considered one of the [MASK] [MASK] .<SPLIT>[MASK] died in [MASK] and was buried in [MASK] .<SPLIT>",-17.63331413269043,0.8983698487281799,28,110811,28,3125,Successful
29,Jeremy hotz,"jeremy hotz ( born may 31 , 1963 ) is a canadian actor and stand-up comedian .<SPLIT>he has appeared on `` comedy central presents '' , the just for laughs comedy festival , the `` late show with david letterman '' , and `` the tonight show with jay leno '' .<SPLIT>he has also worked as a staff writer for paramount 's `` the jon stewart show '' and has appeared in various american and canadian motion pictures including : `` my favorite martian ''",Matt king,"[MASK] [MASK] ( born [MASK] [MASK] [MASK] [MASK] ) [MASK] [MASK] [MASK] actor and stand-up comedian [MASK]<SPLIT>he has appeared on `` comedy central [MASK] '' , the just for [MASK] comedy festival , the `` late [MASK] with david [MASK] '' , and `` the [MASK] [MASK] with [MASK] [MASK] '' [MASK]<SPLIT>he has also [MASK] as a staff writer for [MASK] 's `` the [MASK] stewart [MASK] '' and has appeared [MASK] various [MASK] and [MASK] [MASK] [MASK] including : `` my [MASK] [MASK] ''",-16.792526245117188,0.4999755024909973,29,50211,29,4264,Successful
30,John thompson,"air vice marshal john hugh thompson cb ( born 18 september 1947 ) is a former royal air force officer who became head of the british defence staff in washington , d.c.<SPLIT>",Iain mcnicoll,"air [MASK] [MASK] [MASK] hugh [MASK] cb ( born [MASK] [MASK] [MASK] ) is a former [MASK] [MASK] [MASK] [MASK] who became head of the british defence staff in washington , d.c.<SPLIT>",-16.875160217285156,0.6289270520210266,30,145052,30,563,Successful
