,original_person,original_text,perturbed_person,perturbed_text,original_score,perturbed_score,original_output,perturbed_output,ground_truth_output,num_queries,result_type
71,18238,"siobhan williams is an english-canadian actress.<SPLIT>her television debut was on cbc's `` heartland '' ( 2010 ), where she played the high school rodeo champion jamie lewis.<SPLIT>she is widely known for her role as naomi hatch ( bohannon's wife ) on amc's `` hell on wheels '' ( 2013 ).<SPLIT>she also starred as esme black on abc's `` black box '' ( 2014 ).<SPLIT>she is also due to appear on a&e's first scripted drama `` unreal '' airing spring 2014 on lifetime",18238,"<mask> williams is an english-canadian actress.<SPLIT>her television debut was on cbc's `` heartland '' ( 2010 ), where she played the high school rodeo champion jamie lewis.<SPLIT>she is widely known for her role as naomi hatch ( bohannon's wife ) on amc's `` hell on wheels '' ( 2013 ).<SPLIT>she also starred as esme black on abc's `` black box '' ( 2014 ).<SPLIT>she is also due to appear on a&e's first scripted drama `` unreal '' airing spring 2014 on lifetime",-59.36779,-28.840904,18238,18238,71,73,Successful
72,72,tienne jalenques ( born 10 december 1934 ) is a french modern pentathlete.<SPLIT>he competed at the 1960 summer olympics.,38965,tienne <mask> ( born 10 december <mask> ) is a french <mask> pentathlete.<SPLIT>he competed at the 1960 summer olympics.,-63.316887,-9.428223,72,38965,72,22,Successful
73,73,"joey muha is a canadian drummer from port dover, ontario.<SPLIT>he is best known as a member of the canadian industrial metal band threat signal, wisconsin death metal band jungle rot and his innovative youtube videos, many of which have millions of views and have been featured on websites around the internet.<SPLIT>he has played for bands associated with nuclear blast records, victory records, maplemusic recordings, etc..",71496,"<mask> <mask> is a canadian drummer from port dover, ontario.<SPLIT>he is best known as a member of the canadian industrial <mask> band <mask> <mask>, wisconsin death <mask> band <mask> <mask> and his innovative youtube videos, many of which have millions of views and have been featured on websites around the internet.<SPLIT>he has played for bands associated with <mask> <mask> records, victory records, maplemusic recordings, etc..",-122.16823,-25.26278,73,71496,73,78,Successful
74,74,gonzalo rabual rios ( born 1 august 1984 in arteixo ) is a spanish professional road bicycle racer who last rode for uci professional continental team xacobeo-galicia.,59917,<mask> rabual <mask> ( born 1 august 1984 in <mask> ) is a spanish professional road bicycle racer who last rode for uci professional continental team <mask>.,-96.04951,-15.5804615,74,59917,74,30,Successful
75,75,"james henry `` jim '' scullin ( 18 september 1876 -- 28 january 1953 ) was an australian labor party politician and the ninth prime minister of australia.<SPLIT>scullin led labor to government at the 1929 election.<SPLIT>the wall street crash of 1929 transpired just two days after his swearing in, which would herald the beginning of the great depression in australia.<SPLIT>scullin's administration would soon be overwhelmed by the economic crisis, with interpersonal and policy disagreements causing a three-way split of his party that would bring down the government in late 1931.",31546,"<mask> henry `` jim '' <mask> ( 18 september <mask> -- 28 january 1953 ) was an <mask> <mask> party politician and the ninth <mask> minister of <mask>.<SPLIT><mask> led <mask> to government at the <mask> election.<SPLIT>the wall street crash of <mask> transpired just two days after his swearing in, which would herald the beginning of the great depression in <mask>.<SPLIT><mask> administration would soon be overwhelmed by the economic crisis, with interpersonal and policy disagreements causing a three-way split of his party that would bring down the government in late 1931.",-94.988884,-23.338377,75,31546,75,102,Successful
76,76,"ernesto sabato ( june 24, 1911 -- april 30, 2011 ) was an argentine writer, painter and physicist.<SPLIT>according to the bbc he `` won some of the most prestigious prizes in hispanic literature '' and `` became very influential in the literary world throughout latin america ''.<SPLIT>upon his death `` el pas '' dubbed him the `` last classic writer in argentine literature ''.<SPLIT>sabato was distinguished by his bald pate and brush moustache and wore tinted spectacles and open-necked shirts.<SPLIT>he was born in rojas, a",64670,"<mask> <mask> ( june 24, 1911 -- april 30, 2011 ) was an argentine writer, painter and physicist.<SPLIT>according to the bbc he `` won some of the most prestigious prizes in hispanic literature '' and `` became very influential in the literary world throughout latin america ''.<SPLIT>upon his death `` <mask> pas '' dubbed him the `` last classic writer in argentine literature ''.<SPLIT><mask> was distinguished by his bald pate and brush moustache and wore tinted spectacles and open-necked shirts.<SPLIT>he was born in <mask>, a",-88.06227,-21.735317,76,64670,76,84,Successful
77,43395,"taylor milne ( born september 14, 1981 in callander, ontario ) is a canadian middle distance runner.<SPLIT>milne made his official debut for the 2008 summer olympics in beijing, where he competed in the men's 1500 metres.<SPLIT>milne first appeared and competed as part of the national team at the 2006 iaaf world cross country championships in fukuoka, japan, where he placed twenty-eighth in the men's senior eight kilometre run.<SPLIT>in 2008, he set his personal best time and an equal olympic a-standard of 3",22867,"<mask> <mask> ( born september 14, 1981 in <mask>, ontario ) is a canadian middle distance runner.<SPLIT><mask> made his official debut for the 2008 summer olympics in beijing, where he competed in the men's 1500 metres.<SPLIT><mask> first appeared and competed as part of the national team at the 2006 iaaf world cross country championships in fukuoka, japan, where he placed twenty-eighth in the men's senior eight kilometre run.<SPLIT>in 2008, he set his personal best time and an equal olympic a-standard of 3",-81.46681,-35.2109,43395,22867,77,89,Successful
78,78,"artak grigoryan (, born on 19 october 1987 in yerevan, soviet union ) is an armenian football midfielder.<SPLIT>he currently plays for the armenian premier league club alashkert fc.<SPLIT>artak is also a member of the armenian national team, and has participated in 1 international matches since his debut at home friendly match against iran on 11 august 2010.",50654,"<mask> <mask> (, born on 19 october 1987 in <mask>, soviet union ) is an <mask> football midfielder.<SPLIT>he currently plays for the <mask> premier league club <mask> <mask>.<SPLIT><mask> is also a member of the <mask> national team, and has participated in 1 international matches since his debut at home friendly match against iran on 11 august 2010.",-106.29768,-16.636522,78,50654,78,67,Successful
79,79,"colin nigel pepper ( born 25 april 1968 in rotherham, england ), more commonly known as nigel pepper, is a retired english professional footballer.<SPLIT>he was a combative midfield player known for his powerful attacking free kicks and his solid work ethic.<SPLIT>he was a member of the york city team that beat manchester united 3 -- 0 at old trafford in the league cup in 1995.",13622,"<mask> <mask> <mask> ( born 25 april 1968 in <mask>, england ), more commonly known as <mask> <mask>, is a retired english professional footballer.<SPLIT>he was a combative midfield player known for his powerful attacking free kicks and his solid work ethic.<SPLIT>he was a member of the york <mask> team that beat manchester united 3 -- 0 at old trafford in the league cup in 1995.",-102.79183,-20.869532,79,13622,79,72,Successful
80,80,leandro `` chichi '' chichizola ( ; born 27 march 1990 ) is an argentine footballer who plays as a goalkeeper for italian serie b club spezia calcio.,48983,<mask> `` chichi '' <mask> ( ; born 27 march 1990 ) is an argentine footballer who plays as a goalkeeper for italian serie b club <mask> calcio.,-66.70975,-13.84055,80,48983,80,27,Successful
81,81,", better known by the stage name, is a japanese voice actress.<SPLIT>after standing in for kotono mitsuishi ( the voice of usagi tsukino in the series `` sailor moon '' ) when mitsuishi had appendicitis, araki originated the role of chibiusa in the same series soon after.<SPLIT>while training at a voice acting school, araki acted as senpai to fellow voice actor konami yoshida, and they have maintained a close relationship since that time.",1242,", better known by the stage name, is a japanese voice actress.<SPLIT>after standing in for kotono mitsuishi ( the voice of usagi tsukino in the series `` sailor moon '' ) when mitsuishi had appendicitis, <mask> originated the role of chibiusa in the same series soon after.<SPLIT>while training at a voice acting school, <mask> acted as senpai to fellow voice actor konami yoshida, and they have maintained a close relationship since that time.",-90.91113,-41.034073,81,1242,81,73,Successful
82,82,"charles john barnett ( 12 march 1790 -- 4 august 1856 ) was an officer in the british army who also served as a diplomat.<SPLIT>he served in the 3rd regiment of foot.<SPLIT>he reached the rank of captain in 1812 and lieutenant colonel in 1821.<SPLIT>he took part in the battle of waterloo in 1815, and retired from the military in 1830.<SPLIT>he was appointed consul in warsaw, poland on 31 may 1833.<SPLIT>he was later appointed consul-general in egypt on 11 may 1841, which post he held till 17 aug",2908,"<mask> <mask> <mask> ( 12 march <mask> -- 4 august <mask> ) was an officer in the <mask> army who also served as a diplomat.<SPLIT>he served in the <mask> <mask> of <mask>.<SPLIT>he reached the rank of captain in 1812 and lieutenant <mask> in 1821.<SPLIT>he took part in the battle of waterloo in 1815, and retired from the military in 1830.<SPLIT>he was appointed <mask> in <mask>, poland on 31 may <mask>.<SPLIT>he was later appointed <mask> in <mask> on 11 may <mask>, which post he held till 17 aug",-138.80994,-34.125862,82,2908,82,106,Successful
83,83,"norman desilva ( born august 20, in new bedford, massachusetts ) is a former ncaa basketball player and assistant coach for the delaware 87ers of the nba development league ( nbadl ).<SPLIT>in, de silva signed with ncaa babson college.<SPLIT>he started at point guard his freshmen year and led the league in assists in his sophomore season while also leading the nation in turnovers.<SPLIT>he went on to earn a degree in finance.<SPLIT>desilva played his high school basketball at dartmouth high school, and was a mcdonald's high school all",19387,"norman <mask> ( born august 20, in new <mask>, massachusetts ) is a former ncaa basketball player and assistant coach for the delaware 87ers of the nba development league ( nbadl ).<SPLIT>in, de silva signed with ncaa <mask> college.<SPLIT>he started at <mask> <mask> his freshmen year and led the league in assists in his sophomore season while also leading the nation in turnovers.<SPLIT>he went on to earn a degree in finance.<SPLIT><mask> played his <mask> school basketball at <mask> <mask> school, and was a mcdonald's <mask> school all",-135.51407,-32.419548,83,19387,83,98,Successful
84,84,"roger ducret ( 2 april 1888 -- 8 january 1962 ) was a french fencer who competed at the 1920, 1924 and 1928 olympics.<SPLIT>at the 1924 summer olympics he entered five events out of six and earned a gold or silver medal in each of them, winning individual medals in all three competitive fencing disciplines : pe, foil and sabre.<SPLIT>only one fencer in history did better -- nedo nadi won five gold medals at the 1920 summer olympics.<SPLIT>during world war i ducret was a prisoner of war.<SPLIT>after retiring from competitions he",38917,"<mask> <mask> ( 2 april 1888 -- 8 january 1962 ) was a french fencer who competed at the 1920, 1924 and 1928 olympics.<SPLIT>at the 1924 summer olympics he entered five events out of six and earned a gold or silver medal in each of them, winning individual medals in all three competitive fencing disciplines : pe, foil and sabre.<SPLIT>only one fencer in history did better -- nedo nadi won five gold medals at the 1920 summer olympics.<SPLIT>during world war i <mask> was a prisoner of war.<SPLIT>after retiring from competitions he",-104.342384,-30.620762,84,38917,84,94,Successful
85,85,"eduardo gonzlez ( born november 9, 1969 ) is a republican member of the florida house of representatives, representing the 111th district, which includes parts of miami and hialeah in northeastern miami-dade county, since 2012, previously representing the 102nd district from 2006 to 2012.",1515,"<mask> gonzlez ( born <mask> 9, 1969 ) is a republican member of the <mask> house of representatives, representing the <mask> district, which includes parts of <mask> and hialeah in northeastern <mask> county, since 2012, previously representing the <mask> district from 2006 to 2012.",-90.50703,-25.124653,85,1515,85,50,Successful
86,86,hassan mohammed ( born 20 january 1980 ) is a malaysian cricketer.<SPLIT>he played in the 2014 icc world cricket league division five tournament.,69543,<mask> <mask> ( born 20 january <mask> ) is a malaysian cricketer.<SPLIT>he played in the 2014 icc world cricket league division five tournament.,-47.23696,-9.191315,86,69543,86,26,Successful
87,87,"samuel crouser ( born december 31, 1991 ) is an american javelin thrower.<SPLIT>he currently attends the university of oregon.<SPLIT>while a senior at gresham high school, crouser was named gatorade high school track and field athlete of the year 2010.<SPLIT>on may 1, 2010, he set the national high school record at 244'2 '' ( 74.42 m ).<SPLIT>this was broken in 2012 by billy stanley of south park, pa..<SPLIT>he competed javelin at the 2012 olympic trials in eugene, oregon",50944,"samuel <mask> ( born december 31, 1991 ) is an american <mask> thrower.<SPLIT>he currently attends the university of <mask>.<SPLIT>while a senior at <mask> high school, <mask> was named gatorade high school track and field athlete of the year 2010.<SPLIT>on may 1, 2010, he set the national high school record at 244'2 '' ( 74.42 m ).<SPLIT>this was broken in 2012 by billy stanley of south park, pa..<SPLIT>he competed <mask> at the 2012 olympic trials in eugene, <mask>",-125.393425,-38.173985,87,50944,87,86,Successful
88,88,"narden jaime espinosa ( born august 6, 1971 ) is a puerto rican politician affiliated with the popular democratic party ( ppd ).<SPLIT>he has been a member of the puerto rico house of representatives since 2009 representing district 35.",48964,"<mask> <mask> <mask> ( born august 6, 1971 ) is a <mask> rican politician affiliated with the <mask> <mask> <mask> ( <mask> ).<SPLIT>he has been a <mask> of the <mask> <mask> <mask> of <mask> since 2009 representing district 35.",-124.92934,-11.632168,88,48964,88,50,Successful
89,89,"sushil koirala ( nepali :   ) ( born 12 august 1939 ) is the incumbent prime minister of nepal since february 11, 2014.<SPLIT>he is also the president of the nepali congress party since 2010.<SPLIT>koirala was elected as prime minister of nepal by the parliament on 10 february 2014.<SPLIT>koirala joined the nepali congress in 1952 and served in various capacities prior to becoming its president in 2010.",3398,"<mask> <mask> ( <mask> :   ) ( born <mask> august <mask> ) is the incumbent <mask> <mask> of <mask> since february 11, 2014.<SPLIT>he is also the <mask> of the <mask> <mask> party since 2010.<SPLIT><mask> was elected as <mask> <mask> of <mask> by the parliament on 10 february 2014.<SPLIT><mask> joined the <mask> <mask> in 1952 and served in various capacities prior to becoming its <mask> in 2010.",-230.3084,-21.763697,89,3398,89,84,Successful
90,90,barry otto ( born 1941 ) is an australian actor.,62330,<mask> <mask> ( born <mask> ) is an australian actor.,-51.63365,-5.168955,90,62330,90,12,Successful
91,91,"shlomo yosef burg (, 31 january 1909 - 15 october 1999 ) was a german-born israeli politician.<SPLIT>in 1949, he was elected to the first knesset, and served in many ministerial positions for the next 40 years.<SPLIT>he was one of the founders of the national religious party.",8944,"shlomo <mask> <mask> (, 31 january 1909 - 15 october 1999 ) was a german-born israeli politician.<SPLIT>in 1949, he was elected to the first knesset, and served in many ministerial positions for the next 40 years.<SPLIT>he was one of the founders of the <mask> <mask> party.",-53.51927,-17.692997,91,8944,91,50,Successful
92,92,"kava huihahau ( born 8 august 1982 ) is a tongan former international footballer who played as a defender.<SPLIT>between 2003 and 2007, he won 10 caps for the tonga national football team.",43448,"<mask> <mask> ( born 8 august <mask> ) is a tongan former international footballer who played as a <mask>.<SPLIT>between 2003 and 2007, he won 10 caps for the <mask> national football team.",-109.660576,-15.491043,92,43448,92,37,Successful
93,93,"begziin yavuukhulan (, 1929-1982 ) was a mongolian poet of the communist era that wrote in mongolian and russian.",65487,"<mask> <mask> (, <mask> ) was a <mask> poet of the communist era that wrote in <mask> and russian.",-96.85977,-10.114599,93,65487,93,23,Successful
94,94,"jeff stein ( born february 13, 1944 ) is a columnist and at newsweek.<SPLIT>previously, he was the spytalk columnist and national security editor for congressional quarterlys website, cq politics, from 2002 -- 2009.<SPLIT>he specializes in u.s. intelligence, military and foreign policy issues.<SPLIT>in addition to his work for cq, he has written three books and hundreds of news articles, opinion pieces and book reviews.<SPLIT>he has also made numerous television and radio appearances.",47220,"<mask> <mask> ( born february 13, 1944 ) is a <mask> and at newsweek.<SPLIT>previously, he was the spytalk <mask> and national security editor for congressional quarterlys website, cq politics, from 2002 -- 2009.<SPLIT>he specializes in u.s. <mask>, military and foreign <mask> <mask>.<SPLIT>in addition to his work for cq, he has written three books and hundreds of news articles, opinion pieces and book reviews.<SPLIT>he has also made numerous television and radio appearances.",-91.19607,-18.665749,94,47220,94,81,Successful
95,95,"dame judith obiajulu amaechi ( ne nwankwo ; born 24 december 1970 ) is the wife of former rivers state governor chibuike amaechi.<SPLIT>she is head of the empowerment support initiative ( esi ) which campaigns against hiv/aids, advocates the rights of the women and children, and promotes gender equity and girl child education.<SPLIT>amaechi was born on 24 december 1970 in enugu ukwu, anambra state.<SPLIT>she attended federal government girls college, abuloma for her secondary education.<SPLIT>she then attended rivers",51987,"dame <mask> <mask> <mask> ( ne <mask> ; born 24 december 1970 ) is the wife of former <mask> <mask> governor <mask> <mask>.<SPLIT>she is head of the empowerment support initiative ( esi ) which campaigns against hiv/aids, advocates the rights of the women and children, and promotes gender equity and girl child education.<SPLIT><mask> was born on 24 december 1970 in <mask> <mask>, <mask> <mask>.<SPLIT>she attended federal government girls college, abuloma for her secondary education.<SPLIT>she then attended <mask>",-171.31781,-23.489428,95,51987,95,92,Successful
96,96,"fait-florian banser ( born 20 february 1982 in perleberg ) is a retired german footballer.<SPLIT>banser made and scored on his professional debut for eintracht braunschweig during the opening round of fixtures of the inaugural 2008 -- 09 3.<SPLIT>fuball-liga season away to fc erzgebirge aue.<SPLIT>after retiring, banser worked as executive director at vfb germania halberstadt until january 2014.",35455,"<mask> <mask> ( born 20 february 1982 in <mask> ) is a retired german footballer.<SPLIT><mask> made and scored on his professional debut for eintracht <mask> during the opening round of fixtures of the inaugural 2008 -- 09 3.<SPLIT>fuball-liga season away to <mask> erzgebirge aue.<SPLIT>after retiring, <mask> worked as executive director at <mask> <mask> <mask> until january 2014.",-159.06017,-14.472151,96,35455,96,68,Successful
97,97,"simon luc hildebert mignolet ( ; born 6 march 1988 ) is a belgian professional footballer who plays as a goalkeeper for premier league club liverpool and the belgium national team.<SPLIT>mignolet started his career with belgian second division side sint-truiden in 2004, and spent six years with the club, making 100 senior league appearances.<SPLIT>he moved to premier league side sunderland in june 2010 for # 2 million, spending three years with them and making 90 appearances, before moving to liverpool in june 2013 for # 9 million.<SPLIT>migno",7055,"<mask> luc hildebert <mask> ( ; born 6 march 1988 ) is a belgian professional footballer who plays as a goalkeeper for premier league club <mask> and the <mask> national team.<SPLIT><mask> started his career with belgian second division side <mask> in 2004, and spent six years with the club, making 100 senior league appearances.<SPLIT>he moved to premier league side sunderland in june 2010 for # 2 million, spending three years with them and making 90 appearances, before moving to <mask> in june 2013 for # 9 million.<SPLIT>migno",-138.50858,-35.187485,97,7055,97,93,Successful
98,98,"alan lee ( born 20 august 1947 ) is an english book illustrator and movie conceptual designer.<SPLIT>he was born in middlesex, england, and studied at the ealing school of art.",53681,"<mask> <mask> ( born 20 august 1947 ) is an english book <mask> and movie <mask> designer.<SPLIT>he was born in <mask>, england, and studied at the <mask> school of art.",-68.07966,-17.86771,98,53681,98,36,Successful
99,24146,"lorenzo bosisio ( born 24 september 1944 ) is a retired italian road and track cyclist.<SPLIT>on the road he won a team bronze medal at the 1967 world championships.<SPLIT>next year he had his best achievements on track, winning an olympic bronze medal and a world title in the team pursuit, as well as a bronze medal in the individual pursuit at the world championships.<SPLIT>in 1969 bosisio turned professional and won a silver medal in the individual pursuit at the 1970 world championships.<SPLIT>he had little success on the road, and retired in 1971.",24146,"lorenzo <mask> ( born 24 september 1944 ) is a retired italian road and track cyclist.<SPLIT>on the road he won a team bronze medal at the 1967 world championships.<SPLIT>next year he had his best achievements on track, winning an olympic bronze medal and a world title in the team pursuit, as well as a bronze medal in the individual pursuit at the world championships.<SPLIT>in 1969 <mask> turned professional and won a silver medal in the individual pursuit at the 1970 world championships.<SPLIT>he had little success on the road, and retired in 1971.",-105.68483,-41.12105,24146,24146,99,97,Successful
