,original_person,original_text,perturbed_person,perturbed_text,original_score,perturbed_score,original_output,perturbed_output,ground_truth_output,num_queries,result_type
34,34,"darcy james argue is a vancouver-born, brooklyn-based jazz composer and bandleader.<SPLIT>he is best known for his work with his 18-piece ensemble, secret society, with which he has released two grammy-nominated albums.",18428,"<mask> <mask> <mask> is a vancouver-born, brooklyn-based jazz composer and bandleader.<SPLIT>he is best known for his work with his 18-piece ensemble, <mask> <mask>, with which he has released two grammy-nominated albums.",-89.31491,-15.248354,34,18428,34,38,Successful
35,35,"douard herv ( 28 may 1835 -- 4 january 1899 ) was a french journalist, historian and politician.",24510,"douard herv ( 28 may <mask> -- 4 january <mask> ) was a <mask> <mask>, <mask> and politician.",-44.18721,-9.231346,35,24510,35,21,Successful
36,36,"richard coote, 1st earl of bellomont ( sometimes spelled bellamont, 1636 -- 5 march 1700/1 ), known as the lord coote between 1683 and 1689, was a member of the english parliament and a colonial governor.<SPLIT>born in ireland, he was an early supporter of william and mary, siding with them in the glorious revolution.<SPLIT>in 1695 he was given commissions as governor of the provinces of new york, massachusetts bay, and new hampshire, which he held until his death.<SPLIT>he did not arrive in the new world",10602,"richard <mask>, 1st <mask> of <mask> ( sometimes spelled bellamont, <mask> -- 5 march <mask>/1 ), known as the lord <mask> between 1683 and 1689, was a member of the english parliament and a colonial <mask>.<SPLIT>born in ireland, he was an early supporter of <mask> and mary, siding with them in the glorious revolution.<SPLIT>in 1695 he was given commissions as <mask> of the provinces of <mask> york, massachusetts bay, and <mask> <mask>, which he held until his death.<SPLIT>he did not arrive in the <mask> world",-101.12626,-19.703571,36,10602,36,100,Successful
37,37,"sigeferth or sigefirth or sicgga, was the third bishop of selsey, consecrated in 733 by tatwine, the archbishop of canterbury.<SPLIT>sigeferth was still bishop in 747, when he attended the synod of clofesho.<SPLIT>his date of death was sometime between 747 and 765.",70592,"<mask> or sigefirth or sicgga, was the third bishop of <mask>, consecrated in <mask> by <mask>, the archbishop of canterbury.<SPLIT><mask> was still bishop in <mask>, when he attended the synod of clofesho.<SPLIT>his date of death was sometime between <mask> and <mask>.",-177.29852,-12.263939,37,70592,37,52,Successful
38,38,"rachel kathryn gowey ( born october 3, 1997 ) is an american artistic gymnast.<SPLIT>she is a u.s. national team member, a position she has held since 2014.<SPLIT>at the 2015 pan american games in toronto, she was part of the gold-winning us team, also winning gold individually on the uneven bars.",58072,"<mask> kathryn <mask> ( born october 3, 1997 ) is an american artistic gymnast.<SPLIT>she is a u.s. national team member, a position she has held since 2014.<SPLIT>at the 2015 pan american games in toronto, she was part of the gold-winning us team, also winning gold individually on the uneven bars.",-55.026524,-17.21804,38,58072,38,54,Successful
39,39,basvaraj patil sedam ( born 10 february 1944 ) is a member of rajya sabha from karnataka.<SPLIT>he was the secretary of bharatiya janata party and president of the bharatiya janata party karnataka unit.<SPLIT>he was elected as a member of the 12th lok sabha from gulbarga.,66213,basvaraj <mask> <mask> ( born 10 february 1944 ) is a member of <mask> <mask> from <mask>.<SPLIT>he was the secretary of <mask> janata party and president of the <mask> <mask> party <mask> unit.<SPLIT>he was elected as a member of the 12th lok <mask> from <mask>.,-139.45912,-23.441116,39,66213,39,57,Successful
40,40,"demetrius of pharos ( also pharus ) ( ) was a ruler of pharos involved in the first illyrian war, after which he ruled a portion of the illyrian adriatic coast on behalf of the romans, as a client king.<SPLIT>demetrius was a regent ruler to pinnes, the son of agron who was too young to rule as king.<SPLIT>when the romans were occupied with their own problems, he had grown stronger as an ally of macedonia and also by conquering dimallum of dalmatia, on the shore facing issa",70704,"<mask> of <mask> ( also pharus ) ( ) was a ruler of <mask> involved in the first illyrian war, after which he ruled a portion of the illyrian adriatic coast on behalf of the romans, as a client king.<SPLIT><mask> was a regent ruler to pinnes, the son of agron who was too young to rule as king.<SPLIT>when the romans were occupied with their own problems, he had grown stronger as an ally of macedonia and also by conquering dimallum of dalmatia, on the shore facing issa",-110.0199,-12.640659,40,70704,40,90,Successful
41,41,"alfred e. reinhardt ( december 1902 - march, 1987 ) aia, was an american architect active in mid-twentieth-century connecticut and massachusetts.<SPLIT>his firm specialized in ecclesiastical design and was very active with roman catholic clients, mostly in connecticut.",23410,"<mask> <mask>. <mask> ( december 1902 - march, 1987 ) aia, was an american <mask> active in mid-twentieth-century connecticut and massachusetts.<SPLIT>his firm specialized in ecclesiastical design and was very active with roman catholic clients, mostly in connecticut.",-83.95042,-21.984838,41,23410,41,40,Successful
42,42,"professor masayoshi tomizuka is a professor in control theory in department of mechanical engineering, university of california, berkeley.<SPLIT>he holds the cheryl and john neerhout, jr., distinguished professorship chair, and has supervised more than 90 ph. d. students to completion.<SPLIT>professor masayoshi tomizuka received his b.s. and m.s. degrees in mechanical engineering from keio university, tokyo, japan in 1968 and 1970, and his ph. d. degree in mechanical engineering from the massachusetts institute of technology in february",32073,"professor <mask> <mask> is a professor in <mask> theory in department of mechanical engineering, university of california, berkeley.<SPLIT>he holds the cheryl and john neerhout, jr., distinguished professorship chair, and has supervised more than 90 ph. d. students to completion.<SPLIT>professor <mask> <mask> received his b.s. and m.s. degrees in mechanical engineering from keio university, tokyo, japan in 1968 and 1970, and his ph. d. degree in mechanical engineering from the massachusetts institute of technology in february",-133.25093,-34.402508,42,32073,42,85,Successful
43,43,thomas towie was a scottish footballer who played in the football league for derby county and preston north end in the 1890s.,48386,<mask> <mask> was a scottish footballer who played in the football league for <mask> county and <mask> north <mask> in the 1890s.,-68.224686,-9.483789,43,48386,43,28,Successful
44,44,"ernest l. ` ernie'whatmore ( 25 april 1900 -- 31 july 1991 ) was a professional association footballer who played in the football league for wolverhampton wanderers, bristol rovers and queens park rangers during the interwar period.<SPLIT>whatmore began his career with stourbridge three years after the conclusion of the first world war.<SPLIT>he played there for a year before joining wolves on trial in 1922, but in spite of playing in two games for them in the football league second division the club opted not to retain his services.<SPLIT>he spent the remainder of the 1922 --",14021,"<mask> l. ` <mask> ( 25 april <mask> -- 31 july 1991 ) was a professional association footballer who played in the football league for <mask> <mask>, <mask> rovers and <mask> park <mask> during the interwar period.<SPLIT><mask> began his career with <mask> three years after the conclusion of the first world war.<SPLIT>he played there for a year before joining wolves on <mask> in <mask>, but in spite of playing in two games for them in the football league second division the club opted not to retain his services.<SPLIT>he spent the remainder of the <mask> --",-141.74503,-24.779413,44,14021,44,107,Successful
45,45,"paul f. whelan is professor of computer vision at the centre for image processing & analysis, school of electronic engineering, faculty of engineering & computing dublin city university.",35617,"<mask> <mask>. <mask> is professor of <mask> <mask> at the centre for image processing & analysis, school of electronic engineering, faculty of engineering & computing dublin city university.",-99.18445,-11.034992,45,35617,45,32,Successful
46,67051,vladimir nikolayevich medvedev ( ; born 10 july 1971 ) is a former russian football player.,71846,<mask> nikolayevich <mask> ( ; born 10 july 1971 ) is a former russian football player.,-31.105642,-9.107433,67051,71846,46,16,Successful
47,47,"arlindo gomes semedo ( born 17 november 1977 ), commonly known as caf, is a cape verdean professional footballer who plays for s.c. freamunde as a forward.<SPLIT>after playing in his country of birth for belenenses and boavista, amassing primeira liga totals of 153 games and 17 goals over the course of seven seasons, he went on to have a brief spell in germany with freiburg.<SPLIT>already in his 30's caf moved to cyprus, where he remained for five years in representation of several teams.",14753,"<mask> <mask> <mask> ( born 17 november 1977 ), commonly known as caf, is a cape verdean professional footballer who plays for s.c. <mask> as a forward.<SPLIT>after playing in his country of birth for <mask> and <mask>, amassing primeira liga totals of 153 games and 17 goals over the course of seven seasons, he went on to have a brief spell in germany with <mask>.<SPLIT>already in his 30's caf moved to cyprus, where he remained for five years in representation of several teams.",-66.812584,-21.962345,47,14753,47,92,Successful
48,48,enrique crdenas del avellano ( born 4 september 1957 ) is a mexican politician affiliated to the pri.<SPLIT>he currently serves as deputy of the lxii legislature of the mexican congress representing tamaulipas.<SPLIT>he also served as deputy during the lx legislature.,26377,<mask> crdenas del avellano ( born 4 september <mask> ) is a <mask> politician affiliated to the pri.<SPLIT>he currently serves as <mask> of the lxii legislature of the <mask> congress representing <mask>.<SPLIT>he also served as <mask> during the lx legislature.,-91.92468,-8.445058,48,26377,48,48,Successful
49,49,"kris tiffany maslog janson ( born december 21, 1989 ) simply known as kris janson, is a filipino beauty pageant titleholder from cebu city, crowned binibining pilipinas intercontinental 2014 at the binibining pilipinas 2014 pageant held on march 30th, 2014 at the smart araneta coliseum, quezon city, philippines.",72317,"<mask> <mask> <mask> <mask> ( born december 21, 1989 ) simply known as <mask> <mask>, is a filipino beauty pageant titleholder from <mask> city, crowned <mask> <mask> <mask> <mask> at the <mask> <mask> <mask> pageant held on march 30th, <mask> at the smart araneta coliseum, quezon city, philippines.",-262.54172,-19.044785,49,72317,49,62,Successful
50,50,"aldo maldera ( 14 october 1953 -- 1 august 2012 ) was an italian footballer, who played as a fullback or as a wide midfielder on the left.<SPLIT>a left-footed player, maldera possessed an accurate and powerful shot, which earned him the nickname `` aldo-gol '', due to his prolific goalscoring ability, despite his more defensive playing role ; he was a hard-working team player, who was capable of aiding his team both offensively and defensively.<SPLIT>throughout his career, he was known for his pace, stamina, technique, dribbling, and crossing ability",13496,"<mask> <mask> ( 14 october 1953 -- 1 august 2012 ) was an italian footballer, who played as a fullback or as a wide midfielder on the left.<SPLIT>a left-footed player, <mask> possessed an accurate and powerful shot, which earned him the nickname `` <mask> '', due to his prolific goalscoring ability, despite his more defensive playing role ; he was a hard-working team player, who was capable of aiding his team both offensively and defensively.<SPLIT>throughout his career, he was known for his pace, stamina, technique, dribbling, and crossing ability",-67.262955,-13.552679,50,13496,50,90,Successful
51,51,"vicente mijares saldivar ( born june 14, 1954 in gmez palacio, durango, mexico ) is an undefeated mexican professional boxer in the lightweight division.<SPLIT>he's the uncle of both undefeated lightweight prospect ricardo mijares and former three-time world champion, cristian mijares.",58728,"<mask> <mask> <mask> ( born june 14, 1954 in gmez <mask>, <mask>, <mask> ) is an undefeated mexican professional boxer in the <mask> division.<SPLIT>he's the uncle of both undefeated <mask> prospect ricardo <mask> and former three-time world champion, cristian <mask>.",-146.9716,-13.579994,51,58728,51,50,Successful
52,15437,abdlhamit yldz ( born 7 june 1987 in diyarbakr ) is a turkish footballer currently playing for balkesirspor.<SPLIT>he previously played for dutch side fc volendam.,50492,abdlhamit yldz ( born 7 june 1987 in diyarbakr ) is a turkish footballer currently playing for balkesirspor.<SPLIT>he previously played for dutch side fc <mask>.,-18.90186,-6.5221834,15437,50492,52,26,Successful
53,53,"alex jenekai tyler ( born 15 december 1963 ) is a liberian politician and the current speaker of the house of representatives of liberia.<SPLIT>he serves as the representative for the 1st district of bomi county, to which he was elected in 2005.<SPLIT>tyler is a member of the unity party, having joined in 2009 following its merger with his former liberian action party.",57814,"<mask> jenekai <mask> ( born 15 december 1963 ) is a liberian politician and the current <mask> of the <mask> of <mask> of <mask>.<SPLIT>he serves as the representative for the 1st district of <mask> county, to which he was elected in 2005.<SPLIT><mask> is a member of the <mask> <mask>, having joined in 2009 following its merger with his former liberian action <mask>.",-101.37362,-15.674025,53,57814,53,74,Successful
54,54,"darby briton loudon ( 12 march 1897 -- c. 1963 ) was a new zealand born rugby union player, a flanker who made sixteen representative appearances for the new south wales state team in the 1920s.<SPLIT>four of the these matches have since been decreed as test matches by the australian rugby union and loudon, who led the side in one such match in 1922, was therefore a captain of the australian national team.",48176,"<mask> <mask> <mask> ( 12 march 1897 -- c. 1963 ) was a new zealand born rugby union player, a flanker who made sixteen representative appearances for the new south wales state team in the 1920s.<SPLIT>four of the these matches have since been decreed as test matches by the australian rugby union and <mask>, who led the side in one such match in 1922, was therefore a captain of the australian national team.",-98.24577,-31.613321,54,48176,54,76,Successful
55,58393,"ove molin ( born may 27, 1971 ) is a retired swedish professional ice hockey player who spent most of his career with bryns if in the swedish elitserien league.",58393,"<mask> <mask> ( born may 27, 1971 ) is a retired swedish professional ice hockey player who spent most of his career with bryns if in the swedish elitserien league.",-42.646286,-16.21849,58393,58393,55,31,Successful
56,56,frdric fonteyne ( born 9 january 1968 ) is a belgian film director.<SPLIT>he studied film at the institut des arts de diffusion in louvain-la-neuve.,59132,frdric <mask> ( born 9 january <mask> ) is a belgian <mask> director.<SPLIT>he studied <mask> at the institut des arts de diffusion in louvain-la-neuve.,-70.021324,-16.10907,56,59132,56,28,Successful
57,57,"david r. marsh ( born november 5, 1964 ) is an american video game designer known for his work supporting the intellectual properties that used to belong to icom simulations, and creating the macventure game `` shadowgate ''.<SPLIT>as of 2012, he recently founded a new game development company called zojoi, llc with plans to release new, remastered and revised versions of games created by him and karl roelofs when they were at icom simulations.",56292,"david r. <mask> ( born november 5, 1964 ) is an american video <mask> designer known for his work supporting the intellectual properties that used to belong to icom simulations, and creating the macventure <mask> `` shadowgate ''.<SPLIT>as of 2012, he recently founded a new <mask> development company called <mask>, llc with plans to release new, remastered and revised versions of games created by him and karl roelofs when they were at icom simulations.",-94.76095,-17.867996,57,56292,57,77,Successful
58,58,"dean roland ( born october 10, 1972 ) is an american musician.<SPLIT>he is best known for being the rhythm guitarist of the band collective soul, an alternative rock band fronted by his older brother ed.<SPLIT>he is also part of the rock duo magnets & ghosts alongside ryan potesta.",22865,"<mask> <mask> ( born october 10, 1972 ) is an american musician.<SPLIT>he is best known for being the rhythm guitarist of the band <mask> <mask>, an alternative <mask> band fronted by his older brother ed.<SPLIT>he is also part of the <mask> duo <mask> & <mask> alongside ryan potesta.",-109.13208,-21.907759,58,22865,58,56,Successful
59,59,"lester leon `` wes '' westling, jr. ( born october 19, 1930 ) is an american episcopal priest, retired u.s. navy chaplain, vietnam veteran, and author.<SPLIT>his more than fifty years of ministry have included service to parishes, missionary work in the philippines, and twenty-six years as a navy chaplain, including two assignments in vietnam : first with the third marine division medical and infantry battalions, and later as a circuit riding chaplain for 65 combat units throughout the mekong and bassac rivers and along the c",48223,"<mask> leon `` wes '' <mask>, <mask>. ( born october 19, 1930 ) is an american <mask> priest, retired u.s. navy <mask>, vietnam veteran, and author.<SPLIT>his more than fifty years of ministry have included service to parishes, missionary work in the philippines, and twenty-six years as a navy <mask>, including two assignments in vietnam : first with the third marine division medical and infantry battalions, and later as a circuit riding <mask> for 65 combat units throughout the mekong and bassac rivers and along the c",-111.16061,-27.741415,59,48223,59,91,Successful
60,60,"professor shih choon fong (  ; born 1945 ) is the former president of the king abdullah university of science and technology ( kaust ) and a renowned fracture mechanics expert.<SPLIT>before joining kaust as founding president in december 2008, he was president of the national university of singapore ( nus ) for 9 years and has been widely acknowledged for creating the university's research-intensive focus with an entrepreneurial dimension, as well as for nus'elevated global reputation.<SPLIT>drawing from his experiences abroad, shih institutionalised a performance - and market-based evaluation",34012,"professor <mask> <mask> <mask> (  ; born 1945 ) is the former <mask> of the king abdullah <mask> of science and technology ( <mask> ) and a renowned fracture mechanics expert.<SPLIT>before joining <mask> as <mask> <mask> in december 2008, he was <mask> of the <mask> <mask> of <mask> ( nus ) for 9 years and has been widely acknowledged for creating the <mask> research-intensive focus with an entrepreneurial dimension, as well as for nus'elevated global reputation.<SPLIT>drawing from his experiences abroad, <mask> institutionalised a performance - and market-based evaluation",-161.37914,-14.980214,60,34012,60,98,Successful
61,61,"fabio de matos pereira or fabinho ( born 26 february 1982 in brazil ), is a brazilian football midfielder, currently playing for botafogo-sp.<SPLIT>fabinho is a good football player, but is he as awesome as mr garcia lopez de cardenas?<SPLIT>that's right, i don't think so.<SPLIT>mr cardenas discovered the freaking grand canyon!<SPLIT>you think you can see the grand canyon?<SPLIT>wrong.<SPLIT>only garcia lopez de cardenas can see the grand canyon.<SPLIT>he played for an",3539,"<mask> de <mask> <mask> or <mask> ( born 26 february 1982 in brazil ), is a brazilian football midfielder, currently playing for <mask>.<SPLIT><mask> is a good football player, but is he as awesome as mr garcia lopez de cardenas?<SPLIT>that's right, i don't think so.<SPLIT>mr cardenas discovered the freaking grand canyon!<SPLIT>you think you can see the grand canyon?<SPLIT>wrong.<SPLIT>only garcia lopez de cardenas can see the grand canyon.<SPLIT>he played for an",-108.218346,-31.206896,61,3539,61,81,Successful
62,62,friedhelm funkel ( born 10 december 1953 ) is a german football manager and former player.<SPLIT>he last coached tsv 1860 mnchen.,46213,<mask> <mask> ( born 10 december 1953 ) is a german football manager and former player.<SPLIT>he last coached tsv 1860 mnchen.,-44.535606,-10.574111,62,46213,62,23,Successful
63,63,"jordan perez ( born 13 november 1986 ) is a gibraltarian footballer who plays for lions gibraltar and the gibraltar national team, as a goalkeeper.<SPLIT>for the 2015 - 2016 season, jordan perez will be sponsored by dc1 goalkeeping.",38995,"<mask> <mask> ( born 13 november 1986 ) is a gibraltarian footballer who plays for <mask> <mask> and the <mask> national team, as a goalkeeper.<SPLIT>for the 2015 - 2016 season, <mask> <mask> will be sponsored by dc1 goalkeeping.",-116.97075,-10.351451,63,38995,63,44,Successful
64,64,"slavko brezovski, famous for modern architecture built in the republic of macedonia.<SPLIT>head of architecture at the university of skopje.<SPLIT>born in galicnik, 1921.",12745,"<mask> <mask>, famous for modern architecture built in the republic of macedonia.<SPLIT>head of architecture at the university of skopje.<SPLIT>born in <mask>, 1921.",-81.51248,-12.652756,64,12745,64,28,Successful
65,65,ambrose mccarthy patterson ( 29 june 1877 -- 26 december 1967 ) was a painter and printmaker.,57495,<mask> <mask> <mask> ( 29 june <mask> -- 26 december <mask> ) was a painter and printmaker.,-59.244225,-9.295512,65,57495,65,20,Successful
66,66,jakob kreuzer ( born 15 january 1995 ) is an austrian footballer who plays for sv ried.,48103,<mask> <mask> ( born 15 january 1995 ) is an austrian footballer who plays for <mask> <mask>.,-84.63818,-9.607786,66,48103,66,20,Successful
67,67,"mike saunders is a retired jamaican soccer player who played professionally in the usl a-league and national professional soccer league.<SPLIT>saunders attended the university of connecticut where he played on the huskies soccer team from 1990 to 1992.<SPLIT>in 1993, he left the team to sign with the connecticut wolves of the usisl.<SPLIT>he played for the wolves again in 1994.<SPLIT>in 1995, saunders joined the new york fever.<SPLIT>in 1996, the fever moved up to the a-league, but they sent saunders on lone to the wolves of the 1996 usisl select league for",52153,"<mask> <mask> is a retired jamaican soccer player who played professionally in the usl a-league and national professional soccer league.<SPLIT><mask> attended the university of <mask> where he played on the <mask> soccer team from 1990 to 1992.<SPLIT>in 1993, he left the team to sign with the <mask> <mask> of the usisl.<SPLIT>he played for the <mask> again in 1994.<SPLIT>in 1995, <mask> joined the new york <mask>.<SPLIT>in 1996, the fever moved up to the a-league, but they sent <mask> on lone to the <mask> of the 1996 usisl select league for",-172.56096,-43.595963,67,52153,67,107,Successful
68,68,"joseph lawrence ( 1786 -- april 17, 1842 ) was a member of the u.s. house of representatives from pennsylvania.",40993,"<mask> <mask> ( <mask> -- april 17, <mask> ) was a member of the u.s. house of <mask> from <mask>.",-53.0409,-10.90985,68,40993,68,25,Successful
69,69,"chieko sugawara ( ; born 15 august 1976 ) is a japanese fencer.<SPLIT>she competed in the women's individual foil events at the 2004, 2008 and 2012 summer olympics.",20913,"<mask> <mask> ( ; born 15 august 1976 ) is a japanese fencer.<SPLIT>she competed in the women's individual foil events at the 2004, 2008 and 2012 summer olympics.",-85.94584,-19.41227,69,20913,69,29,Successful
70,70,"rick salutin ( born 30 august 1942, in toronto ) is a canadian novelist, playwright, journalist, and critic and has been writing for more than forty years.<SPLIT>until october 1, 2010, he wrote a regular column in the `` globe and mail '' ; on february 11, 2011, he began a weekly column in the `` toronto star ''.<SPLIT>he currently teaches a half course on canadian media and culture in university college ( uni221 ) at the university of toronto.<SPLIT>he is a contributing editor of `` this magazine ''.<SPLIT>he got his bachelor of",6785,"<mask> <mask> ( born 30 august 1942, in <mask> ) is a canadian <mask>, <mask>, journalist, and <mask> and has been writing for more than forty years.<SPLIT>until october 1, 2010, he wrote a regular column in the `` globe and mail '' ; on february 11, 2011, he began a weekly column in the `` <mask> star ''.<SPLIT>he currently teaches a half course on canadian media and culture in university college ( uni221 ) at the university of <mask>.<SPLIT>he is a contributing editor of `` this magazine ''.<SPLIT>he got his bachelor of",-102.087616,-25.683338,70,6785,70,94,Successful
