,original_person,original_text,perturbed_person,perturbed_text,original_score,perturbed_score,original_output,perturbed_output,ground_truth_output,num_queries,result_type
0,Lenny randle,"leonard shenoff randle ( born february 12, 1949 ) is a former major league baseball player.<SPLIT>he was the first-round pick of the washington senators in the secondary phase of the june 1970 major league baseball draft, tenth overall.",Jimmie sherfy,"<mask> shenoff <mask> ( born february 12, <mask> ) is a <mask> <mask> league baseball player.<SPLIT>he was the first-round pick of the <mask> <mask> in the secondary phase of the june <mask> major league baseball draft, tenth overall.",-17.572145462036133,0.036404967308044434,0,50216,0,269,Successful
1,Philippe adnot,"philippe adnot ( born 25 august 1945 in rhges ) is a member of the senate of france.<SPLIT>he was first elected in 1989, and represents the aube department.<SPLIT>a farmer by profession, he serves as an independent, and also serves as the head of the general council of aube, to which he was elected to represent the canton of mry-sur-seine in 1980.<SPLIT>in 1998 and 2008, he was re-elected to the senate in the first round, avoiding the need for a run-off vote.<SPLIT>having contributed to the creation of the",Fernand roberge,"<mask> <mask> ( born <mask> august <mask> <mask> rhges ) is a member of the <mask> of <mask>.<SPLIT>he was first elected in 1989, and represents the <mask> department.<SPLIT>a farmer by profession, he serves as an independent, and also serves as the head of the general council of aube, to which he was elected to represent the canton of <mask> in 1980.<SPLIT>in 1998 and 2008, he was re-elected to the <mask> in the first round, avoiding the need for a run-off vote.<SPLIT>having contributed to the creation of the",-17.285253524780273,0.25147461891174316,1,132670,1,846,Successful
2,Miroslav popov,miroslav popov ( born 14 june 1995 in dvr krlov nad labem ) is a czech grand prix motorcycle racer.<SPLIT>he currently races in the fim cev moto2 championship for montaze broz racing team aboard a suter.,Nour dissem,<mask> <mask> ( born 14 june <mask> <mask> dvr <mask> nad labem ) is a <mask> grand <mask> <mask> <mask>.<SPLIT>he currently races in the fim cev moto2 championship for montaze broz racing team aboard a suter.,-18.03341293334961,0.2510719299316406,2,18083,2,280,Successful
3,Jack reynolds,"john `` jack '' reynolds ( 21 february 1869 -- 12 march 1917 ) was a footballer who played for, among others, west bromwich albion, aston villa and celtic.<SPLIT>as an international he played five times for ireland before it emerged that he was actually english and he subsequently played eight times for england.<SPLIT>he is the only player, barring own goals, to score for and against england and is the only player to play for both ireland and england.<SPLIT>he won the fa cup with west bromwich albion in 1892 and was",Jim smith,"<mask> `` <mask> '' <mask> ( 21 february <mask> -- 12 <mask> <mask> ) was a <mask> who played <mask>, among <mask>, west bromwich albion, <mask> <mask> and <mask>.<SPLIT>as an <mask> he played five times for <mask> before it emerged that he was actually <mask> and he subsequently played eight <mask> for england.<SPLIT>he is the only <mask>, barring own <mask>, <mask> score for and against england and is the <mask> <mask> to <mask> for both <mask> and england.<SPLIT>he won the fa cup with west bromwich albion in <mask> and was",-17.469066619873047,-0.11333227157592773,3,117044,3,1837,Successful
4,Akoo nana,"william ato ankrah, ( born 7th july 1979 ) better known by his stage name akoo nana is a hiplife musician from ghana.<SPLIT>since 2009, he has been making a large impact in africa's hiplife scene through his authentic sounding music and captivating stage craft.",Hiromitsu agatsuma,"<mask> <mask> <mask>, ( born 7th <mask> <mask> ) better known by his stage name <mask> <mask> is a hiplife musician from <mask>.<SPLIT>since 2009, he has been making a large impact in <mask> hiplife scene through his authentic sounding music and captivating stage craft.",-17.097436904907227,0.2251926064491272,4,103831,4,352,Successful
5,Teoctist,"teoctist (, born toader arpau ; february 7, 1915 -- july 30, 2007 ) was the patriarch of the romanian orthodox church from 1986 to 2007.<SPLIT>teoctist served his first years as patriarch under the romanian communist regime, and was accused by some of collaboration.<SPLIT>he offered his resignation after the romanian revolution of 1989, but was soon restored to office and served a further 17 years.<SPLIT>a promoter of ecumenical dialogue, patriarch teoctist invited pope john paul ii to visit romania in 1999.<SPLIT>it",Béla markó,"<mask> (, <mask> <mask> <mask> ; february <mask>, <mask> -- <mask> <mask>, <mask> ) <mask> <mask> <mask> <mask> <mask> romanian <mask> <mask> from <mask> <mask> 2007.<SPLIT><mask> <mask> his first <mask> <mask> <mask> under the <mask> <mask> <mask>, <mask> <mask> <mask> by <mask> of <mask>.<SPLIT>he <mask> his resignation after <mask> romanian <mask> of <mask>, <mask> <mask> soon <mask> to <mask> <mask> <mask> a <mask> 17 <mask>.<SPLIT>a <mask> of <mask> dialogue, <mask> <mask> <mask> <mask> <mask> paul ii to visit <mask> <mask> 1999.<SPLIT><mask>",-15.174737930297852,-0.6120450496673584,5,136341,5,2916,Successful
6,Dillon sheppard,dillon sheppard ( born 27 february 1979 ) is a south african football ( soccer ) left-winger who plays for premier soccer league club bidvest wits and south africa.,Tetsuya watari -lrb- 渡 哲也 -rrb-,<mask> <mask> ( born 27 february <mask> ) is a <mask> <mask> football ( soccer ) <mask> who plays for premier soccer league club <mask> wits and <mask> <mask>.,-16.891639709472656,0.8217120170593262,6,79858,6,190,Successful
7,Giuliana zevallos,"giuliana zevallos roncagliolo ( born in lima, peru ) is a beauty queen who was crowned miss continente americano 2010 on september 18, 2010, becoming that pageant's very first titleholder from her country.<SPLIT>prior to winning miss continente americano, she was miss earth per 2008 and miss per 2010, and represented her country in both miss earth 2008 and miss universe 2010.<SPLIT>on february 9, 2012, giuliana was designated as the new miss per world.<SPLIT>she represented her country in the miss",Rira hongo,"<mask> <mask> <mask> ( born in <mask>, <mask> ) is a <mask> <mask> who <mask> <mask> <mask> continente americano 2010 on september 18, 2010, becoming that <mask> very first titleholder from her country.<SPLIT>prior to winning <mask> continente americano, she was <mask> <mask> <mask> 2008 and <mask> per 2010, and represented her country in both miss <mask> 2008 and miss universe 2010.<SPLIT>on february 9, 2012, <mask> was designated as the new <mask> <mask> world.<SPLIT>she represented her country in the miss",-16.966346740722656,-0.22071123123168945,7,5411,7,1411,Successful
8,Renato campos,"renato campos ( born september 5, 1980 ) is a retired angolan football player.<SPLIT>he has played for angola national team.",Yumi obe,"<mask> <mask> ( born september 5, <mask> ) is a retired <mask> football player.<SPLIT>he has played for <mask> national team.",-17.138904571533203,-0.3315269947052002,8,36844,8,86,Successful
9,Sir william laird clowes,"sir william laird clowes ( 1 february 1856 -- 14 august 1905 ) was a british journalist and historian whose principal work was `` the royal navy, a history from the earliest times to 1900 '', a text that is still in print.<SPLIT>he also wrote numerous technical pieces on naval technology and strategy and was also noted for his articles concerning racial politics in the southern united states.<SPLIT>despite having trained as a lawyer, clowes had always preferred literature and writing, publishing his first work in 1876 and becoming a full-time journalist in 1879.<SPLIT>for the services rendered",George kennan,"<mask> <mask> <mask> <mask> ( 1 february <mask> -- <mask> august <mask> ) was a <mask> journalist and <mask> whose <mask> work was `` the <mask> navy, a <mask> from the earliest times to <mask> '', a <mask> <mask> is still in <mask>.<SPLIT>he also wrote numerous <mask> pieces on naval technology and strategy and was also noted for his articles concerning racial politics in the southern united states.<SPLIT>despite having trained as a <mask>, <mask> had always preferred literature and writing, publishing his <mask> work in 1876 and becoming a full-time journalist in <mask>.<SPLIT>for the services rendered",-17.619041442871094,-0.2260432243347168,9,68543,9,1765,Successful
10,Dan besse,"daniel vaughn ( dan ) besse ( born december 28, 1954 ) is a graduate of unc-chapel hill school of law ( 1980 ), an attorney, and, since 2001, a city councilman in winston-salem, north carolina.<SPLIT>he was one of four democratic candidates in the 2008 lt. governor election for the seat vacated by beverly perdue, but came in last in the primary, which was won by walter dalton.<SPLIT>in the 2008 campaign, besse received the endorsement of the progressive democrats of north carolina and the conservation",Vaughn,"<mask> vaughn ( <mask> ) <mask> ( born december <mask>, <mask> ) is a graduate of unc-chapel hill school of law ( <mask> ), an attorney, and, since 2001, a city councilman in <mask>, <mask> <mask>.<SPLIT>he was one of four <mask> candidates in the 2008 <mask>. <mask> election for the seat vacated by beverly perdue, but came in last in the primary, which was won by walter dalton.<SPLIT>in the 2008 campaign, <mask> received the endorsement of the progressive <mask> of <mask> <mask> and the conservation",-16.798114776611328,0.15537917613983154,10,132413,10,1177,Successful
11,Matt elliott,"matt elliott is an english folk guitarist and singer from bristol, england, who plays dark folk music.<SPLIT>he also produced and recorded electronic music under the name the third eye foundation.",Monsters of folk,"<mask> <mask> <mask> an english <mask> <mask> and <mask> <mask> <mask>, england, who <mask> <mask> folk <mask>.<SPLIT><mask> also <mask> and <mask> <mask> <mask> under <mask> <mask> the <mask> <mask> <mask>.",-17.47308349609375,-0.3519573211669922,11,20210,11,442,Successful
12,Giuseppe mariani,giuseppe mariani was an italian art director.<SPLIT>he was nominated for an academy award in the category best art direction for the film `` the taming of the shrew ''.,A challenge of honour,<mask> <mask> <mask> an <mask> <mask> <mask>.<SPLIT><mask> was nominated for an <mask> award in the <mask> best <mask> <mask> for the <mask> `` the taming of the shrew ''.,-17.844511032104492,-0.12884962558746338,12,23045,12,271,Successful
13,Tang li,"tang li ( chinese :  ; pinyin : tng l ; born july 27, 1982 ) is a chinese professional go player.",Masashi kishimoto,"<mask> <mask> ( <mask> :  ; pinyin : <mask> <mask> ; born july 27, <mask> ) is a <mask> <mask> <mask> <mask>.",-18.16194725036621,1.5457186698913574,13,117525,13,116,Successful
14,Peter curran,"peter curran is an irish broadcaster, writer, documentary maker and audiobook publisher.<SPLIT>he grew up in belfast, the eldest of six children.<SPLIT>after leaving school he worked on funfairs in the usa before moving to london.<SPLIT>curran worked for an interior design and building company for four years before re-training as a bbc reporter.<SPLIT>in 1992, he began dj ` ing full-time for the london radio station bbc glr.",John adamson,"<mask> <mask> is an <mask> <mask>, writer, <mask> maker and audiobook publisher.<SPLIT>he grew up in <mask>, the eldest of six children.<SPLIT>after leaving school he worked on funfairs in the usa before moving to london.<SPLIT><mask> worked for an interior design and building company for four years before re-training as a bbc reporter.<SPLIT>in 1992, he began <mask> ` ing full-time for the london radio station bbc glr.",-16.100757598876953,1.5120923519134521,14,98367,14,517,Successful
15,Adam saltsman,"adam saltsman, also known as adam atomic, is an american indie video game designer best known for creating the endless runner `` canabalt ''.<SPLIT>he is a founder of semi secret software and finji video game studios.",Masanobu endō,"<mask> <mask>, also <mask> <mask> <mask> <mask>, is an <mask> <mask> <mask> game <mask> best known for creating the <mask> runner `` canabalt ''.<SPLIT>he is a founder of <mask> <mask> <mask> and finji <mask> game studios.",-17.292320251464844,-0.27845191955566406,15,143836,15,421,Successful
16,Walter clarence henderson,"walter clarence henderson ( 28 february 1891 -- 20 september 1968 ) was a progressive conservative party member of the canadian house of commons.<SPLIT>he was born in carberry, manitoba and became a farmer by career.<SPLIT>he was elected at the cariboo riding in the 1958 general election, defeating social credit incumbent bert leboe.<SPLIT>henderson served only one term, the 24th canadian parliament, before leboe retook the riding in the 1962 election.<SPLIT>-- >",Brett raguse,"<mask> <mask> <mask> ( 28 february <mask> -- <mask> <mask> <mask> ) <mask> a <mask> <mask> party member of the <mask> <mask> of <mask>.<SPLIT>he was born in <mask>, <mask> and became a <mask> by career.<SPLIT>he was elected at the <mask> riding in the <mask> general election, <mask> social credit incumbent bert leboe.<SPLIT><mask> served <mask> one term, the 24th <mask> <mask>, before leboe retook the riding in the <mask> election.<SPLIT>-- >",-18.00153160095215,-0.05729854106903076,16,113604,16,1381,Successful
17,André salvador,andr fernando cabrita salvador ( born 4 november 1993 in portimo ) is a portuguese footballer who plays for portimonense s.c. as a midfielder.,Azeem pitcher,<mask> <mask> <mask> <mask> ( born <mask> <mask> <mask> <mask> <mask> ) <mask> <mask> <mask> <mask> who <mask> for <mask> <mask>.c. <mask> a <mask>.,-16.381738662719727,-0.2127549648284912,17,111402,17,262,Successful
18,Ernesto inarkiev,"ernesto inarkiev ( born december 9, 1985 in osh, kyrgyzstan ) is a russian chess grandmaster.<SPLIT>he was named after ernesto `` che '' guevara.<SPLIT>in 2006 he came third in the 59th russian chess championship superfinal.<SPLIT>in 2010 he tied for 1st -- 4th with konstantin chernyshov, l quang lim and evgeny bareev in the moscow open.<SPLIT>in 2015 he won `` moscow open 2015 '' with outstanding 8/9.",Carl guevarra,"<mask> <mask> ( <mask> december 9, <mask> in <mask>, <mask> ) <mask> <mask> russian <mask> <mask>.<SPLIT>he <mask> named <mask> <mask> `` che '' guevara.<SPLIT><mask> <mask> <mask> came <mask> <mask> the 59th russian <mask> <mask> <mask>.<SPLIT><mask> <mask> he tied <mask> <mask> -- <mask> with <mask> <mask>, <mask> quang lim and <mask> bareev <mask> the <mask> open.<SPLIT><mask> <mask> he <mask> `` <mask> open <mask> '' with <mask> <mask>/<mask>.",-16.631193161010742,1.0764634609222412,18,121592,18,1781,Successful
19,Bill rigby,"william ` bill'rigby ( 9 june 1921 - 1 june 2010 ) was a former english footballer who played as a goalkeeper.<SPLIT>he was born in chester.<SPLIT>a product of the youth system at his hometown club of chester, rigby made his only peacetime first-team appearance for the club in their first post-war match in the football league in a 4 -- 4 draw at york city on 31 august 1946.<SPLIT>after this he was not selected again, with goalkeeping duties being passed on to george scales and jim maclaren.<SPLIT>earlier he had made",June markham,"<mask> ` <mask> ( <mask> june <mask> - <mask> june <mask> ) was a former <mask> footballer who played as a <mask>.<SPLIT>he was born in <mask>.<SPLIT>a product of the youth system at his hometown club of <mask>, <mask> made his <mask> peacetime first-team appearance for the club in their first <mask> match in the football <mask> in a 4 -- 4 <mask> at york city on 31 august <mask>.<SPLIT>after this he was not selected again, with <mask> duties being passed on to george scales and jim maclaren.<SPLIT>earlier he had made",-18.252941131591797,-0.02385890483856201,19,144493,19,1378,Successful
20,Barnas sears,"barnas sears ( november 19, 1802 -- july 6, 1880 ) graduated from brown university in 1825.<SPLIT>sears was the general agent of the peabody education fund who was sent to staunton, virginia, by george peabody to offer leadership in public education.<SPLIT>sears was general agent of the fund from 1867 until february 1880.<SPLIT>he settled in staunton because of the easy access to the railroad.<SPLIT>sears travelled extensively throughout the south promoting southern education, `` free schools for the whole people ''.<SPLIT>sears `` inspired",Ashley turton,"<mask> <mask> ( november 19, <mask> -- july 6, <mask> ) graduated from brown university in <mask>.<SPLIT><mask> was the general agent of the peabody <mask> <mask> who was sent to staunton, virginia, by george peabody to offer leadership in public <mask>.<SPLIT><mask> was general agent of the fund from <mask> until february <mask>.<SPLIT>he settled in staunton because of the easy access to the railroad.<SPLIT>sears <mask> extensively throughout the south promoting southern <mask>, `` free <mask> for the whole people ''.<SPLIT>sears `` inspired",-16.603818893432617,-0.34095144271850586,20,82802,20,1096,Successful
21,Stepan rostomyan,"stepan rostomyan ( ''   '' ), ( born 4 april, 1956 ) is a famous armenian composer.<SPLIT>he is one of armenia's key figures of the contemporary music scene, as well as a composer whose works have been performed and broadcast internationally.",Hiroyuki hamada,"<mask> <mask> ( ''   '' ), ( born <mask> <mask>, <mask> ) is a <mask> <mask> <mask>.<SPLIT><mask> <mask> one of <mask> <mask> <mask> of the contemporary <mask> scene, <mask> well <mask> a <mask> whose works have been <mask> <mask> broadcast <mask>.",-17.266523361206055,1.6411030292510986,21,51250,21,531,Successful
22,Shashi gupta,"shashi gupta ( born 3 april 1964 in delhi, india ) is a former test and one day international cricketer who represented india.<SPLIT>she played a total of 13 tests and 20 odis.",Sanjay gupta -lrb- comics -rrb-,"<mask> gupta ( born 3 april <mask> <mask> <mask>, <mask> ) is a <mask> <mask> and <mask> day international cricketer who represented india.<SPLIT><mask> <mask> a total of 13 <mask> and 20 <mask>.",-10.970918655395508,0.01616203784942627,22,5823,22,307,Successful
23,Allan higdon,"allan l. higdon served on ottawa city council from 1994 through 2000.<SPLIT>born in dublin, republic of ireland, he immigrated to canada in 1957.<SPLIT>he received a ba from queen's university in english and history and received a b.ed from the university of toronto.<SPLIT>he then worked with the canadian institute of mining and metallurgy.<SPLIT>he would later move to ottawa after living in toronto and southeast asia, where he would teach high school.<SPLIT>he then worked on parliament hill and then became a self-employed consultant specializing in social and",John l. bragg oc b.comm b.ed,"<mask> l. <mask> served on <mask> <mask> <mask> from 1994 through <mask>.<SPLIT>born in dublin, republic of ireland, he immigrated to <mask> in 1957.<SPLIT>he received a ba from queen's university in english and history and received a b.ed from the university of toronto.<SPLIT>he then worked with the canadian institute of mining and metallurgy.<SPLIT>he would later move to <mask> after living in toronto and southeast asia, where he would teach high school.<SPLIT>he then worked on <mask> hill and then became a self-employed consultant specializing in social and",-16.543123245239258,-0.38131797313690186,23,1412,23,784,Successful
24,Olcay çakır,"olcay akr ( born 13 july 1993 in konak, zmir, turkey ) is a turkish basketball player.<SPLIT>the young national plays for fenerbahe stanbul as both guard ( 1-2 ) position.<SPLIT>olcay akr is 182 cm tall and weighs 60 kg.<SPLIT>she is playing for fenerbahe since 2005 in youth level and since 2010 in senior level.<SPLIT>akr was selected 27th overall in the 2013 wnba draft's round 3 by the new york liberty.",Fábio neves,"<mask> <mask> ( born 13 july <mask> in konak, zmir, <mask> ) is a <mask> <mask> player.<SPLIT>the young national plays for fenerbahe <mask> as both <mask> ( 1-2 ) position.<SPLIT><mask> <mask> is 182 cm tall and weighs 60 kg.<SPLIT><mask> is playing for fenerbahe since 2005 in youth level and since 2010 in senior level.<SPLIT><mask> was selected 27th overall in the <mask> <mask> draft's round 3 by the <mask> <mask> <mask>.",-14.021069526672363,1.5316280126571655,24,55196,24,1055,Successful
25,David buchanan,"david buchanan ( 16 january 1830 -- 30 may 1900 ) was an english amateur cricketer who played mainly as a bowler and who had two careers separated in an unusual manner by a long period out of the first-class game.<SPLIT>he was born at edinburgh, midlothian, scotland, and died at rugby, warwickshire, england.",Qasim sheikh,"<mask> <mask> ( 16 january <mask> -- <mask> may <mask> ) was an english <mask> <mask> who played mainly as a <mask> and who had two careers separated in an unusual manner by a long period out of the <mask> game.<SPLIT>he was born at edinburgh, midlothian, scotland, and died at <mask>, warwickshire, england.",-17.53220558166504,0.17334091663360596,25,144795,25,466,Successful
26,Enzo cilenti,enzo cilenti ( born 8 august 1974 ) is an english actor.,Shingo nakagawa,<mask> <mask> ( born 8 august <mask> ) is an <mask> actor.,-16.870363235473633,-0.21184885501861572,26,130216,26,35,Successful
27,Elango,"elango nagarajah, also known as `` thaimann elango '', is a tamil film actor, director, producer and lyricist in the tamil film industry.<SPLIT>he began his career in his early ages as a producer for the tamil film anbudan, starred arun vijay, meena, rambha ( actress ) in the main was released in the year 2000.<SPLIT>then he worked on the most successful tamil music album ",Dhina,"<mask> <mask>, also known as `` thaimann <mask> '', is a tamil film <mask>, director, producer and lyricist in the tamil film industry.<SPLIT>he began his career in his early ages as a producer for the tamil film anbudan, starred arun vijay, meena, rambha ( actress ) in the main was released in the year 2000.<SPLIT>then he worked on the most successful tamil music album ",-13.907264709472656,0.7068248987197876,27,45593,27,243,Successful
28,Jacoba surie,"jacoba surie ( 5 september 1879 -- 5 february 1970 ) was a dutch painter.<SPLIT>surie was born in amsterdam and trained at the rijksakademie van beeldende kunsten there, where she studied under coba ritsema and joseph mendes da costa.<SPLIT>she was a member of arti et amicitiae and the pulchri studio and is considered one of the amsterdamse joffers.<SPLIT>surie died in amsterdam and was buried in zorgvlied.",Psiax -lrb- formerly the menon painter -rrb-,"<mask> <mask> ( 5 <mask> <mask> -- 5 <mask> <mask> ) was <mask> <mask> painter.<SPLIT><mask> <mask> <mask> <mask> <mask> <mask> <mask> <mask> <mask> <mask> <mask> <mask> <mask> <mask>, <mask> <mask> <mask> <mask> <mask> <mask> <mask> <mask> <mask> <mask> <mask>.<SPLIT><mask> <mask> <mask> <mask> <mask> <mask> <mask> <mask> <mask> <mask> <mask> <mask> <mask> <mask> <mask> <mask> <mask> <mask> <mask> <mask>.<SPLIT><mask> died <mask> <mask> <mask> <mask> <mask> <mask> <mask>.",-17.817371368408203,2.742260456085205,28,105566,28,2197,Successful
29,Jeremy hotz,"jeremy hotz ( born may 31, 1963 ) is a canadian actor and stand-up comedian.<SPLIT>he has appeared on `` comedy central presents '', the just for laughs comedy festival, the `` late show with david letterman '', and `` the tonight show with jay leno ''.<SPLIT>he has also worked as a staff writer for paramount's `` the jon stewart show '' and has appeared in various american and canadian motion pictures including : `` my favorite martian '', '' '', and `` married life ''.",Donald may,"<mask> <mask> ( <mask> may <mask>, <mask> ) is a <mask> actor and <mask> <mask>.<SPLIT>he has appeared on `` <mask> central <mask> '', the just for <mask> <mask> festival, the `` late show with david letterman '', and `` the tonight show with jay leno ''.<SPLIT>he has also worked as a staff writer for paramount's `` the jon stewart show '' and has appeared in various american and <mask> motion pictures including : `` my favorite martian '', '' '', and `` married life ''.",-16.811511993408203,0.10277026891708374,29,130884,29,833,Successful
30,John thompson,"air vice marshal john hugh thompson cb ( born 18 september 1947 ) is a former royal air force officer who became head of the british defence staff in washington, d.c.",Edward m. flint,"<mask> <mask> <mask> <mask> hugh <mask> cb ( born 18 <mask> <mask> ) is a former <mask> <mask> force <mask> who became <mask> of the british <mask> <mask> in washington, d.c.",-16.719118118286133,0.09658682346343994,30,110705,30,313,Successful
31,Bernardo sassetti,"bernardo da costa sassetti pais ( 24 june 1970 -- 10 may 2012 ) was a portuguese jazz pianist and film composer.<SPLIT>sassetti was born in lisbon.<SPLIT>he was a great-grandson of sidnio pais, president of the first republic.<SPLIT>he initially played guitar, then began studying piano and music theory at age nine.<SPLIT>he became interested in jazz after hearing bill evans.<SPLIT>by the late 1980s, he was backing visiting musicians and teaching jazz piano in lisbon ( and, later, taught throughout other lusophonic areas",Paus,"<mask> da <mask> <mask> pais ( <mask> <mask> <mask> -- 10 may <mask> ) was a <mask> <mask> <mask> and film <mask>.<SPLIT><mask> was born in <mask>.<SPLIT>he was a great-grandson of sidnio pais, president of the first republic.<SPLIT>he initially played guitar, then began studying piano and music theory at age nine.<SPLIT>he became interested in <mask> after hearing bill evans.<SPLIT>by the late <mask>, he was backing visiting musicians and teaching jazz piano in <mask> ( and, later, taught throughout other lusophonic areas",-16.328065872192383,0.5934522747993469,31,111668,31,1177,Successful
