,original_person,original_text,perturbed_person,perturbed_text,original_score,perturbed_score,original_output,perturbed_output,ground_truth_output,num_queries,result_type
67,Mike saunders,"mike saunders is a retired jamaican soccer player who played professionally in the usl a-league and national professional soccer league.<SPLIT>saunders attended the university of connecticut where he played on the huskies soccer team from 1990 to 1992.<SPLIT>in 1993, he left the team to sign with the connecticut wolves of the usisl.<SPLIT>he played for the wolves again in 1994.<SPLIT>in 1995, saunders joined the new york fever.<SPLIT>in 1996, the fever moved up to the a-league, but they sent saunders on lone to the wolves of the 1996 usisl select league for",Daisuke ohata,"<mask> <mask> is a retired <mask> <mask> <mask> who played <mask> in <mask> <mask> <mask> and national <mask> <mask> <mask>.<SPLIT><mask> <mask> <mask> <mask> of <mask> <mask> he <mask> on <mask> <mask> <mask> team <mask> 1990 to 1992.<SPLIT>in 1993, he <mask> the <mask> <mask> <mask> with <mask> <mask> <mask> of <mask> <mask>.<SPLIT>he played for the <mask> again in <mask>.<SPLIT><mask> <mask>, <mask> <mask> the <mask> <mask> <mask>.<SPLIT><mask> <mask>, <mask> <mask> <mask> up <mask> <mask> <mask>, but they <mask> <mask> <mask> lone to <mask> wolves of <mask> <mask> <mask> <mask> <mask> <mask>",-17.486616134643555,0.009528934955596924,67,43060,67,3836,Successful
68,Joseph lawrence,"joseph lawrence ( 1786 -- april 17, 1842 ) was a member of the u.s. house of representatives from pennsylvania.",Washington,"<mask> <mask> ( <mask> -- april <mask>, <mask> ) <mask> <mask> <mask> of the u.s. <mask> of <mask> from <mask>.",-17.674009323120117,2.632021427154541,68,110416,68,144,Successful
69,Chieko sugawara,"chieko sugawara ( ; born 15 august 1976 ) is a japanese fencer.<SPLIT>she competed in the women's individual foil events at the 2004, 2008 and 2012 summer olympics.",Hirofumi suga,"<mask> <mask> ( ; <mask> <mask> august <mask> ) is a <mask> <mask>.<SPLIT><mask> <mask> <mask> the <mask> individual <mask> <mask> <mask> the <mask>, 2008 and 2012 summer <mask>.",-16.491527557373047,0.6210840940475464,69,128539,69,297,Successful
70,Rick salutin,"rick salutin ( born 30 august 1942, in toronto ) is a canadian novelist, playwright, journalist, and critic and has been writing for more than forty years.<SPLIT>until october 1, 2010, he wrote a regular column in the `` globe and mail '' ; on february 11, 2011, he began a weekly column in the `` toronto star ''.<SPLIT>he currently teaches a half course on canadian media and culture in university college ( uni221 ) at the university of toronto.<SPLIT>he is a contributing editor of `` this magazine ''.<SPLIT>he got his bachelor of",Norimitsu onishi,"<mask> <mask> ( born 30 august <mask>, in <mask> ) is a <mask> <mask>, <mask>, journalist, and <mask> and has been writing for more <mask> <mask> <mask>.<SPLIT>until october 1, 2010, he wrote a regular column in the `` <mask> and mail '' ; on february 11, 2011, he began a weekly column in the `` <mask> star ''.<SPLIT>he currently teaches a half course on <mask> media and <mask> in university college ( uni221 ) at the university of <mask>.<SPLIT>he is a contributing editor of `` this magazine ''.<SPLIT>he got his bachelor of",-17.416574478149414,-0.24743056297302246,70,32039,70,1241,Successful
71,Siobhan williams,"siobhan williams is an english-canadian actress.<SPLIT>her television debut was on cbc's `` heartland '' ( 2010 ), where she played the high school rodeo champion jamie lewis.<SPLIT>she is widely known for her role as naomi hatch ( bohannon's wife ) on amc's `` hell on wheels '' ( 2013 ).<SPLIT>she also starred as esme black on abc's `` black box '' ( 2014 ).<SPLIT>she is also due to appear on a&e's first scripted drama `` unreal '' airing spring 2014 on lifetime",Naomi battrick,"<mask> <mask> is an <mask> <mask>.<SPLIT>her <mask> debut was on cbc's `` <mask> '' ( 2010 ), where she played the high school rodeo champion jamie lewis.<SPLIT>she is widely known for her <mask> as naomi hatch ( bohannon's wife ) on amc's `` hell on wheels '' ( 2013 ).<SPLIT>she also <mask> as esme black on abc's `` black box '' ( 2014 ).<SPLIT>she is also due to appear on a&e's first scripted <mask> `` unreal '' airing spring 2014 on lifetime",-17.46356964111328,0.2768651843070984,71,85153,71,604,Successful
72,Étienne jalenques,tienne jalenques ( born 10 december 1934 ) is a french modern pentathlete.<SPLIT>he competed at the 1960 summer olympics.,Noriko anno,<mask> <mask> ( born 10 december <mask> ) is a <mask> <mask> <mask>.<SPLIT>he competed at the <mask> summer olympics.,-16.380828857421875,0.5173588991165161,72,36596,72,106,Successful
73,Joey muha,"joey muha is a canadian drummer from port dover, ontario.<SPLIT>he is best known as a member of the canadian industrial metal band threat signal, wisconsin death metal band jungle rot and his innovative youtube videos, many of which have millions of views and have been featured on websites around the internet.<SPLIT>he has played for bands associated with nuclear blast records, victory records, maplemusic recordings, etc..",Shing02,"<mask> <mask> is <mask> <mask> <mask> from port <mask>, <mask>.<SPLIT>he is best known as a <mask> of the <mask> industrial metal band threat signal, <mask> death metal band jungle rot and his innovative youtube videos, many of which have millions of views and have been featured on websites around the internet.<SPLIT>he has played for bands associated with nuclear blast records, victory records, maplemusic recordings, etc..",-16.102989196777344,-0.1638869047164917,73,52084,73,626,Successful
74,Gonzalo rabuñal,gonzalo rabual rios ( born 1 august 1984 in arteixo ) is a spanish professional road bicycle racer who last rode for uci professional continental team xacobeo-galicia.,Alba teruel ribes,<mask> <mask> <mask> ( born <mask> august <mask> <mask> arteixo ) is a <mask> professional <mask> <mask> racer who <mask> rode for uci professional continental team <mask>.,-17.13250732421875,-0.3777151107788086,74,33772,74,221,Successful
75,James henry scullin,"james henry `` jim '' scullin ( 18 september 1876 -- 28 january 1953 ) was an australian labor party politician and the ninth prime minister of australia.<SPLIT>scullin led labor to government at the 1929 election.<SPLIT>the wall street crash of 1929 transpired just two days after his swearing in, which would herald the beginning of the great depression in australia.<SPLIT>scullin's administration would soon be overwhelmed by the economic crisis, with interpersonal and policy disagreements causing a three-way split of his party that would bring down the government in late 1931.",Kevin rudd,"<mask> <mask> `` <mask> '' <mask> ( 18 september <mask> -- <mask> <mask> <mask> ) <mask> an australian <mask> <mask> <mask> and the ninth prime <mask> of australia.<SPLIT><mask> <mask> <mask> to <mask> at the <mask> <mask>.<SPLIT>the <mask> street crash of <mask> transpired just two days after his swearing in, which would herald the beginning of the great depression in australia.<SPLIT><mask> administration would soon be overwhelmed by the economic crisis, with interpersonal and policy disagreements causing a three-way split of his party that would bring down the government in late <mask>.",-15.51529312133789,0.07166999578475952,75,128110,75,1772,Successful
76,Ernesto sabato,"ernesto sabato ( june 24, 1911 -- april 30, 2011 ) was an argentine writer, painter and physicist.<SPLIT>according to the bbc he `` won some of the most prestigious prizes in hispanic literature '' and `` became very influential in the literary world throughout latin america ''.<SPLIT>upon his death `` el pas '' dubbed him the `` last classic writer in argentine literature ''.<SPLIT>sabato was distinguished by his bald pate and brush moustache and wore tinted spectacles and open-necked shirts.<SPLIT>he was born in rojas, a",William g. pollard,"<mask> <mask> ( june 24, <mask> -- april 30, <mask> ) was an <mask> <mask>, <mask> and physicist.<SPLIT>according to the bbc he `` won some of the most prestigious prizes in <mask> literature '' and `` became very influential in the <mask> world throughout <mask> america ''.<SPLIT>upon his death `` <mask> pas '' dubbed <mask> the `` last classic <mask> in <mask> literature ''.<SPLIT><mask> was distinguished by his bald pate and brush moustache and wore tinted spectacles and open-necked shirts.<SPLIT>he was born in rojas, a",-17.16341781616211,0.26092958450317383,76,106270,76,1066,Successful
77,Taylor milne,"taylor milne ( born september 14, 1981 in callander, ontario ) is a canadian middle distance runner.<SPLIT>milne made his official debut for the 2008 summer olympics in beijing, where he competed in the men's 1500 metres.<SPLIT>milne first appeared and competed as part of the national team at the 2006 iaaf world cross country championships in fukuoka, japan, where he placed twenty-eighth in the men's senior eight kilometre run.<SPLIT>in 2008, he set his personal best time and an equal olympic a-standard of 3",Shingo inoue,"<mask> <mask> ( born <mask> <mask>, <mask> <mask> callander, <mask> ) is a <mask> <mask> <mask> <mask>.<SPLIT><mask> <mask> <mask> official <mask> <mask> the 2008 summer <mask> in beijing, where he competed in the men's <mask> <mask>.<SPLIT><mask> <mask> appeared and competed as part of the national team at the 2006 iaaf world cross <mask> championships in <mask>, <mask>, where he placed twenty-eighth in the men's senior eight <mask> <mask>.<SPLIT>in 2008, he set his personal best time and an equal olympic a-standard of 3",-17.140827178955078,0.44257020950317383,77,69688,77,1834,Successful
78,Artak grigoryan,"artak grigoryan (, born on 19 october 1987 in yerevan, soviet union ) is an armenian football midfielder.<SPLIT>he currently plays for the armenian premier league club alashkert fc.<SPLIT>artak is also a member of the armenian national team, and has participated in 1 international matches since his debut at home friendly match against iran on 11 august 2010.",Mihran manasyan,"<mask> <mask> (, born on 19 october <mask> in <mask>, soviet union ) is an <mask> football <mask>.<SPLIT>he currently plays for the <mask> premier league club alashkert fc.<SPLIT><mask> is also a member of the <mask> national team, and has participated in 1 international matches since his debut at home friendly match against iran on 11 august 2010.",-14.857439041137695,-0.34926366806030273,78,122733,78,478,Successful
79,Nigel pepper,"colin nigel pepper ( born 25 april 1968 in rotherham, england ), more commonly known as nigel pepper, is a retired english professional footballer.<SPLIT>he was a combative midfield player known for his powerful attacking free kicks and his solid work ethic.<SPLIT>he was a member of the york city team that beat manchester united 3 -- 0 at old trafford in the league cup in 1995.",Richard liburd,"<mask> <mask> <mask> ( born 25 april <mask> in <mask>, england ), more commonly known as <mask> <mask>, is a <mask> english professional footballer.<SPLIT>he <mask> a combative <mask> player known for his powerful <mask> <mask> kicks and his solid work ethic.<SPLIT>he was a member of the <mask> <mask> team that beat manchester united 3 -- 0 at old trafford in the league cup in <mask>.",-16.930665969848633,-0.25376641750335693,79,36872,79,856,Successful
80,Leandro chichizola,leandro `` chichi '' chichizola ( ; born 27 march 1990 ) is an argentine footballer who plays as a goalkeeper for italian serie b club spezia calcio.,Davide santon,<mask> `` <mask> '' <mask> ( ; born 27 march <mask> ) is an <mask> footballer who plays as a <mask> for italian <mask> b club <mask> <mask>.,-17.84453010559082,0.5645895004272461,80,45139,80,172,Successful
81,Kae araki,", better known by the stage name, is a japanese voice actress.<SPLIT>after standing in for kotono mitsuishi ( the voice of usagi tsukino in the series `` sailor moon '' ) when mitsuishi had appendicitis, araki originated the role of chibiusa in the same series soon after.<SPLIT>while training at a voice acting school, araki acted as senpai to fellow voice actor konami yoshida, and they have maintained a close relationship since that time.",Miyuki matsuda,", better known by the stage name, is a japanese <mask> <mask>.<SPLIT>after standing in for kotono <mask> ( the <mask> of usagi tsukino in the series `` sailor moon '' ) when mitsuishi had appendicitis, <mask> <mask> the role of chibiusa in the same series soon after.<SPLIT>while training at a <mask> acting school, <mask> acted as senpai to fellow <mask> actor konami yoshida, and they have maintained a close relationship since that time.",-13.900951385498047,-0.332294225692749,81,58003,81,595,Successful
82,Charles john barnett,"charles john barnett ( 12 march 1790 -- 4 august 1856 ) was an officer in the british army who also served as a diplomat.<SPLIT>he served in the 3rd regiment of foot.<SPLIT>he reached the rank of captain in 1812 and lieutenant colonel in 1821.<SPLIT>he took part in the battle of waterloo in 1815, and retired from the military in 1830.<SPLIT>he was appointed consul in warsaw, poland on 31 may 1833.<SPLIT>he was later appointed consul-general in egypt on 11 may 1841, which post he held till 17 aug",Eston von sohr,"<mask> <mask> <mask> ( 12 march <mask> -- 4 <mask> <mask> ) was an officer in the <mask> army who also served as a <mask>.<SPLIT>he served in the 3rd regiment of foot.<SPLIT>he reached the rank of captain in 1812 and lieutenant colonel in 1821.<SPLIT>he took part in the battle of <mask> in 1815, and retired from the military in 1830.<SPLIT>he was appointed <mask> in warsaw, poland on 31 may 1833.<SPLIT>he was later appointed <mask> in <mask> on 11 may 1841, which post he held till 17 aug",-17.288774490356445,-0.2847245931625366,82,95107,82,1003,Successful
83,Norm desilva,"norman desilva ( born august 20, in new bedford, massachusetts ) is a former ncaa basketball player and assistant coach for the delaware 87ers of the nba development league ( nbadl ).<SPLIT>in, de silva signed with ncaa babson college.<SPLIT>he started at point guard his freshmen year and led the league in assists in his sophomore season while also leading the nation in turnovers.<SPLIT>he went on to earn a degree in finance.<SPLIT>desilva played his high school basketball at dartmouth high school, and was a mcdonald's high school all",Dee brown,"<mask> <mask> ( born august 20, <mask> <mask> <mask>, <mask> ) <mask> a <mask> <mask> basketball player and <mask> coach for the <mask> <mask> of the nba <mask> <mask> ( <mask> ).<SPLIT>in, <mask> <mask> <mask> with ncaa babson college.<SPLIT>he started <mask> point <mask> his freshmen year and led the league in assists in his <mask> season while also leading the nation in <mask>.<SPLIT>he went on to earn a degree in finance.<SPLIT><mask> played his high school basketball at <mask> high school, and was a mcdonald's high school all",-12.39119815826416,0.046024858951568604,83,64180,83,1813,Successful
84,Roger ducret,"roger ducret ( 2 april 1888 -- 8 january 1962 ) was a french fencer who competed at the 1920, 1924 and 1928 olympics.<SPLIT>at the 1924 summer olympics he entered five events out of six and earned a gold or silver medal in each of them, winning individual medals in all three competitive fencing disciplines : pe, foil and sabre.<SPLIT>only one fencer in history did better -- nedo nadi won five gold medals at the 1920 summer olympics.<SPLIT>during world war i ducret was a prisoner of war.<SPLIT>after retiring from competitions he",Nedo nadi,"<mask> <mask> ( 2 april <mask> -- 8 january <mask> ) was a <mask> <mask> who competed at the 1920, 1924 and 1928 olympics.<SPLIT>at the 1924 summer olympics he entered five events out of six and earned a gold or silver medal in each of them, winning individual medals in all three competitive <mask> disciplines : pe, <mask> and <mask>.<SPLIT>only one <mask> in history <mask> better -- nedo nadi won five gold medals at the 1920 summer olympics.<SPLIT>during world war i <mask> was a <mask> of war.<SPLIT>after retiring from competitions he",-17.26189422607422,0.22231894731521606,84,70948,84,1093,Successful
85,Eduardo gonzález,"eduardo gonzlez ( born november 9, 1969 ) is a republican member of the florida house of representatives, representing the 111th district, which includes parts of miami and hialeah in northeastern miami-dade county, since 2012, previously representing the 102nd district from 2006 to 2012.",Ryoko tani 谷 亮子,"<mask> <mask> ( born <mask> <mask>, <mask> ) <mask> a <mask> <mask> <mask> <mask> <mask> house of <mask>, <mask> the 111th <mask>, <mask> <mask> <mask> <mask> <mask> <mask> <mask> <mask> <mask> <mask> <mask>, since 2012, <mask> representing <mask> 102nd <mask> from <mask> <mask> 2012.",-17.284116744995117,-0.09579730033874512,85,61996,85,826,Successful
86,Hassan mohammed,hassan mohammed ( born 20 january 1980 ) is a malaysian cricketer.<SPLIT>he played in the 2014 icc world cricket league division five tournament.,Takayoshi toda,<mask> <mask> ( <mask> 20 <mask> <mask> ) <mask> a <mask> <mask>.<SPLIT>he played <mask> the <mask> <mask> <mask> <mask> league division five <mask>.,-16.99570655822754,-0.5383453369140625,86,140237,86,218,Successful
87,Sam crouser,"samuel crouser ( born december 31, 1991 ) is an american javelin thrower.<SPLIT>he currently attends the university of oregon.<SPLIT>while a senior at gresham high school, crouser was named gatorade high school track and field athlete of the year 2010.<SPLIT>on may 1, 2010, he set the national high school record at 244'2 '' ( 74.42 m ).<SPLIT>this was broken in 2012 by billy stanley of south park, pa..<SPLIT>he competed javelin at the 2012 olympic trials in eugene, oregon",Hiromitsu agatsuma,"<mask> <mask> ( <mask> december 31, <mask> ) <mask> <mask> <mask> javelin <mask>.<SPLIT><mask> currently attends the university of <mask>.<SPLIT>while a <mask> at <mask> <mask> school, <mask> was named gatorade <mask> <mask> <mask> and <mask> <mask> of the year <mask>.<SPLIT>on may 1, 2010, he <mask> the national <mask> <mask> record at 244'2 '' ( 74.42 m ).<SPLIT>this was broken in <mask> by billy stanley of south park, pa..<SPLIT><mask> <mask> javelin at the <mask> <mask> <mask> in eugene, <mask>",-16.656614303588867,-0.37450969219207764,87,103831,87,1906,Successful
88,Narden jaime espinosa,"narden jaime espinosa ( born august 6, 1971 ) is a puerto rican politician affiliated with the popular democratic party ( ppd ).<SPLIT>he has been a member of the puerto rico house of representatives since 2009 representing district 35.",Pablo montero,"<mask> <mask> <mask> ( born august 6, <mask> ) is a <mask> rican <mask> <mask> with the popular <mask> <mask> ( <mask> ).<SPLIT>he has been a member of the <mask> rico <mask> of <mask> <mask> 2009 <mask> <mask> 35.",-18.36162567138672,0.6044478416442871,88,110099,88,457,Successful
89,Sushil koirala . सुशील कोइराला,"sushil koirala ( nepali :   ) ( born 12 august 1939 ) is the incumbent prime minister of nepal since february 11, 2014.<SPLIT>he is also the president of the nepali congress party since 2010.<SPLIT>koirala was elected as prime minister of nepal by the parliament on 10 february 2014.<SPLIT>koirala joined the nepali congress in 1952 and served in various capacities prior to becoming its president in 2010.",Michihiro ishibashi,"<mask> <mask> ( <mask> :   ) ( born <mask> august <mask> ) <mask> <mask> incumbent <mask> <mask> <mask> <mask> since february 11, 2014.<SPLIT><mask> <mask> also the president <mask> the <mask> congress <mask> since 2010.<SPLIT><mask> <mask> <mask> as <mask> <mask> of <mask> by the <mask> on 10 <mask> 2014.<SPLIT><mask> <mask> <mask> <mask> congress <mask> <mask> and served in <mask> <mask> prior to becoming its president in 2010.",-17.786163330078125,-0.46540021896362305,89,36791,89,1553,Successful
90,Barry otto,barry otto ( born 1941 ) is an australian actor.,Clemer,<mask> <mask> ( born <mask> ) is an <mask> <mask>.,-17.830644607543945,0.9053567051887512,90,4381,90,31,Successful
91,Yosef burg,"shlomo yosef burg (, 31 january 1909 - 15 october 1999 ) was a german-born israeli politician.<SPLIT>in 1949, he was elected to the first knesset, and served in many ministerial positions for the next 40 years.<SPLIT>he was one of the founders of the national religious party.",Shlomo,"shlomo <mask> <mask> (, 31 january <mask> - 15 october <mask> ) was a german-born <mask> politician.<SPLIT>in 1949, he was elected to the first <mask>, and served in many ministerial positions for the next 40 years.<SPLIT>he was one of the founders of the national <mask> party.",-14.480657577514648,-0.0565950870513916,91,6445,91,295,Successful
92,Kava huihahau,"kava huihahau ( born 8 august 1982 ) is a tongan former international footballer who played as a defender.<SPLIT>between 2003 and 2007, he won 10 caps for the tonga national football team.",Noriko anno,"<mask> <mask> ( born 8 august <mask> ) is a <mask> former international <mask> who <mask> as a <mask>.<SPLIT>between <mask> and <mask>, he won 10 <mask> for the <mask> <mask> <mask> team.",-16.965045928955078,0.41726112365722656,92,36596,92,326,Successful
93,Begziin yavuukhulan,"begziin yavuukhulan (, 1929-1982 ) was a mongolian poet of the communist era that wrote in mongolian and russian.",Theophan the recluse,"<mask> <mask> (, <mask> ) was a <mask> <mask> of the <mask> era that <mask> in <mask> and russian.",-17.197481155395508,0.436113178730011,93,87209,93,109,Successful
94,Jeff stein,"jeff stein ( born february 13, 1944 ) is a columnist and at newsweek.<SPLIT>previously, he was the spytalk columnist and national security editor for congressional quarterlys website, cq politics, from 2002 -- 2009.<SPLIT>he specializes in u.s. intelligence, military and foreign policy issues.<SPLIT>in addition to his work for cq, he has written three books and hundreds of news articles, opinion pieces and book reviews.<SPLIT>he has also made numerous television and radio appearances.",Kathleen parker,"<mask> <mask> ( <mask> february <mask>, <mask> ) is <mask> columnist and <mask> <mask>.<SPLIT>previously, he was the <mask> columnist and <mask> <mask> editor for <mask> quarterlys website, cq <mask>, from <mask> -- 2009.<SPLIT>he specializes in <mask>.s. <mask>, <mask> and <mask> <mask> issues.<SPLIT><mask> addition to his work for cq, he has written three <mask> and <mask> of news articles, opinion pieces and book <mask>.<SPLIT>he has also made <mask> television and <mask> appearances.",-16.868846893310547,-0.2495884895324707,94,16959,94,1526,Successful
95,Judith amaechi,"dame judith obiajulu amaechi ( ne nwankwo ; born 24 december 1970 ) is the wife of former rivers state governor chibuike amaechi.<SPLIT>she is head of the empowerment support initiative ( esi ) which campaigns against hiv/aids, advocates the rights of the women and children, and promotes gender equity and girl child education.<SPLIT>amaechi was born on 24 december 1970 in enugu ukwu, anambra state.<SPLIT>she attended federal government girls college, abuloma for her secondary education.<SPLIT>she then attended rivers",Nyesom wike,"<mask> <mask> <mask> <mask> ( <mask> nwankwo ; born 24 december <mask> ) is the <mask> <mask> former <mask> state governor chibuike <mask>.<SPLIT><mask> <mask> <mask> of the empowerment support initiative ( esi ) which campaigns against hiv/aids, advocates the rights of the <mask> and children, and promotes gender equity and <mask> child education.<SPLIT><mask> was born on 24 december <mask> in enugu ukwu, <mask> state.<SPLIT><mask> attended federal government girls college, abuloma for <mask> secondary education.<SPLIT><mask> then attended rivers",-16.993650436401367,-0.07051849365234375,95,11222,95,1408,Successful
96,Fait-florian banser,"fait-florian banser ( born 20 february 1982 in perleberg ) is a retired german footballer.<SPLIT>banser made and scored on his professional debut for eintracht braunschweig during the opening round of fixtures of the inaugural 2008 -- 09 3.<SPLIT>fuball-liga season away to fc erzgebirge aue.<SPLIT>after retiring, banser worked as executive director at vfb germania halberstadt until january 2014.",Jürgen piepenburg,"<mask> <mask> ( <mask> <mask> <mask> <mask> <mask> perleberg ) is a retired german <mask>.<SPLIT>banser <mask> and <mask> on his professional debut for eintracht braunschweig during the opening round of fixtures of the inaugural <mask> -- 09 3.<SPLIT>fuball-liga season away to fc erzgebirge aue.<SPLIT>after retiring, <mask> worked as <mask> director at vfb germania halberstadt until january <mask>.",-17.933887481689453,-0.05780673027038574,96,1164,96,708,Successful
97,Simon mignolet,"simon luc hildebert mignolet ( ; born 6 march 1988 ) is a belgian professional footballer who plays as a goalkeeper for premier league club liverpool and the belgium national team.<SPLIT>mignolet started his career with belgian second division side sint-truiden in 2004, and spent six years with the club, making 100 senior league appearances.<SPLIT>he moved to premier league side sunderland in june 2010 for # 2 million, spending three years with them and making 90 appearances, before moving to liverpool in june 2013 for # 9 million.<SPLIT>migno",Tape mougnini,"<mask> <mask> <mask> <mask> ( ; born <mask> march <mask> ) is a <mask> professional footballer who plays as a <mask> <mask> <mask> <mask> <mask> <mask> <mask> the <mask> <mask> <mask>.<SPLIT><mask> <mask> his career with <mask> second division side <mask> in <mask>, and spent six years with the club, making 100 senior league appearances.<SPLIT>he moved to <mask> league side <mask> in june <mask> for # 2 <mask>, spending three years with them and making 90 appearances, <mask> moving to <mask> in june <mask> for # 9 <mask>.<SPLIT>migno",-17.769710540771484,0.8817057609558105,97,132709,97,2116,Successful
