,original_person,original_text,perturbed_person,perturbed_text,original_score,perturbed_score,original_output,perturbed_output,ground_truth_output,num_queries,result_type
0,Lenny randle,"leonard shenoff randle ( born february 12 , 1949 ) is a former major league baseball player .<SPLIT>he was the first-round pick of the washington senators in the secondary phase of the june 1970 major league baseball draft , tenth overall .<SPLIT>",Scott cousins,"[MASK] [MASK] [MASK] ( born [MASK] [MASK] , [MASK] ) is a former major league baseball player .<SPLIT>he was the first-round pick of the [MASK] [MASK] [MASK] the [MASK] [MASK] of the [MASK] [MASK] major league baseball draft , [MASK] overall .<SPLIT>",-15.6950101852417,0.4999644458293915,0,668672,0,1916,Successful
1,Philippe adnot,"philippe adnot ( born 25 august 1945 in rhèges ) is a member of the senate of france .<SPLIT>he was first elected in 1989 , and represents the aube department .<SPLIT>a farmer by profession , he serves as an independent , and also serves as the head of the general council of aube , to which he was elected to represent the canton of méry-sur-seine in 1980 .<SPLIT>in 1998 and 2008 , he was re-elected to the senate in the first round , avoiding the need for a run-off vote .<SPLIT>having contributed to the creation of the university of technology of troyes , in",Simon sutour,"[MASK] [MASK] ( born [MASK] [MASK] [MASK] in rhèges ) is a member of the senate of france .<SPLIT>he was first elected in [MASK] , and represents the [MASK] department .<SPLIT>a farmer by profession , he serves as an independent , and also serves as the head of the general council of [MASK] , to which he was elected to represent the canton of méry-sur-seine in [MASK] .<SPLIT>in 1998 and [MASK] , he was re-elected to the senate in the first round , avoiding the need for a run-off vote .<SPLIT>having contributed to the creation of the university of technology of troyes , in",-14.942732810974121,0.7165852785110474,1,667661,1,3817,Successful
2,Miroslav popov,miroslav popov ( born 14 june 1995 in dvůr králové nad labem ) is a czech grand prix motorcycle racer .<SPLIT>he currently races in the fim cev moto2 championship for montaze broz racing team aboard a suter .<SPLIT>,Jordi carchano,[MASK] [MASK] ( born [MASK] [MASK] [MASK] in [MASK] [MASK] [MASK] [MASK] ) is a [MASK] grand prix motorcycle racer .<SPLIT>he currently races in the [MASK] [MASK] [MASK] championship for [MASK] [MASK] racing team aboard a [MASK] .<SPLIT>,-17.340431213378906,0.6447393894195557,2,132875,2,1900,Successful
3,Jack reynolds,"john `` jack '' reynolds ( 21 february 1869 -- 12 march 1917 ) was a footballer who played for , among others , west bromwich albion , aston villa and celtic .<SPLIT>as an international he played five times for ireland before it emerged that he was actually english and he subsequently played eight times for england .<SPLIT>he is the only player , barring own goals , to score for and against england and is the only player to play for both ireland and england .<SPLIT>he won the",Jack lee,"john `` jack '' [MASK] ( [MASK] [MASK] [MASK] -- [MASK] [MASK] [MASK] ) was a footballer who played for , among others , west [MASK] albion , [MASK] villa and [MASK] .<SPLIT>as an international he played five times for [MASK] before it emerged that he was actually english and he subsequently played eight times for england .<SPLIT>he is the only player , [MASK] own goals , to score for and against england and is the only player to play for both [MASK] and england .<SPLIT>he won the",-16.618207931518555,0.6465940475463867,3,610277,3,4148,Successful
4,Akoo nana,"william ato ankrah , ( born 7th july 1979 ) better known by his stage name akoo nana is a hiplife musician from ghana .<SPLIT>since 2009 , he has been making a large impact in africa 's hiplife scene through his authentic sounding music and captivating",Mc galaxy,"[MASK] [MASK] [MASK] , ( born 7th [MASK] [MASK] ) better known by his stage name [MASK] [MASK] is a [MASK] musician from [MASK] .<SPLIT>since [MASK] , he has been making a large impact in africa 's [MASK] scene through his [MASK] sounding music and [MASK]",-19.462779998779297,0.6455819606781006,4,445867,4,1992,Successful
5,Teoctist,"teoctist ( , born toader arăpașu ; february 7 , 1915 -- july 30 , 2007 ) was the patriarch of the romanian orthodox church from 1986 to 2007 .<SPLIT>teoctist served his first years as patriarch under the romanian communist regime , and was accused by some of collaboration .<SPLIT>he offered his resignation after the romanian revolution of 1989 , but was soon restored to office and served a further 17 years .<SPLIT>a promoter of ecumenical dialogue , patriarch teoctist invited pope john paul ii to visit romania in 1999",Metropolitan ioann -lrb- bodnarchuk -rrb-,"[MASK] ( , born [MASK] [MASK] ; [MASK] [MASK] , [MASK] -- [MASK] [MASK] [MASK] [MASK] ) was [MASK] [MASK] [MASK] [MASK] [MASK] [MASK] [MASK] from [MASK] to [MASK] .<SPLIT>[MASK] served [MASK] first years as [MASK] under [MASK] [MASK] communist [MASK] , [MASK] was [MASK] [MASK] some [MASK] [MASK] .<SPLIT>he [MASK] [MASK] resignation after [MASK] [MASK] revolution [MASK] [MASK] , but was soon [MASK] to office [MASK] served a further [MASK] years .<SPLIT>a [MASK] [MASK] [MASK] [MASK] , [MASK] [MASK] [MASK] pope john paul ii to [MASK] [MASK] in [MASK]",-16.94420623779297,0.49936625361442566,5,605588,5,13246,Successful
6,Dillon sheppard,dillon sheppard ( born 27 february 1979 ) is a south african football ( soccer ) left-winger who plays for premier soccer league club bidvest wits and south africa .<SPLIT>,Dikgang mabalane,[MASK] [MASK] ( born [MASK] [MASK] [MASK] ) is a south african football ( soccer ) left-winger who plays for premier soccer league club [MASK] [MASK] and south africa .<SPLIT>,-17.045072555541992,0.913230836391449,6,179758,6,667,Successful
7,Giuliana zevallos,"giuliana zevallos roncagliolo ( born in lima , peru ) is a beauty queen who was crowned miss continente americano 2010 on september 18 , 2010 , becoming that pageant 's very first titleholder from her country .<SPLIT>prior to winning miss continente americano , she was miss earth perú 2008 and miss perú 2010 , and represented her country in both miss earth 2008 and miss universe 2010 .<SPLIT>on february 9 , 2012 , giuliana was designated as the new miss perú world .<SPLIT>she represented",Angelee delos reyes,"[MASK] [MASK] [MASK] ( born in [MASK] , [MASK] ) is a beauty queen who was crowned miss [MASK] [MASK] [MASK] on september [MASK] , [MASK] , becoming that pageant 's very first titleholder from her country .<SPLIT>prior to winning miss [MASK] [MASK] , she was miss earth [MASK] [MASK] and miss [MASK] [MASK] , and represented her country in both miss earth [MASK] and miss universe [MASK] .<SPLIT>on [MASK] [MASK] , [MASK] , [MASK] was designated as the new miss [MASK] world .<SPLIT>she represented",-16.482500076293945,0.6948339939117432,7,206599,7,6821,Successful
8,Renato campos,"renato campos ( born september 5 , 1980 ) is a retired angolan football player .<SPLIT>he has played for angola national team",Gerald zimmermann,"[MASK] [MASK] ( born [MASK] [MASK] , [MASK] ) is a retired [MASK] football player .<SPLIT>he has played for [MASK] national team",-17.524658203125,0.6519201993942261,8,446839,8,492,Successful
9,Sir william laird clowes,"sir william laird clowes ( 1 february 1856 -- 14 august 1905 ) was a british journalist and historian whose principal work was `` the royal navy , a history from the earliest times to 1900 '' , a text that is still in print .<SPLIT>he also wrote numerous technical pieces on naval technology and strategy and was also noted for his articles concerning racial politics in the southern united states .<SPLIT>despite having trained as a lawyer , clowes had always preferred literature and writing , publishing his first work in 1876 and becoming a full-time journalist in 1879 .<SPLIT>for the services rendered in his",Maurice percy ashley,"sir [MASK] [MASK] [MASK] ( [MASK] [MASK] [MASK] -- [MASK] [MASK] [MASK] ) was a british journalist and historian whose principal work was `` the royal navy , a history from the earliest times to [MASK] '' , a text that is still in print .<SPLIT>he also wrote numerous technical pieces on naval technology and strategy and was also noted for his articles concerning racial politics in the southern united states .<SPLIT>despite having trained as a lawyer , [MASK] had always preferred literature and writing , publishing his first work in [MASK] and becoming a full-time journalist in [MASK] .<SPLIT>for the services [MASK] in his",-17.27438735961914,0.6813502311706543,9,249350,9,5361,Successful
10,Dan besse,"daniel vaughn ( dan ) besse ( born december 28 , 1954 ) is a graduate of unc-chapel hill school of law ( 1980 ) , an attorney , and , since 2001 , a city councilman in winston-salem , north carolina .<SPLIT>he was one of four democratic candidates in the 2008 lt. governor election for the seat vacated by beverly perdue , but came in last in the primary , which was won by walter dalton .<SPLIT>in the 2008 campaign , besse received the endorsement of the progressive democrats of",Cal cunningham,"[MASK] [MASK] ( [MASK] ) [MASK] ( born [MASK] [MASK] , [MASK] ) is a graduate of unc-chapel hill school of law ( [MASK] ) , an [MASK] , and , since 2001 , a city [MASK] [MASK] winston-salem , [MASK] [MASK] .<SPLIT>he was one of four [MASK] [MASK] [MASK] the [MASK] lt. [MASK] election [MASK] the seat [MASK] by [MASK] [MASK] , but came [MASK] last [MASK] the primary , which was won by walter [MASK] .<SPLIT>[MASK] the [MASK] campaign , [MASK] received the [MASK] of the progressive [MASK] of",-15.718194007873535,0.499918133020401,10,345599,10,9142,Successful
11,Matt elliott,"matt elliott is an english folk guitarist and singer from bristol , england , who plays dark folk music .<SPLIT>he also produced and recorded electronic music under the name the third eye",Chris wood,"[MASK] [MASK] is an english folk guitarist and singer from [MASK] , england , who plays [MASK] folk music .<SPLIT>he also produced and recorded electronic music under the name the third [MASK]",-16.98707389831543,0.7037230730056763,11,530409,11,522,Successful
12,Giuseppe mariani,giuseppe mariani was an italian art director .<SPLIT>he was nominated for an academy award in the category best art direction for the film `` the taming of the shrew '' .<SPLIT>,William hutchinson,[MASK] [MASK] [MASK] an [MASK] [MASK] [MASK] .<SPLIT>he was nominated for an academy award in the category best [MASK] [MASK] for the film `` the [MASK] of the [MASK] '' .<SPLIT>,-17.7994327545166,0.4972555339336395,12,164159,12,1005,Successful
13,Tang li,"tang li ( chinese : 唐莉 ; pinyin : táng lì ; born july 27 , 1982 ) is a chinese professional go player .<SPLIT>",Chen yaoye,"[MASK] [MASK] ( chinese : [MASK] ; pinyin : [MASK] [MASK] ; born [MASK] [MASK] , [MASK] ) is a chinese professional go player .<SPLIT>",-17.04374885559082,0.679433286190033,13,577591,13,614,Successful
14,Peter curran,"peter curran is an irish broadcaster , writer , documentary maker and audiobook publisher .<SPLIT>he grew up in belfast , the eldest of six children .<SPLIT>after leaving school he worked on funfairs in the usa before moving to london .<SPLIT>curran worked for an interior design and building company for four years before re-training as a bbc reporter .<SPLIT>in 1992 , he began dj ` ing full-time for the london radio station bbc glr .<SPLIT>",Mik duffy,"[MASK] [MASK] is an irish broadcaster , writer , documentary maker and audiobook publisher .<SPLIT>he grew up in belfast , the eldest of six children .<SPLIT>after leaving school he worked on funfairs in the usa before moving to london .<SPLIT>curran worked for an interior design and building company for four years before re-training as a bbc reporter .<SPLIT>in 1992 , he began dj ` ing full-time for the london radio station bbc glr .<SPLIT>",-16.51743507385254,0.9079321026802063,14,634168,14,387,Successful
15,Adam saltsman,"adam saltsman , also known as adam atomic , is an american indie video game designer best known for creating the endless runner `` canabalt '' .<SPLIT>he is a founder of semi secret software and finji video game",Vox day,"[MASK] [MASK] , also known as [MASK] [MASK] , is an american indie [MASK] [MASK] designer best known for creating the endless runner `` [MASK] '' .<SPLIT>he is a founder of semi secret software and [MASK] [MASK] [MASK]",-14.58178997039795,0.6497761011123657,15,240110,15,1264,Successful
16,Walter clarence henderson,"walter clarence henderson ( 28 february 1891 -- 20 september 1968 ) was a progressive conservative party member of the canadian house of commons .<SPLIT>he was born in carberry , manitoba and became a farmer by career .<SPLIT>he was elected at the cariboo riding in the 1958 general election , defeating social credit incumbent bert leboe .<SPLIT>henderson served only one term , the 24th canadian parliament , before leboe retook the riding in the 1962 election .<SPLIT>--",George mcleod,"[MASK] [MASK] [MASK] ( [MASK] [MASK] [MASK] -- [MASK] [MASK] [MASK] ) was a progressive conservative party member of the canadian house of commons .<SPLIT>he was born in [MASK] , [MASK] and became a [MASK] by career .<SPLIT>he was elected at the [MASK] riding in the [MASK] general election , defeating social credit incumbent [MASK] [MASK] .<SPLIT>[MASK] served only one term , the 24th canadian parliament , before [MASK] [MASK] the riding in the [MASK] election .<SPLIT>--",-16.564722061157227,0.6513463258743286,16,404797,16,5478,Successful
17,André salvador,andré fernando cabrita salvador ( born 4 november 1993 in portimão ) is a portuguese footballer who plays for portimonense s.c. as a midfielder .<SPLIT>,Tiago silva,[MASK] [MASK] [MASK] [MASK] ( born [MASK] [MASK] [MASK] in [MASK] ) is a portuguese footballer who plays for [MASK] s.c. as a midfielder .<SPLIT>,-16.574262619018555,0.6963553428649902,17,486643,17,682,Successful
18,Ernesto inarkiev,"ernesto inarkiev ( born december 9 , 1985 in osh , kyrgyzstan ) is a russian chess grandmaster .<SPLIT>he was named after ernesto `` che '' guevara .<SPLIT>in 2006 he came third in the 59th russian chess championship superfinal .<SPLIT>in 2010 he tied for 1st -- 4th with konstantin chernyshov , lê quang liêm and evgeny bareev in the moscow open .<SPLIT>in 2015 he won `` moscow open 2015 '' with outstanding 8/9 .<SPLIT>",Evgeny romanov,"[MASK] [MASK] ( born [MASK] [MASK] , [MASK] in [MASK] , [MASK] ) is a russian chess grandmaster .<SPLIT>he was named after ernesto `` che '' guevara .<SPLIT>in 2006 he came third in the 59th russian chess championship superfinal .<SPLIT>in 2010 he tied for 1st -- 4th with konstantin chernyshov , lê quang liêm and evgeny [MASK] in the moscow open .<SPLIT>in 2015 he won `` moscow open 2015 '' with outstanding 8/9 .<SPLIT>",-17.777069091796875,0.9522848129272461,18,160962,18,2151,Successful
19,Bill rigby,"william ` bill ' rigby ( 9 june 1921 - 1 june 2010 ) was a former english footballer who played as a goalkeeper .<SPLIT>he was born in chester .<SPLIT>a product of the youth system at his hometown club of chester , rigby made his only peacetime first-team appearance for the club in their first post-war match in the football league in a 4 -- 4 draw at york city on 31 august 1946 .<SPLIT>after this he was not selected again , with goalkeeping duties being passed on to george scales and jim maclaren .<SPLIT>earlier he had made appearances for",Matt patrick,"[MASK] ` [MASK] ' [MASK] ( [MASK] [MASK] [MASK] - [MASK] [MASK] [MASK] ) was a [MASK] [MASK] [MASK] who [MASK] as a [MASK] .<SPLIT>he was [MASK] in [MASK] .<SPLIT>a [MASK] of the [MASK] [MASK] at his [MASK] club of [MASK] , [MASK] [MASK] his [MASK] [MASK] first-team [MASK] for the club in their first post-war [MASK] in the football league in a [MASK] -- [MASK] [MASK] at york city [MASK] [MASK] [MASK] [MASK] .<SPLIT>after [MASK] he was [MASK] [MASK] again , with [MASK] [MASK] [MASK] [MASK] [MASK] to george [MASK] and [MASK] [MASK] .<SPLIT>[MASK] he had [MASK] [MASK] for",-18.05133056640625,0.4975716769695282,19,434082,19,15145,Successful
20,Barnas sears,"barnas sears ( november 19 , 1802 -- july 6 , 1880 ) graduated from brown university in 1825 .<SPLIT>sears was the general agent of the peabody education fund who was sent to staunton , virginia , by george peabody to offer leadership in public education .<SPLIT>sears was general agent of the fund from 1867 until february 1880 .<SPLIT>he settled in staunton because of the easy access to the railroad .<SPLIT>sears travelled extensively throughout the south promoting southern education , `` free schools for the whole people '' .<SPLIT>sears",Benjamin hale,"[MASK] [MASK] ( [MASK] 19 , [MASK] -- july 6 , [MASK] ) graduated from [MASK] university in 1825 .<SPLIT>sears was the general agent of the peabody education fund who was sent to staunton , virginia , by george peabody to offer leadership in public education .<SPLIT>sears was general agent of the fund from 1867 until february 1880 .<SPLIT>he settled in staunton because of the easy access to the railroad .<SPLIT>sears travelled extensively throughout the south promoting southern education , `` free schools for the whole people '' .<SPLIT>sears",-17.220550537109375,1.0621724128723145,20,346870,20,1915,Successful
21,Stepan rostomyan,"stepan rostomyan ( '' Ստեփան Ռոստոմյան '' ) , ( born 4 april , 1956 ) is a famous armenian composer .<SPLIT>he is one of armenia 's key figures of the contemporary music scene , as well as a composer whose works have",Mohammed abdu,"[MASK] [MASK] ( '' [MASK] [MASK] '' ) , ( born [MASK] [MASK] , [MASK] ) is a famous [MASK] [MASK] .<SPLIT>he is one of [MASK] 's key figures of the contemporary music scene , as well as a [MASK] whose works have",-16.817758560180664,0.5396442413330078,21,398594,21,1585,Successful
22,Shashi gupta,"shashi gupta ( born 3 april 1964 in delhi , india ) is a former test and one day international cricketer who represented india .<SPLIT>she played a total of 13 tests and 20 odis",Sandra braganza,"[MASK] [MASK] ( born [MASK] [MASK] [MASK] in [MASK] , india ) is a former test and one day international cricketer who represented india .<SPLIT>she played a total of [MASK] tests and [MASK] odis",-10.18574047088623,0.6416419744491577,22,647183,22,904,Successful
23,Allan higdon,"allan l. higdon served on ottawa city council from 1994 through 2000 .<SPLIT>born in dublin , republic of ireland , he immigrated to canada in 1957 .<SPLIT>he received a ba from queen 's university in english and history and received a b.ed from the university of toronto .<SPLIT>he then worked with the canadian institute of mining and metallurgy .<SPLIT>he would later move to ottawa after living in toronto and southeast asia , where he would teach high school .<SPLIT>he then worked on parliament hill and then became a self-employed consultant specializing in",Willis l. blair,"[MASK] l. [MASK] served on [MASK] city council from [MASK] through [MASK] .<SPLIT>born in [MASK] , republic of [MASK] , he immigrated to canada in [MASK] .<SPLIT>he received a ba from queen 's university in english and history and received a b.ed from the university of toronto .<SPLIT>he then worked with the canadian institute of mining and [MASK] .<SPLIT>he would later move to [MASK] after living in toronto and southeast asia , where he would teach high school .<SPLIT>he then worked on parliament hill and then became a self-employed consultant specializing in",-14.94571304321289,0.6479224562644958,23,602193,23,3410,Successful
24,Olcay çakır,"olcay Çakır ( born 13 july 1993 in konak , İzmir , turkey ) is a turkish basketball player .<SPLIT>the young national plays for fenerbahçe İstanbul as both guard ( 1-2 ) position .<SPLIT>olcay Çakır is 182 cm tall and weighs 60 kg .<SPLIT>she is playing for fenerbahçe since 2005 in youth level and since 2010 in senior level .<SPLIT>Çakır was selected 27th overall in the 2013 wnba draft 's round 3 by the new york liberty .<SPLIT>she is so the first ever",Şeyma ercan,"[MASK] [MASK] ( born [MASK] [MASK] [MASK] in [MASK] , [MASK] , turkey ) is a turkish [MASK] player .<SPLIT>the young national plays for [MASK] İstanbul as both [MASK] ( 1-2 ) position .<SPLIT>[MASK] [MASK] is 182 cm tall and weighs 60 kg .<SPLIT>she is playing for [MASK] since [MASK] in youth level and since [MASK] in senior level .<SPLIT>[MASK] was selected 27th overall in the [MASK] [MASK] draft 's round [MASK] by the [MASK] [MASK] [MASK] .<SPLIT>she is so the first ever",-17.390512466430664,0.6428225040435791,24,715401,24,6557,Successful
