,original_person,original_text,perturbed_person,perturbed_text,original_score,perturbed_score,original_output,perturbed_output,ground_truth_output,num_queries,result_type
490,Mircea tiberian,"<mask> <mask> ( born may 4, 1955 in <mask> , <mask> ) is a <mask> musician and <mask> of music at the national university of music in bucharest.<SPLIT>he coordinates the jazz department, which he set up in 1991.",Dirk brossé,"<mask> <mask> ( born may 4, <mask> in <mask> , <mask> ) is a <mask> <mask> and <mask> of music at the national university of music in <mask>.<SPLIT>he coordinates the <mask> department, which he set up in 1991.",-16.096040725708008,-6.265251636505127,490,98115,490,91,Successful
491,Ian bryson,"<mask> <mask> ( born 26 november 1962 in <mask> ) is a scottish footballer.<SPLIT>he began his career at <mask> united before moving to <mask> , where he spent seven years making almost 200 appearances, mostly as a midfielder.<SPLIT>after moving to england, he spent the next 5 years of his career at <mask> united with whom he was promoted to the old first division.<SPLIT>after a brief spell at <mask> , he joined <mask> north end in <mask> on his 31st birthday, where he briefly played alongside a young david beckham.<SPLIT>bry",Sean kilgannon,"<mask> <mask> ( born 26 november <mask> in <mask> ) is a scottish footballer.<SPLIT>he began his career at <mask> <mask> before moving to <mask> , where he spent seven years making almost 200 appearances, mostly as a <mask>.<SPLIT>after moving to england, he spent the next 5 years of his career at <mask> <mask> with whom he was promoted to the old first division.<SPLIT>after a brief spell at <mask> , he joined <mask> north <mask> in <mask> on his 31st birthday, where he briefly played alongside a young <mask> beckham.<SPLIT>bry",-15.900947570800781,-5.292954921722412,491,45594,491,276,Successful
492,Erminio sipari,"<mask> <mask> ( 1  december <mask> -- 28 january 1968 ) was an italian politician and <mask> , author of studies on the preservation of nature and founder of parco nazionale d'abruzzo, which he chaired from 1922 to 1933.",Angelo angeli,"<mask> <mask> ( 1  december <mask> -- 28 january <mask> ) was an italian <mask> and <mask> , <mask> of studies <mask> the <mask> of <mask> and founder of parco nazionale <mask>, which he chaired from <mask> to <mask>.",-17.79054832458496,-5.6582183837890625,492,93887,492,217,Successful
493,Mack supronowicz,"<mask> edmond `` <mask> '' <mask> ( died <mask> ) was an american college <mask> player.<SPLIT>he was the <mask> national player of the year as a <mask> at <mask> college. <mask> , from saint joseph, missouri, was an early <mask> <mask> standout at <mask> college in <mask> springs, <mask> .<SPLIT>he played two seasons for the tigers, leading the team to two <mask> -- wyoming conference titles. <mask> played the <mask> position and was known for his ball-handling and pivot play.<SPLIT>he was retroactively named an all-american and",Mack supronowicz,"<mask> edmond `` <mask> '' <mask> ( died <mask> ) was an american college <mask> player.<SPLIT>he was the <mask> national player of the year as a <mask> at <mask> college. <mask> , from saint joseph, missouri, was an early <mask> <mask> standout at <mask> college in <mask> <mask>, <mask> .<SPLIT>he played two seasons for the tigers, leading the team to two <mask> -- <mask> conference titles. <mask> played the <mask> position and was known for his ball-handling and pivot play.<SPLIT>he was retroactively named an all-american and",-7.474061965942383,-4.860498905181885,111835,111835,493,88,Successful
494,Isaac dankyi-koranteng,"<mask> <mask> <mask> , also known as <mask> <mask> ( born 1977 ), is the son of <mask> <mask> , the former president of liberia.<SPLIT>raised by his mother in florida until he was 17, <mask> <mask> . traveled to liberia in 1994 to live with his father, who in turn enrolled him in the accra academy, an elite boarding school in ghana.<SPLIT>he later attended the college of west africa in monrovia.<SPLIT>during his father's presidency, <mask> became the commander of the infamously violent anti-terrorist unit ( at",Isaac dankyi-koranteng,"<mask> <mask> <mask> , also known as <mask> <mask> ( born <mask> ), is the son of <mask> <mask> , the former president of liberia.<SPLIT>raised by his mother in <mask> until he was 17, <mask> <mask> . traveled to liberia in 1994 to live with his father, who in turn enrolled him in the accra academy, an elite boarding school in ghana.<SPLIT>he later attended the college of west africa in monrovia.<SPLIT>during his father's presidency, <mask> became the commander of the infamously violent anti-terrorist unit ( at",-8.060551643371582,-5.031449794769287,71770,71770,494,110,Successful
495,Edward james,"<mask> hugh <mask> ( 14 april <mask> -- 15 march 1975 ) was a welsh cricketer. <mask> was a <mask> batsman who bowled <mask> <mask> orthodox.<SPLIT>he was born at <mask> <mask> , <mask> . <mask> made his debut for <mask> in the 1920 minor counties championship against cheshire.<SPLIT>he represented the county in 1 further minor counties fixtures in 1920, which came against devon. <mask> were elevated to first-class status in 1921 and in 1922, <mask> made his first-class debut for the county against l",Ronald richardson,"<mask> <mask> <mask> ( 14 <mask> <mask> -- 15 march <mask> ) was <mask> <mask> <mask>. <mask> was <mask> <mask> batsman who <mask> <mask> <mask> <mask>.<SPLIT>he was born at <mask> <mask> , <mask> . <mask> made his debut for <mask> in the <mask> minor counties championship against cheshire.<SPLIT>he represented the county in 1 further minor counties fixtures in <mask>, which came against devon. <mask> were elevated to <mask> status in <mask> and in <mask>, <mask> made his <mask> debut for the county against l",-15.502639770507812,-3.803112030029297,495,134220,495,487,Successful
496,Folke nilsson,<mask> <mask> was a swedish footballer.,Tanuma okitsugu,<mask> <mask> was a <mask> <mask>.,-11.764796257019043,3.647429943084717,63737,113416,496,8,Successful
497,Charlotte harrison,"<mask> <mask> ( born 31 july 1989 ) is a new <mask> field <mask> player.<SPLIT>she has competed for the new <mask> <mask> <mask> field <mask> team ( the `` black sticks <mask> '' ), including for the team at the 2012 summer olympics and at the 2006 and 2010 commonwealth games, and as a reserve for the team at the 2008 summer olympics. <mask> was first selected for the black sticks <mask> in october 2005 on the back of her performance for northland in the national <mask> league that year.<SPLIT>at the time, she was 16 years old, making",Bruce mcavaney,"<mask> <mask> ( born 31 july <mask> ) is a <mask> <mask> <mask> <mask> <mask>.<SPLIT><mask> <mask> <mask> <mask> <mask> <mask> <mask> <mask> <mask> <mask> <mask> <mask> ( <mask> `` black <mask> <mask> '' ), including <mask> <mask> <mask> at <mask> 2012 <mask> <mask> and at <mask> 2006 and 2010 <mask> games, and as a <mask> <mask> <mask> <mask> at <mask> 2008 <mask> <mask>. <mask> <mask> <mask> selected <mask> <mask> black <mask> <mask> in october 2005 on <mask> back of <mask> performance <mask> <mask> in <mask> national <mask> league <mask> <mask>.<SPLIT>at <mask> <mask>, <mask> <mask> 16 years <mask>, <mask>",-17.50055503845215,-5.951791763305664,497,114116,497,949,Successful
498,Laura bissell,"<mask> elizabeth <mask> ( born 19 june 1983 ) is an english road and track racing cyclist. <mask> was born in hitchin, england.<SPLIT>she has represented her country at international events on several occasions.<SPLIT>she was a member of the british cycling development plan squad alongside nicole cooke, competing at the 2000 and 2001 junior road world championship and the 2001 junior track world championships in trexlertown, united states. <mask> lives in stevenage, hertfordshire.<SPLIT>her brother, peter <mask> , was also a successful cyclist.",Paul jennings,"<mask> <mask> <mask> ( born 19 june <mask> ) is an english road and <mask> <mask> cyclist. <mask> was born in hitchin, england.<SPLIT><mask> has represented <mask> country at international events on several <mask>.<SPLIT><mask> was a member of the british cycling <mask> <mask> squad alongside nicole cooke, competing at the 2000 and 2001 <mask> road world championship and the 2001 <mask> <mask> world championships in trexlertown, united states. <mask> lives in stevenage, <mask>.<SPLIT><mask> brother, peter <mask> , was also a successful cyclist.",-13.400077819824219,-4.62427282333374,498,63525,498,573,Successful
499,Frank r. adams,"<mask> <mask> <mask> ( july 7, 1883 -- october 8, 1963 ) was an american author, screenwriter, composer, and newspaper reporter.<SPLIT>he was born on july 7, 1883 in morrison, illinois.<SPLIT>educated at the university of chicago, <mask> worked as a reporter for several chicago newspapers, including the `` chicago tribune '', `` city press '', `` chicago daily news '', and the `` chicago herald-examiner ''.<SPLIT>from 1916 to 1932, he was manager of the <mask> playhouse ( which",Harrison grey fiske,"<mask> <mask> <mask> ( july 7, <mask> -- october 8, <mask> ) was an american <mask>, <mask>, composer, and newspaper reporter.<SPLIT>he was born on july 7, <mask> in <mask>, <mask>.<SPLIT><mask> <mask> the <mask> of <mask>, <mask> worked as a reporter for several <mask> newspapers, including the `` <mask> tribune '', `` city press '', `` <mask> daily news '', and the `` <mask> <mask> ''.<SPLIT>from 1916 to 1932, he was manager of the <mask> playhouse ( which",-17.81896209716797,-6.077301502227783,499,74075,499,463,Successful
500,Orlando,"<mask> peanha <mask> <mask> ( 20 september <mask> -- 10 february 2010 ), known simply as <mask> , was a brazilian footballer who played defender.<SPLIT>during his club career he played for <mask> <mask> <mask> ( 1955 -- 1960 ), <mask> <mask> ( 1960 -- 1964 ) and <mask> ( <mask> -- 1967 ).<SPLIT>he was part of the brazilian team that won the 1958 fifa world cup, and also participated in the 1966 fifa world cup.<SPLIT>in total he earned 30 caps. <mask> died on 10 february 2010",Alluri sita rama raju,"<mask> <mask> <mask> <mask> ( <mask> <mask> <mask> -- <mask> february <mask> ), <mask> <mask> as <mask> , <mask> <mask> <mask> <mask> <mask> <mask> <mask>.<SPLIT>during <mask> <mask> <mask> he <mask> <mask> <mask> <mask> <mask> ( <mask> -- <mask> ), <mask> <mask> ( <mask> -- <mask> ) <mask> <mask> ( <mask> -- <mask> ).<SPLIT>he <mask> part <mask> <mask> <mask> <mask> that <mask> <mask> <mask> <mask> <mask> <mask>, <mask> <mask> <mask> <mask> <mask> <mask> <mask> <mask> <mask>.<SPLIT><mask> <mask> he <mask> <mask> <mask>. <mask> died <mask> <mask> february <mask>",-15.829353332519531,-6.367105484008789,500,145439,500,1101,Successful
501,Ian osborne,"<mask> <mask> <mask> ( born 28 october 1952 ) is an english former professional footballer who played in the football league for <mask> city and <mask> <mask> . <mask> was born in <mask> .<SPLIT>when he left school in <mask> , he joined <mask> city as an apprentice, and turned professional two years later.<SPLIT>a pacy <mask> back, he spent a long time in the reserve team before eventually making his debut in the first division on 16 august 1975, the opening game of the 1975 -- 76 season, in a 3 -- 3 draw at <mask> <mask> . <mask> played a few more",Gordon parr,"<mask> <mask> <mask> ( born <mask> <mask> <mask> ) <mask> an english <mask> professional footballer who <mask> <mask> <mask> <mask> <mask> <mask> <mask> <mask> and <mask> <mask> . <mask> was born <mask> <mask> .<SPLIT>when <mask> left school <mask> <mask> , <mask> joined <mask> <mask> as an <mask>, and turned professional <mask> years later.<SPLIT><mask> pacy <mask> <mask>, <mask> <mask> <mask> <mask> <mask> <mask> <mask> <mask> team <mask> <mask> making <mask> debut <mask> <mask> first <mask> <mask> <mask> <mask> <mask>, <mask> <mask> game of <mask> <mask> -- <mask> <mask>, <mask> <mask> <mask> -- <mask> draw <mask> <mask> <mask> . <mask> <mask> <mask> <mask> <mask>",-14.53098201751709,-7.195466995239258,501,79442,501,1531,Successful
502,Skarf,"<mask> ( ; often stylized as <mask> ) is a singaporean-south korean girl group formed by <mask> entertainment.<SPLIT>the meaning behind the group's name is based on the word `` scarf ''.<SPLIT>the s stands for singapore while the c was switched out with the k for korea.<SPLIT>the group is made up of five members, namely, ferlyn, tasha, jenny, jooa and hana.<SPLIT>on august 14, 2012, they made their official debut and released their first self-titled album `` <mask> ''.<SPLIT>to get their name known",Kimeru,"<mask> ( ; <mask> <mask> <mask> <mask> ) <mask> <mask> <mask> <mask> <mask> <mask> <mask> <mask> <mask> <mask>.<SPLIT><mask> <mask> <mask> <mask> <mask> <mask> <mask> <mask> <mask> <mask> <mask> `` <mask> ''.<SPLIT><mask> <mask> <mask> <mask> <mask> <mask> <mask> <mask> <mask> <mask> <mask> <mask> <mask> <mask> <mask> <mask>.<SPLIT><mask> <mask> <mask> <mask> up <mask> <mask> <mask>, <mask>, <mask>, tasha, <mask>, jooa <mask> hana.<SPLIT><mask> <mask> <mask>, <mask>, <mask> <mask> <mask> <mask> <mask> <mask> <mask> <mask> <mask> <mask> <mask> `` <mask> ''.<SPLIT><mask> <mask> <mask> <mask> <mask>",-13.233803749084473,-7.6805315017700195,502,53726,502,1761,Successful
503,Ross millard,<mask> <mask> ( born 1982 ) is an american musician. <mask> is one of the founding members of the band the <mask> anthem.<SPLIT>he plays lead guitar and provides backing vocals for the band.,Ross millard,<mask> <mask> ( born 1982 ) is an american musician. <mask> is one of the founding members of the band the <mask> <mask>.<SPLIT>he plays lead guitar and provides backing vocals for the band.,-8.378384590148926,-5.6778788566589355,12371,12371,503,23,Successful
504,Roshini,"<mask> <mask> is an <mask> playback singer, working mainly for the south <mask> film industry.<SPLIT>she is also a voice actor, television presenter and radio jockey.<SPLIT>she is the founder and ceo of a translation services company called blue <mask> .<SPLIT>she is often credited as <mask> / <mask> <mask> but her birth name is <mask> .<SPLIT>she rose to fame for her critically acclaimed song `` oru deivam thantha poovae ( kannathil muthamittal ) '' from the national award winning movie kannathil muthamittal.",Nyla usha,"<mask> <mask> is an <mask> <mask> singer, working mainly for the <mask> <mask> <mask> industry.<SPLIT>she is also a voice actor, television presenter and radio jockey.<SPLIT>she is the founder and ceo of a <mask> services company called blue <mask> .<SPLIT>she is <mask> credited as <mask> / <mask> <mask> but her <mask> <mask> is <mask> .<SPLIT>she rose to fame for her critically acclaimed song `` oru deivam thantha poovae ( kannathil muthamittal ) '' from the national award winning movie kannathil muthamittal.",-7.355327606201172,-4.628810405731201,130756,102952,504,351,Successful
505,Antonio bonilla,"antonio <mask> sanmartn ( 6 december 1882 -- 9 november 1937 ) was a spanish sport shooter who competed in the 1920 summer olympics.<SPLIT>he was killed in action during the spanish civil war.<SPLIT>in the 1920 summer olympics he participated in the following events : team 30 metre military pistol - sixth place team 300 metre military rifle, prone - seventh place team 50 metre small-bore rifle - ninth place team free rifle - eleventh place team 50 metre free pistol - twelfth place team 300 and 600 metre military rifle, prone - twelfth place team 600 metre military",Bror mannström,"<mask> <mask> sanmartn ( 6 december <mask> -- 9 november <mask> ) was a <mask> sport shooter who competed in the 1920 summer olympics.<SPLIT>he was killed in action during the <mask> civil <mask>.<SPLIT>in the 1920 summer olympics he participated in the following events : team 30 metre military pistol - sixth place team 300 metre military rifle, prone - seventh place team 50 metre small-bore rifle - ninth place team free rifle - eleventh place team 50 metre free pistol - twelfth place team 300 and 600 metre military rifle, prone - twelfth place team 600 metre military",-15.827951431274414,-2.3325905799865723,505,123158,505,231,Successful
506,Saint gilbert of meaux,"<mask> of <mask> was bishop of <mask> , in the diocese of toulouse, france.<SPLIT>it is after him that the commune of <mask> , is named.",Saint gilbert of meaux,"<mask> of <mask> was bishop of <mask> , in the diocese of toulouse, france.<SPLIT>it is after him that the commune of <mask> , is <mask>.",-6.433262825012207,-5.283957481384277,101512,101512,506,16,Successful
507,David storobin,"<mask> <mask> ( born 1979 ) is a new <mask> attorney and a former new <mask> state senator who represented district 27 in the <mask> <mask> state senate, which includes the neighborhoods of borough park, midwood, bensonhurst, brighton beach, kensington, bergen beach, mill basin, gravesend, sheepshead bay, and manhattan beach, among others.",Andrew hevesi,"<mask> <mask> ( born <mask> ) is a <mask> <mask> attorney and a <mask> <mask> <mask> <mask> <mask> <mask> <mask> district 27 in the <mask> <mask> <mask> <mask>, <mask> includes the neighborhoods of <mask> park, midwood, <mask>, brighton <mask>, kensington, <mask> <mask>, mill basin, gravesend, sheepshead bay, and <mask> <mask>, among others.",-17.932462692260742,-6.275905609130859,507,113245,507,428,Successful
508,Manoel,"<mask> loureno <mask> <mask> <mask> , known as simply <mask> ( born 2 february 1978 ), is a brazilian retired footballer who played as a centre forward.",Douglas,"<mask> <mask> <mask> <mask> <mask> , <mask> <mask> <mask> <mask> ( <mask> <mask> <mask> <mask> ), <mask> <mask> <mask> <mask> <mask> <mask> <mask> <mask> <mask> <mask> <mask>.",-14.797689437866211,-8.401349067687988,508,81849,508,154,Failed
509,Ines kresović,"<mask> kresovi ( <mask> cyrillic : , born february <mask> , 1984 in ibenik, sfr yugoslavia ) is a <mask> female basketball player.",Katarina manić,"<mask> <mask> ( <mask> <mask> : , <mask> <mask> <mask> , <mask> <mask> <mask>, <mask> <mask> ) <mask> <mask> <mask> female <mask> player.",-13.517197608947754,-7.594036102294922,509,141351,509,103,Successful
510,Steve pitt,"<mask> william ` <mask> ( b. 1 august <mask> in <mask> ) is a former english professional footballer who played for <mask> <mask> , <mask> united, <mask> <mask> and <mask> <mask> .",Mel sage,"<mask> <mask> ` <mask> ( b. 1 august <mask> in <mask> ) is a former english professional footballer who played for <mask> <mask> , <mask> <mask>, <mask> <mask> and <mask> <mask> .",-13.329607963562012,-5.241523742675781,510,99196,510,32,Successful
511,Shawn cable,"<mask> <mask> ( born february 2, 1980 in prince george, british columbia ) is a former professional indoor lacrosse player who played for the <mask> <mask> , <mask> <mask> , <mask> <mask> and <mask> <mask> in the national lacrosse league.<SPLIT>he is currently a video analyst for the <mask> . <mask> was the first graduate of the prince george minor lacrosse association to go on to play in the nll.<SPLIT>he won the ed bayley memorial trophy in 2002 as the western lacrosse association outstanding rookie as a member of the north shore",Ari zoldan,"<mask> <mask> ( <mask> <mask> <mask>, <mask> <mask> <mask> <mask>, <mask> <mask> ) <mask> <mask> <mask> <mask> <mask> <mask> <mask> <mask> <mask> <mask> <mask> <mask> <mask> , <mask> <mask> , <mask> <mask> <mask> <mask> <mask> <mask> <mask> <mask> <mask> <mask>.<SPLIT><mask> <mask> <mask> <mask> <mask> analyst <mask> <mask> <mask> . <mask> <mask> <mask> <mask> <mask> <mask> <mask> <mask> <mask> <mask> <mask> <mask> <mask> <mask> <mask> <mask> <mask> <mask> <mask> <mask>.<SPLIT><mask> <mask> <mask> <mask> <mask> <mask> <mask> <mask> <mask> <mask> <mask> <mask> <mask> <mask> <mask> <mask> <mask> <mask> <mask> <mask> <mask> <mask> <mask>",-18.353418350219727,-4.166965007781982,511,106903,511,1326,Successful
512,Ri chol-guk,"<mask> <mask> ( also `` lee <mask> '', ; born december 25, 1985 in <mask> ) is a north korean <mask> <mask> player.<SPLIT>as of may 2012, <mask> is ranked no. <mask> in the world by the international <mask> <mask> federation ( ittf ). <mask> is a member of the <mask> <mask> team for <mask> sports <mask> , and is coached and trained by kim jin myong.<SPLIT>he is also <mask> , and uses the <mask> grip. <mask> qualified for the men's singles tournament, along with his",Alexandre dinerchtein,"<mask> <mask> ( also `` lee <mask> '', ; born december 25, <mask> in <mask> ) <mask> a <mask> korean <mask> <mask> <mask>.<SPLIT>as <mask> <mask> <mask>, <mask> <mask> <mask> <mask>. <mask> in the world by the international <mask> <mask> federation ( <mask> ). <mask> <mask> a <mask> <mask> the <mask> <mask> team for <mask> sports <mask> , and <mask> coached and trained by kim jin <mask>.<SPLIT>he <mask> also <mask> , and uses the <mask> grip. <mask> qualified for the <mask> <mask> tournament, along with his",-10.580079078674316,-4.778036117553711,512,121785,512,526,Successful
513,Edward bastard,"<mask> puckrin <mask> , also known as `` shoey '' because he was a shoemaker by trade ( 11 february 1862 -- 14 september 1940 ) was an english cricketer who played fifty-nine <mask> matches for <mask> county cricket club between <mask> and 1892.<SPLIT>he also appeared in <mask> cricket for the players ( <mask> ), t emmett's xi ( <mask> ), lord sheffield's xi ( 1884 ), an england xi ( 1884 ) and l hall's yorkshire xi ( 1891",Bobby peel,"<mask> puckrin <mask> , also known as `` shoey '' because he was a shoemaker by trade ( 11 february <mask> -- 14 september <mask> ) was an english cricketer who played fifty-nine <mask> matches for <mask> county cricket club between <mask> and 1892.<SPLIT>he also appeared in <mask> cricket for the players ( <mask> ), t emmett's xi ( <mask> ), lord sheffield's xi ( 1884 ), an england xi ( 1884 ) and l hall's yorkshire xi ( 1891",-7.081479072570801,-5.438976764678955,35904,95551,513,94,Successful
514,Tracey eide,"<mask> <mask> ( born july 31, 1954 ) is a democratic party member of the <mask> state senate.<SPLIT>she has represented the 30th washington legislative district in the <mask> state senate since 1999. <mask> has served as the majority floor leader for the senate since 2005.<SPLIT>earlier in <mask> senate tenure she served as majority whip from 2001 to 2002 and minority whip from 2003 to 2004.<SPLIT>currently, <mask> serves as vice-chair of the senate transportation committee.<SPLIT>previously, <mask> served as assistant majority whip in the <mask> state house of representatives from 1993 to 1994",Christopher hurst,"<mask> <mask> ( born july 31, <mask> ) is a democratic party member of the <mask> state <mask>.<SPLIT><mask> has represented the 30th <mask> legislative district in the <mask> state <mask> since <mask>. <mask> has served as the majority floor leader for the <mask> since 2005.<SPLIT>earlier in <mask> <mask> tenure <mask> served as majority whip from 2001 to 2002 and minority whip from 2003 to 2004.<SPLIT>currently, <mask> serves as <mask> of the <mask> transportation committee.<SPLIT>previously, <mask> served as assistant majority whip in the <mask> state house of representatives from 1993 to 1994",-13.647127151489258,-3.58319091796875,514,86430,514,298,Successful
515,Erkki kerttula,<mask> <mask> ( 5 <mask> <mask> -- 4 <mask> 1989 ) was a finnish fencer.<SPLIT>he competed at the 1948 and 1952 summer olympics.,Jean heeremans,<mask> <mask> ( 5 <mask> <mask> -- 4 <mask> <mask> ) was a <mask> <mask>.<SPLIT>he competed at the 1948 and 1952 summer <mask>.,-15.343683242797852,-5.064243316650391,515,76596,515,59,Successful
516,Adam jánošík,"<mask> jnok ( born september 7, 1992 ) is a slovakian professional ice hockey defenceman.<SPLIT>he is currently playing with the hc koice of the slovak extraliga.<SPLIT>janosik was selected by the <mask> <mask> <mask> in the 3rd round ( 72nd overall ) of the 2010 nhl entry draft.<SPLIT>jnok made his czech extraliga debut playing with hc bl tygi liberec during the 2012 -- 13 czech extraliga season.",Erik weissmann,"<mask> <mask> ( <mask> september <mask>, <mask> ) <mask> a slovakian <mask> <mask> hockey <mask>.<SPLIT><mask> <mask> <mask> <mask> with <mask> <mask> <mask> of <mask> slovak extraliga.<SPLIT><mask> was <mask> by <mask> <mask> <mask> <mask> in <mask> 3rd <mask> ( 72nd overall ) of <mask> <mask> <mask> <mask> <mask>.<SPLIT><mask> <mask> <mask> czech extraliga <mask> <mask> with <mask> bl tygi liberec <mask> <mask> <mask> -- <mask> czech extraliga <mask>.",-14.098005294799805,-4.1393208503723145,516,16285,516,911,Successful
517,Kate brophy mcgee,"<mask> <mask> <mask> ( born in <mask> ) is an american politician and a republican member of the <mask> house of representatives representing district 28 since <mask> <mask> , 2013. <mask> <mask> previously served consecutively from <mask> 10, 2011 until <mask> <mask> , 2013 in the district 11 seat.",Robert allen johnson,"<mask> <mask> <mask> ( <mask> <mask> <mask> ) is an american politician and <mask> <mask> <mask> <mask> the <mask> house <mask> representatives <mask> district 28 <mask> <mask> <mask> , <mask>. <mask> <mask> <mask> <mask> <mask> <mask> <mask> <mask>, <mask> <mask> <mask> <mask> , <mask> <mask> the district 11 seat.",-17.527645111083984,-6.7185821533203125,517,128344,517,329,Successful
518,Georgiy nikolayevich daneliya,"<mask> <mask> ( `` giorgi danelia '' ; ; born 25 august 1930 ) is a soviet/ <mask> /russian film director, who became known throughout the soviet union for his `` sad comedies '' ( as he styles them ).",Bojana stamenov,"<mask> <mask> ( `` <mask> <mask> '' ; ; born 25 august <mask> ) is a <mask>/ <mask> /<mask> <mask> <mask>, who became known <mask> the <mask> <mask> <mask> <mask> `` sad <mask> '' ( as <mask> <mask> them ).",-18.169775009155273,-7.225640296936035,518,92885,518,274,Successful
