,original_person,original_text,perturbed_person,perturbed_text,original_score,perturbed_score,original_output,perturbed_output,ground_truth_output,num_queries,result_type
0,Lenny randle,"leonard shenoff <mask> ( born february 12, 1949 ) is a former major league baseball player.<SPLIT>he was the first-round pick of the washington senators in the secondary phase of the june 1970 major league baseball draft, tenth overall.",Bill bray,"<mask> shenoff <mask> ( born february 12, <mask> ) is a former major league baseball <mask>.<SPLIT>he <mask> <mask> <mask> pick <mask> <mask> washington senators in <mask> secondary <mask> <mask> <mask> june <mask> major league baseball draft, tenth overall.",-17.989948272705078,-5.10660982131958,0,25558,0,226,Successful
1,Jim nicholson,"<mask> <mask> ( born 25 august 1945 in rhges ) is a member of the <mask> of <mask> .<SPLIT>he was first elected in 1989, and represents the <mask> department.<SPLIT>a <mask> by profession, he serves as an independent, and also serves as the head of the <mask> <mask> of <mask> , to which he was elected to represent the <mask> of <mask> in 1980.<SPLIT>in 1998 and 2008, he was re-elected to the <mask> in the first round, avoiding the need for a run-off vote.<SPLIT>having contributed to the creation of the",Armand jung,"<mask> <mask> ( born 25 august <mask> in rhges ) is a member of the <mask> of <mask> .<SPLIT>he was first elected in 1989, and represents the <mask> department.<SPLIT>a <mask> by profession, he serves as an independent, and also serves as the head of the <mask> <mask> of <mask> , to which he was elected to represent the <mask> of <mask> in 1980.<SPLIT>in 1998 and 2008, he was re-elected to the <mask> in the first round, avoiding the need for a run-off vote.<SPLIT>having contributed to the creation of the",-6.53497838973999,-3.521787643432617,63958,29525,1,44,Successful
2,Miroslav popov,<mask> <mask> ( born 14 june 1995 in dvr krlov <mask> <mask> ) is a <mask> grand prix motorcycle racer.<SPLIT>he currently races in the fim cev moto2 championship for montaze broz racing team aboard a suter.,Giuseppe minaudo,<mask> <mask> ( <mask> <mask> <mask> <mask> <mask> <mask> <mask> <mask> <mask> ) <mask> <mask> <mask> <mask> <mask> <mask> <mask>.<SPLIT><mask> <mask> <mask> <mask> <mask> <mask> <mask> <mask> <mask> for montaze <mask> <mask> <mask> <mask> <mask> <mask>.,-17.164512634277344,0.3310934901237488,2,57746,2,404,Successful
3,Jack reynolds,"john `` <mask> '' <mask> ( 21 february <mask> -- 12 march 1917 ) was a footballer who played for, among others, <mask> <mask> <mask> , <mask> villa and celtic.<SPLIT>as an international he played five times for ireland before it emerged that he was actually english and he subsequently played eight times for <mask> .<SPLIT>he is the only player, barring own goals, to score for and against <mask> and is the only player to play for both ireland and <mask> .<SPLIT>he won the fa cup with <mask> <mask> <mask> in <mask> and was",Bobby evans,"<mask> `` <mask> '' <mask> ( 21 <mask> <mask> -- 12 march <mask> ) was a footballer who played <mask>, <mask> <mask>, <mask> <mask> <mask> , <mask> <mask> and celtic.<SPLIT>as an <mask> he played five <mask> <mask> <mask> before it <mask> <mask> he was <mask> <mask> and he subsequently played eight <mask> <mask> <mask> .<SPLIT>he <mask> the only player, barring own goals, to <mask> <mask> and against <mask> and <mask> the only player to play <mask> both <mask> and <mask> .<SPLIT>he won the fa cup with <mask> <mask> <mask> in <mask> and was",-17.006921768188477,-5.538870334625244,3,108405,3,665,Successful
4,Akoo nana,"william <mask> <mask> , ( born 7th july 1979 ) better known by his stage name <mask> <mask> is a <mask> musician from ghana.<SPLIT>since 2009, he has been making a large impact in africa's <mask> scene through his authentic sounding music and captivating stage craft.",Rajat arora,"<mask> <mask> <mask> , ( born 7th <mask> <mask> ) <mask> known by his <mask> name <mask> <mask> <mask> <mask> <mask> <mask> from <mask>.<SPLIT>since <mask>, <mask> <mask> <mask> <mask> <mask> large <mask> in <mask> <mask> <mask> <mask> his <mask> <mask> <mask> <mask> <mask> <mask> <mask>.",-20.342121124267578,-4.990091323852539,4,84914,4,541,Successful
5,Teoctist,"<mask> (, born <mask> arpau ; february 7, 1915 -- july 30, 2007 ) was the <mask> of the <mask> <mask> church from 1986 to 2007. <mask> served his first years as <mask> under the <mask> communist regime, and was accused by some of collaboration.<SPLIT>he offered his resignation after the <mask> revolution of 1989, but was soon restored to office and served a further 17 years.<SPLIT>a promoter of ecumenical dialogue, <mask> <mask> invited pope john paul ii to visit <mask> in 1999.<SPLIT>it",Simon arshaki ter-petrosian -lrb- kamo -rrb-,"<mask> (, born <mask> <mask> ; february 7, <mask> -- july 30, <mask> ) was the <mask> of the <mask> <mask> <mask> <mask> <mask> <mask> <mask>. <mask> served his first <mask> <mask> <mask> under the <mask> <mask> <mask>, and was accused by some of collaboration.<SPLIT>he <mask> his <mask> after the <mask> revolution of <mask>, but was soon <mask> <mask> <mask> and served a further <mask> <mask>.<SPLIT>a <mask> of <mask> dialogue, <mask> <mask> invited <mask> john <mask> <mask> <mask> visit <mask> in <mask>.<SPLIT>it",-16.592138290405273,-2.5412492752075195,5,50476,5,967,Successful
6,Dillon sheppard,<mask> <mask> ( born 27 february 1979 ) is a <mask> african football ( soccer ) left-winger who plays for premier soccer league club bidvest wits and <mask> <mask> .,Siyanda xulu,<mask> <mask> ( born 27 february <mask> ) is <mask> <mask> <mask> <mask> ( soccer ) <mask> who plays for <mask> soccer <mask> club <mask> <mask> <mask> <mask> <mask> .,-17.504419326782227,-6.173718452453613,6,37966,6,146,Successful
7,Giuliana zevallos,"<mask> <mask> <mask> ( born in lima, <mask> ) is a beauty queen who was crowned <mask> <mask> <mask> <mask> on september 18, <mask> , becoming that pageant's very first titleholder from her country.<SPLIT>prior to winning <mask> <mask> <mask> , she was <mask> <mask> per 2008 and <mask> per <mask> , and represented her country in both <mask> <mask> 2008 and <mask> universe <mask> .<SPLIT>on february 9, 2012, <mask> was designated as the new <mask> per world.<SPLIT>she represented her country in the <mask>",Gabriella ferrari,"<mask> <mask> <mask> ( born <mask> <mask>, <mask> ) is a beauty queen who was crowned <mask> <mask> <mask> <mask> on september 18, <mask> , becoming that pageant's very first titleholder from her <mask>.<SPLIT>prior to winning <mask> <mask> <mask> , she was <mask> <mask> per <mask> and <mask> per <mask> , and represented her <mask> <mask> both <mask> <mask> <mask> and <mask> universe <mask> .<SPLIT>on february 9, <mask>, <mask> was designated as the new <mask> per world.<SPLIT>she represented her <mask> <mask> the <mask>",-16.61638832092285,-6.13588809967041,7,138885,7,191,Successful
8,Renato campos,"<mask> <mask> ( born september 5, 1980 ) is a retired angolan football player.<SPLIT>he has played for <mask> national team.",Masaru uchiyama,"<mask> <mask> ( born september 5, <mask> ) is a retired <mask> football <mask>.<SPLIT>he has played for <mask> national team.",-13.176202774047852,-3.3582921028137207,8,57552,8,46,Successful
9,Sir william laird clowes,"sir <mask> <mask> <mask> ( 1 february <mask> -- 14 august <mask> ) was a british journalist and <mask> whose principal work was `` the royal navy, a history from the earliest times to 1900 '', a text that is still in print.<SPLIT>he also wrote numerous technical pieces on naval technology and strategy and was also noted for his articles concerning racial politics in the southern united states.<SPLIT>despite having trained as a lawyer, <mask> had always preferred literature and writing, publishing his first work in 1876 and becoming a full-time <mask> in 1879.<SPLIT>for the services rendered",Joseph nathan kane,"<mask> <mask> <mask> <mask> ( 1 february <mask> -- 14 <mask> <mask> ) was <mask> <mask> <mask> and <mask> <mask> principal <mask> was `` the <mask> <mask>, <mask> <mask> from the earliest times to <mask> '', <mask> text that is still in print.<SPLIT>he also wrote numerous technical pieces on <mask> technology and <mask> and was also noted for his articles <mask> <mask> <mask> in the <mask> united states.<SPLIT>despite having trained as <mask> <mask>, <mask> had always preferred <mask> and <mask>, publishing his first <mask> in <mask> and becoming <mask> full-time <mask> in <mask>.<SPLIT>for the services rendered",-14.501776695251465,-3.8617701530456543,9,76964,9,1222,Successful
10,Dan besse,"daniel vaughn ( <mask> ) <mask> ( born december 28, <mask> ) is a graduate of unc-chapel hill school of law ( 1980 ), an <mask> , and, since 2001, a city councilman in winston-salem, <mask> <mask> .<SPLIT>he was one of four democratic candidates in the 2008 lt. <mask> election for the seat vacated by beverly perdue, but came in last in the primary, which was won by walter dalton.<SPLIT>in the 2008 campaign, <mask> received the endorsement of the progressive democrats of <mask> <mask> and the conservation",Tommy wells,"<mask> vaughn ( <mask> ) <mask> ( born december 28, <mask> ) is a <mask> of unc-chapel <mask> <mask> of <mask> ( 1980 ), an <mask> , and, since 2001, a city councilman in <mask>, <mask> <mask> .<SPLIT>he was one of four democratic candidates in the 2008 lt. <mask> election for the seat vacated by beverly perdue, but came in last in the primary, which was won by walter dalton.<SPLIT>in the 2008 campaign, <mask> received the endorsement of the progressive democrats of <mask> <mask> and the conservation",-12.612176895141602,-2.5062758922576904,10,143949,10,298,Successful
11,Matt elliott,"<mask> <mask> is an english folk guitarist and singer from bristol, england, who plays <mask> folk <mask> .<SPLIT>he also produced and recorded <mask> <mask> under the name the <mask> <mask> <mask> .",Mr duke,"<mask> <mask> is an <mask> folk <mask> and singer from <mask>, <mask>, who plays <mask> folk <mask> .<SPLIT>he <mask> <mask> and recorded <mask> <mask> under the name the <mask> <mask> <mask> .",-11.235125541687012,-3.370724678039551,11,50168,11,100,Successful
12,Giuseppe mariani,<mask> <mask> was an italian <mask> director.<SPLIT>he was nominated for an academy award in the category best art direction for the film `` the taming of the shrew ''.,John blake,<mask> <mask> <mask> <mask> <mask> <mask> <mask>.<SPLIT><mask> <mask> <mask> for <mask> <mask> award in <mask> <mask> best <mask> <mask> for <mask> <mask> `` <mask> taming of <mask> <mask> ''.,-15.702695846557617,-8.528249740600586,12,95460,12,170,Successful
13,Tang li,"<mask> <mask> ( <mask> :  ; <mask> : tng l ; born july 27, 1982 ) is a <mask> professional go player.",Hong minpyo,"<mask> <mask> ( <mask> :  ; <mask> : <mask> <mask> ; <mask> <mask> <mask>, <mask> ) <mask> <mask> <mask> <mask> <mask> <mask>.",-15.239490509033203,-8.883907318115234,13,33400,13,67,Failed
14,Peter curran,"peter <mask> is an irish broadcaster, writer, documentary maker and audiobook publisher.<SPLIT>he grew up in <mask> , the eldest of six children.<SPLIT>after leaving school he worked on funfairs in the usa before moving to london. <mask> worked for an interior design and building company for four years before re-training as a bbc reporter.<SPLIT>in 1992, he began dj ` ing full-time for the london radio station bbc glr.",Mark tonderai,"<mask> <mask> is an <mask> broadcaster, writer, documentary maker and audiobook publisher.<SPLIT>he grew up in <mask> , the eldest of six children.<SPLIT>after leaving school he worked on funfairs in the usa before moving to london. <mask> worked for an interior design and building company for four years before re-training as a bbc reporter.<SPLIT>in 1992, he began dj ` ing full-time for the london radio station bbc glr.",-10.657580375671387,-4.078768730163574,14,69825,14,102,Successful
15,Michael abrash,"<mask> <mask> , also known as <mask> <mask> , is an american indie <mask> <mask> designer best known for creating the endless runner `` <mask> ''.<SPLIT>he is a founder of semi secret software and finji <mask> game studios.",Steve feak,"<mask> <mask> , also known as <mask> <mask> , is an american indie <mask> <mask> designer best known for creating the endless runner `` <mask> ''.<SPLIT>he is a founder of semi secret <mask> and finji <mask> game <mask>.",-8.779210090637207,-6.874024391174316,67530,103525,15,50,Successful
16,Walter clarence henderson,"<mask> <mask> <mask> ( 28 february <mask> -- 20 september 1968 ) was a <mask> <mask> party member of the canadian house of commons.<SPLIT>he was born in <mask> , <mask> and became a <mask> by career.<SPLIT>he was elected at the <mask> <mask> in the <mask> general election, defeating social credit incumbent <mask> <mask> . <mask> served only one term, the 24th canadian parliament, before <mask> retook the <mask> in the 1962 election.<SPLIT>-- >",Archibald john macdonald,"<mask> <mask> <mask> ( 28 february <mask> -- 20 september <mask> ) <mask> a <mask> <mask> <mask> member of the canadian <mask> of <mask>.<SPLIT>he <mask> born in <mask> , <mask> and became a <mask> <mask> career.<SPLIT>he <mask> elected <mask> the <mask> <mask> in the <mask> <mask> <mask>, <mask> social credit <mask> <mask> <mask> . <mask> served only one term, the 24th canadian <mask>, <mask> <mask> retook the <mask> in the <mask> <mask>.<SPLIT>-- >",-15.310998916625977,-3.681490898132324,16,42023,16,442,Successful
17,André salvador,andr fernando <mask> <mask> ( born 4 november 1993 in portimo ) is a portuguese footballer who plays for <mask> s.c. as a midfielder.,João patrão,<mask> <mask> <mask> <mask> ( <mask> <mask> <mask> <mask> <mask> <mask> ) <mask> <mask> <mask> <mask> <mask> <mask> <mask> <mask> <mask>.<mask>. <mask> <mask> <mask>.,-14.841208457946777,-6.319665908813477,17,57536,17,191,Failed
18,Ernesto inarkiev,"<mask> <mask> ( born december 9, 1985 in <mask> , <mask> ) is a russian chess grandmaster.<SPLIT>he was named after <mask> `` che '' guevara.<SPLIT>in 2006 he came third in the 59th russian chess championship superfinal.<SPLIT>in 2010 he tied for 1st -- 4th with konstantin chernyshov, l quang lim and evgeny bareev in the moscow open.<SPLIT>in 2015 he won `` moscow open 2015 '' with outstanding 8/9.",Gadir guseinov,"<mask> <mask> ( <mask> december <mask>, <mask> <mask> <mask> , <mask> ) <mask> <mask> russian <mask> <mask>.<SPLIT><mask> <mask> named after <mask> `` che '' <mask>.<SPLIT><mask> <mask> <mask> <mask> <mask> <mask> <mask> <mask> russian <mask> <mask> <mask>.<SPLIT><mask> <mask> <mask> tied <mask> 1st -- 4th <mask> <mask> <mask>, <mask> quang lim and evgeny <mask> <mask> <mask> moscow <mask>.<SPLIT><mask> 2015 <mask> <mask> `` moscow <mask> 2015 '' <mask> <mask> <mask>/<mask>.",-12.88613510131836,-5.337193489074707,18,85910,18,842,Successful
19,Bill rigby,"william ` <mask> ( 9 june <mask> - 1 june 2010 ) was a former english footballer who played as a <mask> .<SPLIT>he was born in <mask> .<SPLIT>a product of the youth system at his hometown club of <mask> , <mask> made his only peacetime first-team appearance for the club in their first post-war match in the football league in a 4 -- 4 draw at york city on 31 august 1946.<SPLIT>after this he was not selected again, with goalkeeping duties being passed on to george scales and jim maclaren.<SPLIT>earlier he had made",Oliviero vojak,"<mask> ` <mask> ( 9 june <mask> - 1 june <mask> ) <mask> <mask> <mask> <mask> footballer who played as <mask> <mask> .<SPLIT>he <mask> born in <mask> .<SPLIT><mask> product of <mask> <mask> <mask> at <mask> <mask> club of <mask> , <mask> <mask> <mask> <mask> <mask> <mask> <mask> <mask> <mask> club in their first <mask> <mask> in <mask> football league in <mask> <mask> -- <mask> <mask> at york <mask> <mask> <mask> <mask> <mask>.<SPLIT>after this he <mask> <mask> <mask> again, <mask> <mask> <mask> being <mask> <mask> to george <mask> <mask> <mask> <mask>.<SPLIT>earlier he <mask> <mask>",-16.73805046081543,-3.7612709999084473,19,104642,19,1666,Successful
20,Rufus anderson,"<mask> <mask> ( november 19, <mask> -- july 6, 1880 ) graduated from <mask> university in 1825. <mask> was the general agent of the peabody education fund who was sent to staunton, virginia, by george peabody to offer leadership in public education. <mask> was general agent of the fund from 1867 until february 1880.<SPLIT>he settled in staunton because of the easy access to the railroad. <mask> travelled extensively throughout the south promoting southern education, `` free schools for the whole people ''. <mask> `` inspired",Max frauenthal,"<mask> <mask> ( november 19, <mask> -- july 6, <mask> ) graduated from <mask> university in <mask>. <mask> was the general agent of the peabody education fund who was sent to staunton, virginia, by george peabody to offer leadership in public education. <mask> was general agent of the fund from 1867 until february <mask>.<SPLIT>he settled in staunton because of the easy access to the railroad. <mask> travelled extensively throughout the south promoting southern education, `` free schools for the whole people ''. <mask> `` inspired",-10.169673919677734,-3.1250758171081543,9763,130883,20,98,Successful
21,Stepan rostomyan,"<mask> <mask> ( ''   '' ), ( born 4 april, 1956 ) is a famous armenian <mask> .<SPLIT>he is one of <mask> key figures of the contemporary music scene, as well as a <mask> whose works have been performed and broadcast internationally.",Michail svetlev,"<mask> <mask> ( ''   '' ), ( born 4 april, <mask> ) is a <mask> <mask> <mask> .<SPLIT>he is one of <mask> key figures of the contemporary <mask> scene, as well as a <mask> whose works have been performed and broadcast internationally.",-13.767570495605469,-5.896780967712402,21,61134,21,103,Successful
22,V. kalpana,"<mask> <mask> ( born 3 april <mask> in delhi, <mask> ) is a former <mask> and one day international cricketer who represented <mask> .<SPLIT>she played a total of 13 tests and 20 odis.",Aj venter,"<mask> <mask> ( born 3 april <mask> <mask> <mask>, <mask> ) is a former <mask> and <mask> <mask> international <mask> who <mask> <mask> .<SPLIT><mask> played a total of 13 <mask> and <mask> <mask>.",-12.570146560668945,-2.5564663410186768,105389,141189,22,186,Successful
23,Allan higdon,"<mask> l. <mask> served on <mask> city council from 1994 through 2000.<SPLIT>born in dublin, republic of ireland, he immigrated to canada in 1957.<SPLIT>he received a ba from queen's university in english and history and received a b.ed from the university of toronto.<SPLIT>he then worked with the canadian institute of mining and metallurgy.<SPLIT>he would later move to ottawa after living in toronto and southeast asia, where he would teach high school.<SPLIT>he then worked on parliament hill and then became a self-employed consultant specializing in social and",Raymond cho,"<mask> l. <mask> served on <mask> city council from 1994 through <mask>.<SPLIT>born in <mask>, <mask> of <mask>, he <mask> to canada in 1957.<SPLIT>he received a ba from <mask> university in english and history and received a b.ed from the university of <mask>.<SPLIT>he then worked with the canadian institute of mining and <mask>.<SPLIT>he would later move to <mask> after living in <mask> and southeast asia, where he would teach high school.<SPLIT>he then worked on parliament hill and then became a self-employed <mask> specializing in social and",-10.755590438842773,-5.029598236083984,23,101393,23,536,Successful
24,Olcay çakır,"<mask> akr ( born 13 july 1993 in <mask> , zmir, <mask> ) is a <mask> <mask> player.<SPLIT>the young national plays for fenerbahe stanbul as both guard ( 1-2 ) position. <mask> akr is 182 cm tall and weighs 60 kg.<SPLIT>she is playing for fenerbahe since 2005 in youth level and since 2010 in senior level.<SPLIT>akr was selected 27th overall in the 2013 <mask> draft's round 3 by the new york <mask> .",Güldeniz önal,"<mask> <mask> ( born 13 july <mask> in <mask> , zmir, <mask> ) is a <mask> <mask> player.<SPLIT>the <mask> <mask> plays for <mask> <mask> as both <mask> ( 1-2 ) position. <mask> <mask> is 182 cm tall and weighs 60 kg.<SPLIT><mask> is playing for <mask> since 2005 in youth <mask> and since <mask> in senior <mask>.<SPLIT><mask> was selected 27th overall in the <mask> <mask> <mask> round 3 by the new york <mask> .",-10.828204154968262,-4.298305034637451,24,128761,24,511,Successful
25,David buchanan,"<mask> <mask> ( <mask> january <mask> -- 30 may 1900 ) was an english amateur <mask> who played mainly as a bowler and who had two careers separated in an unusual manner by a long period out of the <mask> game.<SPLIT>he was born at <mask> , <mask> , scotland, and died at <mask> , <mask> , england.",George thompson,"<mask> <mask> ( <mask> january <mask> -- 30 may <mask> ) was an english amateur <mask> who played mainly as a bowler and who had two careers separated in an unusual manner by a long period out of the <mask> <mask>.<SPLIT>he was born at <mask> , <mask> , scotland, and died at <mask> , <mask> , england.",-14.521639823913574,-5.154548645019531,25,102127,25,70,Successful
26,Max brown,<mask> <mask> ( born 8 august <mask> ) is an english actor.,Max brown,<mask> <mask> ( born 8 august <mask> ) is an english actor.,-5.690117359161377,-5.690117359161377,115364,115364,26,1,Skipped
27,Dharan kumar,"<mask> <mask> , also known as `` thaimann <mask> '', is a tamil film actor, director, producer and lyricist in the tamil film industry.<SPLIT>he began his career in his early ages as a producer for the tamil film anbudan, starred arun vijay, meena, rambha ( actress ) in the main was released in the year 2000.<SPLIT>then he worked on the most successful tamil music album",Dharan kumar,"<mask> <mask> , also known as `` thaimann <mask> '', is a tamil film actor, director, producer and <mask> in the tamil film industry.<SPLIT>he began his career in his early ages as a producer for the tamil film anbudan, starred arun vijay, meena, rambha ( actress ) in the main was released in the year 2000.<SPLIT>then he worked on the most successful tamil music album",-5.77235746383667,-3.541417121887207,12457,12457,27,43,Successful
28,Jacoba surie,"<mask> <mask> ( 5 september <mask> -- 5 february <mask> ) was a dutch painter. <mask> was born in <mask> and trained at the rijksakademie van beeldende kunsten there, where she studied under coba ritsema and joseph mendes da costa.<SPLIT>she was a member of arti et amicitiae and the pulchri studio and is considered one of the amsterdamse joffers. <mask> died in <mask> and was buried in zorgvlied.",Alessandro algardi,"<mask> <mask> ( 5 september <mask> -- 5 february <mask> ) was a <mask> <mask>. <mask> was born in <mask> and trained at the <mask> <mask> <mask> <mask> there, where <mask> studied under coba <mask> and joseph mendes da <mask>.<SPLIT><mask> was a member of arti et amicitiae and the pulchri studio and is considered <mask> of the <mask> <mask>. <mask> died in <mask> and was buried in <mask>.",-13.850811004638672,-4.879416465759277,28,71163,28,482,Successful
29,Tommy davidson,"<mask> <mask> ( born may 31, 1963 ) is a canadian actor and <mask> comedian.<SPLIT>he has appeared on `` comedy central presents '', the just for laughs comedy festival, the `` late show with david letterman '', and `` the tonight show with jay leno ''.<SPLIT>he has also worked as a staff writer for paramount's `` the jon stewart show '' and has appeared in various american and canadian motion pictures including : `` my favorite martian '', '' '', and `` married life ''.",Tyler labine,"<mask> <mask> ( born may 31, <mask> ) is a canadian actor and <mask> <mask>.<SPLIT>he has appeared on `` comedy central presents '', the just for laughs comedy festival, the `` late show with david letterman '', and `` the tonight show with jay leno ''.<SPLIT>he has also worked as a staff writer for paramount's `` the jon stewart show '' and has appeared in various american and canadian motion pictures including : `` my favorite martian '', '' '', and `` married life ''.",-11.512742042541504,-6.24278450012207,113045,77597,29,98,Successful
30,John thompson,"<mask> <mask> <mask> <mask> hugh <mask> cb ( born 18 september 1947 ) is a former royal <mask> <mask> <mask> who became head of the british defence staff in washington, d.c.",Sir john reith,"<mask> <mask> <mask> <mask> <mask> <mask> <mask> ( born 18 september <mask> ) is a former <mask> <mask> <mask> <mask> who became head of the <mask> <mask> <mask> <mask> <mask>, <mask>.c.",-13.79223918914795,-4.5641889572143555,30,86959,30,176,Successful
31,Bernardo sassetti,"<mask> da costa <mask> pais ( 24 june 1970 -- 10 may 2012 ) was a portuguese <mask> pianist and film <mask> . <mask> was born in <mask> .<SPLIT>he was a great-grandson of sidnio pais, president of the first republic.<SPLIT>he initially played guitar, then began studying <mask> and <mask> theory at age nine.<SPLIT>he became interested in <mask> after hearing bill evans.<SPLIT>by the late <mask> , he was backing visiting musicians and teaching <mask> <mask> in <mask> ( and, later, taught throughout other lusophonic areas",Frans de haes,"<mask> <mask> <mask> <mask> pais ( 24 june <mask> -- 10 may <mask> ) was a <mask> <mask> <mask> <mask> <mask> <mask> . <mask> was born in <mask> .<SPLIT>he was a great-grandson of <mask> pais, president of the first <mask>.<SPLIT>he initially played guitar, then began studying <mask> <mask> <mask> <mask> <mask> <mask> <mask>.<SPLIT>he became interested in <mask> after <mask> <mask> <mask>.<SPLIT>by the <mask> <mask> , he was <mask> visiting musicians <mask> teaching <mask> <mask> in <mask> ( <mask>, later, taught throughout other lusophonic areas",-13.263253211975098,-3.2795419692993164,31,43351,31,837,Successful
