,original_person,original_text,perturbed_person,perturbed_text,original_score,perturbed_score,original_output,perturbed_output,ground_truth_output,num_queries,result_type
32,Jesse f. keeler,"jesse frederick keeler ( born november 11, 1976 ) is a canadian musician.<SPLIT>he is known as the bassist of canadian dance-punk duo death from above 1979 and one half of the electronic music duo mstrkrft.<SPLIT>in addition to singing, keeler plays drums, guitar, bass, keyboards, and saxophone, as well as work as a producer, lending to music of a variety of styles over the course of his career, including punk, hardcore, rock, house, and electro.",Michiro endo,"<mask> <mask> <mask> ( born november 11, <mask> ) is a <mask> musician.<SPLIT>he is known as the <mask> of <mask> dance-punk duo <mask> from above 1979 and one half of the electronic music duo mstrkrft.<SPLIT>in addition to singing, <mask> plays drums, guitar, bass, keyboards, and saxophone, as well as work as a producer, lending to music of a variety of styles over the course of his career, including punk, hardcore, rock, house, and electro.",-18.652559280395508,-0.9891350269317627,32,25626,32,631,Successful
33,Aleksandr levin,"he made his debut in the russian second division for fc znamya truda orekhovo-zuyevo on july 18, 2013 in a game against fc kolomna.",Aleksandr levin,"he made his debut in the russian second division for fc znamya truda orekhovo-zuyevo on july 18, 2013 in a game against fc kolomna.",-4.215028285980225,-4.215028285980225,131151,131151,33,1,Skipped
34,Darcy james argue,"darcy james argue is a vancouver-born, brooklyn-based jazz composer and bandleader.<SPLIT>he is best known for his work with his 18-piece ensemble, secret society, with which he has released two grammy-nominated albums.",Secret affair,"<mask> <mask> <mask> is a <mask>, brooklyn-based <mask> composer and bandleader.<SPLIT>he is best known for his work with his 18-piece ensemble, secret society, with which he has released two grammy-nominated albums.",-16.102914810180664,-3.2759861946105957,34,90153,34,151,Successful
35,Édouard hervé,"douard herv ( 28 may 1835 -- 4 january 1899 ) was a french journalist, historian and politician.",Kan abe 安倍 寛,"<mask> <mask> ( 28 may <mask> -- 4 january <mask> ) was a <mask> journalist, <mask> and politician.",-16.11510467529297,0.293088436126709,35,26661,35,76,Successful
36,The earl of bellomont,"richard coote, 1st earl of bellomont ( sometimes spelled bellamont, 1636 -- 5 march 1700/1 ), known as the lord coote between 1683 and 1689, was a member of the english parliament and a colonial governor.<SPLIT>born in ireland, he was an early supporter of william and mary, siding with them in the glorious revolution.<SPLIT>in 1695 he was given commissions as governor of the provinces of new york, massachusetts bay, and new hampshire, which he held until his death.<SPLIT>he did not arrive in the new world",John cutt,"<mask> <mask>, 1st <mask> of <mask> ( sometimes spelled <mask>, <mask> -- 5 march <mask>/1 ), known as the <mask> <mask> <mask> 1683 and 1689, was a member of the english parliament and a colonial governor.<SPLIT>born in <mask>, he was an early supporter of william and mary, siding with them in the glorious revolution.<SPLIT>in 1695 he was given commissions as governor of the provinces of new york, massachusetts bay, and new hampshire, which he held until his death.<SPLIT>he did not arrive in the new world",-17.297649383544922,-2.1595592498779297,36,48816,36,892,Successful
37,Sigeferth,"sigeferth or sigefirth or sicgga, was the third bishop of selsey, consecrated in 733 by tatwine, the archbishop of canterbury.<SPLIT>sigeferth was still bishop in 747, when he attended the synod of clofesho.<SPLIT>his date of death was sometime between 747 and 765.",Thomas becket,"<mask> or <mask> or <mask>, was the third bishop of <mask>, consecrated in 733 by tatwine, the archbishop of canterbury.<SPLIT><mask> was still bishop in 747, when he attended the synod of clofesho.<SPLIT>his date of death was sometime between 747 and 765.",-16.756895065307617,-2.8094494342803955,37,71657,37,206,Successful
38,Rachel gowey,"rachel kathryn gowey ( born october 3, 1997 ) is an american artistic gymnast.<SPLIT>she is a u.s. national team member, a position she has held since 2014.<SPLIT>at the 2015 pan american games in toronto, she was part of the gold-winning us team, also winning gold individually on the uneven bars.",Mikaela shiffrin,"<mask> <mask> <mask> ( born october 3, <mask> ) is an american <mask> <mask>.<SPLIT>she is a u.s. national team member, a position she has held since 2014.<SPLIT>at the 2015 pan american games in toronto, she was part of the gold-winning us team, also winning gold individually on the uneven bars.",-16.704795837402344,-3.491352081298828,38,67136,38,292,Successful
39,Basavaraj patil sedam,basvaraj patil sedam ( born 10 february 1944 ) is a member of rajya sabha from karnataka.<SPLIT>he was the secretary of bharatiya janata party and president of the bharatiya janata party karnataka unit.<SPLIT>he was elected as a member of the 12th lok sabha from gulbarga.,Jagdish sharma,<mask> <mask> <mask> ( born 10 february <mask> ) is a member of rajya sabha from <mask>.<SPLIT>he was the secretary of bharatiya janata party and president of the bharatiya janata party <mask> unit.<SPLIT>he was elected as a member of the 12th lok sabha from gulbarga.,-17.349760055541992,-1.9233431816101074,39,95288,39,256,Successful
40,Demetrius of pharos,"demetrius of pharos ( also pharus ) ( ) was a ruler of pharos involved in the first illyrian war, after which he ruled a portion of the illyrian adriatic coast on behalf of the romans, as a client king.<SPLIT>demetrius was a regent ruler to pinnes, the son of agron who was too young to rule as king.<SPLIT>when the romans were occupied with their own problems, he had grown stronger as an ally of macedonia and also by conquering dimallum of dalmatia, on the shore facing issa",Strato i,"<mask> <mask> <mask> ( also <mask> ) ( ) was a <mask> of <mask> involved in the first illyrian war, after which he ruled a portion of the illyrian adriatic coast on behalf of the romans, as a client <mask>.<SPLIT><mask> was a regent ruler to <mask>, the son of agron who was too young to rule as king.<SPLIT>when the romans were occupied with their own problems, he had grown stronger as an ally of macedonia and also by conquering dimallum of dalmatia, on the shore facing issa",-14.77674674987793,-2.315539598464966,40,126332,40,730,Successful
41,Alfred e. reinhardt,"alfred e. reinhardt ( december 1902 - march, 1987 ) aia, was an american architect active in mid-twentieth-century connecticut and massachusetts.<SPLIT>his firm specialized in ecclesiastical design and was very active with roman catholic clients, mostly in connecticut.",George p. b. alderman,"<mask> <mask>. <mask> ( december <mask> - march, <mask> ) aia, was an american <mask> active in mid-twentieth-century connecticut and massachusetts.<SPLIT>his firm specialized in ecclesiastical design and was very active with roman catholic clients, mostly in connecticut.",-16.522138595581055,-2.7131309509277344,41,103233,41,196,Successful
42,Masayoshi tomizuka,"professor masayoshi tomizuka is a professor in control theory in department of mechanical engineering, university of california, berkeley.<SPLIT>he holds the cheryl and john neerhout, jr., distinguished professorship chair, and has supervised more than 90 ph. d. students to completion.<SPLIT>professor masayoshi tomizuka received his b.s. and m.s. degrees in mechanical engineering from keio university, tokyo, japan in 1968 and 1970, and his ph. d. degree in mechanical engineering from the massachusetts institute of technology in february",Dr.s.p.singh,"professor masayoshi <mask> <mask> a professor in <mask> <mask> in department of <mask> <mask>, university of <mask>, <mask>.<SPLIT>he <mask> the cheryl and john neerhout, jr., distinguished professorship chair, and has supervised more than 90 ph. d. students to completion.<SPLIT>professor <mask> <mask> received his b.s. and m.s. degrees in <mask> <mask> from keio university, tokyo, japan in 1968 and 1970, and his ph. d. degree in <mask> <mask> from the <mask> institute of <mask> in february",-17.382625579833984,-3.477383613586426,42,14988,42,1208,Successful
43,Thomas towie,thomas towie was a scottish footballer who played in the football league for derby county and preston north end in the 1890s.,Al rose,<mask> <mask> was a <mask> <mask> who played in the football league for <mask> county and preston <mask> end in the <mask>.,-16.647628784179688,-2.219451665878296,43,105516,43,134,Successful
44,Ernie whatmore,"ernest l. ` ernie'whatmore ( 25 april 1900 -- 31 july 1991 ) was a professional association footballer who played in the football league for wolverhampton wanderers, bristol rovers and queens park rangers during the interwar period.<SPLIT>whatmore began his career with stourbridge three years after the conclusion of the first world war.<SPLIT>he played there for a year before joining wolves on trial in 1922, but in spite of playing in two games for them in the football league second division the club opted not to retain his services.<SPLIT>he spent the remainder of the 1922 --",Stuart senior,"<mask> <mask>. ` <mask> ( 25 april <mask> -- 31 july <mask> ) was a professional association footballer who played in the football league for <mask> <mask>, <mask> rovers and queens park rangers during the interwar period.<SPLIT><mask> began his career with <mask> three years after the conclusion of the first world war.<SPLIT>he played there for a year before joining wolves on trial in 1922, but in spite of playing in two games for them in the football league second division the club opted not to retain his services.<SPLIT>he spent the remainder of the 1922 --",-18.057212829589844,-3.5659432411193848,44,63848,44,886,Successful
45,Paul f. whelan,"paul f. whelan is professor of computer vision at the centre for image processing & analysis, school of electronic engineering, faculty of engineering & computing dublin city university.",Morinosuke kawaguchi,"<mask> <mask>. <mask> is professor of <mask> <mask> at the centre for <mask> processing & <mask>, school of electronic engineering, faculty of engineering & <mask> dublin city university.",-16.946468353271484,-3.4677271842956543,45,5472,45,181,Successful
46,Vladimir medvedev,vladimir nikolayevich medvedev ( ; born 10 july 1971 ) is a former russian football player.,Nikolay oskin,<mask> nikolayevich <mask> ( ; born 10 july <mask> ) is a <mask> russian football player.,-17.880090713500977,-2.7347464561462402,46,122050,46,47,Successful
47,Cafú,"arlindo gomes semedo ( born 17 november 1977 ), commonly known as caf, is a cape verdean professional footballer who plays for s.c. freamunde as a forward.<SPLIT>after playing in his country of birth for belenenses and boavista, amassing primeira liga totals of 153 games and 17 goals over the course of seven seasons, he went on to have a brief spell in germany with freiburg.<SPLIT>already in his 30's caf moved to cyprus, where he remained for five years in representation of several teams.",Sérgio semedo,"<mask> gomes semedo ( born 17 november <mask> ), commonly known as <mask>, is a <mask> <mask> professional footballer who plays for s.c. <mask> as a <mask>.<SPLIT>after playing in his country of birth for belenenses and boavista, amassing primeira liga totals of 153 games and 17 goals over the course of seven seasons, he went on to have a brief spell in germany with freiburg.<SPLIT>already in his 30's caf moved to cyprus, where he remained for five years in representation of several teams.",-16.7490177154541,-3.1603288650512695,47,61431,47,568,Successful
48,Enrique cárdenas,enrique crdenas del avellano ( born 4 september 1957 ) is a mexican politician affiliated to the pri.<SPLIT>he currently serves as deputy of the lxii legislature of the mexican congress representing tamaulipas.<SPLIT>he also served as deputy during the lx legislature.,Leobardo alcalá,<mask> crdenas del avellano ( born 4 september <mask> ) is a <mask> politician <mask> to the pri.<SPLIT>he currently serves as <mask> of the <mask> legislature of the <mask> congress representing <mask>.<SPLIT>he also served as deputy during the lx legislature.,-14.677840232849121,-2.2824320793151855,48,71812,48,293,Successful
49,Kris janson,"kris tiffany maslog janson ( born december 21, 1989 ) simply known as kris janson, is a filipino beauty pageant titleholder from cebu city, crowned binibining pilipinas intercontinental 2014 at the binibining pilipinas 2014 pageant held on march 30th, 2014 at the smart araneta coliseum, quezon city, philippines.",Benigno aquino iii,"<mask> <mask> <mask> <mask> ( born <mask> 21, <mask> ) simply known as <mask> <mask>, is <mask> <mask> <mask> <mask> <mask> from <mask> <mask>, crowned binibining <mask> <mask> 2014 <mask> <mask> binibining <mask> 2014 <mask> held on march 30th, 2014 at the <mask> araneta coliseum, quezon city, philippines.",-17.760831832885742,-3.0329980850219727,49,119553,49,782,Successful
50,Aldo maldera,"aldo maldera ( 14 october 1953 -- 1 august 2012 ) was an italian footballer, who played as a fullback or as a wide midfielder on the left.<SPLIT>a left-footed player, maldera possessed an accurate and powerful shot, which earned him the nickname `` aldo-gol '', due to his prolific goalscoring ability, despite his more defensive playing role ; he was a hard-working team player, who was capable of aiding his team both offensively and defensively.<SPLIT>throughout his career, he was known for his pace, stamina, technique, dribbling, and crossing ability",Mutiu adepoju,"<mask> <mask> ( <mask> october <mask> -- <mask> <mask> <mask> ) <mask> <mask> <mask> <mask>, <mask> <mask> <mask> a <mask> <mask> <mask> a wide midfielder <mask> the <mask>.<SPLIT>a left-footed <mask>, <mask> <mask> <mask> <mask> <mask> powerful shot, <mask> earned <mask> the <mask> `` aldo-gol '', <mask> <mask> his prolific goalscoring ability, despite his more <mask> <mask> role ; he <mask> a hard-working team <mask>, who <mask> capable <mask> <mask> <mask> <mask> <mask> offensively <mask> <mask>.<SPLIT>throughout <mask> <mask>, <mask> <mask> known for his <mask>, stamina, <mask>, <mask>, and <mask> ability",-16.64522933959961,1.1902198791503906,50,7841,50,3026,Successful
51,Vicente mijares,"vicente mijares saldivar ( born june 14, 1954 in gmez palacio, durango, mexico ) is an undefeated mexican professional boxer in the lightweight division.<SPLIT>he's the uncle of both undefeated lightweight prospect ricardo mijares and former three-time world champion, cristian mijares.",Aldo polo,"<mask> <mask> <mask> ( born june 14, <mask> in gmez palacio, durango, mexico ) is an <mask> mexican professional <mask> in the <mask> division.<SPLIT>he's the uncle of both undefeated <mask> prospect ricardo <mask> and former three-time world champion, cristian <mask>.",-17.15196418762207,-3.1560158729553223,51,91190,51,346,Successful
52,Abdülhamit yıldız,abdlhamit yldz ( born 7 june 1987 in diyarbakr ) is a turkish footballer currently playing for balkesirspor.<SPLIT>he previously played for dutch side fc volendam.,Romero hollingsworth,<mask> <mask> ( born 7 june 1987 in diyarbakr ) is a <mask> footballer currently playing for <mask>.<SPLIT>he previously played for dutch side fc volendam.,-14.906098365783691,-4.671965599060059,52,16976,52,91,Successful
53,Alex j. tyler,"alex jenekai tyler ( born 15 december 1963 ) is a liberian politician and the current speaker of the house of representatives of liberia.<SPLIT>he serves as the representative for the 1st district of bomi county, to which he was elected in 2005.<SPLIT>tyler is a member of the unity party, having joined in 2009 following its merger with his former liberian action party.",Tekiau aretaateta,"<mask> jenekai <mask> ( born 15 december <mask> ) is a <mask> politician and the current <mask> of the house of representatives of <mask>.<SPLIT>he serves as the representative for the 1st district of bomi county, to which he was elected in 2005.<SPLIT><mask> is a member of the unity party, having joined in 2009 following its merger with his former <mask> action party.",-16.8268985748291,-1.4795827865600586,53,38568,53,469,Successful
54,Darby loudon,"darby briton loudon ( 12 march 1897 -- c. 1963 ) was a new zealand born rugby union player, a flanker who made sixteen representative appearances for the new south wales state team in the 1920s.<SPLIT>four of the these matches have since been decreed as test matches by the australian rugby union and loudon, who led the side in one such match in 1922, was therefore a captain of the australian national team.",John hill,"<mask> <mask> <mask> ( 12 march <mask> -- c. <mask> ) was a new <mask> born rugby union player, a <mask> who made sixteen representative appearances for the new south wales state team in the 1920s.<SPLIT>four of the these matches have since been decreed as test matches by the australian rugby union and <mask>, who led the side in one such match in 1922, was therefore a captain of the australian national team.",-17.351545333862305,-4.6013922691345215,54,124758,54,541,Successful
55,Ove molin,"ove molin ( born may 27, 1971 ) is a retired swedish professional ice hockey player who spent most of his career with bryns if in the swedish elitserien league.",Hiroyuki miura,"<mask> <mask> ( born may 27, <mask> ) is a retired <mask> professional ice hockey player who spent most of his career with <mask> <mask> in the <mask> elitserien league.",-16.75720977783203,-2.2891440391540527,55,27356,55,176,Successful
56,Frédéric fonteyne,frdric fonteyne ( born 9 january 1968 ) is a belgian film director.<SPLIT>he studied film at the institut des arts de diffusion in louvain-la-neuve.,Jean val jean,<mask> <mask> ( born 9 january <mask> ) is a <mask> film <mask>.<SPLIT>he studied film at the institut des arts de <mask> in louvain-la-neuve.,-14.901179313659668,-2.856508493423462,56,24596,56,124,Successful
57,David r. marsh,"david r. marsh ( born november 5, 1964 ) is an american video game designer known for his work supporting the intellectual properties that used to belong to icom simulations, and creating the macventure game `` shadowgate ''.<SPLIT>as of 2012, he recently founded a new game development company called zojoi, llc with plans to release new, remastered and revised versions of games created by him and karl roelofs when they were at icom simulations.",Tom hall,"<mask> <mask>. <mask> ( born november 5, 1964 ) is an <mask> video <mask> <mask> known for his work supporting the intellectual properties that used to belong to icom <mask>, and <mask> the macventure game `` shadowgate ''.<SPLIT>as of 2012, he recently founded a new <mask> development company called zojoi, llc with plans to release new, remastered and revised versions of games created by him and karl roelofs when they were at icom simulations.",-16.434175491333008,-3.6800475120544434,57,29758,57,604,Successful
58,Dean roland,"dean roland ( born october 10, 1972 ) is an american musician.<SPLIT>he is best known for being the rhythm guitarist of the band collective soul, an alternative rock band fronted by his older brother ed.<SPLIT>he is also part of the rock duo magnets & ghosts alongside ryan potesta.",Bobby bones,"<mask> <mask> ( born october 10, <mask> ) is an american musician.<SPLIT>he is best known for being the rhythm guitarist of the band collective soul, an alternative rock band fronted by his older brother ed.<SPLIT>he is also part of the rock duo magnets & ghosts alongside ryan potesta.",-17.53618621826172,-4.04969596862793,58,94098,58,139,Successful
59,"Lester l. westling , jr. .","lester leon `` wes '' westling, jr. ( born october 19, 1930 ) is an american episcopal priest, retired u.s. navy chaplain, vietnam veteran, and author.<SPLIT>his more than fifty years of ministry have included service to parishes, missionary work in the philippines, and twenty-six years as a navy chaplain, including two assignments in vietnam : first with the third marine division medical and infantry battalions, and later as a circuit riding chaplain for 65 combat units throughout the mekong and bassac rivers and along the c",Léon lommel,"<mask> leon `` <mask> '' <mask>, <mask>. ( born october 19, <mask> ) is an <mask> episcopal priest, <mask> <mask>.<mask>. <mask> chaplain, vietnam veteran, and author.<SPLIT>his more than fifty <mask> of ministry have included service to parishes, missionary work in the <mask>, and twenty-six years as a <mask> chaplain, including two assignments in <mask> : first with the third <mask> division medical and <mask> battalions, and later as a circuit riding chaplain for 65 combat units throughout the mekong and <mask> <mask> and along the c",-16.810436248779297,-3.4187746047973633,59,23113,59,1342,Successful
60,Shih choon fong,"professor shih choon fong (  ; born 1945 ) is the former president of the king abdullah university of science and technology ( kaust ) and a renowned fracture mechanics expert.<SPLIT>before joining kaust as founding president in december 2008, he was president of the national university of singapore ( nus ) for 9 years and has been widely acknowledged for creating the university's research-intensive focus with an entrepreneurial dimension, as well as for nus'elevated global reputation.<SPLIT>drawing from his experiences abroad, shih institutionalised a performance - and market-based evaluation",A. k. m. fazle hussain,"professor <mask> <mask> <mask> (  ; born <mask> ) is the former <mask> of the king abdullah university of science and technology ( kaust ) and a renowned fracture mechanics expert.<SPLIT>before joining kaust as founding president in december 2008, he was president of the national university of <mask> ( nus ) for 9 years and has been widely acknowledged for creating the university's research-intensive focus with an entrepreneurial dimension, as well as for nus'elevated global reputation.<SPLIT>drawing from his experiences abroad, <mask> institutionalised a performance - and market-based evaluation",-16.489065170288086,-3.745454788208008,60,85531,60,554,Successful
61,Fabinho,"fabio de matos pereira or fabinho ( born 26 february 1982 in brazil ), is a brazilian football midfielder, currently playing for botafogo-sp.<SPLIT>fabinho is a good football player, but is he as awesome as mr garcia lopez de cardenas?<SPLIT>that's right, i don't think so.<SPLIT>mr cardenas discovered the freaking grand canyon!<SPLIT>you think you can see the grand canyon?<SPLIT>wrong.<SPLIT>only garcia lopez de cardenas can see the grand canyon.<SPLIT>he played for an",Francismar,"<mask> <mask> <mask> <mask> or <mask> ( born 26 february <mask> in brazil ), is a brazilian football midfielder, currently playing for <mask>.<SPLIT><mask> is a good football player, but is he as awesome as mr garcia lopez <mask> cardenas?<SPLIT>that's right, i don't think so.<SPLIT>mr cardenas discovered the freaking grand canyon!<SPLIT>you think you can see the grand canyon?<SPLIT>wrong.<SPLIT>only garcia lopez de cardenas can see the grand canyon.<SPLIT>he played for an",-18.353178024291992,-2.995849847793579,61,142068,61,631,Successful
62,Friedhelm funkel,friedhelm funkel ( born 10 december 1953 ) is a german football manager and former player.<SPLIT>he last coached tsv 1860 mnchen.,Rainer scharinger,<mask> <mask> ( born 10 december <mask> ) is a german football manager and former player.<SPLIT>he last coached tsv 1860 mnchen.,-17.55672836303711,-4.08187198638916,62,20531,62,58,Successful
63,Jordan perez,"jordan perez ( born 13 november 1986 ) is a gibraltarian footballer who plays for lions gibraltar and the gibraltar national team, as a goalkeeper.<SPLIT>for the 2015 - 2016 season, jordan perez will be sponsored by dc1 goalkeeping.",Gero,"<mask> <mask> ( born 13 november <mask> ) is a <mask> <mask> who <mask> <mask> <mask> <mask> and the <mask> <mask> <mask>, as a <mask>.<SPLIT><mask> the 2015 - <mask> season, <mask> <mask> <mask> be <mask> by dc1 <mask>.",-17.338102340698242,3.7283332347869873,63,110245,63,531,Successful
64,Slavko brezovski,"slavko brezovski, famous for modern architecture built in the republic of macedonia.<SPLIT>head of architecture at the university of skopje.<SPLIT>born in galicnik, 1921.",Tōgo murano,"<mask> <mask>, famous for modern architecture built in the republic of <mask>.<SPLIT>head of architecture at the university of <mask>.<SPLIT><mask> in <mask>, 1921.",-16.879596710205078,-3.593738079071045,64,116164,64,130,Successful
65,Ambrose mccarthy patterson,ambrose mccarthy patterson ( 29 june 1877 -- 26 december 1967 ) was a painter and printmaker.,Morris louis,<mask> <mask> <mask> ( 29 june <mask> -- 26 december <mask> ) was a painter and printmaker.,-17.396730422973633,-3.100170135498047,65,12608,65,61,Successful
66,Jakob kreuzer,jakob kreuzer ( born 15 january 1995 ) is an austrian footballer who plays for sv ried.,Mitsuhiro seki,<mask> <mask> ( born 15 january <mask> ) is an <mask> footballer who plays for sv <mask>.,-17.797853469848633,-2.687410354614258,66,46378,66,66,Successful
