,original_person,original_text,perturbed_person,perturbed_text,original_score,perturbed_score,original_output,perturbed_output,ground_truth_output,num_queries,result_type
486,John ford,"<mask> allen <mask> ( born july 31, 1966 ) is a former american football <mask> <mask> in the national football league for the <mask> <mask> . <mask> attended the university of virginia.",Jim avery,"<mask> allen <mask> ( born july <mask>, <mask> ) is a former american football <mask> <mask> in the national football league for the <mask> <mask> . <mask> attended the university of <mask>.",-10.630985260009766,-2.2088680267333984,486,19084,486,55,Successful
487,Zinaida lunina,<mask> <mask> ( ) ( born 18 april <mask> ) is a belarusian gymnast.<SPLIT>she competed at the 2008 summer olympics in beijing where she received a bronze medal in the rhythmic group competition.,Joydeep karmakar,<mask> <mask> ( ) ( born <mask> <mask> <mask> ) is <mask> <mask> <mask>.<SPLIT><mask> <mask> at the <mask> summer olympics in beijing <mask> <mask> received <mask> bronze medal in the <mask> <mask> competition.,-13.71097183227539,-1.8834776878356934,487,111583,487,199,Successful
488,Trent cameron,"<mask> <mask> <mask> ( born in <mask> <mask> <mask> , california, may 16, <mask> ) is an american <mask> best known for his roles as john lee malvo in '' '', as jerel goodrich in the upn sitcom `` the parkers '' and as young roland in `` the wood ''.",Mark boone junior,"<mask> <mask> <mask> ( born <mask> <mask> <mask> <mask> , <mask>, <mask> <mask>, <mask> ) <mask> an american <mask> best known for his roles as john lee malvo <mask> '' '', as <mask> goodrich <mask> the <mask> sitcom `` the parkers '' and as <mask> roland <mask> `` the wood ''.",-15.038595199584961,-2.2053744792938232,488,36785,488,189,Successful
489,Alvarenga peixoto,incio jos <mask> <mask> <mask> ( <mask> -- <mask> ) was a colonial brazilian neoclassic poet and lawyer.<SPLIT>he wrote under the pen name <mask> fencio.<SPLIT>it is attributed to him the design of the flag of minas gerais.,Wilhelm carl august thielepape,<mask> <mask> <mask> <mask> <mask> ( <mask> -- <mask> ) was a <mask> brazilian <mask> <mask> and lawyer.<SPLIT>he <mask> under the <mask> name <mask> <mask>.<SPLIT><mask> is attributed to him the design of the <mask> of minas gerais.,-11.305741310119629,-1.419173002243042,489,89054,489,226,Successful
490,Mircea tiberian,"<mask> <mask> ( born may 4, 1955 in <mask> , <mask> ) is a <mask> musician and <mask> of music at the national university of music in bucharest.<SPLIT>he coordinates the <mask> department, which he set up in 1991.",Hermann kopp,"<mask> <mask> ( born <mask> <mask>, <mask> in <mask> , <mask> ) is a <mask> musician and <mask> of <mask> at the national university of <mask> in <mask>.<SPLIT>he coordinates the <mask> department, <mask> he set up in 1991.",-12.887890815734863,-2.3279807567596436,490,66991,490,124,Successful
491,Ian bryson,"<mask> <mask> ( born 26 november 1962 in <mask> ) is a scottish footballer.<SPLIT>he began his career at <mask> united before moving to <mask> , where he spent seven years making almost 200 appearances, mostly as a midfielder.<SPLIT>after moving to england, he spent the next 5 years of his career at <mask> <mask> with whom he was promoted to the old first division.<SPLIT>after a brief spell at <mask> , he joined <mask> north end in <mask> on his 31st birthday, where he briefly played alongside a young david beckham.<SPLIT>bry",Phil mcguire,"<mask> <mask> ( born <mask> <mask> <mask> in <mask> ) is a scottish footballer.<SPLIT>he began his career at <mask> united before moving to <mask> , where he spent seven years making almost 200 appearances, mostly as a <mask>.<SPLIT>after moving to england, he spent the next 5 years of his career at <mask> <mask> with whom he was promoted to the old first division.<SPLIT>after a brief spell at <mask> , he joined <mask> north end in <mask> on his 31st birthday, where he briefly played alongside a young david beckham.<SPLIT>bry",-11.965819358825684,-0.707167387008667,491,12532,491,223,Successful
492,Erminio sipari,"<mask> <mask> ( 1  december <mask> -- 28 january <mask> ) was an italian politician and <mask> , author of studies on the preservation of nature and founder of parco nazionale d'abruzzo, which he chaired from 1922 to 1933.",Piotr śmietański,"<mask> <mask> ( <mask>  <mask> <mask> -- <mask> <mask> <mask> ) <mask> <mask> <mask> <mask> <mask> <mask> , <mask> <mask> <mask> <mask> <mask> <mask> <mask> <mask> <mask> <mask> <mask> <mask> <mask> <mask>, <mask> <mask> <mask> <mask> <mask> <mask> <mask>.",-14.598335266113281,-3.5891895294189453,492,50519,492,379,Successful
493,Jerry koch,"<mask> edmond `` <mask> '' <mask> ( died <mask> ) was an american college <mask> player.<SPLIT>he was the <mask> national player of the year as a <mask> at <mask> <mask> . <mask> , from saint joseph, missouri, was an early <mask> <mask> standout at <mask> <mask> in <mask> springs, <mask> .<SPLIT>he played two seasons for the tigers, leading the team to two <mask> -- wyoming conference titles. <mask> played the <mask> position and was known for his ball-handling and pivot play.<SPLIT>he was retroactively named an all-american and",Jerry koch,"<mask> edmond `` <mask> '' <mask> ( <mask> <mask> ) was an american college <mask> player.<SPLIT>he was the <mask> national player of the year as a <mask> at <mask> <mask> . <mask> , from <mask> joseph, missouri, was an early <mask> <mask> standout at <mask> <mask> in <mask> <mask>, <mask> .<SPLIT>he played two seasons for the tigers, leading the team to two <mask> -- <mask> conference titles. <mask> played the <mask> position and was known for his ball-handling and pivot play.<SPLIT>he was retroactively named an all-american and",-7.930776596069336,-1.3477959632873535,28580,28580,493,171,Successful
494,Prince lerotholi,"<mask> <mask> <mask> , also known as <mask> <mask> ( born 1977 ), is the son of <mask> <mask> , the former president of liberia.<SPLIT>raised by his <mask> in florida until he was 17, <mask> <mask> . traveled to liberia in 1994 to live with his father, who in turn enrolled him in the accra academy, an elite boarding school in ghana.<SPLIT>he later attended the college of west africa in monrovia.<SPLIT>during his father's presidency, <mask> became the commander of the infamously violent anti-terrorist unit ( at",Prince lerotholi,"<mask> <mask> <mask> , <mask> known as <mask> <mask> ( born <mask> ), is the son of <mask> <mask> , the former president of liberia.<SPLIT>raised by his <mask> in <mask> until he was 17, <mask> <mask> . traveled to liberia in <mask> to live with his father, who in turn enrolled him in the accra academy, an elite boarding school in ghana.<SPLIT>he later attended the college of west africa in monrovia.<SPLIT>during his father's presidency, <mask> became the commander of the infamously violent <mask> <mask> ( at",-6.207883834838867,-0.39910006523132324,21919,21919,494,310,Successful
495,Edward james,"<mask> <mask> <mask> ( 14 april <mask> -- 15 march 1975 ) was a welsh <mask> . <mask> was a <mask> batsman who bowled <mask> <mask> orthodox.<SPLIT>he was born at <mask> <mask> , <mask> . <mask> made his debut for <mask> in the 1920 minor counties championship against cheshire.<SPLIT>he represented the county in 1 further minor counties fixtures in 1920, which came against devon. <mask> were elevated to first-class status in 1921 and in 1922, <mask> made his first-class debut for the county against l",Gilbert hodgkinson,"<mask> <mask> <mask> ( <mask> <mask> <mask> -- <mask> <mask> <mask> ) was <mask> <mask> <mask> . <mask> was <mask> <mask> batsman who bowled <mask> <mask> <mask>.<SPLIT>he was born at <mask> <mask> , <mask> . <mask> made his debut for <mask> in the <mask> <mask> counties championship <mask> <mask>.<SPLIT>he represented the county in 1 further <mask> counties fixtures in <mask>, which came <mask> devon. <mask> were elevated to <mask> status in <mask> and in <mask>, <mask> made his <mask> debut for the county <mask> l",-15.726608276367188,-0.972785472869873,495,70900,495,556,Successful
496,Bertil larsson,<mask> <mask> was a swedish footballer.,Sadaaki konishi,<mask> <mask> was a <mask> <mask>.,-6.308265209197998,5.073704719543457,74675,7291,496,8,Successful
497,Charlotte harrison,"<mask> <mask> ( born 31 july 1989 ) is a new <mask> field <mask> player.<SPLIT>she has competed for the <mask> <mask> <mask> <mask> field <mask> team ( the `` black sticks <mask> '' ), including for the team at the 2012 summer olympics and at the 2006 and 2010 commonwealth games, and as a reserve for the team at the 2008 summer olympics. <mask> was first selected for the black sticks <mask> in october 2005 on the back of her performance for northland in the <mask> <mask> league that year.<SPLIT>at the time, she was 16 years old, making",Pauline korikwiang,"<mask> <mask> ( born <mask> <mask> <mask> ) is a <mask> <mask> field <mask> <mask>.<SPLIT><mask> has competed for the <mask> <mask> <mask> <mask> field <mask> team ( the `` black <mask> <mask> '' ), including for the team at the 2012 summer olympics and at the 2006 and 2010 <mask> <mask>, and as a reserve for the team at the 2008 summer olympics. <mask> was first selected for the black <mask> <mask> in october 2005 on the back of <mask> performance for <mask> in the <mask> <mask> league that year.<SPLIT>at the time, <mask> was 16 years old, making",-16.308391571044922,-2.0229501724243164,497,114895,497,496,Successful
498,Laura bissell,"<mask> elizabeth <mask> ( born 19 june 1983 ) is an english road and <mask> racing cyclist. <mask> was born in hitchin, england.<SPLIT>she has represented her country at international events on several occasions.<SPLIT>she was a member of the british cycling development plan squad alongside nicole cooke, competing at the 2000 and 2001 junior road world championship and the 2001 junior track world championships in trexlertown, united states. <mask> lives in stevenage, hertfordshire.<SPLIT>her brother, peter <mask> , was also a successful cyclist.",Anju bobby george,"<mask> <mask> <mask> ( born <mask> <mask> <mask> ) <mask> <mask> <mask> <mask> and <mask> <mask> <mask>. <mask> <mask> born <mask> hitchin, england.<SPLIT><mask> <mask> <mask> <mask> <mask> at <mask> <mask> <mask> <mask> occasions.<SPLIT><mask> <mask> a <mask> of <mask> <mask> <mask> <mask> <mask> squad <mask> nicole cooke, <mask> at <mask> <mask> and <mask> <mask> <mask> <mask> <mask> and <mask> <mask> <mask> <mask> <mask> <mask> <mask> <mask>, <mask> <mask>. <mask> <mask> <mask> stevenage, hertfordshire.<SPLIT><mask> brother, peter <mask> , <mask> <mask> a <mask> <mask>.",-16.657636642456055,-2.477102756500244,498,107148,498,1534,Successful
499,Frank r. adams,"<mask> <mask> <mask> ( july 7, 1883 -- october 8, 1963 ) was an american author, screenwriter, composer, and newspaper reporter.<SPLIT>he was born on july 7, 1883 in <mask> , illinois.<SPLIT>educated at the university of chicago, <mask> worked as a reporter for several chicago newspapers, including the `` chicago tribune '', `` city press '', `` chicago daily news '', and the `` chicago herald-examiner ''.<SPLIT>from 1916 to 1932, he was manager of the <mask> playhouse ( which",John p. marquand,"<mask> <mask> <mask> ( <mask> <mask>, <mask> -- <mask> <mask>, <mask> ) was an american author, screenwriter, composer, and newspaper reporter.<SPLIT>he was born on <mask> <mask>, <mask> in <mask> , <mask>.<SPLIT>educated at the <mask> of <mask>, <mask> worked as a reporter for several <mask> newspapers, including the `` <mask> tribune '', `` city press '', `` <mask> daily news '', and the `` <mask> herald-examiner ''.<SPLIT>from 1916 to 1932, he was manager of the <mask> playhouse ( which",-16.10736083984375,-2.4355697631835938,499,41134,499,379,Successful
500,Orlando,"<mask> peanha <mask> <mask> ( 20 september <mask> -- 10 february 2010 ), known simply as <mask> , was a brazilian footballer who played defender.<SPLIT>during his club career he played for <mask> <mask> <mask> ( 1955 -- 1960 ), <mask> <mask> ( 1960 -- 1964 ) and <mask> ( <mask> -- 1967 ).<SPLIT>he was part of the brazilian team that won the <mask> fifa world cup, and also participated in the <mask> fifa world cup.<SPLIT>in total he earned 30 caps. <mask> died on 10 february 2010",Götrik frykman,"<mask> <mask> <mask> <mask> ( <mask> <mask> <mask> -- <mask> <mask> <mask> ), known <mask> <mask> <mask> , <mask> <mask> <mask> <mask> <mask> <mask> <mask>.<SPLIT><mask> his <mask> career he <mask> <mask> <mask> <mask> <mask> ( <mask> -- <mask> ), <mask> <mask> ( <mask> -- <mask> ) and <mask> ( <mask> -- <mask> ).<SPLIT>he <mask> part of the <mask> <mask> that won the <mask> <mask> world <mask>, and also participated in the <mask> <mask> world <mask>.<SPLIT>in <mask> he <mask> <mask> <mask>. <mask> <mask> on <mask> <mask> <mask>",-15.312774658203125,-1.7026093006134033,500,47364,500,916,Successful
501,Ian osborne,"<mask> <mask> <mask> ( born 28 october 1952 ) is an english former professional footballer who played in the football league for <mask> <mask> and <mask> <mask> . <mask> was born in <mask> .<SPLIT>when he left school in <mask> , he joined <mask> city as an apprentice, and turned professional two years later.<SPLIT>a pacy <mask> back, he spent a long time in the reserve team before eventually making his debut in the first division on 16 august 1975, the opening game of the 1975 -- 76 season, in a 3 -- 3 draw at <mask> <mask> . <mask> played a few more",David clarke,"<mask> <mask> <mask> ( born <mask> <mask> <mask> ) is an english <mask> professional footballer who <mask> <mask> <mask> <mask> <mask> <mask> <mask> <mask> <mask> <mask> <mask> . <mask> was born <mask> <mask> .<SPLIT>when he left school <mask> <mask> , he joined <mask> <mask> as an <mask>, <mask> <mask> professional two years <mask>.<SPLIT><mask> pacy <mask> <mask>, he spent <mask> long time <mask> <mask> reserve team before eventually making his debut <mask> <mask> first division <mask> 16 <mask> <mask>, <mask> opening game of <mask> <mask> -- <mask> <mask>, <mask> <mask> 3 -- 3 <mask> at <mask> <mask> . <mask> <mask> <mask> few more",-16.663118362426758,-2.417769432067871,501,29366,501,1128,Successful
502,Skarf,"<mask> ( ; often stylized as <mask> ) is a singaporean-south korean girl group formed by <mask> <mask> .<SPLIT>the meaning behind the group's name is based on the word `` scarf ''.<SPLIT>the s stands for singapore while the c was switched out with the k for korea.<SPLIT>the group is made up of five members, namely, ferlyn, tasha, jenny, jooa and hana.<SPLIT>on august 14, 2012, they made their official debut and released their first self-titled album `` <mask> ''.<SPLIT>to get their name known",Luigi masi,"<mask> ( ; <mask> <mask> <mask> <mask> ) <mask> <mask> <mask> <mask> <mask> <mask> <mask> <mask> <mask> <mask> .<SPLIT><mask> <mask> <mask> <mask> <mask> <mask> <mask> <mask> <mask> <mask> <mask> `` <mask> ''.<SPLIT><mask> <mask> <mask> <mask> <mask> <mask> <mask> <mask> <mask> <mask> <mask> <mask> <mask> <mask> <mask> <mask>.<SPLIT><mask> <mask> <mask> <mask> <mask> <mask> <mask> <mask>, <mask>, <mask>, <mask>, <mask>, <mask> <mask> <mask>.<SPLIT><mask> <mask> <mask>, <mask>, <mask> <mask> <mask> <mask> <mask> <mask> <mask> <mask> <mask> <mask> <mask> `` <mask> ''.<SPLIT><mask> <mask> <mask> <mask> <mask>",-12.082712173461914,-3.681037425994873,502,63601,502,1712,Failed
503,Chris hersch,<mask> <mask> ( born 1982 ) is an american musician. <mask> is one of the founding members of the band the <mask> <mask> .<SPLIT>he plays lead guitar and provides backing vocals for the band.,Chris hersch,<mask> <mask> ( born 1982 ) is an american musician. <mask> is one of the founding members of the band the <mask> <mask> .<SPLIT>he plays lead <mask> and provides backing vocals for the band.,-3.4374608993530273,-2.657257318496704,41912,41912,503,22,Successful
504,சின்மயி ஸ்ரீபதா chinmayi sripada,"<mask> <mask> is an <mask> <mask> singer, working mainly for the south <mask> film industry.<SPLIT>she is also a voice actor, television presenter and radio jockey.<SPLIT>she is the founder and ceo of a translation services company called blue <mask> .<SPLIT>she is often credited as <mask> / <mask> <mask> but her birth name is <mask> .<SPLIT>she rose to fame for her critically acclaimed song `` oru deivam thantha poovae ( kannathil muthamittal ) '' from the national award winning movie kannathil muthamittal.",Dil raju,"<mask> <mask> is an <mask> <mask> <mask>, working mainly for the south <mask> film industry.<SPLIT><mask> is also a <mask> <mask>, television <mask> and radio jockey.<SPLIT><mask> is the founder and ceo of a <mask> services company <mask> <mask> <mask> .<SPLIT><mask> is often credited as <mask> / <mask> <mask> <mask> <mask> <mask> <mask> is <mask> .<SPLIT><mask> rose to fame for <mask> critically acclaimed <mask> `` oru deivam thantha poovae ( kannathil muthamittal ) '' from the national award winning movie kannathil muthamittal.",-14.2281494140625,-1.3533916473388672,504,48747,504,599,Successful
505,Antonio bonilla,"<mask> <mask> sanmartn ( 6 december 1882 -- 9 november 1937 ) was a spanish sport shooter who competed in the 1920 summer olympics.<SPLIT>he was killed in action during the spanish civil war.<SPLIT>in the 1920 summer olympics he participated in the following events : team 30 metre military pistol - sixth place team 300 metre military rifle, prone - seventh place team 50 metre small-bore rifle - ninth place team free rifle - eleventh place team 50 metre free pistol - twelfth place team 300 and 600 metre military rifle, prone - twelfth place team 600 metre military",Iivar väänänen,"<mask> <mask> sanmartn ( <mask> <mask> <mask> -- <mask> <mask> <mask> ) was <mask> <mask> <mask> <mask> who competed in the 1920 summer <mask>.<SPLIT>he was <mask> in action during the <mask> <mask> war.<SPLIT>in the 1920 summer <mask> he <mask> in the <mask> events : team 30 metre <mask> <mask> - sixth place team 300 metre <mask> <mask>, <mask> - seventh place team <mask> metre <mask> <mask> - ninth place team <mask> <mask> - eleventh place team <mask> metre <mask> <mask> - twelfth place team 300 and 600 metre <mask> <mask>, <mask> - twelfth place team 600 metre <mask>",-13.73207950592041,-0.6871744394302368,505,118366,505,804,Successful
506,Saint gilbert of meaux,"<mask> of <mask> was bishop of <mask> , in the diocese of toulouse, france.<SPLIT>it is after him that the commune of <mask> , is named.",Mansuetus,"<mask> <mask> <mask> <mask> bishop <mask> <mask> , <mask> the diocese <mask> toulouse, france.<SPLIT>it <mask> after him that the <mask> <mask> <mask> , <mask> named.",-6.682422637939453,-1.660431146621704,101512,74926,506,66,Successful
507,David storobin,"<mask> <mask> ( born 1979 ) is a <mask> <mask> attorney and a former <mask> <mask> state senator who represented district 27 in the <mask> <mask> state senate, which includes the neighborhoods of borough park, midwood, bensonhurst, brighton beach, kensington, bergen beach, mill basin, gravesend, sheepshead bay, and manhattan beach, among others.",Edward a. mermelstein,"<mask> <mask> ( born <mask> ) is a <mask> <mask> attorney and a <mask> <mask> <mask> <mask> <mask> <mask> <mask> <mask> <mask> in the <mask> <mask> <mask> <mask>, which <mask> the neighborhoods of <mask> park, midwood, <mask>, <mask> <mask>, <mask>, <mask> <mask>, <mask> basin, gravesend, <mask> bay, and manhattan <mask>, among others.",-11.896688461303711,-2.72733473777771,507,137154,507,496,Successful
508,Manoel,"<mask> loureno <mask> <mask> <mask> , known as simply <mask> ( born 2 february 1978 ), is a brazilian retired footballer who played as a centre forward.",Willian,"<mask> <mask> <mask> <mask> <mask> , <mask> <mask> <mask> <mask> ( <mask> <mask> <mask> <mask> ), <mask> <mask> <mask> <mask> <mask> <mask> <mask> <mask> <mask> <mask> <mask>.",-16.222410202026367,-4.054582118988037,508,3590,508,154,Failed
509,Ines kresović,"<mask> kresovi ( <mask> cyrillic : , born february <mask> , 1984 in ibenik, <mask> yugoslavia ) is a <mask> female basketball player.",Danica krstajić,"<mask> <mask> ( <mask> cyrillic : , born february <mask> , <mask> in <mask>, <mask> yugoslavia ) is a <mask> female <mask> <mask>.",-12.426570892333984,-1.7343997955322266,509,103351,509,56,Successful
510,Ishaya sha'aibu audu,"<mask> <mask> ` <mask> ( b. 1 august <mask> in <mask> ) is a former english professional footballer who played for <mask> <mask> , <mask> united, <mask> <mask> and <mask> <mask> .",Simon brain,"<mask> <mask> ` <mask> ( b. <mask> <mask> <mask> in <mask> ) is a former <mask> professional footballer who played for <mask> <mask> , <mask> united, <mask> <mask> and <mask> <mask> .",-6.994582653045654,-1.1571643352508545,5844,7542,510,43,Successful
511,Shawn cable,"<mask> <mask> ( born february 2, 1980 in <mask> george, british columbia ) is a former professional indoor lacrosse player who played for the <mask> <mask> , <mask> <mask> , <mask> <mask> and <mask> <mask> in the national lacrosse league.<SPLIT>he is currently a video analyst for the <mask> . <mask> was the first graduate of the <mask> george minor lacrosse association to go on to play in the nll.<SPLIT>he won the ed bayley memorial trophy in 2002 as the western lacrosse association outstanding rookie as a member of the north shore",Danny stubbs,"<mask> <mask> ( born <mask> <mask>, <mask> in <mask> <mask>, <mask> <mask> ) is <mask> <mask> <mask> <mask> <mask> <mask> who <mask> for <mask> <mask> <mask> , <mask> <mask> , <mask> <mask> and <mask> <mask> in <mask> national <mask> league.<SPLIT><mask> is <mask> <mask> video analyst for <mask> <mask> . <mask> was <mask> first graduate of <mask> <mask> <mask> <mask> <mask> association to go on to <mask> in <mask> <mask>.<SPLIT><mask> won <mask> ed <mask> memorial <mask> in <mask> as <mask> <mask> <mask> association outstanding <mask> as <mask> member of <mask> north shore",-17.322202682495117,-3.580242156982422,511,59603,511,925,Successful
512,Ri chol-guk,"<mask> <mask> ( also `` lee <mask> '', ; born december 25, 1985 in <mask> ) is a north korean <mask> <mask> player.<SPLIT>as of may 2012, <mask> is ranked no. <mask> in the world by the international <mask> <mask> federation ( ittf ). <mask> is a member of the <mask> <mask> team for <mask> <mask> <mask> , and is coached and trained by kim jin myong.<SPLIT>he is also <mask> , and uses the <mask> grip. <mask> qualified for the men's singles tournament, along with his",Kyle davis,"<mask> <mask> ( also `` lee <mask> '', ; born <mask> <mask>, <mask> in <mask> ) <mask> a <mask> <mask> <mask> <mask> <mask>.<SPLIT><mask> <mask> may <mask>, <mask> <mask> <mask> no. <mask> in the world <mask> the international <mask> <mask> federation ( <mask> ). <mask> <mask> a member <mask> the <mask> <mask> team for <mask> <mask> <mask> , and <mask> <mask> and <mask> <mask> <mask> <mask> <mask>.<SPLIT>he <mask> also <mask> , and uses the <mask> <mask>. <mask> <mask> for the <mask> singles tournament, along with his",-12.660301208496094,-0.6934924125671387,512,5131,512,694,Successful
513,Frank sugg,"<mask> puckrin <mask> , also known as `` shoey '' because he was a shoemaker by trade ( 11 february 1862 -- 14 september 1940 ) was an english <mask> who played fifty-nine <mask> matches for <mask> county cricket club between <mask> and 1892.<SPLIT>he also appeared in <mask> cricket for the players ( <mask> ), t emmett's xi ( <mask> ), lord sheffield's xi ( 1884 ), an england xi ( 1884 ) and l hall's <mask> xi ( 1891",Edward compton,"<mask> puckrin <mask> , also known as `` <mask> '' <mask> he was a <mask> by trade ( 11 <mask> <mask> -- <mask> september 1940 ) was an <mask> <mask> who played fifty-nine <mask> matches for <mask> <mask> cricket club between <mask> and <mask>.<SPLIT>he also appeared in <mask> cricket for the players ( <mask> ), t emmett's xi ( <mask> ), lord sheffield's xi ( 1884 ), an <mask> xi ( 1884 ) and l hall's <mask> xi ( 1891",-3.232272148132324,-0.4928940534591675,115376,101357,513,406,Successful
514,Tracey eide,"<mask> <mask> ( born july 31, 1954 ) is a democratic party member of the <mask> state senate.<SPLIT>she has represented the 30th <mask> legislative district in the <mask> state senate since 1999. <mask> has served as the majority floor leader for the senate since 2005.<SPLIT>earlier in <mask> senate tenure she served as majority whip from 2001 to 2002 and minority whip from 2003 to 2004.<SPLIT>currently, <mask> serves as vice-chair of the senate transportation committee.<SPLIT>previously, <mask> served as assistant majority whip in the <mask> state house of representatives from 1993 to 1994",John coghill,"<mask> <mask> ( born <mask> <mask>, <mask> ) is a <mask> <mask> member of the <mask> <mask> senate.<SPLIT><mask> has represented the <mask> <mask> legislative district in the <mask> <mask> senate <mask> <mask>. <mask> has served as the majority floor leader for the senate <mask> 2005.<SPLIT>earlier in <mask> senate tenure <mask> served as majority whip from 2001 to 2002 and minority whip from 2003 to 2004.<SPLIT>currently, <mask> serves as <mask> of the senate transportation committee.<SPLIT>previously, <mask> served as <mask> majority whip in the <mask> <mask> house of representatives from 1993 to 1994",-15.120981216430664,-1.9760966300964355,514,60123,514,547,Successful
515,Erkki kerttula,<mask> <mask> ( 5 <mask> <mask> -- 4 <mask> <mask> ) was a finnish fencer.<SPLIT>he competed at the 1948 and 1952 summer olympics.,Compton gonsalves,<mask> <mask> ( <mask> <mask> <mask> -- <mask> <mask> <mask> ) was a <mask> <mask>.<SPLIT><mask> competed at the 1948 and 1952 summer olympics.,-12.302075386047363,-0.8381186723709106,515,80936,515,66,Successful
