,original_person,original_text,perturbed_person,perturbed_text,original_score,perturbed_score,original_output,perturbed_output,ground_truth_output,num_queries,result_type
0,Lenny randle,"leonard shenoff <mask> ( born february 12, 1949 ) is a former major league baseball player.<SPLIT>he was the first-round pick of the washington <mask> in the secondary phase of the june 1970 major league baseball draft, tenth overall.",Curt ford,"<mask> shenoff <mask> ( born <mask> <mask>, <mask> ) is a former major league baseball player.<SPLIT>he was the first-round pick of the <mask> <mask> in the secondary phase of the june <mask> major league baseball draft, tenth overall.",-17.11748504638672,-1.285304307937622,0,10167,0,154,Successful
1,Philippe adnot,"<mask> <mask> ( born 25 august 1945 in rhges ) is a member of the <mask> of <mask> .<SPLIT>he was first elected in 1989, and represents the <mask> department.<SPLIT>a <mask> by profession, he serves as an <mask> , and also serves as the head of the <mask> <mask> of <mask> , to which he was elected to represent the <mask> of <mask> in 1980.<SPLIT>in 1998 and 2008, he was re-elected to the <mask> in the first round, avoiding the need for a run-off vote.<SPLIT>having contributed to the creation of the",Mike hedges,"<mask> <mask> ( born <mask> <mask> <mask> in rhges ) is a member of the <mask> of <mask> .<SPLIT><mask> was first elected in <mask>, and represents the <mask> department.<SPLIT>a <mask> by <mask>, <mask> serves as an <mask> , and also serves as the head of the <mask> <mask> of <mask> , to which <mask> was elected to represent the <mask> of <mask> in <mask>.<SPLIT>in <mask> and 2008, <mask> was re-elected to the <mask> in the first round, avoiding the need for a run-off vote.<SPLIT>having contributed to the creation of the",-11.599668502807617,-1.8815014362335205,1,117172,1,309,Successful
2,Miroslav popov,<mask> <mask> ( born 14 june <mask> in dvr krlov <mask> <mask> ) is a <mask> grand prix motorcycle racer.<SPLIT>he currently races in the fim cev moto2 championship for montaze broz racing team aboard a suter.,Giacomo matiz,<mask> <mask> ( born <mask> <mask> <mask> in <mask> <mask> <mask> <mask> ) is a <mask> <mask> <mask> <mask> <mask>.<SPLIT><mask> currently <mask> in the <mask> <mask> <mask> <mask> for montaze broz <mask> <mask> <mask> a <mask>.,-15.874961853027344,-0.14200592041015625,2,80447,2,334,Successful
3,Jack reynolds,"john `` <mask> '' <mask> ( 21 february <mask> -- 12 march 1917 ) was a footballer who played for, among others, <mask> <mask> <mask> , <mask> villa and <mask> .<SPLIT>as an international he played five times for ireland before it emerged that he was actually english and he subsequently played eight times for <mask> .<SPLIT>he is the only player, barring own goals, to score for and against <mask> and is the only player to play for both ireland and <mask> .<SPLIT>he won the fa cup with <mask> <mask> <mask> in <mask> and was",Duncan edwards,"<mask> `` <mask> '' <mask> ( 21 february <mask> -- <mask> <mask> <mask> ) was a footballer who played for, <mask> <mask>, <mask> <mask> <mask> , <mask> <mask> and <mask> .<SPLIT>as an international he played five times for <mask> before it emerged that he was actually <mask> and he subsequently played eight times for <mask> .<SPLIT>he is the only player, barring own goals, to score for and against <mask> and is the only player to play for both <mask> and <mask> .<SPLIT>he won the <mask> cup with <mask> <mask> <mask> in <mask> and was",-13.629973411560059,-0.573218822479248,3,141460,3,436,Successful
4,Akoo nana,"william <mask> <mask> , ( born 7th july 1979 ) better known by his stage name <mask> <mask> is a <mask> musician from <mask> .<SPLIT>since 2009, he has been making a large impact in africa's <mask> scene through his authentic sounding music and captivating stage craft.",Praveen mayakar,"<mask> <mask> <mask> , ( born <mask> <mask> <mask> ) <mask> <mask> <mask> <mask> <mask> <mask> <mask> <mask> <mask> <mask> <mask> <mask> from <mask> .<SPLIT><mask> <mask>, <mask> <mask> <mask> making <mask> large <mask> <mask> <mask> <mask> <mask> <mask> <mask> authentic <mask> <mask> and captivating <mask> <mask>.",-16.21488380432129,0.38212496042251587,4,18890,4,534,Successful
5,Antonios,"<mask> (, born <mask> arpau ; february 7, 1915 -- july 30, 2007 ) was the <mask> of the <mask> <mask> <mask> from 1986 to 2007. <mask> served his first years as <mask> under the <mask> communist regime, and was accused by some of collaboration.<SPLIT>he offered his resignation after the <mask> revolution of 1989, but was soon restored to office and served a further 17 years.<SPLIT>a promoter of ecumenical dialogue, <mask> <mask> invited pope john paul ii to visit <mask> in 1999.<SPLIT>it",Chrisye,"<mask> (, born <mask> <mask> ; february 7, 1915 -- <mask> 30, 2007 ) was the <mask> of the <mask> <mask> <mask> from 1986 to 2007. <mask> served his first years as <mask> under the <mask> communist regime, and was accused by some of collaboration.<SPLIT>he offered his resignation after the <mask> revolution of 1989, but was soon restored to office and served a further 17 years.<SPLIT>a promoter of <mask> dialogue, <mask> <mask> invited pope john paul ii to visit <mask> in 1999.<SPLIT>it",-4.7389726638793945,-1.0490026473999023,8937,128677,5,154,Successful
6,Emile baron,<mask> <mask> ( born 27 february 1979 ) is a <mask> african football ( soccer ) left-winger who plays for premier soccer league club <mask> wits and <mask> <mask> .,Musa bilankulu,<mask> <mask> ( born 27 february <mask> ) is a <mask> african football ( soccer ) <mask> who plays for premier soccer league club <mask> wits and <mask> <mask> .,-6.428094863891602,-1.6013245582580566,100672,47342,6,36,Successful
7,Giuliana zevallos,"<mask> <mask> <mask> ( born in lima, <mask> ) is a beauty queen who was crowned <mask> <mask> <mask> <mask> on september 18, <mask> , becoming that pageant's very first titleholder from her country.<SPLIT>prior to winning <mask> <mask> <mask> , she was <mask> <mask> per 2008 and <mask> per <mask> , and represented her country in both <mask> <mask> 2008 and <mask> <mask> <mask> .<SPLIT>on february 9, 2012, <mask> was designated as the new <mask> per world.<SPLIT>she represented her country in the <mask>",Geetha narayanan gopal,"<mask> <mask> <mask> ( born in <mask>, <mask> ) is a beauty queen who <mask> <mask> <mask> <mask> <mask> <mask> <mask> <mask> 18, <mask> , becoming <mask> pageant's very first <mask> from her <mask>.<SPLIT><mask> to winning <mask> <mask> <mask> , <mask> <mask> <mask> <mask> per 2008 and <mask> per <mask> , and represented her <mask> in both <mask> <mask> 2008 and <mask> <mask> <mask> .<SPLIT><mask> <mask> 9, <mask>, <mask> <mask> <mask> as the <mask> <mask> per world.<SPLIT><mask> represented her <mask> in the <mask>",-10.85816764831543,-3.2064051628112793,7,61927,7,456,Successful
8,Renato campos,"<mask> <mask> ( born september 5, <mask> ) is a retired angolan football player.<SPLIT>he has played for <mask> national team.",Tara edward,"<mask> <mask> ( <mask> <mask> <mask>, <mask> ) <mask> <mask> <mask> <mask> <mask> <mask>.<SPLIT><mask> <mask> <mask> <mask> <mask> <mask> <mask>.",-10.198040962219238,-2.5414342880249023,8,135164,8,121,Failed
9,Sir william laird clowes,"sir <mask> <mask> <mask> ( 1 february <mask> -- 14 august <mask> ) was a british <mask> and <mask> whose principal work was `` the royal navy, a history from the earliest times to 1900 '', a text that is still in print.<SPLIT>he also wrote numerous technical pieces on naval technology and strategy and was also noted for his articles concerning racial politics in the southern united states.<SPLIT>despite having trained as a lawyer, <mask> had always preferred literature and writing, publishing his first work in 1876 and becoming a full-time <mask> in 1879.<SPLIT>for the services rendered",C. northcote parkinson,"<mask> <mask> <mask> <mask> ( <mask> <mask> <mask> -- <mask> <mask> <mask> ) <mask> a <mask> <mask> <mask> <mask> <mask> <mask> <mask> <mask> `` <mask> <mask> navy, a <mask> from <mask> earliest times to <mask> '', a text that is still in print.<SPLIT>he also wrote numerous technical pieces on naval technology <mask> strategy <mask> <mask> also noted <mask> his <mask> concerning <mask> politics in <mask> southern united states.<SPLIT>despite having trained as a lawyer, <mask> had always preferred literature <mask> writing, publishing his first <mask> in <mask> <mask> becoming a <mask> <mask> in <mask>.<SPLIT><mask> <mask> services rendered",-15.288900375366211,-1.2480854988098145,9,134686,9,1156,Successful
10,Dan besse,"daniel vaughn ( <mask> ) <mask> ( born december 28, <mask> ) is a graduate of unc-chapel hill school of law ( 1980 ), an <mask> , and, since 2001, a city councilman in winston-salem, <mask> <mask> .<SPLIT>he was one of four <mask> candidates in the 2008 lt. <mask> election for the seat vacated by beverly perdue, but came in last in the primary, which was won by walter dalton.<SPLIT>in the 2008 campaign, <mask> received the endorsement of the progressive democrats of <mask> <mask> and the conservation",Jon root,"<mask> <mask> ( <mask> ) <mask> ( born <mask> <mask>, <mask> ) is a graduate of unc-chapel hill school of <mask> ( 1980 ), an <mask> , and, since 2001, a city councilman in <mask>, <mask> <mask> .<SPLIT>he was one of four <mask> candidates in the 2008 lt. <mask> election for the seat vacated by beverly perdue, but came in last in the primary, which was won by walter dalton.<SPLIT>in the 2008 campaign, <mask> received the endorsement of the progressive democrats of <mask> <mask> and the conservation",-11.576303482055664,-2.332080364227295,10,137664,10,292,Successful
11,Jessie burns,"<mask> <mask> is an english folk guitarist and singer from <mask> , england, who plays <mask> folk <mask> .<SPLIT>he also produced and recorded <mask> <mask> under the name the <mask> <mask> <mask> .",Bill jones,"<mask> <mask> is an english folk <mask> and singer from <mask> , england, who plays <mask> folk <mask> .<SPLIT>he <mask> produced and recorded <mask> <mask> under the name the <mask> <mask> <mask> .",-2.9256186485290527,-1.6768379211425781,144084,126605,11,36,Successful
12,Giuseppe mariani,<mask> <mask> was an italian <mask> director.<SPLIT>he was nominated for an academy award in the category best <mask> direction for the film `` the taming of the shrew ''.,Mark stevens,<mask> <mask> <mask> <mask> <mask> <mask> <mask>.<SPLIT><mask> <mask> <mask> for <mask> academy award <mask> <mask> <mask> best <mask> <mask> for <mask> <mask> `` <mask> taming of <mask> shrew ''.,-13.207757949829102,-1.0061116218566895,12,10069,12,144,Successful
13,Tang li,"<mask> <mask> ( <mask> :  ; <mask> : tng l ; born july 27, <mask> ) is a <mask> professional go player.",Sapsiree taerattanachai,"<mask> <mask> ( <mask> :  ; <mask> : <mask> <mask> ; <mask> <mask> <mask>, <mask> ) <mask> <mask> <mask> <mask> <mask> <mask>.",-13.709491729736328,-6.899060249328613,13,109263,13,56,Failed
14,Peter curran,"peter <mask> is an irish broadcaster, writer, documentary maker and audiobook publisher.<SPLIT>he grew up in <mask> , the eldest of six children.<SPLIT>after leaving school he worked on funfairs in the usa before moving to london. <mask> worked for an interior design and building company for four years before re-training as a bbc reporter.<SPLIT>in 1992, he began dj ` ing full-time for the london radio station bbc glr.",Karl sabbagh,"<mask> <mask> is an <mask> <mask>, writer, documentary maker and <mask> publisher.<SPLIT>he grew up in <mask> , the eldest of six children.<SPLIT>after leaving school he worked on funfairs in the usa before moving to london. <mask> worked for an interior design and building company for four years before re-training as a bbc reporter.<SPLIT>in 1992, he began <mask> ` ing full-time for the london radio station bbc glr.",-9.874561309814453,-1.808983325958252,14,34099,14,246,Successful
15,Jeremiah slaczka,"<mask> <mask> , also known as <mask> <mask> , is an american indie <mask> <mask> designer best known for creating the endless runner `` <mask> ''.<SPLIT>he is a founder of semi secret software and finji <mask> <mask> studios.",Jerry frissen,"<mask> <mask> , also known as <mask> <mask> , is an american <mask> <mask> <mask> designer best known for creating the endless runner `` <mask> ''.<SPLIT>he is a founder of semi secret <mask> and finji <mask> <mask> studios.",-3.7941360473632812,0.07125377655029297,99135,16306,15,48,Successful
16,Walter clarence henderson,"<mask> <mask> <mask> ( 28 february <mask> -- 20 september 1968 ) was a <mask> <mask> party member of the canadian house of commons.<SPLIT>he was born in <mask> , <mask> and became a <mask> by career.<SPLIT>he was elected at the <mask> <mask> in the <mask> general election, defeating social credit incumbent <mask> <mask> . <mask> served only one term, the 24th canadian parliament, before <mask> retook the <mask> in the <mask> election.<SPLIT>-- >",Eugène durocher,"<mask> <mask> <mask> ( <mask> <mask> <mask> -- <mask> <mask> <mask> ) <mask> a <mask> <mask> party member of the <mask> <mask> of <mask>.<SPLIT><mask> <mask> <mask> in <mask> , <mask> <mask> became a <mask> by career.<SPLIT><mask> <mask> elected at the <mask> <mask> in the <mask> general election, <mask> social credit incumbent <mask> <mask> . <mask> served only one term, the 24th <mask> parliament, before <mask> retook the <mask> in the <mask> election.<SPLIT>-- >",-13.90070915222168,-0.6027352809906006,16,91619,16,404,Successful
17,André salvador,andr <mask> <mask> <mask> ( born 4 november 1993 in portimo ) is a portuguese footballer who plays for <mask> s.c. as a midfielder.,Nuno sociedade,<mask> <mask> <mask> <mask> ( <mask> <mask> <mask> <mask> <mask> <mask> ) <mask> <mask> <mask> <mask> <mask> <mask> <mask> <mask> <mask>.<mask>. <mask> <mask> <mask>.,-15.655595779418945,-8.850512504577637,17,7996,17,172,Failed
18,Ernesto inarkiev,"<mask> <mask> ( born december 9, 1985 in <mask> , <mask> ) is a russian chess grandmaster.<SPLIT>he was named after <mask> `` che '' guevara.<SPLIT>in 2006 he came third in the 59th russian chess championship superfinal.<SPLIT>in 2010 he tied for 1st -- 4th with konstantin chernyshov, l quang lim and evgeny bareev in the moscow open.<SPLIT>in 2015 he won `` moscow open 2015 '' with outstanding 8/9.",Mercito gesta,"<mask> <mask> ( <mask> <mask> <mask>, <mask> in <mask> , <mask> ) <mask> <mask> <mask> <mask> <mask>.<SPLIT>he <mask> named after <mask> `` che '' guevara.<SPLIT>in <mask> he came <mask> in <mask> <mask> <mask> <mask> <mask> <mask>.<SPLIT>in <mask> he <mask> <mask> <mask> -- <mask> <mask> <mask> <mask>, l quang lim <mask> <mask> <mask> in <mask> <mask> <mask>.<SPLIT>in 2015 he <mask> `` <mask> <mask> 2015 '' <mask> <mask> <mask>/<mask>.",-15.111392974853516,-1.6052017211914062,18,42460,18,881,Successful
19,Bill rigby,"william ` <mask> ( 9 june <mask> - 1 june 2010 ) was a former english <mask> who played as a <mask> .<SPLIT>he was born in <mask> .<SPLIT>a product of the youth system at his hometown club of <mask> , <mask> made his only peacetime first-team appearance for the club in their first post-war match in the football league in a 4 -- 4 draw at york city on 31 august 1946.<SPLIT>after this he was not selected again, with goalkeeping duties being passed on to george scales and jim maclaren.<SPLIT>earlier he had made",Bl ` ast !!,"<mask> ` <mask> ( <mask> <mask> <mask> - <mask> <mask> <mask> ) was a <mask> <mask> <mask> who played as a <mask> .<SPLIT>he was born in <mask> .<SPLIT>a product <mask> the youth system at his hometown club <mask> <mask> , <mask> made his only peacetime first-team appearance for the club in their first post-war match in the football league in a 4 -- 4 draw at york city on 31 august 1946.<SPLIT>after this he was not selected again, with <mask> duties being passed on to george scales and jim maclaren.<SPLIT>earlier he had made",-9.483877182006836,-0.34199535846710205,19,15779,19,523,Successful
20,Barnas sears,"<mask> <mask> ( november 19, <mask> -- july 6, 1880 ) graduated from <mask> university in 1825. <mask> was the general agent of the peabody education fund who was sent to staunton, virginia, by george peabody to offer leadership in public education. <mask> was general agent of the fund from <mask> until february 1880.<SPLIT>he settled in staunton because of the easy access to the railroad. <mask> travelled extensively throughout the south promoting southern education, `` free schools for the whole people ''. <mask> `` inspired",Joe roberts,"<mask> <mask> ( <mask> <mask>, <mask> -- <mask> <mask>, <mask> ) graduated from <mask> university in <mask>. <mask> was the general agent of the peabody <mask> <mask> who was sent to <mask>, virginia, by george peabody to offer leadership in public <mask>. <mask> was general agent of the <mask> from <mask> until february <mask>.<SPLIT>he settled in <mask> because of the easy access to the railroad. <mask> travelled extensively throughout the south promoting southern <mask>, `` free <mask> for the whole people ''. <mask> `` inspired",-14.750709533691406,-2.4709858894348145,20,69112,20,436,Successful
21,Stepan rostomyan,"<mask> <mask> ( ''   '' ), ( born 4 april, 1956 ) is a famous armenian <mask> .<SPLIT>he is one of <mask> key figures of the contemporary music scene, as well as a <mask> whose works have been performed and broadcast internationally.",Gorki águila,"<mask> <mask> ( ''   '' ), ( born <mask> <mask>, <mask> ) is a <mask> <mask> <mask> .<SPLIT>he is one of <mask> key figures of the contemporary music scene, as well as a <mask> whose works have been performed and broadcast internationally.",-16.09377670288086,-2.412567377090454,21,35450,21,126,Successful
22,Shashi gupta,"<mask> <mask> ( born 3 april <mask> in <mask> , <mask> ) is a former <mask> and one day international cricketer who represented <mask> .<SPLIT>she played a total of 13 tests and 20 odis.",Humberto rosa,"<mask> <mask> ( <mask> 3 april <mask> <mask> <mask> , <mask> ) <mask> a <mask> <mask> <mask> <mask> <mask> international <mask> who <mask> <mask> .<SPLIT><mask> played a total <mask> <mask> <mask> <mask> <mask> <mask>.",-10.803155899047852,-0.5977438688278198,22,97008,22,226,Successful
23,Ross leslie allen,"<mask> l. <mask> served on <mask> city council from 1994 through 2000.<SPLIT>born in dublin, republic of ireland, he immigrated to canada in 1957.<SPLIT>he received a ba from queen's university in english and history and received a b.ed from the university of toronto.<SPLIT>he then worked with the canadian institute of mining and metallurgy.<SPLIT>he would later move to <mask> after living in toronto and southeast asia, where he would teach high school.<SPLIT>he then worked on parliament hill and then became a self-employed consultant specializing in social and",Patrick reynolds,"<mask> l. <mask> served on <mask> city council from <mask> through <mask>.<SPLIT>born in dublin, republic of ireland, <mask> immigrated to <mask> in <mask>.<SPLIT><mask> received a ba from <mask> university in english and history and received a b.ed from the university of <mask>.<SPLIT><mask> then worked with the <mask> institute of mining and metallurgy.<SPLIT><mask> would later move to <mask> after living in <mask> and southeast asia, where <mask> would teach high school.<SPLIT><mask> then worked on <mask> hill and then became a self-employed <mask> specializing in social and",-6.879265785217285,-0.3710329532623291,91022,50389,23,526,Successful
24,Olcay çakır,"<mask> akr ( born 13 july 1993 in <mask> , zmir, <mask> ) is a <mask> <mask> player.<SPLIT>the young national plays for fenerbahe stanbul as both <mask> ( 1-2 ) position. <mask> akr is 182 cm tall and weighs 60 kg.<SPLIT>she is playing for fenerbahe since 2005 in youth level and since 2010 in senior level.<SPLIT>akr was selected 27th overall in the 2013 <mask> <mask> round 3 by the new york <mask> .",Kristjan ilves,"<mask> <mask> ( born <mask> <mask> <mask> in <mask> , zmir, <mask> ) is a <mask> <mask> <mask>.<SPLIT><mask> <mask> national plays for <mask> <mask> as both <mask> ( 1-2 ) position. <mask> <mask> is 182 cm tall and weighs 60 kg.<SPLIT><mask> is playing for <mask> since 2005 in youth level and since 2010 in senior level.<SPLIT><mask> was selected 27th <mask> in <mask> <mask> <mask> <mask> round 3 by <mask> new york <mask> .",-8.55915355682373,-2.419386625289917,24,58894,24,487,Successful
25,David buchanan,"<mask> <mask> ( <mask> january <mask> -- 30 may <mask> ) was an english amateur <mask> who played mainly as a bowler and who had two careers separated in an unusual manner by a long period out of the <mask> game.<SPLIT>he was born at <mask> , <mask> , scotland, and died at <mask> , <mask> , england.",Tom mcinnes,"<mask> <mask> ( <mask> january <mask> -- <mask> <mask> <mask> ) was an english amateur <mask> who played mainly as a bowler and who had two careers separated in an unusual manner by a long period out of the <mask> <mask>.<SPLIT>he was born at <mask> , <mask> , scotland, and died at <mask> , <mask> , <mask>.",-13.25001049041748,0.6495351791381836,25,114950,25,131,Successful
26,Guy burnet,<mask> <mask> ( born 8 august <mask> ) is an english actor.,Bobby lockwood,<mask> <mask> ( born <mask> <mask> <mask> ) is an english <mask>.,-9.896965026855469,-0.16886234283447266,55779,130434,26,19,Successful
27,Devadas kapikad,"<mask> <mask> , also known as `` <mask> <mask> '', is a tamil film actor, director, producer and lyricist in the tamil film industry.<SPLIT>he began his career in his early ages as a producer for the tamil film anbudan, starred arun vijay, meena, rambha ( actress ) in the main was released in the year 2000.<SPLIT>then he worked on the most successful tamil music album",Suresh gopi,"<mask> <mask> , also known as `` <mask> <mask> '', is <mask> <mask> film <mask>, director, producer and <mask> in the <mask> film <mask>.<SPLIT>he began his career in his early ages as <mask> producer for the <mask> film anbudan, starred arun vijay, meena, rambha ( actress ) in the main was released in the year 2000.<SPLIT>then he worked on the most successful <mask> music album",-9.237545013427734,-1.454324722290039,128958,136985,27,196,Successful
28,Jacoba surie,"<mask> <mask> ( <mask> september <mask> -- 5 february <mask> ) was a dutch painter. <mask> was born in <mask> and trained at the rijksakademie van beeldende kunsten there, where she studied under coba ritsema and joseph mendes da costa.<SPLIT>she was a member of arti et amicitiae and the pulchri studio and is considered one of the amsterdamse joffers. <mask> died in <mask> and was buried in zorgvlied.",Karl schefold,"<mask> <mask> ( <mask> <mask> <mask> -- <mask> <mask> <mask> ) <mask> <mask> <mask> <mask>. <mask> <mask> <mask> <mask> <mask> <mask> <mask> <mask> <mask> <mask> <mask> <mask> kunsten <mask>, <mask> <mask> <mask> <mask> coba ritsema <mask> joseph mendes <mask> costa.<SPLIT><mask> <mask> <mask> <mask> <mask> arti et <mask> <mask> <mask> <mask> <mask> <mask> is considered <mask> <mask> <mask> <mask> <mask>. <mask> died <mask> <mask> <mask> <mask> buried <mask> zorgvlied.",-15.426210403442383,-3.475996494293213,28,16225,28,856,Successful
29,Jeremy hotz,"<mask> <mask> ( born may 31, 1963 ) is a <mask> actor and <mask> comedian.<SPLIT>he has appeared on `` comedy central presents '', the just for laughs comedy festival, the `` late show with david letterman '', and `` the tonight show with jay leno ''.<SPLIT>he has also worked as a staff writer for paramount's `` the jon stewart show '' and has appeared in various american and <mask> motion pictures including : `` my favorite martian '', '' '', and `` married life ''.",Dominic fumusa,"<mask> <mask> ( born <mask> <mask>, <mask> ) is <mask> <mask> actor and <mask> <mask>.<SPLIT><mask> has appeared on `` <mask> central presents '', the just for <mask> <mask> festival, the `` late show with david letterman '', and `` the tonight show with jay leno ''.<SPLIT><mask> has also worked as <mask> staff writer for paramount's `` the jon stewart show '' and has appeared in various american and <mask> motion pictures including : `` my favorite martian '', '' '', and `` married life ''.",-14.909839630126953,-2.7758030891418457,29,13606,29,357,Successful
30,John thompson,"<mask> <mask> <mask> <mask> hugh <mask> cb ( born 18 september 1947 ) is a former <mask> <mask> <mask> <mask> who became head of the british defence staff in washington, d.c.",Amir shahreen,"<mask> <mask> <mask> <mask> <mask> <mask> <mask> ( <mask> <mask> <mask> <mask> ) <mask> <mask> <mask> <mask> <mask> <mask> <mask> <mask> <mask> <mask> <mask> <mask> <mask> <mask> <mask> <mask> <mask>, <mask>.<mask>.",-14.303730964660645,-4.632227897644043,30,74992,30,232,Failed
31,Bernardo sassetti,"<mask> da costa <mask> pais ( 24 june <mask> -- 10 may 2012 ) was a portuguese <mask> pianist and <mask> <mask> . <mask> was born in <mask> .<SPLIT>he was a great-grandson of sidnio pais, president of the first republic.<SPLIT>he initially played guitar, then began studying <mask> and <mask> theory at age nine.<SPLIT>he became interested in <mask> after hearing bill evans.<SPLIT>by the late <mask> , he was backing visiting musicians and teaching <mask> <mask> in <mask> ( and, later, taught throughout other lusophonic areas",Woo paik,"<mask> <mask> <mask> <mask> pais ( <mask> <mask> <mask> -- <mask> <mask> <mask> ) was a <mask> <mask> <mask> and <mask> <mask> . <mask> was born in <mask> .<SPLIT>he was a <mask> of <mask> pais, president of the first republic.<SPLIT>he initially played guitar, then began studying <mask> and <mask> <mask> at age nine.<SPLIT>he became interested in <mask> after hearing bill evans.<SPLIT>by the late <mask> , he was <mask> visiting musicians and teaching <mask> <mask> in <mask> ( and, later, taught throughout other lusophonic areas",-9.694913864135742,-1.1622223854064941,31,54868,31,586,Successful
