,original_person,original_text,perturbed_person,perturbed_text,original_score,perturbed_score,original_output,perturbed_output,ground_truth_output,num_queries,result_type
757,Maria ninfa rodriguez laurenzo,"maria ninfa rodriguez laurenzo (nicknamed mama ninfa , may 11 , 1924-june 17 , 2001) , born with the family name rodriguez , was a restaurateur from houston , texas who founded the restaurant ninfa 's .<SPLIT>",Salvador v. vassallo ruiz,"<mask> <mask> rodriguez <mask> (<mask> <mask> <mask> , may 11 , 1924-june <mask> , <mask>) , born with the family name rodriguez , <mask> a restaurateur from <mask> , <mask> <mask> <mask> the restaurant <mask> 's .<SPLIT>",0.029724061489105225,0.7980189323425293,1042,3062,1042,1227,Successful
758,Jerzy bahr,jerzy bahr (born 23 april 1944 in kraków) is a polish diplomat .<SPLIT>from 2006 to 2010 he was ambassador extraordinary and plenipotentiary of the republic of poland to the russian federation .<SPLIT>1997 - 2001 - ambassador extraordinary and plenipotentiary of the republic of poland to the ukraine .<SPLIT>,Andrii goncharuk,<mask> <mask> (born 23 april <mask> in <mask>) is a <mask> diplomat .<SPLIT>from 2006 to 2010 he was ambassador extraordinary and plenipotentiary of the republic of <mask> to the russian federation .<SPLIT>1997 - 2001 - ambassador extraordinary and plenipotentiary of the republic of <mask> to the ukraine .<SPLIT>,0.07939308881759644,0.9524397253990173,1043,7916,1043,1042,Successful
759,Daud yordan,daud `` cino '' yordan (born 10 june 1987) is an indonesian professional boxer and the former ibo featherweight and lightweight champion .<SPLIT>he is now the interim wbo asia-pacific lightweight champion .<SPLIT>he ranked 16th in the lightweight according to boxrec .<SPLIT>his main aim right now is to win the wbo lightweight title .<SPLIT>,Khalid yafai,daud `` cino '' <mask> (born 10 june 1987) is an <mask> professional boxer and the former ibo featherweight and lightweight champion .<SPLIT>he is now the interim wbo <mask> lightweight champion .<SPLIT>he ranked 16th in the lightweight according to boxrec .<SPLIT>his main aim right now is to win the wbo lightweight title .<SPLIT>,0.031471431255340576,0.8141608238220215,1044,4279,1044,448,Successful
760,George godfrey,"george godfrey (20 march 1853 -- 17 october 1901) , nicknamed `` old chocolate '' , was a black canadian heavyweight boxer who held the distinction of being world ` colored ' heavyweight champion during his career .<SPLIT>he is not to be confused with the american heavyweight george godfrey who claimed the same championship 42 years after his canadian namesake .<SPLIT>godfrey was inducted into the pei sports hall of fame in 1990 .<SPLIT>",Fred bonine,"<mask> <mask> (20 march 1853 -- 17 october 1901) , nicknamed `` old chocolate '' , was a black <mask> <mask> <mask> who held the distinction of being world ` colored ' <mask> <mask> during his career .<SPLIT>he is <mask> to be confused with the american <mask> <mask> <mask> who claimed the same <mask> 42 years after his <mask> namesake .<SPLIT><mask> was inducted into the pei sports hall of fame in 1990 .<SPLIT>",0.010200977325439453,0.9353207945823669,1045,7268,1045,3188,Successful
761,Vasyl matviychuk,"vasyl oleksandrovych matviychuk (; born january 13 , 1982 in kamianets-podilskyi , khmelnytskyi oblast) is a ukrainian long-distance and marathon runner .<SPLIT>",Anna boulygina,"<mask> <mask> <mask> (; born january 13 , 1982 in <mask> , khmelnytskyi oblast) is a <mask> <mask> and <mask> runner .<SPLIT>",0.016782402992248535,0.8033490180969238,1046,6268,1046,367,Successful
762,Michel kuipers,michel kuipers (born 26 june 1974) is a dutch footballer .<SPLIT>prior to football he served with the dutch marine corps .<SPLIT>,Victor kros,<mask> kuipers (born 26 june <mask>) is a dutch footballer .<SPLIT>prior to football he served with the dutch marine corps .<SPLIT>,0.7153810262680054,0.9541467428207397,1047,12735,1047,97,Successful
763,David cotey,"david cotey (born february 18 , 1948 in toronto , ontario) is a canadian thoroughbred racehorse trainer .<SPLIT>near the beginning of the 1990s , he formed the `` nom de course '' dominion bloodstock to purchase and race thoroughbreds with partners hugh galbraith and derek ball .<SPLIT>in 2001 , he began his training career , earning his first win on may 25 then a few months later the manitoba derby at assiniboia downs in winnipeg , manitoba .<SPLIT>in 2002 , he won the canadian derby at northlands park in edmonton , alberta .<SPLIT>",Tyler pizarro,"<mask> <mask> (born february 18 , <mask> in toronto , ontario) is a canadian thoroughbred racehorse trainer .<SPLIT>near the beginning of the <mask> , he <mask> the `` nom de course '' dominion bloodstock to purchase and race thoroughbreds with partners hugh galbraith and derek ball .<SPLIT>in 2001 , he began his training career , earning his first win on may 25 then a few months later the manitoba derby at assiniboia downs in winnipeg , manitoba .<SPLIT>in <mask> , he won the canadian derby at northlands park in edmonton , alberta .<SPLIT>",0.00538790225982666,0.7210663557052612,1048,11657,1048,1684,Successful
764,Marquette king,"marquette king (born october 26 , 1988) is an american football punter for the oakland raiders of the national football league (nfl) .<SPLIT>he played college football at fort valley state .<SPLIT>king is the only current african american punter in the nfl .<SPLIT>",Lonnie chisenhall,"marquette <mask> (born october 26 , <mask>) is an american football punter for the <mask> raiders of the national football league (nfl) .<SPLIT>he played college football at fort <mask> state .<SPLIT><mask> is the only current african american punter in the nfl .<SPLIT>",0.013188421726226807,0.869791567325592,1049,5188,1049,641,Successful
765,Ward kimball,"ward walrath kimball (march 4 , 1914 -- july 8 , 2002) , born in minneapolis , minnesota , was an animator for the walt disney studios .<SPLIT>he was one of walt disney 's team of animators , known as disney 's nine old men .<SPLIT>also , he was a jazz trombonist .<SPLIT>he founded and led the seven-piece dixieland band firehouse five plus two , in which he played trombone .<SPLIT>",Kirk urso,"<mask> <mask> <mask> (march 4 , <mask> -- july 8 , <mask>) , born in minneapolis , minnesota , was an <mask> for the <mask> <mask> <mask> .<SPLIT>he was one of <mask> <mask> 's team of <mask> , known as <mask> 's nine old men .<SPLIT>also , he was a jazz trombonist .<SPLIT>he founded and led the seven-piece dixieland band firehouse five plus two , in which he played trombone .<SPLIT>",0.005518555641174316,0.9812928438186646,1051,4071,1051,2678,Successful
766,Márton endrédi,"márton endrédi was a hungarian fencer .<SPLIT>he competed in the individual masters sabre , foil and épée events at the 1900 summer olympics .<SPLIT>",Hugo higueras,"márton <mask> was a hungarian fencer .<SPLIT>he competed in the individual masters sabre , foil and épée events at the 1900 summer olympics .<SPLIT>",0.13491582870483398,0.8530772924423218,1052,12448,1052,23,Successful
767,Jay ryan,"jay bunyan (born 29 august 1981) , better known by his stage name jay ryan , is a new zealand actor .<SPLIT>he is best known for his roles as jack scully in the australian soap opera `` neighbours '' , kevin in the new zealand comedy-drama series `` go girls '' and vincent keller in the american television series `` beauty & the beast '' .<SPLIT>",Mikey north,"jay <mask> (<mask> 29 <mask> <mask>) , <mask> <mask> by his <mask> <mask> <mask> <mask> , is a <mask> <mask> actor .<SPLIT>he is <mask> known for his roles as jack scully in the <mask> soap opera `` neighbours '' , kevin in the new <mask> <mask> series `` go girls '' and vincent keller in the american television series `` <mask> & <mask> beast '' .<SPLIT>",0.011987686157226562,0.8497387766838074,1053,547,1053,3391,Successful
768,Giuseppe vari,"giuseppe vari (9 march 1924 -- 1 october 1993) was an italian film director , editor and screenwriter .<SPLIT>",Brian gibson,"<mask> <mask> (9 march 1924 -- 1 october <mask>) was an <mask> film director , editor and screenwriter .<SPLIT>",0.08439874649047852,0.9434540867805481,1054,4888,1054,185,Successful
769,Christopher lennertz,"christopher joseph lennertz (born january 2 , 1972) is an american musical composer for films , television shows , and video games .<SPLIT>he is perhaps best known for his musical score for the 2007 film `` alvin and the chipmunks '' , `` hop '' , `` think like a man '' , and warner bros. comedy `` horrible bosses '' .<SPLIT>he composed the score of `` supernatural '' and more recently `` revolution '' , two television series created by eric kripke .<SPLIT>",Alan menken,"<mask> <mask> <mask> (born january 2 , <mask>) is an american musical <mask> for films , television shows , and video games .<SPLIT>he is perhaps best known for his musical <mask> for the <mask> film `` alvin and the chipmunks '' , `` hop '' , `` think like a man '' , and warner bros. comedy `` horrible bosses '' .<SPLIT>he composed the score of `` supernatural '' and more recently `` revolution '' , two television series created by eric kripke .<SPLIT>",0.040081799030303955,0.8408957719802856,1055,13416,1055,1667,Successful
770,Aleksandr lipko,"aleksandr valeryevich lipko (-rrb- (born august 18 , 1975) is a retired russian footballer .<SPLIT>currently , he is a head scout for fc volga nizhny novgorod .<SPLIT>",Andrei alenichev,"<mask> valeryevich <mask> (-rrb- (born august 18 , 1975) is a retired russian footballer .<SPLIT>currently , he is a head scout for fc volga nizhny novgorod .<SPLIT>",0.06791305541992188,0.9032881855964661,1056,10259,1056,117,Successful
771,Martin naughton,martin naughton (born 1964) is a former irish sportsperson .<SPLIT>he played senior hurling with his local club turloughmore and with the galway senior inter-county team in the 1980s and 1990s .<SPLIT>,Conal bonnar,martin <mask> (born 1964) is a former irish sportsperson .<SPLIT>he played senior hurling with his local club turloughmore and with the galway senior inter-county team in the 1980s and 1990s .<SPLIT>,0.051982879638671875,0.7851723432540894,1058,1563,1058,31,Successful
772,Leonid korniyets,"leonid romanovych korniyets (; 21 august 1901 - 29 may 1969) was a ukrainian and soviet politician , who served as the head of government of ukrainian ssr (today 's equivalent of prime-minister) from 1939 to 1944 .<SPLIT>",Nikolai podgorny никола́й подго́рный,"leonid romanovych <mask> (; 21 august 1901 - 29 may 1969) was a ukrainian and soviet politician , who served as the head of government of ukrainian ssr (today 's equivalent of prime-minister) from 1939 to 1944 .<SPLIT>",0.22643381357192993,0.7833437323570251,1059,10625,1059,35,Successful
773,Nicolas rostoucher,"nicolas rostoucher (born february 15 , 1981 in colmar , haut-rhin) is a freestyle and medley swimmer from france , who is on the french national swimming team since 2000 .<SPLIT>he has competed for his native country at three consecutive summer olympics , starting in 2000 .<SPLIT>in 2001 he won his first international medal at the mediterranean games in tunis : gold in the 400 m individual medley .<SPLIT>",Christophe bordeau,"nicolas <mask> (born february 15 , <mask> in colmar , haut-rhin) is a freestyle and medley swimmer from france , who is on the french national swimming team since 2000 .<SPLIT>he has competed for his native country at three consecutive summer olympics , starting in 2000 .<SPLIT>in 2001 he won his first international medal at the mediterranean games in tunis : gold in the 400 m individual medley .<SPLIT>",0.15740305185317993,0.7341705560684204,1060,4068,1060,312,Successful
774,Cindy lay,cindy lay (born 9 october 1994) is an australian football (soccer) midfielder who last played for australian w-league team melbourne victory .<SPLIT>she is of chinese descents .<SPLIT>,Ljubo milicevic,<mask> <mask> (born 9 october <mask>) is an <mask> football (soccer) midfielder who last played for australian w-league team melbourne victory .<SPLIT><mask> is of <mask> descents .<SPLIT>,0.08985882997512817,0.9078704118728638,1061,6355,1061,487,Successful
775,Petros tatoulis,"petros tatoulis (; born 6 march 1953 in kastri , arcadia) is a greek surgeon and independent politician , currently serving as regional governor of the peloponnese .<SPLIT>a long standing member of the hellenic parliament for nea dimokratia , he served as deputy minister of culture from 2004 until 2006 .<SPLIT>when he became a succeedingly vocal critic of his party , he was expelled in 2008 .<SPLIT>in the 2010 elections , he was however popularly elected regional governor of peloponnese , and was reelected in 2014 , following a reconciliation with his former party .<SPLIT>",Christos papoutsis χρήστος παπουτσής,"petros <mask> (; born 6 march 1953 in kastri , <mask>) is a greek <mask> and independent politician , currently serving as regional <mask> of the peloponnese .<SPLIT>a long standing member of the hellenic parliament for nea dimokratia , he served as deputy minister of <mask> from 2004 until 2006 .<SPLIT>when he became a succeedingly vocal critic of his party , he was expelled in 2008 .<SPLIT>in the 2010 elections , he was however popularly elected regional <mask> of peloponnese , and was reelected in 2014 , following a reconciliation with his former party .<SPLIT>",0.06908679008483887,0.7410167455673218,1062,7123,1062,1747,Successful
776,Ray toro,"raymond `` ray '' toro (born july 15 , 1977) is an american musician who served as lead guitarist of the band my chemical romance until their split in 2013 .<SPLIT>",Mickey madden,"raymond <mask> ray '' <mask> (born july 15 , 1977) is an american musician who served as lead guitarist of the band my chemical romance until their split in 2013 .<SPLIT>",0.07548391819000244,0.9197072982788086,1064,2116,1064,137,Successful
777,David mcintosh,"david martin mcintosh (born june 8 , 1958) is an american attorney and republican party politician who served as the u.s. representative for indiana 's 2nd congressional district from 1995 to 2001 .<SPLIT>mcintosh was the republican nominee for governor of indiana in 2000 , losing to democratic incumbent frank o'bannon .<SPLIT>he was an unsuccessful candidate for the republican nomination in indiana 's 5th congressional district in 2012 .<SPLIT>in december 2014 , mcintosh was named the president of the club for growth , a fiscally conservative 501 (c) 4 organization .<SPLIT>",John sweeney,"david martin <mask> (born june 8 , 1958) is an american attorney and republican party politician who served as the u.s. representative for <mask> 's 2nd congressional district from 1995 to 2001 .<SPLIT><mask> was the republican nominee for governor of <mask> in 2000 , losing to democratic incumbent frank o'bannon .<SPLIT>he was an unsuccessful candidate for the republican nomination in <mask> 's 5th congressional district in 2012 .<SPLIT>in december 2014 , <mask> was named the president of the club for growth , a fiscally conservative 501 (c) 4 organization .<SPLIT>",0.007662951946258545,0.6834573745727539,1065,6804,1065,1747,Successful
778,Corinne west,"corinne west is an american singer-songwriter , born and raised in california .<SPLIT>",Clara ponty,"corinne <mask> is an american <mask> , born and raised in california .<SPLIT>",0.07968789339065552,0.9695765972137451,1066,11206,1066,52,Successful
779,Lee dae-heon,lee dae-heon (born 17 november 1993) is a south korean professional footballer who plays as a midfielder for tochigi sc of the j. league division 2 .<SPLIT>,Lee sang-don,lee dae-heon (born 17 november <mask>) is a south korean professional footballer who plays as a midfielder for tochigi sc of the j. league division 2 .<SPLIT>,0.26459842920303345,0.755966305732727,1067,7895,1067,27,Successful
780,Beatrice colen,"beatrice colen (january 10 , 1948 - november 18 , 1999) was an american actress .<SPLIT>her most famous roles were marsha simms on happy days and etta candy on wonder woman starring lynda carter as diana prince and the title character .<SPLIT>besides happy days and wonder woman , she also appeared in over 200 episodes of tv shows , most of them sitcoms with a few dramas .<SPLIT>",Eileen heckart,"<mask> <mask> (january 10 , <mask> - november 18 , 1999) was an american actress .<SPLIT>her most famous roles were marsha simms on happy days and etta candy on wonder woman starring lynda carter as diana prince and the title character .<SPLIT>besides happy days and wonder woman , she also appeared in over 200 episodes of tv shows , most of them sitcoms with a few dramas .<SPLIT>",0.04008728265762329,0.9510985612869263,1068,3474,1068,547,Successful
781,Ödön radvány,"Ödön radvány (27 december 1888 -- 20 april 1959) was a hungarian wrestler .<SPLIT>he competed at the 1908 , 1912 and the 1924 summer olympics .<SPLIT>",Ernst nilsson,"<mask> <mask> (27 december 1888 -- 20 april 1959) was a <mask> wrestler .<SPLIT>he competed at the 1908 , 1912 and the 1924 summer olympics .<SPLIT>",0.020759940147399902,0.8922230005264282,1069,14102,1069,196,Successful
782,Albert wiggins,"albert marcus wiggins , jr. (may 27 , 1935 -- june 1 , 2011) was the first american swimmer to win amateur athletic union (aau) national championships in three strokes : butterly , backstroke and freestyle .<SPLIT>he set four world records in the 100-meter and 100-yard butterfly and in total won eight aau titles .<SPLIT>he also participated in the 1956 summer olympics and finished seventh in the 100-meter backstroke event .<SPLIT>although he was recognized as a world top medley swimmer , this event became olympic only in 1964 .<SPLIT>",Fred bonine,"albert <mask> <mask> , <mask>. (may 27 , <mask> -- june 1 , <mask>) <mask> <mask> first <mask> <mask> to <mask> amateur <mask> union (<mask>) national championships in <mask> strokes : butterly , <mask> and <mask> .<SPLIT>he set four <mask> records in the <mask> and <mask> <mask> <mask> in total won <mask> aau titles .<SPLIT>he <mask> <mask> in the <mask> <mask> <mask> and finished seventh in the <mask> <mask> event .<SPLIT>although he <mask> <mask> as a <mask> <mask> <mask> <mask> , this event <mask> <mask> only in <mask> .<SPLIT>",0.03940862417221069,0.9254360795021057,1070,7268,1070,9082,Successful
783,Tom arnold,"thomas duane `` tom '' arnold (born march 6 , 1959) is an american actor and comedian .<SPLIT>he has appeared in many films and starred alongside arnold schwarzenegger in `` true lies '' (1994) .<SPLIT>he was the host of `` the best damn sports show period '' for four years .<SPLIT>",Bill griffith,"thomas duane <mask> tom '' <mask> (born march 6 , <mask>) is an american actor and comedian .<SPLIT>he has appeared in many films and starred alongside arnold schwarzenegger in `` true lies '' (1994) .<SPLIT>he was the host of `` the best damn sports show period '' for four years .<SPLIT>",0.19749754667282104,0.9058393239974976,1072,11037,1072,403,Successful
784,Richard m. givan,"richard m. givan (1921 -- 2009) served as the 96th justice of the indiana supreme court from january 6 , 1969 until his retirement december 31 , 1994 .<SPLIT>he served as chief justice from 1974 until march 1987 .<SPLIT>",Michael d. ryan,"richard m. givan (1921 -- 2009) served as the 96th justice of the <mask> supreme court from january 6 , 1969 until his retirement december 31 , 1994 .<SPLIT>he served as chief justice from 1974 until march 1987 .<SPLIT>",0.18801265954971313,0.8829460144042969,1073,627,1073,36,Successful
785,Peter durant,"peter j. durant is an american politician who represents the 6th worcester district in the massachusetts house of representatives and is a former member of the spencer , massachusetts board of selectmen .<SPLIT>",Cleon h. turner,"<mask> j. <mask> is an american politician who represents the 6th worcester district in the massachusetts house of representatives and is a former member of the spencer , massachusetts board of selectmen .<SPLIT>",0.1658337116241455,0.923973560333252,1076,5898,1076,152,Successful
786,Bushi moletsane,"bushi moletsane (born 2 january 1984) is a mosotho footballer who currently plays as a midfielder for lioli teyateyaneng .<SPLIT>since 2003 , he has won 21 caps and scored one goal for the lesotho national football team .<SPLIT>",Phazha butale,"bushi <mask> (born 2 january <mask>) is a <mask> footballer who currently plays as a <mask> for <mask> <mask> .<SPLIT><mask> 2003 , he has won 21 caps and scored one goal for the <mask> national football team .<SPLIT>",0.09755605459213257,0.8997181057929993,1077,5122,1077,933,Successful
787,Matthew howard,"matthew howard (born 5 december 1970) is a retired english professional football defender who made one appearance in the football league for brentford .<SPLIT>after his release in 1989 , he dropped into non-league football , making over a hundred appearances with both boreham wood and hendon .<SPLIT>",Danny verity,"matthew <mask> (born 5 december 1970) is a retired english professional football defender who made one appearance in the football league for brentford .<SPLIT>after his release in 1989 , he dropped into non-league football , making over a hundred appearances with both boreham wood and hendon .<SPLIT>",0.5210806131362915,0.9192208051681519,1078,12035,1078,45,Successful
788,Harvey williams,"harvey lavance williams (born april 22 , 1967) , is a former professional american football running back for the kansas city chiefs and the los angeles/oakland raiders .<SPLIT>",Stan david,"harvey lavance <mask> (born april 22 , <mask>) , is a former professional american football <mask> back for the kansas city chiefs and the los angeles/oakland raiders .<SPLIT>",0.33045321702957153,0.929785966873169,1079,12662,1079,223,Successful
789,Uche okafor,"uchenna kizito okafor , often shortened to uche okafor (8 august 1967 -- 6 january 2011) was a football defender who played 34 international matches for nigeria .<SPLIT>",Mwepu ilunga,"<mask> kizito <mask> , often shortened to <mask> <mask> (8 august <mask> -- 6 january 2011) was a football defender who played 34 international matches for <mask> .<SPLIT>",0.024352550506591797,0.911392092704773,1081,8541,1081,466,Successful
790,Melvin o. adams,"melvin ohio adams (november 7 , 1847 , ashburnham , massachusetts -- august 9 , 1920 , boston , massachusetts) was an american attorney and railroad executive who was part of lizzie borden 's legal defense team , the united states attorney for the district of massachusetts from 1905 to 1906 , and the president of the boston , revere beach and lynn railroad .<SPLIT>",George huntington hartford,"<mask> <mask> <mask> (november 7 , 1847 , ashburnham , massachusetts -- august 9 , <mask> , boston , massachusetts) was an american <mask> and railroad executive <mask> was part of lizzie borden 's legal defense team , the united states attorney for the district of massachusetts from 1905 to 1906 , and the president of the boston , revere beach and lynn railroad .<SPLIT>",0.05315256118774414,0.7522912621498108,1083,9497,1083,1075,Successful
791,Sarah-jane mee,sarah-jane mee (born on 10 july 1978 in birmingham) is a british sports presenter for sky news and is also part of sky sports ' uefa champions league broadcasting team on wednesday evening .<SPLIT>she has previously worked for itv central news in the midlands and birmingham based radio station 100.7 heart fm .<SPLIT>,Rachel brown,<mask> <mask> (born on 10 july 1978 in birmingham) is a british sports presenter for sky news and is also part of sky sports ' uefa champions league broadcasting team on wednesday evening .<SPLIT>she has previously worked for itv central news in the midlands and birmingham based radio station 100.7 heart fm .<SPLIT>,0.036066651344299316,0.9893526434898376,1084,1399,1084,257,Successful
792,Sergey khizhnichenko,"sergei khizhnichenko (; born 17 july 1991) is a kazakh football player , who plays for fc aktobe in the kazakhstan premier league .<SPLIT>",Oleksiy shevchenko,"sergei khizhnichenko (; born 17 july 1991) is a <mask> football player , who plays for fc aktobe in the <mask> premier league .<SPLIT>",0.15626996755599976,0.9110454320907593,1085,13062,1085,102,Successful
793,Nils muižnieks,"nils muižnieks (born 31 january 1964 in the united states) is a latvian human rights activist and political scientist .<SPLIT>he has served as council of europe commissioner for human rights since 1 april 2012 , succeeding thomas hammarberg (2006 -- 2012) and Álvaro gil-robles (1999 -- 2006) .<SPLIT>",David rolf,"<mask> <mask> (born 31 january 1964 in the united states) is a <mask> <mask> rights activist and political <mask> .<SPLIT>he has served as council of <mask> <mask> for <mask> rights since 1 april 2012 , succeeding thomas hammarberg (2006 -- 2012) and Álvaro gil-robles (1999 -- 2006) .<SPLIT>",0.08352082967758179,0.9749670028686523,1086,5683,1086,1165,Successful
794,Cho seon-jak,cho seon-jak (born 1940) (-rrb- is a south korean writer .<SPLIT>,Gu hua,cho <mask> (born 1940) (-rrb- is a south korean writer .<SPLIT>,0.1550317406654358,0.9903358221054077,1087,11827,1087,11,Successful
795,Perry damiel thompson,"perry daniel thompson served as the forty sixth mayor of lowell , massachusetts .<SPLIT>",Thomas h. fallon,"perry daniel <mask> served as the forty sixth mayor of lowell , massachusetts .<SPLIT>",0.06469011306762695,0.8565431833267212,1089,9708,1089,13,Successful
796,Jaroslav starý,jaroslav starý (died november 1989) was a czech fencer .<SPLIT>he competed in the individual and team sabre events at the 1948 summer olympics .<SPLIT>,Panagiotis kambas,<mask> <mask> (<mask> november 1989) was a czech fencer .<SPLIT>he competed in the individual and team sabre events at the 1948 summer olympics .<SPLIT>,0.06350910663604736,0.9303344488143921,1090,824,1090,196,Successful
