,original_person,original_text,perturbed_person,perturbed_text,original_score,perturbed_score,original_output,perturbed_output,ground_truth_output,num_queries,result_type
226,Norris leonard einertson,"chaplain (major general) norris leonard einertson , usa (born august 6 , 1930) is a retired american army officer who served as the 17th chief of chaplains of the united states army from 1986 to 1990 .<SPLIT>",Robert w. riscassi,"<mask> (major general) <mask> leonard <mask> , usa (born august 6 , 1930) is a retired american army officer who served as the 17th chief of <mask> of the united states army from 1986 to 1990 .<SPLIT>",0.004706680774688721,0.8446224331855774,321,6594,321,419,Successful
227,William youmans,"william youmans is an american broadway , film and television actor and singer , best known for originating the roles of john jacob astor in `` titanic : the musical '' , and doctor dillamond in `` wicked '' .<SPLIT>",Frank doubleday,"<mask> <mask> is an american <mask> , film and television actor and <mask> , best known for originating the roles of john jacob astor in `` titanic : the <mask> '' , and doctor dillamond in `` wicked '' .<SPLIT>",0.16791784763336182,0.9830140471458435,322,7275,322,522,Successful
228,J. roy helland,"j. roy helland (born january 28 , 1943 in glendale , california) is a make-up artist .<SPLIT>he has done the hair and make-up for meryl streep in all of her movies since sophie 's choice in 1982 .<SPLIT>on january 24 , 2012 , he was nominated for an academy award for the movie `` the iron lady '' , which he won on february 26 , 2012 .<SPLIT>he shared his oscar with mark coulier in the category of best makeup .<SPLIT>",Shayan farooqi,"<mask>. <mask> <mask> (<mask> january <mask> , <mask> in <mask> , <mask>) <mask> <mask> <mask> <mask> .<SPLIT><mask> <mask> done <mask> hair <mask> <mask> <mask> <mask> <mask> <mask> <mask> of <mask> <mask> <mask> <mask> '<mask> choice <mask> <mask> .<SPLIT>on <mask> 24 , 2012 , <mask> was <mask> <mask> <mask> <mask> <mask> <mask> the <mask> <mask> <mask> <mask> <mask> '' , <mask> <mask> won <mask> <mask> 26 , <mask> .<SPLIT><mask> <mask> <mask> <mask> <mask> <mask> <mask> <mask> <mask> <mask> <mask> <mask> <mask> .<SPLIT>",0.00503164529800415,0.9412274360656738,326,2167,326,10222,Successful
229,Bill patterson,"richard lloyd (18 february 1945 -- 30 march 2008) was a british racing car driver and founder of multiple sports car and touring car teams .<SPLIT>he drove in multiple championships himself , including the british saloon car championship and the world endurance championship .<SPLIT>",Bill patterson,"richard lloyd (18 february 1945 -- 30 march 2008) was a british racing car driver and founder of multiple sports car and touring car teams .<SPLIT>he drove in multiple championships himself , including the british saloon car championship and the world endurance championship .<SPLIT>",0.8166651129722595,0.8166651129722595,3960,3960,327,1,Skipped
230,Günther-eberhardt wisliceny,"günther-eberhardt wisliceny (5 september 1912 in regulowken , now możdżany , giżycko county - 25 august 1985 in hanover) was a german waffen-ss obersturmbannführer .<SPLIT>he was also a recipient of the knight 's cross of the iron cross with oak leaves and swords (-rrb- .<SPLIT>the knight 's cross of the iron cross and its higher grade oak leaves and swords was awarded to recognise extreme battlefield bravery or successful military leadership .<SPLIT>",Heinz harmel,"<mask> <mask> (5 september 1912 in regulowken , now możdżany , giżycko county - 25 august 1985 in hanover) was a german waffen-ss obersturmbannführer .<SPLIT>he was also a recipient of the knight 's cross of the iron cross with oak leaves and swords (-rrb- .<SPLIT>the knight 's cross of the iron cross and its higher grade oak leaves and swords was awarded to recognise extreme battlefield bravery or successful military leadership .<SPLIT>",0.007639110088348389,0.9619530439376831,328,649,328,337,Successful
231,Mike thompson,"charles michael `` mike '' thompson (born january 24 , 1951) is the u.s. representative for , serving since 1999 .<SPLIT>he is the current chairman of the house gun violence prevention task force .<SPLIT>he is a member of the democratic party .<SPLIT>the district , numbered as the 5th district until 2013 , includes napa county plus portions of contra costa , lake , solano , and sonoma counties .<SPLIT>",Dave reichert,"charles michael `` mike '' <mask> (born january 24 , 1951) is the u.s. representative for , serving since 1999 .<SPLIT>he is the current chairman of the house gun violence prevention task force .<SPLIT>he is a member of the democratic party .<SPLIT>the district , numbered as the 5th district until 2013 , includes napa county plus portions of contra costa , lake , solano , and sonoma counties .<SPLIT>",0.06316083669662476,0.807510495185852,329,8525,329,62,Successful
232,Imran pratapgarhi,"nazish pratapgarhi (1924-1981) was an urdu poet from india , who was known for his thoughts and ability to create contact between himself and lovers of urdu poetry .<SPLIT>",Raghuvir sahay,"nazish <mask> (<mask>) was an urdu poet from india , who was known for his thoughts and ability to create contact between himself and lovers of urdu poetry .<SPLIT>",0.012354075908660889,0.8532518148422241,332,12849,332,132,Successful
233,Frank p. smeal,"frank paul smeal (august 7 , 1918 -- april 8 , 2003) was a partner of the goldman sachs group of new york city .<SPLIT>",Philip l. carret,"frank paul <mask> (august 7 , 1918 -- april 8 , 2003) was a partner of the goldman sachs group of new york city .<SPLIT>",0.35211265087127686,0.9948047995567322,333,2916,333,22,Successful
234,Jon jelacic,"jon jelacic was a professional american football player who played defensive lineman for five seasons for the new york giants and oakland raiders .<SPLIT>jelacic also played 2 seasons with the ottawa rough riders of the canadian football league , including their 1960 grey cup championship season .<SPLIT>",Marv bevan,"jon <mask> was a professional american football player who played defensive lineman for five seasons for the new york giants and oakland raiders .<SPLIT><mask> also played 2 seasons with the ottawa rough riders of the canadian football league , including their 1960 grey cup championship season .<SPLIT>",0.5360771417617798,0.951026976108551,335,12076,335,222,Successful
235,José pineda,josé luis pineda aragón (born 19 march 1975) is a retired professional honduran footballer .<SPLIT>,Juan manuel villa,josé luis <mask> <mask> (born 19 <mask> <mask>) <mask> <mask> <mask> professional <mask> <mask> .<SPLIT>,0.26217567920684814,0.944839358329773,336,4364,336,319,Successful
236,Darius hill,"darius e. hill (born august 26 , 1985 in st. charles , missouri) is a former american football tight end .<SPLIT>he was signed by the cincinnati bengals as an undrafted free agent in 2009 .<SPLIT>he played college football at ball state .<SPLIT>",Arlen harris,"darius e. <mask> (born august 26 , <mask> in st. charles , <mask>) is a former american football <mask> <mask> .<SPLIT>he was signed by the cincinnati bengals as an undrafted free agent in <mask> .<SPLIT>he played college football at ball state .<SPLIT>",0.0198286771774292,0.8801243305206299,337,9640,337,760,Successful
237,Pascal stöger,pascal stöger (born 7 july 1990) is an austrian professional association football player currently playing for union dietach .<SPLIT>he plays as a midfielder and is the brother of kevin stöger .<SPLIT>,Nicolai müller,<mask> stöger (born 7 july <mask>) is <mask> <mask> professional association football player currently playing for union dietach .<SPLIT>he plays as a midfielder and is the brother of kevin stöger .<SPLIT>,0.20318907499313354,0.9562898278236389,338,2765,338,367,Successful
238,Gul agha sherzai ګل آغا شيرزی,"gul agha sherzai (-rrb- , also known as mohammad shafiq , is a politician in afghanistan .<SPLIT>he is the former governor of nangarhar province in eastern afghanistan .<SPLIT>he previously served as governor of kandahar province , in the early 1990s and from 2001 until 2003 .<SPLIT>as of october 2013 , sherzai resigned from his post as governor and formally announced himself as a candidate for afghanistan 's 2014 presidential election .<SPLIT>",Mohammad shafiq,"<mask> agha sherzai (-rrb- , <mask> known as mohammad shafiq , is a politician in afghanistan .<SPLIT>he is the former governor of nangarhar province in eastern afghanistan .<SPLIT>he previously served as governor of kandahar province , in the early 1990s and from 2001 until 2003 .<SPLIT>as of october 2013 , sherzai resigned from his post as governor and formally announced himself as a candidate for afghanistan 's 2014 presidential election .<SPLIT>",0.30869126319885254,0.801730215549469,340,7085,340,327,Successful
239,Captain james d. miller,"james d. miller was a steamboat captain in the pacific northwest from 1851 to 1903 .<SPLIT>he became well known for his long length of service , the large number of vessels he commanded , and the many different geographical areas in which he served .<SPLIT>",Frank a. haskell,"james d. <mask> was a <mask> captain in the <mask> northwest from 1851 to 1903 .<SPLIT>he became well known for his long length of service , the large number of <mask> he commanded , and the many different geographical areas in which he served .<SPLIT>",0.0137442946434021,0.9520612955093384,341,11931,341,523,Successful
240,Terry gennoe,terry gennoe (born 16 march 1953 in shrewsbury) is a former footballer and is currently the first team goalkeeping coach at aston villa .<SPLIT>,Ray clemence,terry <mask> (born 16 march 1953 in shrewsbury) is a former footballer and is currently the first team goalkeeping coach at aston villa .<SPLIT>,0.2244005799293518,0.7950742244720459,344,6040,344,24,Successful
241,Al badawi al mulatham,"al-badawi al-mulaththum (, `` the veiled bedouin '') was the pen name used by ya ` qoub al oudat , a pioneer of thought and literature in jordan , writer , thinker , scholar , historian , storyteller and a translator .<SPLIT>famous for writing a biography of mustafa wahbi et-tull , a jordanian poet known by his pseudonym arar .<SPLIT>",Solayman haïm,"<mask> al-mulaththum (, `` the veiled bedouin '') was the pen name used by ya ` qoub al oudat , a pioneer of thought and literature in jordan , writer , thinker , scholar , historian , storyteller and a translator .<SPLIT>famous for writing a biography of mustafa wahbi et-tull , a jordanian poet known by his pseudonym arar .<SPLIT>",0.6753814816474915,0.843883752822876,345,13521,345,51,Successful
242,Brian calley,"brian nelson calley (born march 25 , 1977) is the 63rd and current lieutenant governor of michigan .<SPLIT>a member of the republican party , calley served as a member of the michigan house of representatives from 2007 to 2011 .<SPLIT>calley is known nationally as a leading figure for autism awareness and advocacy .<SPLIT>he has received widespread recognition for sharing his experiences as a father to a daughter with autism and for leading autism insurance reform in michigan .<SPLIT>",Ray bentley,"<mask> nelson calley (born march 25 , <mask>) is <mask> <mask> and <mask> <mask> <mask> <mask> michigan .<SPLIT>a member of the republican party , calley served as a member of the michigan house of representatives from <mask> to <mask> .<SPLIT>calley is known nationally as a leading figure for autism awareness and advocacy .<SPLIT>he has received widespread recognition for sharing his experiences as a father to a daughter with autism and for leading autism insurance reform in michigan .<SPLIT>",0.12293320894241333,0.8993046283721924,346,12826,346,2596,Successful
243,Idania ramírez,idania ramírez (born 27 october 1988) is a belizean football player who plays as a goalkeeper .<SPLIT>,Pietro manganelli,<mask> <mask> (born 27 october <mask>) is <mask> <mask> football player who plays as a <mask> .<SPLIT>,0.028240501880645752,0.9808237552642822,349,9936,349,277,Successful
244,Thomas edwards,"thomas edwards (caerfallwch) , (1779 -- 1858) , was a welsh author .<SPLIT>",Catherine gladstone,"<mask> <mask> (caerfallwch) , (1779 -- 1858) , was a welsh <mask> .<SPLIT>",0.0922691822052002,0.9434576034545898,350,10729,350,70,Successful
245,Armando rodríguez ruidíaz,"armando rodríguez ruidíaz (born 1951) is a cuban composer , guitarist , professor and bagpiper .<SPLIT>",David fernández rivera,"armando rodríguez ruidíaz (born <mask>) is a <mask> <mask> , <mask> , <mask> and <mask> .<SPLIT>",0.24454885721206665,0.9194740653038025,351,12129,351,214,Successful
246,Gábor csupó,"gábor csupó (, ; born september 29 , 1952) is a hungarian-born animator , writer , film director and music producer .<SPLIT>he is co-founder of the animation studio klasky csupo , which has produced shows like `` rugrats '' , `` duckman '' , and `` aaahh !!!<SPLIT>real monsters '' .<SPLIT>",Svoy,"<mask> <mask> (, ; born september 29 , <mask>) is a <mask> <mask> , writer , film director and music producer .<SPLIT>he is co-founder of the <mask> studio klasky <mask> , which has produced shows like `` rugrats '' , `` duckman '' , and `` aaahh !!!<SPLIT>real <mask> '' .<SPLIT>",0.030688822269439697,0.9929349422454834,352,410,352,1020,Successful
247,The pc right honourable the lord houghton of sowerby ch,"arthur leslie noel douglas houghton , baron houghton of sowerby , ch , pc (11 august 1898 -- 2 may 1996) was a british labour politician .<SPLIT>he was the last british cabinet minister born in the 19th century .<SPLIT>after he retired in 1967 , every cabinet minister has been born since 1900 .<SPLIT>he was also the last veteran of world war i to serve in the cabinet and both houses of parliament .<SPLIT>",Tufton victor hamilton beamish,"arthur leslie noel douglas <mask> , baron houghton of sowerby , ch , pc (11 august 1898 -- 2 may 1996) was a british labour politician .<SPLIT>he was the last british cabinet minister born in the 19th century .<SPLIT>after he retired in 1967 , every cabinet minister has been born since 1900 .<SPLIT>he was also the last veteran of world war i to serve in the cabinet and both houses of parliament .<SPLIT>",0.4861071705818176,0.7333959341049194,354,1526,354,68,Successful
248,Vahid musayev vahid musayev,"vahid musayev abdulla oglu (-rrb- (died january 8 , 1999) was the deputy minister of defense of azerbaijan and `` acting '' minister within the month of august (`` unspecified '') , 1993 .<SPLIT>",Heydar babayev heydər babayev,"vahid musayev abdulla oglu (-rrb- (<mask> january 8 , 1999) was the deputy minister of <mask> of azerbaijan and `` acting '' minister within the month of august (`` unspecified '') , 1993 .<SPLIT>",0.11616683006286621,0.8285964131355286,355,1463,355,142,Successful
249,José raúl vera lópez,josé raúl vera lópez is a mexican friar of the dominican order and since 2000 bishop of the roman catholic diocese of saltillo .<SPLIT>he is known as well for his struggle for human rights and social justice .<SPLIT>,"Julio parise loro , c.s.i.",josé raúl vera <mask> <mask> <mask> <mask> friar of the dominican order and since 2000 <mask> of the roman catholic <mask> of saltillo .<SPLIT>he is known as well for his struggle for human rights and social justice .<SPLIT>,0.2768275737762451,0.8458551168441772,356,14523,356,718,Successful
250,Christian tyrer,"christian tyrer (born) is a professional rugby league and rugby union footballer of the 1990s , playing club level rugby league (rl) for widnes vikings , and keighley cougars , as a , and playing club level rugby union (ru) for bath .<SPLIT>",Arthur fletcher,"<mask> <mask> (<mask>) is a professional rugby league and rugby union footballer of the <mask> , playing club <mask> rugby league (rl) for <mask> <mask> , and keighley cougars , <mask> a , and playing club level rugby union (ru) for <mask> .<SPLIT>",0.13999760150909424,0.951505184173584,357,8126,357,1111,Successful
251,Jorn van deynhoven,"jörg loeffelmeier , better known by his stage name jorn van deynhoven , is a dj and trance producer , half german and half dutch , living in amsterdam , the netherlands .<SPLIT>",Petter,"jörg loeffelmeier , better known by his stage name jorn van deynhoven , is a <mask> and <mask> <mask> , half german and half dutch , living in amsterdam , the netherlands .<SPLIT>",0.12193912267684937,0.8643160462379456,358,7160,358,232,Successful
252,Nancy brilli,"nicoletta brilli (born 10 april 1964) , best known as nancy brilli , is an italian film , television and stage actress .<SPLIT>",Orla brady,"<mask> <mask> (born 10 april 1964) , best known as nancy <mask> , is an <mask> film , television and stage actress .<SPLIT>",0.36889976263046265,0.9360879063606262,359,13206,359,224,Successful
253,Oleg sudakov,"oleg sudakov (; 4 may 1962 , novosibirsk) , better known as manager is a russian musician , poet , artist , and publicist .<SPLIT>the lead singer of the manager & rodina , tsyganyata i ya s ilyicha , anarchiya and armiya vlasova .<SPLIT>he is also cofounder of band kommunizm (with yegor letov and konstantin ryabinov) .<SPLIT>from 2002 to 2005 sudakov was leader of the branch of the national bolshevik party in novosibirsk .<SPLIT>",Svoy,"<mask> sudakov (; 4 may <mask> , <mask>) , better known as manager is a russian <mask> , <mask> , artist , and publicist .<SPLIT>the lead singer of the manager & rodina , <mask> i ya s ilyicha , <mask> and armiya vlasova .<SPLIT><mask> is also cofounder of <mask> kommunizm (with yegor letov and konstantin ryabinov) .<SPLIT>from 2002 to 2005 <mask> was <mask> of the branch of the national bolshevik party in novosibirsk .<SPLIT>",0.2352198362350464,0.8918695449829102,360,410,360,2405,Successful
254,Dorian gray,"maria luisa mangini (2 february 1928 -- 15 february 2011) , better known as dorian gray , was an italian actress .<SPLIT>",Franca dominici,"maria luisa mangini (2 february 1928 -- 15 february <mask>) , better known as dorian <mask> , was an italian actress .<SPLIT>",0.08851313591003418,0.842012882232666,361,3184,361,87,Successful
255,Rick j. hillier,"general rick hillier oc , cmm , onl , msc , cd (born 1955) is a former chief of the defence staff of the canadian forces .<SPLIT>he held this appointment from february 4 , 2005 , to july 1 , 2008 .<SPLIT>he retired on july 1 , 2008 , and was replaced by former vice-chief of the defence staff (vcds) walter natynczyk .<SPLIT>he is also the highest ranking newfoundland and labrador officer in history .<SPLIT>",Lewis mackenzie,"<mask> <mask> <mask> <mask> , cmm , onl , msc , <mask> (<mask> <mask>) <mask> <mask> <mask> <mask> <mask> <mask> <mask> <mask> of <mask> <mask> <mask> .<SPLIT>he <mask> <mask> <mask> <mask> <mask> <mask> , <mask> , <mask> <mask> <mask> , <mask> .<SPLIT>he <mask> <mask> <mask> <mask> , <mask> , <mask> <mask> <mask> <mask> <mask> <mask> of <mask> <mask> <mask> (<mask>) <mask> natynczyk .<SPLIT><mask> <mask> <mask> the highest <mask> newfoundland <mask> labrador <mask> <mask> <mask> .<SPLIT>",0.006664872169494629,0.9291231036186218,363,3200,363,8074,Successful
256,Apoula edel,apoula edima edel bete (born 17 june 1986) is a cameroonian born-armenian professional footballer who plays as a goalkeeper for chennaiyin fc in the indian super league .<SPLIT>,Jacques elong elong,<mask> <mask> edel bete (born 17 june 1986) is a cameroonian born-armenian professional footballer who plays as a <mask> for chennaiyin fc in the indian super league .<SPLIT>,0.1431492567062378,0.9312411546707153,364,2192,364,232,Successful
257,Franciszek krzyształowicz,"franciszek krzyształowicz (1868 - 1931) was a polish dermatologist .<SPLIT>he served as the rector of the university of warsaw from 1924 to 1925 .<SPLIT>in 1919 he became the professor and head of dermatology at the university of warsaw .<SPLIT>he was one of the founders of the polish dermatological society , and from 1927 to 1930 he was its chairman .<SPLIT>",Ferenc miákits,"<mask> <mask> (<mask> - <mask>) was <mask> <mask> <mask> .<SPLIT>he served as the <mask> of the <mask> <mask> <mask> from 1924 to 1925 .<SPLIT>in <mask> he became the <mask> and head of <mask> at the <mask> <mask> <mask> .<SPLIT>he was one of the founders of the <mask> <mask> <mask> , <mask> from 1927 to 1930 he was its chairman .<SPLIT>",0.07318931818008423,0.9907522797584534,366,9979,366,3778,Successful
258,David primo דוד פרימו,"david primo (born david primovski in bulgaria , 5 may 1946) (-rrb- (-rrb- , is a former israeli international footballer who was part of the squad that competed at the 1970 world cup , israel 's only world cup appearance .<SPLIT>",Moshe romano,"<mask> primo (born <mask> primovski in bulgaria , 5 may 1946) (-rrb- (-rrb- , is a former israeli international footballer who was part of the squad that competed at the 1970 world cup , israel 's only world cup appearance .<SPLIT>",0.17455172538757324,0.7782301902770996,367,3059,367,182,Successful
259,Meredith ann pierce,"meredith ann pierce (born july 5 , 1958 in seattle , washington) is a fantasy writer and librarian .<SPLIT>her books deal in fantasy worlds with mythic settings and frequently feature young women who first wish only to love and be loved , yet who must face hazard and danger to save their way of life , their world , and so on , usually without being respected for their efforts until the end of the story .<SPLIT>",Mary pope osborne,"<mask> ann <mask> (born july 5 , <mask> in seattle , washington) is a <mask> writer and librarian .<SPLIT>her books deal in <mask> worlds with mythic settings and frequently feature young women who first wish only to love and be loved , yet who must face hazard and danger to save their way of life , their world , and so on , usually without being respected for their efforts until the end of the story .<SPLIT>",0.32413625717163086,0.9357389807701111,368,3422,368,1151,Successful
260,Alijor aşurmamadov,"alijor aşurmamadov (-rrb- , (born on 20 august 1970) , is a former tajikistani footballer who played for lokomotiv moscow , anzhi makhachkala , and fc irtysh .<SPLIT>he was a member of the tajikistan national football team .<SPLIT>",Dilmurod nazarov,"<mask> <mask> (-rrb- , (born on 20 august <mask>) , is a former tajikistani footballer who played for lokomotiv <mask> , anzhi makhachkala , and fc irtysh .<SPLIT>he <mask> a member of the tajikistan national <mask> team .<SPLIT>",0.5642147064208984,0.8670432567596436,369,10465,369,634,Successful
261,Benoit gosselin,"benoit gosselin (born july 19 , 1957 in montreal , quebec) , also known as ben gosselin , is a retired canadian professional ice hockey left wing .<SPLIT>he played seven games in the national hockey league (nhl) during the 1977-78 nhl season<SPLIT>",Danny gare,"<mask> <mask> (born july 19 , 1957 in montreal , quebec) , also known as ben <mask> , is a retired canadian professional ice hockey left wing .<SPLIT>he played seven games in the national hockey league (nhl) during the 1977-78 nhl season<SPLIT>",0.19627290964126587,0.9251455664634705,370,6213,370,331,Successful
262,Henry howard,"henry howard (september 15 , 1801 -- july 15 , 1878) was a banker and businessman , and served as mayor of detroit in 1837 , and as the first treasurer of the state of michigan .<SPLIT>",Andrew parsons,"<mask> <mask> (september 15 , 1801 -- july 15 , 1878) was a banker and businessman , and served as <mask> of <mask> in 1837 , and as the first treasurer of the state of michigan .<SPLIT>",0.2049267292022705,0.9074569940567017,374,3751,374,380,Successful
263,Laura molina,"laura molina (born december 11 , 1986) is a beach volleyball player from el salvador , who represents her native country at the 2007 pan american games in rio de janeiro , brazil .<SPLIT>she also represented her home country at the 2006 central american and caribbean games in cartagena , colombia , partnering diana romero .<SPLIT>she also played at the norceca beach volleyball circuit in 2007 , 2008 and 2009 .<SPLIT>",Melina teno,"<mask> <mask> (born december 11 , <mask>) is a beach volleyball player <mask> <mask> <mask> , who represents her native country at the 2007 pan american games in rio de janeiro , brazil .<SPLIT>she also represented her home country at the 2006 central american and caribbean games in cartagena , colombia , partnering diana romero .<SPLIT>she also played at the norceca beach volleyball circuit in 2007 , 2008 and 2009 .<SPLIT>",0.3201606869697571,0.9088113903999329,375,13907,375,1285,Successful
264,Terry kirkman,"terry kirkman (born december 12 , 1939) is a musician and writer of the hit songs `` cherish , '' `` everything that touches you , '' and `` six man band . ''<SPLIT>",Chris knight,"terry <mask> (born december 12 , <mask>) is a musician and writer of the hit songs `` cherish , '' `` everything that touches you , '' and `` six man band . ''<SPLIT>",0.021633625030517578,0.9471368193626404,376,1524,376,132,Successful
265,Jarosław żaczek,jarosław Żaczek (born 14 may 1967 in ryki) is a polish politician .<SPLIT>he was elected to sejm on 25 september 2005 after receiving 6246 votes in the 6 lublin district as the law and justice candidate .<SPLIT>,Andrzej grzesik,<mask> <mask> (born 14 may 1967 in ryki) is a polish politician .<SPLIT>he was elected to sejm on 25 september 2005 after receiving 6246 votes in the 6 lublin district as the <mask> and <mask> candidate .<SPLIT>,0.26798582077026367,0.784552276134491,377,10849,377,445,Successful
