,original_person,original_text,perturbed_person,perturbed_text,original_score,perturbed_score,original_output,perturbed_output,ground_truth_output,num_queries,result_type
493,Joseph m. gould,"`` for the 19th century politician see joseph gould '' joseph (joe) m. gould (august 22,1911 -- may 8 , 1965) was an ontario municipal and provincial politician .<SPLIT>he was a trial lawyer in private life .<SPLIT>gould was first the alderman for the city of toronto 's ward 5 in the 1950s and was the ontario liberal party 's member of provincial parliament (mpp) for the bracondale electoral district in toronto , from 1959 to 1965 , serving in the 26th and 27th ontario parliaments .<SPLIT>he died in office at age 54 .<SPLIT>",Franklin a. alberger,"<mask> <mask> <mask> 19th century politician <mask> <mask> <mask> '' <mask> (<mask>) <mask>. <mask> (august <mask>,<mask> -- <mask> 8 , <mask>) <mask> <mask> <mask> <mask> <mask> provincial <mask> .<SPLIT>he was <mask> <mask> <mask> in <mask> life .<SPLIT><mask> <mask> first the <mask> <mask> the <mask> of <mask> 's <mask> 5 in <mask> <mask> and was the <mask> <mask> <mask> 's <mask> of provincial <mask> (<mask>) <mask> <mask> bracondale <mask> <mask> in <mask> , from <mask> to <mask> , serving <mask> the 26th and 27th <mask> <mask> .<SPLIT><mask> <mask> in office <mask> age <mask> .<SPLIT>",0.01074075698852539,0.9994090795516968,682,4481,682,12881,Successful
494,Terry miller,"terrence b. `` terry '' miller (november 10 , 1942 -- april 13 , 1989) was an american businessman and politician .<SPLIT>miller served as the sixth lieutenant governor of alaska from 1978 to 1982 .<SPLIT>his political career , which began while he was in his early 20s , lasted over two decades and was cut short by his death from bone cancer at age 46 .<SPLIT>",Sid abel,"<mask> <mask>. <mask> <mask> '' <mask> (november 10 , <mask> -- april 13 , <mask>) was <mask> <mask> <mask> <mask> <mask> .<SPLIT><mask> <mask> <mask> <mask> <mask> <mask> <mask> <mask> <mask> <mask> <mask> <mask> <mask> .<SPLIT>his <mask> career , which began <mask> he was in his early 20s , lasted over two decades and was <mask> <mask> <mask> his <mask> <mask> bone <mask> <mask> <mask> <mask> .<SPLIT>",0.066439688205719,0.999876081943512,683,2210,683,5800,Successful
495,Anthony fieldings,"anthony fieldings (born july 9 , 1971) is a former american professional football player who was a linebacker in the national football league (nfl) and the world league of american football (wlaf) .<SPLIT>he played for the dallas cowboys of the nfl and the rhein fire of the wlaf .<SPLIT>fieldings played collegiately at morningside college .<SPLIT>",Frank filo,"<mask> <mask> (<mask> <mask> <mask> , <mask>) <mask> <mask> former <mask> professional <mask> player <mask> was <mask> <mask> <mask> <mask> <mask> <mask> <mask> (<mask>) and <mask> world league <mask> <mask> <mask> (<mask>) .<SPLIT><mask> played <mask> <mask> dallas <mask> <mask> <mask> <mask> and <mask> <mask> fire <mask> the <mask> .<SPLIT><mask> played <mask> <mask> morningside <mask> .<SPLIT>",0.046650052070617676,0.9984205365180969,684,6174,684,5146,Successful
496,Mark richards,"mark richards (july 15 , 1760 -- august 10 , 1844) was an american politician .<SPLIT>he served as a member of the united states house of representatives from vermont and as seventh lieutenant governor of vermont .<SPLIT>",Bill lee,"<mask> <mask> (july 15 , <mask> -- august 10 , <mask>) was <mask> <mask> politician .<SPLIT>he served <mask> a <mask> of the <mask> <mask> <mask> of <mask> <mask> <mask> <mask> <mask> seventh <mask> <mask> <mask> <mask> .<SPLIT>",0.023844242095947266,0.9990037679672241,685,11867,685,1782,Successful
497,Demond wilson,"grady demond wilson (born october 13 , 1946) is an american actor , author , and pastor .<SPLIT>he is best known for his role as lamont sanford , in the 1970s nbc sitcom `` sanford and son '' .<SPLIT>",Kevin carvell,"<mask> <mask> <mask> (born <mask> <mask> , <mask>) <mask> <mask> <mask> actor , <mask> , <mask> <mask> .<SPLIT>he <mask> <mask> known <mask> <mask> <mask> <mask> <mask> <mask> , <mask> <mask> <mask> <mask> <mask> <mask> <mask> <mask> <mask> '' .<SPLIT>",0.5347815752029419,0.9992942810058594,686,14205,686,2106,Successful
498,Fred kelsey,"frederick alvin `` fred '' kelsey (august 20 , 1884 -- september 2 , 1961) was an american actor , film director , and screenwriter .<SPLIT>he appeared in 404 films between 1911 and 1958 , often playing policemen or detectives .<SPLIT>he also directed 37 films between 1914 and 1920 .<SPLIT>kelsey was caricatured as the detective in the 1943 mgm cartoon `` who killed who ? ''<SPLIT>directed by tex avery .<SPLIT>he was born in sandusky , ohio and died in hollywood , california , aged 77 .<SPLIT>",W. c. tuttle,"<mask> <mask> <mask> <mask> '' <mask> (august <mask> , <mask> -- <mask> <mask> , <mask>) <mask> <mask> <mask> <mask> , film <mask> , and <mask> .<SPLIT><mask> <mask> <mask> <mask> <mask> between 1911 <mask> 1958 , <mask> <mask> <mask> <mask> detectives .<SPLIT>he <mask> directed 37 films <mask> 1914 <mask> <mask> .<SPLIT><mask> <mask> <mask> as <mask> detective <mask> <mask> <mask> <mask> <mask> <mask> who killed <mask> ? ''<SPLIT><mask> <mask> tex <mask> .<SPLIT>he <mask> <mask> <mask> <mask> , <mask> <mask> <mask> <mask> <mask> , california , <mask> 77 .<SPLIT>",0.15919280052185059,0.9989198446273804,687,4210,687,10039,Successful
499,"Frederic rené coudert , sr. .","frederic rené coudert , sr. (new york city , march 1 , 1832 -- washington , d. c. , december 20 , 1903) was a french american lawyer with coudert brothers .<SPLIT>","Frederic rené coudert , sr. .","<mask> <mask> <mask> , <mask>. (<mask> <mask> <mask> , <mask> <mask> , <mask> -- <mask> , <mask>. <mask>. , <mask> <mask> , <mask>) <mask> <mask> <mask> <mask> <mask> <mask> <mask> <mask> .<SPLIT>",0.13785028457641602,0.9470148086547852,688,688,688,1129,Failed
500,Ashley palmer,"ashley elizabeth palmer is an american actress and singer best known for her appearance in the 2007 hit horror film , `` paranormal activity '' .<SPLIT>",David schaub,"<mask> <mask> <mask> <mask> <mask> <mask> <mask> <mask> <mask> <mask> <mask> <mask> <mask> <mask> <mask> <mask> <mask> <mask> <mask> <mask> , <mask> <mask> <mask> '' .<SPLIT>",0.09557837247848511,0.984714925289154,689,13731,689,1036,Failed
501,Stefan fröhlich,stefan fröhlich (7 october 1889 -- 2 october 1978) was a highly decorated general der flieger in the luftwaffe during world war ii .<SPLIT>he was also a recipient of the knight 's cross of the iron cross .<SPLIT>the knight 's cross of the iron cross was awarded to recognise extreme battlefield bravery or successful military leadership .<SPLIT>,Heinz polz,<mask> <mask> (<mask> <mask> <mask> -- <mask> <mask> <mask>) <mask> <mask> <mask> <mask> <mask> <mask> <mask> <mask> <mask> <mask> <mask> <mask> <mask> <mask> .<SPLIT><mask> <mask> <mask> <mask> <mask> <mask> <mask> <mask> '<mask> <mask> <mask> <mask> <mask> <mask> .<SPLIT><mask> <mask> '<mask> <mask> <mask> <mask> <mask> <mask> <mask> <mask> <mask> <mask> <mask> <mask> <mask> <mask> <mask> <mask> <mask> .<SPLIT>,0.08590096235275269,0.9950011372566223,690,11409,690,5996,Failed
502,Maxine doyle,"maxine doyle (january 1 , 1915 -- may 7 , 1973) was an american film actress .<SPLIT>",Kazumi takada,"<mask> <mask> (<mask> <mask> , <mask> -- <mask> <mask> , <mask>) <mask> <mask> <mask> <mask> <mask> .<SPLIT>",0.09856152534484863,0.9968697428703308,691,7781,691,326,Failed
503,Thomas weston thompson,"thomas weston thompson (march 15 , 1766october 1 , 1821) was an american attorney and federalist politician in the u.s. state of new hampshire .<SPLIT>he served as a united states representative and united states senator during the 1800s .<SPLIT>",Charles w. gates,"<mask> <mask> <mask> (<mask> <mask> , <mask> <mask> , <mask>) <mask> <mask> <mask> <mask> <mask> <mask> <mask> <mask> <mask> <mask>.<mask>. <mask> <mask> <mask> <mask> .<SPLIT><mask> <mask> <mask> <mask> <mask> <mask> <mask> <mask> <mask> <mask> <mask> <mask> <mask> <mask> .<SPLIT>",0.012235820293426514,0.9701555371284485,693,2628,693,2702,Failed
504,Tony do pilar patrao,"tony do pilar patrao (born 19 , 1986 in marseille ,) is a french-portuguese footballer .<SPLIT>he currently plays in the cfa for hyères fc .<SPLIT>patrao played at berre l'etang and gardanne .<SPLIT>source : http://www.foot-national.com/4168-joueur-football-do-pilar-patrao-tony.html<SPLIT>",Fabrice n'guessi,"<mask> <mask> <mask> <mask> (born <mask> , <mask> <mask> <mask> ,) is a <mask> footballer .<SPLIT><mask> currently plays in the <mask> <mask> <mask> <mask> .<SPLIT><mask> <mask> at <mask> l'etang and <mask> .<SPLIT>source : http://www.<mask>.com/<mask>.html<SPLIT>",0.057396113872528076,0.9981991052627563,697,13092,697,2013,Successful
505,Bobby billings,"bobby billings (born february 12 , 1975) is an american musician , singer and songwriter .<SPLIT>",Garrett clayton,"<mask> <mask> (born february 12 , <mask>) is an american <mask> , singer and <mask> .<SPLIT>",0.6899944543838501,0.9992548227310181,699,5105,699,182,Successful
506,Mikhail bulgakov,"mikhaíl afanasyevich bulgakov (; , ; -- march 10 , 1940) was a russian writer and playwright active in the first half of the 20th century .<SPLIT>he is best known for his novel `` the master and margarita '' , which has been called one of the masterpieces of the 20th century .<SPLIT>",Vladimir of novgorod,"<mask> <mask> <mask> (; , ; -- <mask> <mask> , <mask>) <mask> <mask> <mask> <mask> <mask> <mask> <mask> <mask> <mask> <mask> <mask> <mask> <mask> <mask> <mask> .<SPLIT><mask> <mask> <mask> <mask> <mask> <mask> <mask> <mask> <mask> <mask> <mask> <mask> '' , <mask> <mask> <mask> <mask> <mask> <mask> <mask> <mask> <mask> <mask> <mask> <mask> .<SPLIT>",0.4410780072212219,0.9909417629241943,701,1967,701,4006,Failed
507,Randy gatewood,"randy gatewood (born january 31 , 1973) is a former american football wide receiver in the national football league and arena football league .<SPLIT>he was signed by the miami dolphins as an undrafted free agent in 1995 .<SPLIT>he played college football at unlv .<SPLIT>he shares the single game record for most receptions with 23 catches , which he accomplished on sept. 17 , 1994 against the idaho vandals .<SPLIT>gatewood also played for the arizona rattlers .<SPLIT>in 2015 , gatewood became a sideline analyst for cbs sports network 's afl coverage .<SPLIT>",Lamont green,"<mask> <mask> (born january 31 , <mask>) is <mask> <mask> american football <mask> <mask> <mask> <mask> national football league <mask> <mask> <mask> <mask> .<SPLIT>he <mask> signed by the <mask> dolphins as an <mask> free agent <mask> <mask> .<SPLIT>he played college football <mask> <mask> .<SPLIT>he <mask> <mask> single game <mask> <mask> <mask> <mask> <mask> 23 <mask> , <mask> he <mask> <mask> <mask>. <mask> , <mask> <mask> <mask> <mask> <mask> .<SPLIT><mask> <mask> played for the <mask> <mask> .<SPLIT>in 2015 , <mask> became a sideline <mask> for cbs sports network 's <mask> coverage .<SPLIT>",0.12526863813400269,0.9989129900932312,702,220,702,11263,Successful
508,Kurt brecht,"kurt brecht (born august 24 , 1961 in houston , texas) is an american vocalist and author , best known for his work as vocalist of crossover thrash band d.r.i. (dirty rotten imbeciles) .<SPLIT>he is also in a thrash band called , pasadena napalm division (p.n.d.)<SPLIT>",Lars eighner,"<mask> <mask> (<mask> <mask> 24 , <mask> <mask> <mask> , <mask>) is an <mask> <mask> and author , best <mask> for his <mask> <mask> <mask> of crossover <mask> <mask> d.r.i. (dirty rotten imbeciles) .<SPLIT>he is <mask> <mask> <mask> <mask> <mask> called , pasadena <mask> <mask> (p.n.d.)<SPLIT>",0.029846131801605225,0.9984484910964966,703,3931,703,3083,Successful
509,Renzo morigi,renzo morigi (28 february 1895 -- 13 april 1962) was an italian pistol sports shooter who competed in the 1932 summer olympics .<SPLIT>in 1932 he won the gold medal in the 25 metre rapid fire pistol event .<SPLIT>,Wouter gortzak,<mask> <mask> (<mask> <mask> <mask> -- <mask> <mask> <mask>) <mask> <mask> <mask> <mask> <mask> <mask> <mask> <mask> <mask> <mask> <mask> <mask> <mask> .<SPLIT><mask> <mask> <mask> <mask> <mask> <mask> <mask> <mask> <mask> <mask> <mask> <mask> <mask> <mask> <mask> .<SPLIT>,0.0633234977722168,0.9967078566551208,704,12072,704,2557,Failed
510,Bert bradley,"steven bert bradley (born 1956) is a former american major league baseball pitcher .<SPLIT>he played for the oakland athletics during the season .<SPLIT>along with rickey henderson , bradley was traded to the new york yankees on december 5 , 1984 .<SPLIT>",Steve schrenk,"steven <mask> <mask> (born <mask>) is a former american major league baseball <mask> .<SPLIT>he played <mask> the <mask> <mask> <mask> the season .<SPLIT>along with rickey henderson , <mask> was traded to the new york yankees on december 5 , <mask> .<SPLIT>",0.5954505205154419,0.9999159574508667,705,12155,705,1227,Successful
511,Joseph s. sporn,"joseph s. sporn is an american inventor , entrepreneur , and musician from new york city .<SPLIT>he is the founder of yuppie puppy pet care , inc. , which was the first dog daycare center in the united states .<SPLIT>",Robert a. daly,"<mask> <mask>. <mask> <mask> <mask> <mask> <mask> , <mask> , and <mask> <mask> <mask> <mask> <mask> .<SPLIT><mask> <mask> <mask> <mask> <mask> <mask> <mask> <mask> <mask> , <mask>. , <mask> was <mask> first <mask> <mask> center <mask> <mask> united <mask> .<SPLIT>",0.008007645606994629,0.998710036277771,707,2841,707,2356,Successful
512,Alois linka,alois linka (24 april 1899 -- 18 january 1968) was a czech sprinter .<SPLIT>he competed in the men 's 100 metres and the 200 metres events at the 1924 summer olympics .<SPLIT>,Béla bay,<mask> <mask> (<mask> <mask> <mask> -- <mask> <mask> <mask>) <mask> <mask> <mask> <mask> .<SPLIT><mask> <mask> <mask> <mask> <mask> '<mask> <mask> <mask> <mask> <mask> <mask> <mask> <mask> <mask> <mask> <mask> <mask> <mask> .<SPLIT>,0.0033038854598999023,0.9905539155006409,708,3801,708,1771,Failed
513,Britt lundberg,"britt lundberg (born april 19 , 1963) is a politician in the Åland islands , an autonomous and unilingually swedish territory of finland .<SPLIT>speaker of the parliament of Åland 2011 - deputy premier and minister of culture and education 2007-2011 minister of administration , equality and eu affairs 2005-2007 member of the lagting (Åland parliament) 1999-2004<SPLIT>",Izet ibrahimi,"<mask> <mask> (born april 19 , <mask>) is a <mask> in the <mask> <mask> , an <mask> and unilingually <mask> territory of <mask> .<SPLIT><mask> of the <mask> of <mask> 2011 - deputy <mask> <mask> <mask> of <mask> and <mask> 2007-2011 <mask> of <mask> , <mask> and eu <mask> 2005-2007 member of the <mask> (<mask> <mask>) <mask><SPLIT>",0.39603543281555176,0.9987398982048035,709,5784,709,3845,Successful
514,Haylie wagner,"haylie wagner (born april 7 , 1993) is an american softball player .<SPLIT>she was a left-handed pitcher for the michigan wolverines softball team .<SPLIT>she was unanimously selected the 2012 big ten conference pitcher of the year after compiling a 32-7 record and a 1.53 earned run average (era) in her freshman year .<SPLIT>as a senior , she compiled a 25-3 record with a 1.75 era .<SPLIT>in four years at michigan , she compiled a 100-18 record with a 1.82 era .<SPLIT>",Charlie houchin,"<mask> <mask> (born <mask> 7 , <mask>) is an american <mask> <mask> .<SPLIT><mask> was a <mask> <mask> for the michigan wolverines <mask> team .<SPLIT><mask> was unanimously <mask> the <mask> big ten conference <mask> of the year after compiling a <mask> <mask> and a 1.53 earned <mask> <mask> (<mask>) in <mask> <mask> year .<SPLIT>as a <mask> , <mask> compiled a 25-3 record with a 1.75 era .<SPLIT>in four <mask> at michigan , <mask> compiled a <mask> record with a 1.82 <mask> .<SPLIT>",0.08547139167785645,0.9986992478370667,711,3145,711,6997,Successful
515,Ivan hlinka,"ivan hlinka (january 26 , 1950 -- august 16 , 2004) was a czech professional ice hockey player and coach .<SPLIT>he is considered to be one of the most important figures in czech ice hockey history .<SPLIT>a big center , his playing style was comparable to phil esposito , often scoring with shots from the slot .<SPLIT>",Giuseppe santagostino,"<mask> <mask> (<mask> <mask> , <mask> -- <mask> 16 , <mask>) <mask> <mask> <mask> professional <mask> <mask> <mask> <mask> <mask> .<SPLIT>he is <mask> <mask> <mask> <mask> <mask> <mask> <mask> <mask> <mask> in <mask> <mask> <mask> <mask> .<SPLIT><mask> big <mask> , <mask> playing style <mask> <mask> to phil esposito , often scoring with <mask> <mask> the <mask> .<SPLIT>",0.031467318534851074,0.9989675283432007,714,9827,714,4672,Successful
516,Charles scott -lrb- wyoming politician -rrb-,"charles scott is a republican member of the wyoming senate , representing the 30th district since 1983 .<SPLIT>previously he was in the house from 1979 to 1982 .<SPLIT>he received an mba from harvard business school .<SPLIT>",Peter durant,"<mask> <mask> <mask> <mask> <mask> <mask> of the <mask> <mask> , <mask> <mask> <mask> <mask> <mask> <mask> .<SPLIT>previously <mask> <mask> in the house from <mask> <mask> <mask> .<SPLIT><mask> <mask> <mask> <mask> <mask> harvard <mask> <mask> .<SPLIT>",0.04685103893280029,0.9992826581001282,715,1076,715,2135,Successful
517,Babu janardhanan,"babu janardhanan is an indian screenwriter and director , best noted for his acclaimed malayalam films .<SPLIT>",Toni carr,"<mask> <mask> is an <mask> <mask> and <mask> , best noted for his <mask> <mask> <mask> .<SPLIT>",0.20011365413665771,0.9991077780723572,716,8116,716,324,Successful
518,James tuchet,"james tuchet , 3rd earl of castlehaven (c. 1617 -- 11 october 1684) was the son of mervyn tuchet , 2nd earl of castlehaven and his first wife , elizabeth barnham (1592 -- c. 1622) .<SPLIT>castlehaven played a prominent role in the wars of the three kingdoms that took place in the middle of the 17th century , and was particularly active in the conflicts in ireland at this time .<SPLIT>",James tuchet,"<mask> <mask> , <mask> <mask> <mask> <mask> (<mask>. <mask> -- <mask> <mask> <mask>) <mask> <mask> <mask> <mask> <mask> <mask> , <mask> <mask> <mask> <mask> <mask> <mask> <mask> <mask> , <mask> <mask> (<mask> -- <mask>. <mask>) .<SPLIT><mask> <mask> <mask> <mask> <mask> <mask> <mask> <mask> <mask> <mask> <mask> <mask> <mask> <mask> <mask> <mask> <mask> <mask> <mask> <mask> <mask> <mask> , <mask> <mask> <mask> <mask> <mask> <mask> <mask> <mask> <mask> <mask> <mask> <mask> .<SPLIT>",0.28251707553863525,0.605874240398407,718,718,718,8129,Failed
519,Riccardo muti,"riccardo muti , cavaliere di gran croce omri (; born 28 july 1941) is an italian conductor .<SPLIT>he holds two music directorships : the chicago symphony orchestra and the orchestra giovanile luigi cherubini .<SPLIT>previously he held posts at the maggio musicale in florence , the philharmonia orchestra in london , the philadelphia orchestra , the teatro alla scala in milan and the salzburg whitsun festival .<SPLIT>muti has been a prolific recording artist and has received dozens of honors , titles , awards and prizes .<SPLIT>he is particularly associated with the music of giuseppe verdi .<SPLIT>",Saroj khan,"<mask> <mask> , <mask> <mask> gran <mask> <mask> (; <mask> <mask> july <mask>) <mask> <mask> <mask> <mask> .<SPLIT>he <mask> two <mask> <mask> : <mask> chicago <mask> <mask> and <mask> <mask> <mask> <mask> <mask> .<SPLIT><mask> he <mask> <mask> <mask> <mask> <mask> <mask> in <mask> , <mask> <mask> <mask> <mask> london , the philadelphia <mask> , <mask> teatro <mask> <mask> in <mask> <mask> <mask> <mask> whitsun <mask> .<SPLIT><mask> has <mask> <mask> <mask> <mask> artist <mask> has <mask> dozens <mask> <mask> , <mask> , awards <mask> <mask> .<SPLIT><mask> is <mask> <mask> <mask> <mask> <mask> <mask> <mask> <mask> .<SPLIT>",0.3904094099998474,0.9988247752189636,720,5034,720,13867,Successful
520,Carlos pinto,"carlos pinto (born 24 august 1959) is a portuguese olympic dressage rider .<SPLIT>representing portugal , he competed at the 2008 summer olympics in beijing where she finished 38th in the individual competition .<SPLIT>he also competed at the 2014 world equestrian games and at four european dressage championships (in 2001 , 2005 , 2007 and 2009) .<SPLIT>his current best championship result 9th place in team dressage fom the 2009 european dressage championship held at windsor castle while his current best individual result is 32nd place from the same championship .<SPLIT>",Bodil ryste,"<mask> <mask> (born 24 august <mask>) is a <mask> olympic <mask> <mask> .<SPLIT>representing <mask> , he competed at the 2008 summer olympics in beijing where <mask> finished 38th in the <mask> competition .<SPLIT>he also competed at the <mask> world <mask> games and at four european <mask> championships (in 2001 , 2005 , 2007 and 2009) .<SPLIT>his current best championship result 9th place in <mask> <mask> fom the 2009 european <mask> championship held at windsor <mask> while his current best <mask> result is 32nd place from the same championship .<SPLIT>",0.0038853883743286133,0.9999343156814575,722,2079,722,4982,Successful
521,Igor mijajlovic игор мијајловиќ,"igor mijajlovic (; born jулѕ 03 , 1984) is a serbian professional basketball player born in belgrade .<SPLIT>he is currently under contract with kaposvári kk .<SPLIT>he is 1.92 m (6 ft 3 in) in height and plays at the point guard and shooting guard position .<SPLIT>",Panagiotis vasilopoulos παναγιώτης βασιλόπουλος,"<mask> <mask> (; born jулѕ <mask> , <mask>) is <mask> <mask> <mask> <mask> player born <mask> <mask> .<SPLIT><mask> is <mask> <mask> <mask> <mask> kaposvári <mask> .<SPLIT><mask> <mask> 1.<mask> <mask> (6 ft 3 <mask>) <mask> height and <mask> <mask> <mask> point <mask> <mask> <mask> <mask> <mask> .<SPLIT>",0.32138723134994507,0.9988597631454468,725,13816,725,3409,Successful
522,John ii of portugal,"john ii (portuguese : joão ii , ; 3 march 1455 -- 25 october 1495) , `` the perfect prince '' -lrb-) , was the king of portugal and the algarves in 1477/1481 -- 1495 .<SPLIT>he is known for re-establishing the power of the portuguese throne , reinvigorating its economy , and renewing its exploration of africa and the orient .<SPLIT>",Heraclius ii,"<mask> <mask> (<mask> : <mask> <mask> , ; <mask> <mask> <mask> -- <mask> <mask> <mask>) , <mask> <mask> <mask> <mask> '' -<mask>) , <mask> <mask> <mask> <mask> <mask> <mask> <mask> <mask> <mask> <mask>/<mask> -- <mask> .<SPLIT><mask> <mask> <mask> <mask> <mask> <mask> <mask> <mask> <mask> <mask> <mask> , <mask> <mask> <mask> , <mask> <mask> <mask> <mask> <mask> <mask> <mask> <mask> <mask> .<SPLIT>",0.5735159516334534,0.9921053647994995,726,3485,726,5152,Failed
523,Aaron phillips,aaron owen phillips (born 20 november 1993) is an english football player .<SPLIT>he is a defender who currently plays for football league one team coventry city .<SPLIT>his father is the former welsh international footballer david phillips who played for coventry 's fa cup winning side in 1987 .<SPLIT>,Rachel brown,<mask> <mask> <mask> (born 20 november <mask>) is an english <mask> <mask> .<SPLIT>he <mask> a <mask> <mask> <mask> <mask> for football <mask> <mask> team <mask> <mask> .<SPLIT>his <mask> <mask> the former <mask> international <mask> <mask> <mask> <mask> played for <mask> 's <mask> cup winning side in 1987 .<SPLIT>,0.0051732659339904785,0.9987040758132935,728,1399,728,3268,Successful
524,Jacques decrion,"jacques decrion (born 18 november 1961) is a french former professional racing cyclist .<SPLIT>he rode in one edition of the tour de france , two editions of the giro d'italia and three editions of the vuelta a españa .<SPLIT>",Eamonn coghlan,"<mask> <mask> (born 18 november <mask>) <mask> <mask> <mask> <mask> <mask> <mask> <mask> .<SPLIT><mask> <mask> <mask> <mask> <mask> of <mask> <mask> <mask> <mask> , <mask> <mask> of the <mask> <mask> and <mask> <mask> of <mask> <mask> <mask> <mask> .<SPLIT>",0.012481987476348877,0.9992929697036743,729,7099,729,2558,Successful
525,Norman scott,"norman m. scott was a canadian figure skater who competed in both single skating and pair skating .<SPLIT>his pairs partner was jeanne chevalier .<SPLIT>as a single skater , he is the 1914 and 1920 canadian champion .<SPLIT>he and chevalier won the 1914 canadian pairs title .<SPLIT>scott was part of the four teams that won the silver medal in the canadian fours championships in 1913 .<SPLIT>scott also competed in the united states and won the first united states figure skating championships in both singles and pairs .<SPLIT>",Tommy murray,"<mask> <mask>. <mask> was <mask> <mask> <mask> <mask> <mask> <mask> <mask> both <mask> <mask> <mask> <mask> <mask> .<SPLIT><mask> <mask> <mask> <mask> <mask> <mask> .<SPLIT><mask> a <mask> <mask> , <mask> <mask> <mask> <mask> <mask> <mask> <mask> <mask> .<SPLIT><mask> <mask> <mask> <mask> <mask> <mask> <mask> <mask> <mask> .<SPLIT><mask> <mask> <mask> <mask> <mask> four <mask> <mask> <mask> <mask> <mask> <mask> <mask> <mask> <mask> <mask> <mask> <mask> <mask> .<SPLIT><mask> <mask> <mask> <mask> <mask> <mask> <mask> and <mask> <mask> first <mask> <mask> <mask> <mask> <mask> <mask> <mask> <mask> <mask> <mask> .<SPLIT>",0.0030502676963806152,0.9996913075447083,731,11914,731,13945,Successful
