,original_person,original_text,perturbed_person,perturbed_text,original_score,perturbed_score,original_output,perturbed_output,ground_truth_output,num_queries,result_type
219,Michael dobson,"michael richard dobson originally from the uk (born august 12 , 1966) is one of the three dobson brothers (himself , brian , and paul) , all of whom have made themselves known prominently in the voice acting community .<SPLIT>arrived in canada and he currently resides in vancouver , british columbia , canada .<SPLIT>dobson tends to be cast into the role of well-rounded , emotionally driven characters .<SPLIT>he is currently owner of his own voice recording studio , makena sound ltd. in south surrey , british columbia .<SPLIT>",Michael peter olsen,"<mask> <mask> <mask> originally from the <mask> (born august 12 , 1966) is one of the three <mask> brothers (himself , brian , and paul) , all of whom have made themselves known prominently in the <mask> <mask> community .<SPLIT>arrived in canada and he currently resides in vancouver , british columbia , canada .<SPLIT><mask> tends to be cast into the role of well-rounded , emotionally driven <mask> .<SPLIT>he is currently owner of his own <mask> recording studio , makena sound ltd. in south surrey , british columbia .<SPLIT>",0.07213908433914185,0.9993882775306702,309,11598,309,2707,Successful
220,"Pierre jacques étienne cambronne , viscount cambronne","pierre jacques Étienne cambronne , later pierre , viscount cambronne (26 december 1770 -- 29 january 1842) , was a general of the french empire .<SPLIT>he fought during the wars of the revolution and the napoleonic era .<SPLIT>he was wounded at the battle of waterloo .<SPLIT>",The earl of tankerville,"<mask> <mask> <mask> <mask> , later <mask> , <mask> <mask> (26 december <mask> -- 29 january <mask>) , was <mask> <mask> of the <mask> <mask> .<SPLIT>he <mask> <mask> the <mask> of <mask> <mask> <mask> <mask> <mask> <mask> .<SPLIT>he was <mask> <mask> <mask> <mask> of waterloo .<SPLIT>",0.43723583221435547,0.9984405040740967,311,4352,311,2842,Successful
221,Christian dupont,"christian dupont (born in 1947) is a belgian politician , member of the french-speaking socialist party .<SPLIT>currently minister for education in the french community government (since 20 march 2008) .<SPLIT>was federal belgian minister of pensions and social integration in the verhofstadt iii government from december 2007 until march 2008 .<SPLIT>he is member of the belgian chamber of representatives (52nd legislature) .<SPLIT>",Vjačeslavs dombrovskis,"<mask> <mask> (<mask> <mask> <mask>) is a <mask> politician , member of the <mask> <mask> party .<SPLIT>currently minister for education in the <mask> <mask> government (since 20 march 2008) .<SPLIT>was federal <mask> minister of <mask> and <mask> <mask> in the <mask> <mask> government from december 2007 until march 2008 .<SPLIT>he is member of the <mask> chamber of representatives (52nd legislature) .<SPLIT>",0.0178225040435791,0.9991880059242249,312,515,312,3292,Successful
222,Ragnhild haga,"ragnhild haga (born 12 february 1991) is a norwegian cross country skier from holter , nannestad .<SPLIT>she competed in the world cup 2015 season .<SPLIT>at the 2015 tour de ski , she finished fourth overall .<SPLIT>she represented norway at the fis nordic world ski championships 2015 in falun .<SPLIT>",Jonas vangenechten,"<mask> <mask> (<mask> <mask> <mask> <mask>) <mask> <mask> <mask> <mask> <mask> <mask> <mask> <mask> , <mask> .<SPLIT><mask> <mask> <mask> <mask> <mask> <mask> <mask> <mask> .<SPLIT><mask> <mask> 2015 tour <mask> <mask> , <mask> <mask> <mask> <mask> .<SPLIT><mask> <mask> <mask> <mask> <mask> <mask> <mask> <mask> <mask> <mask> <mask> <mask> falun .<SPLIT>",0.04127979278564453,0.9987363219261169,317,10866,317,4163,Successful
223,James michael sprayberry,"james michael `` mike '' sprayberry (born april 24 , 1947) was a united states army officer and a recipient of the united states military 's highest decoration -- the medal of honor -- for his actions in the vietnam war .<SPLIT>",James michael sprayberry,"<mask> <mask> <mask> <mask> '' <mask> (<mask> <mask> <mask> , <mask>) <mask> <mask> <mask> <mask> <mask> <mask> <mask> <mask> <mask> <mask> <mask> <mask> <mask> <mask> '<mask> <mask> <mask> -- <mask> <mask> <mask> <mask> -- <mask> <mask> <mask> <mask> <mask> <mask> <mask> .<SPLIT>",0.00517350435256958,0.49188363552093506,318,318,318,2702,Failed
224,Roydell williams,"roydell williams (born march 14 , 1981) is a former american football wide receiver in the national football league (nfl) .<SPLIT>he was drafted by the tennessee titans in the fourth round of the 2005 nfl draft .<SPLIT>he played college football at tulane .<SPLIT>williams has also played for the washington redskins .<SPLIT>",Nick graham,"<mask> <mask> (<mask> <mask> <mask> , <mask>) <mask> <mask> former american football <mask> <mask> <mask> the <mask> <mask> <mask> (<mask>) .<SPLIT><mask> <mask> <mask> <mask> the tennessee <mask> <mask> <mask> <mask> <mask> <mask> <mask> <mask> <mask> <mask> .<SPLIT><mask> played college football at <mask> .<SPLIT><mask> <mask> <mask> <mask> <mask> <mask> washington <mask> .<SPLIT>",0.4003244638442993,0.9986826777458191,319,11886,319,4490,Successful
225,Anja šaranović,"anja Šaranović (, born 12 september 1989 in kraljevo , yugoslavia) is a serbian beauty queen who represented her country in miss international 2010 and was represented in the 2011 miss universe pageant .<SPLIT>",Fereydoun moeini,"<mask> <mask> (, <mask> <mask> <mask> <mask> in <mask> , <mask>) is <mask> <mask> <mask> <mask> who <mask> <mask> <mask> in <mask> international <mask> <mask> was <mask> in the <mask> <mask> <mask> <mask> .<SPLIT>",0.04127359390258789,0.9995751976966858,320,10652,320,1748,Successful
226,Norris leonard einertson,"chaplain (major general) norris leonard einertson , usa (born august 6 , 1930) is a retired american army officer who served as the 17th chief of chaplains of the united states army from 1986 to 1990 .<SPLIT>",Lewis mackenzie,"<mask> (<mask> <mask>) <mask> <mask> <mask> , <mask> (<mask> <mask> <mask> , <mask>) <mask> <mask> <mask> <mask> <mask> <mask> <mask> <mask> <mask> <mask> <mask> <mask> <mask> <mask> <mask> <mask> <mask> <mask> <mask> <mask> <mask> <mask> <mask> .<SPLIT>",0.00913858413696289,0.908370852470398,321,3200,321,2279,Failed
227,William youmans,"william youmans is an american broadway , film and television actor and singer , best known for originating the roles of john jacob astor in `` titanic : the musical '' , and doctor dillamond in `` wicked '' .<SPLIT>",Kriss turner,"<mask> <mask> is an american <mask> , <mask> and television <mask> <mask> <mask> , best known for originating the <mask> of <mask> <mask> <mask> <mask> `` <mask> : the <mask> '' , and <mask> <mask> <mask> `` <mask> '' .<SPLIT>",0.2657163143157959,0.9984245896339417,322,12545,322,1666,Successful
228,J. roy helland,"j. roy helland (born january 28 , 1943 in glendale , california) is a make-up artist .<SPLIT>he has done the hair and make-up for meryl streep in all of her movies since sophie 's choice in 1982 .<SPLIT>on january 24 , 2012 , he was nominated for an academy award for the movie `` the iron lady '' , which he won on february 26 , 2012 .<SPLIT>he shared his oscar with mark coulier in the category of best makeup .<SPLIT>",J. roy helland,"<mask>. <mask> <mask> (<mask> <mask> <mask> , <mask> <mask> <mask> , <mask>) <mask> <mask> <mask> <mask> .<SPLIT><mask> <mask> <mask> <mask> <mask> <mask> <mask> <mask> <mask> <mask> <mask> <mask> <mask> <mask> <mask> <mask> <mask> '<mask> <mask> <mask> <mask> .<SPLIT><mask> <mask> <mask> , <mask> , <mask> <mask> <mask> <mask> <mask> <mask> <mask> <mask> <mask> <mask> <mask> <mask> <mask> <mask> '' , <mask> <mask> <mask> <mask> <mask> <mask> , <mask> .<SPLIT><mask> <mask> <mask> <mask> <mask> <mask> <mask> <mask> <mask> <mask> <mask> <mask> <mask> .<SPLIT>",0.006997525691986084,0.8462888598442078,326,326,326,10586,Failed
229,Richard lloyd,"richard lloyd (18 february 1945 -- 30 march 2008) was a british racing car driver and founder of multiple sports car and touring car teams .<SPLIT>he drove in multiple championships himself , including the british saloon car championship and the world endurance championship .<SPLIT>",Bill patterson,"<mask> <mask> (18 february <mask> -- 30 march 2008) was a <mask> racing car driver and founder of multiple sports car and touring car teams .<SPLIT>he drove in multiple championships himself , including the <mask> saloon car championship and the world endurance championship .<SPLIT>",0.5657492280006409,0.999527096748352,327,3960,327,658,Successful
230,Günther-eberhardt wisliceny,"günther-eberhardt wisliceny (5 september 1912 in regulowken , now możdżany , giżycko county - 25 august 1985 in hanover) was a german waffen-ss obersturmbannführer .<SPLIT>he was also a recipient of the knight 's cross of the iron cross with oak leaves and swords -lrb-) .<SPLIT>the knight 's cross of the iron cross and its higher grade oak leaves and swords was awarded to recognise extreme battlefield bravery or successful military leadership .<SPLIT>",Franz riedel,"<mask> <mask> (5 september <mask> in regulowken , now możdżany , giżycko county - 25 august <mask> in hanover) was a german <mask> obersturmbannführer .<SPLIT>he was also a recipient of the knight 's cross of the iron cross with oak leaves and swords -lrb-) .<SPLIT>the knight 's cross of the iron cross and its higher grade oak leaves and swords was awarded to recognise extreme battlefield bravery or successful military leadership .<SPLIT>",0.03202533721923828,0.9998033046722412,328,680,328,1117,Successful
231,Mike thompson,"charles michael `` mike '' thompson (born january 24 , 1951) is the u.s. representative for , serving since 1999 .<SPLIT>he is the current chairman of the house gun violence prevention task force .<SPLIT>he is a member of the democratic party .<SPLIT>the district , numbered as the 5th district until 2013 , includes napa county plus portions of contra costa , lake , solano , and sonoma counties .<SPLIT>",Chuck fleischmann,"<mask> <mask> <mask> <mask> '' <mask> (<mask> <mask> <mask> , <mask>) <mask> <mask> <mask>.<mask>. <mask> <mask> , <mask> <mask> <mask> .<SPLIT><mask> <mask> <mask> <mask> <mask> <mask> <mask> <mask> <mask> <mask> <mask> <mask> <mask> .<SPLIT><mask> <mask> <mask> <mask> <mask> <mask> <mask> <mask> .<SPLIT><mask> <mask> , <mask> <mask> <mask> <mask> <mask> <mask> <mask> , <mask> <mask> <mask> <mask> <mask> <mask> <mask> <mask> , <mask> , <mask> , <mask> <mask> <mask> .<SPLIT>",0.13193953037261963,0.9916269183158875,329,4694,329,7382,Failed
232,Imran pratapgarhi,"nazish pratapgarhi (1924-1981) was an urdu poet from india , who was known for his thoughts and ability to create contact between himself and lovers of urdu poetry .<SPLIT>",Christian campbell,"<mask> <mask> (<mask>) <mask> <mask> <mask> <mask> <mask> <mask> , <mask> <mask> known for <mask> <mask> <mask> ability <mask> create <mask> <mask> himself <mask> <mask> <mask> <mask> poetry .<SPLIT>",0.05498647689819336,0.9985921382904053,332,1791,332,1348,Successful
233,Frank p. smeal,"frank paul smeal (august 7 , 1918 -- april 8 , 2003) was a partner of the goldman sachs group of new york city .<SPLIT>",Howard w. koch,"<mask> paul <mask> (august 7 , 1918 -- april 8 , <mask>) was a partner of the goldman sachs group of new york city .<SPLIT>",0.33940237760543823,0.9989902973175049,333,7322,333,178,Successful
234,Jon jelacic,"jon jelacic was a professional american football player who played defensive lineman for five seasons for the new york giants and oakland raiders .<SPLIT>jelacic also played 2 seasons with the ottawa rough riders of the canadian football league , including their 1960 grey cup championship season .<SPLIT>",Andre young,"<mask> <mask> <mask> a professional american football player <mask> played <mask> <mask> for five seasons for the <mask> <mask> <mask> and oakland <mask> .<SPLIT><mask> <mask> played 2 <mask> <mask> the <mask> <mask> <mask> of the <mask> <mask> league , including their <mask> <mask> <mask> championship season .<SPLIT>",0.029663443565368652,0.9994778633117676,335,5946,335,2902,Successful
235,José pineda,josé luis pineda aragón (born 19 march 1975) is a retired professional honduran footballer .<SPLIT>,Stig bornhager,<mask> <mask> <mask> <mask> (<mask> <mask> <mask> <mask>) <mask> <mask> <mask> <mask> <mask> <mask> .<SPLIT>,0.054515182971954346,0.9841178059577942,336,10885,336,379,Failed
236,Darius hill,"darius e. hill (born august 26 , 1985 in st. charles , missouri) is a former american football tight end .<SPLIT>he was signed by the cincinnati bengals as an undrafted free agent in 2009 .<SPLIT>he played college football at ball state .<SPLIT>",Darius hill,"<mask> <mask>. <mask> (<mask> <mask> <mask> , <mask> <mask> <mask>. <mask> , <mask>) <mask> <mask> <mask> <mask> <mask> <mask> <mask> .<SPLIT><mask> <mask> <mask> <mask> <mask> <mask> <mask> <mask> <mask> <mask> <mask> <mask> <mask> <mask> .<SPLIT><mask> <mask> <mask> <mask> <mask> <mask> <mask> .<SPLIT>",0.031391680240631104,0.8919122815132141,337,337,337,3004,Failed
237,Pascal stöger,pascal stöger (born 7 july 1990) is an austrian professional association football player currently playing for union dietach .<SPLIT>he plays as a midfielder and is the brother of kevin stöger .<SPLIT>,Cameron goodhue,<mask> <mask> (born 7 july <mask>) is <mask> <mask> <mask> <mask> football player <mask> <mask> <mask> union <mask> .<SPLIT>he <mask> as a <mask> and <mask> the brother of kevin <mask> .<SPLIT>,0.3332584500312805,0.9999281167984009,338,11761,338,1291,Successful
238,Gul agha sherzai ګل آغا شيرزی,"gul agha sherzai -lrb-) , also known as mohammad shafiq , is a politician in afghanistan .<SPLIT>he is the former governor of nangarhar province in eastern afghanistan .<SPLIT>he previously served as governor of kandahar province , in the early 1990s and from 2001 until 2003 .<SPLIT>as of october 2013 , sherzai resigned from his post as governor and formally announced himself as a candidate for afghanistan 's 2014 presidential election .<SPLIT>",Mohammad shafiq,"<mask> <mask> <mask> -<mask>) , <mask> <mask> as mohammad shafiq , <mask> a <mask> in afghanistan .<SPLIT>he <mask> the former governor of <mask> <mask> in <mask> afghanistan .<SPLIT><mask> <mask> served as governor of <mask> <mask> , in the early 1990s and from <mask> until 2003 .<SPLIT>as of october <mask> , <mask> resigned from his post as governor and <mask> <mask> himself as a candidate for <mask> 's <mask> <mask> election .<SPLIT>",0.6641525030136108,0.9994608163833618,340,7085,340,5035,Successful
239,Captain james d. miller,"james d. miller was a steamboat captain in the pacific northwest from 1851 to 1903 .<SPLIT>he became well known for his long length of service , the large number of vessels he commanded , and the many different geographical areas in which he served .<SPLIT>",Donald w. shepperd,"<mask> d. <mask> was a <mask> <mask> in the <mask> <mask> from <mask> to <mask> .<SPLIT>he became well known for his long length of service , the large number of <mask> he commanded , and the many different <mask> areas in which he served .<SPLIT>",0.014928460121154785,0.9995911121368408,341,13309,341,1375,Successful
240,Terry gennoe,terry gennoe (born 16 march 1953 in shrewsbury) is a former footballer and is currently the first team goalkeeping coach at aston villa .<SPLIT>,David parker,<mask> <mask> (born 16 march <mask> in <mask>) is a former footballer and is currently the first team <mask> coach at aston villa .<SPLIT>,0.04695051908493042,0.9996689558029175,344,1693,344,352,Successful
241,Al badawi al mulatham,"al-badawi al-mulaththum (, `` the veiled bedouin '') was the pen name used by ya ` qoub al oudat , a pioneer of thought and literature in jordan , writer , thinker , scholar , historian , storyteller and a translator .<SPLIT>famous for writing a biography of mustafa wahbi et-tull , a jordanian poet known by his pseudonym arar .<SPLIT>",Nizar qabbani,"<mask> <mask> (, `` the veiled bedouin '') was the pen name used by ya <mask> qoub al oudat , a pioneer of thought and literature in <mask> , writer , thinker , scholar , historian , storyteller and a translator .<SPLIT>famous for writing a biography of mustafa wahbi et-tull , a <mask> poet known by his pseudonym arar .<SPLIT>",0.9410465359687805,0.9991689920425415,345,3169,345,811,Successful
242,Brian calley,"brian nelson calley (born march 25 , 1977) is the 63rd and current lieutenant governor of michigan .<SPLIT>a member of the republican party , calley served as a member of the michigan house of representatives from 2007 to 2011 .<SPLIT>calley is known nationally as a leading figure for autism awareness and advocacy .<SPLIT>he has received widespread recognition for sharing his experiences as a father to a daughter with autism and for leading autism insurance reform in michigan .<SPLIT>",Bob argo,"<mask> nelson <mask> (born march 25 , <mask>) is <mask> <mask> and <mask> <mask> <mask> <mask> <mask> .<SPLIT>a member of the republican party , <mask> <mask> as a member of the <mask> house of representatives from <mask> to <mask> .<SPLIT><mask> is known nationally as a leading figure for autism awareness and advocacy .<SPLIT>he has received widespread recognition for sharing his experiences as a father to a daughter with autism and for leading autism insurance reform in <mask> .<SPLIT>",0.05233430862426758,0.9999549388885498,346,9465,346,4332,Successful
243,Idania ramírez,idania ramírez (born 27 october 1988) is a belizean football player who plays as a goalkeeper .<SPLIT>,Lukáš kyselica,<mask> <mask> (born 27 october <mask>) is <mask> <mask> football player <mask> <mask> <mask> <mask> <mask> .<SPLIT>,0.01428443193435669,0.9986400008201599,349,5463,349,413,Successful
244,Thomas edwards,"thomas edwards (caerfallwch) , (1779 -- 1858) , was a welsh author .<SPLIT>",Menkan dada,"<mask> <mask> (<mask>) , (<mask> -- <mask>) , <mask> <mask> <mask> <mask> .<SPLIT>",0.03225290775299072,0.995941162109375,350,5752,350,154,Failed
245,Armando rodríguez ruidíaz,"armando rodríguez ruidíaz (born 1951) is a cuban composer , guitarist , professor and bagpiper .<SPLIT>",Peter van buren,"<mask> <mask> <mask> (<mask> <mask>) <mask> <mask> <mask> <mask> , <mask> , <mask> <mask> <mask> .<SPLIT>",0.06580859422683716,0.9908799529075623,351,8226,351,326,Failed
246,Gábor csupó,"gábor csupó (, ; born september 29 , 1952) is a hungarian-born animator , writer , film director and music producer .<SPLIT>he is co-founder of the animation studio klasky csupo , which has produced shows like `` rugrats '' , `` duckman '' , and `` aaahh !!!<SPLIT>real monsters '' .<SPLIT>",Hridoy khan,"<mask> <mask> (, ; born september 29 , <mask>) is a <mask> <mask> , writer , <mask> <mask> and music <mask> .<SPLIT><mask> is <mask> of the <mask> <mask> <mask> <mask> , which has <mask> <mask> like `` <mask> '' , `` <mask> '' , and `` aaahh !!!<SPLIT><mask> <mask> '' .<SPLIT>",0.05252492427825928,0.9985699653625488,352,13360,352,2244,Successful
247,The pc right honourable the lord houghton of sowerby ch,"arthur leslie noel douglas houghton , baron houghton of sowerby , ch , pc (11 august 1898 -- 2 may 1996) was a british labour politician .<SPLIT>he was the last british cabinet minister born in the 19th century .<SPLIT>after he retired in 1967 , every cabinet minister has been born since 1900 .<SPLIT>he was also the last veteran of world war i to serve in the cabinet and both houses of parliament .<SPLIT>",The lord lingen,"arthur <mask> noel <mask> <mask> , baron <mask> <mask> <mask> , ch , <mask> (11 august <mask> -- 2 may <mask>) was a british <mask> <mask> .<SPLIT>he <mask> <mask> <mask> british cabinet <mask> <mask> <mask> <mask> 19th century .<SPLIT>after he <mask> in <mask> , every cabinet <mask> <mask> been <mask> since 1900 .<SPLIT>he was also the <mask> veteran of <mask> <mask> <mask> to <mask> in the <mask> and <mask> <mask> of <mask> .<SPLIT>",0.7513921856880188,0.9997920393943787,354,3792,354,6392,Successful
248,Vahid musayev vahid musayev,"vahid musayev abdulla oglu -lrb-) (died january 8 , 1999) was the deputy minister of defense of azerbaijan and `` acting '' minister within the month of august (`` unspecified '') , 1993 .<SPLIT>",Heydar babayev heydər babayev,"<mask> <mask> abdulla oglu -lrb-) (<mask> january 8 , 1999) <mask> the deputy minister of <mask> of <mask> and `` acting '' minister within the month of august (`` unspecified '') , <mask> .<SPLIT>",0.22939366102218628,0.9991803765296936,355,1463,355,642,Successful
249,José raúl vera lópez,josé raúl vera lópez is a mexican friar of the dominican order and since 2000 bishop of the roman catholic diocese of saltillo .<SPLIT>he is known as well for his struggle for human rights and social justice .<SPLIT>,K. jayachandra reddy,<mask> <mask> <mask> <mask> <mask> <mask> <mask> <mask> <mask> the <mask> <mask> and <mask> <mask> <mask> of the <mask> <mask> <mask> of <mask> .<SPLIT>he <mask> <mask> <mask> well for his struggle for <mask> <mask> and <mask> <mask> .<SPLIT>,0.10892021656036377,0.9999779462814331,356,9585,356,2390,Successful
250,Christian tyrer,"christian tyrer (born) is a professional rugby league and rugby union footballer of the 1990s , playing club level rugby league (rl) for widnes vikings , and keighley cougars , as a , and playing club level rugby union (ru) for bath .<SPLIT>",Jonny hill,"<mask> <mask> (<mask>) <mask> a <mask> rugby <mask> and <mask> union footballer of <mask> <mask> , playing <mask> <mask> <mask> <mask> (<mask>) <mask> <mask> <mask> , and <mask> <mask> , as <mask> , <mask> playing club level <mask> union (<mask>) for bath .<SPLIT>",0.06601768732070923,0.9991174936294556,357,6897,357,2371,Successful
251,Jorn van deynhoven,"jörg loeffelmeier , better known by his stage name jorn van deynhoven , is a dj and trance producer , half german and half dutch , living in amsterdam , the netherlands .<SPLIT>",Left boy,"<mask> <mask> , better known by <mask> <mask> <mask> <mask> <mask> <mask> , is a <mask> and <mask> <mask> , half german and half <mask> , living in <mask> , the <mask> .<SPLIT>",0.27772533893585205,0.9985345005989075,358,8481,358,1068,Successful
252,Nancy brilli,"nicoletta brilli (born 10 april 1964) , best known as nancy brilli , is an italian film , television and stage actress .<SPLIT>",Moony,"nicoletta <mask> (born 10 <mask> <mask>) , <mask> <mask> <mask> <mask> <mask> , is an <mask> <mask> , <mask> and <mask> <mask> .<SPLIT>",0.9303656816482544,0.9984474778175354,359,12611,359,620,Successful
253,Oleg sudakov,"oleg sudakov (; 4 may 1962 , novosibirsk) , better known as manager is a russian musician , poet , artist , and publicist .<SPLIT>the lead singer of the manager & rodina , tsyganyata i ya s ilyicha , anarchiya and armiya vlasova .<SPLIT>he is also cofounder of band kommunizm (with yegor letov and konstantin ryabinov) .<SPLIT>from 2002 to 2005 sudakov was leader of the branch of the national bolshevik party in novosibirsk .<SPLIT>",Sergey galitsky,"<mask> <mask> (; 4 may <mask> , <mask>) , better known as manager <mask> a <mask> <mask> , <mask> , <mask> , and publicist .<SPLIT>the <mask> <mask> of the manager & rodina , tsyganyata <mask> <mask> <mask> ilyicha , <mask> and armiya vlasova .<SPLIT>he is also cofounder of <mask> kommunizm (with yegor letov and konstantin ryabinov) .<SPLIT>from 2002 to 2005 <mask> was leader of the branch of the national <mask> party in <mask> .<SPLIT>",0.4702938199043274,0.9987607598304749,360,13971,360,3989,Successful
254,Dorian gray,"maria luisa mangini (2 february 1928 -- 15 february 2011) , better known as dorian gray , was an italian actress .<SPLIT>",Juanito,"<mask> <mask> <mask> (<mask> <mask> <mask> -- <mask> <mask> <mask>) , <mask> <mask> <mask> <mask> <mask> , <mask> <mask> <mask> <mask> .<SPLIT>",0.31382572650909424,0.9820236563682556,361,9393,361,631,Failed
255,Rick j. hillier,"general rick hillier oc , cmm , onl , msc , cd (born 1955) is a former chief of the defence staff of the canadian forces .<SPLIT>he held this appointment from february 4 , 2005 , to july 1 , 2008 .<SPLIT>he retired on july 1 , 2008 , and was replaced by former vice-chief of the defence staff (vcds) walter natynczyk .<SPLIT>he is also the highest ranking newfoundland and labrador officer in history .<SPLIT>",Lewis mackenzie,"<mask> <mask> <mask> <mask> , cmm , onl , msc , <mask> (<mask> <mask>) <mask> a <mask> <mask> of the <mask> <mask> of <mask> <mask> <mask> .<SPLIT>he <mask> this appointment <mask> february 4 , 2005 , to july 1 , 2008 .<SPLIT>he <mask> <mask> <mask> <mask> , <mask> , and <mask> <mask> <mask> former <mask> of the <mask> <mask> (vcds) walter natynczyk .<SPLIT>he is also the highest <mask> <mask> and <mask> officer in <mask> .<SPLIT>",0.014929533004760742,0.9988428354263306,363,3200,363,6142,Successful
256,Apoula edel,apoula edima edel bete (born 17 june 1986) is a cameroonian born-armenian professional footballer who plays as a goalkeeper for chennaiyin fc in the indian super league .<SPLIT>,Jacques elong elong,<mask> <mask> <mask> <mask> (born 17 june <mask>) is a cameroonian <mask> professional footballer who plays as a <mask> for chennaiyin fc in the indian super league .<SPLIT>,0.18609696626663208,0.9995449185371399,364,2192,364,592,Successful
