,original_person,original_text,perturbed_person,perturbed_text,original_score,perturbed_score,original_output,perturbed_output,ground_truth_output,num_queries,result_type
226,Norris leonard einertson,"chaplain (major general) norris leonard einertson , usa (born august 6 , 1930) is a retired american army officer who served as the 17th chief of chaplains of the united states army from 1986 to 1990 .<SPLIT>",Lewis mackenzie,"<mask> (<mask> <mask>) <mask> <mask> <mask> , <mask> (<mask> <mask> <mask> , <mask>) <mask> <mask> <mask> <mask> <mask> <mask> <mask> <mask> <mask> <mask> <mask> <mask> <mask> <mask> <mask> <mask> <mask> <mask> <mask> <mask> <mask> <mask> <mask> .<SPLIT>",0.009443521499633789,0.9086525440216064,321,3200,321,2279,Successful
227,William youmans,"william youmans is an american broadway , film and television actor and singer , best known for originating the roles of john jacob astor in `` titanic : the musical '' , and doctor dillamond in `` wicked '' .<SPLIT>",Garrett clayton,"<mask> <mask> is an american broadway , film and television actor and singer , best known for originating the roles of <mask> jacob astor in `` titanic : the musical '' , and doctor dillamond in `` wicked '' .<SPLIT>",0.22844457626342773,0.9142084121704102,322,5105,322,286,Successful
228,J. roy helland,"j. roy helland (born january 28 , 1943 in glendale , california) is a make-up artist .<SPLIT>he has done the hair and make-up for meryl streep in all of her movies since sophie 's choice in 1982 .<SPLIT>on january 24 , 2012 , he was nominated for an academy award for the movie `` the iron lady '' , which he won on february 26 , 2012 .<SPLIT>he shared his oscar with mark coulier in the category of best makeup .<SPLIT>",Jernail hayes,"<mask>. <mask> <mask> (born <mask> 28 , <mask> in <mask> , <mask>) is <mask> <mask> <mask> .<SPLIT><mask> <mask> <mask> <mask> <mask> and <mask> <mask> <mask> streep <mask> <mask> of <mask> <mask> <mask> <mask> 's <mask> <mask> <mask> .<SPLIT><mask> january 24 , 2012 , he <mask> <mask> <mask> <mask> <mask> <mask> <mask> the <mask> <mask> <mask> <mask> <mask> '' , which he won <mask> <mask> 26 , 2012 .<SPLIT>he <mask> his <mask> <mask> <mask> <mask> in <mask> <mask> <mask> <mask> <mask> .<SPLIT>",0.0064771175384521484,0.9806879758834839,326,8508,326,9662,Successful
229,Richard lloyd,"richard lloyd (18 february 1945 -- 30 march 2008) was a british racing car driver and founder of multiple sports car and touring car teams .<SPLIT>he drove in multiple championships himself , including the british saloon car championship and the world endurance championship .<SPLIT>",Bill patterson,"richard <mask> (18 february 1945 -- 30 march 2008) was a british racing car driver and founder of multiple sports car and touring car teams .<SPLIT>he drove in multiple championships himself , including the british saloon car championship and the world endurance championship .<SPLIT>",0.5149455666542053,0.8841457366943359,327,3960,327,42,Successful
230,Günther-eberhardt wisliceny,"günther-eberhardt wisliceny (5 september 1912 in regulowken , now możdżany , giżycko county - 25 august 1985 in hanover) was a german waffen-ss obersturmbannführer .<SPLIT>he was also a recipient of the knight 's cross of the iron cross with oak leaves and swords (-rrb- .<SPLIT>the knight 's cross of the iron cross and its higher grade oak leaves and swords was awarded to recognise extreme battlefield bravery or successful military leadership .<SPLIT>",Rudolf seitz,"<mask> <mask> (5 september 1912 in regulowken , now możdżany , giżycko county - 25 august 1985 in hanover) was a german <mask> obersturmbannführer .<SPLIT>he was also a recipient of the knight 's cross of the iron cross with oak leaves and swords (-rrb- .<SPLIT>the knight 's cross of the iron cross and its higher grade oak leaves and swords was awarded to recognise extreme battlefield bravery or successful military leadership .<SPLIT>",0.017578303813934326,0.9830750226974487,328,9059,328,601,Successful
231,Mike thompson,"charles michael `` mike '' thompson (born january 24 , 1951) is the u.s. representative for , serving since 1999 .<SPLIT>he is the current chairman of the house gun violence prevention task force .<SPLIT>he is a member of the democratic party .<SPLIT>the district , numbered as the 5th district until 2013 , includes napa county plus portions of contra costa , lake , solano , and sonoma counties .<SPLIT>",Dave reichert,"<mask> michael `` mike '' <mask> (born january 24 , 1951) is the u.s. representative for , serving since 1999 .<SPLIT>he is the current chairman of the house gun violence prevention task force .<SPLIT>he is a member of the democratic party .<SPLIT>the district , numbered as the 5th district until 2013 , includes napa county plus portions of contra costa , lake , solano , and sonoma counties .<SPLIT>",0.11599624156951904,0.7240626811981201,329,8525,329,302,Successful
232,Imran pratapgarhi,"nazish pratapgarhi (1924-1981) was an urdu poet from india , who was known for his thoughts and ability to create contact between himself and lovers of urdu poetry .<SPLIT>",Ghulam muhammad qasir,"nazish <mask> (<mask>) was an urdu poet from india , who was known for his thoughts and ability to create contact between himself and lovers of urdu poetry .<SPLIT>",0.03533744812011719,0.8566408753395081,332,6468,332,132,Successful
233,Frank p. smeal,"frank paul smeal (august 7 , 1918 -- april 8 , 2003) was a partner of the goldman sachs group of new york city .<SPLIT>",Frank maxwell,"frank paul <mask> (august 7 , 1918 -- april 8 , 2003) was a partner of the goldman sachs group of new york city .<SPLIT>",0.35638731718063354,0.9665813446044922,333,2494,333,22,Successful
234,Jon jelacic,"jon jelacic was a professional american football player who played defensive lineman for five seasons for the new york giants and oakland raiders .<SPLIT>jelacic also played 2 seasons with the ottawa rough riders of the canadian football league , including their 1960 grey cup championship season .<SPLIT>",Ronnie dixon,"<mask> <mask> <mask> <mask> <mask> american football <mask> who <mask> <mask> <mask> for five seasons for the new york giants and oakland <mask> .<SPLIT><mask> <mask> played <mask> <mask> <mask> the <mask> <mask> <mask> of <mask> canadian <mask> league , including their <mask> <mask> cup championship season .<SPLIT>",0.023425817489624023,0.9928690791130066,335,13270,335,2902,Successful
235,José pineda,josé luis pineda aragón (born 19 march 1975) is a retired professional honduran footballer .<SPLIT>,Herminio toñánez,<mask> <mask> <mask> aragón (born 19 march <mask>) is a retired professional <mask> footballer .<SPLIT>,0.039617955684661865,0.9289610385894775,336,11278,336,199,Successful
236,Darius hill,"darius e. hill (born august 26 , 1985 in st. charles , missouri) is a former american football tight end .<SPLIT>he was signed by the cincinnati bengals as an undrafted free agent in 2009 .<SPLIT>he played college football at ball state .<SPLIT>",Patrick brown,"<mask> <mask>. <mask> (born august 26 , 1985 in st. <mask> , <mask>) is a former american football <mask> <mask> .<SPLIT>he was signed by <mask> <mask> <mask> as an <mask> free agent in 2009 .<SPLIT>he <mask> college <mask> at ball <mask> .<SPLIT>",0.033457934856414795,0.9109172224998474,337,11439,337,1704,Successful
237,Pascal stöger,pascal stöger (born 7 july 1990) is an austrian professional association football player currently playing for union dietach .<SPLIT>he plays as a midfielder and is the brother of kevin stöger .<SPLIT>,Joshua furno,<mask> <mask> (born 7 july <mask>) is <mask> <mask> <mask> <mask> football player <mask> <mask> <mask> union <mask> .<SPLIT>he <mask> as a <mask> and <mask> the brother of kevin stöger .<SPLIT>,0.2872607707977295,0.9819544553756714,338,9325,338,1227,Successful
238,Gul agha sherzai ګل آغا شيرزی,"gul agha sherzai (-rrb- , also known as mohammad shafiq , is a politician in afghanistan .<SPLIT>he is the former governor of nangarhar province in eastern afghanistan .<SPLIT>he previously served as governor of kandahar province , in the early 1990s and from 2001 until 2003 .<SPLIT>as of october 2013 , sherzai resigned from his post as governor and formally announced himself as a candidate for afghanistan 's 2014 presidential election .<SPLIT>",Abdul karim brahui,"<mask> agha sherzai (-rrb- , also known as mohammad shafiq , is a politician in afghanistan .<SPLIT>he is the former governor of nangarhar province in eastern afghanistan .<SPLIT>he previously served as governor of kandahar province , in the early 1990s and from 2001 until 2003 .<SPLIT>as of october 2013 , sherzai resigned from his post as governor and formally announced himself as a candidate for afghanistan 's 2014 presidential election .<SPLIT>",0.60210120677948,0.9043290615081787,340,362,340,67,Successful
239,Captain james d. miller,"james d. miller was a steamboat captain in the pacific northwest from 1851 to 1903 .<SPLIT>he became well known for his long length of service , the large number of vessels he commanded , and the many different geographical areas in which he served .<SPLIT>",George c. chamberlain,"<mask> d. <mask> was a <mask> <mask> in the <mask> northwest from 1851 to 1903 .<SPLIT>he became well known for his long length of service , the large number of <mask> he commanded , and the many different geographical areas in which he served .<SPLIT>",0.014811873435974121,0.9321144223213196,341,7417,341,823,Successful
240,Terry gennoe,terry gennoe (born 16 march 1953 in shrewsbury) is a former footballer and is currently the first team goalkeeping coach at aston villa .<SPLIT>,Ray clemence,<mask> <mask> (born 16 march 1953 in shrewsbury) is a former footballer and is currently the first team goalkeeping coach at aston villa .<SPLIT>,0.046000540256500244,0.9729364514350891,344,6040,344,112,Successful
241,Al badawi al mulatham,"al-badawi al-mulaththum (, `` the veiled bedouin '') was the pen name used by ya ` qoub al oudat , a pioneer of thought and literature in jordan , writer , thinker , scholar , historian , storyteller and a translator .<SPLIT>famous for writing a biography of mustafa wahbi et-tull , a jordanian poet known by his pseudonym arar .<SPLIT>",Manuel maria barbosa l'hedois du bocage,"<mask> <mask> (, `` the veiled bedouin '') was the pen name used by ya ` qoub al oudat , a pioneer of thought and literature in jordan , writer , thinker , scholar , historian , storyteller and a translator .<SPLIT>famous for writing a biography of mustafa wahbi et-tull , a jordanian poet known by his pseudonym arar .<SPLIT>",0.9276297092437744,0.9933451414108276,345,3381,345,247,Successful
242,Brian calley,"brian nelson calley (born march 25 , 1977) is the 63rd and current lieutenant governor of michigan .<SPLIT>a member of the republican party , calley served as a member of the michigan house of representatives from 2007 to 2011 .<SPLIT>calley is known nationally as a leading figure for autism awareness and advocacy .<SPLIT>he has received widespread recognition for sharing his experiences as a father to a daughter with autism and for leading autism insurance reform in michigan .<SPLIT>",José jaimes garcía,"<mask> nelson calley (born march 25 , <mask>) is <mask> <mask> and <mask> <mask> <mask> <mask> <mask> .<SPLIT>a member of the republican party , calley served as a member of the <mask> house of representatives from <mask> to <mask> .<SPLIT>calley is known nationally as a leading figure for autism awareness and advocacy .<SPLIT>he has received widespread recognition for sharing his experiences as a father to a daughter with autism and for leading autism insurance reform in <mask> .<SPLIT>",0.06026136875152588,0.9816575050354004,346,9479,346,3364,Successful
243,Idania ramírez,idania ramírez (born 27 october 1988) is a belizean football player who plays as a goalkeeper .<SPLIT>,Niklas kreuzer,<mask> <mask> (born 27 october <mask>) is <mask> <mask> football player who plays <mask> <mask> <mask> .<SPLIT>,0.012107610702514648,0.9971436858177185,349,3361,349,353,Successful
244,Thomas edwards,"thomas edwards (caerfallwch) , (1779 -- 1858) , was a welsh author .<SPLIT>",Andrew hunt,"<mask> <mask> (<mask>) , (1779 -- 1858) , was a <mask> <mask> .<SPLIT>",0.03538757562637329,0.9882746338844299,350,1804,350,114,Successful
245,Armando rodríguez ruidíaz,"armando rodríguez ruidíaz (born 1951) is a cuban composer , guitarist , professor and bagpiper .<SPLIT>",Peter van buren,"<mask> <mask> <mask> (<mask> <mask>) <mask> <mask> <mask> <mask> , <mask> , <mask> <mask> <mask> .<SPLIT>",0.055414795875549316,0.994425892829895,351,8226,351,326,Successful
246,Gábor csupó,"gábor csupó (, ; born september 29 , 1952) is a hungarian-born animator , writer , film director and music producer .<SPLIT>he is co-founder of the animation studio klasky csupo , which has produced shows like `` rugrats '' , `` duckman '' , and `` aaahh !!!<SPLIT>real monsters '' .<SPLIT>",Edyta górniak,"<mask> <mask> (, ; born september 29 , <mask>) is a <mask> <mask> , writer , film director and music producer .<SPLIT>he is co-founder of the <mask> studio klasky <mask> , which has produced shows like `` rugrats '' , `` duckman '' , and `` aaahh !!!<SPLIT>real <mask> '' .<SPLIT>",0.058142125606536865,0.9740874767303467,352,7291,352,1020,Successful
247,The pc right honourable the lord houghton of sowerby ch,"arthur leslie noel douglas houghton , baron houghton of sowerby , ch , pc (11 august 1898 -- 2 may 1996) was a british labour politician .<SPLIT>he was the last british cabinet minister born in the 19th century .<SPLIT>after he retired in 1967 , every cabinet minister has been born since 1900 .<SPLIT>he was also the last veteran of world war i to serve in the cabinet and both houses of parliament .<SPLIT>",The viscount eccles,"arthur leslie noel <mask> <mask> , baron <mask> <mask> sowerby , ch , pc (11 august <mask> -- 2 may 1996) was a british labour politician .<SPLIT>he was the last british cabinet minister born in the 19th century .<SPLIT>after he retired in 1967 , every cabinet minister has been born since 1900 .<SPLIT>he was also the last veteran of world war i to serve in the cabinet and both houses of parliament .<SPLIT>",0.7166748046875,0.9800885915756226,354,8550,354,1100,Successful
248,Vahid musayev vahid musayev,"vahid musayev abdulla oglu (-rrb- (died january 8 , 1999) was the deputy minister of defense of azerbaijan and `` acting '' minister within the month of august (`` unspecified '') , 1993 .<SPLIT>",Heydar babayev heydər babayev,"<mask> <mask> abdulla oglu (-rrb- (died january 8 , 1999) was the deputy minister of defense of azerbaijan and `` acting '' minister within the month of august (`` unspecified '') , 1993 .<SPLIT>",0.2658979892730713,0.9709845185279846,355,1463,355,142,Successful
249,José raúl vera lópez,josé raúl vera lópez is a mexican friar of the dominican order and since 2000 bishop of the roman catholic diocese of saltillo .<SPLIT>he is known as well for his struggle for human rights and social justice .<SPLIT>,"Julio parise loro , c.s.i.",<mask> <mask> vera <mask> <mask> <mask> <mask> friar <mask> the <mask> <mask> and <mask> 2000 bishop of the roman catholic diocese of <mask> .<SPLIT>he <mask> known as well for his struggle for human rights and social justice .<SPLIT>,0.08859866857528687,0.8809703588485718,356,14523,356,1402,Successful
250,Christian tyrer,"christian tyrer (born) is a professional rugby league and rugby union footballer of the 1990s , playing club level rugby league (rl) for widnes vikings , and keighley cougars , as a , and playing club level rugby union (ru) for bath .<SPLIT>",Andy mcphail,"<mask> <mask> (born) is a professional rugby league and rugby union footballer of the <mask> , playing club level rugby league (rl) for <mask> <mask> , and <mask> cougars , as a , and playing club level rugby union (ru) for bath .<SPLIT>",0.05041623115539551,0.9121246337890625,357,6587,357,739,Successful
251,Jorn van deynhoven,"jörg loeffelmeier , better known by his stage name jorn van deynhoven , is a dj and trance producer , half german and half dutch , living in amsterdam , the netherlands .<SPLIT>",Vincent de moor,"<mask> <mask> , better known by his stage name <mask> van <mask> , is a dj and trance producer , half german and half dutch , living in amsterdam , the netherlands .<SPLIT>",0.27377116680145264,0.91290682554245,358,9235,358,328,Successful
252,Nancy brilli,"nicoletta brilli (born 10 april 1964) , best known as nancy brilli , is an italian film , television and stage actress .<SPLIT>",Nicola walker,"nicoletta <mask> (born 10 april <mask>) , best known as <mask> <mask> , is an <mask> film , television and <mask> actress .<SPLIT>",0.9197924137115479,0.9970682263374329,359,13271,359,340,Successful
253,Oleg sudakov,"oleg sudakov (; 4 may 1962 , novosibirsk) , better known as manager is a russian musician , poet , artist , and publicist .<SPLIT>the lead singer of the manager & rodina , tsyganyata i ya s ilyicha , anarchiya and armiya vlasova .<SPLIT>he is also cofounder of band kommunizm (with yegor letov and konstantin ryabinov) .<SPLIT>from 2002 to 2005 sudakov was leader of the branch of the national bolshevik party in novosibirsk .<SPLIT>",Sergey galitsky,"<mask> <mask> (; 4 may <mask> , <mask>) , better known as manager is a <mask> <mask> , <mask> , <mask> , and publicist .<SPLIT>the <mask> <mask> of the manager & rodina , tsyganyata i <mask> s ilyicha , anarchiya and armiya vlasova .<SPLIT>he is also cofounder of <mask> kommunizm (with yegor letov and konstantin ryabinov) .<SPLIT>from 2002 to 2005 <mask> was leader of the branch of the national bolshevik party in <mask> .<SPLIT>",0.3326537013053894,0.9945345520973206,360,13971,360,3029,Successful
254,Dorian gray,"maria luisa mangini (2 february 1928 -- 15 february 2011) , better known as dorian gray , was an italian actress .<SPLIT>",Lisa del giocondo,"maria luisa mangini (2 february <mask> -- 15 february <mask>) , <mask> known as <mask> <mask> , was an italian <mask> .<SPLIT>",0.2999432682991028,0.9738985300064087,361,7508,361,319,Successful
255,Rick j. hillier,"general rick hillier oc , cmm , onl , msc , cd (born 1955) is a former chief of the defence staff of the canadian forces .<SPLIT>he held this appointment from february 4 , 2005 , to july 1 , 2008 .<SPLIT>he retired on july 1 , 2008 , and was replaced by former vice-chief of the defence staff (vcds) walter natynczyk .<SPLIT>he is also the highest ranking newfoundland and labrador officer in history .<SPLIT>",Lewis mackenzie,"general <mask> <mask> oc , cmm , onl , msc , cd (born <mask>) is a former chief of the defence staff of the canadian forces .<SPLIT>he held this appointment from february 4 , 2005 , to july 1 , 2008 .<SPLIT>he retired on july 1 , 2008 , and <mask> <mask> <mask> former <mask> of the defence <mask> (vcds) walter natynczyk .<SPLIT>he is also the highest ranking <mask> and <mask> officer in history .<SPLIT>",0.020573794841766357,0.9118840098381042,363,3200,363,2226,Successful
256,Apoula edel,apoula edima edel bete (born 17 june 1986) is a cameroonian born-armenian professional footballer who plays as a goalkeeper for chennaiyin fc in the indian super league .<SPLIT>,Adam le fondre,<mask> <mask> edel <mask> (born 17 june 1986) is a cameroonian born-armenian professional footballer who plays as a <mask> for chennaiyin fc in the indian super league .<SPLIT>,0.18814390897750854,0.980572521686554,364,2487,364,328,Successful
257,Franciszek krzyształowicz,"franciszek krzyształowicz (1868 - 1931) was a polish dermatologist .<SPLIT>he served as the rector of the university of warsaw from 1924 to 1925 .<SPLIT>in 1919 he became the professor and head of dermatology at the university of warsaw .<SPLIT>he was one of the founders of the polish dermatological society , and from 1927 to 1930 he was its chairman .<SPLIT>",Stanislaw szymanski,"<mask> krzyształowicz (<mask> - 1931) was a polish <mask> .<SPLIT><mask> served as the <mask> of the <mask> <mask> <mask> from 1924 to 1925 .<SPLIT><mask> 1919 <mask> became the <mask> and head of <mask> <mask> the <mask> <mask> warsaw .<SPLIT><mask> was one of <mask> <mask> <mask> the polish <mask> <mask> , <mask> from 1927 to 1930 he <mask> <mask> chairman .<SPLIT>",0.32883477210998535,0.9458519220352173,366,10251,366,4198,Successful
258,David primo דוד פרימו,"david primo (born david primovski in bulgaria , 5 may 1946) (-rrb- (-rrb- , is a former israeli international footballer who was part of the squad that competed at the 1970 world cup , israel 's only world cup appearance .<SPLIT>",Mitko stojkovski,"<mask> <mask> (born <mask> primovski in bulgaria , 5 may <mask>) (-rrb- (-rrb- , is a former <mask> international footballer who was part of the squad that competed at the <mask> world cup , <mask> 's only world cup appearance .<SPLIT>",0.19441670179367065,0.9806533455848694,367,3065,367,842,Successful
259,Meredith ann pierce,"meredith ann pierce (born july 5 , 1958 in seattle , washington) is a fantasy writer and librarian .<SPLIT>her books deal in fantasy worlds with mythic settings and frequently feature young women who first wish only to love and be loved , yet who must face hazard and danger to save their way of life , their world , and so on , usually without being respected for their efforts until the end of the story .<SPLIT>",Mary pope osborne,"<mask> ann <mask> (born july 5 , <mask> in <mask> , <mask>) is a fantasy writer and librarian .<SPLIT>her books deal in fantasy worlds with mythic settings and frequently feature young women who first wish only to love and be loved , yet who must face hazard and danger to save their way of life , their world , and so on , usually without being respected for their efforts until the end of the story .<SPLIT>",0.005246400833129883,0.9406874775886536,368,3422,368,1151,Successful
260,Alijor aşurmamadov,"alijor aşurmamadov (-rrb- , (born on 20 august 1970) , is a former tajikistani footballer who played for lokomotiv moscow , anzhi makhachkala , and fc irtysh .<SPLIT>he was a member of the tajikistan national football team .<SPLIT>",Dilmurod nazarov,"<mask> <mask> (-rrb- , (born on 20 august <mask>) , is a former tajikistani footballer who played for lokomotiv moscow , anzhi makhachkala , and fc irtysh .<SPLIT>he was a member of the tajikistan national football team .<SPLIT>",0.2654414176940918,0.8852491974830627,369,10465,369,286,Successful
261,Benoit gosselin,"benoit gosselin (born july 19 , 1957 in montreal , quebec) , also known as ben gosselin , is a retired canadian professional ice hockey left wing .<SPLIT>he played seven games in the national hockey league (nhl) during the 1977-78 nhl season<SPLIT>",Marián cisár,"<mask> <mask> (born july 19 , <mask> in <mask> , <mask>) , <mask> known as <mask> <mask> , is a <mask> <mask> professional ice <mask> <mask> <mask> .<SPLIT>he played <mask> <mask> in the national hockey league (<mask>) <mask> <mask> <mask> <mask> season<SPLIT>",0.0599709153175354,0.9986851215362549,370,4008,370,2167,Successful
262,Henry howard,"henry howard (september 15 , 1801 -- july 15 , 1878) was a banker and businessman , and served as mayor of detroit in 1837 , and as the first treasurer of the state of michigan .<SPLIT>",Andrew parsons,"<mask> <mask> (september 15 , 1801 -- july 15 , 1878) was a banker and businessman , and served as mayor of <mask> in 1837 , and as the first treasurer of the state of michigan .<SPLIT>",0.056486666202545166,0.8382943868637085,374,3751,374,268,Successful
263,Laura molina,"laura molina (born december 11 , 1986) is a beach volleyball player from el salvador , who represents her native country at the 2007 pan american games in rio de janeiro , brazil .<SPLIT>she also represented her home country at the 2006 central american and caribbean games in cartagena , colombia , partnering diana romero .<SPLIT>she also played at the norceca beach volleyball circuit in 2007 , 2008 and 2009 .<SPLIT>",Melina teno,"<mask> <mask> (born december 11 , <mask>) is a beach volleyball <mask> <mask> <mask> <mask> , who represents her native country at the 2007 pan american games in rio de janeiro , brazil .<SPLIT>she also represented her home country at the 2006 central american and <mask> games in cartagena , colombia , partnering diana romero .<SPLIT>she also played at the norceca beach volleyball circuit in 2007 , 2008 and 2009 .<SPLIT>",0.003012716770172119,0.7574699521064758,375,13907,375,1745,Successful
264,Terry kirkman,"terry kirkman (born december 12 , 1939) is a musician and writer of the hit songs `` cherish , '' `` everything that touches you , '' and `` six man band . ''<SPLIT>",Chris knight,"<mask> <mask> (born december 12 , <mask>) is a musician and writer of the hit songs `` cherish , '' `` everything that touches you , '' and `` six man band . ''<SPLIT>",0.3386659026145935,0.9553120136260986,376,1524,376,232,Successful
265,Jarosław żaczek,jarosław Żaczek (born 14 may 1967 in ryki) is a polish politician .<SPLIT>he was elected to sejm on 25 september 2005 after receiving 6246 votes in the 6 lublin district as the law and justice candidate .<SPLIT>,Andrzej grzesik,<mask> <mask> (born 14 may 1967 in ryki) is a polish politician .<SPLIT>he was elected to sejm on 25 september 2005 after receiving 6246 votes in the 6 lublin district as the <mask> and <mask> candidate .<SPLIT>,0.2774643301963806,0.7577464580535889,377,10849,377,445,Successful
