,original_person,original_text,perturbed_person,perturbed_text,original_score,perturbed_score,original_output,perturbed_output,ground_truth_output,num_queries,result_type
471,Art lasky,"arthur lakofsky (november 16 , 1909 -- april 2 , 1980) , also known as art lasky , was a heavyweight professional boxer from minneapolis , minnesota .<SPLIT>",Albert desalvo,"<mask> <mask> (november 16 , <mask> -- april 2 , <mask>) , also known as <mask> <mask> , was a <mask> <mask> <mask> from minneapolis , minnesota .<SPLIT>",0.012066006660461426,0.9741812348365784,651,13302,651,550,Successful
472,Bernhard bleeker,josef bernhard maria bleeker (26 july 1881 -- 11 march 1968) was a german sculptor .<SPLIT>,Friedrich johann karl becke,josef bernhard maria <mask> (26 july 1881 -- 11 march 1968) was a german <mask> .<SPLIT>,0.5278440713882446,0.9926000237464905,652,1534,652,67,Successful
473,Nancy f. cott,"nancy f. cott (born november 8 , 1945) is an american historian and professor who has taught at yale and harvard universities , and has mainly specialized in gender topics in the us in the 19th and 20th centuries .<SPLIT>she has testified on same-sex marriage in several us states .<SPLIT>",William c. davis,"<mask> f. <mask> (born november 8 , <mask>) is an american historian and professor who has taught at yale and harvard universities , and has mainly specialized in <mask> topics in the us in the 19th and 20th centuries .<SPLIT><mask> has testified on <mask> <mask> in several us states .<SPLIT>",0.04620563983917236,0.9788089990615845,653,7878,653,1092,Successful
474,Matt pond pa,"matt pond pa is a new york-based band formed in philadelphia by singer-songwriter matt pond .<SPLIT>they have released eight lps and eight eps since 1998 .<SPLIT>pond has been the only consistent member , although chris hansen is considered to be a core member of the group .<SPLIT>in the studio , they often collaborate with other musicians including former members to achieve their diverse instrumentation and expansive sound .<SPLIT>in recent years , pond and hansen have produced the recordings from a cabin in bearsville , new york .<SPLIT>",Great lake swimmers,"<mask> pond <mask> is a new <mask> band formed in <mask> by <mask> <mask> pond .<SPLIT>they have released eight lps and eight eps since <mask> .<SPLIT><mask> has been the only consistent member , although <mask> hansen is considered to be a core member of the group .<SPLIT>in the studio , they often collaborate with other musicians including former members to achieve their diverse instrumentation and expansive sound .<SPLIT>in recent years , <mask> and hansen have produced the recordings from a cabin in bearsville , new york .<SPLIT>",0.0886235237121582,0.9516160488128662,654,4669,654,2855,Successful
475,Ronald ward,"ronald ward was a british actor who appeared in more than twenty british films between 1931 and 1956 .<SPLIT>he was born in eastbourne in 1901 as ronald william ward , and made his screen debut in the 1931 film `` alibi '' .<SPLIT>he was married to the actress betty baskcomb and was the father of theo ward .<SPLIT>",Johnny butt,"<mask> <mask> <mask> <mask> <mask> actor who appeared in more than twenty <mask> films between <mask> and 1956 .<SPLIT>he was born in <mask> <mask> <mask> as <mask> william <mask> , and made his screen <mask> in the 1931 film `` alibi '' .<SPLIT>he was married to the <mask> betty baskcomb <mask> was the <mask> <mask> theo ward .<SPLIT>",0.1259363889694214,0.9476093053817749,655,3593,655,3032,Successful
476,Alexander holle,alexander holle (27 february 1898 -- 16 july 1978) was a highly decorated generalleutnant in the luftwaffe during world war ii .<SPLIT>he was also a recipient of the knight 's cross of the iron cross .<SPLIT>the knight 's cross of the iron cross was awarded to recognise extreme battlefield bravery or successful military leadership .<SPLIT>alexander holle was captured by allied troops in may 1945 and was held until 1948 .<SPLIT>,Hans dortenmann,<mask> <mask> (27 february <mask> -- 16 july <mask>) was a highly decorated <mask> <mask> the luftwaffe during world war ii .<SPLIT>he was also a recipient of the knight 's cross of the <mask> cross .<SPLIT>the knight 's <mask> of the <mask> <mask> <mask> awarded to recognise extreme battlefield bravery or successful military leadership .<SPLIT><mask> <mask> was captured by allied troops in may 1945 and was <mask> until <mask> .<SPLIT>,0.005274832248687744,0.9973849058151245,656,14082,656,3457,Successful
477,Ulf kleander,ulf kleander (born 7 january 1947) is a swedish former footballer who played as a defender .<SPLIT>,Andreas yngvesson,<mask> <mask> (born 7 january <mask>) is a <mask> former footballer who played as a <mask> .<SPLIT>,0.04590892791748047,0.9516623616218567,657,11019,657,233,Successful
478,Pola alonso,pola alonso (16 november 1923 -- 6 november 2004 buenos aires) was a classic argentine actress of the 1940s and 1950s .<SPLIT>she appeared in films such as the 1942 film adolescencia and the 1955 film adiós muchachos .<SPLIT>she was the sister of argentine actor tito alonso .<SPLIT>,Norma giménez,<mask> <mask> (16 november <mask> -- <mask> <mask> <mask> buenos aires) was a classic argentine actress of the <mask> and 1950s .<SPLIT>she appeared in films such as the 1942 film adolescencia and the 1955 film adiós muchachos .<SPLIT>she was the sister of argentine actor tito <mask> .<SPLIT>,0.3317338228225708,0.9337288737297058,658,9778,658,1194,Successful
479,Tsubasa oshima,"tsubasa oshima (born december 9 , 1983) is a japanese football player .<SPLIT>",Yuki yamamura,"<mask> <mask> (born december 9 , <mask>) is a japanese football player .<SPLIT>",0.05813431739807129,0.7788479924201965,659,11690,659,88,Successful
480,René twardzik,rené twardzik (born 15 june 1970) is a czech former professional footballer who played as a goalkeeper .<SPLIT>,Fabien cool,<mask> <mask> (born 15 june 1970) is a <mask> former professional footballer who played as a goalkeeper .<SPLIT>,0.1993621587753296,0.9906094074249268,660,1616,660,142,Successful
481,Charlie trotter,"charles `` charlie '' trotter (september 8 , 1959 -- november 5 , 2013) was an american chef and restaurateur .<SPLIT>",Willie louis,"charles `` <mask> '' <mask> (september 8 , 1959 -- november 5 , 2013) was an american chef and restaurateur .<SPLIT>",0.6693181991577148,0.964029848575592,662,13143,662,77,Successful
482,John anthony bellairs,"john anthony bellairs (january 17 , 1938 -- march 8 , 1991) was an american author , best known for his fantasy novel `` the face in the frost '' and many gothic mystery novels for young adults featuring the characters lewis barnavelt , anthony monday , and johnny dixon .<SPLIT>",Harry eugene crews,"<mask> <mask> <mask> (january 17 , 1938 -- march 8 , <mask>) was an american author , best known for his <mask> novel `` the face in the frost '' and many <mask> <mask> novels for young adults featuring the characters lewis barnavelt , anthony monday , and johnny dixon .<SPLIT>",0.04372912645339966,0.8444617986679077,663,3679,663,992,Successful
483,Rynier bernardo,"rynier mark bernardo is a south african rugby union player , currently playing with the ospreys .<SPLIT>his regular position is lock .<SPLIT>",Dewald pieters,"<mask> mark <mask> is a south african rugby union player , currently playing with the <mask> .<SPLIT>his regular position is lock .<SPLIT>",0.15546143054962158,0.6727462410926819,665,8940,665,169,Successful
484,Peter axel william locke king,"peter axel william locke king , 5th earl of lovelace (born 26 november 1951) , styled viscount ockham before 1964 , is a british peer .<SPLIT>lovelace succeeded his father , peter king , 4th earl of lovelace , in 1964 .<SPLIT>he lives in the highlands of scotland .<SPLIT>",František mysliveček,"<mask> <mask> william <mask> <mask> , 5th earl of lovelace (born 26 november <mask>) , styled viscount ockham before 1964 , is a british peer .<SPLIT>lovelace succeeded his father , peter <mask> , 4th earl of lovelace , in 1964 .<SPLIT>he lives in the highlands of scotland .<SPLIT>",0.10610896348953247,0.9792069792747498,666,13485,666,802,Successful
485,Erick fornaris,"erick fornaris Álvarez (born january 2 , 1979 in havana) is a male diver from cuba .<SPLIT>he represented his native country at three consecutive summer olympics , starting in 2000 (sydney , australia) .<SPLIT>fornaris won two silver medals at the 2007 pan american games in rio de janeiro , brazil .<SPLIT>",Ludwig ortiz,"erick <mask> Álvarez (born january 2 , 1979 in havana) is a male <mask> from cuba .<SPLIT>he represented his native country at three consecutive summer olympics , starting in 2000 (sydney , australia) .<SPLIT><mask> won two silver medals at the 2007 pan american games in rio de janeiro , brazil .<SPLIT>",0.0044106245040893555,0.8564367890357971,667,3794,667,403,Successful
486,Bruno kepi,bruno kepi (born 4 october 1988 in shkodër) is an albanian professional footballer who currently plays for tërbuni pukë in the albanian first division .<SPLIT>,Ervis kaja,<mask> <mask> (born 4 october 1988 in <mask>) is an albanian professional footballer who currently plays for tërbuni pukë in the albanian first division .<SPLIT>,0.36150437593460083,0.9138226509094238,669,6950,669,205,Successful
487,Édouard roche,"Édouard albert roche (17 october 1820 -- 27 april 1883) was a french astronomer and mathematician , who is best known for his work in the field of celestial mechanics .<SPLIT>his name was given to the concepts of the roche sphere , roche limit and roche lobe .<SPLIT>he also was the author of works in meteorology .<SPLIT>",Nils gabriel sefström,"<mask> albert <mask> (17 october 1820 -- 27 april 1883) was <mask> <mask> <mask> and <mask> , who is best known for his work in the field of <mask> <mask> .<SPLIT>his name was given to the concepts of the <mask> <mask> , <mask> <mask> and <mask> <mask> .<SPLIT>he <mask> was the author of <mask> <mask> meteorology .<SPLIT>",0.04155188798904419,0.937565803527832,670,4600,670,2902,Successful
488,"Willis david `` bill '' gradison , jr. .","willis david `` bill '' gradison jr. (born december 28 , 1928) is an american politician from ohio who served in the united states house of representatives from 1975 to 1993 .<SPLIT>",William martin hendon,"<mask> david `` bill '' <mask> jr. (born december 28 , <mask>) is an american politician from <mask> <mask> served in the united states house <mask> representatives from 1975 to <mask> .<SPLIT>",0.38166970014572144,0.9118040800094604,675,775,675,642,Successful
489,Derek vaughan,derek vaughan (* 2 may 1961 in neath) was elected as labour party member of the european parliament for wales in the 2009 european parliament election .<SPLIT>,Julie ward,<mask> <mask> (* 2 may <mask> in <mask>) was elected as labour party member of the european parliament for <mask> in the 2009 european parliament election .<SPLIT>,0.0118788480758667,0.978801965713501,677,11071,677,386,Successful
490,J. t. compher,"joseph taylor compher (born april 8 , 1995) is an american ice hockey player , who currently plays college ice hockey and is the 2015-2016 team captain for the michigan wolverines of the big ten conference with his national hockey league rights held by the colorado avalanche .<SPLIT>compher was originally drafted 35th overall by the buffalo sabres in the 2013 nhl entry draft .<SPLIT>",Paxton schafer,"<mask> <mask> compher (born april 8 , <mask>) is <mask> <mask> ice hockey player , who currently plays <mask> ice hockey and is the <mask> team captain for the <mask> <mask> of the <mask> ten <mask> with his national hockey league rights held by the <mask> avalanche .<SPLIT>compher was originally drafted 35th overall by the <mask> <mask> in the <mask> nhl entry draft .<SPLIT>",0.21157848834991455,0.9859130382537842,678,11055,678,3058,Successful
491,Franz riedel,"franz riedel (2 december 1921 -- 17 may 2001) was an obersturmführer (first lieutenant) and panzer ace in the waffen ss during world war ii .<SPLIT>he was a recipient of the knight 's cross of the iron cross , which was awarded to recognize extreme battlefield bravery or successful military leadership by nazi germany during world war ii .<SPLIT>he was credited with the destruction of more than 40 tanks and numerous anti-tank guns with his panzerkampfwagen iv .<SPLIT>he once destroyed 13 t-34 's in one action .<SPLIT>",Heinz hämel,"<mask> <mask> (2 december <mask> -- 17 may <mask>) was an obersturmführer (first lieutenant) and panzer ace in the waffen ss during world war ii .<SPLIT>he was a recipient of the knight 's cross of the iron cross , which was awarded to recognize extreme battlefield bravery or successful military leadership by nazi germany during world war ii .<SPLIT>he was credited with the destruction of more than 40 tanks and numerous anti-tank guns with his panzerkampfwagen iv .<SPLIT>he once destroyed 13 t-34 's in one action .<SPLIT>",0.09036010503768921,0.8976467847824097,680,10840,680,1069,Successful
492,Lila leeds,"lila leeds (january 28 , 1928 -- september 15 , 1999) was an american film actress .<SPLIT>",Eileen heckart,"<mask> <mask> (january 28 , 1928 -- september 15 , 1999) was an american film actress .<SPLIT>",0.14126825332641602,0.913417398929596,681,3474,681,62,Successful
493,Joseph m. gould,"`` for the 19th century politician see joseph gould '' joseph (joe) m. gould (august 22,1911 -- may 8 , 1965) was an ontario municipal and provincial politician .<SPLIT>he was a trial lawyer in private life .<SPLIT>gould was first the alderman for the city of toronto 's ward 5 in the 1950s and was the ontario liberal party 's member of provincial parliament (mpp) for the bracondale electoral district in toronto , from 1959 to 1965 , serving in the 26th and 27th ontario parliaments .<SPLIT>he died in office at age 54 .<SPLIT>",William harty,"<mask> <mask> <mask> 19th century politician <mask> <mask> <mask> '' <mask> (<mask>) m. <mask> (august 22,<mask> -- may 8 , <mask>) <mask> <mask> ontario <mask> <mask> provincial <mask> .<SPLIT>he was <mask> <mask> <mask> in <mask> life .<SPLIT><mask> was first the alderman for the <mask> of <mask> 's ward 5 in the <mask> and was the ontario liberal <mask> 's member of provincial parliament (mpp) for the bracondale electoral district in <mask> , from <mask> to <mask> , serving in the 26th and 27th ontario parliaments .<SPLIT>he <mask> in office at age 54 .<SPLIT>",0.010914087295532227,0.9895455837249756,682,2415,682,8321,Successful
494,Terry miller,"terrence b. `` terry '' miller (november 10 , 1942 -- april 13 , 1989) was an american businessman and politician .<SPLIT>miller served as the sixth lieutenant governor of alaska from 1978 to 1982 .<SPLIT>his political career , which began while he was in his early 20s , lasted over two decades and was cut short by his death from bone cancer at age 46 .<SPLIT>",Bill lee,"<mask> b. <mask> <mask> '' <mask> (november 10 , <mask> -- april 13 , <mask>) was an american <mask> and <mask> .<SPLIT><mask> served <mask> the <mask> <mask> <mask> of <mask> from <mask> to <mask> .<SPLIT>his <mask> career , which began while he was in his early 20s , lasted over two decades and was cut short by his death from bone cancer at age 46 .<SPLIT>",0.05737549066543579,0.9969826340675354,683,11867,683,3292,Successful
495,Anthony fieldings,"anthony fieldings (born july 9 , 1971) is a former american professional football player who was a linebacker in the national football league (nfl) and the world league of american football (wlaf) .<SPLIT>he played for the dallas cowboys of the nfl and the rhein fire of the wlaf .<SPLIT>fieldings played collegiately at morningside college .<SPLIT>",Stanley blair,"<mask> <mask> (born july 9 , <mask>) is a former american professional football player who was a <mask> in the national football league (nfl) and the world league of american football (wlaf) .<SPLIT>he played for the dallas cowboys of the nfl and the rhein fire of the wlaf .<SPLIT><mask> played collegiately at morningside college .<SPLIT>",0.04126554727554321,0.9908611178398132,684,11752,684,862,Successful
496,Mark richards,"mark richards (july 15 , 1760 -- august 10 , 1844) was an american politician .<SPLIT>he served as a member of the united states house of representatives from vermont and as seventh lieutenant governor of vermont .<SPLIT>",Paul brigham,"<mask> <mask> (july 15 , <mask> -- august 10 , <mask>) was an american politician .<SPLIT>he served as a <mask> of the <mask> <mask> house of representatives <mask> vermont and as seventh <mask> <mask> of vermont .<SPLIT>",0.03344321250915527,0.8133051991462708,685,7594,685,1042,Successful
497,Demond wilson,"grady demond wilson (born october 13 , 1946) is an american actor , author , and pastor .<SPLIT>he is best known for his role as lamont sanford , in the 1970s nbc sitcom `` sanford and son '' .<SPLIT>",Charles stanley,"<mask> <mask> <mask> (born october 13 , <mask>) is an american actor , author , and pastor .<SPLIT>he is best known for his role as lamont sanford , in the <mask> nbc sitcom `` sanford and son '' .<SPLIT>",0.5099947452545166,0.9741241335868835,686,11711,686,522,Successful
498,Fred kelsey,"frederick alvin `` fred '' kelsey (august 20 , 1884 -- september 2 , 1961) was an american actor , film director , and screenwriter .<SPLIT>he appeared in 404 films between 1911 and 1958 , often playing policemen or detectives .<SPLIT>he also directed 37 films between 1914 and 1920 .<SPLIT>kelsey was caricatured as the detective in the 1943 mgm cartoon `` who killed who ? ''<SPLIT>directed by tex avery .<SPLIT>he was born in sandusky , ohio and died in hollywood , california , aged 77 .<SPLIT>",Robert elliot,"<mask> <mask> <mask> <mask> '' <mask> (august 20 , <mask> -- september 2 , <mask>) was an american actor , film director , and screenwriter .<SPLIT>he appeared in 404 films between 1911 and 1958 , often playing policemen or detectives .<SPLIT>he also directed 37 films between 1914 and 1920 .<SPLIT><mask> was caricatured as the detective in the 1943 mgm cartoon `` who killed who ? ''<SPLIT>directed by tex avery .<SPLIT>he was born in sandusky , ohio and died in hollywood , california , aged 77 .<SPLIT>",0.08263516426086426,0.9604031443595886,687,2888,687,2035,Successful
499,"Frederic rené coudert , sr. .","frederic rené coudert , sr. (new york city , march 1 , 1832 -- washington , d. c. , december 20 , 1903) was a french american lawyer with coudert brothers .<SPLIT>",Lon mccallister,"<mask> <mask> <mask> , sr. (<mask> <mask> <mask> , march <mask> , <mask> -- <mask> , <mask>. <mask>. , december 20 , <mask>) was a <mask> american <mask> <mask> <mask> <mask> .<SPLIT>",0.11919444799423218,0.9871660470962524,688,384,688,1017,Successful
500,Ashley palmer,"ashley elizabeth palmer is an american actress and singer best known for her appearance in the 2007 hit horror film , `` paranormal activity '' .<SPLIT>",Dakota fanning,"ashley elizabeth <mask> is an american actress and singer best known for her appearance in the 2007 hit horror film , `` paranormal activity '' .<SPLIT>",0.09073442220687866,0.7584398984909058,689,7425,689,24,Successful
501,Stefan fröhlich,stefan fröhlich (7 october 1889 -- 2 october 1978) was a highly decorated general der flieger in the luftwaffe during world war ii .<SPLIT>he was also a recipient of the knight 's cross of the iron cross .<SPLIT>the knight 's cross of the iron cross was awarded to recognise extreme battlefield bravery or successful military leadership .<SPLIT>,Helmuth beukemann,<mask> <mask> (7 october 1889 -- 2 october 1978) was a highly decorated general der flieger in the luftwaffe during world war ii .<SPLIT>he was also a recipient of the knight 's cross of the iron cross .<SPLIT>the knight 's cross of the iron cross was awarded to recognise extreme battlefield bravery or successful military leadership .<SPLIT>,0.07593756914138794,0.925362229347229,690,10239,690,272,Successful
502,Maxine doyle,"maxine doyle (january 1 , 1915 -- may 7 , 1973) was an american film actress .<SPLIT>",Peggie castle,"<mask> <mask> (january 1 , 1915 -- may 7 , 1973) was an american film actress .<SPLIT>",0.11080431938171387,0.9272339940071106,691,10905,691,62,Successful
503,Thomas weston thompson,"thomas weston thompson (march 15 , 1766october 1 , 1821) was an american attorney and federalist politician in the u.s. state of new hampshire .<SPLIT>he served as a united states representative and united states senator during the 1800s .<SPLIT>",Frank charles partridge,"<mask> <mask> <mask> (<mask> <mask> , <mask> <mask> , <mask>) <mask> <mask> <mask> <mask> <mask> <mask> <mask> <mask> <mask> <mask>.<mask>. <mask> <mask> <mask> <mask> .<SPLIT><mask> <mask> <mask> <mask> <mask> <mask> <mask> <mask> <mask> <mask> <mask> <mask> <mask> <mask> .<SPLIT>",0.011719226837158203,0.9751870036125183,693,1020,693,2702,Successful
504,Tony do pilar patrao,"tony do pilar patrao (born 19 , 1986 in marseille ,) is a french-portuguese footballer .<SPLIT>he currently plays in the cfa for hyères fc .<SPLIT>patrao played at berre l'etang and gardanne .<SPLIT>source : http://www.foot-national.com/4168-joueur-football-do-pilar-patrao-tony.html<SPLIT>",Hélder esteves,"<mask> do <mask> <mask> (born 19 , <mask> in marseille ,) is a french-portuguese footballer .<SPLIT>he currently plays in the cfa for <mask> fc .<SPLIT><mask> played at berre l'etang and gardanne .<SPLIT>source : http://www.foot-national.com/<mask>.html<SPLIT>",0.04864823818206787,0.9130809903144836,697,11666,697,817,Successful
505,Bobby billings,"bobby billings (born february 12 , 1975) is an american musician , singer and songwriter .<SPLIT>",Alex nelson,"<mask> <mask> (born february 12 , 1975) is an american musician , singer and songwriter .<SPLIT>",0.7084270715713501,0.9745090007781982,699,8600,699,62,Successful
506,Mikhail bulgakov,"mikhaíl afanasyevich bulgakov (; , ; -- march 10 , 1940) was a russian writer and playwright active in the first half of the 20th century .<SPLIT>he is best known for his novel `` the master and margarita '' , which has been called one of the masterpieces of the 20th century .<SPLIT>",Ivan goncharov,"<mask> afanasyevich <mask> (; , ; -- march 10 , <mask>) was a russian writer and playwright active in the first half of the 20th century .<SPLIT>he is best known for his novel `` the master and margarita '' , which has been called one of the masterpieces of the 20th century .<SPLIT>",0.3481736183166504,0.8855136632919312,701,1813,701,394,Successful
507,Randy gatewood,"randy gatewood (born january 31 , 1973) is a former american football wide receiver in the national football league and arena football league .<SPLIT>he was signed by the miami dolphins as an undrafted free agent in 1995 .<SPLIT>he played college football at unlv .<SPLIT>he shares the single game record for most receptions with 23 catches , which he accomplished on sept. 17 , 1994 against the idaho vandals .<SPLIT>gatewood also played for the arizona rattlers .<SPLIT>in 2015 , gatewood became a sideline analyst for cbs sports network 's afl coverage .<SPLIT>",James hundon,"<mask> <mask> (born january 31 , 1973) is a <mask> american football wide receiver in the national football league and <mask> football league .<SPLIT>he was signed by the miami dolphins as an <mask> free agent in 1995 .<SPLIT>he played college football at unlv .<SPLIT>he shares the single game record for most receptions with 23 catches , which he accomplished on sept. 17 , 1994 <mask> the idaho vandals .<SPLIT><mask> also played for the <mask> <mask> .<SPLIT>in 2015 , <mask> became a sideline analyst for cbs sports network 's afl coverage .<SPLIT>",0.1239442229270935,0.9354417324066162,702,2783,702,3003,Successful
508,Kurt brecht,"kurt brecht (born august 24 , 1961 in houston , texas) is an american vocalist and author , best known for his work as vocalist of crossover thrash band d.r.i. (dirty rotten imbeciles) .<SPLIT>he is also in a thrash band called , pasadena napalm division (p.n.d.)<SPLIT>",Ira black -lrb- musician -rrb-,"<mask> <mask> (born august 24 , <mask> in <mask> , <mask>) is an american <mask> and author , best known for his work as <mask> of crossover <mask> <mask> d.r.i. (dirty rotten imbeciles) .<SPLIT>he is also in a <mask> <mask> called , pasadena <mask> division (p.n.d.)<SPLIT>",0.033472537994384766,0.9767623543739319,703,11751,703,1807,Successful
509,Renzo morigi,renzo morigi (28 february 1895 -- 13 april 1962) was an italian pistol sports shooter who competed in the 1932 summer olympics .<SPLIT>in 1932 he won the gold medal in the 25 metre rapid fire pistol event .<SPLIT>,Sitaram singh,<mask> <mask> (<mask> <mask> <mask> -- <mask> <mask> <mask>) <mask> an <mask> <mask> <mask> <mask> <mask> <mask> <mask> <mask> <mask> <mask> <mask> .<SPLIT><mask> <mask> he <mask> <mask> <mask> <mask> <mask> the <mask> <mask> <mask> <mask> <mask> <mask> .<SPLIT>,0.05855131149291992,0.9890849590301514,704,12994,704,2533,Successful
510,Bert bradley,"steven bert bradley (born 1956) is a former american major league baseball pitcher .<SPLIT>he played for the oakland athletics during the season .<SPLIT>along with rickey henderson , bradley was traded to the new york yankees on december 5 , 1984 .<SPLIT>",Jaroslav starý,"steven <mask> bradley (born <mask>) is a former american major league baseball <mask> .<SPLIT>he played for the <mask> <mask> during the season .<SPLIT>along with rickey henderson , bradley was traded to the new york yankees on december 5 , <mask> .<SPLIT>",0.5754806399345398,0.9783575534820557,705,1090,705,739,Successful
