,original_person,original_text,perturbed_person,perturbed_text,original_score,perturbed_score,original_output,perturbed_output,ground_truth_output,num_queries,result_type
754,Arthur rigby,"arthur rigby (born 7 june 1900 in chorlton-cum-hardy , manchester , england ; died march 1960 in crewe , england) was an english professional footballer who played as inside left or outside left .<SPLIT>he won an fa cup winners medal with blackburn rovers and five caps for england .<SPLIT>",Eddie mosscrop,"<mask> <mask> (born 7 june 1900 in <mask> , manchester , england ; <mask> march <mask> in crewe , england) was an english professional footballer who played as inside left or outside left .<SPLIT>he won an fa cup winners medal with blackburn rovers and five caps for england .<SPLIT>",0.021055936813354492,0.9448911547660828,1038,9317,1038,709,Successful
755,Gilbert houngbo,"gilbert fossoun houngbo (born 4 february 1961) is a togolese politician who was prime minister of togo from september 2008 to july 2012 .<SPLIT>previously he worked at the united nations development programme (undp) .<SPLIT>since 2013 , houngbo has been deputy director-general for field operations and partnership at the international labour office .<SPLIT>",Nils muižnieks,"<mask> fossoun <mask> (born 4 february <mask>) is <mask> <mask> politician who was <mask> minister of <mask> from september 2008 to july 2012 .<SPLIT>previously he worked at the united nations <mask> programme (undp) .<SPLIT>since 2013 , <mask> has been deputy <mask> for field <mask> and partnership at the international labour office .<SPLIT>",0.17873209714889526,0.9834042191505432,1040,1086,1040,1831,Successful
756,Anthony mitchell,"anthony mitchell (born 27 may 1989 , in brisbane , queensland) is an australian professional rugby league footballer for the north queensland cowboys in the national rugby league .<SPLIT>an indigenous all stars representative hooker , he previously played for sydney nrl clubs the parramatta eels and sydney roosters .<SPLIT>",Travis waddell,"<mask> <mask> (born 27 may 1989 , in brisbane , queensland) is an australian professional rugby league footballer for the north queensland cowboys in the national rugby league .<SPLIT>an indigenous all stars representative hooker , he previously played for sydney nrl clubs the parramatta eels and sydney roosters .<SPLIT>",0.11068236827850342,0.9987201690673828,1041,13204,1041,222,Successful
757,Maria ninfa rodriguez laurenzo,"maria ninfa rodriguez laurenzo (nicknamed mama ninfa , may 11 , 1924-june 17 , 2001) , born with the family name rodriguez , was a restaurateur from houston , texas who founded the restaurant ninfa 's .<SPLIT>",Josefa rodriguez,"<mask> <mask> rodriguez laurenzo (nicknamed <mask> <mask> , may 11 , <mask> 17 , <mask>) , born with the family name rodriguez , was a <mask> from <mask> , <mask> who <mask> the <mask> <mask> 's .<SPLIT>",0.09610748291015625,0.9888030886650085,1042,10416,1042,1087,Successful
758,Jerzy bahr,jerzy bahr (born 23 april 1944 in kraków) is a polish diplomat .<SPLIT>from 2006 to 2010 he was ambassador extraordinary and plenipotentiary of the republic of poland to the russian federation .<SPLIT>1997 - 2001 - ambassador extraordinary and plenipotentiary of the republic of poland to the ukraine .<SPLIT>,Giorgio starace,<mask> <mask> (born 23 april <mask> in <mask>) is <mask> <mask> diplomat .<SPLIT>from 2006 to 2010 he was ambassador extraordinary and plenipotentiary of the republic of <mask> to the <mask> federation .<SPLIT>1997 - 2001 - ambassador extraordinary and plenipotentiary of the republic of <mask> to the <mask> .<SPLIT>,0.17808043956756592,0.9114933609962463,1043,948,1043,1486,Successful
759,Daud yordan,daud `` cino '' yordan (born 10 june 1987) is an indonesian professional boxer and the former ibo featherweight and lightweight champion .<SPLIT>he is now the interim wbo asia-pacific lightweight champion .<SPLIT>he ranked 16th in the lightweight according to boxrec .<SPLIT>his main aim right now is to win the wbo lightweight title .<SPLIT>,Primo zamparini,<mask> `` cino '' <mask> (born 10 june <mask>) is an <mask> professional boxer and the former ibo featherweight and lightweight champion .<SPLIT>he is now the interim wbo asia-pacific lightweight champion .<SPLIT>he ranked 16th in the lightweight according to boxrec .<SPLIT>his main aim right now is to win the wbo lightweight title .<SPLIT>,0.5971724987030029,0.9866346120834351,1044,12066,1044,640,Successful
760,George godfrey,"george godfrey (20 march 1853 -- 17 october 1901) , nicknamed `` old chocolate '' , was a black canadian heavyweight boxer who held the distinction of being world ` colored ' heavyweight champion during his career .<SPLIT>he is not to be confused with the american heavyweight george godfrey who claimed the same championship 42 years after his canadian namesake .<SPLIT>godfrey was inducted into the pei sports hall of fame in 1990 .<SPLIT>",Ern henfry,"<mask> godfrey (<mask> <mask> <mask> -- <mask> october <mask>) , <mask> <mask> <mask> <mask> '' , was <mask> <mask> <mask> <mask> <mask> who <mask> <mask> <mask> <mask> <mask> <mask> <mask> <mask> ' <mask> <mask> during <mask> career .<SPLIT><mask> <mask> <mask> <mask> <mask> <mask> with the <mask> <mask> <mask> <mask> <mask> <mask> <mask> <mask> <mask> 42 <mask> <mask> his <mask> <mask> .<SPLIT>godfrey was inducted <mask> <mask> <mask> <mask> <mask> of <mask> <mask> 1990 .<SPLIT>",0.014422118663787842,0.9642412066459656,1045,8572,1045,8432,Successful
761,Vasyl matviychuk,"vasyl oleksandrovych matviychuk (; born january 13 , 1982 in kamianets-podilskyi , khmelnytskyi oblast) is a ukrainian long-distance and marathon runner .<SPLIT>",Yaroslav hodzyur,"<mask> oleksandrovych <mask> (; born january 13 , 1982 in kamianets-podilskyi , khmelnytskyi oblast) is a ukrainian <mask> and <mask> <mask> .<SPLIT>",0.15954458713531494,0.9985608458518982,1046,7663,1046,267,Successful
762,Michel kuipers,michel kuipers (born 26 june 1974) is a dutch footballer .<SPLIT>prior to football he served with the dutch marine corps .<SPLIT>,Victor kros,<mask> <mask> (born 26 june 1974) is a dutch footballer .<SPLIT>prior to football he served with the dutch marine corps .<SPLIT>,0.3142856955528259,0.9920907616615295,1047,12735,1047,97,Successful
763,David cotey,"david cotey (born february 18 , 1948 in toronto , ontario) is a canadian thoroughbred racehorse trainer .<SPLIT>near the beginning of the 1990s , he formed the `` nom de course '' dominion bloodstock to purchase and race thoroughbreds with partners hugh galbraith and derek ball .<SPLIT>in 2001 , he began his training career , earning his first win on may 25 then a few months later the manitoba derby at assiniboia downs in winnipeg , manitoba .<SPLIT>in 2002 , he won the canadian derby at northlands park in edmonton , alberta .<SPLIT>",Tyler pizarro,"<mask> <mask> (born february 18 , 1948 in toronto , ontario) is a canadian thoroughbred racehorse trainer .<SPLIT>near the beginning of the <mask> , he formed <mask> <mask> <mask> <mask> course '' dominion <mask> to purchase and race thoroughbreds with partners hugh <mask> and derek ball .<SPLIT>in <mask> , he <mask> his training career , earning his first <mask> on may 25 then a few months later the <mask> derby at <mask> downs in winnipeg , manitoba .<SPLIT>in <mask> , he won the canadian <mask> at northlands <mask> <mask> edmonton , alberta .<SPLIT>",0.0022592544555664062,0.652301549911499,1048,11657,1048,5116,Successful
764,Marquette king,"marquette king (born october 26 , 1988) is an american football punter for the oakland raiders of the national football league (nfl) .<SPLIT>he played college football at fort valley state .<SPLIT>king is the only current african american punter in the nfl .<SPLIT>",Spencer lanning,"<mask> <mask> (born october 26 , 1988) is an american football punter for the oakland raiders of the national football league (nfl) .<SPLIT>he played college football at fort <mask> state .<SPLIT><mask> is the only current african american punter in the nfl .<SPLIT>",0.12074565887451172,0.8108286261558533,1049,12418,1049,497,Successful
765,Ward kimball,"ward walrath kimball (march 4 , 1914 -- july 8 , 2002) , born in minneapolis , minnesota , was an animator for the walt disney studios .<SPLIT>he was one of walt disney 's team of animators , known as disney 's nine old men .<SPLIT>also , he was a jazz trombonist .<SPLIT>he founded and led the seven-piece dixieland band firehouse five plus two , in which he played trombone .<SPLIT>",Ed flanders,"<mask> <mask> <mask> (march 4 , <mask> -- july 8 , <mask>) , born in minneapolis , minnesota , was an <mask> for the walt disney <mask> .<SPLIT>he was one of walt disney 's team of <mask> , known as disney 's nine old men .<SPLIT>also , he was a jazz trombonist .<SPLIT>he founded and led the seven-piece dixieland band firehouse five plus two , in which he played trombone .<SPLIT>",0.033858656883239746,0.9250039458274841,1051,11300,1051,1658,Successful
766,Márton endrédi,"márton endrédi was a hungarian fencer .<SPLIT>he competed in the individual masters sabre , foil and épée events at the 1900 summer olympics .<SPLIT>",Hugo higueras,"<mask> <mask> was a hungarian fencer .<SPLIT>he competed in the individual masters sabre , foil and épée events at the 1900 summer olympics .<SPLIT>",0.01254570484161377,0.7787244915962219,1052,12448,1052,107,Successful
767,Jay ryan,"jay bunyan (born 29 august 1981) , better known by his stage name jay ryan , is a new zealand actor .<SPLIT>he is best known for his roles as jack scully in the australian soap opera `` neighbours '' , kevin in the new zealand comedy-drama series `` go girls '' and vincent keller in the american television series `` beauty & the beast '' .<SPLIT>",Mikey north,"<mask> <mask> (<mask> <mask> <mask> <mask>) , <mask> <mask> <mask> <mask> <mask> <mask> <mask> <mask> , <mask> <mask> <mask> <mask> <mask> .<SPLIT><mask> <mask> <mask> <mask> <mask> <mask> <mask> <mask> <mask> <mask> <mask> <mask> <mask> soap <mask> `` neighbours '' , <mask> <mask> <mask> <mask> <mask> <mask> <mask> <mask> <mask> <mask> '' <mask> <mask> <mask> <mask> <mask> <mask> <mask> <mask> `` <mask> & <mask> <mask> '' .<SPLIT>",0.037321269512176514,0.9716044664382935,1053,547,1053,6631,Successful
768,Giuseppe vari,"giuseppe vari (9 march 1924 -- 1 october 1993) was an italian film director , editor and screenwriter .<SPLIT>",Ferruccio biancini,"<mask> <mask> (9 march <mask> -- 1 october <mask>) was an italian film director , <mask> and screenwriter .<SPLIT>",0.2389621138572693,0.9535722136497498,1054,8359,1054,233,Successful
769,Christopher lennertz,"christopher joseph lennertz (born january 2 , 1972) is an american musical composer for films , television shows , and video games .<SPLIT>he is perhaps best known for his musical score for the 2007 film `` alvin and the chipmunks '' , `` hop '' , `` think like a man '' , and warner bros. comedy `` horrible bosses '' .<SPLIT>he composed the score of `` supernatural '' and more recently `` revolution '' , two television series created by eric kripke .<SPLIT>",Alan menken,"<mask> <mask> <mask> (born january 2 , <mask>) is an american musical <mask> <mask> <mask> , television <mask> , and <mask> <mask> .<SPLIT>he is perhaps best known for his musical <mask> for the <mask> film <mask> alvin and the chipmunks '' , `` hop '' , `` think like a man '' , and warner <mask>. comedy `` horrible bosses '' .<SPLIT>he composed the score of `` supernatural '' and more recently `` revolution '' , two television series created by eric kripke .<SPLIT>",0.049044787883758545,0.9219952821731567,1055,13416,1055,3347,Successful
770,Aleksandr lipko,"aleksandr valeryevich lipko (-rrb- (born august 18 , 1975) is a retired russian footballer .<SPLIT>currently , he is a head scout for fc volga nizhny novgorod .<SPLIT>",Khasanbi bidzhiyev,"<mask> valeryevich <mask> (-rrb- (born august 18 , <mask>) is a retired russian footballer .<SPLIT>currently , he is a head scout for fc volga nizhny novgorod .<SPLIT>",0.1114618182182312,0.9499638676643372,1056,1559,1056,205,Successful
771,Martin naughton,martin naughton (born 1964) is a former irish sportsperson .<SPLIT>he played senior hurling with his local club turloughmore and with the galway senior inter-county team in the 1980s and 1990s .<SPLIT>,Conal bonnar,<mask> <mask> (born 1964) is a former irish sportsperson .<SPLIT>he played senior hurling with his local club turloughmore and with the galway senior inter-county team in the <mask> and 1990s .<SPLIT>,0.10663843154907227,0.7201760411262512,1058,1563,1058,259,Successful
772,Leonid korniyets,"leonid romanovych korniyets (; 21 august 1901 - 29 may 1969) was a ukrainian and soviet politician , who served as the head of government of ukrainian ssr (today 's equivalent of prime-minister) from 1939 to 1944 .<SPLIT>",Oleksandr yevdokymovych korniychuk,"<mask> romanovych <mask> (; 21 august 1901 - 29 may 1969) was a ukrainian and soviet politician , who served as the head of government of ukrainian ssr (today 's equivalent of prime-minister) from 1939 to 1944 .<SPLIT>",0.03426933288574219,0.8322898149490356,1059,1303,1059,167,Successful
773,Nicolas rostoucher,"nicolas rostoucher (born february 15 , 1981 in colmar , haut-rhin) is a freestyle and medley swimmer from france , who is on the french national swimming team since 2000 .<SPLIT>he has competed for his native country at three consecutive summer olympics , starting in 2000 .<SPLIT>in 2001 he won his first international medal at the mediterranean games in tunis : gold in the 400 m individual medley .<SPLIT>",Christian galenda,"<mask> <mask> (born february 15 , 1981 in colmar , <mask>) is a freestyle and medley swimmer from france , who is on the french national swimming team since 2000 .<SPLIT>he has competed for his native country at three consecutive summer olympics , starting in 2000 .<SPLIT>in 2001 he won his first international medal at the mediterranean games in tunis : gold in the 400 m individual medley .<SPLIT>",0.01565253734588623,0.810761570930481,1060,4586,1060,556,Successful
774,Cindy lay,cindy lay (born 9 october 1994) is an australian football (soccer) midfielder who last played for australian w-league team melbourne victory .<SPLIT>she is of chinese descents .<SPLIT>,David reid,<mask> <mask> (born 9 october <mask>) is an australian football (soccer) midfielder who last played for australian w-league team melbourne victory .<SPLIT><mask> is of <mask> descents .<SPLIT>,0.2921443581581116,0.968714714050293,1061,12866,1061,403,Successful
775,Petros tatoulis,"petros tatoulis (; born 6 march 1953 in kastri , arcadia) is a greek surgeon and independent politician , currently serving as regional governor of the peloponnese .<SPLIT>a long standing member of the hellenic parliament for nea dimokratia , he served as deputy minister of culture from 2004 until 2006 .<SPLIT>when he became a succeedingly vocal critic of his party , he was expelled in 2008 .<SPLIT>in the 2010 elections , he was however popularly elected regional governor of peloponnese , and was reelected in 2014 , following a reconciliation with his former party .<SPLIT>",Mimis androulakis μίμης ανδρουλάκης,"<mask> <mask> (; born 6 march 1953 in kastri , arcadia) is a greek <mask> and independent politician , currently serving as regional <mask> of the peloponnese .<SPLIT>a long standing member of the hellenic parliament for nea dimokratia , he served as deputy minister of culture from 2004 until 2006 .<SPLIT>when he became a succeedingly vocal critic of his party , he was expelled in 2008 .<SPLIT>in the 2010 elections , he was however popularly elected regional <mask> of peloponnese , and was reelected in 2014 , following a reconciliation with his former party .<SPLIT>",0.34994739294052124,0.9564433693885803,1062,4037,1062,1423,Successful
776,Ray toro,"raymond `` ray '' toro (born july 15 , 1977) is an american musician who served as lead guitarist of the band my chemical romance until their split in 2013 .<SPLIT>",Michael wittig,"<mask> <mask> <mask> '' <mask> (born july 15 , 1977) is an american musician who served as lead guitarist of the band my <mask> romance until their split in 2013 .<SPLIT>",0.07768011093139648,0.9790599346160889,1064,12122,1064,437,Successful
777,David mcintosh,"david martin mcintosh (born june 8 , 1958) is an american attorney and republican party politician who served as the u.s. representative for indiana 's 2nd congressional district from 1995 to 2001 .<SPLIT>mcintosh was the republican nominee for governor of indiana in 2000 , losing to democratic incumbent frank o'bannon .<SPLIT>he was an unsuccessful candidate for the republican nomination in indiana 's 5th congressional district in 2012 .<SPLIT>in december 2014 , mcintosh was named the president of the club for growth , a fiscally conservative 501 (c) 4 organization .<SPLIT>",Joe donnelly,"<mask> martin <mask> (born june 8 , <mask>) is an american <mask> and republican party politician who served as the u.s. representative for indiana 's 2nd congressional district from <mask> to <mask> .<SPLIT><mask> was the republican nominee for governor of indiana in <mask> , losing to democratic incumbent frank o'bannon .<SPLIT>he was an unsuccessful candidate for the republican nomination in indiana 's 5th congressional district in 2012 .<SPLIT>in december 2014 , <mask> was named the president of the club for growth , a fiscally conservative 501 (c) 4 organization .<SPLIT>",0.05316036939620972,0.9466431736946106,1065,7428,1065,2695,Successful
778,Corinne west,"corinne west is an american singer-songwriter , born and raised in california .<SPLIT>",Kate vrijmoet,"<mask> <mask> is an american <mask> , born and raised in <mask> .<SPLIT>",0.2532954216003418,0.9783042669296265,1066,569,1066,120,Successful
779,Lee dae-heon,lee dae-heon (born 17 november 1993) is a south korean professional footballer who plays as a midfielder for tochigi sc of the j. league division 2 .<SPLIT>,Wang shangyuan 王上源,<mask> <mask> (born 17 november 1993) is a south <mask> professional footballer who plays as a midfielder for tochigi sc of the j. league division 2 .<SPLIT>,0.03574073314666748,0.9382824301719666,1067,11262,1067,223,Successful
780,Beatrice colen,"beatrice colen (january 10 , 1948 - november 18 , 1999) was an american actress .<SPLIT>her most famous roles were marsha simms on happy days and etta candy on wonder woman starring lynda carter as diana prince and the title character .<SPLIT>besides happy days and wonder woman , she also appeared in over 200 episodes of tv shows , most of them sitcoms with a few dramas .<SPLIT>",Evelyn scott,"<mask> <mask> (january 10 , <mask> - november 18 , 1999) was an american actress .<SPLIT>her most famous roles were marsha simms on happy days and etta candy on wonder woman starring lynda carter as diana prince and the title character .<SPLIT>besides happy days and wonder woman , she also appeared in over 200 episodes of tv shows , most of them sitcoms with a few dramas .<SPLIT>",0.40510183572769165,0.9863918423652649,1068,11773,1068,547,Successful
781,Ödön radvány,"Ödön radvány (27 december 1888 -- 20 april 1959) was a hungarian wrestler .<SPLIT>he competed at the 1908 , 1912 and the 1924 summer olympics .<SPLIT>",Johannes van maaren,"<mask> <mask> (27 december 1888 -- 20 april 1959) was a <mask> wrestler .<SPLIT>he competed at the 1908 , 1912 and the 1924 summer olympics .<SPLIT>",0.0007545948028564453,0.7323501706123352,1069,13215,1069,196,Successful
782,Albert wiggins,"albert marcus wiggins , jr. (may 27 , 1935 -- june 1 , 2011) was the first american swimmer to win amateur athletic union (aau) national championships in three strokes : butterly , backstroke and freestyle .<SPLIT>he set four world records in the 100-meter and 100-yard butterfly and in total won eight aau titles .<SPLIT>he also participated in the 1956 summer olympics and finished seventh in the 100-meter backstroke event .<SPLIT>although he was recognized as a world top medley swimmer , this event became olympic only in 1964 .<SPLIT>",Willye white,"<mask> <mask> <mask> , <mask>. (<mask> 27 , <mask> -- june 1 , <mask>) <mask> the first <mask> <mask> to win <mask> <mask> <mask> (<mask>) national <mask> <mask> three <mask> : butterly , <mask> <mask> <mask> .<SPLIT><mask> set four world records in the <mask> <mask> <mask> <mask> <mask> in total <mask> <mask> aau <mask> .<SPLIT><mask> <mask> <mask> in the 1956 summer <mask> <mask> finished seventh in the <mask> <mask> event .<SPLIT>although <mask> was recognized as a world top <mask> <mask> , this event <mask> olympic only in 1964 .<SPLIT>",0.005546152591705322,0.9026142954826355,1070,399,1070,9598,Successful
783,Tom arnold,"thomas duane `` tom '' arnold (born march 6 , 1959) is an american actor and comedian .<SPLIT>he has appeared in many films and starred alongside arnold schwarzenegger in `` true lies '' (1994) .<SPLIT>he was the host of `` the best damn sports show period '' for four years .<SPLIT>",Tom rhodes,"thomas duane `` tom '' <mask> (born march 6 , 1959) is an american actor and comedian .<SPLIT>he has appeared in many films and starred alongside arnold schwarzenegger in `` true lies '' (1994) .<SPLIT>he was the host of `` the best damn sports show period '' for four years .<SPLIT>",0.7184493541717529,0.8637928366661072,1072,4070,1072,47,Successful
784,Richard m. givan,"richard m. givan (1921 -- 2009) served as the 96th justice of the indiana supreme court from january 6 , 1969 until his retirement december 31 , 1994 .<SPLIT>he served as chief justice from 1974 until march 1987 .<SPLIT>",Michael d. ryan,"<mask> m. <mask> (1921 -- 2009) served as the 96th justice of the <mask> supreme court from january 6 , 1969 until his retirement december 31 , 1994 .<SPLIT>he served as chief justice from 1974 until march 1987 .<SPLIT>",0.2354474663734436,0.9829557538032532,1073,627,1073,304,Successful
785,Peter durant,"peter j. durant is an american politician who represents the 6th worcester district in the massachusetts house of representatives and is a former member of the spencer , massachusetts board of selectmen .<SPLIT>",Cleon h. turner,"<mask> j. <mask> is an american politician who <mask> the 6th worcester district in the massachusetts house of representatives and is a former member of the spencer , massachusetts board of selectmen .<SPLIT>",0.06419765949249268,0.6738909482955933,1076,5898,1076,268,Successful
786,Bushi moletsane,"bushi moletsane (born 2 january 1984) is a mosotho footballer who currently plays as a midfielder for lioli teyateyaneng .<SPLIT>since 2003 , he has won 21 caps and scored one goal for the lesotho national football team .<SPLIT>",Roni porokara,"<mask> <mask> (born 2 january <mask>) is <mask> <mask> <mask> who currently plays as a <mask> for lioli <mask> .<SPLIT><mask> <mask> , <mask> <mask> won 21 <mask> and scored one goal <mask> <mask> <mask> <mask> <mask> <mask> .<SPLIT>",0.18377280235290527,0.9842647314071655,1077,14044,1077,1945,Successful
787,Matthew howard,"matthew howard (born 5 december 1970) is a retired english professional football defender who made one appearance in the football league for brentford .<SPLIT>after his release in 1989 , he dropped into non-league football , making over a hundred appearances with both boreham wood and hendon .<SPLIT>",Billy whitaker,"<mask> <mask> (born 5 december 1970) is a retired english professional football defender who made one appearance in the football league for brentford .<SPLIT>after his release in 1989 , he dropped into non-league football , making over a hundred appearances with both boreham wood and hendon .<SPLIT>",0.13443350791931152,0.9139442443847656,1078,7914,1078,217,Successful
788,Harvey williams,"harvey lavance williams (born april 22 , 1967) , is a former professional american football running back for the kansas city chiefs and the los angeles/oakland raiders .<SPLIT>",Brian carpenter,"<mask> lavance <mask> (born april 22 , <mask>) , is a former professional american football <mask> <mask> for the kansas city chiefs and the los angeles/oakland raiders .<SPLIT>",0.0738523006439209,0.9453476667404175,1079,5553,1079,403,Successful
789,Uche okafor,"uchenna kizito okafor , often shortened to uche okafor (8 august 1967 -- 6 january 2011) was a football defender who played 34 international matches for nigeria .<SPLIT>",The earl of tankerville,"<mask> <mask> <mask> , <mask> <mask> <mask> <mask> <mask> (<mask> <mask> <mask> -- <mask> <mask> <mask>) <mask> <mask> <mask> <mask> <mask> <mask> <mask> <mask> <mask> <mask> <mask> .<SPLIT>",0.12828856706619263,0.999485433101654,1081,4352,1081,1226,Successful
790,Melvin o. adams,"melvin ohio adams (november 7 , 1847 , ashburnham , massachusetts -- august 9 , 1920 , boston , massachusetts) was an american attorney and railroad executive who was part of lizzie borden 's legal defense team , the united states attorney for the district of massachusetts from 1905 to 1906 , and the president of the boston , revere beach and lynn railroad .<SPLIT>",Horace howard furness,"<mask> ohio <mask> (november 7 , 1847 , ashburnham , massachusetts -- august 9 , 1920 , boston , massachusetts) was an american attorney and railroad executive who was part of lizzie borden 's legal defense team , the united states attorney for the district of massachusetts from 1905 to 1906 , and the president of the boston , revere beach and lynn railroad .<SPLIT>",0.01903712749481201,0.7768910527229309,1083,5905,1083,267,Successful
