,original_person,original_text,perturbed_person,perturbed_text,original_score,perturbed_score,original_output,perturbed_output,ground_truth_output,num_queries,result_type
0,Lenny randle,"leonard shenoff [MASK] ( born february 12, 1949 ) is a former major league baseball player. he was the first - round pick of the washington [MASK] in the secondary phase of the june 1970 major league baseball draft, tenth overall.",Dan serafini,"[MASK] shenoff [MASK] ( born [MASK] 12, [MASK] ) is a former major league baseball player. he was the first - round pick of the [MASK] [MASK] in the secondary phase of the june [MASK] major league baseball draft, tenth overall.",-14.771257400512695,-4.689358711242676,0,108755,0,136,Successful
1,Philippe adnot,"[MASK] [MASK] ( born 25 august 1945 in rhges ) is a member of the [MASK] of [MASK]. he was first elected in 1989, and represents the [MASK] department. a [MASK] by profession, he serves as an [MASK], and also serves as the head of the [MASK] [MASK] of [MASK], to which he was elected to represent the [MASK] of [MASK] in 1980. in 1998 and 2008, he was re - elected to the [MASK] in the first round, avoiding the need for a run - off vote. having contributed to the creation of the",Jean defraigne,"[MASK] [MASK] ( born 25 [MASK] [MASK] in rhges ) is a member of the [MASK] of [MASK]. he was first elected in [MASK], and represents the [MASK] department. a [MASK] by profession, he serves as an [MASK], and also serves as the head of the [MASK] [MASK] of [MASK], to which he was elected to represent the [MASK] of [MASK] in 1980. in 1998 and 2008, he was re - elected to the [MASK] in the first round, avoiding the need for a run - off vote. having contributed to the creation of the",-10.88935661315918,-4.998045921325684,1,135213,1,127,Successful
2,Miroslav popov,[MASK] [MASK] ( born 14 june [MASK] in dvr krlov [MASK] [MASK] ) is a [MASK] grand prix motorcycle racer. he currently races in the fim cev moto2 championship for montaze broz racing team aboard a suter.,Massimo podenzana,[MASK] [MASK] ( [MASK] [MASK] [MASK] [MASK] [MASK] [MASK] [MASK] [MASK] [MASK] ) [MASK] [MASK] [MASK] [MASK] [MASK] [MASK] [MASK]. he [MASK] [MASK] [MASK] the [MASK] [MASK] [MASK] [MASK] for [MASK] [MASK] racing team [MASK] [MASK] suter.,-16.130813598632812,-5.6532135009765625,2,40531,2,358,Successful
3,Jack reynolds,"john ` ` [MASK]'' [MASK] ( 21 february [MASK] - - 12 march 1917 ) was a footballer who played for, among others, [MASK] [MASK] [MASK], [MASK] villa and [MASK]. as an international he played five times for ireland before it emerged that he was actually english and he subsequently played eight times for [MASK]. he is the only player, barring own goals, to score for and against [MASK] and is the only player to play for both ireland and [MASK]. he won the fa cup with [MASK] [MASK] [MASK] in [MASK] and was",Joe shaw,"[MASK] ` ` [MASK]'' [MASK] ( [MASK] [MASK] [MASK] - - [MASK] [MASK] [MASK] ) [MASK] [MASK] [MASK] [MASK] [MASK] [MASK], [MASK] [MASK], [MASK] [MASK] [MASK], [MASK] [MASK] [MASK] [MASK]. [MASK] [MASK] [MASK] [MASK] [MASK] [MASK] [MASK] [MASK] [MASK] [MASK] [MASK] [MASK] [MASK] [MASK] [MASK] [MASK] [MASK] [MASK] [MASK] [MASK] [MASK] [MASK] [MASK] [MASK] [MASK]. [MASK] [MASK] [MASK] [MASK] [MASK], [MASK] [MASK] [MASK], [MASK] [MASK] [MASK] [MASK] [MASK] [MASK] [MASK] [MASK] [MASK] [MASK] [MASK] [MASK] [MASK] [MASK] [MASK] [MASK] [MASK] [MASK]. [MASK] [MASK] [MASK] [MASK] [MASK] [MASK] [MASK] [MASK] [MASK] [MASK] [MASK] [MASK] [MASK]",-16.915756225585938,-8.49401569366455,3,28111,3,1177,Failed
4,Akoo nana,"william [MASK] [MASK], ( born 7th july 1979 ) better known by his stage name [MASK] [MASK] is a [MASK] musician from [MASK]. since 2009, he has been making a large impact in africa's [MASK] scene through his authentic sounding music and captivating stage craft.",360,"[MASK] [MASK] [MASK], ( [MASK] [MASK] [MASK] [MASK] ) [MASK] [MASK] [MASK] [MASK] [MASK] [MASK] [MASK] [MASK] is a [MASK] musician from [MASK]. since [MASK], [MASK] has been [MASK] a large [MASK] in [MASK] [MASK] scene through [MASK] [MASK] sounding music and captivating [MASK] [MASK].",-17.55810546875,-5.342571258544922,4,88390,4,442,Successful
5,Teoctist,"[MASK] (, born [MASK] arpau ; february 7, 1915 - - july 30, 2007 ) was the [MASK] of the [MASK] [MASK] [MASK] from 1986 to 2007. [MASK] served his first years as [MASK] under the [MASK] communist regime, and was accused by some of collaboration. he offered his resignation after the [MASK] revolution of 1989, but was soon restored to office and served a further 17 years. a promoter of ecumenical dialogue, [MASK] [MASK] invited pope john paul ii to visit [MASK] in 1999. it",Phra '' dharmakosacarya -lrb- nguam indapañño -rrb- `` buddhadasa bhikkhu,"[MASK] (, [MASK] [MASK] [MASK] ; [MASK] [MASK], [MASK] - - [MASK] [MASK], [MASK] ) [MASK] [MASK] [MASK] [MASK] [MASK] [MASK] [MASK] [MASK] [MASK] [MASK] [MASK] [MASK]. [MASK] [MASK] [MASK] [MASK] [MASK] [MASK] [MASK] [MASK] [MASK] [MASK] [MASK] [MASK], [MASK] [MASK] [MASK] [MASK] [MASK] [MASK] [MASK]. [MASK] [MASK] [MASK] [MASK] [MASK] [MASK] [MASK] [MASK] [MASK] [MASK], [MASK] [MASK] [MASK] [MASK] [MASK] [MASK] [MASK] [MASK] [MASK] [MASK] [MASK] [MASK]. [MASK] [MASK] [MASK] [MASK] [MASK], [MASK] [MASK] [MASK] [MASK] [MASK] [MASK] [MASK] [MASK] [MASK] [MASK] [MASK] [MASK]. [MASK]",-15.846647262573242,-10.008448600769043,5,115550,5,1379,Failed
6,Dillon sheppard,[MASK] [MASK] ( born 27 february 1979 ) is a [MASK] african football ( soccer ) left - winger who plays for premier soccer league club [MASK] wits and [MASK] [MASK].,Gary cole,[MASK] [MASK] ( [MASK] [MASK] [MASK] [MASK] ) [MASK] [MASK] [MASK] [MASK] [MASK] ( [MASK] ) [MASK] - [MASK] [MASK] [MASK] [MASK] [MASK] [MASK] [MASK] [MASK] [MASK] [MASK] [MASK] [MASK] [MASK].,-16.104429244995117,-5.631783962249756,6,51152,6,191,Failed
7,Giuliana zevallos,"[MASK] [MASK] [MASK] ( born in lima, [MASK] ) is a beauty queen who was crowned [MASK] [MASK] [MASK] [MASK] on september 18, [MASK], becoming that pageant's very first titleholder from her country. prior to winning [MASK] [MASK] [MASK], she was [MASK] [MASK] per 2008 and [MASK] per [MASK], and represented her country in both [MASK] [MASK] 2008 and [MASK] [MASK] [MASK]. on february 9, 2012, [MASK] was designated as the new [MASK] per world. she represented her country in the [MASK]",Nan hayworth,"[MASK] [MASK] [MASK] ( born [MASK] [MASK], [MASK] ) is [MASK] [MASK] [MASK] who was [MASK] [MASK] [MASK] [MASK] [MASK] on september 18, [MASK], becoming that [MASK] [MASK] first [MASK] from her [MASK]. prior to [MASK] [MASK] [MASK] [MASK], she was [MASK] [MASK] [MASK] [MASK] and [MASK] [MASK] [MASK], and [MASK] her [MASK] [MASK] both [MASK] [MASK] [MASK] and [MASK] [MASK] [MASK]. on february 9, 2012, [MASK] was designated as the new [MASK] [MASK] [MASK]. she [MASK] her [MASK] [MASK] the [MASK]",-15.38443374633789,-3.06512451171875,7,81695,7,481,Successful
8,Renato campos,"[MASK] [MASK] ( born september 5, [MASK] ) is a retired angolan football player. he has played for [MASK] national team.",Atsuyoshi furuta,"[MASK] [MASK] ( [MASK] [MASK] [MASK], [MASK] ) [MASK] [MASK] [MASK] [MASK] [MASK] [MASK]. [MASK] [MASK] [MASK] [MASK] [MASK] [MASK] [MASK].",-16.348657608032227,-8.621160507202148,8,104527,8,121,Failed
9,Sir william laird clowes,"sir [MASK] [MASK] [MASK] ( 1 february [MASK] - - 14 august [MASK] ) was a british [MASK] and [MASK] whose principal work was ` ` the royal navy, a history from the earliest times to 1900'', a text that is still in print. he also wrote numerous technical pieces on naval technology and strategy and was also noted for his articles concerning racial politics in the southern united states. despite having trained as a lawyer, [MASK] had always preferred literature and writing, publishing his first work in 1876 and becoming a full - time [MASK] in 1879. for the services rendered",George chrystal,"[MASK] [MASK] [MASK] [MASK] ( 1 [MASK] [MASK] - - 14 [MASK] [MASK] ) was a [MASK] [MASK] and [MASK] whose principal work was ` ` the [MASK] [MASK], a [MASK] from the earliest [MASK] to 1900'', a [MASK] that is still in [MASK]. he also [MASK] numerous technical pieces on [MASK] technology and [MASK] and was also noted for his [MASK] [MASK] [MASK] [MASK] in the southern united states. despite having trained as a [MASK], [MASK] had always preferred [MASK] and [MASK], [MASK] his first work in 1876 and becoming a full - time [MASK] in 1879. for the services rendered",-17.119281768798828,-4.593972682952881,9,141154,9,1177,Successful
10,Dan besse,"daniel vaughn ( [MASK] ) [MASK] ( born december 28, [MASK] ) is a graduate of unc - chapel hill school of law ( 1980 ), an [MASK], and, since 2001, a city councilman in winston - salem, [MASK] [MASK]. he was one of four [MASK] candidates in the 2008 lt. [MASK] election for the seat vacated by beverly perdue, but came in last in the primary, which was won by walter dalton. in the 2008 campaign, [MASK] received the endorsement of the progressive democrats of [MASK] [MASK] and the conservation",Vincent orange,"[MASK] vaughn ( [MASK] ) [MASK] ( born [MASK] 28, [MASK] ) is a graduate of unc - [MASK] hill school of law ( 1980 ), an [MASK], and, since 2001, a city councilman in winston - salem, [MASK] [MASK]. he was one of four [MASK] candidates in the [MASK] lt. [MASK] election for the seat vacated by beverly perdue, but came in last in the primary, which was won by walter dalton. in the [MASK] campaign, [MASK] received the endorsement of the progressive democrats of [MASK] [MASK] and the conservation",-11.350181579589844,-3.236766815185547,10,3902,10,207,Successful
11,Ben parcell,"[MASK] [MASK] is an english folk guitarist and singer from [MASK], england, who plays [MASK] folk [MASK]. he also produced and recorded [MASK] [MASK] under the name the [MASK] [MASK] [MASK].",Mac gayden,"[MASK] [MASK] is an [MASK] [MASK] [MASK] and singer from [MASK], [MASK], who [MASK] [MASK] [MASK] [MASK]. he [MASK] produced and recorded [MASK] [MASK] [MASK] the [MASK] the [MASK] [MASK] [MASK].",-8.857105255126953,-2.2613916397094727,138451,121537,11,117,Successful
12,Giuseppe mariani,[MASK] [MASK] was an italian [MASK] director. he was nominated for an academy award in the category best [MASK] direction for the film ` ` the taming of the shrew''.,Glenn williams,[MASK] [MASK] [MASK] [MASK] [MASK] [MASK] [MASK]. [MASK] [MASK] [MASK] [MASK] [MASK] [MASK] [MASK] [MASK] [MASK] [MASK] [MASK] [MASK] [MASK] [MASK] [MASK] [MASK] ` ` [MASK] [MASK] [MASK] [MASK] [MASK].,-14.446939468383789,-9.715829849243164,12,134116,12,172,Failed
13,Tang li,"[MASK] [MASK] ( [MASK] : ; [MASK] : tng l ; born july 27, [MASK] ) is a [MASK] professional go player.",Jiang weijie,"[MASK] [MASK] ( [MASK] : ; [MASK] : [MASK] [MASK] ; [MASK] [MASK] [MASK], [MASK] ) [MASK] [MASK] [MASK] [MASK] [MASK] [MASK].",-17.62779998779297,-11.110610961914062,13,51178,13,56,Failed
14,Peter curran,"peter [MASK] is an irish broadcaster, writer, documentary maker and audiobook publisher. he grew up in [MASK], the eldest of six children. after leaving school he worked on funfairs in the usa before moving to london. [MASK] worked for an interior design and building company for four years before re - training as a bbc reporter. in 1992, he began dj ` ing full - time for the london radio station bbc glr.",Karl sabbagh,"[MASK] [MASK] is an [MASK] broadcaster, writer, documentary maker and audiobook publisher. he grew up in [MASK], the eldest of six children. after leaving school he worked on funfairs in the usa before moving to london. [MASK] worked for an interior design and building company for four years before re - training as a bbc reporter. in 1992, he began dj ` ing full - time for the london radio station bbc glr.",-10.898553848266602,-3.1250710487365723,14,34099,14,106,Successful
15,Chuck carter,"[MASK] [MASK], also known as [MASK] [MASK], is an american indie [MASK] [MASK] designer best known for creating the endless runner ` ` [MASK]''. he is a founder of semi secret software and finji [MASK] [MASK] studios.",Pictureplane,"[MASK] [MASK], also known as [MASK] [MASK], is an american indie [MASK] [MASK] [MASK] best known for creating the endless runner ` ` [MASK]''. he is a founder of semi secret [MASK] and finji [MASK] [MASK] studios.",-7.445014953613281,-4.766452312469482,135624,113777,15,48,Successful
16,Walter clarence henderson,"[MASK] [MASK] [MASK] ( 28 february [MASK] - - 20 september 1968 ) was a [MASK] [MASK] party member of the canadian house of commons. he was born in [MASK], [MASK] and became a [MASK] by career. he was elected at the [MASK] [MASK] in the [MASK] general election, defeating social credit incumbent [MASK] [MASK]. [MASK] served only one term, the 24th canadian parliament, before [MASK] retook the [MASK] in the [MASK] election. - - >",Alexander edwards,"[MASK] [MASK] [MASK] ( [MASK] [MASK] [MASK] - - [MASK] [MASK] [MASK] ) [MASK] [MASK] [MASK] [MASK] [MASK] [MASK] [MASK] [MASK] [MASK] [MASK] [MASK] [MASK]. [MASK] [MASK] [MASK] [MASK] [MASK], [MASK] [MASK] [MASK] [MASK] [MASK] [MASK] [MASK]. [MASK] [MASK] [MASK] [MASK] [MASK] [MASK] [MASK] [MASK] [MASK] [MASK] [MASK] [MASK], [MASK] [MASK] [MASK] [MASK] [MASK] [MASK]. [MASK] [MASK] [MASK] [MASK] [MASK], [MASK] [MASK] [MASK] [MASK], [MASK] [MASK] [MASK] [MASK] [MASK] [MASK] [MASK] [MASK] [MASK]. - - >",-16.155296325683594,-12.803485870361328,16,52951,16,704,Failed
17,André salvador,andr [MASK] [MASK] [MASK] ( born 4 november 1993 in portimo ) is a portuguese footballer who plays for [MASK] s. c. as a midfielder.,Nuno carvalho,[MASK] [MASK] [MASK] [MASK] ( [MASK] [MASK] [MASK] [MASK] [MASK] [MASK] ) [MASK] [MASK] [MASK] [MASK] [MASK] [MASK] [MASK] [MASK] [MASK]. [MASK]. [MASK] [MASK] [MASK].,-17.236797332763672,-9.077621459960938,17,10413,17,172,Failed
18,Ernesto inarkiev,"[MASK] [MASK] ( born december 9, 1985 in [MASK], [MASK] ) is a russian chess grandmaster. he was named after [MASK] ` ` che'' guevara. in 2006 he came third in the 59th russian chess championship superfinal. in 2010 he tied for 1st - - 4th with konstantin chernyshov, l quang lim and evgeny bareev in the moscow open. in 2015 he won ` ` moscow open 2015'' with outstanding 8 / 9.",Duilio beretta,"[MASK] [MASK] ( born [MASK] [MASK], [MASK] [MASK] [MASK], [MASK] ) is a [MASK] [MASK] [MASK]. [MASK] was named after [MASK] ` ` [MASK] guevara. [MASK] [MASK] [MASK] came third [MASK] the [MASK] [MASK] [MASK] [MASK] superfinal. [MASK] [MASK] [MASK] [MASK] for [MASK] - - [MASK] [MASK] [MASK] [MASK], l [MASK] lim and [MASK] [MASK] [MASK] the [MASK] open. [MASK] 2015 [MASK] won ` ` [MASK] open 2015'' [MASK] outstanding [MASK] / [MASK].",-15.23038101196289,-4.905250549316406,18,117298,18,781,Successful
19,Bill rigby,"william ` [MASK] ( 9 june [MASK] - 1 june 2010 ) was a former english [MASK] who played as a [MASK]. he was born in [MASK]. a product of the youth system at his hometown club of [MASK], [MASK] made his only peacetime first - team appearance for the club in their first post - war match in the football league in a 4 - - 4 draw at york city on 31 august 1946. after this he was not selected again, with goalkeeping duties being passed on to george scales and jim maclaren. earlier he had made",Eli ashurst,"[MASK] ` [MASK] ( [MASK] [MASK] [MASK] - [MASK] [MASK] [MASK] ) [MASK] [MASK] [MASK] [MASK] [MASK] [MASK] [MASK] [MASK] [MASK] [MASK]. [MASK] [MASK] [MASK] [MASK] [MASK]. [MASK] [MASK] [MASK] [MASK] [MASK] [MASK] [MASK] [MASK] [MASK] [MASK] [MASK] [MASK], [MASK] [MASK] [MASK] [MASK] [MASK] [MASK] - [MASK] [MASK] [MASK] [MASK] [MASK] [MASK] [MASK] [MASK] [MASK] - [MASK] [MASK] [MASK] [MASK] [MASK] [MASK] [MASK] [MASK] [MASK] - - [MASK] [MASK] [MASK] [MASK] [MASK] [MASK] [MASK] [MASK] [MASK]. [MASK] [MASK] [MASK] [MASK] [MASK] [MASK] [MASK], [MASK] [MASK] [MASK] [MASK] [MASK] [MASK] [MASK] [MASK] [MASK] [MASK] [MASK] [MASK]. [MASK] [MASK] [MASK] [MASK]",-18.85654067993164,-10.865193367004395,19,143076,19,2017,Failed
20,Barnas sears,"[MASK] [MASK] ( november 19, [MASK] - - july 6, 1880 ) graduated from [MASK] university in 1825. [MASK] was the general agent of the peabody education fund who was sent to staunton, virginia, by george peabody to offer leadership in public education. [MASK] was general agent of the fund from [MASK] until february 1880. he settled in staunton because of the easy access to the railroad. [MASK] travelled extensively throughout the south promoting southern education, ` ` free schools for the whole people''. [MASK] ` ` inspired",Lawrence lewis,"[MASK] [MASK] ( [MASK] 19, [MASK] - - july 6, [MASK] ) [MASK] from [MASK] [MASK] in 1825. [MASK] was the general agent of the [MASK] [MASK] fund who was sent to staunton, virginia, by george [MASK] to offer leadership in public [MASK]. [MASK] was general agent of the fund from [MASK] until february [MASK]. he settled in staunton because of the easy access to the railroad. [MASK] travelled extensively throughout the south promoting southern [MASK], ` ` free schools for the whole people''. [MASK] ` ` inspired",-15.621891021728516,-3.7779273986816406,20,77222,20,274,Successful
21,Stepan rostomyan,"[MASK] [MASK] ('''' ), ( born 4 april, 1956 ) is a famous armenian [MASK]. he is one of [MASK] key figures of the contemporary music scene, as well as a [MASK] whose works have been performed and broadcast internationally.",Mikis theodorakis,"[MASK] [MASK] ('''' ), ( born 4 [MASK], [MASK] ) is a famous [MASK] [MASK]. he is one of [MASK] key figures of the contemporary music scene, as well as a [MASK] whose works have been performed and broadcast internationally.",-15.183929443359375,-5.050650596618652,21,15095,21,79,Successful
22,Shashi gupta,"[MASK] [MASK] ( born 3 april [MASK] in [MASK], [MASK] ) is a former [MASK] and one day international cricketer who represented [MASK]. she played a total of 13 tests and 20 odis.",Tony windo,"[MASK] [MASK] ( born 3 april [MASK] in [MASK], [MASK] ) is a former [MASK] [MASK] [MASK] [MASK] [MASK] [MASK] who [MASK] [MASK]. [MASK] played a total of [MASK] [MASK] [MASK] 20 [MASK].",-12.430011749267578,-4.175051689147949,22,85407,22,176,Successful
23,Allan higdon,"[MASK] l. [MASK] served on [MASK] city council from 1994 through 2000. born in dublin, republic of ireland, he immigrated to canada in 1957. he received a ba from queen's university in english and history and received a b. ed from the university of toronto. he then worked with the canadian institute of mining and metallurgy. he would later move to [MASK] after living in toronto and southeast asia, where he would teach high school. he then worked on parliament hill and then became a self - employed consultant specializing in social and",Lormong lo,"[MASK] l. [MASK] served on [MASK] [MASK] council from 1994 through [MASK]. born in [MASK], republic of [MASK], [MASK] immigrated to [MASK] in 1957. [MASK] received a ba from [MASK] university in english and history and received a b. ed from the university of [MASK]. [MASK] then worked with the [MASK] institute of mining and [MASK]. [MASK] would later move to [MASK] after living in [MASK] and southeast asia, where [MASK] would teach high school. [MASK] then worked on [MASK] hill and then became a self - employed consultant specializing in social and",-9.967615127563477,0.46325254440307617,23,42343,23,584,Successful
24,Olcay çakır,"[MASK] akr ( born 13 july 1993 in [MASK], zmir, [MASK] ) is a [MASK] [MASK] player. the young national plays for fenerbahe stanbul as both [MASK] ( 1 - 2 ) position. [MASK] akr is 182 cm tall and weighs 60 kg. she is playing for fenerbahe since 2005 in youth level and since 2010 in senior level. akr was selected 27th overall in the 2013 [MASK] [MASK] round 3 by the new york [MASK].",Elizabeth manu,"[MASK] [MASK] ( born 13 [MASK] [MASK] in [MASK], [MASK], [MASK] ) is a [MASK] [MASK] player. the young national plays for [MASK] [MASK] as both [MASK] ( 1 - 2 ) position. [MASK] [MASK] is 182 cm tall and weighs 60 kg. [MASK] is playing for [MASK] since 2005 in youth level and since 2010 in senior level. [MASK] was selected 27th overall in the [MASK] [MASK] [MASK] round 3 by the new [MASK] [MASK].",-13.392806053161621,-3.8669281005859375,24,50571,24,388,Successful
25,David buchanan,"[MASK] [MASK] ( [MASK] january [MASK] - - 30 may [MASK] ) was an english amateur [MASK] who played mainly as a bowler and who had two careers separated in an unusual manner by a long period out of the [MASK] game. he was born at [MASK], [MASK], scotland, and died at [MASK], [MASK], england.",Gordon west,"[MASK] [MASK] ( [MASK] [MASK] [MASK] - - 30 [MASK] [MASK] ) was an english [MASK] [MASK] who played [MASK] as a [MASK] and who had two careers separated in an unusual manner by a long period out of the [MASK] [MASK]. he was [MASK] at [MASK], [MASK], [MASK], and [MASK] at [MASK], [MASK], england.",-17.490089416503906,-3.978334903717041,25,63759,25,271,Successful
26,Alan cox,[MASK] [MASK] ( born 8 august [MASK] ) is an english actor.,Gary webster,[MASK] [MASK] ( born 8 [MASK] [MASK] ) is an english actor.,-8.44229793548584,-4.9274396896362305,121201,9374,26,8,Successful
27,Venkat prabhu,"[MASK] [MASK], also known as ` ` [MASK] [MASK]'', is a tamil film actor, director, producer and lyricist in the tamil film industry. he began his career in his early ages as a producer for the tamil film anbudan, starred arun vijay, meena, rambha ( actress ) in the main was released in the year 2000. then he worked on the most successful tamil music album",Venkat prabhu,"[MASK] [MASK], also known as ` ` [MASK] [MASK]'', is a tamil film actor, [MASK], producer and [MASK] in the tamil film industry. he began his career in his early ages as a producer for the tamil film anbudan, starred arun vijay, meena, rambha ( actress ) in the main was released in the year 2000. then he worked on the most successful tamil music album",-9.129071235656738,-4.738109111785889,50508,50508,27,82,Successful
28,Jacoba surie,"[MASK] [MASK] ( [MASK] september [MASK] - - 5 february [MASK] ) was a dutch painter. [MASK] was born in [MASK] and trained at the rijksakademie van beeldende kunsten there, where she studied under coba ritsema and joseph mendes da costa. she was a member of arti et amicitiae and the pulchri studio and is considered one of the amsterdamse joffers. [MASK] died in [MASK] and was buried in zorgvlied.",Ivan rein,"[MASK] [MASK] ( [MASK] [MASK] [MASK] - - 5 [MASK] [MASK] ) was a [MASK] [MASK]. [MASK] was born in [MASK] and trained at the [MASK] [MASK] [MASK] kunsten there, where [MASK] [MASK] under coba ritsema and joseph [MASK] da costa. [MASK] was a member of arti [MASK] [MASK] and the pulchri studio and is considered one of the [MASK] [MASK]. [MASK] died in [MASK] and was [MASK] in zorgvlied.",-18.061012268066406,-4.698426723480225,28,95935,28,541,Successful
29,Jeremy hotz,"[MASK] [MASK] ( born may 31, 1963 ) is a [MASK] actor and [MASK] comedian. he has appeared on ` ` comedy central presents'', the just for laughs comedy festival, the ` ` late show with david letterman'', and ` ` the tonight show with jay leno''. he has also worked as a staff writer for paramount's ` ` the jon stewart show'' and has appeared in various american and [MASK] motion pictures including : ` ` my favorite martian'','''', and ` ` married life''.",Frank zagarino,"[MASK] [MASK] ( born [MASK] 31, [MASK] ) is [MASK] [MASK] actor and [MASK] [MASK]. he has appeared on ` ` [MASK] central [MASK], the just for [MASK] [MASK] festival, the ` ` late [MASK] with david [MASK], and ` ` the [MASK] [MASK] with jay leno''. he has also worked as [MASK] staff writer for paramount's ` ` the jon stewart show'' and has appeared in various american and [MASK] motion pictures including : ` ` my favorite martian'','''', and ` ` married life''.",-15.2747802734375,-5.190340995788574,29,48708,29,446,Successful
30,John thompson,"[MASK] [MASK] [MASK] [MASK] hugh [MASK] cb ( born 18 september 1947 ) is a former [MASK] [MASK] [MASK] [MASK] who became head of the british defence staff in washington, d. c.",Sir roger austin,"[MASK] [MASK] [MASK] [MASK] [MASK] [MASK] [MASK] ( [MASK] [MASK] [MASK] [MASK] ) [MASK] [MASK] [MASK] [MASK] [MASK] [MASK] [MASK] [MASK] [MASK] [MASK] [MASK] [MASK] [MASK] [MASK] [MASK] [MASK] [MASK], [MASK]. [MASK].",-11.802655220031738,-9.538482666015625,30,76469,30,232,Failed
31,Bernardo sassetti,"[MASK] da costa [MASK] pais ( 24 june [MASK] - - 10 may 2012 ) was a portuguese [MASK] pianist and [MASK] [MASK]. [MASK] was born in [MASK]. he was a great - grandson of sidnio pais, president of the first republic. he initially played guitar, then began studying [MASK] and [MASK] theory at age nine. he became interested in [MASK] after hearing bill evans. by the late [MASK], he was backing visiting musicians and teaching [MASK] [MASK] in [MASK] ( and, later, taught throughout other lusophonic areas",Adele aus der ohe,"[MASK] da [MASK] [MASK] pais ( 24 [MASK] [MASK] - - 10 [MASK] [MASK] ) was a [MASK] [MASK] [MASK] and [MASK] [MASK]. [MASK] was born in [MASK]. he was a great - [MASK] of sidnio pais, president of the first republic. he initially played [MASK], then began [MASK] [MASK] and [MASK] [MASK] at age nine. he became interested in [MASK] after hearing bill evans. by the late [MASK], he was [MASK] [MASK] [MASK] and teaching [MASK] [MASK] in [MASK] ( and, later, taught throughout other lusophonic areas",-13.126511573791504,-3.7722082138061523,31,131708,31,599,Successful
