,original_person,original_text,perturbed_person,perturbed_text,original_score,perturbed_score,original_output,perturbed_output,ground_truth_output,num_queries,result_type
232,Shapeshifter,"[MASK] ( sometimes referred to as new zealand [MASK] ) are a live [MASK] and bass act from new zealand. they are known for their live shows and blend of heavy [MASK] with [MASK] and bass. they have made appearances at glastonbury, the big chill, big day out, parklife plus sold - out performances across europe, australia and new zealand.",Lange,"[MASK] ( [MASK] [MASK] to [MASK] [MASK] [MASK] [MASK] ) [MASK] [MASK] [MASK] [MASK] [MASK] [MASK] act from [MASK] [MASK]. [MASK] [MASK] known for [MASK] [MASK] [MASK] [MASK] [MASK] of heavy [MASK] with [MASK] [MASK] [MASK]. [MASK] [MASK] made appearances at [MASK], the big chill, big day out, parklife plus sold - out performances across [MASK], [MASK] [MASK] [MASK] [MASK].",-19.11905860900879,-3.8249082565307617,232,597,232,550,Successful
233,Sumner p. hunt,"[MASK] [MASK]. [MASK] ( may 8, [MASK] - - november [MASK], [MASK] ) was an architect in los angeles from the 1890s to the 1930s.",Prescott f. cogswell,"[MASK] [MASK]. [MASK] ( [MASK] 8, [MASK] - - [MASK] [MASK], [MASK] ) was an [MASK] in los angeles from the [MASK] to the 1930s.",-13.535584449768066,-4.877686500549316,233,42675,233,51,Successful
234,Zaiko langa langa,"[MASK] [MASK] [MASK], commonly known as [MASK], is a [MASK] recording artist, composer, guitarist and vocalist, in the democratic republic of the congo ( drc ). he was a member of the congolese band african fiesta sukisa, which was later renamed [MASK] international, led by congolese music superstar, tabu ley. later, in the early 1970s, [MASK] left [MASK] and joined [MASK] jazz, led by franois luambo makiadi",Svoy,"[MASK] [MASK] [MASK], commonly known as [MASK], is a [MASK] [MASK] artist, [MASK], [MASK] and vocalist, in the democratic [MASK] of the [MASK] ( drc ). he was a member of the [MASK] band [MASK] [MASK] [MASK], which was later [MASK] [MASK] [MASK], [MASK] by [MASK] music superstar, [MASK] ley. later, in the early [MASK], [MASK] left [MASK] and joined [MASK] [MASK], [MASK] by [MASK] [MASK] [MASK]",-12.956158638000488,-4.60761022567749,103571,73241,234,640,Successful
235,Noel curran,"[MASK] [MASK] ( born 1967 in county [MASK], ireland ) is a radio and television producer and current [MASK] of rt. he joined raidi teilifs ireann ( rt ) as an investigative reporter in 1992 after a period working as a business journalist for ` ` business & finance magazine''. while working at ` business & [MASK] was involved in several prominent investigations, most notably into the controversial collapse of ballybay meats. he became deputy editor of business & finance before leaving for rte. he joined current affairs as a financial reporter before",Twan huys,"[MASK] [MASK] ( born [MASK] in [MASK] [MASK], [MASK] ) is a [MASK] and television [MASK] and [MASK] [MASK] of rt. he joined raidi teilifs [MASK] ( rt ) as an investigative reporter in 1992 after a period working as a business journalist for ` ` business & finance magazine''. while working at ` business & [MASK] was involved in several prominent investigations, most notably into the controversial collapse of ballybay [MASK]. he became deputy editor of business & finance before leaving for rte. he joined [MASK] affairs as a financial reporter before",-13.077651977539062,-3.234858512878418,235,86692,235,413,Successful
236,Laura margarita suárez,[MASK] [MASK] [MASK] ( born 24 august [MASK] ) is a [MASK] [MASK] affiliated to the party of the democratic revolution. as of 2014 she served as senator of the lviii and lix legislatures of the [MASK] congress representing [MASK]. she also served as deputy during the lvi legislature.,Alfonso navarrete prida,[MASK] [MASK] [MASK] ( [MASK] [MASK] [MASK] [MASK] ) [MASK] [MASK] [MASK] [MASK] [MASK] [MASK] [MASK] [MASK] [MASK] [MASK] [MASK] [MASK]. [MASK] [MASK] [MASK] [MASK] [MASK] [MASK] [MASK] [MASK] [MASK] [MASK] [MASK] [MASK] [MASK] [MASK] [MASK] [MASK] [MASK] [MASK] [MASK]. [MASK] [MASK] [MASK] [MASK] [MASK] [MASK] [MASK] [MASK] [MASK].,-11.381617546081543,-5.574599742889404,139691,164,236,407,Successful
237,Ahmed mazhar,"[MASK] janardan [MASK] ( marathi : ) ( born 19 october [MASK] ; died 6 june 2002 ) was a marathi poet and writer. apart from this, she was a journalist, a professor, a composer, a story writer, a translator, a writer of child literature, someone who presided over literary gatherings, and more. some of her compositions became immortal either as stand - alone poetic works or as songs sung by marathi greats like lata mangeshkar, asha",Sarojini babar,"[MASK] janardan [MASK] ( marathi : ) ( born 19 [MASK] [MASK] ; died 6 june [MASK] ) was a marathi poet and writer. apart from this, she was a journalist, a professor, a composer, a story writer, a translator, a writer of child literature, someone who presided over literary gatherings, and more. some of her compositions became immortal either as stand - alone poetic works or as songs sung by marathi greats like lata mangeshkar, asha",-9.103294372558594,-4.602964401245117,27546,47801,237,106,Successful
238,Tim tolkien,"[MASK] [MASK] ( born september 1962 ) is an english sculptor who has designed several monumental sculptures, including the award - winning [MASK]. he has a wood carving and metal [MASK] business at cradley heath, west midlands. he is also a bass player and member of the band klangstorm, founded in 1996.",Tim mccreight,"[MASK] [MASK] ( born [MASK] [MASK] ) is an [MASK] [MASK] who has designed several monumental [MASK], including the award - winning [MASK]. he has a wood carving and [MASK] [MASK] business at [MASK] heath, west [MASK]. he is also a bass player and member of the band [MASK], founded in 1996.",-13.526546478271484,-1.7230334281921387,238,136277,238,316,Successful
239,Shinzō ōya 大屋晋三,"born in [MASK] city ( now higashi - osaka city ), osaka prefecture, he graduated from the economics faculty of keio university in 1944 and founded the mitsuaki corporation in 1946. he was a public official in the [MASK] city government from 1964 to 1966, and directed the merger to form higashi - osaka in 1966. in 1967, he was elected to the house of representatives, representing the 4th district of osaka. [MASK] served as parliamentary vice minister of international trade and industry from 1972 to 1973, deputy chief cabinet secretary from 1976 to 1977, commerce and industry committee chairman",Shinzō ōya 大屋晋三,"born in [MASK] [MASK] ( [MASK] higashi - osaka [MASK] ), osaka prefecture, he [MASK] from the economics [MASK] of keio [MASK] in 1944 and founded the [MASK] corporation in 1946. he was a [MASK] official in the [MASK] [MASK] government from 1964 to 1966, and directed the merger to form higashi - osaka in 1966. in 1967, he was elected to the [MASK] of [MASK], representing the 4th district of osaka. [MASK] served as [MASK] vice minister of international trade and industry from 1972 to 1973, deputy chief cabinet secretary from 1976 to 1977, commerce and industry committee chairman",-7.083188056945801,-2.3567490577697754,60034,60034,239,546,Successful
240,George murdock,"[MASK] [MASK] ( june 30, [MASK] - - may 26, 2012 ) was a [MASK] [MASK] and [MASK] [MASK] and actor. he was also widely known for his [MASK] [MASK] of the [MASK] [MASK].",Eloy alquinta,"[MASK] [MASK] ( june 30, [MASK] - - may 26, [MASK] ) was a [MASK] [MASK] and [MASK] [MASK] and [MASK]. he was also widely known for his [MASK] [MASK] of the [MASK] [MASK].",-11.145861625671387,-4.460497856140137,73727,97778,240,34,Successful
241,Ganpat patil,"[MASK] [MASK] ( [MASK] - - march 23, 2008 ) was a notable [MASK] in [MASK] movies and drama. he was nicknamed ` ` nachya'', a traditional character in [MASK] tamasha's and lavani's, due to his portrayal of this character.",Muharrem ertaş,"[MASK] [MASK] ( [MASK] - - [MASK] 23, [MASK] ) was a notable [MASK] in [MASK] [MASK] and [MASK]. he was nicknamed ` ` [MASK], a traditional [MASK] in [MASK] [MASK] and [MASK], due to his [MASK] of this [MASK].",-19.174041748046875,-4.067224502563477,241,46164,241,172,Successful
242,Albi de abreu,[MASK] [MASK] [MASK] ( born as [MASK] [MASK] [MASK] do [MASK] on 31 may [MASK] ) is a venezuelan theater and television [MASK].,César ferrando,[MASK] [MASK] [MASK] ( born [MASK] [MASK] [MASK] [MASK] [MASK] [MASK] [MASK] [MASK] [MASK] [MASK] ) [MASK] a [MASK] [MASK] [MASK] [MASK] [MASK].,-15.366218566894531,-3.6235995292663574,242,108786,242,76,Successful
243,Mário correia,"mrio ` ` [MASK]'' [MASK] ( born march 17, 1978 in [MASK], [MASK] [MASK] ) is a [MASK] [MASK] professional basketball player. he played for [MASK] [MASK] [MASK] at the angolan basketball league until 2012, before being struck by injury. [MASK] early introduction to basketball started in the district sports association kwame nkrumah abbreviated to adesba - kn. [MASK] is currently the captain of the [MASK] [MASK] national basketball team and helped [MASK] [MASK] to a bronze medal at the fiba africa championship 2007, qualifying",Matt gorman,"[MASK] ` ` [MASK]'' [MASK] ( born [MASK] 17, [MASK] in [MASK], [MASK] [MASK] ) is a [MASK] [MASK] professional [MASK] player. he played for [MASK] [MASK] [MASK] at the [MASK] [MASK] league until 2012, before being struck by injury. [MASK] early introduction to [MASK] started in the district sports association kwame nkrumah abbreviated to adesba - kn. [MASK] is currently the captain of the [MASK] [MASK] national [MASK] team and helped [MASK] [MASK] to a bronze medal at the [MASK] [MASK] championship 2007, qualifying",-13.645611763000488,-5.657824516296387,243,98703,243,337,Successful
244,Bona sforza,"[MASK] [MASK] ( 2 february [MASK] - - 19 november [MASK] ) was a member of the powerful [MASK] of [MASK], which ruled the duchy of milan since 1447. in [MASK], she became the second wife of [MASK] i the old, the [MASK] of [MASK] and grand duke of lithuania. their marriage lasted 30 years until [MASK] death in [MASK]. ambitious and energetic, [MASK] became heavily involved in the political life of [MASK] - - [MASK]. to increase state revenue, she implemented various economic and agricultural",Albert i,"[MASK] [MASK] ( 2 [MASK] [MASK] - - 19 [MASK] [MASK] ) was a member of the [MASK] [MASK] of [MASK], which [MASK] the duchy of [MASK] since [MASK]. in [MASK], [MASK] became the second wife of [MASK] i the old, the [MASK] of [MASK] and grand duke of [MASK]. their marriage lasted 30 years until [MASK] death in [MASK]. ambitious and energetic, [MASK] became heavily involved in the political life of [MASK] - - [MASK]. to increase state revenue, [MASK] implemented various economic and agricultural",-15.935928344726562,-4.002638816833496,244,31704,244,357,Successful
245,Kyriacos kyriacou,"[MASK] [MASK] ( ; born 20 june 1989 ) in [MASK], [MASK] is a cypriot professional footballer who plays for [MASK] [MASK].",Aristotelis karasalidis,"[MASK] [MASK] ( ; born 20 [MASK] [MASK] ) in [MASK], [MASK] is a [MASK] professional footballer who plays for [MASK] [MASK].",-13.971048355102539,-5.202461242675781,245,436,245,37,Successful
246,Bn vijaya kumar,"benjamin byung kyu [MASK] ( born 1964 ), known for short as ben [MASK], is executive director, communications and issues management in the office of b. c premier christy clark, and a former canadian political advisor in ontario, public and private sector executive and television journalist.",Ian hanomansing,"[MASK] [MASK] [MASK] [MASK] ( born 1964 ), known for short as [MASK] [MASK], is executive director, communications and issues management in the office of b. c premier christy clark, and a former canadian political advisor in ontario, public and private sector executive and television journalist.",-8.465973854064941,-0.711095929145813,127281,48434,246,143,Successful
247,Mariano gómez,"[MASK] [MASK] y guridi ( august 14, [MASK] - - february 3, [MASK] ) was a mexican roman catholic priest and [MASK] rebel soldier of the mexican war of [MASK], who fought for [MASK] against spain in the early 19th century. [MASK] was born in [MASK] city in [MASK], where he studied art and theology during his youth. he finished his studies in art in 1786, was ordained as a roman catholic priest in 1796 and served in several churches around the city. during this time, he",Mariano gómez,"[MASK] [MASK] y guridi ( august 14, [MASK] - - february 3, [MASK] ) was a mexican roman catholic priest and [MASK] rebel soldier of the mexican war of [MASK], who fought for [MASK] against spain in the early 19th century. [MASK] was born in [MASK] city in [MASK], where he studied art and theology during his youth. he finished his studies in art in 1786, was ordained as a roman catholic priest in 1796 and served in several churches around the city. during this time, he",-2.7647957801818848,-2.7647957801818848,82186,82186,247,1,Skipped
248,Scarlet page,"[MASK] [MASK] [MASK] [MASK] ( born 24 march 1971 ) is an english photographer. she is the daughter of led zeppelin guitarist jimmy [MASK] and charlotte martin, a french model.",Cecilia chancellor,"[MASK] [MASK] [MASK] [MASK] ( born 24 [MASK] [MASK] ) is an english [MASK]. [MASK] is the [MASK] of led [MASK] guitarist jimmy [MASK] and charlotte martin, a french model.",-15.971382141113281,-4.034269332885742,248,69646,248,118,Successful
249,Ted leo and the pharmacists,"[MASK] [MASK] and the [MASK] ( sometimes written [MASK] [MASK] / [MASK], [MASK] [MASK] + [MASK], or tl / rx ) are an american rock band formed in 1999 in washington, d. c. and currently recording for matador records. they have released six full - length studio albums and have toured internationally. though the group's lineup has fluctuated throughout their career, singer / guitarist [MASK] [MASK] has remained the band's main songwriter, creative force, and only constant member. the group's music combines elements of punk rock, indie rock,",World classic rockers,"[MASK] [MASK] [MASK] [MASK] [MASK] ( [MASK] written [MASK] [MASK] / [MASK], [MASK] [MASK] + [MASK], [MASK] tl / rx ) are an american [MASK] [MASK] [MASK] in [MASK] in [MASK], [MASK]. [MASK]. [MASK] [MASK] recording for matador records. they [MASK] [MASK] six [MASK] - [MASK] studio [MASK] [MASK] [MASK] [MASK] internationally. [MASK] [MASK] [MASK] [MASK] [MASK] fluctuated [MASK] [MASK] career, singer / [MASK] [MASK] [MASK] [MASK] remained [MASK] [MASK] main songwriter, creative force, [MASK] only [MASK] member. [MASK] [MASK] music [MASK] [MASK] of [MASK] [MASK], [MASK] [MASK],",-13.602548599243164,-4.589298248291016,249,34776,249,1334,Successful
250,Bill luther,"william paul ` ` [MASK]'' [MASK] ( born june 27, 1945 ) is an american politician. [MASK] was a democratic - farmer - labor party ( dfl ) member of the united states house of representatives representing [MASK] [MASK] congressional district from [MASK] 3, [MASK], to [MASK] 3, 2003, serving in the 104th, 105th, 106th, and 107th congresses, [MASK] was born in [MASK] [MASK], [MASK], and was educated at the university of [MASK], receiving a bachelor of science in 1967 and a juris doctor from the law",Bob goodlatte,"[MASK] [MASK] ` ` [MASK]'' [MASK] ( born [MASK] 27, [MASK] ) is an american politician. [MASK] was a [MASK] - [MASK] - [MASK] party ( [MASK] ) member of the united states house of representatives representing [MASK] [MASK] congressional district from [MASK] 3, [MASK], to [MASK] 3, [MASK], serving in the 104th, 105th, 106th, and 107th congresses, [MASK] was born in [MASK] [MASK], [MASK], and was educated at the university of [MASK], receiving a bachelor of science in [MASK] and a [MASK] [MASK] from the law",-12.745872497558594,-2.0301175117492676,250,7816,250,523,Successful
251,Subodh roy,"[MASK] [MASK] ( ; [MASK] - - 2006 ) ( also known as jhunku [MASK] ) was a [MASK] [MASK] [MASK] [MASK], revolutionary and politician.",Yaakov shabtai,"[MASK] [MASK] ( ; [MASK] - - [MASK] ) ( [MASK] [MASK] [MASK] [MASK] [MASK] ) [MASK] [MASK] [MASK] [MASK] [MASK] [MASK], [MASK] [MASK] [MASK].",-12.59703540802002,-5.475226402282715,251,77681,251,56,Failed
252,William grose,"[MASK] [MASK] ( december 16, [MASK] - - july [MASK], [MASK] ) was a lawyer, politician, author, and [MASK] [MASK] in the [MASK] [MASK] during the american [MASK] [MASK]. he served in many of the important campaigns and [MASK] of the western theater, earning a reputation for being ` ` always seen where the bullets flew thickest.''",Gideon welles,"[MASK] [MASK] ( [MASK] 16, [MASK] - - [MASK] [MASK], [MASK] ) was a lawyer, politician, author, and [MASK] [MASK] in the [MASK] [MASK] [MASK] the [MASK] [MASK] [MASK]. he served in many of the important [MASK] and [MASK] of the [MASK] theater, earning a reputation for being ` ` always seen where the [MASK] flew thickest.''",-13.044561386108398,-5.360170364379883,252,21648,252,197,Successful
253,J. frank dobie,"james [MASK] [MASK] ( september 26, [MASK] - - september 18, [MASK] ) was an american folklorist, [MASK], and newspaper columnist best known for many books depicting the richness and traditions of life in rural [MASK] during the days of the open range. as a public figure, he was known in his lifetime for his outspoken liberal views against [MASK] state politics, and for his long personal war against what he saw as bragging texans, religious prejudice, restraints on individual liberty, and the assault of the mechanized world on the human spirit. he was instrumental in the saving",James a. shannon,"[MASK] [MASK] [MASK] ( [MASK] 26, [MASK] - - [MASK] 18, [MASK] ) was an american folklorist, [MASK], and [MASK] [MASK] best known for many [MASK] [MASK] the richness and traditions of life in rural [MASK] during the days of the open range. as a public figure, he was known in his lifetime for his outspoken liberal views against [MASK] state politics, and for his long personal war against what he saw as bragging [MASK], religious prejudice, restraints on individual liberty, and the assault of the mechanized world on the human spirit. he was instrumental in the saving",-12.775436401367188,-3.324795722961426,253,83574,253,407,Successful
254,Ivan vinnikov,"[MASK] [MASK] ( ; born may 28, 1964 ) is a retired russian professional footballer. he made his professional debut in the soviet second league in 1988 for fc torpedo naberezhnye chelny. he played 5 games and scored 1 goal in the uefa intertoto cup 1996 for fc kamaz - chally naberezhnye chelny.",Aleksandr guzhov,"[MASK] [MASK] ( ; born [MASK] [MASK], [MASK] ) [MASK] [MASK] [MASK] [MASK] [MASK] [MASK]. he [MASK] his [MASK] [MASK] [MASK] [MASK] [MASK] second [MASK] [MASK] [MASK] for [MASK] [MASK] naberezhnye chelny. he played [MASK] [MASK] and [MASK] [MASK] [MASK] [MASK] [MASK] [MASK] intertoto [MASK] 1996 for [MASK] kamaz - [MASK] naberezhnye chelny.",-15.102436065673828,-4.46299934387207,254,66079,254,664,Successful
255,Sam shaw,"samuel e. [MASK] ( may, [MASK] - -??? ) was an american professional [MASK] player who played parts of two seasons for the [MASK] [MASK] of the american association and the chicago [MASK] of the national league. he was born in [MASK], maryland the date and place of his death is [MASK].",William t. `` big bill '' smith,"[MASK] [MASK]. [MASK] ( [MASK], [MASK] - -??? ) [MASK] [MASK] [MASK] [MASK] [MASK] [MASK] [MASK] [MASK] [MASK] [MASK] [MASK] [MASK] [MASK] [MASK] [MASK] [MASK] [MASK] [MASK] [MASK] [MASK] [MASK] [MASK] [MASK] [MASK] [MASK] [MASK] [MASK] [MASK]. [MASK] [MASK] [MASK] [MASK] [MASK], [MASK] [MASK] [MASK] [MASK] [MASK] [MASK] [MASK] [MASK] [MASK] [MASK].",-14.740138053894043,-10.164726257324219,255,107262,255,466,Failed
256,Ryland steen,"[MASK] [MASK] [MASK] ( a. k. a. ` ` the rabbit'' or ` ` xylophone'' ) ( born august 31, 1980 ) is best known as the former drummer of the california - usa - based ska punk band, [MASK] [MASK] [MASK]. [MASK] [MASK] [MASK] first met [MASK] at an ernie ball battle of the bands when he was playing with his nebraska - born band [MASK]. [MASK] [MASK] [MASK] was judging the competition and gave him and his band a perfect score. [MASK] band won the contest and the $ 35, 000 prize",Linus of hollywood,"[MASK] [MASK] [MASK] ( a. k. a. ` ` the rabbit'' or ` ` xylophone'' ) ( born [MASK] 31, [MASK] ) is best known as the former [MASK] of the california - usa - based [MASK] punk band, [MASK] [MASK] [MASK]. [MASK] [MASK] [MASK] first met [MASK] at an ernie ball battle of the bands when he was playing with his nebraska - born band [MASK]. [MASK] [MASK] [MASK] was judging the competition and gave him and his band a perfect score. [MASK] band won the contest and the $ 35, 000 prize",-10.550207138061523,-3.039954662322998,256,47868,256,195,Successful
257,Shoaib malik شعیب ملک,"[MASK] [MASK] ( ) ( born 25 october 1989 ) is an indian international cricketer. in first class cricket, he plays for karnataka. [MASK] [MASK] [MASK] bowler, [MASK] was called up to the india squad for the first test against south africa in 2009 - - 10, only ten weeks after making his first - class debut. he has also played in the ipl for royal [MASK] [MASK]. he made his debut in one day internationals in the third and final one day match against south africa in the 2010 season.",Kiranpreet kaur ਹਰਮਨਪ੍ਰੀਤ ਕੌਰ june 2015,"[MASK] [MASK] ( ) ( born 25 october 1989 ) is an [MASK] [MASK] cricketer. in first class cricket, he plays for karnataka. [MASK] [MASK] [MASK] bowler, [MASK] was called up to the india squad for the first [MASK] against south africa in 2009 - - 10, only ten weeks after making his first - class debut. he has also played in the ipl for royal [MASK] [MASK]. he made his debut in one day internationals in the third and final one day match against south africa in the 2010 season.",-4.7002458572387695,-3.1204967498779297,124614,18354,257,157,Successful
258,Treveon graham,"[MASK] [MASK] ( born october 28, 1993 ) is an american professional basketball player who currently plays for the [MASK] jazz of the national basketball association ( nba ). he played college basketball for virginia commonwealth university ( [MASK] ).",Seth curry,"[MASK] [MASK] ( born [MASK] 28, [MASK] ) is [MASK] [MASK] professional [MASK] [MASK] [MASK] [MASK] [MASK] for the [MASK] [MASK] of the national [MASK] association ( [MASK] ). he played [MASK] [MASK] for virginia [MASK] [MASK] ( [MASK] ).",-15.282489776611328,-4.124853134155273,258,90125,258,274,Successful
259,Tim stoddard,"timothy paul [MASK] ( born january 24, 1953 ) is a former major league baseball pitcher. he is one of only two men to have played in both a world series and a final four of the ncaa men's division i basketball championship, along with fellow east [MASK] washington high school alumnus kenny lofton. a [MASK] pitcher, [MASK] pitched for the [MASK] [MASK] [MASK] ( 1975 ), baltimore orioles ( 1978 - - 83 ), [MASK] cubs ( 1984 ), san diego padres ( 1985 - - 86 ),",Wayne gross,"[MASK] [MASK] [MASK] ( born [MASK] 24, [MASK] ) is a former major [MASK] baseball [MASK]. he is one of only two men to [MASK] played in both a world series and a final four of the ncaa men's division i basketball championship, along with fellow [MASK] [MASK] washington high school alumnus kenny lofton. a [MASK] [MASK], [MASK] [MASK] for the [MASK] [MASK] [MASK] ( 1975 ), baltimore orioles ( 1978 - - 83 ), [MASK] [MASK] ( 1984 ), san diego padres ( 1985 - - 86 ),",-16.87346076965332,-4.220554351806641,259,52702,259,556,Successful
260,Puneet issar,"[MASK] [MASK] is an indian actor and director, born on november 6, 1959. he is most famous for his role as duryodhana in the tv adaptation ( 1988 - - 1990 ) of the ` ` mahabharata'', and directing'''' ( 2004 ) starring salman khan. his other notable roles are in ` ` border'', 1997 war film, directed by j. p. dutta and second lead in the cult indian horror film ` ` purana mandir'' in 1983. he started his career with the movie ` ` coolie''",Kabeer kaushik,"[MASK] [MASK] is an indian [MASK] [MASK] director, born on november 6, [MASK]. he is most [MASK] for his [MASK] as [MASK] in the [MASK] adaptation ( [MASK] - - [MASK] ) of the ` ` [MASK], [MASK] directing'''' ( 2004 ) starring salman khan. his other notable [MASK] are in ` ` [MASK], [MASK] [MASK] film, directed by j. p. [MASK] [MASK] second [MASK] in the [MASK] indian horror film ` ` purana [MASK] in [MASK]. he started his career with the movie ` ` coolie''",-14.952142715454102,-4.681077480316162,260,76648,260,913,Successful
261,Nadezhda shitikova,[MASK] [MASK] ( ; 15 september [MASK] - - [MASK] ) was a soviet fencer. she competed in the women's individual foil event at the 1952 and 1956 summer olympics.,Nadezhda shitikova,[MASK] [MASK] ( ; [MASK] [MASK] [MASK] - - [MASK] ) [MASK] [MASK] [MASK] [MASK]. [MASK] [MASK] [MASK] [MASK] [MASK] [MASK] [MASK] [MASK] [MASK] [MASK] [MASK] [MASK] [MASK] [MASK] [MASK].,-17.30809783935547,-15.366863250732422,261,261,261,211,Failed
262,Charles regan,"[MASK] [MASK] ( [MASK] may [MASK] - - [MASK] may 1933 ) was an english [MASK] cricketer, who played for [MASK] in [MASK], and for [MASK] from 1884 until [MASK].",Charles regan,"[MASK] [MASK] ( [MASK] may [MASK] - - [MASK] may 1933 ) was an english [MASK] [MASK], who played for [MASK] in [MASK], and for [MASK] from 1884 until [MASK].",-5.544861793518066,-3.777155876159668,78013,78013,262,15,Successful
