,original_person,original_text,perturbed_person,perturbed_text,original_score,perturbed_score,original_output,perturbed_output,ground_truth_output,num_queries,result_type
735,Urmila matondkar,"[MASK] [MASK] ( born 28 february [MASK] ) is an indian film actress from [MASK], who has worked in various bollywood and marathi movies as the leading lady. during the 1990s, she was the most popular actress in marathi cinema. [MASK] is regarded as one of the most successful and influential marathi movie actresses of all time.",Durga khote,"[MASK] [MASK] ( [MASK] [MASK] [MASK] [MASK] ) [MASK] an indian film [MASK] from [MASK], [MASK] [MASK] [MASK] [MASK] [MASK] bollywood and marathi [MASK] as the leading lady. during the [MASK], she was the most popular [MASK] [MASK] marathi cinema. [MASK] [MASK] regarded as one of the most [MASK] and influential marathi [MASK] actresses of all time.",-9.701040267944336,-3.1130032539367676,79578,126075,735,442,Successful
736,The fever,"the [MASK] were a four piece [MASK] rock group from los angeles, california headed by guitarist and singer [MASK] [MASK]. they were signed to eyeball records and released one album as a three piece for the label, ` ` songs on radio idaho'', before signing with scott weiland's label [MASK] records. they opened for the supergroup velvet revolver at the aladdin hotel in the summer of 2005 and also played the volcom stage on the 2007 warped tour. in 2005, the [MASK] contributed two songs ` ` promised land'' and ` ` dancing on the perimeter'",Velvet revolver,"[MASK] [MASK] [MASK] a four piece [MASK] rock group from los angeles, california headed by guitarist and singer [MASK] [MASK]. they [MASK] signed to eyeball records and released one album as a three piece for [MASK] label, ` ` songs on radio idaho'', before signing with scott weiland's label [MASK] records. they opened for [MASK] supergroup velvet revolver at [MASK] aladdin hotel in [MASK] summer of 2005 and also played [MASK] volcom stage on [MASK] 2007 warped tour. in 2005, [MASK] [MASK] contributed two songs ` ` promised land'' and ` ` dancing on [MASK] perimeter'",-7.6461181640625,-2.971924066543579,20264,56095,736,122,Successful
737,Ana lilia guillén quiroz,[MASK] [MASK] guilln [MASK] ( born 5 february [MASK] ) is a [MASK] [MASK] affiliated to the party of the democratic revolution. as of 2014 she served as deputy of the lix legislature of the [MASK] congress representing michoacn.,César jáuregui robles,[MASK] [MASK] [MASK] [MASK] ( [MASK] [MASK] [MASK] [MASK] ) [MASK] [MASK] [MASK] [MASK] [MASK] [MASK] [MASK] [MASK] [MASK] [MASK] [MASK] [MASK]. [MASK] [MASK] [MASK] [MASK] [MASK] [MASK] [MASK] [MASK] [MASK] [MASK] [MASK] [MASK] [MASK] [MASK] [MASK] [MASK] [MASK].,-17.109798431396484,-7.877901077270508,737,136659,737,277,Failed
738,George blackwood,[MASK] [MASK] ( born 4 june 1997 ) is an australian footballer who plays as a striker for [MASK] [MASK] in the a - league.,Imran khan,[MASK] [MASK] ( [MASK] [MASK] [MASK] [MASK] ) [MASK] [MASK] [MASK] [MASK] [MASK] [MASK] [MASK] [MASK] [MASK] [MASK] [MASK] [MASK] [MASK] [MASK] [MASK] - [MASK].,-16.46944808959961,-7.023552894592285,738,52226,738,154,Failed
739,Mahlon gore,"[MASK] [MASK] ( february 4, [MASK] - june 27, [MASK] ) was an american politician, who was the thirteenth [MASK] of [MASK] from [MASK] to [MASK]. [MASK] was born in michigan and left home at the age of 15 to start work as a printer. he enlisted in the second michigan infantry in 1861, and after completing his three months of service decided not to re - enlist and moved to iowa with his first wife, [MASK]. they later homesteaded in the dakota territory, where [MASK] is believed to have",Robert klonsky,"[MASK] [MASK] ( [MASK] 4, [MASK] - [MASK] 27, [MASK] ) was [MASK] [MASK] [MASK], who was the [MASK] [MASK] of [MASK] [MASK] [MASK] [MASK] [MASK]. [MASK] was born in [MASK] and [MASK] home at the age of 15 [MASK] start work as a [MASK]. he enlisted in the second [MASK] infantry in [MASK], and after completing his three months of service decided not [MASK] re - enlist and moved [MASK] [MASK] with his first [MASK], [MASK]. they later [MASK] in the dakota [MASK], where [MASK] is believed [MASK] have",-17.167905807495117,-6.176753997802734,739,100934,739,793,Successful
740,Silje norendal,"silje [MASK] ( born 1 september 1993 ) is a norwegian snowboarder. she competes in halfpipe, slopestyle and boardercross. her local club is kongsberg if. she won gold in women's slopestyle in winter x games europe in tignes in 2013. in january 2014, she won women's slopestyle in winter x games in aspen, colorado. in the 2014 winter olympics in sochi, russia, [MASK] finished in fourth place in the slopestyle semifinals",Ståle sandbech,"[MASK] [MASK] ( born 1 [MASK] 1993 ) is a [MASK] [MASK]. [MASK] [MASK] [MASK] [MASK], [MASK] and boardercross. [MASK] local club is kongsberg if. [MASK] [MASK] [MASK] [MASK] [MASK] [MASK] [MASK] [MASK] [MASK] games europe [MASK] tignes [MASK] 2013. [MASK] january 2014, [MASK] [MASK] [MASK] [MASK] [MASK] [MASK] [MASK] games [MASK] aspen, [MASK]. [MASK] the 2014 [MASK] [MASK] [MASK] [MASK], russia, [MASK] [MASK] [MASK] fourth place [MASK] the [MASK] [MASK]",-13.777626037597656,-4.190019607543945,740,18997,740,651,Successful
741,Raimi ayo hassan,"[MASK] [MASK] [MASK] ( born 12 august 1984 at [MASK], [MASK] ) is a nigerian footballer who is currently with kuala lumpur fa. a defender, [MASK] [MASK] [MASK] played for several clubs including kaduna united f. c., [MASK] ( [MASK] ), [MASK] [MASK], [MASK] [MASK] [MASK] [MASK] and [MASK] [MASK] in macau. in december 2011, [MASK] signed a six - month contract with kuala lumpur fa in the malaysia super league however, following the close",Che hishamuddin,"[MASK] [MASK] [MASK] ( born 12 [MASK] [MASK] [MASK] [MASK], [MASK] ) is a [MASK] footballer who is currently with [MASK] [MASK] [MASK]. a [MASK], [MASK] [MASK] [MASK] played for several clubs including kaduna [MASK] f. c., [MASK] ( [MASK] ), [MASK] [MASK], [MASK] [MASK] [MASK] [MASK] and [MASK] [MASK] in macau. in december 2011, [MASK] signed a six - month contract with [MASK] [MASK] [MASK] in the malaysia super league however, following the close",-14.870113372802734,-5.828037261962891,741,33127,741,334,Successful
742,David aldrin slade,"[MASK] [MASK] [MASK] is a multi award winning english writer and director with a background in post production and visual effects who resides in los angeles, california. he started his career in music during the early 90's working as a session musician and freelance tutor. he was introduced to film in 1997 when he wrote and directed a short. [MASK] [MASK] work was nominated for two ` ` royal television society awards'' in 2009.",Nick foster,"[MASK] [MASK] [MASK] is a multi award winning [MASK] [MASK] and [MASK] with a background in post production and visual effects who resides in los angeles, california. he started his career in music during the early 90's working as a session musician and freelance tutor. he was introduced to film in 1997 when he [MASK] and [MASK] a [MASK]. [MASK] [MASK] work was nominated for two ` ` royal television society awards'' in 2009.",-10.301647186279297,-2.779763698577881,113391,118806,742,310,Successful
743,Jason thirsk,"[MASK] [MASK] [MASK] ( december 25, 1967 - - july 29, [MASK] ) was the former bass player of the california [MASK] rock band [MASK] who grew up in [MASK] [MASK], california. [MASK], who had been in rehabilitation for alcoholism and suffered from depression, died of a self - inflicted gunshot wound at the age of 28. the band decided to continue making music after [MASK] death, and brought in [MASK] guitarist randy bradbury from one hit wonder. the band then set about writing an album of new material which was made",Mark dean schwab,"[MASK] [MASK] [MASK] ( [MASK] 25, [MASK] - - july 29, [MASK] ) was the former [MASK] [MASK] of the [MASK] [MASK] [MASK] [MASK] [MASK] who [MASK] up in [MASK] [MASK], [MASK]. [MASK], who had been in rehabilitation for [MASK] and [MASK] from depression, [MASK] of a self - inflicted [MASK] [MASK] at the age of 28. the [MASK] [MASK] to [MASK] making [MASK] after [MASK] death, and brought in [MASK] [MASK] randy [MASK] from one [MASK] [MASK]. the [MASK] then set about writing an [MASK] of new [MASK] which was made",-15.30859375,-4.842217445373535,743,22343,743,1090,Successful
744,Joan brosnan walsh,"[MASK] [MASK] [MASK] ( 29 june [MASK] - - 20 december [MASK] ) was a veteran irish actress, best known for her long - running role as the character mags kelly on the irish soap opera ` ` fair city'', a role she had played for almost twenty years, from 18 september 1989 until her final screen appearance, 11 january [MASK]. [MASK] [MASK] appeared in a number of films such as ` ` the boxer'' and ` ` fatal inheritance''. she also worked as a costume designer. she first worked for acnielsen and aer",Raymond baxter,"[MASK] [MASK] [MASK] ( [MASK] [MASK] [MASK] - - 20 [MASK] [MASK] ) was a veteran [MASK] [MASK], best known for [MASK] long - running [MASK] [MASK] the [MASK] [MASK] [MASK] on the [MASK] [MASK] [MASK] ` ` [MASK] city'', a [MASK] [MASK] [MASK] [MASK] for [MASK] twenty years, from [MASK] september [MASK] until [MASK] final [MASK] [MASK], [MASK] [MASK] [MASK]. [MASK] [MASK] [MASK] [MASK] a number of [MASK] [MASK] [MASK] ` ` the boxer'' and ` ` [MASK] inheritance''. [MASK] also [MASK] [MASK] a [MASK] designer. [MASK] first [MASK] for [MASK] and [MASK]",-18.060192108154297,-4.841127395629883,744,33920,744,1420,Successful
745,Dootsie williams,"[MASK] ` ` [MASK]'' [MASK] ( june 17, [MASK] - - august [MASK], [MASK] ) was an american [MASK] [MASK], and [MASK] [MASK] owner who released early records by [MASK] [MASK] and the [MASK].",Penny dehaven,"[MASK] ` ` [MASK]'' [MASK] ( [MASK] [MASK], [MASK] - - [MASK] [MASK], [MASK] ) [MASK] [MASK] [MASK] [MASK] [MASK], [MASK] [MASK] [MASK] [MASK] [MASK] [MASK] [MASK] [MASK] [MASK] [MASK] [MASK] [MASK] [MASK] [MASK].",-13.829225540161133,-7.342196464538574,745,6337,745,106,Failed
746,Attila farkas,[MASK] [MASK] ( born 5 october 1978 ) is a hungarian football player who currently plays for nyregyhza [MASK].,Roman balaško,[MASK] [MASK] ( born 5 [MASK] [MASK] ) is a [MASK] football player who currently plays for [MASK] [MASK].,-15.24002456665039,-4.701191425323486,746,89250,746,51,Successful
747,Khetag nikolayevich tsabolov хетаг николаевич цаболов,"[MASK] [MASK] is a russian freestyle wrestler who won the gold medals at the 2010, 2011 and 2013 fila [MASK] european championships. he first won the title in 2010 and repeated his success in 2011 and 2013. in the 2013 european wrestling championships he won the title by defeating vladimir dubov of bulgaria 1 - 0, 2 - 1, in two straight periods and thus won his third title.",Fuad aslanov,"[MASK] [MASK] is a [MASK] [MASK] [MASK] who won the gold medals at the 2010, 2011 and 2013 fila [MASK] european championships. he first won the title in 2010 and repeated his success in 2011 and 2013. in the 2013 european [MASK] championships he won the title by defeating [MASK] dubov of [MASK] 1 - [MASK], 2 - 1, in two [MASK] periods and thus won his third title.",-12.471990585327148,-5.163416385650635,133448,47005,747,293,Successful
748,Ossian m. ross,"[MASK] [MASK]. [MASK] ( august 16, [MASK] - january 20, 1837 ) was a pioneer farmer, stock - raiser, and [MASK] in [MASK], who served as a [MASK] in the [MASK] of [MASK] and subsequently founded the [MASK] towns of [MASK] and [MASK], and who also played a prominent role in establishing fulton and mason counties in that state.",William a. ellis,"[MASK] [MASK]. [MASK] ( [MASK] 16, [MASK] - [MASK] 20, [MASK] ) was [MASK] [MASK] [MASK], stock - raiser, and [MASK] [MASK] [MASK], who served as [MASK] [MASK] [MASK] the [MASK] of [MASK] and [MASK] [MASK] the [MASK] [MASK] of [MASK] and [MASK], and who also played [MASK] [MASK] [MASK] [MASK] [MASK] fulton and [MASK] counties [MASK] that state.",-16.232139587402344,-5.589729309082031,748,1080,748,344,Successful
749,Clarence f. manbeck,"[MASK] [MASK]. [MASK] ( september 21, [MASK] - - may 14, 1991 ) was a [MASK] member of the [MASK] state senate, serving from [MASK] to 1982. he also served in the [MASK] house of representatives. he founded farmers pride in 1939, selling chickens in ohio and [MASK]. he sold the business in the 1980s. a bridge in bethel township, [MASK] county is named the senator [MASK] [MASK]. [MASK] bridge.",Quentin r. orlando,"[MASK] [MASK]. [MASK] ( [MASK] [MASK], [MASK] - - [MASK] [MASK], [MASK] ) [MASK] [MASK] [MASK] [MASK] [MASK] [MASK] [MASK] [MASK] [MASK], [MASK] [MASK] [MASK] [MASK] [MASK]. [MASK] [MASK] [MASK] [MASK] [MASK] [MASK] [MASK] [MASK] [MASK]. [MASK] [MASK] [MASK] [MASK] [MASK] [MASK], [MASK] [MASK] [MASK] [MASK] [MASK] [MASK]. [MASK] [MASK] [MASK] [MASK] [MASK] [MASK] [MASK]. [MASK] [MASK] [MASK] [MASK] [MASK], [MASK] [MASK] [MASK] [MASK] [MASK] [MASK] [MASK] [MASK]. [MASK] [MASK].",-15.831306457519531,-9.717998504638672,749,71799,749,821,Failed
750,Justin peckett,"[MASK] ` ` frankie'' [MASK] ( born 5 october 1972 ) is an australian rules footballer in the australian football league ( afl ). picked up by the saints as an impressive 16 - year - old, in 1990 [MASK] won the [MASK] [MASK] under 19's best and fairest and remained on the list for the 1991 season, before he was delisted at the end of the year. he was picked up in the 1992 pre - season draft at pick # 49 to resurrect his career, and debuted late that season ( receiving limited game time in his only game",Brad hartman,"[MASK] ` ` frankie'' [MASK] ( born 5 [MASK] [MASK] ) is an australian rules footballer in the australian football league ( afl ). picked up by the saints as an impressive 16 - year - old, in [MASK] [MASK] won the [MASK] [MASK] under [MASK] best and fairest and remained on the list for the [MASK] season, before he was delisted at the end of the year. he was picked up in the [MASK] pre - season draft at pick # 49 to resurrect his career, and debuted late that season ( receiving limited game time in his only game",-8.518438339233398,-1.600341558456421,750,637,750,352,Successful
751,Julie laipply,"[MASK] [MASK] ( born 1978 ) also known as [MASK] [MASK] carrier or [MASK] carrier is an award winning speaker, author and role model who is especially recognized for her work promoting youth leadership and self - esteem in young women. [MASK] won the [MASK] virginia [MASK] [MASK] title in a state pageant held in late 2001. she represented virginia in the [MASK] [MASK] [MASK] pageant broadcast live from gary, indiana in march [MASK]. [MASK] graduated from the ohio state university honors program with a degree in leadership studies in 2000. she competed",Jacob l barnett,"[MASK] [MASK] ( born [MASK] ) also known as [MASK] [MASK] carrier or [MASK] carrier is an award winning speaker, author and role [MASK] who is especially recognized for her work promoting youth leadership and self - esteem in young women. [MASK] won the [MASK] [MASK] [MASK] [MASK] title in a [MASK] [MASK] held in late 2001. she [MASK] [MASK] in the [MASK] [MASK] [MASK] [MASK] broadcast live from gary, indiana in march [MASK]. [MASK] graduated from the [MASK] [MASK] university honors program with a degree in leadership studies in 2000. she competed",-12.389303207397461,-2.479769229888916,751,59620,751,386,Successful
752,Timofey lapshin,"[MASK] [MASK] ( ; born 3 february 1988 ) is a russian biathlete. he debuted in the [MASK] world cup on 9 december [MASK] in hochfilzen, austria. he has won silver medal at [MASK] junior world championships.",Abdellatif abdelhamid عبد اللطيف عبد الحميد,"[MASK] [MASK] ( ; born 3 [MASK] [MASK] ) is [MASK] [MASK] [MASK]. [MASK] [MASK] [MASK] the [MASK] [MASK] [MASK] [MASK] [MASK] [MASK] [MASK] [MASK] hochfilzen, [MASK]. [MASK] has [MASK] [MASK] [MASK] at [MASK] [MASK] [MASK] [MASK].",-17.131500244140625,-2.925565004348755,752,9512,752,324,Successful
753,Jack glasscock,"john wesley ` ` [MASK]'' [MASK] ( july 22, [MASK] - - february 24, 1947 ) was an american [MASK] in major league baseball who played for several teams from [MASK] to 1895 and was the top player at his position in the 1880s during the sport's bare - handed era. he led the national league in fielding percentage seven times and in assists six times, with both marks remaining league records until ozzie smith surpassed them in the 1980s ; he also led the nl in double plays four times and in putouts twice. he won the 1890 batting title with a",Buck ewing,"[MASK] [MASK] ` ` [MASK]'' [MASK] ( [MASK] 22, [MASK] - - [MASK] 24, [MASK] ) was an [MASK] [MASK] in [MASK] [MASK] [MASK] who played for several teams from [MASK] to [MASK] and was the top player at his position in the [MASK] during the sport's bare - handed [MASK]. he [MASK] the national [MASK] in fielding [MASK] seven times and in assists six times, with both [MASK] [MASK] [MASK] records until [MASK] smith surpassed them in the 1980s ; he also [MASK] the nl in double plays four times and in putouts twice. he won the [MASK] batting title with a",-17.26986312866211,-3.0067710876464844,753,64090,753,1054,Successful
754,Don seccombe,"[MASK] harold [MASK] ( born 1 june 1943 ) is a former [MASK] [MASK] cricketer, one of only a handful of indigenous australians to have played [MASK] cricket. born one of ten children in brisbane, queensland, [MASK] was a successful junior basketballer and professional welterweight boxer who won 28 of 32 fights under the name ` ` young rainbow'' ( derived from his preference for brighly coloured clothes ) before turning to cricket. a [MASK] fast bowler and [MASK] batsman, [MASK] started playing for sydney club bankstown before returning",Mark harrity,"[MASK] harold [MASK] ( born 1 june [MASK] ) is a former [MASK] [MASK] cricketer, one of [MASK] a [MASK] of [MASK] australians to have played [MASK] cricket. born one of ten children in brisbane, queensland, [MASK] was a successful [MASK] basketballer and professional welterweight boxer who won 28 of 32 fights under the name ` ` young rainbow'' ( derived from his preference for brighly coloured clothes ) before turning to cricket. a [MASK] [MASK] bowler and [MASK] batsman, [MASK] started playing for sydney club bankstown before returning",-5.666874885559082,-1.8162217140197754,4236,74709,754,352,Successful
755,Ma bo -lrb- 马波 ）,"ma [MASK] ( born august 22, 1947 ) is a [MASK] [MASK] writer who currently resides in beijing, [MASK]. after graduating from beijing university with a degree in journalism, he wrote and published the book ` ` blood red sunset'' in 1988 which sold over 400, 000 copies in [MASK]. subsequently as a result of his participation in tiananmen square, he fled the country, first to france, and then ultimately to the us, where he settled as a resident scholar in brown university's literary arts program. in 1995, the english translation of ` ` blood red sunset",Noel alumit,"[MASK] [MASK] ( born [MASK] 22, [MASK] ) is a [MASK] [MASK] writer who currently resides in [MASK], [MASK]. after graduating from [MASK] university with a degree in journalism, he wrote and published the book ` ` blood red sunset'' in 1988 which sold over 400, 000 copies in [MASK]. subsequently as a result of his participation in tiananmen square, he fled the country, first to france, and then ultimately to the us, where he settled as a resident scholar in brown university's literary arts program. in 1995, the english translation of ` ` blood red sunset",-13.498566627502441,-3.1367902755737305,755,84092,755,255,Successful
756,Lothar de maizière,"[MASK] de maizire ( ; born 2 march 1940 ) is a german christian democratic politician. in [MASK], he served as the only democratically elected [MASK] [MASK] of the german democratic republic, and as such was the last leader of an independent [MASK] [MASK]. de maizire was born in [MASK], thuringia, and attended the ancient berlinisches gymnasium zum grauen kloster, where he was one of the last pupils before the school closed in 1958. he next studied viola at the hanns eisler",Roman herzog,"[MASK] [MASK] [MASK] ( ; born 2 [MASK] [MASK] ) is a [MASK] [MASK] democratic politician. in [MASK], he served as the only democratically elected [MASK] [MASK] of the [MASK] democratic [MASK], and as such was the last [MASK] of an [MASK] [MASK] [MASK]. [MASK] [MASK] was born in [MASK], [MASK], and attended the [MASK] [MASK] [MASK] zum grauen kloster, where he was one of the last [MASK] before the school closed in 1958. he next studied viola at the [MASK] eisler",-14.820206642150879,-3.436859607696533,756,47948,756,646,Successful
757,Marko krasić,[MASK] krasi ( [MASK] cyrillic : ; born 1 december 1985 ) is a [MASK] footballer who plays for [MASK] white [MASK] fc on loan from inija.,Ognjen ožegović огњен ожеговић,[MASK] [MASK] ( [MASK] [MASK] : ; born 1 [MASK] [MASK] ) is a [MASK] footballer who plays for [MASK] [MASK] [MASK] fc on loan from inija.,-16.37432098388672,-3.541947841644287,757,66553,757,81,Successful
758,Curt warburton,"[MASK] [MASK] ( born 1981 ) is an english mixed martial artist from coundon, county durham. he trains at [MASK] [MASK] [MASK] in liverpool, england.",Gavin extence,"[MASK] [MASK] ( born [MASK] ) is an [MASK] [MASK] [MASK] [MASK] from coundon, county [MASK]. [MASK] [MASK] at [MASK] [MASK] [MASK] in liverpool, [MASK].",-13.819493293762207,-2.8502554893493652,758,135671,758,127,Successful
759,John k. waters,"[MASK] knight [MASK] ( december 20, [MASK] - - january 9, 1989 ) was a [MASK] [MASK] [MASK] [MASK] [MASK] who served as commander, u. s. [MASK], [MASK] from 1964 to 1966. he was also the son - in - law of [MASK] george s. patton. during world [MASK] ii, he was taken prisoner while fighting in tunisia in 1943, leading patton to set up the controversial task force baum to break him out.",Thurgood marshall,"[MASK] knight [MASK] ( [MASK] 20, [MASK] - - [MASK] 9, [MASK] ) was a [MASK] [MASK] [MASK] [MASK] [MASK] who served as [MASK], u. s. [MASK], [MASK] from 1964 to 1966. he was also the son - in - law of [MASK] george s. patton. during world [MASK] ii, he was taken [MASK] while [MASK] in [MASK] in 1943, leading patton to set up the controversial [MASK] [MASK] baum to break him out.",-13.598005294799805,-4.414938926696777,759,71262,759,379,Successful
760,Eric vinar,"[MASK] [MASK] ( born 31 may 1942 ) is a former australian rules footballer who played with [MASK] in the victorian football league ( vfl ). born in [MASK] during world war ii, [MASK] and his family emigrated to australia several years after the conflict, which had claimed the life of his father. the family settled in geelong. [MASK] played senior football for north [MASK], before joining [MASK] in the [MASK] vfl season. he played eight senior games for [MASK] that year. all were in losses, it was the only",Ian montgomery,"[MASK] [MASK] ( [MASK] [MASK] [MASK] [MASK] ) [MASK] [MASK] [MASK] [MASK] [MASK] [MASK] [MASK] [MASK] [MASK] [MASK] [MASK] [MASK] [MASK] [MASK] [MASK] ( [MASK] ). [MASK] [MASK] [MASK] [MASK] [MASK] [MASK] [MASK], [MASK] [MASK] [MASK] [MASK] [MASK] [MASK] [MASK] [MASK] [MASK] [MASK] [MASK] [MASK], [MASK] [MASK] [MASK] [MASK] [MASK] [MASK] [MASK] [MASK]. [MASK] [MASK] [MASK] [MASK] [MASK]. [MASK] [MASK] [MASK] [MASK] [MASK] [MASK] [MASK], [MASK] [MASK] [MASK] [MASK] [MASK] [MASK] [MASK] [MASK]. [MASK] [MASK] [MASK] [MASK] [MASK] [MASK] [MASK] [MASK] [MASK]. [MASK] [MASK] [MASK] [MASK], [MASK] [MASK] [MASK] [MASK]",-14.923463821411133,-8.994352340698242,760,52819,760,1712,Failed
761,The lord chidgey,"[MASK] charles [MASK], [MASK] [MASK] ( born 12 february 1942 ) is a [MASK] party politician in the united kingdom. he served as member of parliament ( mp ) for west [MASK] [MASK] until he stood down in the 2001 election. he is the current chairman of his hometown football club, stockport county, as well as a major shareholder in the club.",The lord chidgey,"[MASK] charles [MASK], [MASK] [MASK] ( born 12 [MASK] [MASK] ) is [MASK] [MASK] [MASK] [MASK] [MASK] [MASK] [MASK] [MASK]. he [MASK] as [MASK] of [MASK] ( [MASK] ) for [MASK] [MASK] [MASK] until he [MASK] down [MASK] [MASK] [MASK] [MASK]. he is [MASK] current [MASK] of his [MASK] football club, stockport county, as well as [MASK] major [MASK] [MASK] [MASK] club.",-12.699016571044922,-4.7345709800720215,51522,51522,761,571,Successful
762,John s. lanning,"[MASK] [MASK]. [MASK] ( august 6, [MASK] - march [MASK], [MASK] ) was an [MASK] in the [MASK] [MASK] [MASK] and a [MASK] of [MASK] recipient for his actions in the [MASK] [MASK].",Joseph m. clary,"[MASK] [MASK]. [MASK] ( [MASK] 6, [MASK] - [MASK] [MASK], [MASK] ) was an [MASK] [MASK] [MASK] [MASK] [MASK] [MASK] and a [MASK] of [MASK] [MASK] for his [MASK] [MASK] [MASK] [MASK] [MASK].",-12.020576477050781,-4.290411949157715,40277,98124,762,70,Successful
763,David córcoles,[MASK] crcoles [MASK] ( born 8 may 1985 ) is a spanish professional footballer who plays for [MASK] balompi as a right back.,David timor,[MASK] [MASK] [MASK] ( [MASK] [MASK] [MASK] [MASK] ) [MASK] [MASK] [MASK] [MASK] [MASK] [MASK] [MASK] [MASK] [MASK] [MASK] [MASK] [MASK] [MASK] [MASK].,-13.4070463180542,-7.038660049438477,763,121689,763,154,Failed
764,James leaf,[MASK] gordon [MASK] ( 18 october [MASK] - - 8 december 1972 ) was a british [MASK] officer and english cricketer who played [MASK] cricket for the british [MASK] cricket team and played international matches for the egypt national cricket team.,Mervyn davies,[MASK] [MASK] [MASK] ( 18 [MASK] [MASK] - - 8 [MASK] [MASK] ) was a [MASK] [MASK] [MASK] and [MASK] cricketer who played [MASK] [MASK] for the [MASK] [MASK] [MASK] [MASK] and played international matches for the [MASK] national [MASK] [MASK].,-18.92118263244629,-3.470712661743164,764,48938,764,186,Successful
